repo_name,organization,language,stars,forks,open_issues,age_days,has_coc,has_contributing,has_workflows,has_readme,description
awesome-claude-skills,ComposioHQ,Python,49581,5141,431,164,False,True,True,True,"A curated list of awesome Claude Skills, resources, and tools for customizing Claude AI workflows"
hacker-scripts,NARKOZ,JavaScript,49444,6661,69,3782,False,False,False,True,Based on a true story
open-source-ios-apps,dkhamsing,,49442,5747,2,4081,False,True,True,True,:iphone: Collaborative List of Open-Source iOS Apps
dbeaver,dbeaver,Java,49340,4093,3258,3813,True,True,True,True,Free universal database tool and SQL client
json,nlohmann,C++,49266,7341,104,4652,True,True,True,True,JSON for Modern C++
alist,AlistGo,Go,49238,7964,559,1923,True,True,True,True,"🗂️A file list/WebDAV program that supports multiple storages, powered by Gin and Solidjs. / 一个支持多存储的文件列表/WebDAV程序，使用 Gin 和 Solidjs。"
ghostty,ghostty-org,Zig,49201,2176,212,1462,False,True,True,True,"👻 Ghostty is a fast, feature-rich, and cross-platform terminal emulator that uses platform-native UI and GPU acceleration."
huginn,huginn,Ruby,49007,4246,693,4768,False,False,True,True,Create agents that monitor and act on your behalf.  Your agents are standing by!
query,TanStack,TypeScript,48964,3748,159,2393,False,True,True,True,"🤖 Powerful asynchronous state management, server-state utilities and data fetching for the web. TS/JS, React Query, Solid Query, Svelte Query and Vue Query."
dayjs,iamkun,JavaScript,48622,2427,1202,2911,False,True,True,True,⏰ Day.js 2kB immutable date-time library alternative to Moment.js with the same modern API
julia,JuliaLang,Julia,48534,5755,4741,5457,True,True,True,True,The Julia Programming Language
algorithm-visualizer,algorithm-visualizer,JavaScript,48467,7583,78,3607,True,True,False,True,:fireworks:Interactive Online Platform that Visualizes Algorithms from Code
RxJava,ReactiveX,Java,48437,7601,20,4829,False,True,True,True,RxJava – Reactive Extensions for the JVM – a library for composing asynchronous and event-based programs using observable sequences for the Java VM.
expo,expo,TypeScript,48371,11596,907,3514,False,True,True,True,"An open-source framework for making universal native apps with React. Expo runs on Android, iOS, and the web."
pandas,pandas-dev,Python,48295,19804,3529,5698,True,True,True,True,"Flexible and powerful data analysis / manipulation library for Python, providing labeled data structures similar to R data.frame objects, statistical functions, and much more"
freqtrade,freqtrade,Python,48194,10043,43,3239,False,True,True,True,"Free, open source crypto trading bot"
llama_index,run-llama,Python,48156,7131,250,1245,True,True,True,True,LlamaIndex is the leading document agent and OCR platform
whisper.cpp,ggml-org,C++,48134,5359,1162,1282,False,False,True,True,Port of OpenAI's Whisper model in C/C++
open-source-mac-os-apps,serhii-londar,,48028,2503,51,3070,False,True,True,True,🚀 Awesome list of open source applications for macOS. https://t.me/s/opensourcemacosapps
moment,moment,JavaScript,48025,7018,296,5509,False,True,True,True,"Parse, validate, manipulate, and display dates in javascript."
terraform,hashicorp,Go,48009,10256,1892,4400,True,True,True,True,"Terraform enables you to safely and predictably create, change, and improve infrastructure. It is a source-available tool that codifies APIs into declarative configuration files that can be shared amongst team members, treated as code, edited, reviewed, and versioned."
x64dbg,x64dbg,C++,48002,2698,587,4006,True,True,True,True,An open-source user mode debugger for Windows. Optimized for reverse engineering and malware analysis.
Fooocus,lllyasviel,Python,47926,7834,289,964,False,False,True,True,Focus on prompting and generating
type-challenges,type-challenges,TypeScript,47882,5236,33135,2076,True,False,True,True,Collection of TypeScript type challenges with online judge
jadx,skylot,Java,47882,5468,416,4760,True,True,True,True,Dex to Java decompiler
kubernetes-the-hard-way,kelseyhightower,,47880,15594,47,3553,False,True,False,True,Bootstrap Kubernetes the hard way. No scripts.
htmx,bigskysoftware,JavaScript,47719,1581,658,2177,False,True,True,True,</> htmx - high power tools for HTML
design-patterns-for-humans,kamranahmedse,,47656,5505,17,3329,False,False,False,True,An ultra-simplified explanation to design patterns
crewAI,crewAIInc,Python,47640,6459,480,886,False,True,True,True,"Framework for orchestrating role-playing, autonomous AI agents. By fostering collaborative intelligence, CrewAI empowers agents to work together seamlessly, tackling complex tasks."
big-list-of-naughty-strings,minimaxir,Python,47619,2163,108,3887,False,False,False,True,The Big List of Naughty Strings is a list of strings which have a high probability of causing issues when used as user-input data.
gogs,gogs,Go,47579,5063,972,4430,False,True,True,True,Gogs is a painless self-hosted Git service
Projects,karan,,47549,10666,118,4652,False,True,False,True,:page_with_curl: A list of practical projects that anyone can solve in any programming language.
OpenCut,OpenCut-app,TypeScript,47539,4960,278,281,True,True,True,True,The open-source CapCut alternative
chinese-independent-developer,1c7,,47474,4038,2,3112,False,False,True,True,👩🏿‍💻👨🏾‍💻👩🏼‍💻👨🏽‍💻👩🏻‍💻中国独立开发者项目列表 -- 分享大家都在做什么
awesome-java,akullpp,,47444,7657,27,4282,False,True,True,True,"A curated list of awesome frameworks, libraries and software for the Java programming language."
Pake,tw93,Rust,47412,9397,0,1263,True,True,True,True,🤱🏻 Turn any webpage into a desktop app with one command.
brew,Homebrew,Ruby,47299,11050,22,3677,True,True,True,True,🍺 The missing package manager for macOS (or Linux)
awesome-react-components,brillout,,47167,3750,39,3566,True,True,True,True,Curated List of React Components & Libraries.
PythonDataScienceHandbook,jakevdp,Jupyter Notebook,47157,18804,230,3519,True,True,False,True,Python Data Science Handbook: full text in Jupyter Notebooks
plane,makeplane,TypeScript,47127,3835,704,1227,True,True,True,True,"🔥🔥🔥 Open-source Jira, Linear, Monday, and ClickUp alternative. Plane is a modern project management platform to manage tasks, sprints, docs, and triage."
Made-With-ML,GokuMohandas,Jupyter Notebook,47038,7389,24,2703,False,False,True,True,"Learn how to develop, deploy and iterate on production-grade ML applications."
react,typescript-cheatsheets,JavaScript,47017,4293,1,2859,True,True,True,True,Cheatsheets for experienced React developers getting started with TypeScript
quill,slab,TypeScript,47010,3630,635,4991,True,True,True,True,Quill is a modern WYSIWYG editor built for compatibility and extensibility
v2ray-core,v2ray,Go,46956,8868,8,3860,True,False,True,True,A platform for building proxies to bypass network restrictions.
MediaCrawler,NanmiCoder,Python,46948,10082,141,1025,False,False,True,True,小红书笔记 | 评论爬虫、抖音视频 | 评论爬虫、快手视频 | 评论爬虫、B 站视频 ｜ 评论爬虫、微博帖子 ｜ 评论爬虫、百度贴吧帖子 ｜ 百度贴吧评论回复爬虫  | 知乎问答文章｜评论爬虫
serverless,serverless,JavaScript,46943,5735,1224,3997,True,True,True,True,"⚡ Serverless Framework – Effortlessly build apps that auto-scale, incur zero costs when idle, and require minimal maintenance using AWS Lambda and other managed cloud services."
okhttp,square,Kotlin,46915,9279,94,4998,False,True,True,True,"Square’s meticulous HTTP client for the JVM, Android, and GraalVM."
pixijs,pixijs,TypeScript,46826,4988,333,4816,True,True,True,True,"The HTML5 Creation Engine: Create beautiful digital content with the fastest, most flexible 2D WebGL renderer."
ruff,astral-sh,Rust,46770,1977,1918,1329,True,True,True,True,"An extremely fast Python linter and code formatter, written in Rust."
metabase,metabase,Clojure,46673,6346,4049,4074,False,True,True,True,The easy-to-use open source Business Intelligence and Embedded Analytics tool that lets everyone work with data :bar_chart:
discourse,discourse,Ruby,46658,8861,149,4826,True,True,True,True,"A platform for community discussion. Free, open, simple."
awesome-design-patterns,DovAmir,,46632,3221,22,2856,False,True,False,True,A curated list of software and architecture related design patterns.
ClickHouse,ClickHouse,C++,46604,8253,5648,3588,True,True,True,True,ClickHouse® is a real-time analytics database management system
MiroFish,666ghj,Python,46406,6590,196,125,False,False,True,True,"A Simple and Universal Swarm Intelligence Engine, Predicting Anything. 简洁通用的群体智能引擎，预测万物"
text-generation-webui,oobabooga,Python,46380,5904,770,1196,False,False,True,True,"The original local LLM interface. Text, vision, tool-calling, training, and more. 100% offline."
AI-For-Beginners,microsoft,Jupyter Notebook,46334,9479,4,1853,True,False,True,True,"12 Weeks, 24 Lessons, AI for All!"
frontend-dev-bookmarks,dypsilon,,46313,5152,123,4664,False,True,False,True,Manually curated collection of resources for frontend web developers.
30-Days-Of-JavaScript,Asabeneh,JavaScript,46204,10441,368,2289,False,False,False,True,"30 days of JavaScript programming challenge is a step-by-step guide to learn JavaScript programming language in 30 days. This challenge may take more than 100 days,  please just follow your own pace. These videos may help too: https://www.youtube.com/channel/UC7PNRuno1rzYPb1xLa4yktw"
learn-regex,ziishaned,,46152,6210,65,3173,False,False,False,True,Learn regex the easy way
acme.sh,acmesh-official,Shell,46134,5549,1376,3747,False,False,True,True,A pure Unix shell script ACME client for SSL / TLS certificate automation
tldraw,tldraw,TypeScript,46103,3114,328,1786,True,True,True,True,very good whiteboard infinite canvas SDK
GitHubDaily,GitHubDaily,,45850,4593,560,2647,False,False,False,True,"坚持分享 GitHub 上高质量、有趣实用的开源技术教程、开发者工具、编程网站、技术资讯。A list cool, interesting projects of GitHub."
monaco-editor,microsoft,JavaScript,45824,4019,799,3583,True,True,True,True,A browser based code editor
nvm-windows,coreybutler,Go,45726,3776,83,4209,False,True,True,True,A node.js version management utility for Windows. Ironically written in Go.
JeecgBoot,jeecgboot,Java,45637,15859,78,2681,False,False,True,True,"一款 AI 驱动的低代码平台，提供""零代码""与""代码生成""双模式——零代码模式一句话搭建系统，代码生成模式自动输出前后端代码与建表 SQL，生成即可运行。平台内置 AI 聊天助手、AI大模型、知识库、AI流程编排、MCP 与插件体系，兼容主流大模型，支持一句话生成流程图、设计表单、聊天式业务操作，解决 Java 项目 80% 重复工作，高效且不失灵活。"
prisma,prisma,TypeScript,45627,2134,2539,2475,True,True,True,True,"Next-generation ORM for Node.js & TypeScript | PostgreSQL, MySQL, MariaDB, SQL Server, SQLite, MongoDB and CockroachDB"
architecture-samples,android,Kotlin,45624,11873,218,3706,False,True,True,True,A collection of samples to discuss and showcase different architectural tools and patterns for Android apps.
worldmonitor,koala73,TypeScript,45578,7301,121,81,True,True,True,True,"Real-time global intelligence dashboard. AI-powered news aggregation, geopolitical monitoring, and infrastructure tracking in a unified situational awareness interface"
awesome-cheatsheets,LeCoupa,JavaScript,45576,6668,135,3064,False,False,True,True,"👩‍💻👨‍💻 Awesome cheatsheets for popular programming languages, frameworks and development tools. They include everything you should know in one single file."
get-shit-done,gsd-build,JavaScript,45467,3664,100,106,False,True,True,True,"A light-weight and powerful meta-prompting, context engineering and spec-driven development system for Claude Code by TÂCHES."
legado,gedoor,Kotlin,45456,5207,71,2505,False,False,True,True,"Legado 3.0 Book Reader with powerful controls & full functions❤️阅读3.0, 阅读是一款可以自定义来源阅读网络内容的工具，为广大网络文学爱好者提供一种方便、快捷舒适的试读体验。"
bevy,bevyengine,Rust,45355,4481,3277,2263,True,True,True,True,A refreshingly simple data-driven game engine built in Rust
jest,jestjs,TypeScript,45330,6641,244,4494,True,True,True,True,Delightful JavaScript Testing.
AdminLTE,ColorlibHQ,CSS,45323,18260,9,4479,True,True,True,True,AdminLTE - Free admin dashboard template based on Bootstrap 5
zx,google,JavaScript,45323,1235,38,1790,True,True,True,True,A tool for writing better scripts
slidev,slidevjs,TypeScript,45319,1989,194,1802,True,True,True,True,Presentation Slides for Developers
spotube,KRTirtho,Dart,45301,2025,769,1871,True,False,True,True,🎧 Open source music streaming app! Available for both desktop & mobile!
penpot,penpot,Clojure,45105,2637,579,3744,True,True,True,True,Penpot: The open-source design tool for design and code collaboration
oh-my-openagent,code-yeongyu,TypeScript,45075,3359,364,118,False,True,True,True,omo; the best agent harness - previously oh-my-opencode
Rocket.Chat,RocketChat,TypeScript,45046,13487,3688,3968,True,True,True,True,The Secure CommsOS™ for mission-critical operations
TTS,coqui-ai,Python,44951,6022,7,2140,True,True,True,True,"🐸💬 - a deep learning toolkit for Text-to-Speech, battle-tested in research and production"
CppCoreGuidelines,isocpp,CSS,44874,5545,250,3876,False,True,True,True,"The C++ Core Guidelines are a set of tried-and-true guidelines, rules, and best practices about coding in C++"
minimind,jingyaogong,Python,44867,5415,29,612,True,False,True,True,🚀🚀 「大模型」2小时完全从0训练64M的小参数GPT！🌏 Train a 64M-parameter GPT from scratch in just 2h!
airflow,apache,Python,44834,16789,1797,4004,True,True,True,True,"Apache Airflow - A platform to programmatically author, schedule, and monitor workflows"
Mole,tw93,Shell,44826,1323,1,188,False,True,True,True,🐹 Deep clean and optimize your Mac.
meteor,meteor,JavaScript,44787,5265,375,5185,True,True,True,True,"Meteor, the JavaScript App Platform"
RuView,ruvnet,Rust,44751,6005,58,297,False,False,True,True,"π RuView: WiFi DensePose turns commodity WiFi signals into real-time human pose estimation, vital sign monitoring, and presence detection — all without a single pixel of video. "
Leaflet,Leaflet,JavaScript,44741,6103,557,5668,True,True,True,True,🍃 JavaScript library for mobile-friendly interactive maps 🇺🇦
TradingAgents,TauricResearch,Python,44686,8089,258,458,False,False,True,True,TradingAgents: Multi-Agents LLM Financial Trading Framework
hyper,vercel,TypeScript,44677,3552,1025,3559,False,False,True,True,A terminal built on web technologies
react-hook-form,react-hook-form,TypeScript,44634,2377,133,2582,True,True,True,True,📋 React Hooks for form state management and validation (Web + React Native)
awesome-compose,docker,HTML,44628,8089,355,2237,False,True,True,True,Awesome Docker Compose samples
LocalAI,mudler,Go,44611,3825,159,1108,False,True,True,True,"LocalAI is the open-source AI engine. Run any model - LLMs, vision, voice, image, video - on any hardware. No GPU required."
grpc,grpc,C++,44566,11100,1213,4130,True,True,True,True,"C++ based gRPC (C++, Python, Ruby, Objective-C, PHP, C#)"
edex-ui,GitSquared,JavaScript,44537,3065,6,3348,False,False,True,True,"A cross-platform, customizable science fiction terminal emulator with advanced monitoring & touchscreen support."
pyenv,pyenv,Shell,44518,3242,56,4959,False,True,True,True,Simple Python version management
awesome-remote-job,lukasz-madon,,44488,4529,47,4106,False,True,True,True,A curated list of awesome remote jobs and resources. Inspired by https://github.com/vinta/awesome-python
reactjs-interview-questions,sudheerj,JavaScript,44413,10309,12,2860,False,False,True,True,List of top 500 ReactJS Interview Questions & Answers....Coding exercise questions are coming soon!!
upscayl,upscayl,TypeScript,44296,2146,60,1339,False,False,True,True,"🆙 Upscayl - #1 Free and Open Source AI Image Upscaler for Linux, MacOS and Windows."
iina,iina,Swift,44252,2782,1974,3388,False,True,True,True,The modern video player for macOS.
build-web-application-with-golang,astaxie,Go,44121,10525,138,4988,False,False,False,True,A golang ebook intro how to build a web with golang
learn-claude-code,shareAI-lab,TypeScript,44104,6737,28,274,False,False,True,True,"Bash is all you need -  A nano claude code–like 「agent harness」, built from 0 to 1"
EasySpider,NaiboWang,JavaScript,44080,5377,266,2082,False,False,True,True,A visual no-code/code-free web crawler/spider易采集：一个可视化浏览器自动化测试/数据采集/爬虫软件，可以无代码图形化的设计和执行爬虫任务。别名：ServiceWrapper面向Web应用的智能化服务封装系统。
streamlit,streamlit,Python,44069,4178,1318,2411,True,True,True,True,Streamlit — A faster way to build and share data apps.
parcel,parcel-bundler,JavaScript,44049,2278,595,3157,True,True,True,True,The zero configuration build tool for the web. 📦🚀
Summer2026-Internships,SimplifyJobs,Python,43994,3168,4,2137,False,True,True,True,Collection of Summer 2026 tech internships!
react-use,streamich,TypeScript,43964,3276,653,2711,False,True,True,True,React Hooks — 👍
front-end-interview-handbook,yangshun,MDX,43915,5951,11,2998,True,True,True,True,Front End interview preparation materials for busy engineers (updated for 2026)
copyparty,9001,Python,43907,1792,258,2500,True,True,False,True,"Portable file server with accelerated resumable uploads, dedup, WebDAV, SFTP, FTP, TFTP, zeroconf, media indexer, thumbnails++ all in one file"
retrofit,square,HTML,43905,7356,169,5684,False,True,True,True,A type-safe HTTP client for Android and the JVM
babel,babel,TypeScript,43904,5817,762,4201,True,True,True,True,🐠 Babel is a compiler for writing next generation JavaScript.
jsoncrack.com,AykutSarac,TypeScript,43801,3533,44,1520,True,True,True,True,"✨ Innovative and open-source visualization application that transforms various data formats, such as JSON, YAML, XML and CSV into interactive graphs."
TensorFlow-Examples,aymericdamien,Jupyter Notebook,43793,14776,227,3792,False,False,False,True,TensorFlow Tutorial and Examples for Beginners (support TF v1 & v2)
tmux,tmux,C,43750,2526,65,3953,False,True,True,True,tmux source code
TrafficMonitor,zhongyang219,C++,43706,3626,1275,3166,False,False,True,True,这是一个用于显示当前网速、CPU及内存利用率的桌面悬浮窗软件，并支持任务栏显示，支持更换皮肤。
claude-mem,thedotmack,TypeScript,43697,3256,204,211,False,False,True,True,"A Claude Code plugin that automatically captures everything Claude does during your coding sessions, compresses it with AI (using Claude's agent-sdk), and injects relevant context back into future sessions."
helix,helix-editor,Rust,43688,3385,1473,2129,False,True,True,True,A post-modern modal text editor.
cobra,spf13,Go,43539,3097,361,4591,False,True,True,True,A Commander for modern Go CLI interactions
milvus,milvus-io,Go,43518,3922,1083,2387,True,True,True,True,"Milvus is a high-performance, cloud-native vector database built for scalable vector ANN search"
sentry,getsentry,Python,43471,4644,2071,5691,True,True,True,True,Developer-first error tracking and performance monitoring
cli,cli,Go,43454,8184,951,2370,True,True,True,True,GitHub’s official command line tool
fuels-rs,FuelLabs,Rust,43325,1359,68,1611,False,False,True,True,Fuel Network Rust SDK
twenty,twentyhq,TypeScript,43296,5727,90,1215,True,True,True,True,"Building a modern alternative to Salesforce, powered by the community."
fuels-ts,FuelLabs,TypeScript,43280,1368,81,1669,True,True,True,True,Fuel Network Typescript SDK
awesome-openclaw-skills,VoltAgent,,43243,4122,16,64,False,True,True,True,"The awesome collection of OpenClaw skills. 5,400+ skills filtered and categorized from the official OpenClaw Skills Registry.🦞"
exo,exo-explore,Python,43196,2981,168,644,False,True,True,True,Run frontier AI locally.
RSSHub,DIYgod,TypeScript,43101,9515,361,2919,True,True,True,True,🧡 Everything is RSSible
kong,Kong,Lua,43075,5106,133,4151,True,True,True,True,🦍 The API and AI Gateway
spark,apache,Scala,43062,29139,308,4416,True,True,True,True,Apache Spark - A unified analytics engine for large-scale data processing
CPlusPlusThings,Light-City,C++,43020,8829,8,2451,False,False,False,True,C++那些事
pm2,Unitech,JavaScript,43017,2699,1098,4697,False,True,True,True,Node.js Production Process Manager with a built-in Load Balancer.
BMAD-METHOD,bmad-code-org,JavaScript,42999,5156,154,351,True,True,True,True,Breakthrough Method for Agile Ai Driven Development
Win11Debloat,Raphire,PowerShell,42998,1710,30,1980,False,True,True,True,"A simple, lightweight PowerShell script that allows you to remove pre-installed apps, disable telemetry, as well as perform various other changes to declutter and customize your Windows experience. Win11Debloat works for both Windows 10 and Windows 11."
pandoc,jgm,Haskell,42997,3801,1057,5854,False,True,True,True,Universal markup converter
what-happens-when,alex,,42961,5729,2070,4527,False,False,False,True,"An attempt to answer the age old interview question ""What happens when you type google.com into your browser and press enter?"""
fanqiang,bannedbook,Kotlin,42942,7677,324,4094,False,False,True,True,翻墙-科学上网
mitmproxy,mitmproxy,Python,42879,4503,423,5887,True,True,True,True,An interactive TLS-capable intercepting HTTP proxy for penetration testers and software developers.
Umi-OCR,hiroi-sora,Python,42866,4235,330,1464,False,False,False,True,"OCR software, free and offline. 开源、免费的离线OCR软件。支持截屏/批量导入图片，PDF文档识别，排除水印/页眉页脚，扫描/生成二维码。内置多国语言库。"
zig,ziglang,Zig,42802,3072,3419,3890,False,False,False,True,Moved to Codeberg
python-patterns,faif,Python,42792,7044,13,5045,False,False,True,True,A collection of design patterns/idioms in Python
Files,files-community,C#,42765,2663,532,2642,True,True,True,True,A modern file manager that helps users organize their files and folders.
chatgpt-on-wechat,zhayujie,Python,42665,9862,349,1331,False,False,True,True,CowAgent是基于大模型的超级AI助理，能主动思考和任务规划、访问操作系统和外部资源、创造和执行Skills、拥有长期记忆并不断成长，比OpenClaw更轻量和便捷。同时支持微信、飞书、钉钉、企微、QQ、公众号、网页等接入，可选择OpenAI/Claude/Gemini/DeepSeek/ Qwen/GLM/Kimi/LinkAI，能处理文本、语音、图片和文件，可快速搭建个人AI助理和企业数字员工。
cherry-studio,CherryHQ,TypeScript,42625,3981,844,676,True,True,True,True,"AI productivity studio with smart chat, autonomous agents, and 300+ assistants. Unified access to frontier LLMs"
aider,Aider-AI,Python,42584,4098,1459,1056,False,True,True,True,aider is AI pair programming in your terminal
system-design,karanpratapsingh,,42524,5412,4,1323,True,True,False,True,Learn how to design systems at scale and prepare for system design interviews
git-flight-rules,k88hudson,,42475,3186,16,4269,False,False,False,True,Flight rules for git
bruno,usebruno,JavaScript,42412,2257,1630,1280,False,True,True,True,Opensource IDE For Exploring and Testing API's (lightweight alternative to Postman/Insomnia)
full-stack-fastapi-template,fastapi,TypeScript,42364,8284,20,2592,False,True,True,True,"Full stack, modern web application template. Using FastAPI, React, SQLModel, PostgreSQL, Docker, GitHub Actions, automatic HTTPS and more."
Alamofire,Alamofire,Swift,42363,7653,41,4260,False,True,True,True,Elegant HTTP Networking in Swift
zod,colinhacks,TypeScript,42250,1878,302,2214,True,True,True,True,TypeScript-first schema validation with static type inference
fd,sharkdp,Rust,42248,1022,173,3247,False,True,True,True,"A simple, fast and user-friendly alternative to 'find'"
siyuan,siyuan-note,TypeScript,42218,2625,338,2038,True,True,True,True,"A privacy-first, self-hosted, fully open source personal knowledge management software, written in typescript and golang."
gradio,gradio-app,Python,42216,3363,502,2658,True,True,True,True,"Build and share delightful machine learning apps, all in Python. 🌟 Star to support our work!"
ailearning,apachecn,Python,42158,11592,3,3320,False,False,False,True,AiLearning：数据分析+机器学习实战+线性代数+PyTorch+NLTK+TF2
diagrams,mingrammer,Python,42135,2725,385,2248,False,True,True,True,:art: Diagram as Code for prototyping cloud system architectures
DeepSpeed,deepspeedai,Python,41948,4770,1281,2258,True,True,True,True,"DeepSpeed is a deep learning optimization library that makes distributed training and inference easy, efficient, and effective."
ray,ray-project,Python,41886,7398,3573,3443,False,True,True,True,Ray is an AI compute engine. Ray consists of a core distributed runtime and a set of AI Libraries for accelerating ML workloads.
English-level-up-tips,byoungd,,41883,4408,28,3226,False,False,True,True,An advanced guide to learn English which might benefit you a lot 🎉 .  离谱的英语学习指南/英语学习教程/英语学习/学英语
swiper,nolimits4web,JavaScript,41822,9705,250,5129,True,True,True,True,Most modern mobile touch slider with hardware accelerated transitions
logseq,logseq,Clojure,41763,2526,1000,2138,True,True,True,True,"A privacy-first, open-source platform for knowledge management and collaboration. Download link:  http://github.com/logseq/logseq/releases. roadmap: https://discuss.logseq.com/t/logseq-product-roadmap/34267"
