repo_name,organization,language,stars,forks,open_issues,age_days,has_coc,has_contributing,has_workflows,has_readme,description
chinese-poetry,chinese-poetry,JavaScript,51444,10368,136,3542,False,False,True,True,"The most comprehensive database of Chinese poetry 🧶最全中华古诗词数据库,  唐宋两朝近一万四千古诗人,  接近5.5万首唐诗加26万宋诗.  两宋时期1564位词人，21050首词。"
crewAI,crewAIInc,Python,51427,7107,307,931,False,True,True,True,"Framework for orchestrating role-playing, autonomous AI agents. By fostering collaborative intelligence, CrewAI empowers agents to work together seamlessly, tackling complex tasks."
jekyll,jekyll,Ruby,51415,10288,251,6416,True,True,True,True,:globe_with_meridians: Jekyll is a blog-aware static site generator in Ruby
Mole,tw93,Shell,51398,1609,13,233,False,True,True,True,🐹 Deep clean and optimize your Mac.
windows,dockur,Shell,51364,4295,105,851,False,False,True,True,Windows inside a Docker container.
DefinitelyTyped,DefinitelyTyped,TypeScript,51235,30504,679,4969,False,False,True,True,The repository for high quality TypeScript type definitions.
ruflo,ruvnet,TypeScript,51159,5735,540,346,False,False,True,True,"🌊 The leading agent orchestration platform for Claude. Deploy intelligent multi-agent swarms, coordinate autonomous workflows, and build conversational AI systems. Features    enterprise-grade architecture, self-learning swarm intelligence, RAG integration, and native Claude Code / Codex Integration"
Semantic-UI,Semantic-Org,JavaScript,51096,4876,1071,4784,False,True,False,True,Semantic is a UI component framework based around useful principles from natural language.
go-ethereum,ethereum,Go,51042,21914,401,4522,False,True,True,True,Go implementation of the Ethereum protocol
lazydocker,jesseduffield,Go,51040,1612,274,2553,True,True,True,True,The lazier way to manage everything docker
100-Days-Of-ML-Code,Avik-Jain,,51035,11560,67,2870,True,True,False,True,100 Days of ML Coding
lx-music-desktop,lyswhut,TypeScript,50973,6808,1165,2465,False,False,True,True,一个基于 Electron 的音乐软件
awesome-wechat-weapp,justjavac,,50945,9014,2,3521,False,False,False,True,微信小程序开发资源汇总 :100:
professional-programming,charlax,Python,50801,3969,1,3842,False,True,False,True,A collection of learning resources for curious software engineers
odoo,odoo,Python,50672,32412,9700,4384,False,True,False,True,Odoo. Open Source Apps To Grow Your Business.
hiring-without-whiteboards,poteto,JavaScript,50611,3886,38,3348,True,True,True,True,⭐️  Companies that don't have a broken hiring process
freqtrade,freqtrade,Python,50353,10507,32,3284,False,True,True,True,"Free, open source crypto trading bot"
open-source-ios-apps,dkhamsing,,50281,5775,5,4126,False,True,True,True,:iphone: Collaborative List of Open-Source iOS Apps
OpenCut,OpenCut-app,TypeScript,50147,5393,306,326,True,True,True,True,The open-source CapCut alternative
bulma,jgthms,CSS,50078,3896,521,3764,False,True,True,True,Modern CSS framework based on Flexbox
dbeaver,dbeaver,Java,50037,4178,3322,3858,True,True,True,True,Free universal database tool and SQL client
mastodon,mastodon,Ruby,49952,7438,4443,3734,True,True,True,True,"Your self-hosted, globally interconnected microblogging community"
minimind,jingyaogong,Python,49863,6339,35,657,True,False,True,True,🧠「大模型」2小时完全从0训练64M的小参数LLM！Train a 64M-parameter LLM from scratch in just 2h!
json,nlohmann,C++,49696,7395,73,4697,True,True,True,True,JSON for Modern C++
whisper.cpp,ggml-org,C++,49694,5535,1197,1327,False,False,True,True,Port of OpenAI's Whisper model in C/C++
cypress,cypress-io,TypeScript,49650,3397,1205,4090,True,True,True,True,"Fast, easy and reliable testing for anything that runs in a browser."
MediaCrawler,NanmiCoder,Python,49631,10515,158,1070,False,False,True,True,小红书笔记 | 评论爬虫、抖音视频 | 评论爬虫、快手视频 | 评论爬虫、B 站视频 ｜ 评论爬虫、微博帖子 ｜ 评论爬虫、百度贴吧帖子 ｜ 百度贴吧评论回复爬虫  | 知乎问答文章｜评论爬虫
Scrapling,D4Vinci,Python,49603,4668,2,578,True,True,True,True,🕷️ An adaptive Web Scraping framework that handles everything from a single request to a full-scale crawl!
hello-agents,datawhalechina,Python,49543,5974,111,249,False,False,True,True,📚 《从零开始构建智能体》——从零开始的智能体原理与实践教程
pi,earendil-works,TypeScript,49541,5885,47,278,False,True,True,True,"AI agent toolkit: coding agent CLI, unified LLM API, TUI & web UI libraries, Slack bot, vLLM pods"
hacker-scripts,NARKOZ,JavaScript,49492,6645,70,3827,False,False,False,True,Based on a true story
alist,AlistGo,Go,49471,7947,575,1968,True,True,True,True,"🗂️A file list/WebDAV program that supports multiple storages, powered by Gin and Solidjs. / 一个支持多存储的文件列表/WebDAV程序，使用 Gin 和 Solidjs。"
expo,expo,TypeScript,49452,12252,573,3559,False,True,True,True,"An open-source framework for making universal native apps with React. Expo runs on Android, iOS, and the web."
query,TanStack,TypeScript,49427,3817,175,2438,False,True,True,True,"🤖 Powerful asynchronous state management, server-state utilities and data fetching for the web. TS/JS, React Query, Solid Query, Svelte Query and Vue Query."
llama_index,run-llama,Python,49423,7415,373,1290,True,True,True,True,LlamaIndex is the leading document agent and OCR platform
huginn,huginn,Ruby,49270,4264,695,4814,False,False,True,True,Create agents that monitor and act on your behalf.  Your agents are standing by!
plane,makeplane,TypeScript,49171,4249,812,1272,True,True,True,True,"🔥🔥🔥 Open-source Jira, Linear, Monday, and ClickUp alternative. Plane is a modern project management platform to manage tasks, sprints, docs, and triage."
pandas,pandas-dev,Python,48768,19950,3279,5743,True,True,True,True,"Flexible and powerful data analysis / manipulation library for Python, providing labeled data structures similar to R data.frame objects, statistical functions, and much more"
Pake,tw93,Rust,48712,9820,0,1308,True,True,True,True,🤱🏻 Turn any webpage into a desktop app with one command.
julia,JuliaLang,Julia,48710,5773,4703,5502,True,True,True,True,The Julia Programming Language
awesome-openclaw-skills,VoltAgent,,48678,4767,19,109,False,True,True,True,"The awesome collection of OpenClaw skills. 5,400+ skills filtered and categorized from the official OpenClaw Skills Registry.🦞"
dayjs,iamkun,JavaScript,48643,2426,1228,2956,False,True,True,True,⏰ Day.js 2kB immutable date-time library alternative to Moment.js with the same modern API
open-source-mac-os-apps,serhii-londar,,48581,2561,75,3115,False,True,True,True,🚀 Awesome list of open source applications for macOS. https://t.me/s/opensourcemacosapps
chinese-independent-developer,1c7,,48550,4160,1,3157,False,True,True,True,👩🏿‍💻👨🏾‍💻👩🏼‍💻👨🏽‍💻👩🏻‍💻中国独立开发者项目列表 -- 分享大家都在做什么
algorithm-visualizer,algorithm-visualizer,JavaScript,48547,7588,79,3652,True,True,False,True,:fireworks:Interactive Online Platform that Visualizes Algorithms from Code
jadx,skylot,Java,48518,5511,422,4805,True,True,True,True,Dex to Java decompiler
Fooocus,lllyasviel,Python,48482,7892,295,1009,False,False,True,True,Focus on prompting and generating
terraform,hashicorp,Go,48400,10347,1896,4445,True,True,True,True,"Terraform enables you to safely and predictably create, change, and improve infrastructure. It is a source-available tool that codifies APIs into declarative configuration files that can be shared amongst team members, treated as code, edited, reviewed, and versioned."
x64dbg,x64dbg,C++,48383,2735,570,4051,True,True,True,True,An open-source user mode debugger for Windows. Optimized for reverse engineering and malware analysis.
kubernetes-the-hard-way,kelseyhightower,,48300,15656,49,3598,False,True,False,True,Bootstrap Kubernetes the hard way. No scripts.
RxJava,ReactiveX,Java,48253,7588,20,4874,False,True,True,True,RxJava – Reactive Extensions for the JVM – a library for composing asynchronous and event-based programs using observable sequences for the Java VM.
OpenSpec,Fission-AI,TypeScript,48133,3376,326,282,False,False,True,True,Spec-driven development (SDD) for AI coding assistants.
rtk,rtk-ai,Rust,48118,2917,904,112,False,True,True,True,"CLI proxy that reduces LLM token consumption by 60-90% on common dev commands. Single Rust binary, zero dependencies"
graphify,safishamsi,Python,48083,5221,246,41,False,False,True,True,"AI coding assistant skill (Claude Code, Codex, OpenCode, Cursor, Gemini CLI, and more). Turn any folder of code, SQL schemas, R scripts, shell scripts, docs, papers, images, or videos into a queryable knowledge graph. App code + database schema + infrastructure in one graph."
type-challenges,type-challenges,TypeScript,48078,5254,33177,2121,True,False,True,True,Collection of TypeScript type challenges with online judge
PythonDataScienceHandbook,jakevdp,Jupyter Notebook,48078,18940,231,3564,True,True,False,True,Python Data Science Handbook: full text in Jupyter Notebooks
brew,Homebrew,Ruby,48000,11117,21,3722,True,True,True,True,🍺 The missing package manager for macOS (or Linux)
htmx,bigskysoftware,JavaScript,47992,1597,656,2222,False,True,True,True,</> htmx - high power tools for HTML
moment,moment,JavaScript,47979,6999,298,5554,False,True,True,True,"Parse, validate, manipulate, and display dates in javascript."
awesome-java,akullpp,,47934,7674,9,4327,False,True,True,True,"A curated list of awesome frameworks, libraries and software for the Java programming language."
design-patterns-for-humans,nilbuild,,47813,5509,16,3374,False,False,False,True,An ultra-simplified explanation to design patterns
Projects,karan,,47655,10640,117,4697,False,True,False,True,:page_with_curl: A list of practical projects that anyone can solve in any programming language.
big-list-of-naughty-strings,minimaxir,Python,47628,2162,108,3932,False,False,False,True,The Big List of Naughty Strings is a list of strings which have a high probability of causing issues when used as user-input data.
Made-With-ML,GokuMohandas,Jupyter Notebook,47608,7513,25,2748,False,False,True,True,"Learn how to develop, deploy and iterate on production-grade ML applications."
awesome-react-components,brillout,,47555,3770,49,3611,True,True,True,True,Curated List of React Components & Libraries.
penpot,penpot,Clojure,47549,2944,692,3789,True,True,True,True,Penpot: The open-source design tool for design and code collaboration
ruff,astral-sh,Rust,47528,2088,1995,1374,True,True,True,True,"An extremely fast Python linter and code formatter, written in Rust."
gogs,gogs,Go,47515,5062,993,4475,False,True,True,True,Gogs is a painless self-hosted Git service
AI-For-Beginners,microsoft,Jupyter Notebook,47511,9815,4,1898,True,False,True,True,"12 Weeks, 24 Lessons, AI for All!"
ClickHouse,ClickHouse,C++,47422,8402,6121,3633,True,True,True,True,ClickHouse® is a real-time analytics database management system
awesome-design-patterns,DovAmir,,47357,3243,24,2901,False,True,False,True,A curated list of software and architecture related design patterns.
metabase,metabase,Clojure,47315,6464,4154,4119,False,True,True,True,The easy-to-use open source Business Intelligence and Embedded Analytics tool that lets everyone work with data :bar_chart:
pixijs,pixijs,TypeScript,47184,5010,326,4861,True,True,True,True,"The HTML5 Creation Engine: Create beautiful digital content with the fastest, most flexible 2D WebGL renderer."
BMAD-METHOD,bmad-code-org,JavaScript,47175,5529,50,396,True,True,True,True,Breakthrough Method for Agile Ai Driven Development
textgen,oobabooga,Python,47127,5981,799,1241,False,False,True,True,"Open-source desktop app for local LLMs. Text, vision, tool-calling, OpenAI/Anthropic-compatible API. 100% private."
VibeVoice,microsoft,Python,47126,5236,161,262,True,True,True,True,Open-Source Frontier Voice AI
quill,slab,TypeScript,47108,3637,649,5036,True,True,True,True,Quill is a modern WYSIWYG editor built for compatibility and extensibility
react,typescript-cheatsheets,JavaScript,47043,4292,1,2904,True,True,True,True,Cheatsheets for experienced React developers getting started with TypeScript
tldraw,tldraw,TypeScript,47038,3212,375,1831,True,True,True,True,very good whiteboard infinite canvas SDK
litellm,BerriAI,Python,47034,8057,3070,1023,False,True,True,True,"Python SDK, Proxy Server (AI Gateway) to call 100+ LLM APIs in OpenAI (or native) format, with cost tracking, guardrails, loadbalancing and logging. [Bedrock, Azure, OpenAI, VertexAI, Cohere, Anthropic, Sagemaker, HuggingFace, VLLM, NVIDIA NIM]"
discourse,discourse,Ruby,47021,8913,151,4871,True,True,True,True,"A platform for community discussion. Free, open, simple."
okhttp,square,Kotlin,46966,9270,111,5043,False,True,True,True,"Square’s meticulous HTTP client for the JVM, Android, and GraalVM."
pretext,chenglou,TypeScript,46937,2596,61,68,False,False,True,True,"Fast, accurate & comprehensive text measurement & layout"
remotion,remotion-dev,TypeScript,46928,3235,107,2151,True,True,True,True,🎥      Make videos programmatically with React
serverless,serverless,JavaScript,46915,5734,1230,4042,True,True,True,True,"⚡ Serverless Framework – Effortlessly build apps that auto-scale, incur zero costs when idle, and require minimal maintenance using AWS Lambda and other managed cloud services."
v2ray-core,v2ray,Go,46851,8855,17,3905,True,False,True,True,A platform for building proxies to bypass network restrictions.
frontend-dev-bookmarks,dypsilon,,46697,5150,123,4709,False,True,False,True,Manually curated collection of resources for frontend web developers.
legado,gedoor,Kotlin,46644,5358,63,2550,False,False,True,True,"Legado 3.0 Book Reader with powerful controls & full functions❤️阅读3.0, 阅读是一款可以自定义来源阅读网络内容的工具，为广大网络文学爱好者提供一种方便、快捷舒适的试读体验。"
acme.sh,acmesh-official,Shell,46563,5568,1396,3792,False,False,True,True,A pure Unix shell script ACME client for SSL / TLS certificate automation
slidev,slidevjs,TypeScript,46471,2067,190,1847,True,True,True,True,Presentation Slides for Developers
GitHubDaily,GitHubDaily,,46459,4652,592,2692,False,False,False,True,"坚持分享 GitHub 上高质量、有趣实用的开源技术教程、开发者工具、编程网站、技术资讯。A list cool, interesting projects of GitHub."
nvm-windows,coreybutler,Go,46366,3823,84,4254,False,True,True,True,A node.js version management utility for Windows. Ironically written in Go.
30-Days-Of-JavaScript,Asabeneh,JavaScript,46351,10440,370,2334,False,False,False,True,"30 days of JavaScript programming challenge is a step-by-step guide to learn JavaScript programming language in 30 days. This challenge may take more than 100 days,  please just follow your own pace. These videos may help too: https://www.youtube.com/channel/UC7PNRuno1rzYPb1xLa4yktw"
LocalAI,mudler,Go,46266,4076,166,1153,False,True,True,True,"LocalAI is the open-source AI engine. Run any model - LLMs, vision, voice, image, video - on any hardware. No GPU required."
Win11Debloat,Raphire,PowerShell,46265,1880,38,2025,False,True,True,True,"A simple, lightweight PowerShell script that allows you to remove pre-installed apps, disable telemetry, as well as perform various other changes to declutter and customize your Windows experience. Win11Debloat works for both Windows 10 and Windows 11."
JeecgBoot,jeecgboot,Java,46259,15993,23,2726,False,False,True,True,AI低代码平台，支持「低代码 + 零代码」双模式：零代码 5 分钟搭建业务系统，低代码模式一键生成前后端代码。 内置AI 应用，支持AI聊天、知识库、流程编排、MCP与插件，支持各种模型。Skills能力实现：一句话画流程图、设计表单、生成系统。 引领 AI生成→在线配置→代码生成→手工合并的开发模式，解决Java项目80%的重复工作，快速提高效率，又不失灵活性。
spotube,KRTirtho,Dart,46244,2081,793,1916,True,False,True,True,🎧 Open source music streaming app! Available for both desktop & mobile!
learn-regex,ziishaned,,46123,6182,65,3218,False,False,False,True,Learn regex the easy way
bevy,bevyengine,Rust,46079,4562,3386,2308,True,True,True,True,A refreshingly simple data-driven game engine built in Rust
monaco-editor,microsoft,JavaScript,46002,4065,814,3628,True,True,True,True,A browser based code editor
prisma,prisma,TypeScript,45966,2197,2595,2520,True,True,True,True,"Next-generation ORM for Node.js & TypeScript | PostgreSQL, MySQL, MariaDB, SQL Server, SQLite, MongoDB and CockroachDB"
awesome-cheatsheets,LeCoupa,JavaScript,45856,6697,138,3109,False,False,True,True,"👩‍💻👨‍💻 Awesome cheatsheets for popular programming languages, frameworks and development tools. They include everything you should know in one single file."
twenty,twentyhq,TypeScript,45809,6418,131,1260,True,True,True,True,"The open alternative to Salesforce, designed for AI."
awesome-remote-job,lukasz-madon,,45751,4617,16,4151,False,True,True,True,A curated list of awesome remote jobs and resources. Inspired by https://github.com/vinta/awesome-python
cherry-studio,CherryHQ,TypeScript,45690,4338,1168,721,True,True,True,True,"AI productivity studio with smart chat, autonomous agents, and 300+ assistants. Unified access to frontier LLMs"
architecture-samples,android,Kotlin,45688,11873,220,3751,False,True,True,True,A collection of samples to discuss and showcase different architectural tools and patterns for Android apps.
tmux,tmux,C,45510,2624,48,3998,False,True,True,True,tmux source code
zx,google,JavaScript,45493,1268,38,1836,True,True,True,True,A tool for writing better scripts
fanqiang,bannedbook,Kotlin,45435,7899,326,4139,False,False,True,True,翻墙-科学上网
airflow,apache,Python,45420,17058,1737,4049,True,True,True,True,"Apache Airflow - A platform to programmatically author, schedule, and monitor workflows"
AdminLTE,ColorlibHQ,CSS,45382,18232,27,4524,True,True,True,True,AdminLTE - Free admin dashboard template based on Bootstrap 5
jest,jestjs,TypeScript,45362,6653,221,4539,True,True,True,True,Delightful JavaScript Testing.
Rocket.Chat,RocketChat,TypeScript,45312,13573,3707,4013,True,True,True,True,The Secure CommsOS™ for mission-critical operations
TTS,coqui-ai,Python,45309,6093,8,2185,True,True,True,True,"🐸💬 - a deep learning toolkit for Text-to-Speech, battle-tested in research and production"
upscayl,upscayl,TypeScript,45267,2206,58,1384,False,False,True,True,"🆙 Upscayl - #1 Free and Open Source AI Image Upscaler for Linux, MacOS and Windows."
awesome-compose,docker,HTML,45266,8146,374,2282,False,True,True,True,Awesome Docker Compose samples
goose,aaif-goose,Rust,45211,4628,271,629,False,True,True,True,"an open source, extensible AI agent that goes beyond code suggestions - install, execute, edit, and test with any LLM"
Leaflet,Leaflet,JavaScript,45018,6124,534,5713,True,True,True,True,🍃 JavaScript library for mobile-friendly interactive maps 🇺🇦
CppCoreGuidelines,isocpp,CSS,44988,5543,248,3921,False,True,True,True,"The C++ Core Guidelines are a set of tried-and-true guidelines, rules, and best practices about coding in C++"
iina,iina,Swift,44864,2815,1908,3433,False,True,True,True,The modern video player for macOS.
copyparty,9001,Python,44834,1834,258,2545,True,True,False,True,"Portable file server with accelerated resumable uploads, dedup, WebDAV, SFTP, FTP, TFTP, zeroconf, media indexer, thumbnails++ all in one file"
aider,Aider-AI,Python,44834,4412,1535,1101,False,True,True,True,aider is AI pair programming in your terminal
edex-ui,GitSquared,JavaScript,44821,3111,6,3393,False,False,True,True,"A cross-platform, customizable science fiction terminal emulator with advanced monitoring & touchscreen support."
meteor,meteor,JavaScript,44781,5257,376,5230,True,True,True,True,"Meteor, the JavaScript App Platform"
career-ops,santifer,JavaScript,44765,9399,198,40,True,True,True,True,"AI-powered job search system built on Claude Code. 14 skill modes, Go dashboard, PDF generation, batch processing."
pyenv,pyenv,Shell,44761,3269,55,5004,False,True,True,True,Simple Python version management
grpc,grpc,C++,44753,11169,1333,4175,True,True,True,True,"C++ based gRPC (C++, Python, Ruby, Objective-C, PHP, C#)"
react-hook-form,react-hook-form,TypeScript,44714,2399,96,2627,True,True,True,True,📋 React Hooks for form state management and validation (Web + React Native)
exo,exo-explore,Python,44679,3155,225,689,False,True,True,True,Run frontier AI locally.
streamlit,streamlit,Python,44597,4262,1303,2456,True,True,True,True,Streamlit — A faster way to build and share data apps.
Summer2026-Internships,SimplifyJobs,Python,44597,3179,5,2182,False,True,True,True,Collection of Summer 2026 tech internships!
hyper,vercel,TypeScript,44582,3558,1042,3605,False,False,True,True,A terminal built on web technologies
reactjs-interview-questions,sudheerj,JavaScript,44572,10365,15,2905,False,False,True,True,List of top 500 ReactJS Interview Questions & Answers....Coding exercise questions are coming soon!!
CowAgent,zhayujie,Python,44465,10098,336,1376,False,False,True,True,CowAgent (chatgpt-on-wechat) 是基于大模型的超级AI助理，能主动思考和任务规划、访问操作系统和外部资源、创造和执行Skills、通过长期记忆和知识库不断成长，比OpenClaw更轻量和便捷。同时支持微信、飞书、钉钉、企微、QQ、公众号、网页等接入，可选择DeepSeek/OpenAI/Claude/Gemini/ MiniMax/Qwen/GLM/LinkAI，能处理文本、语音、图片和文件，可快速搭建个人AI助理和企业数字员工。
TrafficMonitor,zhongyang219,C++,44415,3684,1303,3211,False,False,True,True,这是一个用于显示当前网速、CPU及内存利用率的桌面悬浮窗软件，并支持任务栏显示，支持更换皮肤。
cli,cli,Go,44398,8430,1005,2415,True,True,True,True,GitHub’s official command line tool
helix,helix-editor,Rust,44371,3466,1545,2174,False,True,True,True,A post-modern modal text editor.
milvus,milvus-io,Go,44299,4000,882,2432,True,True,True,True,"Milvus is a high-performance, cloud-native vector database built for scalable vector ANN search"
Umi-OCR,hiroi-sora,Python,44202,4369,338,1509,False,False,False,True,"OCR software, free and offline. 开源、免费的离线OCR软件。支持截屏/批量导入图片，PDF文档识别，排除水印/页眉页脚，扫描/生成二维码。内置多国语言库。"
pandoc,jgm,Haskell,44134,3851,1072,5899,False,True,True,True,Universal markup converter
English-level-up-tips,byoungd,,44110,4650,23,3271,False,False,True,True,An advanced guide to learn English which might benefit you a lot 🎉 .  离谱的英语学习指南/英语学习教程/英语学习/学英语
RSSHub,DIYgod,TypeScript,44040,9786,353,2964,True,True,True,True,🧡 Everything is RSSible
parcel,parcel-bundler,JavaScript,44030,2274,591,3202,True,True,True,True,The zero configuration build tool for the web. 📦🚀
react-use,streamich,TypeScript,43980,3274,655,2756,False,True,True,True,React Hooks — 👍
front-end-interview-handbook,yangshun,MDX,43963,5953,11,3043,True,True,True,True,Front End interview preparation materials for busy engineers (updated for 2026)
jsoncrack.com,AykutSarac,TypeScript,43958,3536,35,1565,True,True,True,True,"✨ Innovative and open-source visualization application that transforms various data formats, such as JSON, YAML, XML and CSV into interactive graphs."
build-web-application-with-golang,astaxie,Go,43939,10495,138,5033,False,False,False,True,A golang ebook intro how to build a web with golang
cobra,spf13,Go,43932,3143,366,4636,False,True,True,True,A Commander for modern Go CLI interactions
retrofit,square,HTML,43902,7346,169,5729,False,True,True,True,A type-safe HTTP client for Android and the JVM
babel,babel,TypeScript,43894,5826,752,4246,True,True,True,True,🐠 Babel is a compiler for writing next generation JavaScript.
siyuan,siyuan-note,TypeScript,43872,2792,341,2083,True,True,True,True,"A privacy-first, self-hosted, fully open source personal knowledge management software, written in typescript and golang."
sentry,getsentry,Python,43856,4706,2095,5736,True,True,True,True,Developer-first error tracking and performance monitoring
EasySpider,NaiboWang,JavaScript,43810,5338,265,2127,False,False,True,True,A visual no-code/code-free web crawler/spider易采集：一个可视化浏览器自动化测试/数据采集/爬虫软件，可以无代码图形化的设计和执行爬虫任务。别名：ServiceWrapper面向Web应用的智能化服务封装系统。
bruno,usebruno,JavaScript,43790,2403,1656,1325,False,True,True,True,Opensource IDE For Exploring and Testing API's (lightweight alternative to Postman/Insomnia)
TensorFlow-Examples,aymericdamien,Jupyter Notebook,43774,14761,228,3837,False,False,False,True,TensorFlow Tutorial and Examples for Beginners (support TF v1 & v2)
awesome-claude-code,hesreallyhim,Python,43765,3733,306,390,True,True,True,True,"A curated list of awesome skills, hooks, slash-commands, agent orchestrators, applications, and plugins for Claude Code by Anthropic"
mitmproxy,mitmproxy,Python,43547,4566,428,5932,True,True,True,True,An interactive TLS-capable intercepting HTTP proxy for penetration testers and software developers.
Files,files-community,C#,43501,2719,518,2687,True,True,True,True,A modern file manager that helps users organize their files and folders.
kong,Kong,Lua,43395,5135,139,4196,True,True,True,True,🦍 The API and AI Gateway
spark,apache,Scala,43269,29178,376,4461,True,True,True,True,Apache Spark - A unified analytics engine for large-scale data processing
