repo_name,organization,language,stars,forks,open_issues,age_days,has_coc,has_contributing,has_workflows,has_readme,description
build-your-own-x,codecrafters-io,Markdown,498337,47227,475,2913,False,False,True,True,Master programming by recreating your favorite technologies from scratch.
awesome,sindresorhus,,460724,34565,68,4311,True,True,True,True,😎 Awesome lists about all kinds of interesting topics
freeCodeCamp,freeCodeCamp,TypeScript,443950,44437,185,4145,True,True,True,True,"freeCodeCamp.org's open-source codebase and curriculum. Learn math, programming, and computer science for free."
public-apis,public-apis,Python,429682,46881,1317,3693,False,True,True,True,A collective list of free APIs
free-programming-books,EbookFoundation,Python,387440,66207,79,4584,True,True,True,True,:books: Freely available programming books
openclaw,openclaw,TypeScript,366874,75373,6777,157,False,True,True,True,Your own personal AI assistant. Any OS. Any Platform. The lobster way. 🦞 
developer-roadmap,nilbuild,TypeScript,353959,43981,12,3333,True,True,True,True,"Interactive roadmaps, guides and other educational content to help developers grow in their careers."
system-design-primer,donnemartin,Python,346474,55901,529,3350,False,True,False,True,Learn how to design large-scale systems. Prep for the system design interview.  Includes Anki flashcards.
coding-interview-university,jwasham,,343369,82310,104,3616,False,False,True,True,A complete computer science study plan to become a software engineer.
awesome-python,vinta,Python,295314,27795,18,4325,False,True,True,True,"An opinionated list of Python frameworks, libraries, tools, and resources"
awesome-selfhosted,awesome-selfhosted,,289255,13331,0,3987,False,False,False,True,A list of Free Software network services and web applications which can be hosted on your own servers
996.ICU,996icu,,276108,20890,16694,2592,False,False,False,True,Repo for counting stars and contributing. Press F to pay respect to glorious developers.
project-based-learning,practical-tutorials,,264514,34372,296,3306,False,True,True,True,Curated list of project-based tutorials
react,facebook,JavaScript,244772,51022,1257,4724,True,True,True,True,The library for web and native user interfaces.
linux,torvalds,C,231517,62017,3,5352,False,False,True,True,Linux kernel source tree
Python,TheAlgorithms,Python,220541,50492,941,3575,True,True,True,True,All Algorithms implemented in Python
the-book-of-secret-knowledge,trimstray,,218120,13107,140,2868,True,True,True,True,"A collection of inspiring lists, manuals, cheatsheets, blogs, hacks, one-liners, cli/web tools and more."
vue,vuejs,TypeScript,209809,33878,621,4659,True,True,True,True,"This is the repo for Vue 2. For Vue 3, go to https://github.com/vuejs/core"
computer-science,ossu,HTML,203455,25319,23,4380,False,True,True,True,🎓 Path to a free self-taught education in Computer Science!
javascript-algorithms,trekhleb,JavaScript,195901,31086,403,2959,True,True,True,True,📝 Algorithms and data structures implemented in JavaScript with explanations and links to further readings
tensorflow,tensorflow,C++,194944,75300,4809,3828,True,True,True,True,An Open Source Machine Learning Framework for Everyone
claw-code,ultraworkers,Rust,189433,109559,1513,30,False,False,True,True,The repo is finally unlocked. enjoy the party! The fastest repo in history to surpass 100K stars ⭐. Join Discord: https://discord.gg/5TUQKqFWd Built in Rust using oh-my-codex.
ohmyzsh,ohmyzsh,Shell,186643,26350,546,6089,True,True,True,True,"🙃   A delightful community-driven (with 2,400+ contributors) framework for managing your zsh configuration. Includes 300+ optional plugins (rails, git, macOS, hub, docker, homebrew, node, php, python, etc), 140+ themes to spice up your morning, and an auto-update tool that makes it easy to keep up with the latest updates from the community."
n8n,n8n-io,TypeScript,186303,57269,1563,2504,True,True,True,True,"Fair-code workflow automation platform with native AI capabilities. Combine visual building with custom code, self-host or cloud, 400+ integrations."
You-Dont-Know-JS,getify,,184441,33579,2,4549,False,True,True,True,A book series (2 published editions) on the JS language.
vscode,microsoft,TypeScript,184431,39584,16908,3892,True,True,True,True,Visual Studio Code
CS-Notes,CyC2018,,184284,51037,194,2998,False,False,False,True,:books: 技术面试必备基础知识、Leetcode、计算机操作系统、计算机网络、系统设计
AutoGPT,Significant-Gravitas,Python,183916,46236,405,1141,True,True,True,True,"AutoGPT is the vision of accessible AI for everyone, to use and to build on. Our mission is to provide the tools, so that you can focus on what matters."
Python-100-Days,jackfrued,Jupyter Notebook,182049,55665,696,2982,False,False,True,True,Python - 100天从新手到大师
flutter,flutter,Dart,176153,30299,12567,4073,True,True,True,True,Flutter makes it easy and fast to build beautiful apps for mobile and beyond
superpowers,obra,Shell,174788,15421,285,203,True,False,True,True,An agentic skills framework & software development methodology that works.
bootstrap,twbs,MDX,174212,78940,431,5389,True,True,True,True,"The most popular HTML, CSS, and JavaScript framework for developing responsive, mobile first projects on the web."
Microsoft-Activation-Scripts,massgravel,Batchfile,173691,16679,2,2300,False,False,False,True,"Open-source Windows and Office activator featuring HWID, Ohook, TSforge, and Online KMS activation methods, along with advanced troubleshooting."
gitignore,github,,173643,82579,69,5652,True,True,True,True,A collection of useful .gitignore templates
awesome-go,avelino,Go,171467,13180,183,4316,True,True,True,True,"A curated list of awesome Go frameworks, libraries and software"
everything-claude-code,affaan-m,JavaScript,171074,26521,146,103,True,True,True,True,"The agent harness performance optimization system. Skills, instincts, memory, security, and research-first development for Claude Code, Codex, Opencode, Cursor and beyond."
ollama,ollama,Go,170439,15913,3125,1039,False,True,True,True,"Get up and running with Kimi-K2.5, GLM-5, MiniMax, DeepSeek, gpt-oss, Qwen, Gemma and other models."
stable-diffusion-webui,AUTOMATIC1111,Python,162674,30300,2482,1347,False,False,True,True,Stable Diffusion web UI
prompts.chat,f,HTML,161272,21050,45,1242,False,True,True,True,"f.k.a. Awesome ChatGPT Prompts. Share, discover, and collect prompts from the community. Free and open source — self-host for your organization with complete privacy."
the-art-of-command-line,jlevy,,160820,14801,254,3998,False,True,False,True,"Master the command line, in one page"
transformers,huggingface,Python,160133,33067,2342,2740,True,True,True,True,"🤗 Transformers: the model-definition framework for state-of-the-art machine learning models in text, vision, audio, and multimodal models, for both inference and training. "
yt-dlp,yt-dlp,Python,159940,13263,2503,2013,False,True,True,True,A feature-rich command-line audio/video downloader
FreeDomain,DigitalPlatDev,HTML,159538,2717,31,700,False,False,False,True,DigitalPlat FreeDomain: Free Domain For Everyone
JavaGuide,Snailclimb,Java,155354,46155,62,2915,False,False,True,True,Java 面试 & 后端通用面试指南，覆盖计算机基础、数据库、分布式、高并发、系统设计与 AI 应用开发
HelloGitHub,521xueweihan,Python,154160,11755,352,3648,False,False,False,True,":octocat: 分享 GitHub 上有趣、入门级的开源项目。Share interesting, entry-level open source projects on GitHub."
opencode,anomalyco,TypeScript,152701,17624,6213,365,False,True,True,True,The open source coding agent.
javascript,airbnb,JavaScript,148118,26703,159,4928,True,False,True,True,JavaScript Style Guide
langflow,langflow-ai,Python,147574,8885,946,1177,True,True,True,True,Langflow is a powerful tool for building and deploying AI-powered agents and workflows.
youtube-dl,ytdl-org,Python,140165,10621,4125,5660,False,True,True,True,Command-line program to download videos from YouTube.com and other video sites
dify,langgenius,TypeScript,139776,21921,827,1114,True,True,True,True,Production-ready platform for agentic workflow development.
scrcpy,Genymobile,C,139269,12963,2794,3082,False,False,True,True,Display and control your Android device
next.js,vercel,JavaScript,139238,30992,3855,3494,True,True,True,True,The React Framework
tech-interview-handbook,yangshun,TypeScript,139212,16546,44,3587,True,True,True,True,Curated coding interview preparation materials for busy software engineers
system-prompts-and-models-of-ai-tools,x1xhlol,,136472,34099,137,421,False,False,True,True,"FULL Augment Code, Claude Code, Cluely, CodeBuddy, Comet, Cursor, Devin AI, Junie, Kiro, Leap.new, Lovable, Manus, NotionAI, Orchids.app, Perplexity, Poke, Qoder, Replit, Same.dev, Trae, Traycer AI, VSCode Agent, Warp.dev, Windsurf, Xcode, Z.ai Code, Dia & v0. (And other Open Sourced) System Prompts, Internal Tools & AI Models"
langchain,langchain-ai,Python,135533,22396,559,1292,True,True,True,True,The agent engineering platform
open-webui,open-webui,Python,135017,19198,334,937,True,False,True,True,"User-friendly AI Interface (Supports Ollama, OpenAI API, ...)"
go,golang,Go,133700,18993,10059,4273,True,True,True,True,The Go programming language
fucking-algorithm,labuladong,Markdown,133372,23635,1,2262,False,False,False,True,"Crack LeetCode, not only how, but also why. "
PowerToys,microsoft,C#,132646,7930,6787,2556,True,True,True,True,Microsoft PowerToys is a collection of utilities that supercharge productivity and customization on Windows
30-seconds-of-code,Chalarangelo,JavaScript,127636,12481,1,3074,True,True,True,True,Coding articles to level up your development skills
hermes-agent,NousResearch,Python,127043,19051,7368,282,False,True,True,True,The agent that grows with you
skills,anthropics,Python,126668,14860,793,220,False,False,True,True,Public repository for Agent Skills
hello-algo,krahets,Java,125791,15088,30,1273,False,False,True,True,"《Hello 算法》：动画图解、一键运行的数据结构与算法教程。支持简中、繁中、English、日本語，提供 Python, Java, C++, C, C#, JS, Go, Swift, Rust, Ruby, Kotlin, TS, Dart 等代码实现"
react-native,facebook,C++,125737,25147,1298,4129,True,True,True,True,A framework for building native applications using React
excalidraw,excalidraw,TypeScript,122294,13480,3030,2311,False,True,True,True,Virtual whiteboard for sketching hand-drawn like diagrams
kubernetes,kubernetes,Go,122011,42980,2706,4346,True,True,True,True,Production-Grade Container Scheduling and Management
electron,electron,C++,121087,17155,858,4767,True,True,True,True,":electron: Build cross-platform desktop apps with JavaScript, HTML, and CSS"
free-for-dev,ripienaar,HTML,121055,12633,12,4061,True,True,True,True,"A list of SaaS, PaaS and IaaS offerings that have free tiers of interest to devops and infradev"
claude-code,anthropics,Shell,119558,19830,10887,432,False,False,True,True,"Claude Code is an agentic coding tool that lives in your terminal, understands your codebase, and helps you code faster by executing routine tasks, explaining complex code, and handling git workflows - all through natural language commands."
markitdown,microsoft,Python,119050,7874,649,533,True,False,True,True,Python tool for converting files and office documents to Markdown.
node,nodejs,JavaScript,116995,35490,2651,4173,True,True,True,True,Node.js JavaScript runtime ✨🐢🚀✨
free-programming-books-zh_CN,justjavac,,116803,28307,33,4561,True,True,False,True,:books: 免费的计算机编程类中文书籍，欢迎投稿
iptv,iptv-org,TypeScript,115646,6060,8,2724,True,True,True,True,Collection of publicly available IPTV channels from all over the world
clash-verge-rev,clash-verge-rev,TypeScript,115019,8403,300,891,False,True,True,True,"A modern GUI client based on Tauri, designed to run in Windows, macOS and Linux for tailored proxy experience"
firecrawl,firecrawl,TypeScript,113527,7207,301,745,False,True,True,True,"🔥 The API to search, scrape, and interact with the web for AI"
ui,shadcn-ui,TypeScript,113311,8693,1853,1212,False,True,True,True,"A set of beautifully-designed, accessible components and a code distribution platform. Works with your favorite frameworks. Open Source. Open Code."
rustdesk,rustdesk,Rust,113248,16999,116,2040,True,True,True,True,"An open-source remote desktop application designed for self-hosting, as an alternative to TeamViewer."
d3,d3,Shell,112815,22752,29,5694,False,False,True,True,"Bring data to life with SVG, Canvas and HTML. :bar_chart::chart_with_upwards_trend::tada:"
rust,rust-lang,Rust,112459,14862,12334,5797,True,True,True,True,Empowering everyone to build reliable and efficient software.
three.js,mrdoob,JavaScript,112267,36353,516,5882,True,True,True,True,JavaScript 3D Library.
Awesome-Hacking,Hack-with-Github,,111360,10237,28,3683,False,True,True,True,"A collection of various awesome lists for hackers, pentesters and security researchers"
ComfyUI,Comfy-Org,Python,110850,12925,4010,1200,False,True,True,True,"The most powerful and modular diffusion model GUI, api and backend with a graph/nodes interface."
godot,godotengine,C++,110155,25164,18127,4499,True,True,True,True,Godot Engine – Multi-platform 2D and 3D game engine
generative-ai-for-beginners,microsoft,Jupyter Notebook,110060,59055,6,1046,True,True,True,True,"21 Lessons, Get Started Building with Generative AI "
axios,axios,JavaScript,109039,11660,169,4273,True,True,True,True,Promise based HTTP client for the browser and node.js
TypeScript,microsoft,TypeScript,108707,13374,5032,4335,True,True,True,True,TypeScript is a superset of JavaScript that compiles to clean JavaScript output.
awesome-llm-apps,Shubhamsaboo,Python,108253,15952,5,732,False,False,True,True,"100+ AI Agent & RAG apps you can actually run — clone, customize, ship."
GitHub-Chinese-Top-Charts,GrowingGit,Java,107766,13538,190,2430,False,False,False,True,:cn: GitHub中文排行榜，各语言分设「软件 | 资料」榜单，精准定位中文好项目。各取所需，高效学习。
llama.cpp,ggml-org,C++,107655,17634,1557,1147,False,True,True,True,LLM inference in C/C++
deno,denoland,Rust,106574,6039,2313,2908,True,True,True,True,A modern runtime for JavaScript and TypeScript.
frp,fatedier,Go,106199,15033,39,3783,False,False,True,True,A fast reverse proxy to help you expose a local server behind a NAT or firewall to the internet.
tauri,tauri-apps,Rust,106064,3564,1396,2483,True,True,True,True,"Build smaller, faster, and more secure desktop and mobile applications with a web frontend."
papers-we-love,papers-we-love,Shell,105740,6331,2,4519,True,True,True,True,Papers from the computer science community to read and discuss.
nodebestpractices,goldbergyoni,Dockerfile,105237,10731,100,3149,False,False,True,True,:white_check_mark:  The Node.js best practices list (July 2024)
v2rayN,2dust,C#,104128,14799,9,2467,False,False,True,True,"A GUI client for Windows, Linux and macOS, support Xray and sing-box and others"
create-react-app,facebook,JavaScript,103464,27075,2378,3574,True,True,True,True,Set up a modern web app by running one command.
andrej-karpathy-skills,forrestchang,,103389,10176,78,94,False,False,True,True,"A single CLAUDE.md file to improve Claude Code behavior, derived from Andrej Karpathy's observations on LLM coding pitfalls."
DeepSeek-V3,deepseek-ai,Python,103335,16723,170,490,False,False,True,True,
awesome-mac,jaywcjlove,Swift,103041,7685,266,3574,True,True,True,True, This project is dedicated to collecting high-quality macOS software and organizing them systematically by different categories for easy search and use.
terminal,microsoft,C++,102978,9256,1729,3184,True,True,True,True,"The new Windows Terminal and the original Windows console host, all in the same place!"
gemini-cli,google-gemini,TypeScript,102843,13417,2782,378,False,True,True,True,An open-source AI agent that brings the power of Gemini directly into your terminal.
supabase,supabase,TypeScript,101675,12243,974,2393,True,True,True,True,"The Postgres development platform. Supabase gives you a dedicated Postgres database to build your web, mobile, and AI applications."
angular,angular,TypeScript,100053,27219,1125,4242,True,True,True,True,Deliver web apps with confidence 🚀
HowToCook,Anduin2017,Dockerfile,99725,10932,472,2252,True,True,True,True,程序员在家做饭方法指南。Programmer's guide about how to cook at home (Simplified Chinese only).
pytorch,pytorch,Python,99565,27630,18517,3548,True,True,True,True,Tensors and Dynamic neural networks in Python with strong GPU acceleration
immich,immich-app,TypeScript,99392,5521,693,1547,True,True,True,True,High performance self-hosted photo and video management solution.
neovim,neovim,Vim Script,99243,6860,1931,4472,False,True,True,True,Vim-fork focused on extensibility and usability
every-programmer-should-know,mtdvio,,98855,8730,24,3171,False,True,False,True,A collection of (mostly) technical things every software developer should know about
whisper,openai,Python,98698,12128,122,1322,False,False,True,True,Robust Speech Recognition via Large-Scale Weak Supervision
material-ui,mui,JavaScript,98258,32655,1536,4273,True,True,True,True,Material UI: Comprehensive React component library that implements Google's Material Design. Free forever.
ant-design,ant-design,TypeScript,97901,54594,1367,4024,True,True,True,True,An enterprise-class UI design language and React UI library
fastapi,fastapi,Python,97797,9177,180,2700,False,True,True,True,"FastAPI framework, high performance, easy to learn, fast to code, ready for production"
thefuck,nvbn,Python,96771,3932,423,4040,False,True,True,True,Magnificent app which corrects your previous console command.
Web-Dev-For-Beginners,microsoft,JavaScript,95696,15433,48,1998,True,True,True,True,"24 Lessons, 12 Weeks, Get Started as a Web Developer"
tailwindcss,tailwindlabs,TypeScript,94813,5214,93,3128,False,True,True,True,A utility-first CSS framework for rapid UI development.
clean-code-javascript,ryanmcdermott,JavaScript,94296,12466,123,3443,False,False,False,True,Clean Code concepts adapted for JavaScript
puppeteer,puppeteer,TypeScript,94224,9410,303,3278,False,True,True,True,JavaScript API for Chrome and Firefox
java-design-patterns,iluwatar,Java,93961,27372,226,4282,False,True,True,True,Design patterns implemented in Java
app-ideas,florinpop17,,93572,10416,605,2621,True,True,True,True,A Collection of application ideas which can be used to improve your coding skills.
nvm,nvm-sh,Shell,93163,10139,378,5859,True,True,True,True,Node Version Manager - POSIX-compliant bash script to manage multiple active node.js versions
Deep-Live-Cam,hacksider,Python,92516,13435,114,949,False,True,True,True,real time face swap and one-click video deepfake with only a single image
DeepSeek-R1,deepseek-ai,,92013,11733,42,465,False,False,True,True,
spec-kit,github,Python,92011,7965,653,252,True,True,True,True,💫 Toolkit to help you get started with Spec-Driven Development
LLMs-from-scratch,rasbt,Jupyter Notebook,91767,14144,5,1012,False,False,True,True,"Implement a ChatGPT-like LLM in PyTorch from scratch, step by step"
browser-use,browser-use,Python,91460,10412,239,546,False,True,True,True,🌐 Make websites accessible for AI agents. Automate tasks online with ease.
vue-element-admin,PanJiaChen,Vue,90272,30509,1375,3301,False,False,False,True,:tada: A magical vue admin                                                                https://panjiachen.github.io/vue-element-admin
weekly,ruanyf,,89917,4034,7716,2756,False,False,False,True,科技爱好者周刊，每周五发布
storybook,storybookjs,TypeScript,89834,10041,2268,3696,True,True,True,True,"Storybook is the industry standard workshop for building, documenting, and testing UI components in isolation"
agency-agents,msitarzewski,Shell,89726,14570,118,199,False,True,True,True,"A complete AI agency at your fingertips - From frontend wizards to Reddit community ninjas, from whimsy injectors to reality checkers. Each agent is a specialized expert with personality, processes, and proven deliverables."
bun,oven-sh,Zig,89477,4369,6670,1843,True,True,True,True,"Incredibly fast JavaScript runtime, bundler, test runner, and package manager – all in one"
bitcoin,bitcoin,C++,88969,38940,698,5611,False,True,True,True,Bitcoin Core integration/staging tree
gin,gin-gonic,Go,88416,8590,681,4336,True,True,True,True,"Gin is a high-performance HTTP web framework written in Go. It provides a Martini-like API but with significantly better performance—up to 40 times faster—thanks to httprouter. Gin is designed for building REST APIs, web applications, and microservices."
NextChat,ChatGPTNextWeb,TypeScript,87857,59779,818,1147,True,False,True,True,✨ Light and Fast AI Assistant. Support: Web | iOS | MacOS | Android |  Linux | Windows
hugo,gohugoio,Go,87843,8253,241,4683,False,True,True,True,The world’s fastest framework for building websites.
mermaid,mermaid-js,TypeScript,87746,8924,1657,4198,True,True,True,True,Generation of diagrams like flowcharts or sequence diagrams from text in a similar manner as markdown
playwright,microsoft,TypeScript,87735,5607,515,2358,True,True,True,True,"Playwright is a framework for Web Testing and Automation. It allows testing Chromium, Firefox and WebKit with a single API. "
gstack,garrytan,TypeScript,87465,12844,493,50,False,True,True,True,"Use Garry Tan's exact Claude Code setup: 23 opinionated tools that serve as CEO, Designer, Eng Manager, Release Manager, Doc Engineer, and QA"
django,django,Python,87366,33867,429,5116,True,True,True,True,The Web framework for perfectionists with deadlines.
opencv,opencv,C++,87304,56549,2732,5033,False,True,True,True,Open Source Computer Vision Library
core,home-assistant,Python,86878,37396,3714,4608,True,True,True,True,:house_with_garden: Open source home automation that puts local control and privacy first.
svelte,sveltejs,JavaScript,86447,4899,996,3448,True,True,True,True,web development for the rest of us
manim,3b1b,Python,86432,7249,488,4057,False,False,True,True,Animation engine for explanatory math videos
uptime-kuma,louislam,JavaScript,86078,7754,728,1763,True,True,True,True,A fancy self-hosted monitoring tool
awesome-mcp-servers,punkpeye,,86039,9688,869,517,False,True,True,True,A collection of MCP servers.
ML-For-Beginners,microsoft,Jupyter Notebook,85570,20706,4,1885,True,True,True,True,"12 weeks, 26 lessons, 52 quizzes, classic Machine Learning for all"
awesome-for-beginners,MunGell,,85136,7847,99,3841,False,True,True,True,A list of awesome beginners-friendly projects.
servers,modelcontextprotocol,TypeScript,84851,10548,420,528,True,True,True,True,Model Context Protocol Servers
uv,astral-sh,Rust,84212,3015,2709,941,True,True,True,True,"An extremely fast Python package and project manager, written in Rust."
laravel,laravel,Blade,84118,24693,31,5441,False,False,True,True,"Laravel is a web application framework with expressive, elegant syntax. We’ve already laid the foundation for your next big idea — freeing you to create without sweating the small things."
mall,macrozheng,Java,83524,29692,15,2949,False,False,False,True,mall项目是一套电商系统，包括前台商城系统及后台管理系统，基于Spring Boot+MyBatis实现，采用Docker容器化部署。 前台商城系统包含首页门户、商品推荐、商品搜索、商品展示、购物车、订单流程、会员中心、客户服务、帮助中心等模块。 后台管理系统包含商品管理、订单管理、会员管理、促销管理、运营管理、内容管理、统计报表、财务管理、权限管理、设置等模块。
syncthing,syncthing,Go,83351,5138,384,4538,False,True,True,True,Open Source Continuous File Synchronization
realworld,realworld-apps,TypeScript,83336,7602,35,3716,False,True,True,True,"""The mother of all demo apps"" — Exemplary fullstack Medium.com clone powered by React, Angular, Node, Django, and many more"
sherlock,sherlock-project,Python,82758,9651,277,2684,True,False,True,True,Hunt down social media accounts by username across social networks
animate.css,animate-css,CSS,82530,16016,80,5314,True,True,True,True,🍿 A cross-browser library of CSS animations. As easy to use as an easy thing.
awesome-interview-questions,DopplerHQ,,82265,9480,48,3806,False,True,True,True,:octocat: A curated awesome list of lists of interview questions. Feel free to contribute! :mortar_board: 
system-design-101,ByteByteGoHq,,82239,9087,59,955,False,True,True,True,Explain complex systems using visuals and simple terms. Help you prepare for system design interviews.
devops-exercises,bregman-arie,Python,82194,19314,45,2401,False,True,True,True,"Linux, Jenkins, AWS, SRE, Prometheus, Docker, Python, Ansible, Git, Kubernetes, Terraform, OpenStack, SQL, NoSQL, Azure, GCP, DNS, Elastic, Network, Virtualization. DevOps Interview Questions"
FiraCode,tonsky,Clojure,81526,3184,426,4188,False,False,True,True,Free monospaced font with programming ligatures
zed,zed-industries,Rust,80937,8155,2786,1896,True,True,True,True,"Code at the speed of thought – Zed is a high-performance, multiplayer code editor from the creators of Atom and Tree-sitter."
cs-video-courses,Developer-Y,,80554,11120,3,3478,False,True,True,True,List of Computer Science courses with video lectures.
spring-boot,spring-projects,Java,80542,41901,471,4941,True,True,True,True,"Spring Boot helps you to create Spring-powered, production-grade applications and services with absolute minimum fuss."
