repo_name,organization,language,stars,forks,open_issues,age_days,has_coc,has_contributing,has_workflows,has_readme,description
Chart.js,chartjs,JavaScript,67352,11966,547,4775,False,False,True,True,Simple HTML5 Charts using the <canvas> tag
AFFiNE,toeverything,TypeScript,67241,4746,578,1352,True,True,True,True,"There can be more than Notion and Miro. AFFiNE(pronounced [ə‘fain]) is a next-gen knowledge base that brings planning, sorting and creating all together. Privacy first, open-source, customizable and ready to use. "
ghidra,NationalSecurityAgency,Java,67157,7390,1876,2601,False,True,True,True,Ghidra is a software reverse engineering (SRE) framework
anime,juliangarnier,JavaScript,67087,4490,96,3683,False,True,True,True,JavaScript animation engine
MetaGPT,FoundationAgents,Python,67028,8495,115,1018,False,False,True,True,"🌟 The Multi-Agent Framework: First AI Software Company, Towards Natural Language Programming"
33-js-concepts,leonardomso,JavaScript,66314,9188,0,2778,True,True,True,True,📜 33 JavaScript concepts every developer should know.
annotated_deep_learning_paper_implementations,labmlai,Python,66289,6674,29,2058,False,False,True,True,"🧑‍🏫 60+ Implementations/tutorials of deep learning papers with side-by-side notes 📝; including transformers (original, xl, switch, feedback, vit, ...), optimizers (adam, adabelief, sophia, ...), gans(cyclegan, stylegan2, ...), 🎮 reinforcement learning (ppo, dqn), capsnet, distillation, ... 🧠"
echarts,apache,TypeScript,66139,19818,1717,4759,True,True,True,True,"Apache ECharts is a powerful, interactive charting and data visualization library for browser"
gpt4free,xtekky,Python,66000,13618,5,1111,True,True,True,True,The official gpt4free repository | various collection of powerful language models | opus 4.6 gpt 5.3 kimi 2.5 deepseek v3.2 gemini 3
OpenBB,OpenBB-finance,Python,65843,6546,77,1940,True,False,True,True,"Financial data platform for analysts, quants and AI agents."
webpack,webpack,JavaScript,65838,9377,205,5147,True,True,True,True,"A bundler for javascript and friends. Packs many modules into a few bundled assets. Code Splitting allows for loading parts of the application on demand. Through ""loaders"", modules can be CommonJs, AMD, ES6 modules, CSS, Images, JSON, Coffeescript, LESS, ... and your custom stuff."
scikit-learn,scikit-learn,Python,65812,26940,2049,5718,True,True,True,True,scikit-learn: machine learning in Python
Apollo-11,chrislgarry,Assembly,65804,7537,127,4393,False,True,True,True,Original Apollo 11 Guidance Computer (AGC) source code for the command and lunar modules.
awesome-nodejs,sindresorhus,,65426,6207,27,4294,True,True,True,True,":zap: Delightful Node.js packages and resources [BECAUSE OF TOO MUCH SPAM AND LOW-QUALITY SUBMISSIONS, SUBMISSIONS ARE PAUSED UNTIL SEPTEMBER]"
Java,TheAlgorithms,Java,65355,21059,49,3558,True,True,True,True,All Algorithms implemented in Java
javascript-questions,lydiahallie,,65305,9235,50,2497,False,False,False,True,"A long list of (advanced) JavaScript questions, and their explanations :sparkles:  "
design-resources-for-developers,bradtraversy,,65253,12004,2,2168,False,True,False,True,"Curated list of design and UI resources from stock photos, web templates, CSS frameworks, UI libraries, tools and much more"
nocode,kelseyhightower,Dockerfile,65177,4826,4705,2988,False,True,False,True,The best way to write secure and reliable applications. Write nothing; deploy nowhere.
interviews,kdn251,Java,64916,12912,118,3345,False,False,False,True,Everything you need to know to get the job.
localstack,localstack,Python,64862,4689,0,3457,True,True,True,True,💻 A fully functional local AWS cloud stack. Develop and test your cloud & Serverless apps offline
docusaurus,facebook,TypeScript,64556,9827,372,3219,True,True,True,True,Easy to maintain open source documentation websites.
ui-ux-pro-max-skill,nextlevelbuilder,Python,64454,6492,90,134,False,False,True,True,An AI SKILL that provide design intelligence for building professional UI/UX multiple platforms
keras,keras-team,Python,63983,19737,268,4035,False,True,True,True,Deep Learning for humans
crawl4ai,unclecode,Python,63954,6554,68,704,True,True,True,True,"🚀🤖 Crawl4AI: Open-source LLM Friendly Web Crawler & Scraper. Don't be shy, join here: https://discord.gg/jP8KfhDhyN"
prometheus,prometheus,Go,63577,10333,755,4888,True,True,True,True,The Prometheus monitoring system and time series database.
pathway,pathwaycom,Python,63542,1631,35,1233,True,True,True,True,"Python ETL framework for stream processing, real-time analytics, LLM pipelines, and RAG."
alacritty,alacritty,Rust,63415,3414,337,3708,False,True,True,True,"A cross-platform, OpenGL terminal emulator."
open-interpreter,openinterpreter,Python,63112,5480,313,1004,False,True,True,True,A natural language interface for computers
socket.io,socketio,TypeScript,63023,10151,207,5877,False,True,True,True,Realtime application framework (Node.JS server)
resume.github.com,resume,JavaScript,62824,1367,71,5545,False,False,False,True,Resumes generated using the GitHub informations
uBlock,gorhill,JavaScript,62739,4009,17,4030,False,True,True,True,uBlock Origin - An efficient blocker for Chromium and Firefox. Fast and lean.
nocodb,nocodb,TypeScript,62716,4719,651,3088,True,True,True,True,🔥 🔥 🔥 A Free & Self-hostable Airtable Alternative
traefik,traefik,Go,62681,5909,774,3865,True,True,True,True,The Cloud Native Application Proxy
nerd-fonts,ryanoasis,CSS,62513,3888,70,4148,True,True,True,True,"Iconic font aggregator, collection, & patcher. 3,600+ icons, 50+ patched fonts: Hack, Source Code Pro, more. Glyph collections: Font Awesome, Material Design Icons, Octicons, & more"
rustlings,rust-lang,Rust,62492,11174,79,3864,False,True,True,True,:crab: Small exercises to get you used to reading and writing Rust code!
ripgrep,BurntSushi,Rust,62363,2483,170,3686,False,False,True,True,ripgrep recursively searches directories for a regex pattern while respecting your gitignore
ladybird,LadybirdBrowser,C++,62347,2940,680,683,True,True,True,True,Truly independent web browser
tldr,tldr-pages,Markdown,62108,5192,267,4509,False,True,True,True,Collaborative cheatsheets for console commands 📚.
sway,FuelLabs,Rust,61795,5423,890,1910,False,False,True,True,🌴 Empowering everyone to build reliable and efficient smart contracts.
redux,reduxjs,TypeScript,61445,15098,41,3972,True,True,True,True,A JS library for predictable global state management
unsloth,unslothai,Python,61441,5318,1151,866,True,True,True,True,"Unsloth Studio is a web UI for training and running open models like Gemma 4, Qwen3.5, DeepSeek, gpt-oss locally."
lodash,lodash,JavaScript,61323,7130,142,5120,False,True,True,True,"A modern JavaScript utility library delivering modularity, performance, & extras."
scrapy,scrapy,Python,61307,11464,641,5895,True,True,True,True,"Scrapy, a fast high-level web crawling & scraping framework for Python."
deer-flow,bytedance,Python,61238,7863,601,342,True,True,True,True,"An open-source long-horizon SuperAgent harness that researches, codes, and creates. With the help of sandboxes, memories, tools, skill, subagents and message gateway, it handles different levels of tasks that could take minutes to hours."
leetcode-master,youngyangyang04,Shell,61089,12314,244,2312,False,False,False,True,《代码随想录》LeetCode 刷题攻略：200道经典题目刷题顺序，共60w字的详细图解，视频难点剖析，50余张思维导图，支持C++，Java，Python，Go，JavaScript等多语言版本，从此算法学习不再迷茫！🔥🔥 来看看，你会发现相见恨晚！🚀 
30-Days-Of-Python,Asabeneh,Python,61043,11616,108,2337,False,False,True,True,The 30 Days of Python programming challenge is a step-by-step guide to learn the Python programming language in 30 days. This challenge may take more than 100 days. Follow your own pace. These videos may help too: https://www.youtube.com/channel/UC7PNRuno1rzYPb1xLa4yktw
atom,atom,JavaScript,60870,17257,994,5197,True,True,False,True,:atom: The hackable text editor
architect-awesome,xingshaocheng,,60824,17744,63,2929,False,False,False,True,后端架构师技术图谱
Front-end-Developer-Interview-Questions,h5bp,Nunjucks,60816,11051,52,5177,True,True,True,True,"A list of helpful front-end related questions you can use to interview potential candidates, test yourself or completely ignore."
minio,minio,Go,60696,7378,79,4107,True,True,True,True,"MinIO is a high-performance, S3 compatible object store, open sourced under GNU AGPLv3 license."
openpilot,commaai,Python,60610,10812,243,3428,False,True,True,True,"openpilot is an operating system for robotics. Currently, it upgrades the driver assistance system on 300+ supported cars."
drawio-desktop,jgraph,JavaScript,60407,5649,70,3245,True,False,True,True,Official electron build of draw.io
git,git,C,60288,27803,364,6473,True,True,True,True,Git Source Code Mirror - This is a publish-only repository but pull requests can be turned into patches to the mailing list via GitGitGadget (https://gitgitgadget.github.io/). Please follow Documentation/SubmittingPatches procedure for any of your improvements.
cline,cline,TypeScript,60242,6153,678,646,True,True,True,True,"Autonomous coding agent right in your IDE, capable of creating/editing files, executing commands, using the browser, and more with your permission every step of the way."
markdown-here,adam-p,JavaScript,60184,11088,319,5084,False,True,False,True,"Google Chrome, Firefox, and Thunderbird extension that lets you write email in Markdown and render it before sending."
llm-app,pathwaycom,Jupyter Notebook,60042,1430,10,999,True,True,True,True,"Ready-to-run cloud templates for RAG, AI pipelines, and enterprise search with live data. 🐳Docker-friendly.⚡Always in sync with Sharepoint, Google Drive, S3, Kafka, PostgreSQL, real-time data APIs, and more."
nuxt,nuxt,TypeScript,60013,5586,947,3456,True,True,True,True,The Full-Stack Vue Framework.
jquery,jquery,JavaScript,59845,20475,95,6219,True,True,True,True,jQuery JavaScript Library
spring-framework,spring-projects,Java,59844,38865,367,5606,True,True,True,True,Spring Framework
Magisk,topjohnwu,Kotlin,59831,17209,48,3504,False,False,True,True,The Magic Mask for Android
MinerU,opendatalab,Python,59705,4987,161,774,False,False,True,True,Transforms complex documents like PDFs into LLM-ready markdown/JSON for your Agentic workflows.
Real-Time-Voice-Cloning,CorentinJ,Python,59620,9404,170,2514,False,False,True,True,Clone a voice in 5 seconds to generate arbitrary speech in real-time
awesome-flutter,Solido,Dart,59620,6868,29,3263,False,True,True,True,"An awesome list that curates the best Flutter libraries, tools, tutorials, articles and more."
llama,meta-llama,Python,59327,9831,521,1154,True,True,True,True,Inference code for Llama models
shadowsocks-windows,shadowsocks,C#,59298,16261,199,4837,False,True,False,True,A C# port of shadowsocks
awesome-chatgpt-prompts-zh,PlexPt,,59035,13551,44,1219,False,False,False,True,ChatGPT 中文调教指南。各种场景使用指南。学习怎么让它听你的话。
FFmpeg,FFmpeg,C,58956,13713,3,5478,False,True,False,True,Mirror of https://git.ffmpeg.org/ffmpeg.git
memos,usememos,Go,58842,4267,25,1587,False,False,True,True,"Open-source, self-hosted note-taking tool built for quick capture. Markdown-native, lightweight, and fully yours."
angular.js,angular,JavaScript,58748,27177,461,5942,True,True,False,True,AngularJS - HTML enhanced for web apps!
mkcert,FiloSottile,Go,58548,3091,166,2849,True,True,True,True,A simple zero-config tool to make locally trusted development certificates with any names you'd like.
astro,withastro,TypeScript,58438,3352,319,1855,True,True,True,True,The web framework for content-driven websites. ⭐️ Star to support our work!
vaultwarden,dani-garcia,Rust,58373,2697,53,2977,False,False,True,True,"Unofficial Bitwarden compatible server written in Rust, formerly known as bitwarden_rs"
rails,rails,Ruby,58341,22173,1570,6577,True,True,True,True,Ruby on Rails
anything-llm,Mintplex-Labs,JavaScript,58274,6299,326,1045,False,True,True,True,The all-in-one AI productivity accelerator. On device and privacy first with no annoying setup or configuration.
bat,sharkdp,Rust,58141,1515,347,2914,False,True,True,True,A cat(1) clone with wings.
hackingtool,Z4nzu,Python,58097,6475,56,2193,False,False,True,True,ALL IN ONE Hacking Tool For Hackers
docling,docling-project,Python,57751,3956,873,643,True,True,True,True,Get your documents ready for gen AI
zustand,pmndrs,TypeScript,57731,2026,6,2561,False,True,True,True,🐻 Bear necessities for state management in React
pocketbase,pocketbase,Go,57598,3282,24,1378,False,True,True,True,Open Source realtime backend in 1 file
html5-boilerplate,h5bp,JavaScript,57430,12308,25,5923,True,True,True,True,"A professional front-end template for building fast, robust, and adaptable web apps or sites."
DeepLearning-500-questions,scutan90,JavaScript,57312,15953,121,2847,False,False,False,True,深度学习500问，以问答形式对常用的概率知识、线性代数、机器学习、深度学习、计算机视觉等热点问题进行阐述，以帮助自己及有需要的读者。 全书分为18个章节，50余万字。由于水平有限，书中不妥之处恳请广大读者批评指正。   未完待续............ 如有意合作，联系scutjy2015@163.com                     版权所有，违权必究       Tan 2018.06
private-gpt,zylon-ai,Python,57197,7604,294,1077,False,False,True,True,"Interact with your documents using the power of GPT, 100% privately, no data leaks"
yolov5,ultralytics,Python,57195,17460,52,2157,True,True,True,True,YOLOv5 🚀 in PyTorch > ONNX > CoreML > TFLite
fuel-core,FuelLabs,Rust,57179,2863,200,2055,False,True,True,True,Rust full node implementation of the Fuel v2 protocol.
meilisearch,meilisearch,Rust,57115,2502,292,2912,True,True,True,True,A lightning-fast search engine API bringing AI-powered hybrid search to your sites and applications.
autogen,microsoft,Python,57059,8589,766,969,True,True,True,True,A programming framework for agentic AI
you-get,soimort,Python,56816,9763,383,4984,False,True,True,True,:arrow_double_down: Dumb downloader that scrapes the web
awesome-rust,rust-unofficial,Rust,56730,3293,11,4288,False,True,True,True,A curated list of Rust code and resources.
GPT-SoVITS,RVC-Boss,Python,56644,6187,874,820,False,False,True,True,1 min voice data can also be used to train a good TTS model! (few shot voice cloning)
nanoGPT,karpathy,Python,56631,9681,342,1203,False,False,False,True,"The simplest, fastest repository for training/finetuning medium-sized GPTs."
rclone,rclone,Go,56620,5028,1161,4411,True,True,True,True,"""rsync for cloud storage"" - Google Drive, S3, Dropbox, Backblaze B2, One Drive, Swift, Hubic, Wasabi, Google Cloud Storage, Azure Blob, Azure Files, Yandex Files"
ai-agents-for-beginners,microsoft,Jupyter Notebook,56620,19595,4,501,True,False,True,True,12 Lessons to Get Started Building AI Agents
pi-hole,pi-hole,Shell,56545,3011,49,4327,True,True,True,True,A black hole for Internet advertisements
react-router,remix-run,TypeScript,56341,10846,166,4350,True,True,True,True,Declarative routing for React
starship,starship,Rust,56309,2469,1000,2569,True,True,True,True,"☄🌌️  The minimal, blazing-fast, and infinitely customizable prompt for any shell!"
face_recognition,ageitgey,Python,56293,13717,832,3328,False,True,True,True,The world's simplest facial recognition api for Python and the command line
github-cheat-sheet,tiimgreen,,56235,5411,44,4384,False,True,False,True,A list of cool features of Git and GitHub.
rich,Textualize,Python,56069,2099,303,2346,True,True,True,True,Rich is a Python library for rich text and beautiful formatting in the terminal.
gatsby,gatsbyjs,JavaScript,55961,10215,362,3980,True,True,True,True,"React-based framework with performance, scalability, and security built in."
ultralytics,ultralytics,Python,55861,10756,297,1310,True,True,True,True,Ultralytics YOLO 🚀
awesome-android-ui,wasabeef,,55831,10262,40,4129,True,False,False,True,A curated list of awesome Android UI/UX libraries
leetcode,azl397985856,JavaScript,55790,9429,10,2936,False,True,False,True,LeetCode Solutions: A Record of My Problem Solving Journey.( leetcode题解，记录自己的leetcode解题之路。)
project-layout,golang-standards,Makefile,55760,5439,98,3138,False,False,True,True,Standard Go Project Layout
OpenManus,FoundationAgents,Python,55736,9725,543,403,True,False,True,True,"No fortress, purely open ground.  OpenManus is Coming."
appwrite,appwrite,TypeScript,55698,5216,820,2562,True,True,True,True,"Appwrite® - complete cloud infrastructure for your web, mobile and AI apps. Including Auth, Databases, Storage, Functions, Messaging, Hosting, Realtime and more"
MoneyPrinterTurbo,harry0703,Python,55639,7954,0,764,False,False,True,True,利用AI大模型，一键生成高清短视频 Generate short videos with one click using AI LLM.
gpt-engineer,AntonOsika,Python,55215,7313,69,1080,True,True,True,True,CLI platform to experiment with codegen. Precursor to: https://lovable.dev
marktext,marktext,JavaScript,55189,4102,1420,3074,True,True,True,True,"📝A simple and elegant markdown editor, available for Linux, macOS and Windows."
faceswap,deepfakes,Python,55152,13410,6,3037,True,False,True,True,Deepfakes Software For All
gitea,go-gitea,Go,54881,6569,2827,3451,True,True,True,True,"Git with a cup of tea! Painless self-hosted all-in-one software development service, including Git hosting, code review, team collaboration, package registry and CI/CD"
MiroFish,666ghj,Python,54764,8252,234,139,False,False,True,True,"A Simple and Universal Swarm Intelligence Engine, Predicting Anything. 简洁通用的群体智能引擎，预测万物"
ChatGPT,lencx,Rust,54350,6179,927,1223,False,False,True,True,"🔮 ChatGPT Desktop Application (Mac, Windows and Linux)"
joplin,laurent22,TypeScript,54344,6058,585,3374,False,True,True,True,"Joplin - the privacy-focused note taking app with sync capabilities for Windows, macOS, Linux, Android and iOS."
element,ElemeFE,Vue,54164,14504,2968,3509,False,False,True,True,A Vue.js 2.0 UI Toolkit for Web
maybe,maybe-finance,Ruby,54074,5532,0,833,False,True,True,True,The personal finance app for everyone
Free-Certifications,cloudcommunity,,54052,3555,73,2082,False,False,False,True,A curated list of free courses with certifications. Also available at https://free-certifications.com/
v2rayNG,2dust,Kotlin,53958,7188,15,2526,False,False,True,True,"A V2Ray client for Android, support Xray core and v2fly core"
segment-anything,facebookresearch,Jupyter Notebook,53926,6319,592,1117,True,True,True,True,"The repository provides code for running inference with the SegmentAnything Model (SAM), links for downloading the trained model checkpoints, and example notebooks that show how to use the model."
requests,psf,Python,53894,9837,232,5538,True,True,True,True,"A simple, yet elegant, HTTP library."
claude-mem,thedotmack,TypeScript,53770,4293,247,225,False,False,True,True,"A Claude Code plugin that automatically captures everything Claude does during your coding sessions, compresses it with AI (using Claude's agent-sdk), and injects relevant context back into future sessions."
dive,wagoodman,Go,53764,1983,202,2892,False,False,True,True,A tool for exploring each layer in a docker image
powerlevel10k,romkatv,Shell,53741,2402,146,2605,False,False,False,True,A Zsh theme
n8n-workflows,Zie619,Python,53736,7001,23,334,False,False,True,True,all of the workflows of n8n i could find (also from the site itself)
normalize.css,necolas,CSS,53609,10439,74,5458,False,True,False,True,A modern alternative to CSS resets
awesome-claude-skills,ComposioHQ,Python,53609,5733,511,178,False,True,True,True,"A curated list of awesome Claude Skills, resources, and tools for customizing Claude AI workflows"
trackerslist,ngosang,,53482,6619,9,3641,False,False,True,True,Updated list of public BitTorrent trackers
first-contributions,firstcontributions,,53462,101084,199,3492,True,True,True,True,🚀✨ Help beginners to contribute to open source projects
core,vuejs,TypeScript,53425,9089,982,2862,False,True,True,True,"🖖 Vue.js is a progressive, incrementally-adoptable JavaScript framework for building UI on the web."
termux-app,termux,Java,53333,6363,519,3825,False,False,True,True,Termux - a terminal emulator application for Android OS extendible by variety of packages.
ai-hedge-fund,virattt,Python,53145,9220,101,500,False,False,True,True,An AI Hedge Fund Team
ImHex,WerWolv,C++,53144,2358,343,1980,True,True,True,True,"🔍 A Hex Editor for Reverse Engineers, Programmers and people who value their retinas when working at 3 AM."
paperclip,paperclipai,TypeScript,53140,8921,2231,42,False,True,True,True,Open-source orchestration for zero-human companies
pdf.js,mozilla,JavaScript,53121,10603,451,5466,True,True,True,True,PDF Reader in JavaScript
material-design-icons,google,,53103,9723,402,4205,True,True,True,True,Material Design icons by Google (Material Symbols)
coolify,coollabsio,PHP,52991,4048,723,1904,True,True,True,True,"An open-source, self-hostable PaaS alternative to Vercel, Heroku & Netlify that lets you easily deploy static sites, databases, full-stack applications and 280+ one-click services on your own servers."
mem0,mem0ai,Python,52965,5940,218,1028,False,True,True,True,Universal memory layer for AI Agents
learn-claude-code,shareAI-lab,TypeScript,52919,8672,79,288,False,False,True,True,"Bash is all you need -  A nano claude code–like 「agent harness」, built from 0 to 1"
typst,typst,Rust,52695,1538,1169,2393,False,True,True,True,A markup-based typesetting system that is powerful and easy to learn.
kotlin,JetBrains,Kotlin,52579,6280,225,5173,True,True,True,True,The Kotlin Programming Language. 
context7,upstash,TypeScript,52576,2483,141,383,False,False,True,True,Context7 Platform -- Up-to-date code documentation for LLMs and AI code editors
Ghost,TryGhost,JavaScript,52490,11467,237,4727,True,True,True,True,"Independent technology for modern publishing, memberships, subscriptions and newsletters."
ionic-framework,ionic-team,TypeScript,52457,13391,635,4619,True,True,True,True,"A powerful cross-platform UI toolkit for building native-quality iOS, Android, and Progressive Web Apps with HTML, CSS, and JavaScript."
PowerShell,PowerShell,C#,52422,8264,1452,3743,True,True,True,True,PowerShell for every system!
Docker-OSX,sickcodes,Shell,52416,2903,417,2139,False,False,True,True,Run macOS VM in a Docker! Run near native OSX-KVM in Docker! X11 Forwarding! CI/CD for OS X Security Research! Docker mac Containers.
get-shit-done,gsd-build,JavaScript,52282,4376,30,120,False,True,True,True,"A light-weight and powerful meta-prompting, context engineering and spec-driven development system for Claude Code by TÂCHES."
Flowise,FlowiseAI,TypeScript,51872,24133,811,1109,True,True,True,True,"Build AI Agents, Visually"
awesome-ios,vsouza,Swift,51813,6960,23,4295,True,True,True,True,"A curated list of awesome iOS ecosystem, including Objective-C and Swift Projects "
winutil,ChrisTitusTech,PowerShell,51807,2813,17,1447,True,True,True,True,"Chris Titus Tech's Windows Utility - Install Programs, Tweaks, Fixes, and Updates"
prettier,prettier,JavaScript,51790,4701,1466,3422,True,True,True,True,Prettier is an opinionated code formatter.
nanochat,karpathy,Python,51783,6878,92,182,False,False,True,True,The best ChatGPT that $100 can buy.
etcd,etcd-io,Go,51623,10317,232,4664,True,True,True,True,Distributed reliable key-value store for the most critical data of a distributed system
TrendRadar,sansan0,Python,51605,23116,38,350,False,False,True,True,"⭐AI-driven public opinion & trend monitor with multi-platform aggregation, RSS, and smart alerts.🎯 告别信息过载，你的 AI 舆情监控助手与热点筛选工具！聚合多平台热点 +  RSS 订阅，支持关键词精准筛选。AI 智能筛选新闻 + AI 翻译 +  AI 分析简报直推手机，也支持接入 MCP 架构，赋能 AI 自然语言对话分析、情感洞察与趋势预测等。支持 Docker ，数据本地/云端自持。集成微信/飞书/钉钉/Telegram/邮件/ntfy/bark/slack 等渠道智能推送。"
grok-1,xai-org,Python,51521,8458,126,757,True,False,True,True,Grok open release
guava,google,Java,51506,11149,728,4337,True,True,True,True,Google core libraries for Java
jekyll,jekyll,Ruby,51394,10294,246,6384,True,True,True,True,:globe_with_meridians: Jekyll is a blog-aware static site generator in Ruby
Motrix,agalwood,JavaScript,51362,4849,776,2673,True,True,True,True,A full-featured download manager.
oh-my-openagent,code-yeongyu,TypeScript,51352,4122,520,132,False,True,True,True,omo; the best agent harness - previously oh-my-opencode
chinese-poetry,chinese-poetry,JavaScript,51258,10342,132,3511,False,False,True,True,"The most comprehensive database of Chinese poetry 🧶最全中华古诗词数据库,  唐宋两朝近一万四千古诗人,  接近5.5万首唐诗加26万宋诗.  两宋时期1564位词人，21050首词。"
DefinitelyTyped,DefinitelyTyped,TypeScript,51179,30536,686,4938,False,False,True,True,The repository for high quality TypeScript type definitions.
Semantic-UI,Semantic-Org,JavaScript,51115,4885,1073,4753,False,True,False,True,Semantic is a UI component framework based around useful principles from natural language.
go-ethereum,ethereum,Go,50980,21884,395,4491,False,True,True,True,Go implementation of the Ethereum protocol
windows,dockur,Shell,50903,4201,120,820,False,False,True,True,Windows inside a Docker container.
awesome-wechat-weapp,justjavac,,50760,9006,2,3490,False,False,False,True,微信小程序开发资源汇总 :100:
professional-programming,charlax,Python,50741,3966,1,3811,False,True,False,True,A collection of learning resources for curious software engineers
