repo_name,organization,language,stars,forks,open_issues,age_days,has_coc,has_contributing,has_workflows,has_readme,description
vue2-elm,bailicangdu,Vue,41158,12334,121,3369,False,False,True,True,Large single page application with 45 pages built on vue2 + vuex. 基于 vue2 + vuex 构建一个具有 45 个页面的大型单页面应用
cheat.sh,chubin,Python,41100,1902,143,3233,False,True,True,True,the only cheat sheet you need
curl,curl,C,41096,7102,53,5840,True,True,True,True,"A command line tool and library for transferring data with URL syntax, supporting DICT, FILE, FTP, FTPS, GOPHER, GOPHERS, HTTP, HTTPS, IMAP, IMAPS, LDAP, LDAPS, MQTT, MQTTS, POP3, POP3S, RTMP, RTMPS, RTSP, SCP, SFTP, SMB, SMBS, SMTP, SMTPS, TELNET, TFTP, WS and WSS. libcurl offers a myriad of powerful features"
jan,janhq,TypeScript,41067,2589,276,941,True,True,True,True,Jan is an open source alternative to ChatGPT that runs 100% offline on your computer.
styled-components,styled-components,TypeScript,41029,2525,335,3497,True,True,True,True,Visual primitives for the component age. Use the best bits of ES6 and CSS to style your apps without stress 💅
vuetify,vuetifyjs,TypeScript,40988,7153,636,3471,True,True,True,True,🐉 Vue Component Framework
tabler,tabler,HTML,40844,4350,108,2963,True,False,True,True,Tabler is free and open-source HTML Dashboard UI Kit built on Bootstrap
BMAD-METHOD,bmad-code-org,JavaScript,40672,4985,117,335,True,True,True,True,Breakthrough Method for Agile Ai Driven Development
desktop,zen-browser,JavaScript,40658,1374,530,717,True,False,True,True,Welcome to a calmer internet
WeChatMsg,LC044,,40649,4906,25,1159,False,False,False,True,
bubbletea,charmbracelet,Go,40595,1130,163,2255,False,True,True,True,A powerful little TUI framework 🏗
cal.com,calcom,TypeScript,40568,12194,1372,1818,True,True,True,True,Scheduling infrastructure for absolutely everyone.
data-engineer-handbook,DataExpert-io,Jupyter Notebook,40509,7712,26,846,False,False,False,True,This is a repo with links to everything you'd ever want to learn about data engineering
daisyui,saadeghi,Svelte,40489,1621,52,1932,False,True,True,True,"🌼 🌼 🌼 🌼 🌼  The most popular, free and open-source Tailwind CSS component library"
50projects50days,bradtraversy,CSS,40484,9774,41,1944,False,False,False,True,"50+ mini web projects using HTML, CSS & JS"
twenty,twentyhq,TypeScript,40468,5371,250,1199,True,True,True,True,"Building a modern alternative to Salesforce, powered by the community."
HEU_KMS_Activator,zbezj,,40377,3814,166,2457,False,False,False,True,
chakra-ui,chakra-ui,TypeScript,40349,3569,27,2401,True,True,True,True,Chakra UI is a component system for building SaaS products with speed ⚡️
zju-icicles,QSCTech,HTML,40345,9606,10,3546,False,False,True,True,浙江大学课程攻略共享计划
aria2,aria2,C++,40286,3825,1139,5586,False,False,True,True,"aria2 is a lightweight multi-protocol & multi-source, cross platform download utility operated in command-line. It supports HTTP/HTTPS, FTP, SFTP, BitTorrent and Metalink."
wrk,wg,C,40133,3029,203,5107,False,False,True,True,Modern HTTP benchmarking tool
remote-jobs,remoteintech,Nunjucks,40098,3924,16,3806,True,True,True,True,Source for remoteintech.company — a community-maintained directory of remote-friendly tech companies
oh-my-openagent,code-yeongyu,TypeScript,40026,3023,372,102,False,True,True,True,omo; the best agent harness - previously oh-my-opencode
vim,vim,Vim Script,40008,6005,1652,3861,False,True,True,True,The official Vim repository
php-src,php,C,39975,8015,1770,5386,False,True,True,True,The PHP Interpreter
bert,google-research,Python,39912,9708,881,2697,False,True,False,True,TensorFlow code and pre-trained models for BERT
puter,HeyPuter,JavaScript,39897,3532,189,742,False,True,True,True,"🌐 The Internet Computer! Free, Open-Source, and Self-Hostable."
tidb,pingcap,Go,39868,6137,5854,3843,True,True,True,True,"TiDB - the open-source, cloud-native, distributed SQL database designed for modern applications."
esbuild,evanw,Go,39805,1298,600,3560,False,False,True,True,An extremely fast bundler for the web
Mole,tw93,Shell,39777,1107,0,172,False,True,True,True,🐹 Deep clean and optimize your Mac.
Fabric,danielmiessler,Go,39765,3973,26,801,True,True,True,True,Fabric is an open-source framework for augmenting humans using AI. It provides a modular system for solving specific problems using a crowdsourced set of AI prompts that can be used anywhere.
trpc,trpc,TypeScript,39750,1506,190,2066,False,True,True,True,🧙‍♀️  Move Fast and Break Nothing. End-to-end typesafe APIs made easy. 
free,freefq,,39743,5666,554,2107,False,False,False,True,翻墙、免费翻墙、免费科学上网、免费节点、免费梯子、免费ss/v2ray/trojan节点、蓝灯、谷歌商店、翻墙梯子
gorm,go-gorm,Go,39640,4148,525,4523,True,False,True,True,"The fantastic ORM library for Golang, aims to be developer friendly"
video.js,videojs,JavaScript,39553,7519,635,5783,True,True,True,True,Video.js - open source HTML5 video player
remotion,remotion-dev,TypeScript,39496,2488,75,2090,True,True,True,True,🎥      Make videos programmatically with React
Deep-Learning-Papers-Reading-Roadmap,floodsung,Python,39483,7321,92,3438,False,False,False,True,Deep Learning papers reading roadmap for anyone who are eager to learn this amazing tech!
photoprism,photoprism,Go,39434,2225,436,2968,True,True,True,True,AI-Powered Photos App for the Decentralized Web 🌈💎✨
FastChat,lm-sys,Python,39424,4788,1005,1092,False,False,True,True,"An open platform for training, serving, and evaluating large language models. Release repo for Vicuna and Chatbot Arena."
fiber,gofiber,Go,39385,1962,44,2250,True,True,True,True,⚡️ Express inspired web framework written in Go
faiss,facebookresearch,C++,39381,4287,300,3322,True,True,True,True,A library for efficient similarity search and clustering of dense vectors.
appsmith,appsmithorg,TypeScript,39372,4495,4440,2084,True,True,True,True,"Platform to build admin panels, internal tools, and dashboards. Integrates with 25+ databases and any API."
Awesome-Design-Tools,goabstract,JavaScript,39277,2203,123,2587,False,False,True,True,The best design tools and plugins for everything 👉
phaser,phaserjs,JavaScript,39186,7128,116,4719,True,True,True,True,"Phaser is a fun, free and fast 2D game framework for making HTML5 games for desktop and mobile web browsers, supporting Canvas and WebGL rendering."
materialize,Dogfalo,JavaScript,39124,4660,791,4201,True,True,True,True,"Materialize, a CSS Framework based on Material Design"
shellcheck,koalaman,Haskell,39113,1903,1200,4866,False,False,True,True,"ShellCheck, a static analysis tool for shell scripts"
cobalt,imputnet,Svelte,39113,3275,224,1345,False,True,True,True,best way to save what you love
data-engineering-zoomcamp,DataTalksClub,Jupyter Notebook,39105,7862,5,1605,False,False,True,True,Data Engineering Zoomcamp is a free 9-week course on building production-ready data pipelines. The next cohort starts in January 2026. Join the course here 👇🏼
styleguide,google,HTML,39099,12999,174,3951,True,True,True,True,Style guides for Google-originated open-source projects
litellm,BerriAI,Python,39070,6409,1754,962,False,True,True,True,"Python SDK, Proxy Server (AI Gateway) to call 100+ LLM APIs in OpenAI (or native) format, with cost tracking, guardrails, loadbalancing and logging. [Bedrock, Azure, OpenAI, VertexAI, Cohere, Anthropic, Sagemaker, HuggingFace, VLLM, NVIDIA NIM]"
bark,suno-ai,Jupyter Notebook,39045,4686,266,1072,False,False,False,True,🔊 Text-Prompted Generative Audio Model
lossless-cut,mifi,TypeScript,39014,1892,241,3422,False,True,True,True,The swiss army knife of lossless video/audio editing
quivr,QuivrHQ,Python,39009,3733,23,1037,False,False,True,True,"Opiniated RAG for integrating GenAI in your apps 🧠   Focus on your product rather than the RAG. Easy integration in existing products with customisation!  Any LLM: GPT4, Groq, Llama. Any Vectorstore: PGVector, Faiss. Any Files. Anyway you want."
chatbox,chatboxai,TypeScript,38955,3940,1074,1104,False,False,True,True,Powerful AI Client
ChatTTS,2noise,Python,38933,4225,64,656,False,False,True,True,A generative speech model for daily dialogue.
leveldb,google,C++,38900,8168,371,4217,True,True,True,True,LevelDB is a fast key-value storage library written at Google that provides an ordered mapping from string keys to string values.
mindsdb,mindsdb,Python,38745,6141,185,2781,True,True,True,True,Query Engine for AI Analytics: Build self-reasoning agents across all your live data
nushell,nushell,Rust,38717,2079,1488,2500,True,True,True,True,A new type of shell
qlib,microsoft,Python,38716,6032,366,2038,True,False,True,True,"Qlib is an AI-oriented Quant investment platform that aims to use AI tech to empower Quant Research, from exploring ideas to implementing productions. Qlib supports diverse ML modeling paradigms, including supervised learning, market dynamics modeling, and RL, and is now equipped with https://github.com/microsoft/RD-Agent to automate R&D process."
agno,agno-agi,Python,38699,5116,647,1410,True,True,True,True,"Build, run, manage agentic software at scale."
BettaFish,666ghj,Python,38696,7235,49,621,True,True,True,True,微舆：人人可用的多Agent舆情分析助手，打破信息茧房，还原舆情原貌，预测未来走向，辅助决策！从0实现，不依赖任何框架。
novu,novuhq,TypeScript,38691,4238,162,1661,True,True,True,True,"The open-source notification Inbox infrastructure. E-mail, SMS, Push and Slack Integrations."
devdocs,freeCodeCamp,Ruby,38608,2578,234,4524,True,True,True,True,API Documentation Browser
impress.js,impress,JavaScript,38517,6616,59,5190,False,False,True,True,It's a presentation framework based on the power of CSS3 transforms and transitions in modern browsers and inspired by the idea behind prezi.com.
preact,preactjs,JavaScript,38477,2027,149,3838,True,True,True,True,⚛️ Fast 3kB React alternative with the same modern API. Components & Virtual DOM.
awesome-cursorrules,PatrickJS,MDX,38457,3255,80,544,True,True,True,True,📄  Configuration files that enhance Cursor AI editor experience with custom rules and behaviors
googletest,google,C++,38347,10723,526,3882,True,True,True,True,GoogleTest - Google Testing and Mocking Framework
python-cheatsheet,gto76,Python,38285,6740,0,2971,False,False,True,True,Comprehensive Python Cheatsheet
MPAndroidChart,PhilJay,Java,38228,9052,2189,4341,False,True,False,True,"A powerful 🚀 Android chart view / graph view library, supporting line- bar- pie- radar- bubble- and candlestick charts as well as scaling, panning and animations."
lapce,lapce,Rust,38137,1241,871,2958,False,True,True,True,Lightning-fast and Powerful Code Editor written in Rust
halo,halo-dev,Java,38091,10226,245,2915,True,True,True,True,强大易用的开源建站工具。
insomnia,Kong,TypeScript,38068,2239,819,3613,True,True,True,True,"The open-source, cross-platform API client for GraphQL, REST, WebSockets, SSE and gRPC. With Cloud, Local and Git storage."
istio,istio,Go,38062,8275,495,3403,False,True,True,True,"Connect, secure, control, and observe services."
worldmonitor,koala73,TypeScript,38037,6329,137,65,True,True,True,True,"Real-time global intelligence dashboard — AI-powered news aggregation, geopolitical monitoring, and infrastructure tracking in a unified situational awareness interface"
ant-design-pro,ant-design,TypeScript,37995,8237,177,3123,True,False,True,True,👨🏻‍💻👩🏻‍💻 Use Ant Design like a Pro!
tesseract.js,naptha,JavaScript,37922,2364,42,3917,False,False,True,True,Pure Javascript OCR for more than 100 Languages 📖🎉🖥
aspnetcore,dotnet,C#,37777,10602,3808,4386,True,True,True,True,"ASP.NET Core is a cross-platform .NET framework for building modern cloud-based web applications on Windows, Mac, or Linux."
polars,pola-rs,Rust,37750,2687,2725,2131,True,True,True,True,"Extremely fast Query Engine for DataFrames, written in Rust"
wtfjs,denysdovhan,JavaScript,37740,2689,45,3165,False,True,True,True,🤪 A list of funny and tricky JavaScript examples
cli,httpie,Python,37714,3833,251,5131,True,True,True,True,"🥧 HTTPie CLI  — modern, user-friendly command-line HTTP client for the API era. JSON support, colors, sessions, downloads, plugins & more."
metasploit-framework,rapid7,Ruby,37711,14796,576,5310,True,True,True,True,Metasploit Framework
Folo,RSSNext,TypeScript,37636,1991,376,706,True,True,True,True,🧡 Folo is the AI Reader
freecodecamp.cn,FreeCodeCampChina,CSS,37633,1411,157,3453,False,True,False,True,FCC China open source codebase and curriculum. Learn to code and help nonprofits.
vnpy,vnpy,Python,37611,11062,15,4031,True,False,True,True,基于Python的开源量化交易平台开发框架
interview,huihut,C++,37609,8125,2,2955,False,False,True,True,"📚 C/C++ 技术面试基础知识总结，包括语言、程序库、数据结构、算法、系统、网络、链接装载库等知识及面试经验、招聘、内推等信息。This repository is a summary of the basic knowledge of recruiting job seekers and beginners in the direction of C/C++ technology, including language, program library, data structure, algorithm, system, network, link loading library, interview experience, recruitment, recommendation, etc."
outline,outline,TypeScript,37606,3137,61,3583,True,False,True,True,"The fastest knowledge base for growing teams. Beautiful, realtime collaborative, feature packed, and markdown compatible."
ToolJet,ToolJet,JavaScript,37598,4980,951,1810,True,True,True,True,"ToolJet is the open-source foundation of ToolJet AI - the AI-native platform for building internal tools, dashboard, business applications, workflows and AI agents 🚀"
it-tools,CorentinTh,Vue,37566,4691,762,2169,False,False,True,True,"Collection of handy online tools for developers, with great UX. "
NewPipe,TeamNewPipe,Java,37540,3499,1385,3845,False,True,True,True,A libre lightweight streaming front-end for Android.
Langchain-Chatchat,chatchat-space,Python,37508,6174,21,1079,False,False,True,True,"Langchain-Chatchat（原Langchain-ChatGLM）基于 Langchain 与 ChatGLM, Qwen 与 Llama 等语言模型的 RAG 与 Agent 应用 | Langchain-Chatchat (formerly langchain-ChatGLM), local knowledge based LLM (like ChatGLM, Qwen and Llama) RAG and Agent app with langchain "
awesome-openclaw-skills,VoltAgent,,37474,3595,1,48,False,True,True,True,"The awesome collection of OpenClaw skills. 5,400+ skills filtered and categorized from the official OpenClaw Skills Registry.🦞"
v,vlang,V,37462,2238,995,2592,True,True,True,True,"Simple, fast, safe, compiled language for developing maintainable software. Compiles itself in <1s with zero library dependencies. Supports automatic C => V translation. https://vlang.io"
google-research,google-research,Jupyter Notebook,37462,8362,1786,2718,False,True,True,True,Google Research
engineering-blogs,kilimchoi,Ruby,37446,1963,143,3927,False,True,False,True,A curated list of engineering blogs
Open-Assistant,LAION-AI,Python,37439,3306,296,1187,False,True,True,True,"OpenAssistant is a chat-based assistant that understands tasks, can interact with third-party systems, and retrieve information dynamically to do so."
GFPGAN,TencentARC,Python,37396,6286,403,1821,True,False,True,True,GFPGAN aims at developing Practical Algorithms for Real-world Face Restoration.
llvm-project,llvm,LLVM,37375,16528,34870,3384,True,True,True,True,The LLVM Project is a collection of modular and reusable compiler and toolchain technologies.
tutorials,eugenp,Java,37359,53756,33,4702,False,True,False,True,Getting Started with Spring Boot 3: 
spacedrive,spacedriveapp,Rust,37358,1232,21,1629,True,True,True,True,"Spacedrive is an open source cross-platform file explorer, powered by a virtual distributed filesystem written in Rust."
paperless-ngx,paperless-ngx,Python,37355,2380,11,1491,True,True,True,True,"A community-supported supercharged document management system: scan, index and archive all your documents"
taro,NervJS,TypeScript,37347,4903,1714,2897,False,True,True,True,开放式跨端跨框架解决方案，支持使用 React/Vue 等框架来开发微信/京东/百度/支付宝/字节跳动/ QQ 小程序/H5/React Native 等应用。  https://taro.zone/
deeplearningbook-chinese,exacity,TeX,37210,9170,67,3384,False,False,True,True,Deep Learning Book Chinese Translation
interview_internal_reference,0voice,Python,37206,9421,36,2469,False,False,False,True,2025年最新总结，阿里，腾讯，百度，美团，头条等技术面试题目，以及答案，专家出题人分析汇总。
manim,ManimCommunity,Python,37202,2718,455,2126,True,True,True,True,A community-maintained Python framework for creating mathematical animations. 
arthas,alibaba,Java,37186,7635,463,2754,False,True,True,True,Alibaba Java Diagnostic Tool Arthas/Alibaba Java诊断利器Arthas
compose,docker,Go,37150,5746,69,4478,False,True,True,True,Define and run multi-container applications with Docker
RevokeMsgPatcher,huiyadanli,C#,37141,3947,54,2428,False,False,True,True,:trollface: A hex editor for WeChat/QQ/TIM - PC版微信/QQ/TIM防撤回补丁（我已经看到了，撤回也没用了）
gym,openai,Python,37097,8707,128,3608,False,True,True,True,A toolkit for developing and comparing reinforcement learning algorithms.
stats,exelban,Swift,37034,1208,29,2481,False,False,True,True,macOS system monitor in your menu bar
wtfpython,satwikkansal,Python,36919,2662,70,3120,True,True,True,True,What the f*ck Python? 😱
JavaFamily,AobingJava,,36918,7803,6,2315,False,False,False,True,【Java面试+Java学习指南】 一份涵盖大部分Java程序员所需要掌握的核心知识。
drawdb,drawdb-io,JavaScript,36884,2946,195,972,False,True,True,True,"Free, simple, and intuitive online database diagram editor and SQL generator."
MockingBird,babysor,Python,36875,5236,482,1681,True,False,False,True,🚀Clone a voice in 5 seconds to generate arbitrary speech in real-time
portainer,portainer,TypeScript,36849,2803,727,3586,True,True,True,True,Making Docker and Kubernetes management easy.
REKCARC-TSC-UHT,PKUanonym,HTML,36831,7850,2,2536,False,False,False,True,"清华大学计算机系课程攻略 Guidance for courses in Department of Computer Science and Technology, Tsinghua University"
sqlmap,sqlmapproject,Python,36826,6217,61,5009,True,True,True,True,Automatic SQL injection and database takeover tool
docs,inkonchain,MDX,36814,455,48,676,False,False,True,True,Ink Documentation
gkd,gkd-kit,Kotlin,36802,1784,11,985,False,False,True,True,"基于无障碍，高级选择器，订阅规则的自定义屏幕点击安卓应用 | An Android APP with custom screen tapping based on Accessibility, Advanced Selectors, and Subscription Rules"
node,inkonchain,Shell,36762,633,18,670,False,False,True,True,How to run an Ink Node
react-bits,DavidHDev,JavaScript,36748,1626,7,585,False,True,True,True,"An open source collection of animated, interactive & fully customizable React components for building memorable websites."
RuView,ruvnet,Rust,36718,5040,52,281,False,False,True,True,"π RuView: WiFi DensePose turns commodity WiFi signals into real-time human pose estimation, vital sign monitoring, and presence detection — all without a single pixel of video. "
shadowsocks-android,shadowsocks,Kotlin,36702,11530,60,4836,False,True,True,True,A shadowsocks client for Android
supervision,roboflow,Python,36693,3131,130,1202,True,True,True,True,We write your reusable computer vision tools. 💜
ink-kit,inkonchain,TypeScript,36669,427,3,495,False,False,True,True,React component library for onchain applications - See README for modern alternatives
duckdb,duckdb,C++,36659,3008,654,2818,True,True,True,True,DuckDB is an analytical in-process SQL database management system
marked,markedjs,TypeScript,36652,3512,12,5347,True,True,True,True,A markdown parser and compiler. Built for speed.
awesome-shell,alebcay,,36645,2478,133,4269,False,True,True,True,"A curated list of awesome command-line frameworks, toolkits, guides and gizmos. Inspired by awesome-php."
GPT_API_free,chatanywhere,Python,36640,2563,62,1056,False,False,False,True,Free ChatGPT&DeepSeek API Key，免费ChatGPT&DeepSeek API。免费接入DeepSeek API和GPT4 API，支持 gpt | deepseek | claude | gemini | grok 等排名靠前的常用大模型。
og-aws,open-guides,Shell,36591,3909,160,3531,True,True,True,True,📙 Amazon Web Services — a practical guide
date-fns,date-fns,TypeScript,36516,1938,915,4177,False,True,True,True,⏳ Modern JavaScript date utility library ⌛️
LLM101n,karpathy,,36499,1993,19,657,False,False,False,True,LLM101n: Let's build a Storyteller
pytorch-image-models,huggingface,Python,36497,5137,69,2597,True,True,True,True,"The largest collection of PyTorch image encoders / backbones. Including train, eval, inference, export scripts, and pretrained weights -- ResNet, ResNeXT, EfficientNet, NFNet, Vision Transformer (ViT), MobileNetV4, MobileNet-V3 & V2, RegNet, DPN, CSPNet, Swin Transformer, MaxViT, CoAtNet, ConvNeXt, and more"
Coursera-ML-AndrewNg-Notes,fengdu78,HTML,36484,11159,68,3052,False,False,True,True,吴恩达老师的机器学习课程个人笔记
headscale,juanfont,Go,36421,1953,128,2092,True,True,True,True,"An open source, self-hosted implementation of the Tailscale control server"
typeorm,typeorm,TypeScript,36392,6507,517,3666,False,True,True,True,"TypeScript & JavaScript ORM for Node.js — supports PostgreSQL, MySQL, MariaDB, SQLite, SQL Server, Oracle, and more."
sheetjs,SheetJS,,36208,7961,132,4849,False,False,False,True,📗 SheetJS Spreadsheet Data Toolkit -- New home https://git.sheetjs.com/SheetJS/sheetjs
HanLP,hankcs,Python,36201,10906,12,4174,False,True,True,True,中文分词 词性标注 命名实体识别 依存句法分析 成分句法分析 语义依存分析 语义角色标注 指代消解 风格转换 语义相似度 新词发现 关键词短语提取 自动摘要 文本分类聚类 拼音简繁转换 自然语言处理
955.WLB,formulahendry,,36163,1752,202,2544,False,False,False,True,955 不加班的公司名单 - 工作 955，work–life balance (工作与生活的平衡)
slate,slatedocs,,36161,356,50,4565,False,False,False,True,Beautiful static documentation for your API
lerna,lerna,TypeScript,36093,2279,337,3753,True,True,True,True,"Lerna is a fast, modern build system for managing and publishing multiple JavaScript/TypeScript packages from the same repository."
OpenVoice,myshell-ai,Python,36084,4034,299,836,False,False,False,True,Instant voice cloning by MIT and MyShell. Audio foundation model.
aseprite,aseprite,C++,36082,7850,1905,4225,True,True,True,True,"Animated sprite editor & pixel art tool (Windows, macOS, Linux)"
hello-algorithm,geekxh,Java,36025,6453,11,2115,False,False,False,True,🌍 针对小白的算法训练 | 包括四部分：①.大厂面经 ②.力扣图解  ③.千本开源电子书 ④.百张技术思维导图（项目花了上百小时，希望可以点 star 支持，🌹感谢~）推荐免费ChatGPT使用网站
servo,servo,Rust,35993,3529,3091,5148,True,True,True,True,"Servo aims to empower developers with a lightweight, high-performance alternative for embedding web technologies in applications."
carbon,carbon-app,JavaScript,35991,1976,80,3194,True,True,True,True,:black_heart: Create and share beautiful images of your source code
qBittorrent,qbittorrent,C++,35990,4595,2514,5152,False,True,True,True,qBittorrent BitTorrent client
DragGAN,XingangPan,Python,35969,3438,154,1031,False,False,False,True,Official Code for DragGAN (SIGGRAPH 2023)
awesome-deepseek-integration,deepseek-ai,,35914,3992,22,794,False,False,True,True,Integrate the DeepSeek API into popular software
manifesto,opentofu,HTML,35881,1046,20,944,False,False,True,True,The OpenTF Manifesto expresses concern over HashiCorp's switch of the Terraform license from open-source to the Business Source License (BSL) and calls for the tool's return to a truly open-source license.
ShareX,ShareX,C#,35875,3624,565,4540,False,False,True,True,"ShareX is a free and open-source application that enables users to capture or record any area of their screen with a single keystroke. It also supports uploading images, text, and various file types to a wide range of destinations."
Xray-core,XTLS,Go,35837,5045,51,1951,True,False,True,True,"Xray, Penetrates Everything. Also the best v2ray-core. Where the magic happens. An open platform for various uses."
mattermost,mattermost,TypeScript,35823,8417,828,3925,True,True,True,True,Mattermost is an open source platform for secure collaboration across the entire software development lifecycle..
fastify,fastify,JavaScript,35821,2617,109,3454,True,True,True,True,"Fast and low overhead web framework, for Node.js"
AgentGPT,reworkd,TypeScript,35820,9435,219,1073,True,True,True,True,"🤖 Assemble, configure, and deploy autonomous AI Agents in your browser."
ruoyi-vue-pro,YunaiV,Java,35794,7732,5,1876,False,False,True,True,🔥 官方推荐 🔥 RuoYi-Vue 全新 Pro 版本，优化重构所有功能。基于 Spring Boot + MyBatis Plus + Vue & Element 实现的后台管理系统 + 微信小程序，支持 RBAC 动态权限、数据权限、SaaS 多租户、Flowable 工作流、三方登录、支付、短信、商城、CRM、ERP、AI 大模型、IoT 物联网等功能。你的 ⭐️ Star ⭐️，是作者生发的动力！
leetcode,doocs,Java,35775,9387,0,2736,True,True,True,True,🔥LeetCode solutions in any programming language | 多种编程语言实现 LeetCode、《剑指 Offer（第 2 版）》、《程序员面试金典（第 6 版）》题解
koa,koajs,JavaScript,35748,3215,28,4620,True,True,True,True,Expressive middleware for node.js using ES2017 async functions
