repo_name,organization,language,stars,forks,open_issues,age_days,has_coc,has_contributing,has_workflows,has_readme,description
PowerShell,PowerShell,C#,53896,8352,1518,3803,True,True,True,True,PowerShell for every system!
ImHex,WerWolv,C++,53850,2398,367,2040,True,True,True,True,"🔍 A Hex Editor for Reverse Engineers, Programmers and people who value their retinas when working at 3 AM."
core,vuejs,TypeScript,53820,9144,975,2922,False,True,True,True,"🖖 Vue.js is a progressive, incrementally-adoptable JavaScript framework for building UI on the web."
normalize.css,necolas,CSS,53538,10372,76,5518,False,True,False,True,A modern alternative to CSS resets
Flowise,FlowiseAI,TypeScript,53528,24506,913,1169,True,True,True,True,"Build AI Agents, Visually"
pdf.js,mozilla,JavaScript,53442,10630,425,5527,True,True,True,True,PDF Reader in JavaScript
material-design-icons,google,,53437,9729,406,4265,True,True,True,True,Material Design icons by Google (Material Symbols)
crewAI,crewAIInc,Python,53390,7469,442,960,False,True,True,True,"Framework for orchestrating role-playing, autonomous AI agents. By fostering collaborative intelligence, CrewAI empowers agents to work together seamlessly, tackling complex tasks."
career-ops,santifer,JavaScript,53320,10641,126,69,True,True,True,True,"AI-powered job search system built on Claude Code. 14 skill modes, Go dashboard, PDF generation, batch processing."
English-level-up-tips,byoungd,,53254,5498,29,3300,False,False,True,True,An advanced guide to learn English which might benefit you a lot 🎉 .  离谱的英语学习指南/英语学习教程/英语学习/学英语
jellyfin,jellyfin,C#,53200,4967,619,2743,True,True,True,True,The Free Software Media System - Server Backend & API
kotlin,JetBrains,Kotlin,52850,6325,279,5233,True,True,True,True,The Kotlin Programming Language. 
Docker-OSX,sickcodes,Shell,52587,2883,418,2199,False,False,True,True,Run macOS VM in a Docker! Run near native OSX-KVM in Docker! X11 Forwarding! CI/CD for OS X Security Research! Docker mac Containers.
ionic-framework,ionic-team,TypeScript,52513,13359,622,4679,True,True,True,True,"A powerful cross-platform UI toolkit for building native-quality iOS, Android, and Progressive Web Apps with HTML, CSS, and JavaScript."
awesome-ios,vsouza,Swift,52449,6977,11,4355,True,True,True,True,"A curated list of awesome iOS ecosystem, including Objective-C and Swift Projects "
odoo,odoo,Python,52378,32788,9785,4413,False,True,True,True,Odoo. Open Source Apps To Grow Your Business.
prettier,prettier,JavaScript,52003,4741,1405,3482,True,True,True,True,Prettier is an opinionated code formatter.
Motrix,agalwood,JavaScript,51941,4884,779,2733,True,True,True,True,A full-featured download manager.
chinese-poetry,chinese-poetry,JavaScript,51841,10439,135,3571,False,False,True,True,"The most comprehensive database of Chinese poetry 🧶最全中华古诗词数据库,  唐宋两朝近一万四千古诗人,  接近5.5万首唐诗加26万宋诗.  两宋时期1564位词人，21050首词。"
etcd,etcd-io,Go,51819,10395,259,4724,True,True,True,True,Distributed reliable key-value store for the most critical data of a distributed system
grok-1,xai-org,Python,51692,8477,125,817,True,False,True,True,Grok open release
minimind,jingyaogong,Python,51683,6640,42,686,True,False,True,True,🧠「大模型」2小时完全从0训练64M的小参数LLM！Train a 64M-parameter LLM from scratch in just 2h!
windows,dockur,Shell,51676,4364,109,880,False,False,True,True,Windows inside a Docker container.
lx-music-desktop,lyswhut,TypeScript,51531,6854,1203,2494,False,False,True,True,一个基于 Electron 的音乐软件
jekyll,jekyll,Ruby,51493,10289,250,6445,True,True,True,True,:globe_with_meridians: Jekyll is a blog-aware static site generator in Ruby
guava,google,Java,51474,11138,740,4397,True,True,True,True,Google core libraries for Java
freqtrade,freqtrade,Python,51395,10704,32,3313,False,True,True,True,"Free, open source crypto trading bot"
lazydocker,jesseduffield,Go,51338,1626,277,2582,True,True,True,True,The lazier way to manage everything docker
DefinitelyTyped,DefinitelyTyped,TypeScript,51271,30455,673,4998,False,False,True,True,The repository for high quality TypeScript type definitions.
100-Days-Of-ML-Code,Avik-Jain,,51238,11540,68,2899,True,True,False,True,100 Days of ML Coding
go-ethereum,ethereum,Go,51140,21927,375,4551,False,True,True,True,Go implementation of the Ethereum protocol
MediaCrawler,NanmiCoder,Python,51126,10727,172,1099,False,False,True,True,小红书笔记 | 评论爬虫、抖音视频 | 评论爬虫、快手视频 | 评论爬虫、B 站视频 ｜ 评论爬虫、微博帖子 ｜ 评论爬虫、百度贴吧帖子 ｜ 百度贴吧评论回复爬虫  | 知乎问答文章｜评论爬虫
professional-programming,charlax,Python,51109,3994,3,3871,False,True,False,True,A collection of learning resources for curious software engineers
awesome-wechat-weapp,justjavac,,51094,9017,2,3550,False,False,False,True,微信小程序开发资源汇总 :100:
Semantic-UI,Semantic-Org,JavaScript,51067,4872,1071,4813,False,True,False,True,Semantic is a UI component framework based around useful principles from natural language.
hiring-without-whiteboards,poteto,JavaScript,50864,3896,9,3377,True,True,True,True,⭐️  Companies that don't have a broken hiring process
plane,makeplane,TypeScript,50742,4493,893,1301,True,True,True,True,"🔥🔥🔥 Open-source Jira, Linear, Monday, and ClickUp alternative. Plane is a modern project management platform to manage tasks, sprints, docs, and triage."
open-source-ios-apps,dkhamsing,,50682,5788,3,4155,False,True,True,True,:iphone: Collaborative List of Open-Source iOS Apps
whisper.cpp,ggml-org,C++,50679,5656,1199,1356,False,True,True,True,Port of OpenAI's Whisper model in C/C++
dbeaver,dbeaver,Java,50533,4230,3321,3887,True,True,True,True,Free universal database tool and SQL client
Pake,tw93,Rust,50428,10317,1,1337,True,True,True,True,🤱🏻 Turn any webpage into a desktop app with one command.
litellm,BerriAI,Python,50211,8839,3420,1052,False,True,True,True,"Python SDK, Proxy Server (AI Gateway) to call 100+ LLM APIs in OpenAI (or native) format, with cost tracking, guardrails, loadbalancing and logging. [Bedrock, Azure, OpenAI, VertexAI, Cohere, Anthropic, Sagemaker, HuggingFace, VLLM, NVIDIA NIM]"
awesome-openclaw-skills,VoltAgent,,50164,4887,13,138,False,True,True,True,"The awesome collection of OpenClaw skills. 5,400+ skills filtered and categorized from the official OpenClaw Skills Registry.🦞"
Fooocus,lllyasviel,Python,50102,8082,299,1038,False,False,True,True,Focus on prompting and generating
llama_index,run-llama,Python,50099,7548,429,1319,True,True,True,True,LlamaIndex is the leading document agent and OCR platform
bulma,jgthms,CSS,50075,3897,521,3793,False,True,True,True,Modern CSS framework based on Flexbox
expo,expo,TypeScript,50036,12731,585,3588,False,True,True,True,"An open-source framework for making universal native apps with React. Expo runs on Android, iOS, and the web."
mastodon,mastodon,Ruby,50020,7463,4435,3763,True,True,True,True,"Your self-hosted, globally interconnected microblogging community"
remotion,remotion-dev,TypeScript,49953,3570,126,2180,True,True,True,True,🎥      Make videos programmatically with React
json,nlohmann,C++,49920,7413,73,4726,True,True,True,True,JSON for Modern C++
twenty,twentyhq,TypeScript,49804,7195,150,1289,True,True,True,True,"The open alternative to Salesforce, designed for AI."
cypress,cypress-io,TypeScript,49731,3410,1177,4119,True,True,True,True,"Fast, easy and reliable testing for anything that runs in a browser."
query,TanStack,TypeScript,49728,3882,183,2467,False,True,True,True,"🤖 Powerful asynchronous state management, server-state utilities and data fetching for the web. TS/JS, React Query, Solid Query, Svelte Query and Vue Query."
hacker-scripts,NARKOZ,JavaScript,49688,6659,70,3856,False,False,False,True,Based on a true story
alist,AlistGo,Go,49651,7953,564,1997,True,True,True,True,"🗂️A file list/WebDAV program that supports multiple storages, powered by Gin and Solidjs. / 一个支持多存储的文件列表/WebDAV程序，使用 Gin 和 Solidjs。"
penpot,penpot,Clojure,49618,3187,658,3818,True,True,True,True,Penpot: The open-source design tool for design and code collaboration
huginn,huginn,Ruby,49460,4277,696,4843,False,False,True,True,Create agents that monitor and act on your behalf.  Your agents are standing by!
VibeVoice,microsoft,Python,49297,5479,164,291,True,True,True,True,Open-Source Frontier Voice AI
goose,aaif-goose,Rust,49119,5182,361,658,False,True,True,True,"an open source, extensible AI agent that goes beyond code suggestions - install, execute, edit, and test with any LLM"
open-source-mac-os-apps,serhii-londar,,49041,2582,111,3144,False,True,True,True,🚀 Awesome list of open source applications for macOS. https://t.me/s/opensourcemacosapps
BMAD-METHOD,bmad-code-org,JavaScript,49037,5682,61,425,True,True,True,True,Breakthrough Method for Agile Ai Driven Development
jadx,skylot,Java,49031,5544,419,4834,True,True,True,True,Dex to Java decompiler
pandas,pandas-dev,Python,48967,20011,3219,5772,True,True,True,True,"Flexible and powerful data analysis / manipulation library for Python, providing labeled data structures similar to R data.frame objects, statistical functions, and much more"
chinese-independent-developer,1c7,,48856,4190,3,3186,False,True,True,True,👩🏿‍💻👨🏾‍💻👩🏼‍💻👨🏽‍💻👩🏻‍💻中国独立开发者项目列表 -- 分享大家都在做什么
julia,JuliaLang,Julia,48828,5790,4711,5531,True,True,True,True,The Julia Programming Language
terraform,hashicorp,Go,48672,10372,1908,4474,True,True,True,True,"Terraform enables you to safely and predictably create, change, and improve infrastructure. It is a source-available tool that codifies APIs into declarative configuration files that can be shared amongst team members, treated as code, edited, reviewed, and versioned."
dayjs,iamkun,JavaScript,48654,2441,1271,2985,False,True,True,True,⏰ Day.js 2kB immutable date-time library alternative to Moment.js with the same modern API
kubernetes-the-hard-way,kelseyhightower,,48643,15709,49,3627,False,True,False,True,Bootstrap Kubernetes the hard way. No scripts.
x64dbg,x64dbg,C++,48627,2751,570,4080,True,True,True,True,An open-source user mode debugger for Windows. Optimized for reverse engineering and malware analysis.
algorithm-visualizer,algorithm-visualizer,JavaScript,48559,7581,79,3681,True,True,False,True,:fireworks:Interactive Online Platform that Visualizes Algorithms from Code
PythonDataScienceHandbook,jakevdp,Jupyter Notebook,48517,18981,230,3593,True,True,False,True,Python Data Science Handbook: full text in Jupyter Notebooks
brew,Homebrew,Ruby,48453,11155,14,3751,True,True,True,True,🍺 The Package Manager for Everywhere
pretext,chenglou,TypeScript,48392,2694,81,97,False,False,True,True,"Fast, accurate & comprehensive text measurement & layout"
codegraph,colbymchenry,TypeScript,48318,2952,224,145,False,False,True,True,"Pre-indexed code knowledge graph, auto syncs on code changes, for Claude Code, Codex, Gemini, Cursor, OpenCode, AntiGravity, Kiro, and Hermes Agent — fewer tokens, fewer tool calls, 100% local"
RxJava,ReactiveX,Java,48236,7587,23,4903,False,True,True,True,RxJava – Reactive Extensions for the JVM – a library for composing asynchronous and event-based programs using observable sequences for the Java VM.
awesome-java,akullpp,,48207,7686,23,4356,False,True,True,True,"A curated list of awesome frameworks, libraries and software for the Java programming language."
type-challenges,type-challenges,TypeScript,48206,5264,33207,2150,True,False,True,True,Collection of TypeScript type challenges with online judge
htmx,bigskysoftware,JavaScript,48195,1602,663,2251,False,True,True,True,</> htmx - high power tools for HTML
AI-For-Beginners,microsoft,Jupyter Notebook,48105,9961,9,1927,True,False,True,True,"12 Weeks, 24 Lessons, AI for All!"
Made-With-ML,GokuMohandas,Jupyter Notebook,48000,7548,25,2777,False,False,True,True,"Learn how to develop, deploy and iterate on production-grade ML applications."
ClickHouse,ClickHouse,C++,47973,8507,6232,3662,True,True,True,True,ClickHouse® is a real-time analytics database management system
moment,moment,JavaScript,47970,6988,299,5583,False,True,True,True,"Parse, validate, manipulate, and display dates in javascript."
ruff,astral-sh,Rust,47954,2148,2002,1403,True,True,True,True,"An extremely fast Python linter and code formatter, written in Rust."
design-patterns-for-humans,nilbuild,,47869,5503,16,3403,False,False,False,True,An ultra-simplified explanation to design patterns
awesome-react-components,brillout,,47758,3782,55,3640,True,True,True,True,Curated List of React Components & Libraries.
tldraw,tldraw,TypeScript,47757,3295,422,1860,True,True,True,True,"Build infinite canvas apps in React with the tldraw SDK. World's best, top-most agent recommended #1 five star SDK."
Projects,karan,,47726,10637,122,4726,False,True,False,True,:page_with_curl: A list of practical projects that anyone can solve in any programming language.
awesome-design-patterns,DovAmir,,47718,3260,24,2930,False,True,False,True,A curated list of software and architecture related design patterns.
big-list-of-naughty-strings,minimaxir,Python,47673,2161,108,3961,False,False,False,True,The Big List of Naughty Strings is a list of strings which have a high probability of causing issues when used as user-input data.
metabase,metabase,Clojure,47662,6539,4194,4148,False,True,True,True,The easy-to-use open source Business Intelligence and Embedded Analytics tool that lets everyone work with data :bar_chart:
gogs,gogs,Go,47598,5071,994,4504,False,True,True,True,The painless way to host your own Git service
Win11Debloat,Raphire,PowerShell,47514,1912,33,2054,False,True,True,True,"A simple, lightweight PowerShell script that allows you to remove pre-installed apps, disable telemetry, as well as perform various other changes to declutter and customize your Windows experience. Win11Debloat works for both Windows 10 and Windows 11."
pixijs,pixijs,TypeScript,47392,5030,331,4890,True,True,True,True,"The HTML5 Creation Engine: Create beautiful digital content with the fastest, most flexible 2D WebGL renderer."
fanqiang,bannedbook,Kotlin,47313,8066,327,4168,False,False,True,True,翻墙-科学上网
textgen,oobabooga,Python,47292,5976,819,1270,False,False,True,True,"Open-source desktop app for local LLMs. Text, vision, tool-calling, OpenAI/Anthropic-compatible API. 100% private."
cherry-studio,CherryHQ,TypeScript,47254,4482,1183,750,True,True,True,True,"AI productivity studio with smart chat, autonomous agents, and 300+ assistants. Unified access to frontier LLMs"
discourse,discourse,Ruby,47252,8934,163,4900,True,True,True,True,"A platform for community discussion. Free, open, simple."
quill,slab,TypeScript,47147,3655,649,5065,True,True,True,True,Quill is a modern WYSIWYG editor built for compatibility and extensibility
slidev,slidevjs,TypeScript,47145,2100,198,1876,True,True,True,True,Presentation Slides for Developers
react,typescript-cheatsheets,TypeScript,47067,4293,0,2933,True,True,True,True,Cheatsheets for experienced React developers getting started with TypeScript
okhttp,square,Kotlin,46973,9275,112,5072,False,True,True,True,"Square’s meticulous HTTP client for the JVM, Android, and GraalVM."
spotube,KRTirtho,Dart,46941,2149,811,1945,True,False,True,True,🎧 Open source music streaming app! Available for both desktop & mobile!
frontend-dev-bookmarks,dypsilon,,46931,5148,132,4738,False,True,False,True,Manually curated collection of resources for frontend web developers.
serverless,serverless,JavaScript,46920,5729,1218,4071,True,True,True,True,"⚡ Serverless Framework – Effortlessly build apps that auto-scale, incur zero costs when idle, and require minimal maintenance using AWS Lambda and other managed cloud services."
legado,gedoor,Kotlin,46897,5770,18,2579,False,False,True,True,"Legado 3.0 Book Reader with powerful controls & full functions❤️阅读3.0, 阅读是一款可以自定义来源阅读网络内容的工具，为广大网络文学爱好者提供一种方便、快捷舒适的试读体验。"
acme.sh,acmesh-official,Shell,46879,5592,1404,3821,False,False,True,True,A pure Unix shell script ACME client for SSL / TLS certificate automation
v2ray-core,v2ray,Go,46867,8840,19,3934,True,False,True,True,A platform for building proxies to bypass network restrictions.
LocalAI,mudler,Go,46819,4134,196,1182,False,True,True,True,"LocalAI is the open-source AI engine. Run any model - LLMs, vision, voice, image, video - on any hardware. No GPU required."
nvm-windows,coreybutler,Go,46783,3839,89,4283,False,True,True,True,A node.js version management utility for Windows. Ironically written in Go.
GitHubDaily,GitHubDaily,,46763,4641,641,2721,False,False,False,True,"坚持分享 GitHub 上高质量、有趣实用的开源技术教程、开发者工具、编程网站、技术资讯。A list cool, interesting projects of GitHub."
JeecgBoot,jeecgboot,Java,46722,16051,32,2755,False,False,True,True,AI 低代码平台「低代码 + 零代码」双驱动！低代码可一键生成前后端代码;零代码可 5 分钟搭建系统;AI Skills 一句话画流程、设计表单、生成整套系统。内置 AI聊天、知识库、流程编排、MCP插件等，兼容主流大模型。引领「AI 生成 → 在线配置 → 代码生成 → 手工合并->AI修改」开发模式，消除 Java 项目 80% 的重复工作，提效而不失灵活。
bevy,bevyengine,Rust,46588,4621,3222,2337,True,True,True,True,A refreshingly simple data-driven game engine built in Rust
tmux,tmux,C,46521,2691,25,4027,False,True,True,True,tmux source code
30-Days-Of-JavaScript,Asabeneh,JavaScript,46456,10436,367,2363,False,False,False,True,"30 days of JavaScript programming challenge is a step-by-step guide to learn JavaScript programming language in 30 days. This challenge may take more than 100 days,  please just follow your own pace. These videos may help too: https://www.youtube.com/channel/UC7PNRuno1rzYPb1xLa4yktw"
awesome-remote-job,lukasz-madon,,46341,4636,39,4180,False,True,True,True,A curated list of awesome remote jobs and resources. Inspired by https://github.com/vinta/awesome-python
awesome-claude-code,hesreallyhim,Python,46315,4038,458,419,True,True,True,True,"A curated list of awesome skills, hooks, slash-commands, agent orchestrators, applications, and plugins for Claude Code by Anthropic"
prisma,prisma,TypeScript,46247,2242,2620,2549,True,True,True,True,"Next-generation ORM for Node.js & TypeScript | PostgreSQL, MySQL, MariaDB, SQL Server, SQLite, MongoDB and CockroachDB"
monaco-editor,microsoft,JavaScript,46179,4078,828,3657,True,True,True,True,A browser based code editor
learn-regex,ziishaned,,46104,6164,65,3247,False,False,False,True,Learn regex the easy way
aider,Aider-AI,Python,46097,4577,1619,1130,False,True,True,True,aider is AI pair programming in your terminal
upscayl,upscayl,TypeScript,46024,2269,55,1413,False,False,True,True,"🆙 Upscayl - #1 Free and Open Source AI Image Upscaler for Linux, MacOS and Windows."
awesome-cheatsheets,LeCoupa,JavaScript,46003,6712,138,3138,False,False,True,True,"👩‍💻👨‍💻 Awesome cheatsheets for popular programming languages, frameworks and development tools. They include everything you should know in one single file."
airflow,apache,Python,45794,17231,1705,4078,True,True,True,True,"Apache Airflow - A platform to programmatically author, schedule, and monitor workflows"
architecture-samples,android,Kotlin,45718,11870,221,3780,False,True,True,True,A collection of samples to discuss and showcase different architectural tools and patterns for Android apps.
TTS,coqui-ai,Python,45549,6115,9,2214,True,True,True,True,"🐸💬 - a deep learning toolkit for Text-to-Speech, battle-tested in research and production"
zx,google,JavaScript,45533,1268,52,1865,True,True,True,True,A tool for writing better scripts
awesome-compose,docker,HTML,45531,8203,385,2311,False,True,True,True,Awesome Docker Compose samples
cal.diy,calcom,TypeScript,45477,14027,1284,1908,True,True,True,True,Scheduling infrastructure for absolutely everyone.
AdminLTE,ColorlibHQ,CSS,45456,18211,0,4553,True,True,True,True,AdminLTE - Free admin dashboard template based on Bootstrap 5
Rocket.Chat,RocketChat,TypeScript,45451,13641,3758,4042,True,True,True,True,The Secure CommsOS™ for mission-critical operations
jest,jestjs,TypeScript,45431,6662,236,4568,True,True,True,True,Delightful JavaScript Testing.
claude-cookbooks,anthropics,Jupyter Notebook,45357,5269,228,1032,False,True,True,True,A collection of notebooks/recipes showcasing some fun and effective ways of using Claude.
exo,exo-explore,Python,45332,3250,262,718,False,True,True,True,Run frontier AI locally.
CowAgent,zhayujie,Python,45262,10195,16,1405,False,True,True,True,"Open-source super AI assistant & Agent Harness. Plans tasks, runs tools and skills, self-evolves with memory and knowledge. Multi-model, multi-channel. Lightweight, extensible, one-line install. (formerly chatgpt-on-wechat)"
copyparty,9001,Python,45205,1841,266,2574,True,True,False,True,"Portable file server with accelerated resumable uploads, dedup, WebDAV, SFTP, FTP, TFTP, zeroconf, media indexer, thumbnails++ all in one file"
iina,iina,Swift,45191,2837,1892,3462,False,True,True,True,The modern video player for macOS.
Leaflet,Leaflet,JavaScript,45188,6134,547,5742,True,True,True,True,🍃 JavaScript library for mobile-friendly interactive maps 🇺🇦
Umi-OCR,hiroi-sora,Python,45165,4446,344,1538,False,False,False,True,"OCR software, free and offline. 开源、免费的离线OCR软件。支持截屏/批量导入图片，PDF文档识别，排除水印/页眉页脚，扫描/生成二维码。内置多国语言库。"
CppCoreGuidelines,isocpp,CSS,45094,5548,251,3950,False,True,True,True,"The C++ Core Guidelines are a set of tried-and-true guidelines, rules, and best practices about coding in C++"
streamlit,streamlit,Python,44956,4278,1321,2485,True,True,True,True,Streamlit — A faster way to build and share data apps.
Summer2026-Internships,SimplifyJobs,Python,44897,3182,5,2211,False,True,True,True,"Summer 2026 software engineering, data science, AI, quant, product management, and hardware internship postings. Updated daily by Simplify and Pitt CSC."
pyenv,pyenv,Shell,44882,3249,56,5033,False,True,True,True,Simple Python version management
grpc,grpc,C++,44881,11158,1312,4204,True,True,True,True,"C++ based gRPC (C++, Python, Ruby, Objective-C, PHP, C#)"
bruno,usebruno,JavaScript,44865,2573,1709,1354,False,True,True,True,Opensource IDE For Exploring and Testing API's (lightweight alternative to Postman/Insomnia)
helix,helix-editor,Rust,44864,3543,1555,2203,False,True,True,True,A post-modern modal text editor.
edex-ui,GitSquared,JavaScript,44863,3124,6,3422,False,False,True,True,"A cross-platform, customizable science fiction terminal emulator with advanced monitoring & touchscreen support."
cli,cli,Go,44806,8553,1016,2444,True,True,True,True,GitHub’s official command line tool
TrafficMonitor,zhongyang219,C++,44789,3696,1321,3240,False,False,True,True,这是一个用于显示当前网速、CPU及内存利用率的桌面悬浮窗软件，并支持任务栏显示，支持更换皮肤。
meteor,meteor,JavaScript,44780,5248,398,5259,True,True,True,True,"Meteor, the JavaScript App Platform"
react-hook-form,react-hook-form,TypeScript,44761,2419,43,2656,True,True,True,True,📋 React Hooks for form state management and validation (Web + React Native)
milvus,milvus-io,Go,44754,4064,906,2462,True,True,True,True,"Milvus is a high-performance, cloud-native vector database built for scalable vector ANN search"
pandoc,jgm,Haskell,44753,3898,1059,5928,False,True,True,True,Universal markup converter
RSSHub,DIYgod,TypeScript,44673,9922,346,2993,True,True,True,True,🧡 Everything is RSSible
reactjs-interview-questions,sudheerj,JavaScript,44641,10370,15,2934,False,False,True,True,List of top 500 ReactJS Interview Questions & Answers....Coding exercise questions are coming soon!!
hyper,vercel,TypeScript,44598,3561,1043,3634,False,False,True,True,A terminal built on web technologies
shannon,KeygraphHQ,TypeScript,44527,5162,11,259,False,False,True,True,"Shannon Lite is an autonomous, white-box AI pentester for web applications and APIs. It analyzes your source code, identifies attack vectors, and executes real exploits to prove vulnerabilities before they reach production."
siyuan,siyuan-note,TypeScript,44423,2839,345,2112,True,True,True,True,"A privacy-first, self-hosted, fully open source personal knowledge management software, written in typescript and golang."
qlib,microsoft,Python,44325,7006,423,2129,True,False,True,True,"Qlib is an AI-oriented Quant investment platform that aims to use AI tech to empower Quant Research, from exploring ideas to implementing productions. Qlib supports diverse ML modeling paradigms, including supervised learning, market dynamics modeling, and RL, and is now equipped with https://github.com/microsoft/RD-Agent to automate R&D process."
nanobot,HKUDS,Python,44127,7807,877,131,False,True,True,True,"Lightweight, open-source AI agent for your tools, chats, and workflows."
jsoncrack.com,AykutSarac,TypeScript,44122,3551,36,1594,True,True,True,True,"✨ Innovative and open-source visualization application that transforms various data formats, such as JSON, YAML, XML and CSV into interactive graphs."
sentry,getsentry,Python,44098,4727,2097,5765,True,True,True,True,Developer-first error tracking and performance monitoring
cobra,spf13,Go,44087,3149,376,4665,False,True,True,True,A Commander for modern Go CLI interactions
