repo_name,organization,language,stars,forks,open_issues,age_days,has_coc,has_contributing,has_workflows,has_readme,description
build-your-own-x,codecrafters-io,Markdown,530947,50219,617,2997,False,False,True,True,Master programming by recreating your favorite technologies from scratch.
awesome,sindresorhus,,488227,36016,96,4395,True,True,True,True,😎 Awesome lists about all kinds of interesting topics
freeCodeCamp,freeCodeCamp,TypeScript,452594,45646,243,4229,True,True,True,True,"freeCodeCamp.org's open-source codebase and curriculum. Learn math, programming, and computer science for free."
public-apis,public-apis,Python,452242,49793,1596,3777,False,True,True,True,A collective list of free APIs
free-programming-books,EbookFoundation,Python,392869,66563,75,4668,True,True,True,True,:books: Freely available programming books
openclaw,openclaw,TypeScript,383968,80665,6958,241,False,True,True,True,Your own personal AI assistant. Any OS. Any Platform. The lobster way. 🦞 
developer-roadmap,nilbuild,TypeScript,362470,44649,0,3417,True,True,True,True,"Interactive roadmaps, guides and other educational content to help developers grow in their careers."
system-design-primer,donnemartin,Python,358957,57376,573,3434,False,True,True,True,Learn how to design large-scale systems. Prep for the system design interview.  Includes Anki flashcards.
coding-interview-university,jwasham,,357010,84376,124,3700,False,False,True,True,A complete computer science study plan to become a software engineer.
awesome-python,vinta,Python,309975,28364,17,4409,True,True,True,True,"An opinionated list of Python frameworks, libraries, tools, and resources"
awesome-selfhosted,awesome-selfhosted,,307736,14429,0,4071,False,False,False,True,A list of Free Software network services and web applications which can be hosted on your own servers
996.ICU,996icu,,276461,20785,16697,2676,False,False,False,True,Repo for counting stars and contributing. Press F to pay respect to glorious developers.
project-based-learning,practical-tutorials,Python,274981,35443,290,3390,False,True,True,True,Curated list of project-based tutorials
superpowers,obra,Shell,260174,23196,315,287,True,False,True,True,An agentic skills framework & software development methodology that works.
react,react,JavaScript,246691,51164,1217,4808,True,True,True,True,The library for web and native user interfaces.
linux,torvalds,C,240261,63439,3,5436,False,False,True,True,Linux kernel source tree
the-book-of-secret-knowledge,trimstray,,234857,13972,161,2952,True,True,True,True,"A collection of inspiring lists, manuals, cheatsheets, blogs, hacks, one-liners, cli/web tools and more."
ECC,affaan-m,JavaScript,232624,35456,100,187,True,True,True,True,"The agent harness performance optimization system. Skills, instincts, memory, security, and research-first development for Claude Code, Codex, Opencode, Cursor and beyond."
Python,TheAlgorithms,Python,223050,50890,1021,3659,True,True,True,True,All Algorithms implemented in Python
hermes-agent,NousResearch,Python,219612,41685,24857,366,False,True,True,True,The agent that grows with you
vue,vuejs,TypeScript,210113,33695,636,4743,True,True,True,True,"This is the repo for Vue 2. For Vue 3, go to https://github.com/vuejs/core"
computer-science,ossu,HTML,207155,25685,23,4464,False,True,True,True,🎓 Path to a free self-taught education in Computer Science!
n8n,n8n-io,TypeScript,197688,59574,1398,2588,True,True,True,True,"Fair-code workflow automation platform with native AI capabilities. Combine visual building with custom code, self-host or cloud, 400+ integrations."
tensorflow,tensorflow,C++,196488,75508,2771,3912,True,True,True,True,An Open Source Machine Learning Framework for Everyone
javascript-algorithms,trekhleb,JavaScript,196317,31049,403,3043,True,True,True,True,📝 Algorithms and data structures implemented in JavaScript with explanations and links to further readings
andrej-karpathy-skills,multica-ai,,195785,20159,124,178,False,False,True,True,"A single CLAUDE.md file to improve Claude Code behavior, derived from Andrej Karpathy's observations on LLM coding pitfalls."
claw-code,ultraworkers,Rust,194879,109515,33,114,True,True,True,True,"An agent-managed museum exhibit, built in Rust with Gajae-Code / LazyCodex — developed and maintained with no human intervention."
opencode,anomalyco,TypeScript,189102,23898,4810,449,False,True,True,True,The open source coding agent.
ohmyzsh,ohmyzsh,Shell,188766,26467,578,6173,True,True,True,True,"🙃   A delightful community-driven (with 2,500+ contributors) framework for managing your zsh configuration. Includes 300+ optional plugins (rails, git, macOS, hub, docker, homebrew, node, php, python, etc), 140+ themes to spice up your morning, and an auto-update tool that makes it easy to keep up with the latest updates from the community."
FreeDomain,DigitalPlatDev,,187988,3945,36,784,False,False,False,True,DigitalPlat FreeDomain: Free Domain For Everyone
vscode,microsoft,TypeScript,187831,41225,19509,3976,True,True,True,True,Visual Studio Code
AutoGPT,Significant-Gravitas,Python,185662,46073,492,1225,True,True,True,True,"AutoGPT is the vision of accessible AI for everyone, to use and to build on. Our mission is to provide the tools, so that you can focus on what matters."
skills,mattpocock,Shell,185117,15870,219,170,False,False,True,True,Skills for Real Engineers. Straight from my .agents directory.
CS-Notes,CyC2018,,184875,50833,196,3082,False,False,True,True,:books: 技术面试必备基础知识、Leetcode、计算机操作系统、计算机网络、系统设计
You-Dont-Know-JS,getify,,184616,33466,2,4633,False,True,True,True,A book series (2 published editions) on the JS language.
Python-100-Days,jackfrued,Jupyter Notebook,184524,55692,705,3066,False,False,True,True,Python - 100天从新手到大师
Microsoft-Activation-Scripts,massgravel,Batchfile,184306,17660,2,2384,False,False,False,True,"Open-source Windows and Office activator featuring HWID, Ohook, TSforge, and Online KMS activation methods, along with advanced troubleshooting."
yt-dlp,yt-dlp,Python,179756,15305,2552,2097,False,True,True,True,A feature-rich command-line audio/video downloader
awesome-go,avelino,Go,179012,13425,191,4400,True,True,True,True,"A curated list of awesome Go frameworks, libraries and software"
flutter,flutter,Dart,177916,30755,12972,4157,True,True,True,True,Flutter makes it easy and fast to build beautiful apps for mobile and beyond
ollama,ollama,Go,176756,17084,3532,1123,False,True,True,True,"Get up and running with Kimi-K2.6, GLM-5.2, MiniMax, DeepSeek, gpt-oss, Qwen, Gemma and other models."
gitignore,github,,174996,82326,75,5736,True,True,True,True,A collection of useful .gitignore templates
bootstrap,twbs,MDX,174510,78725,291,5473,True,True,True,True,"The most popular HTML, CSS, and JavaScript framework for developing responsive, mobile first projects on the web."
markitdown,microsoft,Python,168631,12173,818,617,True,False,True,True,Python tool for converting files and office documents to Markdown.
HelloGitHub,521xueweihan,Python,166921,12411,543,3732,False,False,False,True,":octocat: 分享 GitHub 上有趣、入门级的开源项目。Share interesting, entry-level open source projects on GitHub."
prompts.chat,f,HTML,166274,21487,64,1326,False,True,True,True,"f.k.a. Awesome ChatGPT Prompts. Share, discover, and collect prompts from the community. Free and open source — self-host for your organization with complete privacy."
stable-diffusion-webui,AUTOMATIC1111,Python,164248,30434,2499,1431,False,False,True,True,Stable Diffusion web UI
skills,anthropics,Python,163787,19436,1044,304,False,False,True,True,Public repository for Agent Skills
transformers,huggingface,Python,162903,34009,2380,2824,True,True,True,True,"🤗 Transformers: the model-definition framework for state-of-the-art machine learning models in text, vision, audio, and multimodal models, for both inference and training. "
the-art-of-command-line,jlevy,,161892,14829,256,4082,False,True,False,True,"Master the command line, in one page"
JavaGuide,Snailclimb,JavaScript,157261,46184,58,2999,False,False,True,True,Java 面试 & 后端通用面试指南，覆盖计算机基础、数据库、分布式、高并发、系统设计与 AI 应用开发
firecrawl,firecrawl,TypeScript,155211,8837,439,829,False,True,True,True,"The API to search, scrape, and interact with the web at scale. 🔥"
langflow,langflow-ai,Python,152304,9636,983,1261,True,True,True,True,Langflow is a powerful tool for building and deploying AI-powered agents and workflows.
dify,langgenius,TypeScript,150032,23644,983,1198,True,True,True,True,"Build Agentic workflows, RAG pipelines, with rich AI model and tool support on one collaborative workspace. Deploy on cloud, VPC, or self-hosted, so teams move from prototype to production without rebuilding the stack."
javascript,airbnb,JavaScript,148087,26617,161,5012,True,False,True,True,JavaScript Style Guide
open-webui,open-webui,Python,146532,21277,479,1021,True,False,True,True,"User-friendly AI Interface (Supports Ollama, OpenAI API, ...)"
scrcpy,Genymobile,C,146286,13486,2858,3166,False,False,True,True,Display and control your Android device
langchain,langchain-ai,Python,142469,23715,450,1376,True,True,True,True,The agent engineering platform.
system-prompts-and-models-of-ai-tools,x1xhlol,,142241,34822,158,505,False,False,True,True,"FULL Augment Code, Claude Code, Cluely, CodeBuddy, Comet, Cursor, Devin AI, Junie, Kiro, Leap.new, Lovable, Manus, NotionAI, Orchids.app, Perplexity, Poke, Qoder, Replit, Same.dev, Trae, Traycer AI, VSCode Agent, Warp.dev, Windsurf, Xcode, Z.ai Code, Dia & v0. (And other Open Sourced) System Prompts, Internal Tools & AI Models"
tech-interview-handbook,yangshun,TypeScript,141191,16695,45,3671,True,True,True,True,Curated coding interview preparation materials for busy software engineers
next.js,vercel,JavaScript,141096,31500,4166,3578,True,True,True,True,The React Framework
youtube-dl,ytdl-org,Python,140781,10671,4130,5744,False,True,True,True,Command-line program to download videos from YouTube.com and other video sites
claude-code,anthropics,Python,138876,22286,13217,516,False,False,True,True,"Claude Code is an agentic coding tool that lives in your terminal, understands your codebase, and helps you code faster by executing routine tasks, explaining complex code, and handling git workflows - all through natural language commands."
PowerToys,microsoft,C,136701,8305,7439,2640,True,True,True,True,Microsoft PowerToys is a collection of utilities that supercharge productivity and customization on Windows
agency-agents,msitarzewski,Shell,136226,22187,99,283,False,True,True,True,"A complete AI agency at your fingertips - From frontend wizards to Reddit community ninjas, from whimsy injectors to reality checkers. Each agent is a specialized expert with personality, processes, and proven deliverables."
go,golang,Go,135331,19126,10181,4357,True,True,True,True,The Go programming language
fucking-algorithm,labuladong,Markdown,134956,23595,3,2346,False,False,True,True,"Crack LeetCode, not only how, but also why. "
iptv,iptv-org,TypeScript,134189,7614,32,2808,True,True,True,True,Collection of publicly available IPTV channels from all over the world
clash-verge-rev,clash-verge-rev,TypeScript,133407,9644,424,975,False,True,True,True,"A modern GUI client based on Tauri, designed to run in Windows, macOS and Linux for tailored proxy experience"
free-for-dev,ripienaar,HTML,130278,13644,14,4145,True,True,True,True,"A list of SaaS, PaaS and IaaS offerings that have free tiers of interest to devops and infradev"
hello-algo,krahets,Java,128747,15343,39,1357,False,False,True,True,"《Hello 算法》：动画图解、一键运行的数据结构与算法教程。支持简中、繁中、English、日本語，提供 Python, Java, C++, C, C#, JS, Go, Swift, Rust, Ruby, Kotlin, TS, Dart 等代码实现"
30-seconds-of-code,Chalarangelo,JavaScript,128481,12480,5,3158,True,True,True,True,Coding articles to level up your development skills
excalidraw,excalidraw,TypeScript,128239,14535,3254,2395,False,True,True,True,Virtual whiteboard for sketching hand-drawn like diagrams
awesome-llm-apps,Shubhamsaboo,Python,127010,18727,17,816,False,False,True,True,"100+ AI Agents, Agent Skills and RAG Apps - Free and Open Source."
react-native,react,C++,126251,25187,1019,4213,True,True,True,True,A framework for building native applications using React
gstack,garrytan,TypeScript,123985,18566,781,134,False,True,True,True,"Use Garry Tan's exact Claude Code setup: 23 opinionated tools that serve as CEO, Designer, Eng Manager, Release Manager, Doc Engineer, and QA"
kubernetes,kubernetes,Go,123904,43572,2657,4430,True,True,True,True,Production-Grade Container Scheduling and Management
spec-kit,github,Python,123528,11022,289,336,True,True,True,True,💫 Toolkit to help you get started with Spec-Driven Development
electron,electron,C++,122151,17332,873,4851,True,True,True,True,":electron: Build cross-platform desktop apps with JavaScript, HTML, and CSS"
ComfyUI,Comfy-Org,Python,122027,14377,4322,1284,False,True,True,True,"The most powerful and modular diffusion model GUI, api and backend with a graph/nodes interface."
llama.cpp,ggml-org,C++,121425,20942,1909,1231,False,True,True,True,LLM inference in C/C++
cc-switch,farion1231,Rust,120638,8100,2060,353,True,True,True,True,"A cross-platform desktop All-in-One assistant for Claude Code, Codex, OpenCode, OpenClaw, Grok Build & Hermes Agent. Only official website: ccswitch.io"
ui,shadcn-ui,TypeScript,119674,9505,2174,1296,False,True,True,True,"A set of beautifully-designed, accessible components and a code distribution platform. Works with your favorite frameworks. Open Source. Open Code."
rustdesk,rustdesk,Rust,118750,18102,126,2124,True,True,True,True,"An open-source remote desktop application designed for self-hosting, as an alternative to TeamViewer."
node,nodejs,JavaScript,118332,36090,2332,4257,True,True,True,True,Node.js JavaScript runtime ✨🐢🚀✨
free-programming-books-zh_CN,justjavac,,117795,28229,35,4645,True,True,False,True,:books: 免费的计算机编程类中文书籍，欢迎投稿
Awesome-Hacking,Hack-with-Github,,116788,10546,43,3767,False,True,True,True,"A collection of various awesome lists for hackers, pentesters and security researchers"
rust,rust-lang,Rust,114780,15191,12653,5881,True,True,True,True,Empowering everyone to build reliable and efficient software.
godot,godotengine,C++,114545,26089,18588,4583,True,True,True,True,Godot Engine – Multi-platform 2D and 3D game engine
three.js,mrdoob,JavaScript,113954,36443,387,5966,True,True,True,True,JavaScript 3D Library.
generative-ai-for-beginners,microsoft,Jupyter Notebook,113447,60896,6,1130,True,True,True,True,"21 Lessons, Get Started Building with Generative AI "
d3,d3,Shell,113265,22693,20,5778,False,False,True,True,"Bring data to life with SVG, Canvas and HTML. :bar_chart::chart_with_upwards_trend::tada:"
v2rayN,2dust,C#,112079,15571,10,2551,False,False,True,True,"A GUI client for Windows, Linux and macOS, support Xray and sing-box and others"
TypeScript,microsoft,TypeScript,109926,13560,5059,4419,True,True,True,True,TypeScript is a superset of JavaScript that compiles to clean JavaScript output.
ui-ux-pro-max-skill,nextlevelbuilder,Python,109510,11675,123,235,True,True,True,True,An AI SKILL that provide design intelligence for building professional UI/UX multiple platforms
tauri,tauri-apps,Rust,109399,3795,1421,2567,True,True,True,True,"Build smaller, faster, and more secure desktop and mobile applications with a web frontend."
axios,axios,JavaScript,109145,11777,64,4357,True,True,True,True,Promise based HTTP client for the browser and node.js
immich,immich-app,TypeScript,108593,6307,702,1631,True,True,True,True,High performance self-hosted photo and video management solution.
awesome-mac,jaywcjlove,Swift,108529,8188,515,3658,True,True,True,True, This project is dedicated to collecting high-quality macOS software and organizing them systematically by different categories for easy search and use.
frp,fatedier,Go,108308,15135,50,3867,False,False,True,True,A fast reverse proxy to help you expose a local server behind a NAT or firewall to the internet.
papers-we-love,papers-we-love,Shell,108076,6394,2,4603,True,True,True,True,Papers from the computer science community to read and discuss.
deno,denoland,Rust,107767,6196,1434,2992,True,True,True,True,A modern runtime for JavaScript and TypeScript.
supabase,supabase,TypeScript,106870,13229,1141,2477,True,True,True,True,"The Postgres development platform. Supabase gives you a dedicated Postgres database to build your web, mobile, and AI applications."
browser-use,browser-use,Python,106437,11705,327,630,False,True,True,True,🌐 Make websites accessible for AI agents. Automate tasks online with ease.
gemini-cli,google-gemini,TypeScript,106146,14307,1165,462,False,True,True,True,An open-source AI agent that brings the power of Gemini directly into your terminal.
whisper,openai,Python,105491,12813,133,1406,False,False,True,True,Robust Speech Recognition via Large-Scale Weak Supervision
nodebestpractices,goldbergyoni,Dockerfile,105447,10712,134,3233,False,False,True,True,✅ The Node.js best practices list (July 2026)
terminal,microsoft,C++,104328,9455,1750,3268,True,True,True,True,"The new Windows Terminal and the original Windows console host, all in the same place!"
awesome-design-md,VoltAgent,,104139,11938,306,114,False,True,True,True,A collection of DESIGN.md files analysis by popular brand design systems. Drop one into your project and let coding agents generate a matching UI.
DeepSeek-V3,deepseek-ai,Python,103985,16706,248,574,False,False,True,True,
create-react-app,react,JavaScript,103303,26932,2409,3658,True,True,True,True,Set up a modern web app by running one command.
pytorch,pytorch,Python,101899,28473,18272,3632,True,True,True,True,Tensors and Dynamic neural networks in Python with strong GPU acceleration
HowToCook,Anduin2017,,101334,11035,461,2336,True,False,True,True,Programmer's guide about how to cook at home.
neovim,neovim,Vim Script,101325,6983,1883,4556,False,True,True,True,Vim-fork focused on extensibility and usability
codex,openai,Rust,101059,15145,10688,467,False,True,True,True,Lightweight coding agent that runs in your terminal
fastapi,fastapi,Python,100813,9676,85,2784,False,True,True,True,"FastAPI framework, high performance, easy to learn, fast to code, ready for production"
angular,angular,TypeScript,100609,27291,1155,4326,True,True,True,True,Deliver web apps with confidence 🚀
every-programmer-should-know,mtdvio,,100150,8778,25,3255,False,True,False,True,A collection of (mostly) technical things every software developer should know about
LLMs-from-scratch,rasbt,Jupyter Notebook,99688,15312,4,1096,False,False,True,True,"Implement a ChatGPT-like LLM in PyTorch from scratch, step by step"
MoneyPrinterTurbo,harry0703,Python,98956,14645,6,865,False,False,True,True,利用 AI 大模型和自动化工作流，根据主题或关键词一键生成高清短视频。Generate HD short videos from a topic or keyword with an automated AI workflow.
ant-design,ant-design,TypeScript,98804,54671,1191,4108,True,True,True,True,An enterprise-class UI design language and React UI library
material-ui,mui,JavaScript,98627,32555,1499,4357,True,True,True,True,Material UI: Comprehensive React component library that implements Google's Material Design. Free forever.
weekly,ruanyf,,97765,4267,8453,2840,False,False,False,True,科技爱好者周刊，每周五发布
thefuck,nvbn,Python,97552,3954,453,4124,False,True,True,True,Magnificent app which corrects your previous console command.
app-ideas,florinpop17,,96144,10543,606,2705,True,True,True,True,A Collection of application ideas which can be used to improve your coding skills.
Web-Dev-For-Beginners,microsoft,JavaScript,96063,15688,89,2082,True,True,True,True,"24 Lessons, 12 Weeks, Get Started as a Web Developer"
tailwindcss,tailwindlabs,TypeScript,96032,5407,57,3212,False,True,True,True,A utility-first CSS framework for rapid UI development.
puppeteer,puppeteer,TypeScript,95335,9540,276,3362,False,True,True,True,JavaScript API for Chrome and Firefox
Deep-Live-Cam,hacksider,Python,95167,13854,51,1033,False,True,True,True,real time face swap and one-click video deepfake with only a single image
bun,oven-sh,Rust,94971,4898,8029,1927,True,True,True,True,"Incredibly fast JavaScript runtime, bundler, test runner, and package manager – all in one"
graphify,Graphify-Labs,Python,94755,9179,628,111,False,False,True,True,"Turn any codebase, with its docs, SQL schemas, configs, and PDFs, into a queryable knowledge graph. A /graphify skill for Claude Code, Cursor, Codex, and Gemini CLI: local deterministic AST parsing, every edge explained, no vector store."
clean-code-javascript,ryanmcdermott,JavaScript,94733,12513,123,3527,False,False,False,True,Clean Code concepts adapted for JavaScript
TradingAgents,TauricResearch,Python,94344,18228,302,573,False,False,True,True,TradingAgents: Multi-Agents LLM Financial Trading Framework
java-design-patterns,iluwatar,Java,94239,27371,148,4366,False,True,True,True,Design patterns implemented in Java
nvm,nvm-sh,Shell,94217,10275,388,5943,True,True,True,True,Node Version Manager - POSIX-compliant bash script to manage multiple active node.js versions
playwright,microsoft,TypeScript,93346,6140,167,2442,True,True,True,True,"Playwright is a framework for Web Testing and Automation. It allows testing Chromium, Firefox and WebKit with a single API. "
caveman,JuliusBrussee,JavaScript,92504,5247,422,110,True,True,True,True,🪨 why use many token when few token do trick — Claude Code skill that cuts 65% of tokens by talking like caveman
DeepSeek-R1,deepseek-ai,,91985,11708,41,549,False,False,True,True,
autoresearch,karpathy,Python,91934,13142,195,139,False,False,True,True,AI agents running research on single-GPU nanochat training automatically
awesome-mcp-servers,punkpeye,,91310,13491,2515,601,False,True,True,True,A collection of MCP servers.
storybook,storybookjs,TypeScript,90648,10237,1745,3780,True,True,True,True,"Storybook is the industry standard workshop for building, documenting, and testing UI components in isolation"
vue-element-admin,PanJiaChen,Vue,90240,30398,1402,3385,False,False,False,True,:tada: A magical vue admin                                                                https://panjiachen.github.io/vue-element-admin
opencv,opencv,C++,90111,56922,2761,5117,False,True,True,True,Open Source Computer Vision Library
bitcoin,bitcoin,C++,89662,39109,671,5695,False,True,True,True,Bitcoin Core integration/staging tree
uptime-kuma,louislam,JavaScript,89445,8157,758,1847,True,True,True,True,A fancy self-hosted monitoring tool
core,home-assistant,Python,89404,38087,3378,4692,True,True,True,True,:house_with_garden: Open source home automation that puts local control and privacy first.
mermaid,mermaid-js,TypeScript,89389,9140,1668,4282,True,True,True,True,Generation of diagrams like flowcharts or sequence diagrams from text in a similar manner as markdown
hugo,gohugoio,Go,89125,8300,236,4767,False,True,True,True,The world’s fastest framework for building websites.
gin,gin-gonic,Go,88946,8649,726,4420,True,True,True,True,"Gin is a high-performance HTTP web framework written in Go. It provides a Martini-like API but with significantly better performance—up to 40 times faster—thanks to httprouter. Gin is designed for building REST APIs, web applications, and microservices."
servers,modelcontextprotocol,TypeScript,88825,11279,679,612,True,True,True,True,Model Context Protocol Servers
manim,3b1b,Python,88815,7406,493,4141,False,False,True,True,Animation engine for explanatory math videos
NextChat,ChatGPTNextWeb,TypeScript,88542,59382,845,1231,True,False,True,True,✨ Light and Fast AI Assistant. Support: Web | iOS | MacOS | Android |  Linux | Windows
ponytail,DietrichGebert,JavaScript,88538,4844,101,42,False,False,True,True,Makes your AI agent think like the laziest senior dev in the room. The best code is the code you never wrote.
ML-For-Beginners,microsoft,Jupyter Notebook,88516,21617,2,1969,True,True,True,True,"12 weeks, 26 lessons, 52 quizzes, classic Machine Learning for all"
claude-mem,thedotmack,JavaScript,88395,7673,268,326,False,False,True,True,"Persistent Context Across Sessions for Every Agent –  Captures everything your agent does during sessions, compresses it with AI, and injects relevant context back into future sessions. Works with Claude Code, OpenClaw, Codex, Gemini, Hermes, Copilot, OpenCode + More"
django,django,Python,88189,33969,450,5200,True,True,True,True,The Web framework for perfectionists with deadlines.
Stirling-PDF,Stirling-Tools,Java,87885,7781,511,1273,False,True,True,True,#1 PDF Application on GitHub that lets you edit PDFs on any device anywhere
uv,astral-sh,Rust,87812,3369,2804,1025,True,True,True,True,"An extremely fast Python package and project manager, written in Rust."
awesome-for-beginners,MunGell,,87690,7951,139,3925,False,True,True,True,A list of awesome beginners-friendly projects.
svelte,sveltejs,JavaScript,87651,5053,1094,3532,True,True,True,True,web development for the rest of us
zed,zed-industries,Rust,87456,9682,3260,1980,True,True,True,True,"Code at the speed of thought – Zed is a high-performance, multiplayer code editor from the creators of Atom and Tree-sitter."
vllm,vllm-project,Python,87016,19787,6006,1260,True,True,True,True,A high-throughput and memory-efficient inference and serving engine for LLMs
sherlock,sherlock-project,Python,87003,10205,319,2768,True,False,True,True,Hunt down social media accounts by username across social networks
syncthing,syncthing,Go,86848,5381,400,4622,False,True,True,True,Open Source Continuous File Synchronization
