repo_name,organization,language,stars,forks,open_issues,age_days,has_coc,has_contributing,has_workflows,has_readme,description
paperclip,paperclipai,TypeScript,70231,13037,4956,102,False,True,True,True,The open-source app everyone uses to manage agents at work
swift,swiftlang,Swift,70051,10736,9041,3885,True,True,True,True,The Swift Programming Language
anime,juliangarnier,JavaScript,69833,4712,109,3743,False,True,True,True,JavaScript animation engine
ghidra,NationalSecurityAgency,Java,69584,7635,1884,2661,False,True,True,True,Ghidra is a software reverse engineering (SRE) framework
odysseus,pewdiepie-archdaemon,Python,69502,8782,1282,12,False,True,True,True,Self-hosted AI workspace. 
AFFiNE,toeverything,TypeScript,69327,4923,628,1412,True,True,True,True,"There can be more than Notion and Miro. AFFiNE(pronounced [ə‘fain]) is a next-gen knowledge base that brings planning, sorting and creating all together. Privacy first, open-source, customizable and ready to use. "
express,expressjs,JavaScript,69160,23675,216,6195,True,True,True,True,"Fast, unopinionated, minimalist web framework for node."
OpenBB,OpenBB-finance,Python,69035,6952,70,2000,True,False,True,True,"Financial data platform for analysts, quants and AI agents."
awesome-courses,prakhar1989,,69020,8371,63,4227,False,True,False,True,:books: List of awesome university courses for learning Computer Science!
ansible,ansible,Python,68886,24090,785,5211,True,True,True,True,"Ansible is a radically simple IT automation platform that makes your applications and systems easier to deploy and maintain. Automate everything from code deployment to network configuration to cloud management, in a language that approaches plain English, using SSH, with no agents to install on remote systems. https://docs.ansible.com."
MetaGPT,FoundationAgents,Python,68758,8786,125,1078,False,False,True,True,"🌟 The Multi-Agent Framework: First AI Software Company, Towards Natural Language Programming"
node,base,Shell,68525,3244,36,1227,False,True,True,True,Everything required to run your own Base node
crawl4ai,unclecode,Python,68361,6981,96,764,True,True,True,True,"🚀🤖 Crawl4AI: Open-source LLM Friendly Web Crawler & Scraper. Don't be shy, join here: https://discord.gg/jP8KfhDhyN"
Apollo-11,chrislgarry,Assembly,68065,7696,132,4453,False,True,True,True,Original Apollo 11 Guidance Computer (AGC) source code for the command and lunar modules.
Chart.js,chartjs,JavaScript,67487,11942,568,4835,False,False,True,True,Simple HTML5 Charts using the <canvas> tag
MinerU,opendatalab,Python,67391,5675,21,834,False,False,True,True,Transforms complex documents like PDFs and Office docs into LLM-ready markdown/JSON for your Agentic workflows.
ai-agents-for-beginners,microsoft,Jupyter Notebook,67104,22147,28,561,True,False,True,True,12 Lessons to Get Started Building AI Agents
annotated_deep_learning_paper_implementations,labmlai,Python,66925,6708,32,2118,False,False,True,True,"🧑‍🏫 60+ Implementations/tutorials of deep learning papers with side-by-side notes 📝; including transformers (original, xl, switch, feedback, vit, ...), optimizers (adam, adabelief, sophia, ...), gans(cyclegan, stylegan2, ...), 🎮 reinforcement learning (ppo, dqn), capsnet, distillation, ... 🧠"
echarts,apache,TypeScript,66574,19798,1616,4819,True,True,True,True,"Apache ECharts is a powerful, interactive charting and data visualization library for browser"
33-js-concepts,leonardomso,JavaScript,66468,9167,2,2838,True,True,True,True,📜 33 JavaScript concepts every developer should know.
graphify,safishamsi,Python,66379,6715,350,70,False,False,True,True,"AI coding assistant skill (Claude Code, Codex, OpenCode, Cursor, Gemini CLI, and more). Turn any folder of code, SQL schemas, R scripts, shell scripts, docs, papers, images, or videos into a queryable knowledge graph. App code + database schema + infrastructure in one graph."
unsloth,unslothai,Python,66376,5944,1301,926,True,True,True,True,"Unsloth Studio is a web UI for training and running open models like Gemma 4, Qwen3.6, DeepSeek, gpt-oss locally."
learn-claude-code,shareAI-lab,Python,66329,10809,69,348,False,False,True,True,"Bash is all you need -  A nano claude code–like 「agent harness」, built from 0 to 1"
gpt4free,xtekky,Python,66325,13575,3,1171,True,True,True,True,The official gpt4free repository | various collection of powerful language models | opus 4.6 gpt 5.3 kimi 2.5 deepseek v3.2 gemini 3
scikit-learn,scikit-learn,Python,66312,27059,2059,5778,True,True,True,True,scikit-learn: machine learning in Python
MiroFish,666ghj,Python,66258,10314,309,199,False,False,True,True,"A Simple and Universal Swarm Intelligence Engine, Predicting Anything. 简洁通用的群体智能引擎，预测万物"
design-resources-for-developers,bradtraversy,,66016,12087,39,2228,False,True,True,True,"Curated list of design and UI resources from stock photos, web templates, CSS frameworks, UI libraries, tools and much more"
awesome-nodejs,sindresorhus,,65938,6225,26,4354,True,True,True,True,":zap: Delightful Node.js packages and resources [BECAUSE OF TOO MUCH SPAM AND LOW-QUALITY SUBMISSIONS, SUBMISSIONS ARE PAUSED UNTIL JULY]"
Java,TheAlgorithms,Java,65831,21203,21,3618,True,True,True,True,All Algorithms implemented in Java
webpack,webpack,JavaScript,65797,9350,184,5207,True,True,True,True,"A bundler for javascript and friends. Packs many modules into a few bundled assets. Code Splitting allows for loading parts of the application on demand. Through ""loaders"", modules can be CommonJs, AMD, ES6 modules, CSS, Images, JSON, Coffeescript, LESS, ... and your custom stuff."
uBlock,gorhill,JavaScript,65440,4162,17,4090,False,True,True,True,uBlock Origin - An efficient blocker for Chromium and Firefox. Fast and lean.
nocode,kelseyhightower,Dockerfile,65387,4823,4713,3048,False,True,False,True,The best way to write secure and reliable applications. Write nothing; deploy nowhere.
javascript-questions,lydiahallie,,65323,9218,51,2557,False,False,False,True,"A long list of (advanced) JavaScript questions, and their explanations :sparkles:  "
docusaurus,facebook,TypeScript,65192,9925,398,3279,True,True,True,True,Easy to maintain open source documentation websites.
localstack,localstack,Python,65043,4733,0,3517,True,True,True,True,💻 A fully functional local AWS cloud stack. Develop and test your cloud & Serverless apps offline
ripgrep,BurntSushi,Rust,65007,2592,200,3746,False,True,True,True,ripgrep recursively searches directories for a regex pattern while respecting your gitignore
interviews,kdn251,Java,64952,12886,120,3405,False,False,False,True,Everything you need to know to get the job.
30-Days-Of-Python,Asabeneh,Python,64686,12160,142,2397,False,False,True,True,The 30 Days of Python programming challenge is a step-by-step guide to learn the Python programming language in 30 days. This challenge may take more than 100 days. Follow your own pace. These videos may help too: https://www.youtube.com/channel/UC7PNRuno1rzYPb1xLa4yktw
alacritty,alacritty,Rust,64540,3492,339,3768,False,True,True,True,"A cross-platform, OpenGL terminal emulator."
prometheus,prometheus,Go,64474,10502,836,4948,True,True,True,True,The Prometheus monitoring system and time series database.
awesome-claude-skills,ComposioHQ,Python,64361,7115,801,238,False,True,True,True,"A curated list of awesome Claude Skills, resources, and tools for customizing Claude AI workflows"
get-shit-done,gsd-build,JavaScript,64181,5462,7,180,False,True,True,True,"A light-weight and powerful meta-prompting, context engineering and spec-driven development system for Claude Code by TÂCHES."
keras,keras-team,Python,64085,19733,176,4095,False,True,True,True,Deep Learning for humans
open-design,nexu-io,TypeScript,64071,7144,407,46,False,True,True,True,"🎨 Local-first, open-source Claude Design alternative. 🖥️ Native desktop app. ⚡ 259+ Skills · ✨ 142+ Design Systems 🖼️ Web · desktop · mobile prototypes · slides · images · videos · HyperFrames 📦 Sandboxed preview · HTML/PDF/PPTX/MP4 export 🤖 Claude Code / OpenClaw / Codex / Cursor / OpenCode / Qwen / Copilot / Hermes / Kimi & 17+ CLIs."
ladybird,LadybirdBrowser,C++,64063,3078,532,743,True,True,True,True,Truly independent web browser
openinterpreter,openinterpreter,Python,63885,5541,336,1064,False,True,True,True,"A lightweight coding agent for open models like Deepseek, Kimi, and Qwen"
traefik,traefik,Go,63598,6045,852,3925,True,True,True,True,The Cloud Native Application Proxy
nocodb,nocodb,TypeScript,63416,4839,711,3148,True,True,True,True,🔥 🔥 🔥 A Free & Self-hostable Airtable Alternative
Scrapling,D4Vinci,Python,63341,6174,6,607,True,True,True,True,🕷️ An adaptive Web Scraping framework that handles everything from a single request to a full-scale crawl!
nerd-fonts,ryanoasis,CSS,63332,3900,76,4208,True,True,True,True,"Iconic font aggregator, collection, & patcher. 3,600+ icons, 50+ patched fonts: Hack, Source Code Pro, more. Glyph collections: Font Awesome, Material Design Icons, Octicons, & more"
rustlings,rust-lang,Rust,63205,11201,38,3924,False,True,True,True,:crab: Small exercises to get you used to reading and writing Rust code!
cline,cline,TypeScript,63153,6667,1070,706,True,True,True,True,"Autonomous coding agent as an SDK, IDE extension, or CLI assistant."
socket.io,socketio,TypeScript,63145,10133,178,5937,False,True,True,True,Bidirectional and low-latency communication for every platform
pathway,pathwaycom,Python,63009,1679,38,1293,True,True,True,True,"Python ETL framework for stream processing, real-time analytics, LLM pipelines, and RAG."
resume.github.com,resume,JavaScript,62865,1369,76,5605,False,False,False,True,Resumes generated using the GitHub informations
tldr,tldr-pages,Markdown,62845,5296,302,4569,False,True,True,True,Collaborative cheatsheets for console commands 📚.
vaultwarden,dani-garcia,Rust,62289,2897,52,3037,False,False,True,True,"Unofficial Bitwarden compatible server written in Rust, formerly known as bitwarden_rs"
scrapy,scrapy,Python,62223,11644,620,5955,True,True,True,True,"Scrapy, a fast high-level web crawling & scraping framework for Python."
pi,earendil-works,TypeScript,62129,7515,47,307,False,True,True,True,"AI agent toolkit: unified LLM API, agent loop, TUI, coding agent CLI"
oh-my-openagent,code-yeongyu,TypeScript,62047,5026,676,192,False,True,True,True,"omo/lazycodex: The coding agent for tokenmaxxers;the one and only agent harness for complex codebases. For your Codex, for your OpenCode"
rtk,rtk-ai,Rust,61976,3819,1204,141,False,True,True,True,"CLI proxy that reduces LLM token consumption by 60-90% on common dev commands. Single Rust binary, zero dependencies"
leetcode-master,youngyangyang04,Shell,61663,12330,247,2372,False,False,False,True,《代码随想录》LeetCode 刷题攻略：200道经典题目刷题顺序，共60w字的详细图解，视频难点剖析，50余张思维导图，支持C++，Java，Python，Go，JavaScript等多语言版本，从此算法学习不再迷茫！🔥🔥 来看看，你会发现相见恨晚！🚀 
warp,warpdotdev,Rust,61638,4984,4350,1800,True,True,True,True,"Warp is an agentic development environment, born out of the terminal."
sway,FuelLabs,Rust,61635,5421,917,1970,False,False,True,True,🌴 Empowering everyone to build reliable and efficient smart contracts.
drawio-desktop,jgraph,JavaScript,61575,5695,71,3305,True,False,True,True,Official electron build of draw.io
anything-llm,Mintplex-Labs,JavaScript,61511,6693,330,1105,False,True,True,True,Stop renting your intelligence. Own it with AnythingLLM. Everything you need for a powerful local-first agent experience 
redux,reduxjs,TypeScript,61486,15057,47,4032,True,True,True,True,A JS library for predictable global state management
git,git,C,61479,28007,376,6533,True,True,True,True,Git Source Code Mirror - This is a publish-only repository but pull requests can be turned into patches to the mailing list via GitGitGadget (https://gitgitgadget.github.io/). Please follow Documentation/SubmittingPatches procedure for any of your improvements.
docling,docling-project,Python,61474,4299,931,703,True,True,True,True,Get your documents ready for gen AI
openpilot,commaai,Python,61354,10976,149,3488,False,True,True,True,"openpilot is an operating system for robotics. Currently, it upgrades the driver assistance system on 300+ supported cars."
lodash,lodash,JavaScript,61232,7173,152,5180,False,True,True,True,"A modern JavaScript utility library delivering modularity, performance, & extras."
minio,minio,Go,61179,7583,81,4167,True,True,True,True,"MinIO is a high-performance, S3 compatible object store, open sourced under GNU AGPLv3 license."
FFmpeg,FFmpeg,C,61042,13902,3,5538,False,True,False,True,Mirror of https://git.ffmpeg.org/ffmpeg.git
Magisk,topjohnwu,Kotlin,60916,17673,64,3564,False,False,True,True,The Magic Mask for Android
Front-end-Developer-Interview-Questions,h5bp,Nunjucks,60886,11034,61,5237,True,True,True,True,"A list of helpful front-end related questions you can use to interview potential candidates, test yourself or completely ignore."
architect-awesome,xingshaocheng,,60820,17690,63,2989,False,False,False,True,后端架构师技术图谱
atom,atom,JavaScript,60801,17219,994,5257,True,True,False,True,:atom: The hackable text editor
memos,usememos,Go,60704,4464,26,1647,False,False,True,True,"Open-source, self-hosted note-taking tool built for quick capture. Markdown-native, lightweight, and fully yours."
awesome-chatgpt-prompts-zh,PlexPt,,60621,13571,45,1279,False,False,False,True,ChatGPT 中文调教指南。各种场景使用指南。学习怎么让它听你的话。
nuxt,nuxt,TypeScript,60428,5669,810,3516,True,True,True,True,the full-stack Vue framework
awesome-flutter,Solido,Dart,60303,6892,35,3323,False,True,True,True,"An awesome list that curates the best Flutter libraries, tools, tutorials, articles and more."
markdown-here,adam-p,JavaScript,60214,11056,318,5144,False,True,False,True,"Google Chrome, Firefox, and Thunderbird extension that lets you write email in Markdown and render it before sending."
astro,withastro,TypeScript,60099,3538,154,1915,True,True,True,True,The web framework for content-driven websites. ⭐️ Star to support our work!
spring-framework,spring-projects,Java,60024,38824,434,5666,True,True,True,True,Spring Framework
ai-hedge-fund,virattt,Python,60009,10605,142,560,False,False,True,True,An AI Hedge Fund Team
Real-Time-Voice-Cloning,CorentinJ,Python,59906,9407,171,2574,False,False,True,True,Clone a voice in 5 seconds to generate arbitrary speech in real-time
jquery,jquery,JavaScript,59830,20413,96,6279,True,True,True,True,jQuery JavaScript Library
shadowsocks-windows,shadowsocks,C#,59565,16253,202,4897,False,True,False,True,A C# port of shadowsocks
nanoGPT,karpathy,Python,59536,10267,347,1263,False,False,False,True,"The simplest, fastest repository for training/finetuning medium-sized GPTs."
llama,meta-llama,Python,59452,9789,520,1214,True,True,True,True,Inference code for Llama models
TrendRadar,sansan0,Python,59372,24637,45,410,False,False,True,True,"⭐AI-driven public opinion & trend monitor with multi-platform aggregation, RSS, and smart alerts.🎯 告别信息过载，你的 AI 舆情监控助手与热点筛选工具！聚合多平台热点 +  RSS 订阅，支持关键词精准筛选。AI 智能筛选新闻 + AI 翻译 +  AI 分析简报直推手机，也支持接入 MCP 架构，赋能 AI 自然语言对话分析、情感洞察与趋势预测等。支持 Docker ，数据本地/云端自持。集成微信/飞书/钉钉/Telegram/邮件/ntfy/bark/slack 等渠道智能推送。"
llm-app,pathwaycom,Jupyter Notebook,59333,1419,10,1059,True,True,True,True,"Ready-to-run cloud templates for RAG, AI pipelines, and enterprise search with live data. 🐳Docker-friendly.⚡Always in sync with Sharepoint, Google Drive, S3, Kafka, PostgreSQL, real-time data APIs, and more."
pi-hole,pi-hole,Shell,59250,3224,45,4387,True,True,True,True,A black hole for Internet advertisements
bat,sharkdp,Rust,59244,1564,404,2974,False,True,True,True,A cat(1) clone with wings.
ruflo,ruvnet,TypeScript,59196,6830,640,375,False,False,True,True,"🌊 The leading agent meta-harness for Claude. Deploy intelligent multi-agent swarms, coordinate autonomous workflows, and build conversational AI systems. Features adaptive memory, self-learning swarm intelligence, RAG integration, and native Claude Code / Codex Integration"
mkcert,FiloSottile,Go,59076,3125,169,2910,True,True,True,True,A simple zero-config tool to make locally trusted development certificates with any names you'd like.
pocketbase,pocketbase,Go,59063,3458,18,1439,False,True,True,True,Open Source realtime backend in 1 file
autogen,microsoft,Python,58914,8895,884,1029,True,True,True,True,A programming framework for agentic AI
hello-agents,datawhalechina,Python,58809,7214,147,278,False,False,True,True,📚 《从零开始构建智能体》——从零开始的智能体原理与实践教程
rails,rails,Ruby,58666,22161,1489,6637,True,True,True,True,Ruby on Rails
GPT-SoVITS,RVC-Boss,Python,58628,6413,875,880,False,False,True,True,1 min voice data can also be used to train a good TTS model! (few shot voice cloning)
angular.js,angular,JavaScript,58603,27104,461,6002,True,True,False,True,AngularJS - HTML enhanced for web apps!
mem0,mem0ai,Python,58460,6714,374,1088,False,True,True,True,Universal memory layer for AI Agents
ultralytics,ultralytics,Python,58339,11188,328,1370,True,True,True,True,Ultralytics YOLO 🚀
zustand,pmndrs,TypeScript,58278,2067,4,2621,False,True,True,True,🐻 Bear necessities for state management in React
starship,starship,Rust,58249,2555,1017,2629,True,True,True,True,"☄🌌️  The minimal, blazing-fast, and infinitely customizable prompt for any shell!"
Understand-Anything,Egonex-AI,TypeScript,58197,4845,191,90,True,True,True,True,"Graphs that teach > graphs that impress. Turn any code into an interactive knowledge graph you can explore, search, and ask questions about. Works with Claude Code, Codex, Cursor, Copilot, Gemini CLI, and more."
meilisearch,meilisearch,Rust,58074,2564,308,2972,True,True,True,True,A lightning-fast search engine API bringing AI-powered hybrid search to your sites and applications.
v2rayNG,2dust,Kotlin,57989,7575,13,2586,False,False,True,True,"A V2Ray client for Android, support Xray core and v2fly core"
awesome-rust,rust-unofficial,Rust,57837,3420,9,4348,False,True,True,True,A curated list of Rust code and resources.
rclone,rclone,Go,57826,5148,1198,4471,True,True,True,True,"""rsync for cloud storage"" - Google Drive, S3, Dropbox, Backblaze B2, One Drive, Swift, Hubic, Wasabi, Google Cloud Storage, Azure Blob, Azure Files, Yandex Files"
claude-code-best-practice,shanraisshan,HTML,57570,5781,9,224,False,False,True,True,from vibe coding to agentic engineering - practice makes claude perfect
yolov5,ultralytics,Python,57518,17468,41,2217,True,True,True,True,Ultralytics YOLOv5 in PyTorch > ONNX > CoreML > TFLite
html5-boilerplate,h5bp,JavaScript,57489,12294,31,5983,True,True,True,True,"A professional front-end template for building fast, robust, and adaptable web apps or sites."
DeepLearning-500-questions,scutan90,JavaScript,57432,15919,120,2908,False,False,False,True,深度学习500问，以问答形式对常用的概率知识、线性代数、机器学习、深度学习、计算机视觉等热点问题进行阐述，以帮助自己及有需要的读者。 全书分为18个章节，50余万字。由于水平有限，书中不妥之处恳请广大读者批评指正。   未完待续............ 如有意合作，联系scutjy2015@163.com                     版权所有，违权必究       Tan 2018.06
github-cheat-sheet,tiimgreen,,57338,5426,48,4444,False,True,False,True,A list of cool features of Git and GitHub.
marktext,marktext,TypeScript,57299,4293,1088,3134,False,True,True,True,"📝A simple and elegant markdown editor, available for Linux, macOS and Windows."
context7,upstash,TypeScript,57261,2702,15,443,False,False,True,True,Context7 Platform -- Up-to-date code documentation for LLMs and AI code editors
private-gpt,zylon-ai,Python,57240,7605,4,1137,False,False,True,True,"Interact with your documents using the power of GPT, 100% privately, no data leaks"
agent-skills,addyosmani,Shell,57123,6168,131,117,False,True,True,True,Production-grade engineering skills for AI coding agents.
fuel-core,FuelLabs,Rust,57017,2864,195,2115,False,True,True,True,Rust full node implementation of the Fuel v2 protocol.
coolify,coollabsio,PHP,56892,4763,795,1964,True,True,True,True,"An open-source, self-hostable PaaS alternative to Vercel, Heroku & Netlify that lets you easily deploy static sites, databases, full-stack applications and 280+ one-click services on your own servers."
you-get,soimort,Python,56838,9733,384,5044,False,True,True,True,:arrow_double_down: Dumb downloader that scrapes the web
rich,Textualize,Python,56620,2175,344,2406,True,True,True,True,Rich is a Python library for rich text and beautiful formatting in the terminal.
OpenManus,FoundationAgents,Python,56537,9839,531,463,True,False,True,True,"No fortress, purely open ground.  OpenManus is Coming."
face_recognition,ageitgey,Python,56488,13701,837,3388,False,True,True,True,The world's simplest facial recognition api for Python and the command line
react-router,remix-run,TypeScript,56437,10867,133,4410,True,True,True,True,Declarative routing for React
awesome-android-ui,wasabeef,,56417,10249,39,4189,True,False,False,True,A curated list of awesome Android UI/UX libraries
ghostty,ghostty-org,Zig,56394,2889,246,1536,False,True,True,True,"👻 Ghostty is a fast, feature-rich, and cross-platform terminal emulator that uses platform-native UI and GPU acceleration."
worldmonitor,koala73,TypeScript,56366,9010,165,155,True,True,True,True,"Real-time global intelligence dashboard. AI-powered news aggregation, geopolitical monitoring, and infrastructure tracking in a unified situational awareness interface"
termux-app,termux,Java,56312,6761,552,3885,False,False,True,True,Termux - a terminal emulator application for Android OS extendible by variety of packages.
appwrite,appwrite,TypeScript,56295,5440,967,2622,True,True,True,True,"Appwrite® - complete cloud infrastructure for your web, mobile and AI apps. Including Auth, Databases, Storage, Functions, Messaging, Hosting, Realtime and more"
gitea,go-gitea,Go,56264,6787,2757,3511,True,True,True,True,"Git with a cup of tea! Painless self-hosted all-in-one software development service, including Git hosting, code review, team collaboration, package registry and CI/CD"
project-layout,golang-standards,Makefile,56110,5443,94,3198,False,False,True,True,Standard Go Project Layout
gatsby,gatsbyjs,JavaScript,55934,10170,392,4040,True,True,True,True,"React-based framework with performance, scalability, and security built in."
winutil,ChrisTitusTech,PowerShell,55858,3177,45,1507,True,True,True,True,"Chris Titus Tech's Windows Utility - Install Programs, Tweaks, Fixes, and Updates"
leetcode,azl397985856,JavaScript,55760,9410,10,2996,False,True,False,True,LeetCode Solutions: A Record of My Problem Solving Journey.( leetcode题解，记录自己的leetcode解题之路。)
Mole,tw93,Shell,55729,1939,3,263,False,True,True,True,"🐹 Clean, uninstall, analyze, optimize, and monitor your Mac from the terminal."
OpenCut,OpenCut-app,TypeScript,55552,6047,324,355,True,False,True,True,The open-source CapCut alternative
mempalace,MemPalace,Python,55493,7200,604,69,False,True,True,True,The best-benchmarked open-source AI memory system. And it's free.
faceswap,deepfakes,Python,55276,13365,8,3097,True,False,True,True,Deepfakes Software For All
gpt-engineer,AntonOsika,Python,55206,7313,71,1140,True,True,True,True,CLI platform to experiment with codegen. Precursor to: https://lovable.dev
joplin,laurent22,TypeScript,55177,6139,567,3434,False,True,True,True,"Joplin - the privacy-focused note taking app with sync capabilities for Windows, macOS, Linux, Android and iOS."
n8n-workflows,Zie619,Python,55106,7297,29,394,False,False,True,True,all of the workflows of n8n i could find (also from the site itself)
nanochat,karpathy,Python,54965,7487,108,242,False,False,True,True,The best ChatGPT that $100 can buy.
OpenSpec,Fission-AI,TypeScript,54559,3823,402,311,False,False,True,True,Spec-driven development (SDD) for AI coding assistants.
first-contributions,firstcontributions,,54452,104174,95,3552,True,True,True,True,🚀✨ Help beginners to contribute to open source projects
powerlevel10k,romkatv,Shell,54430,2422,147,2665,False,False,False,True,A Zsh theme
ChatGPT,lencx,Rust,54383,6156,938,1283,False,False,True,True,"🔮 ChatGPT Desktop Application (Mac, Windows and Linux)"
segment-anything,facebookresearch,Jupyter Notebook,54342,6355,594,1177,True,True,True,True,"The repository provides code for running inference with the SegmentAnything Model (SAM), links for downloading the trained model checkpoints, and example notebooks that show how to use the model."
dive,wagoodman,Go,54220,1980,203,2952,False,False,True,True,A tool for exploring each layer in a docker image
typst,typst,Rust,54196,1601,1247,2453,False,True,True,True,A markup-based typesetting system that is powerful and easy to learn.
maybe,maybe-finance,Ruby,54161,5597,0,893,False,True,True,True,The personal finance app for everyone
trackerslist,ngosang,,54133,6597,5,3701,False,False,True,True,Updated list of public BitTorrent trackers
element,ElemeFE,Vue,54119,14457,2970,3570,False,False,True,True,A Vue.js 2.0 UI Toolkit for Web
requests,psf,Python,54039,9968,228,5598,True,True,True,True,"A simple, yet elegant, HTTP library."
Ghost,TryGhost,JavaScript,53902,11706,171,4787,True,True,True,True,"Independent technology for modern publishing, memberships, subscriptions and newsletters."
