repo_name,organization,language,stars,forks,open_issues,age_days,has_coc,has_contributing,has_workflows,has_readme,description
TTS,coqui-ai,Python,45801,6151,5,2255,True,True,True,True,"🐸💬 - a deep learning toolkit for Text-to-Speech, battle-tested in research and production"
architecture-samples,android,Kotlin,45764,11862,222,3821,False,True,True,True,A collection of samples to discuss and showcase different architectural tools and patterns for Android apps.
iina,iina,Swift,45681,2874,1913,3503,False,True,True,True,The modern video player for macOS.
zx,google,JavaScript,45623,1277,54,1906,True,True,True,True,A tool for writing better scripts
helix,helix-editor,Rust,45571,3627,1555,2244,False,True,True,True,A post-modern modal text editor.
pandoc,jgm,Haskell,45535,3921,1047,5969,False,True,True,True,Universal markup converter
AdminLTE,ColorlibHQ,Astro,45527,18187,0,4594,True,True,True,True,AdminLTE - Free admin dashboard template based on Bootstrap 5
Summer2026-Internships,SimplifyJobs,Python,45494,3201,54,2252,False,True,True,True,"Summer 2026 software engineering, data science, AI, quant, product management, and hardware internship postings. Updated daily by Simplify and Pitt CSC."
jest,jestjs,TypeScript,45454,6712,232,4609,True,True,True,True,Delightful JavaScript Testing.
cli,cli,Go,45385,8752,1031,2485,True,True,True,True,GitHub’s official command line tool
Leaflet,Leaflet,JavaScript,45384,6143,547,5783,True,True,True,True,🍃 JavaScript library for mobile-friendly interactive maps 🇺🇦
siyuan,siyuan-note,TypeScript,45381,2914,274,2153,True,True,True,True,"A privacy-first, self-hosted, fully open source personal knowledge management software, written in typescript and golang."
RSSHub,DIYgod,TypeScript,45370,10035,344,3034,True,True,True,True,🧡 Everything is RSSible
milvus,milvus-io,Go,45359,4137,1139,2502,True,True,True,True,"Milvus is a high-performance, cloud-native vector database built for scalable vector ANN search"
TrafficMonitor,zhongyang219,C++,45347,3732,1322,3281,False,False,True,True,这是一个用于显示当前网速、CPU及内存利用率的桌面悬浮窗软件，并支持任务栏显示，支持更换皮肤。
streamlit,streamlit,Python,45328,4331,1206,2526,True,True,True,True,Streamlit — A faster way to build and share data apps.
grpc,grpc,C++,45203,11240,1355,4245,True,True,True,True,"C++ based gRPC (C++, Python, Ruby, Objective-C, PHP, C#)"
CppCoreGuidelines,isocpp,CSS,45199,5549,251,3991,False,True,True,True,"The C++ Core Guidelines are a set of tried-and-true guidelines, rules, and best practices about coding in C++"
edex-ui,GitSquared,JavaScript,45002,3157,6,3463,False,False,True,True,"A cross-platform, customizable science fiction terminal emulator with advanced monitoring & touchscreen support."
pyenv,pyenv,Shell,44973,3262,55,5074,False,True,True,True,Simple Python version management
react-hook-form,react-hook-form,TypeScript,44804,2455,10,2697,True,True,True,True,📋 React Hooks for form state management and validation (Web + React Native)
meteor,meteor,JavaScript,44802,5242,421,5300,True,True,True,True,"Meteor, the JavaScript App Platform"
dive-into-llms,Lordog,Jupyter Notebook,44755,5368,14,836,False,False,False,True,《动手学大模型Dive into LLMs》系列编程实践教程
reactjs-interview-questions,sudheerj,JavaScript,44698,10366,8,2975,False,False,True,True,List of top 500 ReactJS Interview Questions & Answers....Coding exercise questions are coming soon!!
hyper,vercel,TypeScript,44668,3570,1045,3675,False,False,True,True,A terminal built on web technologies
system-design,karanpratapsingh,,44626,5809,3,1438,True,True,False,True,Learn how to design systems at scale and prepare for system design interviews
GitNexus,abhigyanpatwari,TypeScript,44584,4946,279,355,False,True,True,True,"GitNexus: The Zero-Server Code Intelligence Engine -       GitNexus is a client-side knowledge graph creator that runs entirely in your browser. Drop in a git repository (Github, Gitlab, Azure, Local) or ZIP file, and get an interactive knowledge graph with a built in Graph RAG Agent. Perfect for code exploration"
CLIProxyAPI,router-for-me,Go,44522,6974,368,387,False,False,True,True,"Wrap Antigravity, ChatGPT Codex, Claude Code, Grok Build as an OpenAI/Gemini/Claude/Codex compatible API service, allowing you to enjoy the free Gemini 3.1 Pro, GPT 5.5, Grok 4.3, Claude model through API"
mitmproxy,mitmproxy,Python,44430,4640,447,6002,True,True,True,True,An interactive TLS-capable intercepting HTTP proxy for penetration testers and software developers.
Files,files-community,C#,44412,2795,467,2757,True,True,True,True,A modern file manager that helps users organize their files and folders.
full-stack-fastapi-template,fastapi,TypeScript,44404,8822,17,2707,False,True,True,True,"Full stack, modern web application template. Using FastAPI, React, SQLModel, PostgreSQL, Docker, GitHub Actions, automatic HTTPS and more."
sentry,getsentry,Python,44370,4768,2132,5806,True,True,True,True,Developer-first error tracking and performance monitoring
cobra,spf13,Go,44304,3175,406,4706,False,True,True,True,A Commander for modern Go CLI interactions
EasySpider,NaiboWang,JavaScript,44285,5380,269,2197,False,False,True,True,A visual no-code/code-free web crawler/spider易采集：一个可视化浏览器自动化测试/数据采集/网页爬虫软件，可以无代码图形化的设计和执行爬虫任务。别名：ServiceWrapper面向Web应用的智能化服务封装系统。
jsoncrack.com,AykutSarac,TypeScript,44265,3568,36,1635,True,True,True,True,"✨ Innovative and open-source visualization application that transforms various data formats, such as JSON, YAML, XML and CSV into interactive graphs."
react-bits,DavidHDev,JavaScript,44066,2080,2,716,False,True,True,True,"An open source collection of animated, interactive & fully customizable React components for building memorable websites."
logseq,logseq,Clojure,44051,2736,932,2253,True,True,True,True,"A privacy-first, open-source platform for knowledge management and collaboration. Download link:  http://github.com/logseq/logseq/releases. roadmap: https://logseq.io/p/NX4mc_ggEV"
parcel,parcel-bundler,JavaScript,44033,2286,603,3272,True,True,True,True,The zero configuration build tool for the web. 📦🚀
react-use,streamich,TypeScript,44005,3266,662,2826,False,True,True,True,React Hooks — 👍
data-engineering-zoomcamp,DataTalksClub,Jupyter Notebook,43984,8647,1,1736,False,False,True,True,Data Engineering Zoomcamp is a free 9-week course on building production-ready data pipelines. The next cohort starts in January 2026. Join the course here 👇🏼
front-end-interview-handbook,yangshun,MDX,43981,5936,12,3113,True,True,True,True,Front End interview preparation materials for busy engineers (updated for 2026)
babel,babel,TypeScript,43951,5887,765,4316,True,True,True,True,🐠 Babel is a compiler for writing next generation JavaScript.
retrofit,lysine-dev,Java,43920,7335,171,5799,False,True,True,True,A type-safe HTTP client for Android and the JVM
build-web-application-with-golang,astaxie,Go,43917,10445,138,5103,False,False,False,True,A golang ebook intro how to build a web with golang
bubbletea,charmbracelet,Go,43908,1272,195,2386,False,True,True,True,A powerful little TUI framework 🏗
fd,sharkdp,Rust,43854,1100,180,3362,False,True,True,True,"A simple, fast and user-friendly alternative to 'find'"
kong,Kong,Lua,43846,5188,167,4266,True,True,True,True,🦍 The API and AI Gateway
vnpy,vnpy,Python,43818,12234,21,4162,True,False,True,True,基于Python的开源量化交易平台开发框架
strix,usestrix,Python,43790,4520,226,352,False,True,True,True,Open-source AI penetration testing tool to find and fix your app’s vulnerabilities.
agentic-awesome-skills,sickn33,Python,43782,6471,2,190,True,True,True,True,"AAS Core is the local, agent-first control plane for complete catalog discovery, agent-owned selection, stack validation, and planning, backed by 1,987+ agentic skills. Includes CLI, local MCP, catalog, plugins, and Workbench."
payload,payloadcms,TypeScript,43759,3968,909,2025,False,True,True,True,"Payload is the open-source, fullstack Next.js framework, giving you instant backend superpowers. Get a full TypeScript backend and admin panel instantly. Use Payload as a headless CMS or for building powerful applications."
TensorFlow-Examples,aymericdamien,Jupyter Notebook,43742,14686,228,3907,False,False,False,True,TensorFlow Tutorial and Examples for Beginners (support TF v1 & v2)
spark,apache,Scala,43684,29293,445,4531,True,True,True,True,Apache Spark - A unified analytics engine for large-scale data processing
jan,janhq,TypeScript,43681,2914,409,1072,True,True,True,True,Jan is an open source alternative to ChatGPT that runs 100% offline on your computer.
3x-ui,MHSanaei,Go,43563,8330,108,1260,False,True,True,True,"Xray panel supporting multi-protocol multi-user expire day & traffic & IP limit (Vmess, Vless, Trojan, ShadowSocks, Wireguard, Hysteria, Tunnel, Mixed, HTTP, Tun, MTProto) "
desktop,zen-browser,JavaScript,43548,1652,591,848,True,False,True,True,Welcome to a calmer internet
paperless-ngx,paperless-ngx,Python,43411,2933,5,1622,True,True,True,True,"A community-supported supercharged document management system: scan, index and archive all your documents"
ccxt,ccxt,Python,43384,8753,1210,3357,False,True,True,True,A unified trading API with more than 100 crypto exchanges and prediction markets in JavaScript / TypeScript / Python / C# / PHP / Go / Java 
hyperswitch,juspay,Rust,43343,4968,2022,1375,True,True,True,True,"Open source, composable payments platform | PCI compliant | SaaS and Self-host options | Enables connectivity to multiple payment, payout, fraud, vault and tokenization providers | Uplifts authorization with intelligent routing and revenue recovery | Reduce payment processing costs with cost observability | Reduces payment ops with reconciliation"
ray,ray-project,Python,43329,7827,3469,3558,False,True,True,True,Ray is an AI compute engine. Ray consists of a core distributed runtime and a set of AI Libraries for accelerating ML workloads.
zod,colinhacks,TypeScript,43319,2093,293,2329,True,True,True,True,TypeScript-first schema validation with static type inference
CPlusPlusThings,Light-City,C++,43303,8811,9,2566,False,False,False,True,C++那些事
zig,ziglang,Zig,43275,3127,2885,4005,False,False,False,True,Moved to Codeberg
new-api,QuantumNous,TypeScript,43261,10086,1095,986,True,False,True,True,"A unified AI model hub for aggregation & distribution. It supports cross-converting various LLMs into OpenAI-compatible, Claude-compatible, or Gemini-compatible formats. A centralized gateway for personal and enterprise model management. 🍥"
what-happens-when,alex,,43246,5740,2065,4642,False,False,True,True,"An attempt to answer the age old interview question ""What happens when you type google.com into your browser and press enter?"""
pm2,Unitech,JavaScript,43242,2712,1093,4812,False,True,True,True,Node.js/Bun Production Process Manager with a built-in Load Balancer.
gradio,gradio-app,Python,43191,3557,215,2773,True,True,True,True,"Build and share delightful machine learning apps, all in Python. 🌟 Star to support our work!"
Fabric,danielmiessler,Go,43185,4211,69,932,True,True,True,True,Fabric is an open-source framework for augmenting humans using AI. It provides a modular system for solving specific problems using a crowdsourced set of AI prompts that can be used anywhere.
obsidian-skills,kepano,,43139,3075,57,202,False,False,True,True,"Agent skills for Obsidian. Teach your agent to use Obsidian CLI and open formats including Markdown, Bases, JSON Canvas."
fuels-rs,FuelLabs,Rust,43101,1361,70,1726,False,False,True,True,Fuel Network Rust SDK
fuels-ts,FuelLabs,TypeScript,43065,1367,78,1784,True,True,True,True,Fuel Network Typescript SDK
airi,moeru-ai,TypeScript,43039,4305,191,599,True,True,True,True,"💖🧸 Self hosted, you-owned Grok Companion, a container of souls of waifu, cyber livings to bring them into our worlds, wishing to achieve Neuro-sama's altitude. Capable of realtime voice chat, Minecraft, Factorio playing. Web / macOS / Windows supported."
ai-engineering-from-scratch,rohitg00,Python,42902,7166,106,127,True,True,True,True,Learn it. Build it. Ship it for others.
python-patterns,faif,Python,42881,7009,15,5160,False,False,True,True,A collection of design patterns/idioms in Python
puter,HeyPuter,TypeScript,42839,3962,15,873,False,True,True,True,"🌐 The Internet Computer! Free, Open-Source, and Self-Hostable."
DeepSpeed,deepspeedai,Python,42790,4903,1304,2373,True,True,True,True,"DeepSpeed is a deep learning optimization library that makes distributed training and inference easy, efficient, and effective."
HEU_KMS_Activator,zbezj,,42666,3912,174,2588,False,False,False,True,
git-flight-rules,k88hudson,,42587,3174,14,4384,False,False,False,True,Flight rules for git
diagrams,mingrammer,Python,42456,2729,392,2363,False,True,True,True,:art: Diagram as Code for prototyping cloud system architectures
curl,curl,C,42452,7277,62,5971,True,True,True,True,"A command line tool and library for transferring data with URL syntax, supporting DICT, FILE, FTP, FTPS, GOPHER, GOPHERS, HTTP, HTTPS, IMAP, IMAPS, LDAP, LDAPS, MQTT, MQTTS, POP3, POP3S, RTSP, SCP, SFTP, SMB, SMBS, SMTP, SMTPS, TELNET, TFTP, WS and WSS. libcurl offers a myriad of powerful features"
ailearning,apachecn,Python,42410,11531,4,3435,False,False,False,True,AiLearning：数据分析+机器学习实战+线性代数+PyTorch+NLTK+TF2
Alamofire,Alamofire,Swift,42406,7669,45,4376,False,True,True,True,Elegant HTTP Networking in Swift
data-engineer-handbook,DataExpert-io,Jupyter Notebook,42354,7934,39,977,False,False,False,True,This is a repo with links to everything you'd ever want to learn about data engineering
lossless-cut,mifi,TypeScript,42325,2088,271,3553,False,True,True,True,The swiss army knife of lossless video/audio editing
headscale,juanfont,Go,42031,2370,139,2223,True,True,True,True,"An open source, self-hosted implementation of the Tailscale control server"
free-claude-code,Alishahryar1,Python,41892,6821,336,176,False,True,True,True,"Use claude code, codex or pi for free from the terminal, IDE, or you phone like OpenClaw (voice supported)"
swiper,nolimits4web,TypeScript,41884,9639,249,5244,True,True,False,True,Most modern mobile touch slider with hardware accelerated transitions
fastlane,fastlane,Ruby,41872,6023,718,4251,True,True,True,True,🚀 The easiest way to automate building and releasing your iOS and Android apps
WeChatMsg,LC044,,41869,5254,25,1290,False,False,False,True,
BettaFish,666ghj,Python,41831,7624,5,752,True,True,True,True,微舆：人人可用的多Agent舆情分析助手，打破信息茧房，还原舆情原貌，预测未来走向，辅助决策！从0实现，不依赖任何框架。
daisyui,saadeghi,Svelte,41790,1662,29,2063,False,True,True,True,"🌼 🌼 🌼 🌼 🌼  The most popular, free and open-source Tailwind CSS component library"
multica,multica-ai,Go,41786,5289,1205,191,False,True,True,True,"The open-source managed agents platform. Turn coding agents into real teammates — assign tasks, track progress, compound skills."
hexo,hexojs,TypeScript,41771,28,102,5051,True,True,True,True,"A fast, simple & powerful blog framework, powered by Node.js."
black,psf,Python,41760,2825,291,3053,True,True,True,True,The uncompromising Python code formatter
cobalt,imputnet,Svelte,41748,3593,259,1476,False,True,True,True,best way to save what you love
pure-bash-bible,dylanaraps,Shell,41723,3632,62,2963,False,True,False,True,📖 A collection of pure bash alternatives to external processes.
OpenMontage,calesthio,Python,41706,4965,198,116,False,True,True,True,"World's first open-source, agentic video production system. 12 production pipelines, 100+ tools, 700+ agent skill and production-knowledge files. Turn your AI coding assistant into a full video production studio."
uni-app,dcloudio,Objective-C,41587,3709,697,2933,False,True,True,True,A cross-platform framework using Vue.js
cheat.sh,chubin,Python,41565,1918,148,3364,False,True,True,True,the only cheat sheet you need
dubbo,apache,Java,41540,26396,1003,5147,True,True,True,True,The java implementation of Apache Dubbo. An RPC and microservice framework.
aria2,aria2,C++,41512,3876,1151,5717,False,False,True,True,"aria2 is a lightweight multi-protocol & multi-source, cross platform download utility operated in command-line. It supports HTTP/HTTPS, FTP, SFTP, BitTorrent and Metalink."
yarn,yarnpkg,JavaScript,41501,2721,2056,3838,True,True,True,True,The 1.x line is frozen - features and bugfixes now happen on https://github.com/yarnpkg/berry
marketingskills,coreyhaines31,JavaScript,41443,6532,77,189,False,True,True,True,"Marketing skills for Claude Code and AI agents. CRO, copywriting, SEO, analytics, and growth engineering."
ColossalAI,hpcaitech,Python,41421,4505,502,1729,False,True,True,True,"Making large AI models cheaper, faster and more accessible"
agno,agno-agi,Python,41393,5689,1015,1541,True,True,True,True,"Build, run, and manage agent platforms."
tabler,tabler,HTML,41357,4392,141,3094,True,False,True,True,Tabler is free and open-source HTML Dashboard UI Kit built on Bootstrap
free,freefq,,41292,5624,590,2238,False,False,False,True,翻墙、免费翻墙、免费科学上网、免费节点、免费梯子、免费ss/v2ray/trojan节点、蓝灯、谷歌商店、翻墙梯子
LibreChat,danny-avila,TypeScript,41211,8477,614,1258,True,True,True,True,"Enhanced ChatGPT Clone: Features Agents, MCP, Skills, DeepSeek, Anthropic, AWS, OpenAI, Responses API, Azure, Groq, o1, GPT-5, Mistral, OpenRouter, Vertex AI, Gemini, Artifacts, AI model switching, message search, Code Interpreter, langchain, DALL-E-3, OpenAPI Actions, Functions, Secure Multi-User Auth, Presets, open-source for self-hosting. Active"
nw.js,nwjs,JavaScript,41185,3855,901,5314,False,False,False,True,Call all Node.js modules directly from DOM/WebWorker and enable a new way of writing applications with all Web technologies.
chatbox,chatboxai,TypeScript,41118,4159,1215,1235,False,False,True,True,Powerful AI Client
styled-components,styled-components,TypeScript,41113,2571,15,3628,True,True,True,True,"Fast, expressive styling for React. Server components, client components, streaming SSR, React Native—one API."
vue2-elm,bailicangdu,Vue,41047,12260,121,3500,False,False,True,True,Large single page application with 45 pages built on vue2 + vuex. 基于 vue2 + vuex 构建一个具有 45 个页面的大型单页面应用
ChatGLM-6B,zai-org,Python,41020,5128,609,1228,False,False,False,True,ChatGLM-6B: An Open Bilingual Dialogue Language Model | 开源双语对话语言模型
vuetify,vuetifyjs,TypeScript,41014,7133,474,3602,True,True,True,True,🐉 Vue Component Framework
ppt-master,hugohe3,Python,40837,3391,3,225,True,True,True,True,"AI turns documents or topics into real, native PowerPoint decks—with native shapes, transitions and animations, data-backed charts and tables on demand, audio narration from speaker notes, and support for your own .pptx templates. · by Hugo He"
zju-icicles,QSCTech,HTML,40733,9582,10,3677,False,False,True,True,浙江大学课程攻略共享计划
stats,exelban,Swift,40733,1438,26,2612,False,False,True,True,macOS system monitor in your menu bar
yazi,sxyazi,Rust,40685,950,82,1111,True,True,True,True,"💥 Blazing fast terminal file manager written in Rust, based on async I/O."
vim,vim,Vim Script,40669,6096,1655,3992,False,True,True,True,The official Vim repository
Awesome-Design-Tools,goabstract,JavaScript,40656,2304,170,2718,False,False,True,True,The best design tools and plugins for everything 👉
50projects50days,bradtraversy,CSS,40630,9732,48,2075,False,False,False,True,"50+ mini web projects using HTML, CSS & JS"
Xray-core,XTLS,Go,40602,5709,54,2082,True,False,True,True,"Xray, Penetrates Everything. Also the best v2ray-core. Where the magic happens. An open platform for various uses."
remote-jobs,remoteintech,JavaScript,40584,3943,11,3937,True,True,True,True,Source for remoteintech.company — a community-maintained directory of remote-friendly tech companies
faiss,facebookresearch,C++,40573,4469,283,3453,True,True,True,True,A library for efficient similarity search and clustering of dense vectors.
chakra-ui,chakra-ui,TypeScript,40525,3631,14,2532,True,True,True,True,Chakra UI is a component system for building SaaS products with speed ⚡️
trpc,trpc,TypeScript,40460,1641,254,2197,False,True,True,True,🧙‍♀️  Move Fast and Break Nothing. End-to-end typesafe APIs made easy. 
appsmith,appsmithorg,TypeScript,40457,4681,4474,2215,True,True,True,True,"Platform to build admin panels, internal tools, and dashboards. Integrates with 25+ databases and any API."
awesome-cursorrules,PatrickJS,JavaScript,40412,3449,40,675,True,True,True,True,📄  Configuration files that enhance Cursor AI editor experience with custom rules and behaviors
claude-howto,luongnv89,Python,40403,4911,24,258,True,True,True,True,"A visual, example-driven guide to Claude Code — from basic concepts to advanced agents, with copy-paste templates that bring immediate value."
gkd,gkd-kit,Kotlin,40393,1908,12,1116,False,False,True,True,"基于无障碍，高级选择器，订阅规则的自定义屏幕点击安卓应用 | An Android APP with custom screen tapping based on Accessibility, Advanced Selectors, and Subscription Rules"
wrk,wg,C,40352,3026,203,5238,False,False,True,True,Modern HTTP benchmarking tool
tidb,pingcap,Go,40332,6221,6603,3974,True,True,True,True,"TiDB is built for agentic workloads that grow unpredictably, with ACID guarantees and native support for transactions, analytics, and vector search. No data silos. No noisy neighbors. No infrastructure ceiling."
php-src,php,C,40252,8107,1888,5517,False,True,True,True,The PHP Interpreter
sniffnet,GyulyVGC,Rust,40128,1780,61,1453,True,True,True,True,Comfortably monitor your Internet traffic 🕵️‍♂️
nushell,nushell,Rust,40071,2187,1449,2631,True,True,True,True,A new type of shell
bert,google-research,Python,40063,9691,880,2828,False,True,False,True,TensorFlow code and pre-trained models for BERT
CodeWhale,Hmbown,Rust,40056,3448,349,185,True,True,True,True,"Open-source, community-driven agent harness"
phaser,phaserjs,JavaScript,40015,7142,119,4850,True,True,True,True,"Phaser is a fun, free and fast 2D game framework for making HTML5 games for desktop and mobile web browsers, supporting Canvas and WebGL rendering."
fiber,gofiber,Go,40008,2012,43,2381,True,True,True,True,⚡️ Express inspired web framework written in Go
photoprism,photoprism,Go,39997,2316,497,3099,True,True,True,True,AI-Powered Photos App 🌈💎✨
esbuild,evanw,Go,39993,1324,634,3691,False,False,True,True,An extremely fast bundler for the web
it-tools,CorentinTh,Vue,39909,5245,812,2300,False,False,True,True,"Collection of handy online tools for developers, with great UX. "
insomnia,Kong,TypeScript,39901,2358,860,3744,True,True,True,True,"The open-source, cross-platform API client for GraphQL, REST, WebSockets, SSE and gRPC. With Cloud, Local and Git storage."
gorm,go-gorm,Go,39885,4165,508,4654,True,False,True,True,"The fantastic ORM library for Golang, aims to be developer friendly"
awesome-system-design-resources,ashishps1,Java,39857,8521,14,1003,False,False,False,True,Learn System Design concepts and prepare for interviews using free resources.
video.js,videojs,JavaScript,39832,7484,668,5914,True,True,True,True,Video.js - open source HTML5 video player
outline,outline,TypeScript,39813,3447,61,3714,True,False,True,True,"The fastest knowledge base for growing teams. Beautiful, realtime collaborative, feature packed, and markdown compatible."
reactive-resume,amruthpillai,TypeScript,39779,4506,105,2311,False,False,True,True,"A one-of-a-kind resume builder that keeps your privacy in mind. Completely secure, customizable, portable, open-source and free forever. Try it out today!"
BitNet,microsoft,C++,39775,3654,303,717,True,False,True,True,Official inference framework for 1-bit LLMs
shellcheck,koalaman,Haskell,39756,1938,1146,4997,False,False,True,True,"ShellCheck, a static analysis tool for shell scripts"
duckdb,duckdb,C++,39668,3466,665,2949,True,True,True,True,DuckDB is an analytical in-process SQL database management system
ChatTTS,2noise,Python,39664,4249,62,787,False,False,True,True,A generative speech model for daily dialogue.
manim,ManimCommunity,Python,39662,2973,511,2257,True,True,True,True,A community-maintained Python framework for creating mathematical animations. 
openscreen,siddharthvaddem,TypeScript,39643,2944,49,287,False,True,True,True,"Create stunning demos for free. Open-source, no subscriptions, no watermarks, and free for commercial use. An alternative to Screen Studio."
Deep-Learning-Papers-Reading-Roadmap,floodsung,Python,39549,7274,91,3569,False,False,False,True,Deep Learning papers reading roadmap for anyone who are eager to learn this amazing tech!
Sunshine,LizardByte,C++,39530,2130,125,1681,True,True,True,True,Self-hosted game stream host for Moonlight.
FastChat,lm-sys,Python,39501,4786,1037,1223,False,False,True,True,"An open platform for training, serving, and evaluating large language models. Release repo for Vicuna and Chatbot Arena."
mindshub,mindsdb,Makefile,39482,6222,5,2912,True,True,True,True,Make AI do actual work. Swap the model anytime — keep everything you've built.
styleguide,google,HTML,39462,12953,169,4082,True,True,True,True,Style guides for Google-originated open-source projects
ink,vadimdemedes,TypeScript,39451,1028,30,3328,True,True,True,True,🌈 React for interactive command-line apps
llvm-project,llvm,LLVM,39426,17947,37607,3515,True,True,True,True,The LLVM Project is a collection of modular and reusable compiler and toolchain technologies.
