repo_name,organization,language,stars,forks,open_issues,age_days,has_coc,has_contributing,has_workflows,has_readme,description
build-your-own-x,codecrafters-io,Markdown,520933,49285,515,2973,False,False,True,True,Master programming by recreating your favorite technologies from scratch.
awesome,sindresorhus,,479982,35620,87,4371,True,True,True,True,😎 Awesome lists about all kinds of interesting topics
freeCodeCamp,freeCodeCamp,TypeScript,450766,45298,207,4205,True,True,True,True,"freeCodeCamp.org's open-source codebase and curriculum. Learn math, programming, and computer science for free."
public-apis,public-apis,Python,445088,48845,1480,3753,False,True,True,True,A collective list of free APIs
free-programming-books,EbookFoundation,Python,391004,66470,77,4645,True,True,True,True,:books: Freely available programming books
openclaw,openclaw,TypeScript,381065,79820,6658,217,False,True,True,True,Your own personal AI assistant. Any OS. Any Platform. The lobster way. 🦞 
developer-roadmap,nilbuild,TypeScript,358663,44304,23,3393,True,True,True,True,"Interactive roadmaps, guides and other educational content to help developers grow in their careers."
system-design-primer,donnemartin,Python,355478,56973,564,3410,False,True,True,True,Learn how to design large-scale systems. Prep for the system design interview.  Includes Anki flashcards.
coding-interview-university,jwasham,,354604,84006,119,3676,False,False,True,True,A complete computer science study plan to become a software engineer.
awesome-python,vinta,Python,305554,28185,21,4385,True,True,True,True,"An opinionated list of Python frameworks, libraries, tools, and resources"
awesome-selfhosted,awesome-selfhosted,,301942,14073,0,4047,False,False,False,True,A list of Free Software network services and web applications which can be hosted on your own servers
996.ICU,996icu,,276336,20813,16697,2652,False,False,False,True,Repo for counting stars and contributing. Press F to pay respect to glorious developers.
project-based-learning,practical-tutorials,,271388,35062,318,3366,False,True,True,True,Curated list of project-based tutorials
react,react,JavaScript,246318,51101,1271,4784,True,True,True,True,The library for web and native user interfaces.
superpowers,obra,Shell,241731,21460,293,263,True,False,True,True,An agentic skills framework & software development methodology that works.
linux,torvalds,C,238031,62920,3,5412,False,False,True,True,Linux kernel source tree
the-book-of-secret-knowledge,trimstray,,230889,13804,158,2928,True,True,True,True,"A collection of inspiring lists, manuals, cheatsheets, blogs, hacks, one-liners, cli/web tools and more."
ECC,affaan-m,JavaScript,223590,34230,65,163,True,True,True,True,"The agent harness performance optimization system. Skills, instincts, memory, security, and research-first development for Claude Code, Codex, Opencode, Cursor and beyond."
Python,TheAlgorithms,Python,222314,50802,987,3635,True,True,True,True,All Algorithms implemented in Python
vue,vuejs,TypeScript,210092,33688,635,4719,True,True,True,True,"This is the repo for Vue 2. For Vue 3, go to https://github.com/vuejs/core"
hermes-agent,NousResearch,Python,205902,37208,24548,342,False,True,True,True,The agent that grows with you
computer-science,ossu,HTML,205455,25526,23,4440,False,True,True,True,🎓 Path to a free self-taught education in Computer Science!
javascript-algorithms,trekhleb,JavaScript,196155,31044,399,3019,True,True,True,True,📝 Algorithms and data structures implemented in JavaScript with explanations and links to further readings
tensorflow,tensorflow,C++,196112,75194,2836,3888,True,True,True,True,An Open Source Machine Learning Framework for Everyone
n8n,n8n-io,TypeScript,194594,58938,1462,2564,True,True,True,True,"Fair-code workflow automation platform with native AI capabilities. Combine visual building with custom code, self-host or cloud, 400+ integrations."
claw-code,ultraworkers,Rust,194467,109865,21,90,True,True,True,True,"An agent-managed museum exhibit, built in Rust with Gajae-Code / LazyCodex — developed and maintained with no human intervention."
ohmyzsh,ohmyzsh,Shell,188469,26372,568,6149,True,True,True,True,"🙃   A delightful community-driven (with 2,500+ contributors) framework for managing your zsh configuration. Includes 300+ optional plugins (rails, git, macOS, hub, docker, homebrew, node, php, python, etc), 140+ themes to spice up your morning, and an auto-update tool that makes it easy to keep up with the latest updates from the community."
vscode,microsoft,TypeScript,187048,40722,18890,3952,True,True,True,True,Visual Studio Code
AutoGPT,Significant-Gravitas,Python,185220,46119,460,1201,True,True,True,True,"AutoGPT is the vision of accessible AI for everyone, to use and to build on. Our mission is to provide the tools, so that you can focus on what matters."
andrej-karpathy-skills,multica-ai,,184753,18938,123,154,False,False,True,True,"A single CLAUDE.md file to improve Claude Code behavior, derived from Andrej Karpathy's observations on LLM coding pitfalls."
CS-Notes,CyC2018,,184651,50871,196,3058,False,False,True,True,:books: 技术面试必备基础知识、Leetcode、计算机操作系统、计算机网络、系统设计
You-Dont-Know-JS,getify,,184552,33507,2,4609,False,True,True,True,A book series (2 published editions) on the JS language.
Python-100-Days,jackfrued,Jupyter Notebook,183809,55685,702,3042,False,False,True,True,Python - 100天从新手到大师
FreeDomain,DigitalPlatDev,HTML,181520,3715,36,760,False,False,False,True,DigitalPlat FreeDomain: Free Domain For Everyone
Microsoft-Activation-Scripts,massgravel,Batchfile,181308,17380,2,2360,False,False,False,True,"Open-source Windows and Office activator featuring HWID, Ohook, TSforge, and Online KMS activation methods, along with advanced troubleshooting."
opencode,anomalyco,TypeScript,180650,22237,7106,425,False,True,True,True,The open source coding agent.
flutter,flutter,Dart,177644,30580,12902,4133,True,True,True,True,Flutter makes it easy and fast to build beautiful apps for mobile and beyond
awesome-go,avelino,Go,176760,13360,185,4376,True,True,True,True,"A curated list of awesome Go frameworks, libraries and software"
ollama,ollama,Go,175161,16766,3507,1099,False,True,True,True,"Get up and running with Kimi-K2.6, GLM-5.1, MiniMax, DeepSeek, gpt-oss, Qwen, Gemma and other models."
gitignore,github,,174655,82379,72,5712,True,True,True,True,A collection of useful .gitignore templates
bootstrap,twbs,MDX,174413,78777,271,5449,True,True,True,True,"The most popular HTML, CSS, and JavaScript framework for developing responsive, mobile first projects on the web."
yt-dlp,yt-dlp,Python,174314,14704,2512,2073,False,True,True,True,A feature-rich command-line audio/video downloader
prompts.chat,f,HTML,164537,21294,60,1302,False,True,True,True,"f.k.a. Awesome ChatGPT Prompts. Share, discover, and collect prompts from the community. Free and open source — self-host for your organization with complete privacy."
stable-diffusion-webui,AUTOMATIC1111,Python,163942,30371,2494,1407,False,False,True,True,Stable Diffusion web UI
HelloGitHub,521xueweihan,Python,163273,12255,472,3709,False,False,False,True,":octocat: 分享 GitHub 上有趣、入门级的开源项目。Share interesting, entry-level open source projects on GitHub."
transformers,huggingface,Python,162036,33663,2453,2800,True,True,True,True,"🤗 Transformers: the model-definition framework for state-of-the-art machine learning models in text, vision, audio, and multimodal models, for both inference and training. "
the-art-of-command-line,jlevy,,161459,14825,256,4058,False,True,False,True,"Master the command line, in one page"
markitdown,microsoft,Python,161382,11354,825,593,True,False,True,True,Python tool for converting files and office documents to Markdown.
skills,anthropics,Python,156742,18456,993,280,False,False,True,True,Public repository for Agent Skills
JavaGuide,Snailclimb,JavaScript,156702,46153,57,2975,False,False,True,True,Java 面试 & 后端通用面试指南，覆盖计算机基础、数据库、分布式、高并发、系统设计与 AI 应用开发
skills,mattpocock,Shell,150826,13036,102,146,False,False,True,True,Skills for Real Engineers. Straight from my .claude directory.
langflow,langflow-ai,Python,150218,9362,978,1237,True,True,True,True,Langflow is a powerful tool for building and deploying AI-powered agents and workflows.
javascript,airbnb,JavaScript,148087,26645,159,4988,True,False,True,True,JavaScript Style Guide
dify,langgenius,TypeScript,147048,23152,857,1174,True,True,True,True,Production-ready platform for agentic workflow development.
scrcpy,Genymobile,C,144717,13343,2847,3142,False,False,True,True,Display and control your Android device
open-webui,open-webui,Python,143490,20682,247,997,True,False,True,True,"User-friendly AI Interface (Supports Ollama, OpenAI API, ...)"
firecrawl,firecrawl,TypeScript,141663,8164,374,805,False,True,True,True,"The API to search, scrape, and interact with the web at scale. 🔥"
system-prompts-and-models-of-ai-tools,x1xhlol,,141336,34760,154,481,False,False,True,True,"FULL Augment Code, Claude Code, Cluely, CodeBuddy, Comet, Cursor, Devin AI, Junie, Kiro, Leap.new, Lovable, Manus, NotionAI, Orchids.app, Perplexity, Poke, Qoder, Replit, Same.dev, Trae, Traycer AI, VSCode Agent, Warp.dev, Windsurf, Xcode, Z.ai Code, Dia & v0. (And other Open Sourced) System Prompts, Internal Tools & AI Models"
youtube-dl,ytdl-org,Python,140615,10683,4128,5720,False,True,True,True,Command-line program to download videos from YouTube.com and other video sites
langchain,langchain-ai,Python,140531,23325,413,1352,True,True,True,True,The agent engineering platform.
tech-interview-handbook,yangshun,TypeScript,140519,16640,46,3647,True,True,True,True,Curated coding interview preparation materials for busy software engineers
next.js,vercel,JavaScript,140438,31276,4148,3554,True,True,True,True,The React Framework
PowerToys,microsoft,C,135907,8174,7334,2616,True,True,True,True,Microsoft PowerToys is a collection of utilities that supercharge productivity and customization on Windows
go,golang,Go,135114,19009,10172,4333,True,True,True,True,The Go programming language
claude-code,anthropics,Python,135025,21788,9033,492,False,False,True,True,"Claude Code is an agentic coding tool that lives in your terminal, understands your codebase, and helps you code faster by executing routine tasks, explaining complex code, and handling git workflows - all through natural language commands."
fucking-algorithm,labuladong,Markdown,134608,23615,3,2322,False,False,True,True,"Crack LeetCode, not only how, but also why. "
iptv,iptv-org,TypeScript,129402,7159,28,2784,True,True,True,True,Collection of publicly available IPTV channels from all over the world
clash-verge-rev,clash-verge-rev,TypeScript,128684,9335,419,951,False,True,True,True,"A modern GUI client based on Tauri, designed to run in Windows, macOS and Linux for tailored proxy experience"
30-seconds-of-code,Chalarangelo,JavaScript,128240,12472,0,3134,True,True,True,True,Coding articles to level up your development skills
hello-algo,krahets,Java,128024,15236,39,1333,False,False,True,True,"《Hello 算法》：动画图解、一键运行的数据结构与算法教程。支持简中、繁中、English、日本語，提供 Python, Java, C++, C, C#, JS, Go, Swift, Rust, Ruby, Kotlin, TS, Dart 等代码实现"
free-for-dev,ripienaar,HTML,126907,13273,13,4121,True,True,True,True,"A list of SaaS, PaaS and IaaS offerings that have free tiers of interest to devops and infradev"
excalidraw,excalidraw,TypeScript,126461,14201,3192,2371,False,True,True,True,Virtual whiteboard for sketching hand-drawn like diagrams
react-native,react,C++,126125,25180,1041,4189,True,True,True,True,A framework for building native applications using React
kubernetes,kubernetes,Go,123513,43319,2737,4406,True,True,True,True,Production-Grade Container Scheduling and Management
electron,electron,C++,121836,17280,879,4827,True,True,True,True,":electron: Build cross-platform desktop apps with JavaScript, HTML, and CSS"
agency-agents,msitarzewski,Shell,119351,19533,87,259,False,True,True,True,"A complete AI agency at your fingertips - From frontend wizards to Reddit community ninjas, from whimsy injectors to reality checkers. Each agent is a specialized expert with personality, processes, and proven deliverables."
ComfyUI,Comfy-Org,Python,118827,13906,4179,1260,False,True,True,True,"The most powerful and modular diffusion model GUI, api and backend with a graph/nodes interface."
llama.cpp,ggml-org,C++,118690,20081,1827,1207,False,True,True,True,LLM inference in C/C++
gstack,garrytan,TypeScript,118180,17587,752,110,False,True,True,True,"Use Garry Tan's exact Claude Code setup: 23 opinionated tools that serve as CEO, Designer, Eng Manager, Release Manager, Doc Engineer, and QA"
node,nodejs,JavaScript,118156,35799,2353,4233,True,True,True,True,Node.js JavaScript runtime ✨🐢🚀✨
ui,shadcn-ui,TypeScript,117774,9199,2077,1272,False,True,True,True,"A set of beautifully-designed, accessible components and a code distribution platform. Works with your favorite frameworks. Open Source. Open Code."
rustdesk,rustdesk,Rust,117335,17773,118,2100,True,True,True,True,"An open-source remote desktop application designed for self-hosting, as an alternative to TeamViewer."
free-programming-books-zh_CN,justjavac,,117212,28217,32,4621,True,True,False,True,:books: 免费的计算机编程类中文书籍，欢迎投稿
spec-kit,github,Python,116479,10291,371,312,True,True,True,True,💫 Toolkit to help you get started with Spec-Driven Development
awesome-llm-apps,Shubhamsaboo,Python,116090,17269,9,792,False,False,True,True,"100+ AI Agent & RAG apps you can actually run — clone, customize, ship."
Awesome-Hacking,Hack-with-Github,,115309,10469,40,3743,False,True,True,True,"A collection of various awesome lists for hackers, pentesters and security researchers"
rust,rust-lang,Rust,114428,15030,12562,5857,True,True,True,True,Empowering everyone to build reliable and efficient software.
three.js,mrdoob,JavaScript,113403,36401,405,5942,True,True,True,True,JavaScript 3D Library.
godot,godotengine,C++,113328,25810,18426,4559,True,True,True,True,Godot Engine – Multi-platform 2D and 3D game engine
d3,d3,Shell,113151,22708,20,5754,False,False,True,True,"Bring data to life with SVG, Canvas and HTML. :bar_chart::chart_with_upwards_trend::tada:"
generative-ai-for-beginners,microsoft,Jupyter Notebook,112421,60401,10,1106,True,True,True,True,"21 Lessons, Get Started Building with Generative AI "
cc-switch,farion1231,Rust,110866,7330,1595,329,True,True,True,True,"A cross-platform desktop All-in-One assistant for Claude Code, Codex, OpenCode, OpenClaw, Gemini CLI & Hermes Agent. Only official website: ccswitch.io"
v2rayN,2dust,C#,110196,15457,13,2527,False,False,True,True,"A GUI client for Windows, Linux and macOS, support Xray and sing-box and others"
TypeScript,microsoft,TypeScript,109440,13449,5046,4395,True,True,True,True,TypeScript is a superset of JavaScript that compiles to clean JavaScript output.
axios,axios,JavaScript,109225,11734,106,4333,True,True,True,True,Promise based HTTP client for the browser and node.js
GitHub-Chinese-Top-Charts,GrowingGit,Java,108647,13540,193,2490,False,False,False,True,:cn: GitHub中文排行榜，各语言分设「软件 | 资料」榜单，精准定位中文好项目。各取所需，高效学习。
tauri,tauri-apps,Rust,108498,3733,1440,2543,True,True,True,True,"Build smaller, faster, and more secure desktop and mobile applications with a web frontend."
frp,fatedier,Go,107664,15091,43,3843,False,False,True,True,A fast reverse proxy to help you expose a local server behind a NAT or firewall to the internet.
papers-we-love,papers-we-love,Shell,107436,6383,2,4579,True,True,True,True,Papers from the computer science community to read and discuss.
deno,denoland,Rust,107389,6094,1346,2968,True,True,True,True,A modern runtime for JavaScript and TypeScript.
awesome-mac,jaywcjlove,Swift,106491,7954,408,3634,True,True,True,True, This project is dedicated to collecting high-quality macOS software and organizing them systematically by different categories for easy search and use.
gemini-cli,google-gemini,TypeScript,105666,14178,1342,438,False,True,True,True,An open-source AI agent that brings the power of Gemini directly into your terminal.
nodebestpractices,goldbergyoni,Dockerfile,105382,10718,133,3209,False,False,True,True,✅ The Node.js best practices list (July 2026)
supabase,supabase,TypeScript,105041,12908,1087,2453,True,True,True,True,"The Postgres development platform. Supabase gives you a dedicated Postgres database to build your web, mobile, and AI applications."
immich,immich-app,TypeScript,104709,5970,665,1607,True,True,True,True,High performance self-hosted photo and video management solution.
whisper,openai,Python,103893,12638,133,1382,False,False,True,True,Robust Speech Recognition via Large-Scale Weak Supervision
DeepSeek-V3,deepseek-ai,Python,103843,16735,263,550,False,False,True,True,
terminal,microsoft,C++,103755,9382,1733,3244,True,True,True,True,"The new Windows Terminal and the original Windows console host, all in the same place!"
create-react-app,react,JavaScript,103315,26979,2409,3634,True,True,True,True,Set up a modern web app by running one command.
browser-use,browser-use,Python,101520,11267,284,606,False,True,True,True,🌐 Make websites accessible for AI agents. Automate tasks online with ease.
pytorch,pytorch,Python,101219,28169,18227,3608,True,True,True,True,Tensors and Dynamic neural networks in Python with strong GPU acceleration
HowToCook,Anduin2017,,100978,11024,458,2312,True,False,True,True,Programmer's guide about how to cook at home.
neovim,neovim,Vim Script,100927,6937,1914,4532,False,True,True,True,Vim-fork focused on extensibility and usability
angular,angular,TypeScript,100476,27194,1177,4302,True,True,True,True,Deliver web apps with confidence 🚀
every-programmer-should-know,mtdvio,,99982,8775,25,3231,False,True,False,True,A collection of (mostly) technical things every software developer should know about
fastapi,fastapi,Python,99790,9509,103,2760,False,True,True,True,"FastAPI framework, high performance, easy to learn, fast to code, ready for production"
ant-design,ant-design,TypeScript,98519,54636,1291,4084,True,True,True,True,An enterprise-class UI design language and React UI library
material-ui,mui,JavaScript,98497,32596,1535,4333,True,True,True,True,Material UI: Comprehensive React component library that implements Google's Material Design. Free forever.
ui-ux-pro-max-skill,nextlevelbuilder,Python,98205,10346,124,211,False,True,True,True,An AI SKILL that provide design intelligence for building professional UI/UX multiple platforms
LLMs-from-scratch,rasbt,Jupyter Notebook,98169,15058,3,1072,False,False,True,True,"Implement a ChatGPT-like LLM in PyTorch from scratch, step by step"
thefuck,nvbn,Python,97450,3948,455,4100,False,True,True,True,Magnificent app which corrects your previous console command.
Web-Dev-For-Beginners,microsoft,JavaScript,95933,15630,84,2058,True,True,True,True,"24 Lessons, 12 Weeks, Get Started as a Web Developer"
tailwindcss,tailwindlabs,TypeScript,95800,5308,63,3188,False,True,True,True,A utility-first CSS framework for rapid UI development.
app-ideas,florinpop17,,95378,10502,606,2681,True,True,True,True,A Collection of application ideas which can be used to improve your coding skills.
puppeteer,puppeteer,TypeScript,95280,9467,265,3338,False,True,True,True,JavaScript API for Chrome and Firefox
weekly,ruanyf,,94734,4203,8218,2816,False,False,False,True,科技爱好者周刊，每周五发布
codex,openai,Rust,94521,14019,8085,443,False,True,True,True,Lightweight coding agent that runs in your terminal
clean-code-javascript,ryanmcdermott,JavaScript,94453,12462,123,3503,False,False,False,True,Clean Code concepts adapted for JavaScript
Deep-Live-Cam,hacksider,Python,94431,13774,60,1009,False,True,True,True,real time face swap and one-click video deepfake with only a single image
awesome-design-md,VoltAgent,,94412,11182,295,90,False,True,True,True,A collection of DESIGN.md files analysis by popular brand design systems. Drop one into your project and let coding agents generate a matching UI.
MoneyPrinterTurbo,harry0703,Python,94268,13683,46,841,False,False,True,True,利用AI大模型，一键生成高清短视频 Generate short videos with one click using AI LLM.
java-design-patterns,iluwatar,Java,94167,27362,145,4342,False,True,True,True,Design patterns implemented in Java
nvm,nvm-sh,Shell,93984,10241,393,5919,True,True,True,True,Node Version Manager - POSIX-compliant bash script to manage multiple active node.js versions
bun,oven-sh,Rust,93525,4743,6827,1903,True,True,True,True,"Incredibly fast JavaScript runtime, bundler, test runner, and package manager – all in one"
DeepSeek-R1,deepseek-ai,,91983,11723,49,525,False,False,True,True,
playwright,microsoft,TypeScript,91924,6003,174,2418,True,True,True,True,"Playwright is a framework for Web Testing and Automation. It allows testing Chromium, Firefox and WebKit with a single API. "
storybook,storybookjs,TypeScript,90476,10154,1752,3756,True,True,True,True,"Storybook is the industry standard workshop for building, documenting, and testing UI components in isolation"
vue-element-admin,PanJiaChen,Vue,90251,30421,1402,3361,False,False,False,True,:tada: A magical vue admin                                                                https://panjiachen.github.io/vue-element-admin
awesome-mcp-servers,punkpeye,,90012,12256,1961,577,False,True,True,True,A collection of MCP servers.
TradingAgents,TauricResearch,Python,89825,17337,285,549,False,False,True,True,TradingAgents: Multi-Agents LLM Financial Trading Framework
bitcoin,bitcoin,C++,89586,39030,670,5671,False,True,True,True,Bitcoin Core integration/staging tree
opencv,opencv,C++,89459,56659,2730,5093,False,True,True,True,Open Source Computer Vision Library
autoresearch,karpathy,Python,89185,12888,200,115,False,False,True,True,AI agents running research on single-GPU nanochat training automatically
mermaid,mermaid-js,TypeScript,88934,9080,1632,4258,True,True,True,True,Generation of diagrams like flowcharts or sequence diagrams from text in a similar manner as markdown
hugo,gohugoio,Go,88786,8281,230,4743,False,True,True,True,The world’s fastest framework for building websites.
gin,gin-gonic,Go,88782,8639,709,4396,True,True,True,True,"Gin is a high-performance HTTP web framework written in Go. It provides a Martini-like API but with significantly better performance—up to 40 times faster—thanks to httprouter. Gin is designed for building REST APIs, web applications, and microservices."
uptime-kuma,louislam,JavaScript,88597,8054,759,1823,True,True,True,True,A fancy self-hosted monitoring tool
NextChat,ChatGPTNextWeb,TypeScript,88342,59508,839,1207,True,False,True,True,✨ Light and Fast AI Assistant. Support: Web | iOS | MacOS | Android |  Linux | Windows
django,django,Python,88142,33882,458,5176,True,True,True,True,The Web framework for perfectionists with deadlines.
core,home-assistant,Python,88078,37774,3331,4668,True,True,True,True,:house_with_garden: Open source home automation that puts local control and privacy first.
manim,3b1b,Python,87975,7340,496,4117,False,False,True,True,Animation engine for explanatory math videos
servers,modelcontextprotocol,TypeScript,87868,11104,617,588,True,True,True,True,Model Context Protocol Servers
svelte,sveltejs,JavaScript,87590,4961,1058,3508,True,True,True,True,web development for the rest of us
ML-For-Beginners,microsoft,Jupyter Notebook,87534,21289,5,1945,True,True,True,True,"12 weeks, 26 lessons, 52 quizzes, classic Machine Learning for all"
awesome-for-beginners,MunGell,,87013,7927,131,3901,False,True,True,True,A list of awesome beginners-friendly projects.
uv,astral-sh,Rust,86911,3254,2747,1001,True,True,True,True,"An extremely fast Python package and project manager, written in Rust."
zed,zed-industries,Rust,86200,9316,3429,1956,True,True,True,True,"Code at the speed of thought – Zed is a high-performance, multiplayer code editor from the creators of Atom and Tree-sitter."
syncthing,syncthing,Go,85926,5319,392,4598,False,True,True,True,Open Source Continuous File Synchronization
sherlock,sherlock-project,Python,85892,10049,304,2744,True,False,True,True,Hunt down social media accounts by username across social networks
Stirling-PDF,Stirling-Tools,Java,85269,7405,468,1249,False,True,True,True,#1 PDF Application on GitHub that lets you edit PDFs on any device anywhere
claude-mem,thedotmack,JavaScript,85107,7346,224,302,False,False,True,True,"Persistent Context Across Sessions for Every Agent –  Captures everything your agent does during sessions, compresses it with AI, and injects relevant context back into future sessions. Works with Claude Code, OpenClaw, Codex, Gemini, Hermes, Copilot, OpenCode + More"
system-design-101,ByteByteGoHq,,84991,9391,66,1015,False,True,True,True,Explain complex systems using visuals and simple terms. Help you prepare for system design interviews.
vllm,vllm-project,Python,84865,18677,5481,1236,True,True,True,True,A high-throughput and memory-efficient inference and serving engine for LLMs
laravel,laravel,Blade,84582,24730,31,5501,False,False,True,True,"Laravel is a web application framework with expressive, elegant syntax. We’ve already laid the foundation for your next big idea — freeing you to create without sweating the small things."
localsend,localsend,Dart,84405,4609,1024,1292,False,True,True,True,An open-source cross-platform alternative to AirDrop
