repo_name,organization,language,stars,forks,open_issues,age_days,has_coc,has_contributing,has_workflows,has_readme,description
annotated_deep_learning_paper_implementations,labmlai,Python,66123,6644,29,2038,False,False,True,True,"🧑‍🏫 60+ Implementations/tutorials of deep learning papers with side-by-side notes 📝; including transformers (original, xl, switch, feedback, vit, ...), optimizers (adam, adabelief, sophia, ...), gans(cyclegan, stylegan2, ...), 🎮 reinforcement learning (ppo, dqn), capsnet, distillation, ... 🧠"
ghidra,NationalSecurityAgency,Java,66116,7285,1851,2581,False,True,True,True,Ghidra is a software reverse engineering (SRE) framework
MetaGPT,FoundationAgents,Python,66073,8337,99,998,False,False,True,True,"🌟 The Multi-Agent Framework: First AI Software Company, Towards Natural Language Programming"
ChinaTextbook,TapXWorld,Roff,66055,14732,98,2271,False,False,False,True,所有小初高、大学PDF教材。
webpack,webpack,JavaScript,66016,9348,198,5127,True,True,True,True,"A bundler for javascript and friends. Packs many modules into a few bundled assets. Code Splitting allows for loading parts of the application on demand. Through ""loaders"", modules can be CommonJs, AMD, ES6 modules, CSS, Images, JSON, Coffeescript, LESS, ... and your custom stuff."
echarts,apache,TypeScript,66016,19833,1750,4739,True,True,True,True,"Apache ECharts is a powerful, interactive charting and data visualization library for browser"
gpt4free,xtekky,Python,65909,13651,5,1091,True,True,True,True,The official gpt4free repository | various collection of powerful language models | opus 4.6 gpt 5.3 kimi 2.5 deepseek v3.2 gemini 3
scikit-learn,scikit-learn,Python,65505,26840,2160,5698,True,True,True,True,scikit-learn: machine learning in Python
awesome-nodejs,sindresorhus,,65407,6199,29,4274,True,True,True,True,":zap: Delightful Node.js packages and resources [BECAUSE OF TOO MUCH SPAM AND LOW-QUALITY SUBMISSIONS, SUBMISSIONS ARE PAUSED UNTIL SEPTEMBER]"
javascript-questions,lydiahallie,,65312,9237,48,2477,False,False,False,True,"A long list of (advanced) JavaScript questions, and their explanations :sparkles:  "
Java,TheAlgorithms,Java,65274,21040,53,3538,True,True,True,True,All Algorithms implemented in Java
design-resources-for-developers,bradtraversy,,65101,11992,2,2148,False,True,False,True,"Curated list of design and UI resources from stock photos, web templates, CSS frameworks, UI libraries, tools and much more"
nocode,kelseyhightower,Dockerfile,65048,4826,4696,2968,False,True,False,True,The best way to write secure and reliable applications. Write nothing; deploy nowhere.
interviews,kdn251,Java,64938,12922,118,3325,False,False,False,True,Everything you need to know to get the job.
localstack,localstack,Python,64806,4645,0,3437,True,True,True,True,💻 A fully functional local AWS cloud stack. Develop and test your cloud & Serverless apps offline
Apollo-11,chrislgarry,Assembly,64708,7384,125,4373,False,True,True,True,Original Apollo 11 Guidance Computer (AGC) source code for the command and lunar modules.
docusaurus,facebook,TypeScript,64257,9783,355,3199,True,True,True,True,Easy to maintain open source documentation websites.
keras,keras-team,Python,63924,19737,263,4015,False,True,True,True,Deep Learning for humans
OpenBB,OpenBB-finance,Python,63540,6247,70,1920,True,False,True,True,"Financial data platform for analysts, quants and AI agents."
prometheus,prometheus,Go,63287,10268,758,4868,True,True,True,True,The Prometheus monitoring system and time series database.
alacritty,alacritty,Rust,63113,3362,334,3687,False,True,True,True,"A cross-platform, OpenGL terminal emulator."
socket.io,socketio,TypeScript,62974,10152,205,5857,False,True,True,True,Realtime application framework (Node.JS server)
open-interpreter,openinterpreter,Python,62853,5416,308,984,False,True,True,True,A natural language interface for computers
resume.github.com,resume,JavaScript,62821,1365,71,5525,False,False,False,True,Resumes generated using the GitHub informations
crawl4ai,unclecode,Python,62529,6389,36,684,True,True,True,True,"🚀🤖 Crawl4AI: Open-source LLM Friendly Web Crawler & Scraper. Don't be shy, join here: https://discord.gg/jP8KfhDhyN"
nocodb,nocodb,TypeScript,62524,4680,650,3068,True,True,True,True,🔥 🔥 🔥 A Free & Self-hostable Airtable Alternative
pathway,pathwaycom,Python,62364,1621,38,1213,True,True,True,True,"Python ETL framework for stream processing, real-time analytics, LLM pipelines, and RAG."
traefik,traefik,Go,62351,5887,775,3845,True,True,True,True,The Cloud Native Application Proxy
uBlock,gorhill,JavaScript,62302,3988,17,4010,False,True,True,True,uBlock Origin - An efficient blocker for Chromium and Firefox. Fast and lean.
rustlings,rust-lang,Rust,62291,11171,84,3844,False,True,True,True,:crab: Small exercises to get you used to reading and writing Rust code!
nerd-fonts,ryanoasis,CSS,62171,3870,63,4128,True,True,True,True,"Iconic font aggregator, collection, & patcher. 3,600+ icons, 50+ patched fonts: Hack, Source Code Pro, more. Glyph collections: Font Awesome, Material Design Icons, Octicons, & more"
sway,FuelLabs,Rust,61859,5428,894,1890,False,False,True,True,🌴 Empowering everyone to build reliable and efficient smart contracts.
tldr,tldr-pages,Markdown,61782,5134,249,4489,False,True,True,True,Collaborative cheatsheets for console commands 📚.
agency-agents,msitarzewski,Shell,61732,9280,105,162,False,True,True,True,"A complete AI agency at your fingertips - From frontend wizards to Reddit community ninjas, from whimsy injectors to reality checkers. Each agent is a specialized expert with personality, processes, and proven deliverables."
lodash,lodash,JavaScript,61575,7126,136,5100,False,True,True,True,"A modern JavaScript utility library delivering modularity, performance, & extras."
ladybird,LadybirdBrowser,C++,61474,2883,638,663,True,True,True,True,Truly independent web browser
redux,reduxjs,TypeScript,61459,15117,41,3952,True,True,True,True,A JS library for predictable global state management
ripgrep,BurntSushi,Rust,61356,2439,134,3666,False,False,True,True,ripgrep recursively searches directories for a regex pattern while respecting your gitignore
atom,atom,JavaScript,61002,17263,994,5177,True,True,False,True,:atom: The hackable text editor
scrapy,scrapy,Python,60936,11392,655,5875,True,True,True,True,"Scrapy, a fast high-level web crawling & scraping framework for Python."
leetcode-master,youngyangyang04,Shell,60869,12337,242,2292,False,False,False,True,《代码随想录》LeetCode 刷题攻略：200道经典题目刷题顺序，共60w字的详细图解，视频难点剖析，50余张思维导图，支持C++，Java，Python，Go，JavaScript等多语言版本，从此算法学习不再迷茫！🔥🔥 来看看，你会发现相见恨晚！🚀 
architect-awesome,xingshaocheng,,60843,17768,64,2909,False,False,False,True,后端架构师技术图谱
Front-end-Developer-Interview-Questions,h5bp,Nunjucks,60814,11067,50,5157,True,True,True,True,"A list of helpful front-end related questions you can use to interview potential candidates, test yourself or completely ignore."
minio,minio,Go,60545,7303,80,4087,True,True,True,True,"MinIO is a high-performance, S3 compatible object store, open sourced under GNU AGPLv3 license."
openpilot,commaai,Python,60416,10731,246,3408,False,True,True,True,"openpilot is an operating system for robotics. Currently, it upgrades the driver assistance system on 300+ supported cars."
markdown-here,adam-p,JavaScript,60172,11100,319,5064,False,True,False,True,"Google Chrome, Firefox, and Thunderbird extension that lets you write email in Markdown and render it before sending."
drawio-desktop,jgraph,JavaScript,60020,5627,67,3225,True,False,True,True,Official electron build of draw.io
30-Days-Of-Python,Asabeneh,Python,59988,11442,100,2317,False,False,True,True,The 30 Days of Python programming challenge is a step-by-step guide to learn the Python programming language in 30 days. This challenge may take more than 100 days. Follow your own pace. These videos may help too: https://www.youtube.com/channel/UC7PNRuno1rzYPb1xLa4yktw
nuxt,nuxt,TypeScript,59920,5576,929,3436,True,True,True,True,The Full-Stack Vue Framework.
git,git,C,59894,27698,360,6453,True,True,True,True,Git Source Code Mirror - This is a publish-only repository but pull requests can be turned into patches to the mailing list via GitGitGadget (https://gitgitgadget.github.io/). Please follow Documentation/SubmittingPatches procedure for any of your improvements.
jquery,jquery,JavaScript,59868,20473,96,6199,True,True,True,True,jQuery JavaScript Library
spring-framework,spring-projects,Java,59785,38902,358,5586,True,True,True,True,Spring Framework
Real-Time-Voice-Cloning,CorentinJ,Python,59557,9418,170,2494,False,False,True,True,Clone a voice in 5 seconds to generate arbitrary speech in real-time
Magisk,topjohnwu,Kotlin,59502,17053,53,3484,False,False,True,True,The Magic Mask for Android
awesome-flutter,Solido,Dart,59388,6870,26,3243,False,True,True,True,"An awesome list that curates the best Flutter libraries, tools, tutorials, articles and more."
cline,cline,TypeScript,59321,6023,702,626,True,True,True,True,"Autonomous coding agent right in your IDE, capable of creating/editing files, executing commands, using the browser, and more with your permission every step of the way."
shadowsocks-windows,shadowsocks,C#,59282,16283,199,4817,False,True,False,True,A C# port of shadowsocks
llama,meta-llama,Python,59255,9822,516,1134,True,True,True,True,Inference code for Llama models
llm-app,pathwaycom,Jupyter Notebook,58943,1397,9,979,True,True,True,True,"Ready-to-run cloud templates for RAG, AI pipelines, and enterprise search with live data. 🐳Docker-friendly.⚡Always in sync with Sharepoint, Google Drive, S3, Kafka, PostgreSQL, real-time data APIs, and more."
angular.js,angular,JavaScript,58898,27214,461,5922,True,True,False,True,AngularJS - HTML enhanced for web apps!
awesome-chatgpt-prompts-zh,PlexPt,,58817,13562,43,1199,False,False,False,True,ChatGPT 中文调教指南。各种场景使用指南。学习怎么让它听你的话。
mkcert,FiloSottile,Go,58359,3048,165,2829,True,True,True,True,A simple zero-config tool to make locally trusted development certificates with any names you'd like.
rails,rails,Ruby,58338,22176,1534,6557,True,True,True,True,Ruby on Rails
FFmpeg,FFmpeg,C,58274,13616,3,5458,False,True,False,True,Mirror of https://git.ffmpeg.org/ffmpeg.git
memos,usememos,Go,58167,4208,31,1567,False,False,True,True,"Open-source, self-hosted note-taking tool built for quick capture. Markdown-native, lightweight, and fully yours."
unsloth,unslothai,Python,58077,4895,1031,846,True,True,True,True,"Unsloth Studio is a web UI for training and running open models like Qwen, DeepSeek, gpt-oss and Gemma locally."
astro,withastro,TypeScript,57855,3265,271,1835,True,True,True,True,The web framework for content-driven websites. ⭐️ Star to support our work!
bat,sharkdp,Rust,57806,1490,340,2894,False,True,True,True,A cat(1) clone with wings.
zustand,pmndrs,TypeScript,57519,1999,4,2541,False,True,True,True,🐻 Bear necessities for state management in React
html5-boilerplate,h5bp,JavaScript,57410,12301,25,5903,True,True,True,True,"A professional front-end template for building fast, robust, and adaptable web apps or sites."
fuel-core,FuelLabs,Rust,57264,2863,191,2035,False,True,True,True,Rust full node implementation of the Fuel v2 protocol.
DeepLearning-500-questions,scutan90,JavaScript,57254,15964,121,2827,False,False,False,True,深度学习500问，以问答形式对常用的概率知识、线性代数、机器学习、深度学习、计算机视觉等热点问题进行阐述，以帮助自己及有需要的读者。 全书分为18个章节，50余万字。由于水平有限，书中不妥之处恳请广大读者批评指正。   未完待续............ 如有意合作，联系scutjy2015@163.com                     版权所有，违权必究       Tan 2018.06
vaultwarden,dani-garcia,Rust,57252,2657,50,2957,False,False,True,True,"Unofficial Bitwarden compatible server written in Rust, formerly known as bitwarden_rs"
private-gpt,zylon-ai,Python,57191,7612,292,1057,False,False,True,True,"Interact with your documents using the power of GPT, 100% privately, no data leaks"
MinerU,opendatalab,Python,57120,4725,192,754,False,False,True,True,Transforms complex documents like PDFs into LLM-ready markdown/JSON for your Agentic workflows.
pocketbase,pocketbase,Go,57099,3214,24,1358,False,True,True,True,Open Source realtime backend in 1 file
yolov5,ultralytics,Python,57075,17435,44,2137,True,True,True,True,YOLOv5 🚀 in PyTorch > ONNX > CoreML > TFLite
you-get,soimort,Python,56835,9778,381,4964,False,True,True,True,:arrow_double_down: Dumb downloader that scrapes the web
meilisearch,meilisearch,Rust,56715,2444,283,2892,True,True,True,True,A lightning-fast search engine API bringing AI-powered hybrid search to your sites and applications.
anything-llm,Mintplex-Labs,JavaScript,56688,6128,300,1025,False,True,True,True,The all-in-one AI productivity accelerator. On device and privacy first with no annoying setup or configuration.
docling,docling-project,Python,56448,3841,856,623,True,True,True,True,Get your documents ready for gen AI
awesome-rust,rust-unofficial,Rust,56347,3248,10,4268,False,True,True,True,A curated list of Rust code and resources.
react-router,remix-run,TypeScript,56332,10842,151,4330,True,True,True,True,Declarative routing for React
pi-hole,pi-hole,Shell,56266,2997,57,4307,True,True,True,True,A black hole for Internet advertisements
rclone,rclone,Go,56243,4993,1156,4391,True,True,True,True,"""rsync for cloud storage"" - Google Drive, S3, Dropbox, Backblaze B2, One Drive, Swift, Hubic, Wasabi, Google Cloud Storage, Azure Blob, Azure Files, Yandex Files"
face_recognition,ageitgey,Python,56225,13705,831,3308,False,True,True,True,The world's simplest facial recognition api for Python and the command line
autogen,microsoft,Python,56161,8443,701,949,True,True,True,True,A programming framework for agentic AI
GPT-SoVITS,RVC-Boss,Python,56087,6120,867,800,False,False,True,True,1 min voice data can also be used to train a good TTS model! (few shot voice cloning)
gatsby,gatsbyjs,JavaScript,55949,10214,353,3960,True,True,True,True,"React-based framework with performance, scalability, and security built in."
rich,Textualize,Python,55870,2073,310,2326,True,True,True,True,Rich is a Python library for rich text and beautiful formatting in the terminal.
github-cheat-sheet,tiimgreen,,55842,5410,43,4364,False,True,False,True,A list of cool features of Git and GitHub.
leetcode,azl397985856,JavaScript,55814,9435,10,2916,False,True,False,True,LeetCode Solutions: A Record of My Problem Solving Journey.( leetcode题解，记录自己的leetcode解题之路。)
awesome-android-ui,wasabeef,,55722,10273,38,4109,True,False,False,True,A curated list of awesome Android UI/UX libraries
project-layout,golang-standards,Makefile,55624,5439,97,3118,False,False,False,True,Standard Go Project Layout
nanoGPT,karpathy,Python,55527,9459,340,1183,False,False,False,True,"The simplest, fastest repository for training/finetuning medium-sized GPTs."
OpenManus,FoundationAgents,Python,55461,9691,526,383,True,False,True,True,"No fortress, purely open ground.  OpenManus is Coming."
hackingtool,Z4nzu,Python,55305,6024,4,2173,False,False,True,True,ALL IN ONE Hacking Tool For Hackers
appwrite,appwrite,TypeScript,55273,5112,746,2542,True,True,True,True,"Appwrite® - complete cloud infrastructure for your web, mobile and AI apps. Including Auth, Databases, Storage, Functions, Messaging, Hosting, Realtime and more"
gpt-engineer,AntonOsika,Python,55229,7312,68,1060,True,True,True,True,CLI platform to experiment with codegen. Precursor to: https://lovable.dev
starship,starship,Rust,55169,2427,1000,2549,True,True,True,True,"☄🌌️  The minimal, blazing-fast, and infinitely customizable prompt for any shell!"
faceswap,deepfakes,Python,55066,13413,4,3017,True,False,True,True,Deepfakes Software For All
ultralytics,ultralytics,Python,54943,10560,306,1290,True,True,True,True,Ultralytics YOLO 🚀
ai-agents-for-beginners,microsoft,Jupyter Notebook,54904,18981,7,481,True,False,True,True,12 Lessons to Get Started Building AI Agents
marktext,marktext,JavaScript,54684,4053,1415,3054,True,True,True,True,"📝A simple and elegant markdown editor, available for Linux, macOS and Windows."
autoresearch,karpathy,Python,54604,7597,157,18,False,False,True,True,AI agents running research on single-GPU nanochat training automatically
gitea,go-gitea,Go,54468,6489,2869,3431,True,True,True,True,"Git with a cup of tea! Painless self-hosted all-in-one software development service, including Git hosting, code review, team collaboration, package registry and CI/CD"
ChatGPT,lencx,Rust,54370,6193,925,1203,False,False,True,True,"🔮 ChatGPT Desktop Application (Mac, Windows and Linux)"
element,ElemeFE,Vue,54190,14524,2967,3489,False,False,True,True,A Vue.js 2.0 UI Toolkit for Web
maybe,maybe-finance,Ruby,54049,5468,0,813,False,True,True,True,The personal finance app for everyone
joplin,laurent22,TypeScript,54041,5999,609,3354,False,True,True,True,"Joplin - the privacy-focused note taking app with sync capabilities for Windows, macOS, Linux, Android and iOS."
requests,psf,Python,53868,9795,286,5518,True,True,True,True,"A simple, yet elegant, HTTP library."
normalize.css,necolas,CSS,53771,10455,74,5438,False,True,False,True,A modern alternative to CSS resets
segment-anything,facebookresearch,Jupyter Notebook,53766,6295,592,1097,True,True,True,True,"The repository provides code for running inference with the SegmentAnything Model (SAM), links for downloading the trained model checkpoints, and example notebooks that show how to use the model."
dive,wagoodman,Go,53641,1964,200,2872,False,False,True,True,A tool for exploring each layer in a docker image
powerlevel10k,romkatv,Shell,53470,2395,138,2585,False,False,False,True,A Zsh theme
core,vuejs,TypeScript,53308,9070,1000,2842,False,True,True,True,"🖖 Vue.js is a progressive, incrementally-adoptable JavaScript framework for building UI on the web."
trackerslist,ngosang,,53293,6628,6,3621,False,False,True,True,Updated list of public BitTorrent trackers
n8n-workflows,Zie619,Python,53175,6896,21,314,False,False,True,True,all of the workflows of n8n i could find (also from the site itself)
first-contributions,firstcontributions,,53157,100111,162,3472,True,True,True,True,🚀✨ Help beginners to contribute to open source projects
Free-Certifications,cloudcommunity,,53084,3509,69,2062,False,False,False,True,A curated list of free courses with certifications. Also available at https://free-certifications.com/
pdf.js,mozilla,JavaScript,53022,10602,474,5446,True,True,True,True,PDF Reader in JavaScript
material-design-icons,google,,53020,9730,400,4185,True,True,True,True,Material Design icons by Google (Material Symbols)
ImHex,WerWolv,C++,52971,2343,333,1960,True,True,True,True,"🔍 A Hex Editor for Reverse Engineers, Programmers and people who value their retinas when working at 3 AM."
MoneyPrinterTurbo,harry0703,Python,52778,7466,237,744,False,False,True,True,利用AI大模型，一键生成高清短视频 Generate short videos with one click using AI LLM.
v2rayNG,2dust,Kotlin,52691,7070,6,2506,False,False,True,True,"A V2Ray client for Android, support Xray core and v2fly core"
kotlin,JetBrains,Kotlin,52500,6264,222,5153,True,True,True,True,The Kotlin Programming Language. 
termux-app,termux,Java,52430,6270,507,3805,False,False,True,True,Termux - a terminal emulator application for Android OS extendible by variety of packages.
ionic-framework,ionic-team,TypeScript,52412,13381,629,4599,True,True,True,True,"A powerful cross-platform UI toolkit for building native-quality iOS, Android, and Progressive Web Apps with HTML, CSS, and JavaScript."
Docker-OSX,sickcodes,Shell,52344,2907,415,2119,False,False,True,True,Run macOS VM in a Docker! Run near native OSX-KVM in Docker! X11 Forwarding! CI/CD for OS X Security Research! Docker mac Containers.
typst,typst,Rust,52260,1514,1158,2373,False,True,True,True,A markup-based typesetting system that is powerful and easy to learn.
Ghost,TryGhost,JavaScript,52134,11386,370,4707,True,True,True,True,"Independent technology for modern publishing, memberships, subscriptions and newsletters."
PowerShell,PowerShell,C#,52113,8235,1424,3723,True,True,True,True,PowerShell for every system!
coolify,coollabsio,PHP,52066,3874,674,1884,True,True,True,True,"An open-source, self-hostable PaaS alternative to Vercel, Heroku & Netlify that lets you easily deploy static sites, databases, full-stack applications and 280+ one-click services on your own servers."
prettier,prettier,JavaScript,51753,4680,1458,3402,True,True,True,True,Prettier is an opinionated code formatter.
etcd,etcd-io,Go,51698,10342,217,4644,True,True,True,True,Distributed reliable key-value store for the most critical data of a distributed system
awesome-ios,vsouza,Swift,51610,6962,19,4275,True,True,True,True,"A curated list of awesome iOS ecosystem, including Objective-C and Swift Projects "
grok-1,xai-org,Python,51528,8471,125,737,True,False,True,True,Grok open release
guava,google,Java,51502,11150,723,4317,True,True,True,True,Google core libraries for Java
jekyll,jekyll,Ruby,51491,10296,243,6364,True,True,True,True,:globe_with_meridians: Jekyll is a blog-aware static site generator in Ruby
chinese-poetry,chinese-poetry,JavaScript,51151,10334,129,3491,False,False,True,True,"The most comprehensive database of Chinese poetry 🧶最全中华古诗词数据库,  唐宋两朝近一万四千古诗人,  接近5.5万首唐诗加26万宋诗.  两宋时期1564位词人，21050首词。"
Motrix,agalwood,JavaScript,51128,4830,775,2653,True,True,True,True,A full-featured download manager.
Semantic-UI,Semantic-Org,JavaScript,51120,4893,1074,4733,False,True,False,True,Semantic is a UI component framework based around useful principles from natural language.
DefinitelyTyped,DefinitelyTyped,TypeScript,51107,30561,694,4918,False,False,True,True,The repository for high quality TypeScript type definitions.
Flowise,FlowiseAI,TypeScript,51049,23976,811,1089,True,True,True,True,"Build AI Agents, Visually"
mem0,mem0ai,Python,50969,5709,547,1008,False,True,True,True,Universal memory layer for AI Agents
go-ethereum,ethereum,Go,50951,21879,377,4471,False,True,True,True,Go implementation of the Ethereum protocol
windows,dockur,Shell,50710,4159,116,800,False,False,True,True,Windows inside a Docker container.
professional-programming,charlax,Python,50688,3971,2,3790,False,True,False,True,A collection of learning resources for curious software engineers
awesome-wechat-weapp,justjavac,,50670,9008,2,3470,False,False,False,True,微信小程序开发资源汇总 :100:
hiring-without-whiteboards,poteto,JavaScript,50520,3882,38,3296,True,True,True,True,⭐️  Companies that don't have a broken hiring process
context7,upstash,TypeScript,50483,2387,170,363,False,False,True,True,Context7 Platform -- Up-to-date code documentation for LLMs and AI code editors
lazydocker,jesseduffield,Go,50347,1591,262,2502,True,True,True,True,The lazier way to manage everything docker
nanochat,karpathy,Python,50221,6581,86,162,False,False,True,True,The best ChatGPT that $100 can buy.
winutil,ChrisTitusTech,PowerShell,50177,2705,21,1427,True,True,True,True,"Chris Titus Tech's Windows Utility - Install Programs, Tweaks, Fixes, and Updates"
bulma,jgthms,CSS,50063,3904,521,3713,False,True,True,True,Modern CSS framework based on Flexbox
100-Days-Of-ML-Code,Avik-Jain,,50056,11371,66,2819,True,True,False,True,100 Days of ML Coding
ui-ux-pro-max-skill,nextlevelbuilder,Python,49928,4822,77,114,False,False,True,True,An AI SKILL that provide design intelligence for building professional UI/UX multiple platforms
mastodon,mastodon,Ruby,49790,7425,4435,3683,True,True,True,True,"Your self-hosted, globally interconnected microblogging community"
odoo,odoo,Python,49730,31892,9426,4333,False,True,False,True,Odoo. Open Source Apps To Grow Your Business.
TrendRadar,sansan0,Python,49703,22787,50,330,False,False,True,True,"⭐AI-driven public opinion & trend monitor with multi-platform aggregation, RSS, and smart alerts.🎯 告别信息过载，你的 AI 舆情监控助手与热点筛选工具！聚合多平台热点 +  RSS 订阅，支持关键词精准筛选。AI 智能筛选新闻 + AI 翻译 +  AI 分析简报直推手机，也支持接入 MCP 架构，赋能 AI 自然语言对话分析、情感洞察与趋势预测等。支持 Docker ，数据本地/云端自持。集成微信/飞书/钉钉/Telegram/邮件/ntfy/bark/slack 等渠道智能推送。"
cypress,cypress-io,TypeScript,49612,3397,1213,4039,True,True,True,True,"Fast, easy and reliable testing for anything that runs in a browser."
jellyfin,jellyfin,C#,49598,4559,881,2662,True,True,True,True,The Free Software Media System - Server Backend & API
ai-hedge-fund,virattt,Python,49540,8615,90,480,False,False,True,True,An AI Hedge Fund Team
lx-music-desktop,lyswhut,TypeScript,49519,6665,1103,2414,False,False,True,True,一个基于 Electron 的音乐软件
hacker-scripts,NARKOZ,JavaScript,49450,6665,69,3776,False,False,False,True,Based on a true story
open-source-ios-apps,dkhamsing,,49363,5744,1,4075,False,True,True,True,:iphone: Collaborative List of Open-Source iOS Apps
dbeaver,dbeaver,Java,49264,4088,3250,3807,True,True,True,True,Free universal database tool and SQL client
alist,AlistGo,Go,49220,7971,566,1917,True,True,True,True,"🗂️A file list/WebDAV program that supports multiple storages, powered by Gin and Solidjs. / 一个支持多存储的文件列表/WebDAV程序，使用 Gin 和 Solidjs。"
json,nlohmann,C++,49217,7340,104,4646,True,True,True,True,JSON for Modern C++
