repo_name,organization,language,stars,forks,open_issues,age_days,has_coc,has_contributing,has_workflows,has_readme,description
milvus,milvus-io,Go,44941,4090,923,2474,True,True,True,True,"Milvus is a high-performance, cloud-native vector database built for scalable vector ANN search"
grpc,grpc,C++,44923,11162,1363,4216,True,True,True,True,"C++ based gRPC (C++, Python, Ruby, Objective-C, PHP, C#)"
pyenv,pyenv,Shell,44914,3252,57,5045,False,True,True,True,Simple Python version management
RSSHub,DIYgod,TypeScript,44912,9950,353,3005,True,True,True,True,🧡 Everything is RSSible
edex-ui,GitSquared,JavaScript,44909,3133,6,3434,False,False,True,True,"A cross-platform, customizable science fiction terminal emulator with advanced monitoring & touchscreen support."
supervision,roboflow,Python,44887,3986,101,1304,True,True,True,True,We write your reusable computer vision tools. 💜
meteor,meteor,JavaScript,44792,5245,402,5271,True,True,True,True,"Meteor, the JavaScript App Platform"
react-hook-form,react-hook-form,TypeScript,44774,2420,52,2668,True,True,True,True,📋 React Hooks for form state management and validation (Web + React Native)
nanobot,HKUDS,Python,44710,7885,885,143,False,True,True,True,"Lightweight, open-source AI agent for your tools, chats, and workflows."
reactjs-interview-questions,sudheerj,JavaScript,44654,10363,15,2946,False,False,True,True,List of top 500 ReactJS Interview Questions & Answers....Coding exercise questions are coming soon!!
hyper,vercel,TypeScript,44621,3564,1043,3646,False,False,True,True,A terminal built on web technologies
siyuan,siyuan-note,TypeScript,44598,2844,309,2124,True,True,True,True,"A privacy-first, self-hosted, fully open source personal knowledge management software, written in typescript and golang."
chrome-devtools-mcp,ChromeDevTools,TypeScript,44380,2869,87,286,False,True,True,True,Chrome DevTools for coding agents
system-design,karanpratapsingh,,44187,5747,3,1409,True,True,False,True,Learn how to design systems at scale and prepare for system design interviews
jsoncrack.com,AykutSarac,TypeScript,44168,3549,34,1606,True,True,True,True,"✨ Innovative and open-source visualization application that transforms various data formats, such as JSON, YAML, XML and CSV into interactive graphs."
sentry,getsentry,Python,44159,4730,2129,5777,True,True,True,True,Developer-first error tracking and performance monitoring
cobra,spf13,Go,44157,3153,379,4677,False,True,True,True,A Commander for modern Go CLI interactions
EasySpider,NaiboWang,JavaScript,44149,5385,268,2168,False,False,True,True,A visual no-code/code-free web crawler/spider易采集：一个可视化浏览器自动化测试/数据采集/网页爬虫软件，可以无代码图形化的设计和执行爬虫任务。别名：ServiceWrapper面向Web应用的智能化服务封装系统。
mitmproxy,mitmproxy,Python,44051,4605,442,5973,True,True,True,True,An interactive TLS-capable intercepting HTTP proxy for penetration testers and software developers.
Files,files-community,C#,44031,2758,481,2728,True,True,True,True,A modern file manager that helps users organize their files and folders.
parcel,parcel-bundler,JavaScript,44026,2279,598,3243,True,True,True,True,The zero configuration build tool for the web. 📦🚀
babel,babel,TypeScript,44007,5828,754,4287,True,True,True,True,🐠 Babel is a compiler for writing next generation JavaScript.
react-use,streamich,TypeScript,43990,3273,661,2797,False,True,True,True,React Hooks — 👍
front-end-interview-handbook,yangshun,MDX,43969,5936,12,3084,True,True,True,True,Front End interview preparation materials for busy engineers (updated for 2026)
build-web-application-with-golang,astaxie,Go,43920,10468,138,5074,False,False,False,True,A golang ebook intro how to build a web with golang
retrofit,square,HTML,43912,7339,170,5770,False,True,True,True,A type-safe HTTP client for Android and the JVM
full-stack-fastapi-template,fastapi,TypeScript,43863,8698,17,2678,False,True,True,True,"Full stack, modern web application template. Using FastAPI, React, SQLModel, PostgreSQL, Docker, GitHub Actions, automatic HTTPS and more."
CL4R1T4S,elder-plinius,,43788,8893,112,477,False,False,False,True,"LEAKED SYSTEM PROMPTS FOR CHATGPT, CLAUDE, GEMINI, GROK, PERPLEXITY, CURSOR, LOVABLE, REPLIT, AND MORE! - AI SYSTEMS TRANSPARENCY FOR ALL! 👐"
CLI-Anything,HKUDS,Python,43764,4094,64,108,False,True,True,True,"""CLI-Anything: Making ALL Software Agent-Native"" -- CLI-Hub: https://clianything.cc/"
TensorFlow-Examples,aymericdamien,Jupyter Notebook,43742,14704,228,3878,False,False,False,True,TensorFlow Tutorial and Examples for Beginners (support TF v1 & v2)
kong,Kong,Lua,43670,5158,151,4237,True,True,True,True,🦍 The API and AI Gateway
logseq,logseq,Clojure,43551,2680,912,2224,True,True,True,True,"A privacy-first, open-source platform for knowledge management and collaboration. Download link:  http://github.com/logseq/logseq/releases. roadmap: https://logseq.io/p/NX4mc_ggEV"
spark,apache,Scala,43500,29254,423,4502,True,True,True,True,Apache Spark - A unified analytics engine for large-scale data processing
fd,sharkdp,Rust,43464,1074,168,3333,False,True,True,True,"A simple, fast and user-friendly alternative to 'find'"
FlClash,chen08209,Dart,43449,2729,479,1044,False,False,True,True,"A multi-platform proxy client based on ClashMeta,simple and easy to use, open-source and ad-free."
bubbletea,charmbracelet,Go,43351,1243,185,2357,False,True,True,True,A powerful little TUI framework 🏗
CPlusPlusThings,Light-City,C++,43239,8829,10,2537,False,False,False,True,C++那些事
pm2,Unitech,JavaScript,43224,2714,1084,4783,False,True,True,True,Node.js Production Process Manager with a built-in Load Balancer.
payload,payloadcms,TypeScript,43213,3843,834,1996,False,True,True,True,"Payload is the open-source, fullstack Next.js framework, giving you instant backend superpowers. Get a full TypeScript backend and admin panel instantly. Use Payload as a headless CMS or for building powerful applications."
zig,ziglang,Zig,43212,3059,2900,3976,False,False,False,True,Moved to Codeberg
what-happens-when,alex,,43197,5738,2065,4613,False,False,True,True,"An attempt to answer the age old interview question ""What happens when you type google.com into your browser and press enter?"""
jan,janhq,TypeScript,43195,2956,467,1043,True,True,True,True,Jan is an open source alternative to ChatGPT that runs 100% offline on your computer.
fuels-rs,FuelLabs,Rust,43145,1362,72,1697,False,False,True,True,Fuel Network Rust SDK
fuels-ts,FuelLabs,TypeScript,43115,1371,78,1755,True,True,True,True,Fuel Network Typescript SDK
hyperswitch,juspay,Rust,43104,4874,1876,1346,True,True,True,True,"Open source, composable payments platform | PCI compliant | SaaS and Self-host options | Enables connectivity to multiple payment, payout, fraud, vault and tokenization providers | Uplifts authorization with intelligent routing and revenue recovery | Reduce payment processing costs with cost observability | Reduces payment ops with reconciliation"
zod,colinhacks,TypeScript,43046,2037,224,2300,True,True,True,True,TypeScript-first schema validation with static type inference
ccxt,ccxt,Python,43045,8711,1325,3328,False,True,True,True,A cryptocurrency trading API with more than 100 exchanges in JavaScript / TypeScript / Python / C# / PHP / Go / Java 
desktop,zen-browser,JavaScript,43016,1580,541,819,True,False,True,True,Welcome to a calmer internet
ray,ray-project,Python,43009,7725,3485,3529,False,True,True,True,Ray is an AI compute engine. Ray consists of a core distributed runtime and a set of AI Libraries for accelerating ML workloads.
gradio,gradio-app,Python,42990,3508,261,2744,True,True,True,True,"Build and share delightful machine learning apps, all in Python. 🌟 Star to support our work!"
GitNexus,abhigyanpatwari,TypeScript,42917,4826,262,326,False,True,True,True,"GitNexus: The Zero-Server Code Intelligence Engine -       GitNexus is a client-side knowledge graph creator that runs entirely in your browser. Drop in a git repository (Github, Gitlab, Azure, Local) or ZIP file, and get an interactive knowledge graph with a built in Graph RAG Agent. Perfect for code exploration"
python-patterns,faif,Python,42814,7014,15,5131,False,False,True,True,A collection of design patterns/idioms in Python
data-engineering-zoomcamp,DataTalksClub,Jupyter Notebook,42753,8461,0,1707,False,False,True,True,Data Engineering Zoomcamp is a free 9-week course on building production-ready data pipelines. The next cohort starts in January 2026. Join the course here 👇🏼
Fabric,danielmiessler,Go,42624,4194,64,903,True,True,True,True,Fabric is an open-source framework for augmenting humans using AI. It provides a modular system for solving specific problems using a crowdsourced set of AI prompts that can be used anywhere.
DeepSpeed,deepspeedai,Python,42575,4866,1308,2344,True,True,True,True,"DeepSpeed is a deep learning optimization library that makes distributed training and inference easy, efficient, and effective."
container,apple,Swift,42537,1249,384,390,True,True,True,True,"A tool for creating and running Linux containers using lightweight virtual machines on a Mac. It is written in Swift, and optimized for Apple silicon. "
git-flight-rules,k88hudson,,42472,3173,14,4355,False,False,False,True,Flight rules for git
paperless-ngx,paperless-ngx,Python,42464,2831,5,1593,True,True,True,True,"A community-supported supercharged document management system: scan, index and archive all your documents"
puter,HeyPuter,TypeScript,42416,3899,15,844,False,True,True,True,"🌐 The Internet Computer! Free, Open-Source, and Self-Hostable."
diagrams,mingrammer,Python,42396,2729,388,2334,False,True,True,True,:art: Diagram as Code for prototyping cloud system architectures
Alamofire,Alamofire,Swift,42393,7667,43,4347,False,True,True,True,Elegant HTTP Networking in Swift
ailearning,apachecn,Python,42350,11542,4,3406,False,False,False,True,AiLearning：数据分析+机器学习实战+线性代数+PyTorch+NLTK+TF2
curl,curl,C,42231,7245,63,5942,True,True,True,True,"A command line tool and library for transferring data with URL syntax, supporting DICT, FILE, FTP, FTPS, GOPHER, GOPHERS, HTTP, HTTPS, IMAP, IMAPS, LDAP, LDAPS, MQTT, MQTTS, POP3, POP3S, RTSP, SCP, SFTP, SMB, SMBS, SMTP, SMTPS, TELNET, TFTP, WS and WSS. libcurl offers a myriad of powerful features"
HEU_KMS_Activator,zbezj,,42125,3884,174,2559,False,False,False,True,
vnpy,vnpy,Python,42045,11978,16,4133,True,False,True,True,基于Python的开源量化交易平台开发框架
swiper,nolimits4web,JavaScript,41857,9651,250,5215,True,True,False,True,Most modern mobile touch slider with hardware accelerated transitions
data-engineer-handbook,DataExpert-io,Jupyter Notebook,41834,7892,39,948,False,False,False,True,This is a repo with links to everything you'd ever want to learn about data engineering
react-bits,DavidHDev,JavaScript,41807,1920,0,687,False,True,True,True,"An open source collection of animated, interactive & fully customizable React components for building memorable websites."
hexo,hexojs,TypeScript,41770,27,97,5022,True,True,True,True,"A fast, simple & powerful blog framework, powered by Node.js."
WeChatMsg,LC044,,41720,5229,25,1261,False,False,False,True,
fastlane,fastlane,Ruby,41708,6016,743,4222,True,True,True,True,🚀 The easiest way to automate building and releasing your iOS and Android apps
pure-bash-bible,dylanaraps,Shell,41667,3626,62,2934,False,True,False,True,📖 A collection of pure bash alternatives to external processes.
antigravity-awesome-skills,sickn33,Python,41639,6679,5,161,True,True,True,True,"Installable GitHub library of 1,600+ agentic skills for Claude Code, Cursor, Codex CLI, Gemini CLI, Antigravity, and more. Includes specialized plugins, installer CLI, bundles, workflows, and official/community skill collections."
lossless-cut,mifi,TypeScript,41631,2029,255,3524,False,True,True,True,The swiss army knife of lossless video/audio editing
black,psf,Python,41581,2780,283,3024,True,True,True,True,The uncompromising Python code formatter
uni-app,dcloudio,Objective-C,41556,3711,692,2904,False,True,True,True,A cross-platform framework using Vue.js
dubbo,apache,Java,41521,26425,997,5118,True,True,True,True,The java implementation of Apache Dubbo. An RPC and microservice framework.
BettaFish,666ghj,Python,41502,7604,35,723,True,True,True,True,微舆：人人可用的多Agent舆情分析助手，打破信息茧房，还原舆情原貌，预测未来走向，辅助决策！从0实现，不依赖任何框架。
yarn,yarnpkg,JavaScript,41500,2723,2056,3809,True,True,True,True,The 1.x line is frozen - features and bugfixes now happen on https://github.com/yarnpkg/berry
cheat.sh,chubin,Python,41484,1915,144,3335,False,True,True,True,the only cheat sheet you need
3x-ui,MHSanaei,Go,41447,7725,85,1231,False,True,True,True,"Xray panel supporting multi-protocol multi-user expire day & traffic & IP limit (Vmess, Vless, Trojan, ShadowSocks, Wireguard, Hysteria, Tunnel, Mixed, HTTP, Tun) "
ColossalAI,hpcaitech,Python,41406,4506,501,1700,False,True,True,True,"Making large AI models cheaper, faster and more accessible"
dive-into-llms,Lordog,Jupyter Notebook,41394,5028,14,807,False,False,False,True,《动手学大模型Dive into LLMs》系列编程实践教程
aria2,aria2,C++,41289,3870,1149,5688,False,False,True,True,"aria2 is a lightweight multi-protocol & multi-source, cross platform download utility operated in command-line. It supports HTTP/HTTPS, FTP, SFTP, BitTorrent and Metalink."
airi,moeru-ai,TypeScript,41234,4146,186,570,True,True,True,True,"💖🧸 Self hosted, you-owned Grok Companion, a container of souls of waifu, cyber livings to bring them into our worlds, wishing to achieve Neuro-sama's altitude. Capable of realtime voice chat, Minecraft, Factorio playing. Web / macOS / Windows supported."
cobalt,imputnet,Svelte,41218,3533,251,1447,False,True,True,True,best way to save what you love
tabler,tabler,HTML,41211,4373,140,3065,True,False,True,True,Tabler is free and open-source HTML Dashboard UI Kit built on Bootstrap
impeccable,pbakaus,JavaScript,41204,2275,43,221,False,False,True,True,The design language that makes your AI harness better at design.
nw.js,nwjs,JavaScript,41189,3849,899,5286,False,False,False,True,Call all Node.js modules directly from DOM/WebWorker and enable a new way of writing applications with all Web technologies.
daisyui,saadeghi,Svelte,41174,1635,60,2034,False,True,True,True,"🌼 🌼 🌼 🌼 🌼  The most popular, free and open-source Tailwind CSS component library"
styled-components,styled-components,TypeScript,41103,2525,11,3600,True,True,True,True,"Fast, expressive styling for React. Server components, client components, streaming SSR, React Native—one API."
vue2-elm,bailicangdu,Vue,41058,12269,121,3471,False,False,True,True,Large single page application with 45 pages built on vue2 + vuex. 基于 vue2 + vuex 构建一个具有 45 个页面的大型单页面应用
ChatGLM-6B,zai-org,Python,41036,5136,609,1199,False,False,False,True,ChatGLM-6B: An Open Bilingual Dialogue Language Model | 开源双语对话语言模型
vuetify,vuetifyjs,TypeScript,41003,7134,518,3573,True,True,True,True,🐉 Vue Component Framework
free,freefq,,40940,5631,585,2209,False,False,False,True,翻墙、免费翻墙、免费科学上网、免费节点、免费梯子、免费ss/v2ray/trojan节点、蓝灯、谷歌商店、翻墙梯子
agno,agno-agi,Python,40836,5554,942,1512,True,True,True,True,"Build, run, and manage agent platforms."
zju-icicles,QSCTech,HTML,40631,9577,10,3648,False,False,True,True,浙江大学课程攻略共享计划
chatbox,chatboxai,TypeScript,40627,4119,1192,1206,False,False,True,True,Powerful AI Client
50projects50days,bradtraversy,CSS,40596,9745,48,2046,False,False,False,True,"50+ mini web projects using HTML, CSS & JS"
vim,vim,Vim Script,40551,6083,1641,3963,False,True,True,True,The official Vim repository
remote-jobs,remoteintech,JavaScript,40496,3945,14,3908,True,True,True,True,Source for remoteintech.company — a community-maintained directory of remote-friendly tech companies
chakra-ui,chakra-ui,TypeScript,40476,3618,15,2503,True,True,True,True,Chakra UI is a component system for building SaaS products with speed ⚡️
headscale,juanfont,Go,40394,2215,119,2194,True,True,True,True,"An open source, self-hosted implementation of the Tailscale control server"
faiss,facebookresearch,C++,40384,4436,290,3424,True,True,True,True,A library for efficient similarity search and clustering of dense vectors.
Awesome-Design-Tools,goabstract,JavaScript,40366,2277,160,2689,False,False,True,True,The best design tools and plugins for everything 👉
trpc,trpc,TypeScript,40362,1627,236,2168,False,True,True,True,🧙‍♀️  Move Fast and Break Nothing. End-to-end typesafe APIs made easy. 
wrk,wg,C,40339,3031,204,5209,False,False,True,True,Modern HTTP benchmarking tool
tidb,pingcap,Go,40206,6201,6358,3945,True,True,True,True,"TiDB is built for agentic workloads that grow unpredictably, with ACID guarantees and native support for transactions, analytics, and vector search. No data silos. No noisy neighbors. No infrastructure ceiling."
php-src,php,C,40197,8078,1849,5488,False,True,True,True,The PHP Interpreter
appsmith,appsmithorg,TypeScript,40152,4619,4461,2186,True,True,True,True,"Platform to build admin panels, internal tools, and dashboards. Integrates with 25+ databases and any API."
Agent-Reach,Panniantong,Python,40151,3181,101,121,False,True,True,True,"Give your AI agent eyes to see the entire internet. Read & search Twitter, Reddit, YouTube, GitHub, Bilibili, XiaoHongShu — one CLI, zero API fees."
awesome-cursorrules,PatrickJS,JavaScript,40084,3433,28,646,True,True,True,True,📄  Configuration files that enhance Cursor AI editor experience with custom rules and behaviors
bert,google-research,Python,40047,9699,880,2799,False,True,False,True,TensorFlow code and pre-trained models for BERT
new-api,QuantumNous,Go,39993,9149,883,957,True,False,True,True,"A unified AI model hub for aggregation & distribution. It supports cross-converting various LLMs into OpenAI-compatible, Claude-compatible, or Gemini-compatible formats. A centralized gateway for personal and enterprise model management. 🍥"
esbuild,evanw,Go,39951,1316,620,3662,False,False,True,True,An extremely fast bundler for the web
stats,exelban,Swift,39949,1395,18,2583,False,False,True,True,macOS system monitor in your menu bar
photoprism,photoprism,Go,39898,2304,467,3070,True,True,True,True,AI-Powered Photos App for the Decentralized Web 🌈💎✨
fiber,gofiber,Go,39891,1995,47,2352,True,True,True,True,⚡️ Express inspired web framework written in Go
Xray-core,XTLS,Go,39832,5521,54,2053,True,False,True,True,"Xray, Penetrates Everything. Also the best v2ray-core. Where the magic happens. An open platform for various uses."
phaser,phaserjs,JavaScript,39831,7145,113,4821,True,True,True,True,"Phaser is a fun, free and fast 2D game framework for making HTML5 games for desktop and mobile web browsers, supporting Canvas and WebGL rendering."
gorm,go-gorm,Go,39824,4152,526,4625,True,False,True,True,"The fantastic ORM library for Golang, aims to be developer friendly"
nushell,nushell,Rust,39811,2165,1432,2602,True,True,True,True,A new type of shell
video.js,videojs,JavaScript,39805,7494,666,5885,True,True,True,True,Video.js - open source HTML5 video player
gkd,gkd-kit,Kotlin,39773,1887,7,1087,False,False,True,True,"基于无障碍，高级选择器，订阅规则的自定义屏幕点击安卓应用 | An Android APP with custom screen tapping based on Accessibility, Advanced Selectors, and Subscription Rules"
LibreChat,danny-avila,TypeScript,39759,8154,503,1229,True,True,True,True,"Enhanced ChatGPT Clone: Features Agents, MCP, Skills, DeepSeek, Anthropic, AWS, OpenAI, Responses API, Azure, Groq, o1, GPT-5, Mistral, OpenRouter, Vertex AI, Gemini, Artifacts, AI model switching, message search, Code Interpreter, langchain, DALL-E-3, OpenAPI Actions, Functions, Secure Multi-User Auth, Presets, open-source for self-hosting. Active"
yazi,sxyazi,Rust,39752,911,66,1082,True,True,True,True,"💥 Blazing fast terminal file manager written in Rust, based on async I/O."
insomnia,Kong,TypeScript,39688,2347,855,3715,True,True,True,True,"The open-source, cross-platform API client for GraphQL, REST, WebSockets, SSE and gRPC. With Cloud, Local and Git storage."
shellcheck,koalaman,Haskell,39610,1931,1233,4968,False,False,True,True,"ShellCheck, a static analysis tool for shell scripts"
sniffnet,GyulyVGC,Rust,39587,1689,63,1424,True,True,True,True,Comfortably monitor your Internet traffic 🕵️‍♂️
Deep-Learning-Papers-Reading-Roadmap,floodsung,Python,39531,7289,91,3540,False,False,False,True,Deep Learning papers reading roadmap for anyone who are eager to learn this amazing tech!
it-tools,CorentinTh,Vue,39514,5061,809,2271,False,False,True,True,"Collection of handy online tools for developers, with great UX. "
ChatTTS,2noise,Python,39512,4249,63,758,False,False,True,True,A generative speech model for daily dialogue.
FastChat,lm-sys,Python,39486,4791,1023,1194,False,False,True,True,"An open platform for training, serving, and evaluating large language models. Release repo for Vicuna and Chatbot Arena."
BitNet,microsoft,Python,39455,3611,323,688,True,False,True,True,Official inference framework for 1-bit LLMs
styleguide,google,HTML,39391,12962,169,4053,True,True,True,True,Style guides for Google-originated open-source projects
minds,mindsdb,Makefile,39327,6204,1,2883,True,True,True,True,"General-purpose AI designed for knowledge workers — creators, strategists, and operators — and individuals seeking AI systems they can truly control to help them get work done, with full flexibility to extend and deploy anywhere (VPC, on-prem, or cloud)."
novu,novuhq,TypeScript,39200,4341,88,1763,True,True,True,True,The open-source communication infrastructure for agents and products
quivr,QuivrHQ,Python,39177,3720,24,1139,False,False,True,True,"Opiniated RAG for integrating GenAI in your apps 🧠   Focus on your product rather than the RAG. Easy integration in existing products with customisation!  Any LLM: GPT4, Groq, Llama. Any Vectorstore: PGVector, Faiss. Any Files. Anyway you want."
bark,suno-ai,Jupyter Notebook,39172,4673,268,1174,False,False,False,True,🔊 Text-Prompted Generative Audio Model
leveldb,google,C++,39170,8200,395,4319,True,True,True,True,LevelDB is a fast key-value storage library written at Google that provides an ordered mapping from string keys to string values.
manim,ManimCommunity,Python,39156,2924,495,2228,True,True,True,True,A community-maintained Python framework for creating mathematical animations. 
devdocs,freeCodeCamp,Ruby,39113,2607,236,4626,True,True,True,True,API Documentation Browser
halo,halo-dev,Java,39104,10303,131,3017,True,True,True,True,Halo 是一款强大易用的开源建站工具，从个人博客、知识库，到企业官网、在线商城，Halo 都能助您轻松实现，一站式满足您的多样化建站需求。
outline,outline,TypeScript,39063,3366,48,3685,True,False,True,True,"The fastest knowledge base for growing teams. Beautiful, realtime collaborative, feature packed, and markdown compatible."
ink,vadimdemedes,TypeScript,39054,1015,28,3300,True,True,True,True,🌈 React for interactive command-line apps
reactive-resume,amruthpillai,TypeScript,39023,4386,97,2282,False,False,True,True,"A one-of-a-kind resume builder that keeps your privacy in mind. Completely secure, customizable, portable, open-source and free forever. Try it out today!"
duckdb,duckdb,C++,39007,3359,557,2920,True,True,True,True,DuckDB is an analytical in-process SQL database management system
CodeWhale,Hmbown,Rust,38981,3355,243,156,True,True,True,True,"Open-source, community-driven agent harness"
awesome-system-design-resources,ashishps1,Java,38958,8355,14,974,False,False,False,True,Learn System Design concepts and prepare for interviews using free resources.
llvm-project,llvm,LLVM,38957,17608,37169,3486,True,True,True,True,The LLVM Project is a collection of modular and reusable compiler and toolchain technologies.
polars,pola-rs,Rust,38868,2904,2785,2233,True,True,True,True,"Extremely fast Query Engine for DataFrames, written in Rust"
materialize,Dogfalo,JavaScript,38859,4625,793,4303,True,True,True,True,"Materialize, a CSS Framework based on Material Design"
openscreen,siddharthvaddem,TypeScript,38823,2787,49,258,False,True,True,True,"Create stunning demos for free. Open-source, no subscriptions, no watermarks, and free for commercial use. An alternative to Screen Studio."
NewPipe,TeamNewPipe,Java,38802,3647,1414,3947,False,True,True,True,A libre lightweight streaming front-end for Android.
googletest,google,C++,38739,10803,571,3984,True,True,True,True,GoogleTest - Google Testing and Mocking Framework
preact,preactjs,JavaScript,38713,2037,150,3940,True,True,True,True,⚛️ Fast 3kB React alternative with the same modern API. Components & Virtual DOM.
Sunshine,LizardByte,C++,38597,2036,126,1652,True,True,True,True,Self-hosted game stream host for Moonlight.
lapce,lapce,Rust,38572,1293,887,3060,False,True,True,True,Lightning-fast and Powerful Code Editor written in Rust
GPT_API_free,chatanywhere,,38561,2653,20,1158,False,False,False,True,Free ChatGPT&DeepSeek API Key，免费ChatGPT&DeepSeek API。免费接入DeepSeek API和GPT4 API，支持 gpt | deepseek | claude | gemini | grok 等排名靠前的常用大模型。
Folo,RSSNext,TypeScript,38549,2092,369,808,True,True,True,True,🧡 Folo is the AI RSS Reader
python-cheatsheet,gto76,Python,38527,6709,0,3073,False,False,True,True,Comprehensive Python Cheatsheet
metasploit-framework,rapid7,Ruby,38456,14879,589,5413,True,True,True,True,Metasploit Framework
