repo_name,organization,language,stars,forks,open_issues,age_days,has_coc,has_contributing,has_workflows,has_readme,description
hyperswitch,juspay,Rust,41761,4577,1446,1260,True,True,True,True,"An open source payments switch written in Rust to make payments fast, reliable and affordable"
dubbo,apache,Java,41685,26521,955,5032,True,True,True,True,The java implementation of Apache Dubbo. An RPC and microservice framework.
litellm,BerriAI,Python,41613,6866,2122,978,False,True,True,True,"Python SDK, Proxy Server (AI Gateway) to call 100+ LLM APIs in OpenAI (or native) format, with cost tracking, guardrails, loadbalancing and logging. [Bedrock, Azure, OpenAI, VertexAI, Cohere, Anthropic, Sagemaker, HuggingFace, VLLM, NVIDIA NIM]"
ccxt,ccxt,Python,41577,8571,1372,3242,False,True,True,True,A cryptocurrency trading API with more than 100 exchanges in JavaScript / TypeScript / Python / C# / PHP / Go 
nw.js,nwjs,JavaScript,41533,3870,959,5199,False,False,False,True,Call all Node.js modules directly from DOM/WebWorker and enable a new way of writing applications with all Web technologies.
yarn,yarnpkg,JavaScript,41525,2733,2065,3723,True,True,True,True,The 1.x line is frozen - features and bugfixes now happen on https://github.com/yarnpkg/berry
payload,payloadcms,TypeScript,41524,3522,798,1910,False,True,True,True,"Payload is the open-source, fullstack Next.js framework, giving you instant backend superpowers. Get a full TypeScript backend and admin panel instantly. Use Payload as a headless CMS or for building powerful applications."
uni-app,dcloudio,Objective-C,41460,3715,676,2818,False,True,True,True,A cross-platform framework using Vue.js
pure-bash-bible,dylanaraps,Shell,41453,3638,62,2848,False,True,False,True,📖 A collection of pure bash alternatives to external processes.
black,psf,Python,41436,2746,322,2938,True,True,True,True,The uncompromising Python code formatter
jan,janhq,TypeScript,41406,2651,276,957,True,True,True,True,Jan is an open source alternative to ChatGPT that runs 100% offline on your computer.
paperclip,paperclipai,TypeScript,41382,6178,1365,28,False,True,True,True,Open-source orchestration for zero-human companies
ColossalAI,hpcaitech,Python,41373,4522,492,1614,False,True,True,True,"Making large AI models cheaper, faster and more accessible"
remotion,remotion-dev,TypeScript,41336,2657,69,2106,True,True,True,True,🎥      Make videos programmatically with React
hexo,hexojs,TypeScript,41330,5038,98,4936,True,True,True,True,"A fast, simple & powerful blog framework, powered by Node.js."
fastlane,fastlane,Ruby,41284,5980,824,4136,True,True,True,True,🚀 The easiest way to automate building and releasing your iOS and Android apps
ChatGLM-6B,zai-org,Python,41205,5201,605,1113,False,False,False,True,ChatGLM-6B: An Open Bilingual Dialogue Language Model | 开源双语对话语言模型
cheat.sh,chubin,Python,41173,1902,144,3249,False,True,True,True,the only cheat sheet you need
curl,curl,C,41145,7116,44,5856,True,True,True,True,"A command line tool and library for transferring data with URL syntax, supporting DICT, FILE, FTP, FTPS, GOPHER, GOPHERS, HTTP, HTTPS, IMAP, IMAPS, LDAP, LDAPS, MQTT, MQTTS, POP3, POP3S, RTMP, RTMPS, RTSP, SCP, SFTP, SMB, SMBS, SMTP, SMTPS, TELNET, TFTP, WS and WSS. libcurl offers a myriad of powerful features"
vue2-elm,bailicangdu,Vue,41143,12320,121,3385,False,False,True,True,Large single page application with 45 pages built on vue2 + vuex. 基于 vue2 + vuex 构建一个具有 45 个页面的大型单页面应用
bubbletea,charmbracelet,Go,41079,1151,173,2271,False,True,True,True,A powerful little TUI framework 🏗
desktop,zen-browser,JavaScript,41065,1415,509,733,True,False,True,True,Welcome to a calmer internet
styled-components,styled-components,TypeScript,41021,2527,9,3513,True,True,True,True,"Fast, expressive styling for React. Server components, client components, streaming SSR, React Native—one API."
vuetify,vuetifyjs,TypeScript,40986,7159,624,3487,True,True,True,True,🐉 Vue Component Framework
tabler,tabler,HTML,40887,4351,111,2979,True,False,True,True,Tabler is free and open-source HTML Dashboard UI Kit built on Bootstrap
cal.com,calcom,TypeScript,40854,12378,1369,1834,True,True,True,True,Scheduling infrastructure for absolutely everyone.
data-engineer-handbook,DataExpert-io,Jupyter Notebook,40774,7764,25,862,False,False,False,True,This is a repo with links to everything you'd ever want to learn about data engineering
WeChatMsg,LC044,,40714,4928,25,1175,False,False,False,True,
HEU_KMS_Activator,zbezj,,40685,3832,168,2473,False,False,False,True,
daisyui,saadeghi,Svelte,40632,1627,56,1948,False,True,True,True,"🌼 🌼 🌼 🌼 🌼  The most popular, free and open-source Tailwind CSS component library"
50projects50days,bradtraversy,CSS,40486,9771,48,1960,False,False,False,True,"50+ mini web projects using HTML, CSS & JS"
aria2,aria2,C++,40441,3834,1140,5602,False,False,True,True,"aria2 is a lightweight multi-protocol & multi-source, cross platform download utility operated in command-line. It supports HTTP/HTTPS, FTP, SFTP, BitTorrent and Metalink."
zju-icicles,QSCTech,HTML,40386,9597,10,3562,False,False,True,True,浙江大学课程攻略共享计划
chakra-ui,chakra-ui,TypeScript,40329,3574,20,2417,True,True,True,True,Chakra UI is a component system for building SaaS products with speed ⚡️
Fabric,danielmiessler,Go,40272,4015,27,817,True,True,True,True,Fabric is an open-source framework for augmenting humans using AI. It provides a modular system for solving specific problems using a crowdsourced set of AI prompts that can be used anywhere.
wrk,wg,C,40167,3029,203,5123,False,False,True,True,Modern HTTP benchmarking tool
remote-jobs,remoteintech,Nunjucks,40143,3929,9,3822,True,True,True,True,Source for remoteintech.company — a community-maintained directory of remote-friendly tech companies
puter,HeyPuter,JavaScript,40109,3580,170,758,False,True,True,True,"🌐 The Internet Computer! Free, Open-Source, and Self-Hostable."
vim,vim,Vim Script,40094,6023,1665,3877,False,True,True,True,The official Vim repository
BettaFish,666ghj,Python,40042,7436,61,637,True,True,True,True,微舆：人人可用的多Agent舆情分析助手，打破信息茧房，还原舆情原貌，预测未来走向，辅助决策！从0实现，不依赖任何框架。
php-src,php,C,39959,8022,1756,5402,False,True,True,True,The PHP Interpreter
bert,google-research,Python,39943,9707,881,2713,False,True,False,True,TensorFlow code and pre-trained models for BERT
tidb,pingcap,Go,39903,6165,5897,3859,True,True,True,True,"TiDB - the open-source, cloud-native, distributed SQL database designed for modern applications."
free,freefq,,39860,5650,562,2123,False,False,False,True,翻墙、免费翻墙、免费科学上网、免费节点、免费梯子、免费ss/v2ray/trojan节点、蓝灯、谷歌商店、翻墙梯子
trpc,trpc,TypeScript,39846,1530,186,2082,False,True,True,True,🧙‍♀️  Move Fast and Break Nothing. End-to-end typesafe APIs made easy. 
esbuild,evanw,Go,39815,1302,612,3576,False,False,True,True,An extremely fast bundler for the web
gorm,go-gorm,Go,39632,4144,519,4539,True,False,True,True,"The fantastic ORM library for Golang, aims to be developer friendly"
video.js,videojs,JavaScript,39632,7509,636,5799,True,True,True,True,Video.js - open source HTML5 video player
faiss,facebookresearch,C++,39552,4310,309,3338,True,True,True,True,A library for efficient similarity search and clustering of dense vectors.
qlib,microsoft,Python,39551,6184,386,2054,True,False,True,True,"Qlib is an AI-oriented Quant investment platform that aims to use AI tech to empower Quant Research, from exploring ideas to implementing productions. Qlib supports diverse ML modeling paradigms, including supervised learning, market dynamics modeling, and RL, and is now equipped with https://github.com/microsoft/RD-Agent to automate R&D process."
fiber,gofiber,Go,39493,1967,41,2266,True,True,True,True,⚡️ Express inspired web framework written in Go
Deep-Learning-Papers-Reading-Roadmap,floodsung,Python,39480,7314,92,3454,False,False,False,True,Deep Learning papers reading roadmap for anyone who are eager to learn this amazing tech!
photoprism,photoprism,Go,39473,2234,440,2984,True,True,True,True,AI-Powered Photos App for the Decentralized Web 🌈💎✨
FastChat,lm-sys,Python,39459,4784,1003,1108,False,False,True,True,"An open platform for training, serving, and evaluating large language models. Release repo for Vicuna and Chatbot Arena."
lossless-cut,mifi,TypeScript,39456,1916,246,3438,False,True,True,True,The swiss army knife of lossless video/audio editing
appsmith,appsmithorg,TypeScript,39452,4507,4460,2100,True,True,True,True,"Platform to build admin panels, internal tools, and dashboards. Integrates with 25+ databases and any API."
data-engineering-zoomcamp,DataTalksClub,Jupyter Notebook,39439,7927,8,1621,False,False,True,True,Data Engineering Zoomcamp is a free 9-week course on building production-ready data pipelines. The next cohort starts in January 2026. Join the course here 👇🏼
Awesome-Design-Tools,goabstract,JavaScript,39400,2211,132,2603,False,False,True,True,The best design tools and plugins for everything 👉
cobalt,imputnet,Svelte,39336,3293,231,1361,False,True,True,True,best way to save what you love
phaser,phaserjs,JavaScript,39254,7123,121,4735,True,True,True,True,"Phaser is a fun, free and fast 2D game framework for making HTML5 games for desktop and mobile web browsers, supporting Canvas and WebGL rendering."
chatbox,chatboxai,TypeScript,39210,3985,1089,1120,False,False,True,True,Powerful AI Client
shellcheck,koalaman,Haskell,39191,1907,1208,4882,False,False,True,True,"ShellCheck, a static analysis tool for shell scripts"
styleguide,google,HTML,39150,13000,173,3967,True,True,True,True,Style guides for Google-originated open-source projects
materialize,Dogfalo,JavaScript,39089,4657,792,4217,True,True,True,True,"Materialize, a CSS Framework based on Material Design"
quivr,QuivrHQ,Python,39078,3746,23,1053,False,False,True,True,"Opiniated RAG for integrating GenAI in your apps 🧠   Focus on your product rather than the RAG. Easy integration in existing products with customisation!  Any LLM: GPT4, Groq, Llama. Any Vectorstore: PGVector, Faiss. Any Files. Anyway you want."
bark,suno-ai,Jupyter Notebook,39063,4685,266,1088,False,False,False,True,🔊 Text-Prompted Generative Audio Model
agno,agno-agi,Python,39044,5177,692,1426,True,True,True,True,"Build, run, manage agentic software at scale."
ChatTTS,2noise,Python,39006,4235,66,672,False,False,True,True,A generative speech model for daily dialogue.
leveldb,google,C++,38932,8175,378,4233,True,True,True,True,LevelDB is a fast key-value storage library written at Google that provides an ordered mapping from string keys to string values.
mindsdb,mindsdb,Python,38880,6173,105,2797,True,True,True,True,Query Engine for AI Analytics: Build self-reasoning agents across all your live data
nushell,nushell,Rust,38861,2087,1476,2516,True,True,True,True,A new type of shell
awesome-cursorrules,PatrickJS,MDX,38780,3283,94,560,True,True,True,True,📄  Configuration files that enhance Cursor AI editor experience with custom rules and behaviors
novu,novuhq,TypeScript,38747,4248,140,1677,True,True,True,True,"The open-source notification infrastructure. In-app Inbox component, E-mail, SMS, Push and Slack Integrations."
devdocs,freeCodeCamp,Ruby,38650,2581,226,4540,True,True,True,True,API Documentation Browser
vnpy,vnpy,Python,38634,11255,14,4047,True,False,True,True,基于Python的开源量化交易平台开发框架
preact,preactjs,JavaScript,38522,2029,149,3854,True,True,True,True,⚛️ Fast 3kB React alternative with the same modern API. Components & Virtual DOM.
impress.js,impress,JavaScript,38466,6618,60,5206,False,False,True,True,It's a presentation framework based on the power of CSS3 transforms and transitions in modern browsers and inspired by the idea behind prezi.com.
googletest,google,C++,38415,10728,528,3898,True,True,True,True,GoogleTest - Google Testing and Mocking Framework
python-cheatsheet,gto76,Python,38307,6727,0,2987,False,False,True,True,Comprehensive Python Cheatsheet
insomnia,Kong,TypeScript,38233,2259,820,3629,True,True,True,True,"The open-source, cross-platform API client for GraphQL, REST, WebSockets, SSE and gRPC. With Cloud, Local and Git storage."
MPAndroidChart,PhilJay,Java,38225,9046,2189,4357,False,True,False,True,"A powerful 🚀 Android chart view / graph view library, supporting line- bar- pie- radar- bubble- and candlestick charts as well as scaling, panning and animations."
lapce,lapce,Rust,38195,1242,872,2974,False,True,True,True,Lightning-fast and Powerful Code Editor written in Rust
halo,halo-dev,Java,38163,10227,242,2931,True,True,True,True,Halo 是一款强大易用的开源建站工具，从个人博客、知识库，到企业官网、在线商城，Halo 都能助您轻松实现，一站式满足您的多样化建站需求。
istio,istio,Go,38071,8280,524,3419,False,True,True,True,"Connect, secure, control, and observe services."
ant-design-pro,ant-design,TypeScript,38040,8233,178,3139,True,False,True,True,👨🏻‍💻👩🏻‍💻 Use Ant Design like a Pro!
tesseract.js,naptha,JavaScript,37971,2363,42,3933,False,False,True,True,Pure Javascript OCR for more than 100 Languages 📖🎉🖥
polars,pola-rs,Rust,37924,2717,2737,2147,True,True,True,True,"Extremely fast Query Engine for DataFrames, written in Rust"
it-tools,CorentinTh,Vue,37883,4715,767,2185,False,False,True,True,"Collection of handy online tools for developers, with great UX. "
outline,outline,TypeScript,37872,3164,69,3599,True,False,True,True,"The fastest knowledge base for growing teams. Beautiful, realtime collaborative, feature packed, and markdown compatible."
Folo,RSSNext,TypeScript,37862,2010,389,722,True,True,True,True,🧡 Folo is the AI RSS Reader
cli,httpie,Python,37807,3852,261,5147,True,True,True,True,"🥧 HTTPie CLI  — modern, user-friendly command-line HTTP client for the API era. JSON support, colors, sessions, downloads, plugins & more."
aspnetcore,dotnet,C#,37803,10621,3855,4402,True,True,True,True,"ASP.NET Core is a cross-platform .NET framework for building modern cloud-based web applications on Windows, Mac, or Linux."
metasploit-framework,rapid7,Ruby,37802,14812,592,5326,True,True,True,True,Metasploit Framework
wtfjs,denysdovhan,JavaScript,37752,2691,44,3181,False,True,True,True,🤪 A list of funny and tricky JavaScript examples
paperless-ngx,paperless-ngx,Python,37751,2400,13,1507,True,True,True,True,"A community-supported supercharged document management system: scan, index and archive all your documents"
ToolJet,ToolJet,JavaScript,37692,4986,978,1826,True,True,True,True,"ToolJet is the open-source foundation of ToolJet AI - the AI-native platform for building internal tools, dashboard, business applications, workflows and AI agents 🚀"
NewPipe,TeamNewPipe,Java,37689,3527,1383,3861,False,True,True,True,A libre lightweight streaming front-end for Android.
Langchain-Chatchat,chatchat-space,Python,37684,6187,16,1095,False,False,True,True,"Langchain-Chatchat（原Langchain-ChatGLM）基于 Langchain 与 ChatGLM, Qwen 与 Llama 等语言模型的 RAG 与 Agent 应用 | Langchain-Chatchat (formerly langchain-ChatGLM), local knowledge based LLM (like ChatGLM, Qwen and Llama) RAG and Agent app with langchain "
interview,huihut,C++,37675,8126,2,2971,False,False,True,True,"📚 C/C++ 技术面试基础知识总结，包括语言、程序库、数据结构、算法、系统、网络、链接装载库等知识及面试经验、招聘、内推等信息。This repository is a summary of the basic knowledge of recruiting job seekers and beginners in the direction of C/C++ technology, including language, program library, data structure, algorithm, system, network, link loading library, interview experience, recruitment, recommendation, etc."
engineering-blogs,kilimchoi,Ruby,37669,1975,145,3943,False,True,True,True,A curated list of engineering blogs
llvm-project,llvm,LLVM,37657,16720,35186,3400,True,True,True,True,The LLVM Project is a collection of modular and reusable compiler and toolchain technologies.
freecodecamp.cn,FreeCodeCampChina,CSS,37639,1413,158,3469,False,True,False,True,FCC China open source codebase and curriculum. Learn to code and help nonprofits.
google-research,google-research,Jupyter Notebook,37600,8372,1829,2734,False,True,True,True,Google Research
spacedrive,spacedriveapp,Rust,37539,1244,25,1646,True,True,True,True,"Spacedrive is an open source cross-platform file explorer, powered by a virtual distributed filesystem written in Rust."
stats,exelban,Swift,37478,1236,26,2497,False,False,True,True,macOS system monitor in your menu bar
manim,ManimCommunity,Python,37474,2753,471,2142,True,True,True,True,A community-maintained Python framework for creating mathematical animations. 
v,vlang,V,37451,2238,989,2608,True,True,True,True,"Simple, fast, safe, compiled language for developing maintainable software. Compiles itself in <1s with zero library dependencies. Supports automatic C => V translation. https://vlang.io"
Open-Assistant,LAION-AI,Python,37423,3302,296,1203,False,True,True,True,"OpenAssistant is a chat-based assistant that understands tasks, can interact with third-party systems, and retrieve information dynamically to do so."
gkd,gkd-kit,Kotlin,37421,1799,13,1001,False,False,True,True,"基于无障碍，高级选择器，订阅规则的自定义屏幕点击安卓应用 | An Android APP with custom screen tapping based on Accessibility, Advanced Selectors, and Subscription Rules"
GFPGAN,TencentARC,Python,37410,6281,403,1837,True,False,True,True,GFPGAN aims at developing Practical Algorithms for Real-world Face Restoration.
taro,NervJS,TypeScript,37376,4898,1719,2913,False,True,True,True,开放式跨端跨框架解决方案，支持使用 React/Vue 等框架来开发微信/京东/百度/支付宝/字节跳动/ QQ 小程序/H5/React Native 等应用。  https://taro.zone/
tutorials,eugenp,Java,37343,53702,27,4718,False,True,False,True,Getting Started with Spring Boot 3: 
react-bits,DavidHDev,JavaScript,37338,1653,8,601,False,True,True,True,"An open source collection of animated, interactive & fully customizable React components for building memorable websites."
RevokeMsgPatcher,huiyadanli,C#,37272,3953,56,2444,False,False,True,True,:trollface: A hex editor for WeChat/QQ/TIM - PC版微信/QQ/TIM防撤回补丁（我已经看到了，撤回也没用了）
deeplearningbook-chinese,exacity,TeX,37219,9160,67,3400,False,False,True,True,Deep Learning Book Chinese Translation
arthas,alibaba,Java,37217,7639,468,2770,False,True,True,True,Alibaba Java Diagnostic Tool Arthas/Alibaba Java诊断利器Arthas
interview_internal_reference,0voice,Python,37216,9411,36,2485,False,False,False,True,2025年最新总结，阿里，腾讯，百度，美团，头条等技术面试题目，以及答案，专家出题人分析汇总。
compose,docker,Go,37204,5767,87,4494,False,True,True,True,Define and run multi-container applications with Docker
nanobot,HKUDS,Python,37161,6395,903,57,False,True,True,True,"""🐈 nanobot: The Ultra-Lightweight OpenClaw"""
gym,openai,Python,37121,8706,128,3624,False,True,True,True,A toolkit for developing and comparing reinforcement learning algorithms.
duckdb,duckdb,C++,37075,3049,644,2834,True,True,True,True,DuckDB is an analytical in-process SQL database management system
portainer,portainer,TypeScript,37004,2800,730,3602,True,True,True,True,Making Docker and Kubernetes management easy.
drawdb,drawdb-io,JavaScript,36993,2972,216,988,False,True,True,True,"Free, simple, and intuitive online database diagram editor and SQL generator."
GPT_API_free,chatanywhere,Python,36993,2585,65,1072,False,False,False,True,Free ChatGPT&DeepSeek API Key，免费ChatGPT&DeepSeek API。免费接入DeepSeek API和GPT4 API，支持 gpt | deepseek | claude | gemini | grok 等排名靠前的常用大模型。
headscale,juanfont,Go,36971,1991,130,2108,True,True,True,True,"An open source, self-hosted implementation of the Tailscale control server"
sqlmap,sqlmapproject,Python,36963,6235,58,5025,True,True,True,True,Automatic SQL injection and database takeover tool
JavaFamily,AobingJava,,36925,7801,6,2331,False,False,False,True,【Java面试+Java学习指南】 一份涵盖大部分Java程序员所需要掌握的核心知识。
wtfpython,satwikkansal,Python,36912,2665,70,3136,True,True,True,True,What the f*ck Python? 😱
MockingBird,babysor,Python,36893,5232,482,1697,True,False,False,True,🚀Clone a voice in 5 seconds to generate arbitrary speech in real-time
REKCARC-TSC-UHT,PKUanonym,HTML,36892,7843,2,2552,False,False,False,True,"清华大学计算机系课程攻略 Guidance for courses in Department of Computer Science and Technology, Tsinghua University"
BitNet,microsoft,Python,36872,3213,293,602,True,False,True,True,Official inference framework for 1-bit LLMs
supervision,roboflow,Python,36798,3158,118,1218,True,True,True,True,We write your reusable computer vision tools. 💜
docs,inkonchain,MDX,36787,458,50,692,False,False,True,True,Ink Documentation
awesome-shell,alebcay,,36755,2488,145,4285,False,True,True,True,"A curated list of awesome command-line frameworks, toolkits, guides and gizmos. Inspired by awesome-php."
claude-cookbooks,anthropics,Jupyter Notebook,36751,3990,87,958,False,True,True,True,A collection of notebooks/recipes showcasing some fun and effective ways of using Claude.
marked,markedjs,JavaScript,36735,3516,16,5363,True,True,True,True,A markdown parser and compiler. Built for speed.
node,inkonchain,Shell,36732,633,18,686,False,False,True,True,How to run an Ink Node
shadowsocks-android,shadowsocks,Kotlin,36725,11519,60,4852,False,True,True,True,A shadowsocks client for Android
airi,moeru-ai,TypeScript,36652,3629,117,484,True,True,True,True,"💖🧸 Self hosted, you-owned Grok Companion, a container of souls of waifu, cyber livings to bring them into our worlds, wishing to achieve Neuro-sama's altitude. Capable of realtime voice chat, Minecraft, Factorio playing. Web / macOS / Windows supported."
ink-kit,inkonchain,TypeScript,36641,427,3,511,False,False,True,True,React component library for onchain applications - See README for modern alternatives
LLM101n,karpathy,,36633,2002,19,673,False,False,False,True,LLM101n: Let's build a Storyteller
Coursera-ML-AndrewNg-Notes,fengdu78,HTML,36596,11158,67,3068,False,False,True,True,吴恩达老师的机器学习课程个人笔记
pytorch-image-models,huggingface,Python,36572,5143,64,2613,True,True,True,True,"The largest collection of PyTorch image encoders / backbones. Including train, eval, inference, export scripts, and pretrained weights -- ResNet, ResNeXT, EfficientNet, NFNet, Vision Transformer (ViT), MobileNetV4, MobileNet-V3 & V2, RegNet, DPN, CSPNet, Swin Transformer, MaxViT, CoAtNet, ConvNeXt, and more"
og-aws,open-guides,Shell,36555,3908,161,3547,True,True,False,True,📙 Amazon Web Services — a practical guide
date-fns,date-fns,TypeScript,36535,1942,918,4193,False,True,True,True,⏳ Modern JavaScript date utility library ⌛️
typeorm,typeorm,TypeScript,36411,6507,523,3682,False,True,True,True,"TypeScript & JavaScript ORM for Node.js — supports PostgreSQL, MySQL, MariaDB, SQLite, SQL Server, Oracle, and more."
Xray-core,XTLS,Go,36398,5119,41,1967,True,False,True,True,"Xray, Penetrates Everything. Also the best v2ray-core. Where the magic happens. An open platform for various uses."
aseprite,aseprite,C++,36301,7913,1910,4241,True,True,True,True,"Animated sprite editor & pixel art tool (Windows, macOS, Linux)"
qBittorrent,qbittorrent,C++,36252,4603,2527,5168,False,True,True,True,qBittorrent BitTorrent client
HanLP,hankcs,Python,36228,10906,12,4190,False,True,True,True,中文分词 词性标注 命名实体识别 依存句法分析 成分句法分析 语义依存分析 语义角色标注 指代消解 风格转换 语义相似度 新词发现 关键词短语提取 自动摘要 文本分类聚类 拼音简繁转换 自然语言处理
sheetjs,SheetJS,,36227,7959,132,4865,False,False,False,True,📗 SheetJS Spreadsheet Data Toolkit -- New home https://git.sheetjs.com/SheetJS/sheetjs
955.WLB,formulahendry,,36174,1749,202,2560,False,False,False,True,955 不加班的公司名单 - 工作 955，work–life balance (工作与生活的平衡)
OpenVoice,myshell-ai,Python,36174,4039,300,852,False,False,False,True,Instant voice cloning by MIT and MyShell. Audio foundation model.
slate,slatedocs,,36151,359,50,4581,False,False,False,True,Beautiful static documentation for your API
servo,servo,Rust,36147,3562,3068,5164,True,True,True,True,"Servo aims to empower developers with a lightweight, high-performance alternative for embedding web technologies in applications."
awesome-deepseek-integration,deepseek-ai,,36093,4004,27,810,False,False,True,True,Integrate the DeepSeek API into popular software
ruoyi-vue-pro,YunaiV,Java,36092,7786,5,1892,False,False,True,True,🔥 官方推荐 🔥 RuoYi-Vue 全新 Pro 版本，优化重构所有功能。基于 Spring Boot + MyBatis Plus + Vue & Element 实现的后台管理系统 + 微信小程序，支持 RBAC 动态权限、数据权限、SaaS 多租户、Flowable 工作流、三方登录、支付、短信、商城、CRM、ERP、AI 大模型、IoT 物联网等功能。你的 ⭐️ Star ⭐️，是作者生发的动力！
lerna,lerna,TypeScript,36085,2279,313,3769,True,True,True,True,"Lerna is a fast, modern build system for managing and publishing multiple JavaScript/TypeScript packages from the same repository."
