repo_name,organization,language,stars,forks,open_issues,age_days,has_coc,has_contributing,has_workflows,has_readme,description
you-get,soimort,Python,56853,9711,386,5085,False,True,True,True,:arrow_double_down: Dumb downloader that scrapes the web
appwrite,appwrite,TypeScript,56639,5567,1083,2663,True,True,True,True,"Appwrite® - complete cloud infrastructure for your web, mobile and AI apps. Including Auth, Databases, Storage, Functions, Messaging, Hosting, Realtime and more"
face_recognition,ageitgey,Python,56611,13699,830,3429,False,True,True,True,The world's simplest facial recognition api for Python and the command line
nanochat,karpathy,Python,56594,7829,94,283,False,False,True,True,The best ChatGPT that $100 can buy.
react-router,remix-run,TypeScript,56516,10897,138,4451,True,True,True,True,Declarative routing for React
project-layout,golang-standards,Makefile,56350,5436,95,3239,False,False,True,True,Standard Go Project Layout
up,byoungd,JavaScript,56120,5757,33,3341,False,False,True,True,An advanced guide which might benefit you a lot 🎉 . 人生进阶指南 离谱的人生 离谱的英语学习指南/英语学习教程/英语学习/学英语
crewAI,crewAIInc,Python,56053,7928,661,1001,False,True,True,True,"Framework for orchestrating role-playing, autonomous AI agents. By fostering collaborative intelligence, CrewAI empowers agents to work together seamlessly, tackling complex tasks."
gatsby,gatsbyjs,JavaScript,55947,10152,403,4081,True,True,True,True,"React-based framework with performance, scalability, and security built in."
n8n-workflows,Zie619,Python,55806,7440,34,435,False,False,True,True,all of the workflows of n8n i could find (also from the site itself)
leetcode,azl397985856,JavaScript,55778,9395,11,3037,False,True,False,True,LeetCode Solutions: A Record of My Problem Solving Journey.( leetcode题解，记录自己的leetcode解题之路。)
joplin,laurent22,TypeScript,55705,6187,616,3475,False,True,True,True,"Joplin - the privacy-focused note taking app with sync capabilities for Windows, macOS, Linux, Android and iOS."
faceswap,deepfakes,Python,55359,13354,9,3138,True,False,True,True,Deepfakes Software For All
gpt-engineer,AntonOsika,Python,55198,7302,70,1181,True,True,True,True,CLI platform to experiment with codegen. Precursor to: https://lovable.dev
first-contributions,firstcontributions,,55167,106587,257,3593,True,True,True,True,🚀✨ Help beginners to contribute to open source projects
typst,typst,Rust,55066,1652,1260,2494,False,True,True,True,A markup-based typesetting system that is powerful and easy to learn.
plane,makeplane,TypeScript,54960,5090,1027,1342,True,True,True,True,"🔥🔥🔥 Open-source Jira, Linear, Monday, and ClickUp alternative. Plane is a modern project management platform to manage tasks, sprints, docs, and triage."
Flowise,FlowiseAI,TypeScript,54878,24753,1018,1210,True,True,True,True,"Build AI Agents, Visually"
jellyfin,jellyfin,C#,54791,5169,567,2783,True,True,True,True,The Free Software Media System - Server Backend & API
powerlevel10k,romkatv,Shell,54779,2432,150,2706,False,False,False,True,A Zsh theme
trackerslist,ngosang,,54614,6591,6,3742,False,False,True,True,Updated list of public BitTorrent trackers
segment-anything,facebookresearch,Jupyter Notebook,54593,6354,596,1218,True,True,True,True,"The repository provides code for running inference with the SegmentAnything Model (SAM), links for downloading the trained model checkpoints, and example notebooks that show how to use the model."
litellm,BerriAI,Python,54541,10021,4170,1093,False,True,True,True,"The fastest, litest AI Gateway. Rust core with Python SDK. Call 100+ LLM APIs in OpenAI (or native) format with cost tracking, guardrails, load balancing, and logging [Bedrock, Azure, OpenAI, Anthropic, OpenAI, VertexAI, vLLM, Nvidia NIM]"
PowerShell,PowerShell,C#,54521,8394,1552,3844,True,True,True,True,PowerShell for every system!
Ghost,TryGhost,JavaScript,54519,11829,110,4828,True,True,True,True,"Independent technology for modern publishing, memberships, subscriptions and newsletters."
ChatGPT,lencx,Rust,54411,6142,939,1324,False,False,True,True,"❄️ ChatGPT Desktop Application (Mac, Windows and Linux)"
maybe,maybe-finance,Ruby,54364,5644,0,934,False,True,True,True,The personal finance app for everyone
dive,wagoodman,Go,54353,1991,209,2993,False,False,True,True,A tool for exploring each layer in a docker image
ImHex,WerWolv,C++,54265,2424,373,2081,True,True,True,True,"🔍 A Hex Editor for Reverse Engineers, Programmers and people who value their retinas when working at 3 AM."
requests,psf,Python,54149,10029,233,5639,True,True,True,True,"A simple, yet elegant, HTTP library."
element,ElemeFE,Vue,54097,14435,2967,3610,False,False,True,True,A Vue.js 2.0 UI Toolkit for Web
remotion,remotion-dev,TypeScript,54093,3943,170,2221,True,True,True,True,🎥      Make videos programmatically with React
core,vuejs,TypeScript,54016,9168,917,2963,False,True,True,True,"🖖 Vue.js is a progressive, incrementally-adoptable JavaScript framework for building UI on the web."
minimind,jingyaogong,Python,53789,6974,48,727,True,False,True,True,🧠「大模型」2小时完全从0训练64M的小参数LLM！Train a 64M-parameter LLM from scratch in just 2h!
Win11Debloat,Raphire,PowerShell,53689,2248,27,2095,False,True,True,True,"A simple, lightweight PowerShell script that allows you to remove pre-installed apps, disable telemetry, as well as perform various other changes to declutter and customize your Windows experience. Win11Debloat works for both Windows 10 and Windows 11."
material-design-icons,google,,53648,9739,412,4306,True,True,True,True,Material Design icons by Google (Material Symbols)
pdf.js,mozilla,JavaScript,53626,10651,413,5567,True,True,True,True,PDF Reader in JavaScript
twenty,twentyhq,TypeScript,53566,8156,125,1330,True,True,True,True,"The open alternative to Salesforce, designed for AI."
normalize.css,necolas,CSS,53540,10355,76,5559,False,True,False,True,A modern alternative to CSS resets
last30days-skill,mvanhorn,Python,53325,4617,85,181,False,False,True,True,"AI agent skill that researches any topic across Reddit, X, YouTube, HN, Polymarket, and the web - then synthesizes a grounded summary"
odoo,odoo,Python,53232,33220,10263,4454,False,True,True,True,Odoo. Open Source Apps To Grow Your Business.
kotlin,JetBrains,Kotlin,53214,6374,359,5274,True,True,True,True,The Kotlin Programming Language. 
awesome-ios,vsouza,Swift,52857,6988,15,4396,True,True,True,True,"A curated list of awesome iOS ecosystem, including Objective-C and Swift Projects "
chinese-poetry,chinese-poetry,JavaScript,52844,10639,135,3612,False,False,True,True,"The most comprehensive database of Chinese poetry 🧶最全中华古诗词数据库,  唐宋两朝近一万四千古诗人,  接近5.5万首唐诗加26万宋诗.  两宋时期1564位词人，21050首词。"
AI-For-Beginners,microsoft,Jupyter Notebook,52762,10699,6,1968,True,True,True,True,"12 Weeks, 24 Lessons, AI for All!"
Docker-OSX,sickcodes,Shell,52695,2881,417,2240,False,False,True,True,Run macOS VM in a Docker! Run near native OSX-KVM in Docker! X11 Forwarding! CI/CD for OS X Security Research! Docker mac Containers.
ionic-framework,ionic-team,TypeScript,52594,13331,635,4720,True,True,True,True,"A powerful cross-platform UI toolkit for building native-quality iOS, Android, and Progressive Web Apps with HTML, CSS, and JavaScript."
freqtrade,freqtrade,Python,52584,10940,31,3354,False,True,True,True,"Free, open source crypto trading bot"
windows,dockur,Shell,52553,4522,30,921,False,False,True,True,Windows inside a Docker container.
lx-music-desktop,lyswhut,TypeScript,52304,6922,1236,2535,False,False,True,True,一个基于 Electron 的音乐软件
Motrix,agalwood,JavaScript,52301,4898,784,2774,True,True,True,True,A full-featured download manager.
whisper.cpp,ggml-org,C++,52238,5873,1224,1397,False,True,True,True,Port of OpenAI's Whisper model in C/C++
lazydocker,jesseduffield,Go,52142,1660,284,2623,True,True,True,True,The lazier way to manage everything docker
prettier,prettier,JavaScript,52112,4858,1413,3523,True,True,True,True,Prettier is an opinionated code formatter.
grok-1,xai-org,Python,52047,8517,124,858,True,False,True,True,Grok open release
etcd,etcd-io,Go,52021,10427,289,4765,True,True,True,True,Distributed reliable key-value store for the most critical data of a distributed system
jekyll,jekyll,Ruby,51590,10298,252,6485,True,True,True,True,:globe_with_meridians: Jekyll is a blog-aware static site generator in Ruby
goose,aaif-goose,Rust,51561,5678,367,699,True,True,True,True,"an open source, extensible AI agent that goes beyond code suggestions - install, execute, edit, and test with any LLM"
100-Days-Of-ML-Code,Avik-Jain,,51546,11595,68,2940,True,True,False,True,100 Days of ML Coding
guava,google,Java,51534,11146,741,4438,True,True,True,True,Google core libraries for Java
awesome-openclaw-skills,VoltAgent,,51477,4970,13,179,False,True,True,True,"The awesome collection of OpenClaw skills. 5,400+ skills filtered and categorized from the official OpenClaw Skills Registry.🦞"
open-source-ios-apps,dkhamsing,,51360,5989,3,4196,False,True,True,True,:iphone: Collaborative List of Open-Source iOS Apps
DefinitelyTyped,DefinitelyTyped,TypeScript,51353,30425,713,5039,False,False,True,True,The repository for high quality TypeScript type definitions.
professional-programming,charlax,Python,51290,4006,5,3912,False,True,False,True,A collection of learning resources for curious software engineers
wechat-miniapp-radar,justjavac,TypeScript,51217,9021,0,3591,False,False,True,True,小程序雷达：AI 驱动的小程序技术选型、趋势追踪和迁移诊断工具
hiring-without-whiteboards,poteto,JavaScript,51213,3904,10,3418,True,True,True,True,⭐️  Companies that don't have a broken hiring process
go-ethereum,ethereum,Go,51196,21998,380,4592,False,True,True,True,Go implementation of the Ethereum protocol
Fooocus,lllyasviel,Python,51180,8295,308,1079,False,False,True,True,Focus on prompting and generating
dbeaver,dbeaver,Java,51114,4298,3329,3928,True,True,True,True,Free universal database tool and SQL client
llama_index,run-llama,Python,51052,7804,570,1360,True,True,True,True,LlamaIndex is the leading document agent and OCR platform
BMAD-METHOD,bmad-code-org,JavaScript,51042,5863,104,466,True,True,True,True,Breakthrough Method for Agile Ai Driven Development
Semantic-UI,Semantic-Org,JavaScript,51041,4863,1070,4854,False,True,False,True,Semantic is a UI component framework based around useful principles from natural language.
expo,expo,TypeScript,50983,13165,704,3629,False,True,True,True,"An open-source framework for making universal native apps with React. Expo runs on Android, iOS, and the web."
awesome-claude-code,hesreallyhim,Python,50791,4423,701,460,True,True,True,True,"A hand-picked collection of the finest of resources for the most awesome of agents, Claude Code, the undisputed champion of coding companions, from the unstoppable team at Anthropic PBC. A delectable showcase of top tier skills, ambidextrous agents, scintillating status lines, top notch developer tooling, and also we have plugins"
cypress,cypress-io,TypeScript,50622,3512,1090,4160,True,True,True,True,"Fast, easy and reliable testing for anything that runs in a browser."
VibeVoice,microsoft,Python,50458,5641,178,332,True,True,True,True,Open-Source Frontier Voice AI
json,nlohmann,C++,50198,7437,84,4767,True,True,True,True,JSON for Modern C++
mastodon,mastodon,Ruby,50140,7483,4480,3804,True,True,True,True,"Your self-hosted, globally interconnected microblogging community"
bulma,jgthms,CSS,50063,3890,524,3834,False,True,True,True,Modern CSS framework based on Flexbox
query,TanStack,TypeScript,49974,4011,209,2508,False,True,True,True,"🤖 Powerful asynchronous state management, server-state utilities and data fetching for the web. TS/JS, React Query, Solid Query, Svelte Query and Vue Query."
alist,AlistGo,Go,49912,7947,560,2038,True,True,True,True,"🗂️A file list/WebDAV program that supports multiple storages, powered by Gin and Solidjs. / 一个支持多存储的文件列表/WebDAV程序，使用 Gin 和 Solidjs。"
hacker-scripts,NARKOZ,JavaScript,49778,6665,71,3897,False,False,False,True,Based on a true story
jadx,skylot,Java,49751,5659,436,4875,True,True,True,True,Dex to Java decompiler
open-source-mac-os-apps,serhii-londar,,49743,2648,160,3185,False,True,True,True,🚀 Awesome list of open source applications for macOS. https://t.me/s/opensourcemacosapps
huginn,huginn,Ruby,49671,4277,695,4884,False,False,True,True,Create agents that monitor and act on your behalf.  Your agents are standing by!
claude-cookbooks,anthropics,Jupyter Notebook,49519,5875,291,1073,False,True,True,True,A collection of notebooks/recipes showcasing some fun and effective ways of using Claude.
PythonDataScienceHandbook,jakevdp,Jupyter Notebook,49351,19069,228,3634,True,True,False,True,Python Data Science Handbook: full text in Jupyter Notebooks
pandas,pandas-dev,Python,49300,20165,2882,5813,True,True,True,True,"Flexible and powerful data analysis / manipulation library for Python, providing labeled data structures similar to R data.frame objects, statistical functions, and much more"
pretext,chenglou,TypeScript,49300,2722,90,138,False,False,True,True,"Fast, accurate & comprehensive text measurement & layout"
terraform,hashicorp,Go,49262,10534,1914,4515,True,True,True,True,"Terraform enables you to safely and predictably create, change, and improve infrastructure. It is a source-available tool that codifies APIs into declarative configuration files that can be shared amongst team members, treated as code, edited, reviewed, and versioned."
impeccable,pbakaus,JavaScript,49229,2875,40,250,False,False,True,True,The design language that makes your AI harness better at design.
kubernetes-the-hard-way,kelseyhightower,,49227,15778,50,3668,False,True,False,True,Bootstrap Kubernetes the hard way. No scripts.
tldraw,tldraw,TypeScript,49220,3416,447,1901,True,True,True,True,"Build infinite canvas apps in React with the tldraw SDK. World's best, top-most agent recommended #1 five star SDK."
fanqiang,bannedbook,Kotlin,49215,8195,329,4209,False,False,True,True,翻墙-科学上网
x64dbg,x64dbg,C++,48979,2794,574,4121,True,True,True,True,An open-source user mode debugger for Windows. Optimized for reverse engineering and malware analysis.
cherry-studio,CherryHQ,TypeScript,48931,4653,1188,791,True,True,True,True,"AI productivity studio with smart chat, autonomous agents, and 300+ assistants. Unified access to frontier LLMs"
brew,Homebrew,Ruby,48927,11243,28,3792,True,True,True,True,🍺 The Package Manager for Everywhere
julia,JuliaLang,Julia,48920,5863,4722,5572,True,True,True,True,The Julia Programming Language
Made-With-ML,GokuMohandas,Jupyter Notebook,48860,7689,27,2818,False,False,True,True,"Learn how to develop, deploy and iterate on production-grade ML applications."
ClickHouse,ClickHouse,C++,48827,8695,6566,3703,True,True,True,True,ClickHouse® is a real-time analytics database management system
ruff,astral-sh,Rust,48814,2278,2079,1444,True,True,True,True,"An extremely fast Python linter and code formatter, written in Rust."
dayjs,iamkun,JavaScript,48660,2456,1290,3026,False,True,True,True,⏰ Day.js 2kB immutable date-time library alternative to Moment.js with the same modern API
algorithm-visualizer,algorithm-visualizer,JavaScript,48660,7585,80,3722,True,True,False,True,:fireworks:Interactive Online Platform that Visualizes Algorithms from Code
htmx,bigskysoftware,JavaScript,48643,1624,668,2292,False,True,True,True,</> htmx - high power tools for HTML
awesome-java,akullpp,,48539,7695,3,4397,False,True,True,True,"A curated list of awesome frameworks, libraries and software for the Java programming language."
type-challenges,type-challenges,TypeScript,48359,5283,33236,2191,True,False,True,True,Collection of TypeScript type challenges with online judge
metabase,metabase,Clojure,48341,6683,4180,4189,False,True,True,True,The easy-to-use open source Business Intelligence and Embedded Analytics tool that lets everyone work with data :bar_chart:
supervision,roboflow,Python,48330,4440,79,1333,True,True,True,True,We write your reusable computer vision tools. 💜
awesome-design-patterns,DovAmir,,48290,3282,25,2971,False,True,False,True,A curated list of software and architecture related design patterns.
container,apple,Swift,48240,1520,463,419,True,True,True,True,"A tool for creating and running Linux containers using lightweight virtual machines on a Mac. It is written in Swift, and optimized for Apple silicon. "
RxJava,ReactiveX,Java,48226,7591,13,4944,False,True,True,True,RxJava – Reactive Extensions for the JVM – a library for composing asynchronous and event-based programs using observable sequences for the Java VM.
awesome-react-components,brillout,,48044,3810,67,3681,True,True,True,True,Curated List of React Components & Libraries.
design-patterns-for-humans,nilbuild,,48031,5514,16,3444,False,False,False,True,An ultra-simplified explanation to design patterns
tmux,tmux,C,48006,2791,29,4068,False,True,True,True,tmux source code
moment,moment,JavaScript,47938,6992,306,5624,False,True,True,True,"Parse, validate, manipulate, and display dates in javascript."
pixijs,pixijs,TypeScript,47879,5049,351,4931,True,True,True,True,"The HTML5 Creation Engine: Create beautiful digital content with the fastest, most flexible 2D WebGL renderer."
spotube,KRTirtho,Dart,47850,2218,829,1986,True,False,True,True,🎧 Open source music streaming app! Available for both desktop & mobile!
slidev,slidevjs,TypeScript,47828,2128,210,1917,True,True,True,True,Presentation Slides for Developers
Projects,karan,,47824,10623,123,4767,False,True,False,True,:page_with_curl: A list of practical projects that anyone can solve in any programming language.
LocalAI,mudler,Go,47781,4278,200,1223,False,True,True,True,"LocalAI is the open-source AI engine. Run any model - LLMs, vision, voice, image, video - on any hardware. No GPU required."
big-list-of-naughty-strings,minimaxir,Python,47700,2157,108,4002,False,False,False,True,The Big List of Naughty Strings is a list of strings which have a high probability of causing issues when used as user-input data.
gogs,gogs,Go,47696,5075,1001,4545,False,True,True,True,The painless way to host your own Git service
aider,Aider-AI,Python,47649,4758,1758,1171,False,True,True,True,aider is AI pair programming in your terminal
discourse,discourse,Ruby,47507,8953,211,4941,True,True,True,True,"A platform for community discussion. Free, open, simple."
upscayl,upscayl,TypeScript,47504,2352,54,1454,False,False,True,True,"🆙 Upscayl - #1 Free and Open Source AI Image Upscaler for Linux, MacOS and Windows."
chrome-devtools-mcp,ChromeDevTools,TypeScript,47489,3180,111,315,False,True,True,True,Chrome DevTools for coding agents
textgen,oobabooga,Python,47485,5983,836,1311,False,False,True,True,"Open-source desktop app for local LLMs. Text, vision, tool-calling, OpenAI/Anthropic-compatible API. 100% private."
prisma,prisma,TypeScript,47378,2403,2515,2590,True,True,True,True,"Next-generation ORM for Node.js & TypeScript | PostgreSQL, MySQL, MariaDB, SQL Server, SQLite, MongoDB and CockroachDB"
bevy,bevyengine,Rust,47307,4713,3335,2378,True,True,True,True,A refreshingly simple data-driven game engine built in Rust
acme.sh,acmesh-official,Shell,47293,5645,87,3862,False,True,True,True,A pure Unix shell script ACME client for SSL / TLS certificate automation
quill,slab,TypeScript,47246,3657,659,5106,True,True,True,True,Quill is a modern WYSIWYG editor built for compatibility and extensibility
frontend-dev-bookmarks,dypsilon,,47229,5147,134,4779,False,True,False,True,Manually curated collection of resources for frontend web developers.
GitHubDaily,GitHubDaily,,47203,4654,723,2762,False,False,False,True,"坚持分享 GitHub 上高质量、有趣实用的开源技术教程、开发者工具、编程网站、技术资讯。A list cool, interesting projects of GitHub."
JeecgBoot,jeecgboot,Java,47171,16113,37,2796,False,False,True,True,【低代码迈入v2.0时代，一句话即可生成整个系统】企业级AI低代码平台，一键生成前后端代码甚至整个系统。 AI Skills 一句话画流程、设计表单、生成报表、大屏。内置 AI应用平台涵盖：AI聊天、知识库、流程编排、MCP插件等，兼容主流大模型。引领AI低代码「Skills 生成 → 在线配置 → 代码生成 → 手工合并->AI修改」开发模式，解决 Java 项目 90% 重复工作，提高效率又不失灵活。
nvm-windows,coreybutler,Go,47145,3857,87,4324,False,True,True,True,A node.js version management utility for Windows. Ironically written in Go.
react,typescript-cheatsheets,TypeScript,47097,4286,0,2974,True,True,True,True,Cheatsheets for experienced React developers getting started with TypeScript
okhttp,lysine-dev,Kotlin,47011,9283,139,5113,False,True,True,True,"A meticulous HTTP client for the JVM, Android, and GraalVM."
v2ray-core,v2ray,Go,46927,8838,16,3975,True,False,True,True,A platform for building proxies to bypass network restrictions.
serverless,serverless,JavaScript,46920,5728,1225,4112,True,True,True,True,"⚡ Serverless Framework – Effortlessly build apps that auto-scale, incur zero costs when idle, and require minimal maintenance using AWS Lambda and other managed cloud services."
legado,gedoor,Kotlin,46907,5490,18,2620,False,False,True,True,"Legado 3.0 Book Reader with powerful controls & full functions❤️阅读3.0, 阅读是一款可以自定义来源阅读网络内容的工具，为广大网络文学爱好者提供一种方便、快捷舒适的试读体验。"
awesome-remote-job,lukasz-madon,,46832,4691,66,4221,False,True,True,True,A curated list of awesome remote jobs and resources. Inspired by https://github.com/vinta/awesome-python
cal.diy,calcom,TypeScript,46734,14531,1362,1949,True,True,True,True,Scheduling infrastructure for absolutely everyone.
30-Days-Of-JavaScript,Asabeneh,JavaScript,46595,10459,368,2404,False,False,False,True,"30 days of JavaScript programming challenge is a step-by-step guide to learn JavaScript programming language in 30 days. This challenge may take more than 100 days,  please just follow your own pace. These videos may help too: https://www.youtube.com/channel/UC7PNRuno1rzYPb1xLa4yktw"
FlClash,chen08209,Dart,46575,2946,555,1073,False,False,True,True,"A multi-platform proxy client based on ClashMeta,simple and easy to use, open-source and ad-free."
qlib,microsoft,Python,46573,7408,466,2169,True,False,True,True,"Qlib is an AI-oriented Quant investment platform that aims to use AI tech to empower Quant Research, from exploring ideas to implementing productions. Qlib supports diverse ML modeling paradigms, including supervised learning, market dynamics modeling, and RL, and is now equipped with https://github.com/microsoft/RD-Agent to automate R&D process."
exo,exo-explore,Python,46445,3380,319,759,False,True,True,True,Run frontier AI locally.
monaco-editor,microsoft,JavaScript,46416,4098,838,3698,True,True,True,True,A browser based code editor
voicebox,jamiepine,TypeScript,46323,5673,587,179,False,True,True,True,"The open-source AI voice studio. Clone, dictate, create."
awesome-cheatsheets,LeCoupa,JavaScript,46234,6702,136,3179,False,False,True,True,"👩‍💻👨‍💻 Awesome cheatsheets for popular programming languages, frameworks and development tools. They include everything you should know in one single file."
airflow,apache,Python,46229,17435,1787,4119,True,True,True,True,"Apache Airflow - A platform to programmatically author, schedule, and monitor workflows"
Umi-OCR,hiroi-sora,Python,46208,4541,355,1579,False,False,False,True,"OCR software, free and offline. 开源、免费的离线OCR软件。支持截屏/批量导入图片，PDF文档识别，排除水印/页眉页脚，扫描/生成二维码。内置多国语言库。"
nanobot,HKUDS,Python,46148,8158,839,172,False,True,True,True,"Lightweight, open-source AI agent for your tools, chats, and workflows."
shannon,KeygraphHQ,TypeScript,46116,5332,23,300,False,False,True,True,"Shannon is an autonomous, white-box AI pentester for web applications and APIs. It analyzes your source code, identifies attack vectors, and executes real exploits to prove vulnerabilities before they reach production."
CowAgent,zhayujie,Python,46102,10271,37,1446,False,True,True,True,"Open-source super AI assistant & Agent Harness. Plans tasks, runs tools and skills, self-evolves with memory and knowledge. Multi-model, multi-channel. Lightweight, extensible, one-line install. (formerly chatgpt-on-wechat)"
learn-regex,ziishaned,,46077,6149,65,3288,False,False,False,True,Learn regex the easy way
CLI-Anything,HKUDS,Python,45970,4292,88,137,False,True,True,True,"""CLI-Anything: Making ALL Software Agent-Native"" -- CLI-Hub: https://clianything.cc/"
CL4R1T4S,elder-plinius,,45923,9342,121,506,False,False,False,True,"LEAKED SYSTEM PROMPTS FOR CHATGPT, CLAUDE, GEMINI, GROK, PERPLEXITY, CURSOR, LOVABLE, REPLIT, AND MORE! - AI SYSTEMS TRANSPARENCY FOR ALL! 👐"
awesome-compose,docker,HTML,45916,8257,408,2352,False,True,True,True,Awesome Docker Compose samples
Rocket.Chat,RocketChat,TypeScript,45861,13740,3901,4083,True,True,True,True,The Secure CommsOS™ for mission-critical operations
bruno,usebruno,JavaScript,45839,2711,1808,1395,False,True,True,True,Opensource IDE For Exploring and Testing API's (lightweight alternative to Postman/Insomnia)
copyparty,9001,Python,45834,1871,267,2615,True,True,False,True,"Portable file server with accelerated resumable uploads, dedup, WebDAV, SFTP, FTP, TFTP, zeroconf, media indexer, thumbnails++ all in one file"
