repo_name,organization,language,stars,forks,open_issues,age_days,has_coc,has_contributing,has_workflows,has_readme,description
act,nektos,Go,70799,1957,338,2721,False,True,True,True,Run your GitHub Actions locally 🚀
paperclip,paperclipai,TypeScript,70576,13110,5020,105,False,True,True,True,The open-source app everyone uses to manage agents at work
swift,swiftlang,Swift,70052,10735,9043,3888,True,True,True,True,The Swift Programming Language
anime,juliangarnier,JavaScript,69923,4722,109,3746,False,True,True,True,JavaScript animation engine
ghidra,NationalSecurityAgency,Java,69727,7651,1885,2664,False,True,True,True,Ghidra is a software reverse engineering (SRE) framework
AFFiNE,toeverything,TypeScript,69435,4933,628,1415,True,True,True,True,"There can be more than Notion and Miro. AFFiNE(pronounced [ə‘fain]) is a next-gen knowledge base that brings planning, sorting and creating all together. Privacy first, open-source, customizable and ready to use. "
OpenBB,OpenBB-finance,Python,69235,6975,71,2003,True,False,True,True,"Financial data platform for analysts, quants and AI agents."
express,expressjs,JavaScript,69187,23711,206,6198,True,True,True,True,"Fast, unopinionated, minimalist web framework for node."
awesome-courses,prakhar1989,,69098,8377,64,4230,False,True,False,True,:books: List of awesome university courses for learning Computer Science!
ansible,ansible,Python,68963,24096,791,5214,True,True,True,True,"Ansible is a radically simple IT automation platform that makes your applications and systems easier to deploy and maintain. Automate everything from code deployment to network configuration to cloud management, in a language that approaches plain English, using SSH, with no agents to install on remote systems. https://docs.ansible.com."
MetaGPT,FoundationAgents,Python,68839,8797,128,1081,False,False,True,True,"🌟 The Multi-Agent Framework: First AI Software Company, Towards Natural Language Programming"
crawl4ai,unclecode,Python,68615,7006,99,767,True,True,True,True,"🚀🤖 Crawl4AI: Open-source LLM Friendly Web Crawler & Scraper. Don't be shy, join here: https://discord.gg/jP8KfhDhyN"
node,base,Shell,68522,3246,32,1230,False,True,True,True,Everything required to run your own Base node
Apollo-11,chrislgarry,Assembly,68084,7698,132,4456,False,True,True,True,Original Apollo 11 Guidance Computer (AGC) source code for the command and lunar modules.
graphify,safishamsi,Python,67806,6860,358,73,False,False,True,True,"AI coding assistant skill (Claude Code, Codex, OpenCode, Cursor, Gemini CLI, and more). Turn any folder of code, SQL schemas, R scripts, shell scripts, docs, papers, images, or videos into a queryable knowledge graph. App code + database schema + infrastructure in one graph."
MinerU,opendatalab,Python,67686,5699,22,837,False,False,True,True,Transforms complex documents like PDFs and Office docs into LLM-ready markdown/JSON for your Agentic workflows.
Chart.js,chartjs,JavaScript,67498,11942,568,4838,False,False,True,True,Simple HTML5 Charts using the <canvas> tag
ai-agents-for-beginners,microsoft,Jupyter Notebook,67339,22226,30,564,True,False,True,True,12 Lessons to Get Started Building AI Agents
annotated_deep_learning_paper_implementations,labmlai,Python,66940,6710,32,2121,False,False,True,True,"🧑‍🏫 60+ Implementations/tutorials of deep learning papers with side-by-side notes 📝; including transformers (original, xl, switch, feedback, vit, ...), optimizers (adam, adabelief, sophia, ...), gans(cyclegan, stylegan2, ...), 🎮 reinforcement learning (ppo, dqn), capsnet, distillation, ... 🧠"
learn-claude-code,shareAI-lab,Python,66806,10868,72,351,False,False,True,True,"Bash is all you need -  A nano claude code–like 「agent harness」, built from 0 to 1"
unsloth,unslothai,Python,66603,5972,1299,929,True,True,True,True,"Unsloth Studio is a web UI for training and running open models like Gemma 4, Qwen3.6, DeepSeek, gpt-oss locally."
echarts,apache,TypeScript,66598,19797,1612,4822,True,True,True,True,"Apache ECharts is a powerful, interactive charting and data visualization library for browser"
MiroFish,666ghj,Python,66558,10372,320,202,False,False,True,True,"A Simple and Universal Swarm Intelligence Engine, Predicting Anything. 简洁通用的群体智能引擎，预测万物"
33-js-concepts,leonardomso,JavaScript,66468,9166,2,2841,True,True,True,True,📜 33 JavaScript concepts every developer should know.
scikit-learn,scikit-learn,Python,66344,27063,2078,5781,True,True,True,True,scikit-learn: machine learning in Python
gpt4free,xtekky,Python,66332,13574,1,1174,True,True,True,True,The official gpt4free repository | various collection of powerful language models | opus 4.6 gpt 5.3 kimi 2.5 deepseek v3.2 gemini 3
design-resources-for-developers,bradtraversy,,66052,12088,40,2231,False,True,True,True,"Curated list of design and UI resources from stock photos, web templates, CSS frameworks, UI libraries, tools and much more"
awesome-nodejs,sindresorhus,,65969,6226,26,4357,True,True,True,True,":zap: Delightful Node.js packages and resources [BECAUSE OF TOO MUCH SPAM AND LOW-QUALITY SUBMISSIONS, SUBMISSIONS ARE PAUSED UNTIL JULY]"
Java,TheAlgorithms,Java,65840,21205,24,3621,True,True,True,True,All Algorithms implemented in Java
webpack,webpack,JavaScript,65832,9352,182,5210,True,True,True,True,"A bundler for javascript and friends. Packs many modules into a few bundled assets. Code Splitting allows for loading parts of the application on demand. Through ""loaders"", modules can be CommonJs, AMD, ES6 modules, CSS, Images, JSON, Coffeescript, LESS, ... and your custom stuff."
open-design,nexu-io,TypeScript,65654,7361,404,49,False,True,True,True,"🎨 Local-first, open-source Claude Design alternative. 🖥️ Native desktop app. ⚡ 259+ Skills · ✨ 142+ Design Systems 🖼️ Web · desktop · mobile prototypes · slides · images · videos · HyperFrames 📦 Sandboxed preview · HTML/PDF/PPTX/MP4 export 🤖 Claude Code / OpenClaw / Codex / Cursor / OpenCode / Qwen / Copilot / Hermes / Kimi & 17+ CLIs."
uBlock,gorhill,JavaScript,65515,4171,17,4093,False,True,True,True,uBlock Origin - An efficient blocker for Chromium and Firefox. Fast and lean.
nocode,kelseyhightower,Dockerfile,65392,4825,4713,3051,False,True,False,True,The best way to write secure and reliable applications. Write nothing; deploy nowhere.
javascript-questions,lydiahallie,,65329,9217,51,2560,False,False,False,True,"A long list of (advanced) JavaScript questions, and their explanations :sparkles:  "
docusaurus,facebook,TypeScript,65227,9928,404,3282,True,True,True,True,Easy to maintain open source documentation websites.
ripgrep,BurntSushi,Rust,65086,2595,201,3749,False,True,True,True,ripgrep recursively searches directories for a regex pattern while respecting your gitignore
30-Days-Of-Python,Asabeneh,Python,65069,12203,142,2400,False,False,True,True,The 30 Days of Python programming challenge is a step-by-step guide to learn the Python programming language in 30 days. This challenge may take more than 100 days. Follow your own pace. These videos may help too: https://www.youtube.com/channel/UC7PNRuno1rzYPb1xLa4yktw
localstack,localstack,Python,65053,4737,0,3520,True,True,True,True,💻 A fully functional local AWS cloud stack. Develop and test your cloud & Serverless apps offline
interviews,kdn251,Java,64943,12882,121,3408,False,False,False,True,Everything you need to know to get the job.
awesome-claude-skills,ComposioHQ,Python,64761,7165,815,242,False,True,True,True,"A curated list of awesome Claude Skills, resources, and tools for customizing Claude AI workflows"
alacritty,alacritty,Rust,64588,3489,339,3771,False,True,True,True,"A cross-platform, OpenGL terminal emulator."
prometheus,prometheus,Go,64533,10508,841,4951,True,True,True,True,The Prometheus monitoring system and time series database.
get-shit-done,gsd-build,JavaScript,64253,5466,6,183,False,True,True,True,"A light-weight and powerful meta-prompting, context engineering and spec-driven development system for Claude Code by TÂCHES."
ladybird,LadybirdBrowser,C++,64118,3078,510,746,True,True,True,True,Truly independent web browser
Scrapling,D4Vinci,Python,64108,6266,7,610,True,True,True,True,🕷️ An adaptive Web Scraping framework that handles everything from a single request to a full-scale crawl!
keras,keras-team,Python,64094,19737,186,4098,False,True,True,True,Deep Learning for humans
openinterpreter,openinterpreter,Rust,63992,5553,269,1068,False,True,True,True,"A lightweight coding agent for open models like Deepseek, Kimi, and Qwen"
traefik,traefik,Go,63635,6041,845,3928,True,True,True,True,The Cloud Native Application Proxy
nocodb,nocodb,TypeScript,63459,4842,713,3151,True,True,True,True,🔥 🔥 🔥 A Free & Self-hostable Airtable Alternative
nerd-fonts,ryanoasis,CSS,63366,3902,76,4211,True,True,True,True,"Iconic font aggregator, collection, & patcher. 3,600+ icons, 50+ patched fonts: Hack, Source Code Pro, more. Glyph collections: Font Awesome, Material Design Icons, Octicons, & more"
cline,cline,TypeScript,63358,6697,1107,710,True,True,True,True,"Autonomous coding agent as an SDK, IDE extension, or CLI assistant."
rustlings,rust-lang,Rust,63226,11201,38,3927,False,True,True,True,:crab: Small exercises to get you used to reading and writing Rust code!
socket.io,socketio,TypeScript,63171,10150,178,5940,False,True,True,True,Bidirectional and low-latency communication for every platform
pi,earendil-works,TypeScript,63064,7655,51,310,False,True,True,True,"AI agent toolkit: unified LLM API, agent loop, TUI, coding agent CLI"
pathway,pathwaycom,Python,62962,1677,38,1296,True,True,True,True,"Python ETL framework for stream processing, real-time analytics, LLM pipelines, and RAG."
tldr,tldr-pages,Markdown,62872,5300,328,4573,False,True,True,True,Collaborative cheatsheets for console commands 📚.
resume.github.com,resume,JavaScript,62865,1369,76,5608,False,False,False,True,Resumes generated using the GitHub informations
rtk,rtk-ai,Rust,62687,3876,1233,144,False,True,True,True,"CLI proxy that reduces LLM token consumption by 60-90% on common dev commands. Single Rust binary, zero dependencies"
vaultwarden,dani-garcia,Rust,62401,2903,50,3040,False,False,True,True,"Unofficial Bitwarden compatible server written in Rust, formerly known as bitwarden_rs"
oh-my-openagent,code-yeongyu,TypeScript,62399,5058,707,195,False,True,True,True,"omo/lazycodex: The coding agent for tokenmaxxers;the one and only agent harness for complex codebases. For your Codex, for your OpenCode"
scrapy,scrapy,Python,62264,11651,618,5958,True,True,True,True,"Scrapy, a fast high-level web crawling & scraping framework for Python."
warp,warpdotdev,Rust,61819,5023,4356,1803,True,True,True,True,"Warp is an agentic development environment, born out of the terminal."
leetcode-master,youngyangyang04,Shell,61689,12327,247,2375,False,False,False,True,《代码随想录》LeetCode 刷题攻略：200道经典题目刷题顺序，共60w字的详细图解，视频难点剖析，50余张思维导图，支持C++，Java，Python，Go，JavaScript等多语言版本，从此算法学习不再迷茫！🔥🔥 来看看，你会发现相见恨晚！🚀 
docling,docling-project,Python,61654,4307,937,707,True,True,True,True,Get your documents ready for gen AI
anything-llm,Mintplex-Labs,JavaScript,61653,6723,333,1108,False,True,True,True,Stop renting your intelligence. Own it with AnythingLLM. Everything you need for a powerful local-first agent experience 
sway,FuelLabs,Rust,61628,5421,918,1973,False,False,True,True,🌴 Empowering everyone to build reliable and efficient smart contracts.
drawio-desktop,jgraph,JavaScript,61620,5699,72,3308,True,False,True,True,Official electron build of draw.io
git,git,C,61516,28018,378,6536,True,True,True,True,Git Source Code Mirror - This is a publish-only repository but pull requests can be turned into patches to the mailing list via GitGitGadget (https://gitgitgadget.github.io/). Please follow Documentation/SubmittingPatches procedure for any of your improvements.
redux,reduxjs,TypeScript,61502,15055,47,4035,True,True,True,True,A JS library for predictable global state management
openpilot,commaai,Python,61376,10987,148,3491,False,True,True,True,"openpilot is an operating system for robotics. Currently, it upgrades the driver assistance system on 300+ supported cars."
lodash,lodash,JavaScript,61230,7179,151,5183,False,True,True,True,"A modern JavaScript utility library delivering modularity, performance, & extras."
minio,minio,Go,61189,7593,81,4170,True,True,True,True,"MinIO is a high-performance, S3 compatible object store, open sourced under GNU AGPLv3 license."
FFmpeg,FFmpeg,C,61157,13913,3,5541,False,True,False,True,Mirror of https://git.ffmpeg.org/ffmpeg.git
Magisk,topjohnwu,Kotlin,60983,17695,65,3567,False,False,True,True,The Magic Mask for Android
Front-end-Developer-Interview-Questions,h5bp,Nunjucks,60886,11035,61,5240,True,True,True,True,"A list of helpful front-end related questions you can use to interview potential candidates, test yourself or completely ignore."
Understand-Anything,Egonex-AI,TypeScript,60865,5028,216,93,True,True,True,True,"Graphs that teach > graphs that impress. Turn any code into an interactive knowledge graph you can explore, search, and ask questions about. Works with Claude Code, Codex, Cursor, Copilot, Gemini CLI, and more."
architect-awesome,xingshaocheng,,60821,17689,63,2992,False,False,False,True,后端架构师技术图谱
memos,usememos,Go,60806,4472,25,1650,False,False,True,True,"Open-source, self-hosted note-taking tool built for quick capture. Markdown-native, lightweight, and fully yours."
atom,atom,JavaScript,60804,17217,994,5260,True,True,False,True,:atom: The hackable text editor
awesome-chatgpt-prompts-zh,PlexPt,,60654,13572,46,1282,False,False,False,True,ChatGPT 中文调教指南。各种场景使用指南。学习怎么让它听你的话。
agent-skills,addyosmani,Shell,60559,6571,136,120,False,True,True,True,Production-grade engineering skills for AI coding agents.
nuxt,nuxt,TypeScript,60456,5669,813,3519,True,True,True,True,the full-stack Vue framework
awesome-flutter,Solido,Dart,60326,6890,35,3326,False,True,True,True,"An awesome list that curates the best Flutter libraries, tools, tutorials, articles and more."
markdown-here,adam-p,JavaScript,60218,11053,318,5147,False,True,False,True,"Google Chrome, Firefox, and Thunderbird extension that lets you write email in Markdown and render it before sending."
astro,withastro,TypeScript,60205,3546,154,1918,True,True,True,True,The web framework for content-driven websites. ⭐️ Star to support our work!
ai-hedge-fund,virattt,Python,60131,10635,142,563,False,False,True,True,An AI Hedge Fund Team
spring-framework,spring-projects,Java,60028,38840,455,5669,True,True,True,True,Spring Framework
Real-Time-Voice-Cloning,CorentinJ,Python,59917,9407,171,2577,False,False,True,True,Clone a voice in 5 seconds to generate arbitrary speech in real-time
jquery,jquery,JavaScript,59826,20409,97,6282,True,True,True,True,jQuery JavaScript Library
nanoGPT,karpathy,Python,59704,10295,348,1266,False,False,False,True,"The simplest, fastest repository for training/finetuning medium-sized GPTs."
ruflo,ruvnet,TypeScript,59679,6910,652,378,False,False,True,True,"🌊 The leading agent meta-harness for Claude. Deploy intelligent multi-agent swarms, coordinate autonomous workflows, and build conversational AI systems. Features adaptive memory, self-learning swarm intelligence, RAG integration, and native Claude Code / Codex Integration"
shadowsocks-windows,shadowsocks,C#,59561,16252,200,4901,False,True,False,True,A C# port of shadowsocks
hello-agents,datawhalechina,Python,59551,7329,149,281,False,False,True,True,📚 《从零开始构建智能体》——从零开始的智能体原理与实践教程
TrendRadar,sansan0,Python,59494,24677,45,413,False,False,True,True,"⭐AI-driven public opinion & trend monitor with multi-platform aggregation, RSS, and smart alerts.🎯 告别信息过载，你的 AI 舆情监控助手与热点筛选工具！聚合多平台热点 +  RSS 订阅，支持关键词精准筛选。AI 智能筛选新闻 + AI 翻译 +  AI 分析简报直推手机，也支持接入 MCP 架构，赋能 AI 自然语言对话分析、情感洞察与趋势预测等。支持 Docker ，数据本地/云端自持。集成微信/飞书/钉钉/Telegram/邮件/ntfy/bark/slack 等渠道智能推送。"
llama,meta-llama,Python,59463,9788,520,1217,True,True,True,True,Inference code for Llama models
llm-app,pathwaycom,Jupyter Notebook,59344,1432,10,1062,True,True,True,True,"Ready-to-run cloud templates for RAG, AI pipelines, and enterprise search with live data. 🐳Docker-friendly.⚡Always in sync with Sharepoint, Google Drive, S3, Kafka, PostgreSQL, real-time data APIs, and more."
pi-hole,pi-hole,Shell,59307,3227,44,4390,True,True,True,True,A black hole for Internet advertisements
bat,sharkdp,Rust,59265,1566,406,2977,False,True,True,True,A cat(1) clone with wings.
pocketbase,pocketbase,Go,59104,3459,16,1442,False,True,True,True,Open Source realtime backend in 1 file
mkcert,FiloSottile,Go,59094,3127,170,2913,True,True,True,True,A simple zero-config tool to make locally trusted development certificates with any names you'd like.
autogen,microsoft,Python,58987,8896,887,1032,True,True,True,True,A programming framework for agentic AI
GPT-SoVITS,RVC-Boss,Python,58718,6424,875,883,False,False,True,True,1 min voice data can also be used to train a good TTS model! (few shot voice cloning)
rails,rails,Ruby,58690,22171,1503,6640,True,True,True,True,Ruby on Rails
mem0,mem0ai,Python,58669,6743,373,1091,False,True,True,True,Universal memory layer for AI Agents
angular.js,angular,JavaScript,58600,27097,461,6005,True,True,False,True,AngularJS - HTML enhanced for web apps!
ultralytics,ultralytics,Python,58459,11197,331,1373,True,True,True,True,Ultralytics YOLO 🚀
zustand,pmndrs,TypeScript,58315,2071,4,2624,False,True,True,True,🐻 Bear necessities for state management in React
starship,starship,Rust,58305,2555,1019,2632,True,True,True,True,"☄🌌️  The minimal, blazing-fast, and infinitely customizable prompt for any shell!"
v2rayNG,2dust,Kotlin,58156,7598,7,2589,False,False,True,True,"A V2Ray client for Android, support Xray core and v2fly core"
meilisearch,meilisearch,Rust,58115,2566,310,2975,True,True,True,True,A lightning-fast search engine API bringing AI-powered hybrid search to your sites and applications.
claude-code-best-practice,shanraisshan,HTML,57883,5815,9,227,False,False,True,True,from vibe coding to agentic engineering - practice makes claude perfect
awesome-rust,rust-unofficial,Rust,57878,3429,9,4351,False,True,True,True,A curated list of Rust code and resources.
rclone,rclone,Go,57871,5156,1206,4474,True,True,True,True,"""rsync for cloud storage"" - Google Drive, S3, Dropbox, Backblaze B2, One Drive, Swift, Hubic, Wasabi, Google Cloud Storage, Azure Blob, Azure Files, Yandex Files"
yolov5,ultralytics,Python,57526,17466,42,2220,True,True,True,True,Ultralytics YOLOv5 in PyTorch > ONNX > CoreML > TFLite
html5-boilerplate,h5bp,JavaScript,57493,12294,31,5986,True,True,True,True,"A professional front-end template for building fast, robust, and adaptable web apps or sites."
context7,upstash,TypeScript,57462,2714,18,446,False,False,True,True,Context7 Platform -- Up-to-date code documentation for LLMs and AI code editors
DeepLearning-500-questions,scutan90,JavaScript,57435,15917,120,2911,False,False,False,True,深度学习500问，以问答形式对常用的概率知识、线性代数、机器学习、深度学习、计算机视觉等热点问题进行阐述，以帮助自己及有需要的读者。 全书分为18个章节，50余万字。由于水平有限，书中不妥之处恳请广大读者批评指正。   未完待续............ 如有意合作，联系scutjy2015@163.com                     版权所有，违权必究       Tan 2018.06
marktext,marktext,TypeScript,57430,4296,1089,3137,False,True,True,True,"📝A simple and elegant markdown editor, available for Linux, macOS and Windows."
github-cheat-sheet,tiimgreen,,57402,5428,48,4447,False,True,False,True,A list of cool features of Git and GitHub.
private-gpt,zylon-ai,Python,57276,7610,5,1140,False,False,True,True,"Interact with your documents using the power of GPT, 100% privately, no data leaks"
coolify,coollabsio,PHP,57041,4790,795,1967,True,True,True,True,"An open-source, self-hostable PaaS alternative to Vercel, Heroku & Netlify that lets you easily deploy static sites, databases, full-stack applications and 280+ one-click services on your own servers."
fuel-core,FuelLabs,Rust,57015,2861,194,2118,False,True,True,True,Rust full node implementation of the Fuel v2 protocol.
you-get,soimort,Python,56837,9731,384,5047,False,True,True,True,:arrow_double_down: Dumb downloader that scrapes the web
rich,Textualize,Python,56634,2182,351,2409,True,True,True,True,Rich is a Python library for rich text and beautiful formatting in the terminal.
OpenManus,FoundationAgents,Python,56572,9845,526,466,True,False,True,True,"No fortress, purely open ground.  OpenManus is Coming."
ghostty,ghostty-org,Zig,56548,2912,250,1539,False,True,True,True,"👻 Ghostty is a fast, feature-rich, and cross-platform terminal emulator that uses platform-native UI and GPU acceleration."
worldmonitor,koala73,TypeScript,56537,9041,172,158,True,True,True,True,"Real-time global intelligence dashboard. AI-powered news aggregation, geopolitical monitoring, and infrastructure tracking in a unified situational awareness interface"
face_recognition,ageitgey,Python,56502,13701,837,3391,False,True,True,True,The world's simplest facial recognition api for Python and the command line
awesome-android-ui,wasabeef,,56456,10249,39,4192,True,False,False,True,A curated list of awesome Android UI/UX libraries
termux-app,termux,Java,56451,6784,551,3888,False,False,True,True,Termux - a terminal emulator application for Android OS extendible by variety of packages.
react-router,remix-run,TypeScript,56442,10866,132,4413,True,True,True,True,Declarative routing for React
gitea,go-gitea,Go,56325,6793,2751,3514,True,True,True,True,"Git with a cup of tea! Painless self-hosted all-in-one software development service, including Git hosting, code review, team collaboration, package registry and CI/CD"
appwrite,appwrite,TypeScript,56317,5445,971,2625,True,True,True,True,"Appwrite® - complete cloud infrastructure for your web, mobile and AI apps. Including Auth, Databases, Storage, Functions, Messaging, Hosting, Realtime and more"
project-layout,golang-standards,Makefile,56116,5443,94,3201,False,False,True,True,Standard Go Project Layout
Mole,tw93,Shell,56073,1967,1,266,False,True,True,True,"🐹 Clean, uninstall, analyze, optimize, and monitor your Mac from the terminal."
winutil,ChrisTitusTech,PowerShell,55979,3179,53,1510,True,True,True,True,"Chris Titus Tech's Windows Utility - Install Programs, Tweaks, Fixes, and Updates"
gatsby,gatsbyjs,JavaScript,55941,10169,392,4043,True,True,True,True,"React-based framework with performance, scalability, and security built in."
OpenCut,OpenCut-app,TypeScript,55819,6085,325,359,True,False,True,True,The open-source CapCut alternative
leetcode,azl397985856,JavaScript,55758,9410,10,2999,False,True,False,True,LeetCode Solutions: A Record of My Problem Solving Journey.( leetcode题解，记录自己的leetcode解题之路。)
mempalace,MemPalace,Python,55694,7219,578,72,False,True,True,True,The best-benchmarked open-source AI memory system. And it's free.
faceswap,deepfakes,Python,55289,13365,8,3100,True,False,True,True,Deepfakes Software For All
joplin,laurent22,TypeScript,55228,6143,564,3437,False,True,True,True,"Joplin - the privacy-focused note taking app with sync capabilities for Windows, macOS, Linux, Android and iOS."
gpt-engineer,AntonOsika,Python,55203,7312,71,1143,True,True,True,True,CLI platform to experiment with codegen. Precursor to: https://lovable.dev
n8n-workflows,Zie619,Python,55165,7313,29,397,False,False,True,True,all of the workflows of n8n i could find (also from the site itself)
nanochat,karpathy,Python,55084,7514,109,245,False,False,True,True,The best ChatGPT that $100 can buy.
OpenSpec,Fission-AI,TypeScript,55028,3857,410,314,False,False,True,True,Spec-driven development (SDD) for AI coding assistants.
first-contributions,firstcontributions,,54492,104345,87,3555,True,True,True,True,🚀✨ Help beginners to contribute to open source projects
powerlevel10k,romkatv,Shell,54461,2422,147,2668,False,False,False,True,A Zsh theme
ChatGPT,lencx,Rust,54389,6155,937,1286,False,False,True,True,"🔮 ChatGPT Desktop Application (Mac, Windows and Linux)"
segment-anything,facebookresearch,Jupyter Notebook,54350,6353,594,1180,True,True,True,True,"The repository provides code for running inference with the SegmentAnything Model (SAM), links for downloading the trained model checkpoints, and example notebooks that show how to use the model."
typst,typst,Rust,54298,1603,1247,2456,False,True,True,True,A markup-based typesetting system that is powerful and easy to learn.
dive,wagoodman,Go,54240,1980,204,2955,False,False,True,True,A tool for exploring each layer in a docker image
trackerslist,ngosang,,54174,6593,6,3704,False,False,True,True,Updated list of public BitTorrent trackers
maybe,maybe-finance,Ruby,54167,5597,0,896,False,True,True,True,The personal finance app for everyone
element,ElemeFE,Vue,54117,14455,2971,3573,False,False,True,True,A Vue.js 2.0 UI Toolkit for Web
requests,psf,Python,54041,9971,228,5601,True,True,True,True,"A simple, yet elegant, HTTP library."
Ghost,TryGhost,JavaScript,53961,11722,155,4790,True,True,True,True,"Independent technology for modern publishing, memberships, subscriptions and newsletters."
