repo_name,organization,language,stars,forks,open_issues,age_days,has_coc,has_contributing,has_workflows,has_readme,description
DefinitelyTyped,DefinitelyTyped,TypeScript,51208,30509,698,4956,False,False,True,True,The repository for high quality TypeScript type definitions.
windows,dockur,Shell,51159,4258,137,838,False,False,True,True,Windows inside a Docker container.
Semantic-UI,Semantic-Org,JavaScript,51101,4879,1072,4771,False,True,False,True,Semantic is a UI component framework based around useful principles from natural language.
go-ethereum,ethereum,Go,51016,21891,407,4509,False,True,True,True,Go implementation of the Ethereum protocol
jellyfin,jellyfin,C#,50926,4729,854,2700,True,True,True,True,The Free Software Media System - Server Backend & API
awesome-wechat-weapp,justjavac,,50875,9010,2,3508,False,False,False,True,微信小程序开发资源汇总 :100:
lazydocker,jesseduffield,Go,50875,1608,273,2540,True,True,True,True,The lazier way to manage everything docker
100-Days-Of-ML-Code,Avik-Jain,,50818,11500,67,2857,True,True,False,True,100 Days of ML Coding
professional-programming,charlax,Python,50777,3966,1,3829,False,True,False,True,A collection of learning resources for curious software engineers
mempalace,MemPalace,Python,50695,6657,526,27,False,True,True,True,The best-benchmarked open-source AI memory system. And it's free.
lx-music-desktop,lyswhut,TypeScript,50600,6773,1140,2452,False,False,True,True,一个基于 Electron 的音乐软件
hiring-without-whiteboards,poteto,JavaScript,50588,3885,38,3335,True,True,True,True,⭐️  Companies that don't have a broken hiring process
crewAI,crewAIInc,Python,50445,6951,382,918,False,True,True,True,"Framework for orchestrating role-playing, autonomous AI agents. By fostering collaborative intelligence, CrewAI empowers agents to work together seamlessly, tackling complex tasks."
odoo,odoo,Python,50419,32244,9621,4371,False,True,False,True,Odoo. Open Source Apps To Grow Your Business.
claude-code-best-practice,shanraisshan,HTML,50153,4987,13,182,False,False,True,True,from vibe coding to agentic engineering - practice makes claude perfect
bulma,jgthms,CSS,50078,3901,522,3751,False,True,True,True,Modern CSS framework based on Flexbox
open-source-ios-apps,dkhamsing,,50063,5762,1,4113,False,True,True,True,:iphone: Collaborative List of Open-Source iOS Apps
mastodon,mastodon,Ruby,49898,7436,4445,3721,True,True,True,True,"Your self-hosted, globally interconnected microblogging community"
dbeaver,dbeaver,Java,49833,4152,3319,3845,True,True,True,True,Free universal database tool and SQL client
Mole,tw93,Shell,49753,1540,2,220,False,True,True,True,🐹 Deep clean and optimize your Mac.
freqtrade,freqtrade,Python,49654,10350,31,3271,False,True,True,True,"Free, open source crypto trading bot"
cypress,cypress-io,TypeScript,49624,3396,1222,4077,True,True,True,True,"Fast, easy and reliable testing for anything that runs in a browser."
json,nlohmann,C++,49545,7380,104,4684,True,True,True,True,JSON for Modern C++
hacker-scripts,NARKOZ,JavaScript,49474,6646,69,3814,False,False,False,True,Based on a true story
alist,AlistGo,Go,49400,7946,567,1955,True,True,True,True,"🗂️A file list/WebDAV program that supports multiple storages, powered by Gin and Solidjs. / 一个支持多存储的文件列表/WebDAV程序，使用 Gin 和 Solidjs。"
query,TanStack,TypeScript,49302,3803,159,2425,False,True,True,True,"🤖 Powerful asynchronous state management, server-state utilities and data fetching for the web. TS/JS, React Query, Solid Query, Svelte Query and Vue Query."
whisper.cpp,ggml-org,C++,49262,5479,1191,1314,False,False,True,True,Port of OpenAI's Whisper model in C/C++
huginn,huginn,Ruby,49219,4252,695,4800,False,False,True,True,Create agents that monitor and act on your behalf.  Your agents are standing by!
expo,expo,TypeScript,49146,12028,895,3546,False,True,True,True,"An open-source framework for making universal native apps with React. Expo runs on Android, iOS, and the web."
llama_index,run-llama,Python,49090,7338,315,1277,True,True,True,True,LlamaIndex is the leading document agent and OCR platform
MediaCrawler,NanmiCoder,Python,48739,10399,154,1057,False,False,True,True,小红书笔记 | 评论爬虫、抖音视频 | 评论爬虫、快手视频 | 评论爬虫、B 站视频 ｜ 评论爬虫、微博帖子 ｜ 评论爬虫、百度贴吧帖子 ｜ 百度贴吧评论回复爬虫  | 知乎问答文章｜评论爬虫
minimind,jingyaogong,Python,48705,6162,30,644,True,False,True,True,🚀 「大模型」2小时完全从0训练64M的小参数LLM！🌏 Train a 64M-parameter LLM from scratch in just 2h!
julia,JuliaLang,Julia,48654,5766,4715,5489,True,True,True,True,The Julia Programming Language
pandas,pandas-dev,Python,48638,19894,3391,5730,True,True,True,True,"Flexible and powerful data analysis / manipulation library for Python, providing labeled data structures similar to R data.frame objects, statistical functions, and much more"
OpenCut,OpenCut-app,TypeScript,48637,5178,296,313,True,True,True,True,The open-source CapCut alternative
dayjs,iamkun,JavaScript,48631,2428,1208,2943,False,True,True,True,⏰ Day.js 2kB immutable date-time library alternative to Moment.js with the same modern API
plane,makeplane,TypeScript,48624,4139,750,1259,True,True,True,True,"🔥🔥🔥 Open-source Jira, Linear, Monday, and ClickUp alternative. Plane is a modern project management platform to manage tasks, sprints, docs, and triage."
algorithm-visualizer,algorithm-visualizer,JavaScript,48521,7588,78,3639,True,True,False,True,:fireworks:Interactive Online Platform that Visualizes Algorithms from Code
open-source-mac-os-apps,serhii-londar,,48409,2536,70,3102,False,True,True,True,🚀 Awesome list of open source applications for macOS. https://t.me/s/opensourcemacosapps
chinese-independent-developer,1c7,,48328,4139,1,3144,False,True,True,True,👩🏿‍💻👨🏾‍💻👩🏼‍💻👨🏽‍💻👩🏻‍💻中国独立开发者项目列表 -- 分享大家都在做什么
jadx,skylot,Java,48316,5505,417,4792,True,True,True,True,Dex to Java decompiler
terraform,hashicorp,Go,48306,10331,1889,4432,True,True,True,True,"Terraform enables you to safely and predictably create, change, and improve infrastructure. It is a source-available tool that codifies APIs into declarative configuration files that can be shared amongst team members, treated as code, edited, reviewed, and versioned."
Pake,tw93,Rust,48301,9668,3,1295,True,True,True,True,🤱🏻 Turn any webpage into a desktop app with one command.
RxJava,ReactiveX,Java,48287,7589,20,4861,False,True,True,True,RxJava – Reactive Extensions for the JVM – a library for composing asynchronous and event-based programs using observable sequences for the Java VM.
Fooocus,lllyasviel,Python,48271,7870,293,996,False,False,True,True,Focus on prompting and generating
x64dbg,x64dbg,C++,48254,2726,570,4038,True,True,True,True,An open-source user mode debugger for Windows. Optimized for reverse engineering and malware analysis.
kubernetes-the-hard-way,kelseyhightower,,48104,15634,49,3585,False,True,False,True,Bootstrap Kubernetes the hard way. No scripts.
type-challenges,type-challenges,TypeScript,48025,5248,33168,2108,True,False,True,True,Collection of TypeScript type challenges with online judge
moment,moment,JavaScript,47984,7001,297,5541,False,True,True,True,"Parse, validate, manipulate, and display dates in javascript."
htmx,bigskysoftware,JavaScript,47931,1589,657,2209,False,True,True,True,</> htmx - high power tools for HTML
brew,Homebrew,Ruby,47816,11090,17,3709,True,True,True,True,🍺 The missing package manager for macOS (or Linux)
awesome-java,akullpp,,47807,7666,4,4314,False,True,True,True,"A curated list of awesome frameworks, libraries and software for the Java programming language."
design-patterns-for-humans,nilbuild,,47786,5509,16,3361,False,False,False,True,An ultra-simplified explanation to design patterns
PythonDataScienceHandbook,jakevdp,Jupyter Notebook,47775,18892,231,3551,True,True,False,True,Python Data Science Handbook: full text in Jupyter Notebooks
awesome-openclaw-skills,VoltAgent,,47724,4682,18,96,False,True,True,True,"The awesome collection of OpenClaw skills. 5,400+ skills filtered and categorized from the official OpenClaw Skills Registry.🦞"
big-list-of-naughty-strings,minimaxir,Python,47632,2160,108,3919,False,False,False,True,The Big List of Naughty Strings is a list of strings which have a high probability of causing issues when used as user-input data.
Projects,karan,,47622,10644,117,4684,False,True,False,True,:page_with_curl: A list of practical projects that anyone can solve in any programming language.
gogs,gogs,Go,47505,5058,988,4462,False,True,True,True,Gogs is a painless self-hosted Git service
Made-With-ML,GokuMohandas,Jupyter Notebook,47469,7470,24,2735,False,False,True,True,"Learn how to develop, deploy and iterate on production-grade ML applications."
awesome-react-components,brillout,,47438,3758,44,3598,True,True,True,True,Curated List of React Components & Libraries.
ruff,astral-sh,Rust,47331,2036,1961,1361,True,True,True,True,"An extremely fast Python linter and code formatter, written in Rust."
ClickHouse,ClickHouse,C++,47161,8361,5954,3620,True,True,True,True,ClickHouse® is a real-time analytics database management system
awesome-design-patterns,DovAmir,,47150,3234,24,2888,False,True,False,True,A curated list of software and architecture related design patterns.
penpot,penpot,Clojure,47148,2865,612,3776,True,True,True,True,Penpot: The open-source design tool for design and code collaboration
metabase,metabase,Clojure,47145,6420,4106,4106,False,True,True,True,The easy-to-use open source Business Intelligence and Embedded Analytics tool that lets everyone work with data :bar_chart:
AI-For-Beginners,microsoft,Jupyter Notebook,47112,9681,2,1885,True,False,True,True,"12 Weeks, 24 Lessons, AI for All!"
pixijs,pixijs,TypeScript,47089,5008,324,4848,True,True,True,True,"The HTML5 Creation Engine: Create beautiful digital content with the fastest, most flexible 2D WebGL renderer."
quill,slab,TypeScript,47087,3631,645,5023,True,True,True,True,Quill is a modern WYSIWYG editor built for compatibility and extensibility
react,typescript-cheatsheets,JavaScript,47037,4292,1,2891,True,True,True,True,Cheatsheets for experienced React developers getting started with TypeScript
okhttp,square,Kotlin,46949,9270,106,5030,False,True,True,True,"Square’s meticulous HTTP client for the JVM, Android, and GraalVM."
discourse,discourse,Ruby,46942,8900,149,4858,True,True,True,True,"A platform for community discussion. Free, open, simple."
serverless,serverless,JavaScript,46917,5736,1232,4029,True,True,True,True,"⚡ Serverless Framework – Effortlessly build apps that auto-scale, incur zero costs when idle, and require minimal maintenance using AWS Lambda and other managed cloud services."
textgen,oobabooga,Python,46915,5970,786,1228,False,False,True,True,"The original local LLM interface. Text, vision, tool-calling, training. UI + API, 100% offline and private."
v2ray-core,v2ray,Go,46862,8856,17,3892,True,False,True,True,A platform for building proxies to bypass network restrictions.
tldraw,tldraw,TypeScript,46752,3185,345,1818,True,True,True,True,very good whiteboard infinite canvas SDK
frontend-dev-bookmarks,dypsilon,,46596,5147,123,4696,False,True,False,True,Manually curated collection of resources for frontend web developers.
acme.sh,acmesh-official,Shell,46461,5561,1382,3779,False,False,True,True,A pure Unix shell script ACME client for SSL / TLS certificate automation
legado,gedoor,Kotlin,46354,5310,63,2537,False,False,True,True,"Legado 3.0 Book Reader with powerful controls & full functions❤️阅读3.0, 阅读是一款可以自定义来源阅读网络内容的工具，为广大网络文学爱好者提供一种方便、快捷舒适的试读体验。"
GitHubDaily,GitHubDaily,,46311,4637,583,2679,False,False,False,True,"坚持分享 GitHub 上高质量、有趣实用的开源技术教程、开发者工具、编程网站、技术资讯。A list cool, interesting projects of GitHub."
30-Days-Of-JavaScript,Asabeneh,JavaScript,46285,10446,369,2321,False,False,False,True,"30 days of JavaScript programming challenge is a step-by-step guide to learn JavaScript programming language in 30 days. This challenge may take more than 100 days,  please just follow your own pace. These videos may help too: https://www.youtube.com/channel/UC7PNRuno1rzYPb1xLa4yktw"
VibeVoice,microsoft,Python,46214,5113,149,249,True,True,True,True,Open-Source Frontier Voice AI
nvm-windows,coreybutler,Go,46191,3806,81,4241,False,True,True,True,A node.js version management utility for Windows. Ironically written in Go.
BMAD-METHOD,bmad-code-org,JavaScript,46164,5450,52,383,True,True,True,True,Breakthrough Method for Agile Ai Driven Development
slidev,slidevjs,TypeScript,46158,2039,190,1834,True,True,True,True,Presentation Slides for Developers
learn-regex,ziishaned,,46133,6192,65,3205,False,False,False,True,Learn regex the easy way
JeecgBoot,jeecgboot,Java,46062,15959,11,2713,False,False,True,True,AI低代码平台，支持「低代码 + 零代码」双模式：零代码 5 分钟搭建业务系统，低代码模式一键生成前后端代码。 内置AI 应用，支持AI聊天、知识库、流程编排、MCP与插件，支持各种模型。Skills能力实现：一句话画流程图、设计表单、生成系统。 引领 AI生成→在线配置→代码生成→手工合并的开发模式，解决Java项目80%的重复工作，快速提高效率，又不失灵活性。
LocalAI,mudler,Go,45997,4043,157,1140,False,True,True,True,"LocalAI is the open-source AI engine. Run any model - LLMs, vision, voice, image, video - on any hardware. No GPU required."
pretext,chenglou,TypeScript,45988,2547,81,55,False,False,True,True,"Fast, accurate & comprehensive text measurement & layout"
monaco-editor,microsoft,JavaScript,45934,4057,813,3615,True,True,True,True,A browser based code editor
spotube,KRTirtho,Dart,45931,2064,789,1903,True,False,True,True,🎧 Open source music streaming app! Available for both desktop & mobile!
prisma,prisma,TypeScript,45867,2181,2579,2507,True,True,True,True,"Next-generation ORM for Node.js & TypeScript | PostgreSQL, MySQL, MariaDB, SQL Server, SQLite, MongoDB and CockroachDB"
bevy,bevyengine,Rust,45846,4537,3342,2295,True,True,True,True,A refreshingly simple data-driven game engine built in Rust
awesome-cheatsheets,LeCoupa,JavaScript,45746,6688,137,3096,False,False,True,True,"👩‍💻👨‍💻 Awesome cheatsheets for popular programming languages, frameworks and development tools. They include everything you should know in one single file."
Win11Debloat,Raphire,PowerShell,45662,1860,35,2012,False,True,True,True,"A simple, lightweight PowerShell script that allows you to remove pre-installed apps, disable telemetry, as well as perform various other changes to declutter and customize your Windows experience. Win11Debloat works for both Windows 10 and Windows 11."
architecture-samples,android,Kotlin,45652,11872,219,3738,False,True,True,True,A collection of samples to discuss and showcase different architectural tools and patterns for Android apps.
awesome-remote-job,lukasz-madon,,45516,4593,53,4138,False,True,True,True,A curated list of awesome remote jobs and resources. Inspired by https://github.com/vinta/awesome-python
zx,google,JavaScript,45456,1262,39,1822,True,True,True,True,A tool for writing better scripts
litellm,BerriAI,Python,45449,7712,2799,1010,False,True,True,True,"Python SDK, Proxy Server (AI Gateway) to call 100+ LLM APIs in OpenAI (or native) format, with cost tracking, guardrails, loadbalancing and logging. [Bedrock, Azure, OpenAI, VertexAI, Cohere, Anthropic, Sagemaker, HuggingFace, VLLM, NVIDIA NIM]"
remotion,remotion-dev,TypeScript,45433,3092,95,2138,True,True,True,True,🎥      Make videos programmatically with React
twenty,twentyhq,TypeScript,45397,6285,107,1247,True,True,True,True,"The open alternative to Salesforce, designed for AI."
AdminLTE,ColorlibHQ,CSS,45376,18240,24,4511,True,True,True,True,AdminLTE - Free admin dashboard template based on Bootstrap 5
jest,jestjs,TypeScript,45336,6646,228,4526,True,True,True,True,Delightful JavaScript Testing.
airflow,apache,Python,45257,16980,1717,4036,True,True,True,True,"Apache Airflow - A platform to programmatically author, schedule, and monitor workflows"
Rocket.Chat,RocketChat,TypeScript,45225,13541,3674,4000,True,True,True,True,The Secure CommsOS™ for mission-critical operations
TTS,coqui-ai,Python,45204,6066,7,2172,True,True,True,True,"🐸💬 - a deep learning toolkit for Text-to-Speech, battle-tested in research and production"
awesome-compose,docker,HTML,45081,8129,365,2269,False,True,True,True,Awesome Docker Compose samples
tmux,tmux,C,45061,2598,55,3985,False,True,True,True,tmux source code
upscayl,upscayl,TypeScript,45001,2187,57,1371,False,False,True,True,"🆙 Upscayl - #1 Free and Open Source AI Image Upscaler for Linux, MacOS and Windows."
Leaflet,Leaflet,JavaScript,44946,6116,545,5700,True,True,True,True,🍃 JavaScript library for mobile-friendly interactive maps 🇺🇦
CppCoreGuidelines,isocpp,CSS,44941,5543,247,3908,False,True,True,True,"The C++ Core Guidelines are a set of tried-and-true guidelines, rules, and best practices about coding in C++"
cherry-studio,CherryHQ,TypeScript,44877,4264,1127,708,True,True,True,True,"AI productivity studio with smart chat, autonomous agents, and 300+ assistants. Unified access to frontier LLMs"
meteor,meteor,JavaScript,44769,5255,357,5217,True,True,True,True,"Meteor, the JavaScript App Platform"
edex-ui,GitSquared,JavaScript,44763,3100,6,3380,False,False,True,True,"A cross-platform, customizable science fiction terminal emulator with advanced monitoring & touchscreen support."
pyenv,pyenv,Shell,44702,3246,56,4991,False,True,True,True,Simple Python version management
grpc,grpc,C++,44697,11144,1310,4162,True,True,True,True,"C++ based gRPC (C++, Python, Ruby, Objective-C, PHP, C#)"
react-hook-form,react-hook-form,TypeScript,44688,2393,126,2614,True,True,True,True,📋 React Hooks for form state management and validation (Web + React Native)
iina,iina,Swift,44680,2806,1904,3420,False,True,True,True,The modern video player for macOS.
OpenSpec,Fission-AI,TypeScript,44679,3103,301,269,False,False,True,True,Spec-driven development (SDD) for AI coding assistants.
copyparty,9001,Python,44615,1819,248,2532,True,True,False,True,"Portable file server with accelerated resumable uploads, dedup, WebDAV, SFTP, FTP, TFTP, zeroconf, media indexer, thumbnails++ all in one file"
hyper,vercel,TypeScript,44591,3549,1040,3591,False,False,True,True,A terminal built on web technologies
reactjs-interview-questions,sudheerj,JavaScript,44545,10356,14,2892,False,False,True,True,List of top 500 ReactJS Interview Questions & Answers....Coding exercise questions are coming soon!!
streamlit,streamlit,Python,44422,4221,1298,2443,True,True,True,True,Streamlit — A faster way to build and share data apps.
Summer2026-Internships,SimplifyJobs,Python,44395,3177,4,2169,False,True,True,True,Collection of Summer 2026 tech internships!
exo,exo-explore,Python,44285,3115,196,676,False,True,True,True,Run frontier AI locally.
TrafficMonitor,zhongyang219,C++,44268,3673,1294,3198,False,False,True,True,这是一个用于显示当前网速、CPU及内存利用率的桌面悬浮窗软件，并支持任务栏显示，支持更换皮肤。
aider,Aider-AI,Python,44223,4338,1514,1088,False,True,True,True,aider is AI pair programming in your terminal
helix,helix-editor,Rust,44207,3442,1525,2161,False,True,True,True,A post-modern modal text editor.
cli,cli,Go,44160,8359,994,2402,True,True,True,True,GitHub’s official command line tool
milvus,milvus-io,Go,44080,3985,1081,2419,True,True,True,True,"Milvus is a high-performance, cloud-native vector database built for scalable vector ANN search"
parcel,parcel-bundler,JavaScript,44032,2272,591,3189,True,True,True,True,The zero configuration build tool for the web. 📦🚀
build-web-application-with-golang,astaxie,Go,43981,10499,138,5020,False,False,False,True,A golang ebook intro how to build a web with golang
react-use,streamich,TypeScript,43969,3272,654,2743,False,True,True,True,React Hooks — 👍
CowAgent,zhayujie,Python,43952,10031,358,1363,False,False,True,True,CowAgent (chatgpt-on-wechat) 是基于大模型的超级AI助理，能主动思考和任务规划、访问操作系统和外部资源、创造和执行Skills、通过长期记忆和知识库不断成长，比OpenClaw更轻量和便捷。同时支持微信、飞书、钉钉、企微、QQ、公众号、网页等接入，可选择DeepSeek/OpenAI/Claude/Gemini/ MiniMax/Qwen/GLM/LinkAI，能处理文本、语音、图片和文件，可快速搭建个人AI助理和企业数字员工。
front-end-interview-handbook,yangshun,MDX,43943,5956,11,3030,True,True,True,True,Front End interview preparation materials for busy engineers (updated for 2026)
jsoncrack.com,AykutSarac,TypeScript,43921,3538,34,1552,True,True,True,True,"✨ Innovative and open-source visualization application that transforms various data formats, such as JSON, YAML, XML and CSV into interactive graphs."
retrofit,square,HTML,43905,7350,170,5716,False,True,True,True,A type-safe HTTP client for Android and the JVM
babel,babel,TypeScript,43894,5814,753,4233,True,True,True,True,🐠 Babel is a compiler for writing next generation JavaScript.
English-level-up-tips,byoungd,,43864,4642,23,3258,False,False,True,True,An advanced guide to learn English which might benefit you a lot 🎉 .  离谱的英语学习指南/英语学习教程/英语学习/学英语
Umi-OCR,hiroi-sora,Python,43839,4327,337,1496,False,False,False,True,"OCR software, free and offline. 开源、免费的离线OCR软件。支持截屏/批量导入图片，PDF文档识别，排除水印/页眉页脚，扫描/生成二维码。内置多国语言库。"
pandoc,jgm,Haskell,43830,3837,1068,5886,False,True,True,True,Universal markup converter
cobra,spf13,Go,43811,3135,365,4623,False,True,True,True,A Commander for modern Go CLI interactions
TensorFlow-Examples,aymericdamien,Jupyter Notebook,43782,14753,228,3824,False,False,False,True,TensorFlow Tutorial and Examples for Beginners (support TF v1 & v2)
RSSHub,DIYgod,TypeScript,43773,9705,360,2951,True,True,True,True,🧡 Everything is RSSible
sentry,getsentry,Python,43751,4678,2123,5723,True,True,True,True,Developer-first error tracking and performance monitoring
EasySpider,NaiboWang,JavaScript,43744,5322,266,2114,False,False,True,True,A visual no-code/code-free web crawler/spider易采集：一个可视化浏览器自动化测试/数据采集/爬虫软件，可以无代码图形化的设计和执行爬虫任务。别名：ServiceWrapper面向Web应用的智能化服务封装系统。
goose,aaif-goose,Rust,43661,4463,418,616,False,True,True,True,"an open source, extensible AI agent that goes beyond code suggestions - install, execute, edit, and test with any LLM"
pi-mono,badlogic,TypeScript,43657,5121,11,265,False,True,True,True,"AI agent toolkit: coding agent CLI, unified LLM API, TUI & web UI libraries, Slack bot, vLLM pods"
fanqiang,bannedbook,Kotlin,43479,7722,322,4126,False,False,True,True,翻墙-科学上网
bruno,usebruno,JavaScript,43433,2371,1658,1312,False,True,True,True,Opensource IDE For Exploring and Testing API's (lightweight alternative to Postman/Insomnia)
siyuan,siyuan-note,TypeScript,43426,2751,360,2070,True,True,True,True,"A privacy-first, self-hosted, fully open source personal knowledge management software, written in typescript and golang."
mitmproxy,mitmproxy,Python,43359,4540,440,5919,True,True,True,True,An interactive TLS-capable intercepting HTTP proxy for penetration testers and software developers.
kong,Kong,Lua,43299,5125,137,4183,True,True,True,True,🦍 The API and AI Gateway
Files,files-community,C#,43235,2706,521,2674,True,True,True,True,A modern file manager that helps users organize their files and folders.
fuels-rs,FuelLabs,Rust,43227,1360,68,1643,False,False,True,True,Fuel Network Rust SDK
spark,apache,Scala,43222,29162,362,4448,True,True,True,True,Apache Spark - A unified analytics engine for large-scale data processing
fuels-ts,FuelLabs,TypeScript,43200,1369,77,1701,True,True,True,True,Fuel Network Typescript SDK
pm2,Unitech,JavaScript,43106,2714,1103,4729,False,True,True,True,Node.js Production Process Manager with a built-in Load Balancer.
CPlusPlusThings,Light-City,C++,43091,8834,9,2483,False,False,False,True,C++那些事
system-design,karanpratapsingh,,43078,5518,3,1355,True,True,False,True,Learn how to design systems at scale and prepare for system design interviews
what-happens-when,alex,,43045,5733,2065,4559,False,False,True,True,"An attempt to answer the age old interview question ""What happens when you type google.com into your browser and press enter?"""
full-stack-fastapi-template,fastapi,TypeScript,42950,8474,29,2624,False,True,True,True,"Full stack, modern web application template. Using FastAPI, React, SQLModel, PostgreSQL, Docker, GitHub Actions, automatic HTTPS and more."
zig,ziglang,Zig,42887,3068,3135,3922,False,False,False,True,Moved to Codeberg
fd,sharkdp,Rust,42791,1055,181,3279,False,True,True,True,"A simple, fast and user-friendly alternative to 'find'"
python-patterns,faif,Python,42731,7031,15,5077,False,False,True,True,A collection of design patterns/idioms in Python
hyperswitch,juspay,Rust,42573,4609,1607,1292,True,True,True,True,"An open source payments switch written in Rust to make payments fast, reliable and affordable"
