repo_name,organization,language,stars,forks,open_issues,age_days,has_coc,has_contributing,has_workflows,has_readme,description
AFFiNE,toeverything,TypeScript,66082,4615,584,1324,True,True,True,True,"There can be more than Notion and Miro. AFFiNE(pronounced [ə‘fain]) is a next-gen knowledge base that brings planning, sorting and creating all together. Privacy first, open-source, customizable and ready to use. "
webpack,webpack,JavaScript,66042,9329,202,5119,True,True,True,True,"A bundler for javascript and friends. Packs many modules into a few bundled assets. Code Splitting allows for loading parts of the application on demand. Through ""loaders"", modules can be CommonJs, AMD, ES6 modules, CSS, Images, JSON, Coffeescript, LESS, ... and your custom stuff."
annotated_deep_learning_paper_implementations,labmlai,Python,66016,6640,29,2030,False,False,True,True,"🧑‍🏫 60+ Implementations/tutorials of deep learning papers with side-by-side notes 📝; including transformers (original, xl, switch, feedback, vit, ...), optimizers (adam, adabelief, sophia, ...), gans(cyclegan, stylegan2, ...), 🎮 reinforcement learning (ppo, dqn), capsnet, distillation, ... 🧠"
echarts,apache,TypeScript,65948,19838,1766,4731,True,True,True,True,"Apache ECharts is a powerful, interactive charting and data visualization library for browser"
daytona,daytonaio,TypeScript,65940,5076,344,769,True,True,True,True,Daytona is a Secure and Elastic Infrastructure for Running AI-Generated Code
ChinaTextbook,TapXWorld,Roff,65870,14687,97,2262,False,False,False,True,所有小初高、大学PDF教材。
ghidra,NationalSecurityAgency,Java,65812,7250,1859,2573,False,True,True,True,Ghidra is a software reverse engineering (SRE) framework
gpt4free,xtekky,Python,65770,13647,7,1083,True,True,True,True,The official gpt4free repository | various collection of powerful language models | opus 4.6 gpt 5.3 kimi 2.5 deepseek v3.2 gemini 3
codex,openai,Rust,65712,8784,2018,337,False,True,True,True,Lightweight coding agent that runs in your terminal
scikit-learn,scikit-learn,Python,65428,26802,2138,5690,True,True,True,True,scikit-learn: machine learning in Python
awesome-nodejs,sindresorhus,,65319,6201,30,4266,True,True,True,True,":zap: Delightful Node.js packages and resources [BECAUSE OF TOO MUCH SPAM AND LOW-QUALITY SUBMISSIONS, SUBMISSIONS ARE PAUSED UNTIL SEPTEMBER]"
javascript-questions,lydiahallie,,65309,9236,48,2469,False,False,False,True,"A long list of (advanced) JavaScript questions, and their explanations :sparkles:  "
MetaGPT,FoundationAgents,Python,65302,8224,94,990,False,False,True,True,"🌟 The Multi-Agent Framework: First AI Software Company, Towards Natural Language Programming"
Java,TheAlgorithms,Java,65226,21029,38,3530,True,True,True,True,All Algorithms implemented in Java
design-resources-for-developers,bradtraversy,,65029,11989,27,2140,False,True,False,True,"Curated list of design and UI resources from stock photos, web templates, CSS frameworks, UI libraries, tools and much more"
nocode,kelseyhightower,Dockerfile,65015,4819,4682,2960,False,True,False,True,The best way to write secure and reliable applications. Write nothing; deploy nowhere.
interviews,kdn251,Java,64967,12926,118,3317,False,False,False,True,Everything you need to know to get the job.
Apollo-11,chrislgarry,Assembly,64693,7377,126,4365,False,True,True,True,Original Apollo 11 Guidance Computer (AGC) source code for the command and lunar modules.
localstack,localstack,Python,64672,4602,1,3429,True,True,True,True,💻 A fully functional local AWS cloud stack. Develop and test your cloud & Serverless apps offline
docusaurus,facebook,TypeScript,64151,9774,356,3191,True,True,True,True,Easy to maintain open source documentation websites.
keras,keras-team,Python,63935,19738,271,4007,False,True,True,True,Deep Learning for humans
prometheus,prometheus,Go,63215,10247,768,4860,True,True,True,True,The Prometheus monitoring system and time series database.
OpenBB,OpenBB-finance,Python,63198,6207,66,1912,True,False,True,True,"Financial data platform for analysts, quants and AI agents."
alacritty,alacritty,Rust,62991,3349,337,3679,False,True,True,True,"A cross-platform, OpenGL terminal emulator."
socket.io,socketio,TypeScript,62962,10152,205,5849,False,True,True,True,Realtime application framework (Node.JS server)
resume.github.com,resume,JavaScript,62820,1363,71,5517,False,False,False,True,Resumes generated using the GitHub informations
open-interpreter,openinterpreter,Python,62743,5415,309,976,False,True,True,True,A natural language interface for computers
nocodb,nocodb,TypeScript,62484,4666,620,3060,True,True,True,True,🔥 🔥 🔥 A Free & Self-hostable Airtable Alternative
traefik,traefik,Go,62226,5884,776,3837,True,True,True,True,The Cloud Native Application Proxy
rustlings,rust-lang,Rust,62178,11173,83,3836,False,True,True,True,:crab: Small exercises to get you used to reading and writing Rust code!
uBlock,gorhill,JavaScript,62131,3978,17,4002,False,True,True,True,uBlock Origin - An efficient blocker for Chromium and Firefox. Fast and lean.
crawl4ai,unclecode,Python,62052,6335,30,676,True,False,True,True,"🚀🤖 Crawl4AI: Open-source LLM Friendly Web Crawler & Scraper. Don't be shy, join here: https://discord.gg/jP8KfhDhyN"
nerd-fonts,ryanoasis,CSS,62037,3870,64,4119,True,True,True,True,"Iconic font aggregator, collection, & patcher. 3,600+ icons, 50+ patched fonts: Hack, Source Code Pro, more. Glyph collections: Font Awesome, Material Design Icons, Octicons, & more"
sway,FuelLabs,Rust,61876,5427,891,1882,False,False,True,True,🌴 Empowering everyone to build reliable and efficient smart contracts.
tldr,tldr-pages,Markdown,61693,5118,255,4481,False,True,True,True,Collaborative cheatsheets for console commands 📚.
lodash,lodash,JavaScript,61582,7127,132,5091,False,True,True,True,"A modern JavaScript utility library delivering modularity, performance, & extras."
redux,reduxjs,TypeScript,61438,15124,43,3944,True,True,True,True,A JS library for predictable global state management
ladybird,LadybirdBrowser,C++,61346,2873,664,655,True,True,True,True,Truly independent web browser
ripgrep,BurntSushi,Rust,61020,2434,126,3658,False,False,True,True,ripgrep recursively searches directories for a regex pattern while respecting your gitignore
atom,atom,JavaScript,61003,17272,994,5169,True,True,False,True,:atom: The hackable text editor
architect-awesome,xingshaocheng,,60842,17786,64,2901,False,False,False,True,后端架构师技术图谱
scrapy,scrapy,Python,60842,11370,656,5867,True,True,True,True,"Scrapy, a fast high-level web crawling & scraping framework for Python."
Front-end-Developer-Interview-Questions,h5bp,Nunjucks,60805,11069,50,5149,True,True,True,True,"A list of helpful front-end related questions you can use to interview potential candidates, test yourself or completely ignore."
leetcode-master,youngyangyang04,Shell,60771,12345,241,2284,False,False,False,True,《代码随想录》LeetCode 刷题攻略：200道经典题目刷题顺序，共60w字的详细图解，视频难点剖析，50余张思维导图，支持C++，Java，Python，Go，JavaScript等多语言版本，从此算法学习不再迷茫！🔥🔥 来看看，你会发现相见恨晚！🚀 
minio,minio,Go,60493,7263,80,4079,True,True,True,True,"MinIO is a high-performance, S3 compatible object store, open sourced under GNU AGPLv3 license."
openpilot,commaai,Python,60336,10710,263,3400,False,True,True,True,"openpilot is an operating system for robotics. Currently, it upgrades the driver assistance system on 300+ supported cars."
markdown-here,adam-p,JavaScript,60174,11113,317,5056,False,True,False,True,"Google Chrome, Firefox, and Thunderbird extension that lets you write email in Markdown and render it before sending."
nuxt,nuxt,TypeScript,59876,5572,909,3428,True,True,True,True,The Full-Stack Vue Framework.
jquery,jquery,JavaScript,59872,20467,97,6191,True,True,True,True,jQuery JavaScript Library
drawio-desktop,jgraph,JavaScript,59869,5612,66,3217,True,False,True,True,Official electron build of draw.io
spring-framework,spring-projects,Java,59771,38916,365,5577,True,True,True,True,Spring Framework
git,git,C,59717,27665,354,6445,True,True,True,True,Git Source Code Mirror - This is a publish-only repository but pull requests can be turned into patches to the mailing list via GitGitGadget (https://gitgitgadget.github.io/). Please follow Documentation/SubmittingPatches procedure for any of your improvements.
30-Days-Of-Python,Asabeneh,Python,59592,11366,100,2309,False,False,True,True,The 30 Days of Python programming challenge is a step-by-step guide to learn the Python programming language in 30 days. This challenge may take more than 100 days. Follow your own pace. These videos may help too: https://www.youtube.com/channel/UC7PNRuno1rzYPb1xLa4yktw
Real-Time-Voice-Cloning,CorentinJ,Python,59525,9424,170,2486,False,False,True,True,Clone a voice in 5 seconds to generate arbitrary speech in real-time
pathway,pathwaycom,Python,59421,1607,37,1205,True,True,True,True,"Python ETL framework for stream processing, real-time analytics, LLM pipelines, and RAG."
Magisk,topjohnwu,Rust,59318,16989,47,3476,False,False,True,True,The Magic Mask for Android
awesome-flutter,Solido,Dart,59288,6870,24,3235,False,True,True,True,"An awesome list that curates the best Flutter libraries, tools, tutorials, articles and more."
shadowsocks-windows,shadowsocks,C#,59282,16292,199,4809,False,True,False,True,A C# port of shadowsocks
llama,meta-llama,Python,59229,9825,516,1126,True,True,True,True,Inference code for Llama models
cline,cline,TypeScript,59026,5979,795,618,True,True,True,True,"Autonomous coding agent right in your IDE, capable of creating/editing files, executing commands, using the browser, and more with your permission every step of the way."
angular.js,angular,JavaScript,58915,27229,461,5914,True,True,False,True,AngularJS - HTML enhanced for web apps!
awesome-chatgpt-prompts-zh,PlexPt,,58747,13574,42,1191,False,False,False,True,ChatGPT 中文调教指南。各种场景使用指南。学习怎么让它听你的话。
rails,rails,Ruby,58348,22175,1504,6549,True,True,True,True,Ruby on Rails
mkcert,FiloSottile,Go,58345,3046,165,2821,True,True,True,True,A simple zero-config tool to make locally trusted development certificates with any names you'd like.
FFmpeg,FFmpeg,C,57963,13575,3,5450,False,True,False,True,Mirror of https://git.ffmpeg.org/ffmpeg.git
memos,usememos,Go,57952,4204,25,1559,False,False,True,True,"Open-source, self-hosted note-taking tool built for quick capture. Markdown-native, lightweight, and fully yours."
bat,sharkdp,Rust,57694,1492,341,2886,False,True,True,True,A cat(1) clone with wings.
astro,withastro,TypeScript,57599,3226,280,1827,True,True,True,True,The web framework for content-driven websites. ⭐️ Star to support our work!
zustand,pmndrs,TypeScript,57407,1982,3,2533,False,True,True,True,🐻 Bear necessities for state management in React
html5-boilerplate,h5bp,JavaScript,57399,12305,24,5895,True,True,True,True,"A professional front-end template for building fast, robust, and adaptable web apps or sites."
fuel-core,FuelLabs,Rust,57291,2866,190,2027,False,True,True,True,Rust full node implementation of the Fuel v2 protocol.
DeepLearning-500-questions,scutan90,JavaScript,57224,15971,121,2819,False,False,False,True,深度学习500问，以问答形式对常用的概率知识、线性代数、机器学习、深度学习、计算机视觉等热点问题进行阐述，以帮助自己及有需要的读者。 全书分为18个章节，50余万字。由于水平有限，书中不妥之处恳请广大读者批评指正。   未完待续............ 如有意合作，联系scutjy2015@163.com                     版权所有，违权必究       Tan 2018.06
private-gpt,zylon-ai,Python,57184,7606,293,1049,False,False,True,True,"Interact with your documents using the power of GPT, 100% privately, no data leaks"
yolov5,ultralytics,Python,57031,17444,46,2129,True,True,True,True,YOLOv5 🚀 in PyTorch > ONNX > CoreML > TFLite
vaultwarden,dani-garcia,Rust,56864,2636,37,2949,False,False,True,True,"Unofficial Bitwarden compatible server written in Rust, formerly known as bitwarden_rs"
you-get,soimort,Python,56783,9780,381,4956,False,True,True,True,:arrow_double_down: Dumb downloader that scrapes the web
pocketbase,pocketbase,Go,56777,3178,24,1350,False,True,True,True,Open Source realtime backend in 1 file
meilisearch,meilisearch,Rust,56442,2430,276,2884,True,True,True,True,A lightning-fast search engine API bringing AI-powered hybrid search to your sites and applications.
MinerU,opendatalab,Python,56336,4672,193,746,False,False,True,True,Transforms complex documents like PDFs into LLM-ready markdown/JSON for your Agentic workflows.
anything-llm,Mintplex-Labs,JavaScript,56331,6088,303,1017,False,True,True,True,The all-in-one AI productivity accelerator. On device and privacy first with no annoying setup or configuration.
react-router,remix-run,TypeScript,56310,10846,158,4322,True,True,True,True,Declarative routing for React
face_recognition,ageitgey,Python,56208,13713,833,3300,False,True,True,True,The world's simplest facial recognition api for Python and the command line
awesome-rust,rust-unofficial,Rust,56177,3230,11,4260,False,True,True,True,A curated list of Rust code and resources.
llm-app,pathwaycom,Jupyter Notebook,56150,1385,8,971,True,True,True,True,"Ready-to-run cloud templates for RAG, AI pipelines, and enterprise search with live data. 🐳Docker-friendly.⚡Always in sync with Sharepoint, Google Drive, S3, Kafka, PostgreSQL, real-time data APIs, and more."
pi-hole,pi-hole,Shell,56147,2995,57,4299,True,True,True,True,A black hole for Internet advertisements
rclone,rclone,Go,56076,4973,1141,4383,True,True,True,True,"""rsync for cloud storage"" - Google Drive, S3, Dropbox, Backblaze B2, One Drive, Swift, Hubic, Wasabi, Google Cloud Storage, Azure Blob, Azure Files, Yandex Files"
gatsby,gatsbyjs,JavaScript,55946,10226,355,3952,True,True,True,True,"React-based framework with performance, scalability, and security built in."
docling,docling-project,Python,55931,3784,852,615,True,True,True,True,Get your documents ready for gen AI
GPT-SoVITS,RVC-Boss,Python,55842,6099,861,792,False,False,True,True,1 min voice data can also be used to train a good TTS model! (few shot voice cloning)
leetcode,azl397985856,JavaScript,55824,9439,10,2908,False,True,False,True,LeetCode Solutions: A Record of My Problem Solving Journey.( leetcode题解，记录自己的leetcode解题之路。)
rich,Textualize,Python,55792,2061,307,2318,True,True,True,True,Rich is a Python library for rich text and beautiful formatting in the terminal.
autogen,microsoft,Python,55724,8399,678,941,True,True,True,True,A programming framework for agentic AI
github-cheat-sheet,tiimgreen,,55684,5402,43,4356,False,True,False,True,A list of cool features of Git and GitHub.
awesome-android-ui,wasabeef,,55672,10274,38,4101,True,False,False,True,A curated list of awesome Android UI/UX libraries
project-layout,golang-standards,Makefile,55557,5442,98,3110,False,False,False,True,Standard Go Project Layout
OpenManus,FoundationAgents,Python,55285,9672,529,375,True,False,True,True,"No fortress, purely open ground.  OpenManus is Coming."
hackingtool,Z4nzu,Python,55249,6016,2,2165,False,False,True,True,ALL IN ONE Hacking Tool For Hackers
gpt-engineer,AntonOsika,Python,55229,7317,68,1052,True,True,True,True,CLI platform to experiment with codegen. Precursor to: https://lovable.dev
appwrite,appwrite,TypeScript,55150,5089,734,2534,True,True,True,True,"Appwrite® - complete cloud infrastructure for your web, mobile and AI apps. Including Auth, Databases, Storage, Functions, Messaging, Hosting, Realtime and more"
faceswap,deepfakes,Python,55054,13416,5,3009,True,False,True,True,Deepfakes Software For All
nanoGPT,karpathy,Python,55017,9368,338,1175,False,False,False,True,"The simplest, fastest repository for training/finetuning medium-sized GPTs."
starship,starship,Rust,54895,2420,984,2541,True,True,True,True,"☄🌌️  The minimal, blazing-fast, and infinitely customizable prompt for any shell!"
ultralytics,ultralytics,Python,54500,10488,299,1282,True,True,True,True,Ultralytics YOLO 🚀
marktext,marktext,JavaScript,54485,4032,1404,3046,True,True,True,True,"📝A simple and elegant markdown editor, available for Linux, macOS and Windows."
ChatGPT,lencx,Rust,54363,6194,923,1195,False,False,True,True,"🔮 ChatGPT Desktop Application (Mac, Windows and Linux)"
gitea,go-gitea,Go,54325,6479,2855,3423,True,True,True,True,"Git with a cup of tea! Painless self-hosted all-in-one software development service, including Git hosting, code review, team collaboration, package registry and CI/CD"
element,ElemeFE,Vue,54201,14534,2967,3481,False,False,True,True,A Vue.js 2.0 UI Toolkit for Web
ai-agents-for-beginners,microsoft,Jupyter Notebook,54193,18779,6,473,True,False,True,True,12 Lessons to Get Started Building AI Agents
unsloth,unslothai,Python,54083,4524,940,838,True,True,True,True,"Fine-tuning & Reinforcement Learning for LLMs. 🦥 Train OpenAI gpt-oss, DeepSeek, Qwen, Llama, Gemma, TTS 2x faster with 70% less VRAM."
maybe,maybe-finance,Ruby,54048,5449,0,805,False,True,True,True,The personal finance app for everyone
joplin,laurent22,TypeScript,53932,5958,598,3346,False,True,True,True,"Joplin - the privacy-focused note taking app with sync capabilities for Windows, macOS, Linux, Android and iOS."
requests,psf,Python,53882,9783,301,5510,True,True,True,True,"A simple, yet elegant, HTTP library."
normalize.css,necolas,CSS,53768,10465,74,5430,False,True,False,True,A modern alternative to CSS resets
segment-anything,facebookresearch,Jupyter Notebook,53681,6285,592,1089,True,True,True,True,"The repository provides code for running inference with the SegmentAnything Model (SAM), links for downloading the trained model checkpoints, and example notebooks that show how to use the model."
dive,wagoodman,Go,53590,1965,203,2864,False,False,True,True,A tool for exploring each layer in a docker image
powerlevel10k,romkatv,Shell,53333,2392,137,2577,False,False,False,True,A Zsh theme
core,vuejs,TypeScript,53250,9073,994,2834,False,True,True,True,"🖖 Vue.js is a progressive, incrementally-adoptable JavaScript framework for building UI on the web."
trackerslist,ngosang,,53215,6629,10,3613,False,False,True,True,Updated list of public BitTorrent trackers
first-contributions,firstcontributions,,53022,99601,224,3464,True,True,True,True,🚀✨ Help beginners to contribute to open source projects
material-design-icons,google,,52988,9734,398,4177,True,True,True,True,Material Design icons by Google (Material Symbols)
pdf.js,mozilla,JavaScript,52986,10598,481,5438,True,True,True,True,PDF Reader in JavaScript
n8n-workflows,Zie619,Python,52968,6846,20,306,False,False,True,True,all of the workflows of n8n i could find (also from the site itself)
ImHex,WerWolv,C++,52888,2343,335,1952,True,True,True,True,"🔍 A Hex Editor for Reverse Engineers, Programmers and people who value their retinas when working at 3 AM."
Free-Certifications,cloudcommunity,,52686,3498,67,2054,False,False,False,True,A curated list of free courses with certifications. Also available at https://free-certifications.com/
kotlin,JetBrains,Kotlin,52459,6251,217,5145,True,True,True,True,The Kotlin Programming Language. 
ionic-framework,ionic-team,TypeScript,52405,13399,627,4591,True,True,True,True,"A powerful cross-platform UI toolkit for building native-quality iOS, Android, and Progressive Web Apps with HTML, CSS, and JavaScript."
Docker-OSX,sickcodes,Shell,52274,2899,415,2111,False,False,True,True,Run macOS VM in a Docker! Run near native OSX-KVM in Docker! X11 Forwarding! CI/CD for OS X Security Research! Docker mac Containers.
v2rayNG,2dust,Kotlin,52228,7029,10,2498,False,False,True,True,"A V2Ray client for Android, support Xray core and v2fly core"
typst,typst,Rust,52099,1506,1154,2365,False,True,True,True,A markup-based typesetting system that is powerful and easy to learn.
termux-app,termux,Java,52078,6210,503,3797,False,False,True,True,Termux - a terminal emulator application for Android OS extendible by variety of packages.
Ghost,TryGhost,JavaScript,52068,11384,374,4699,True,True,True,True,"Independent technology for modern publishing, memberships, subscriptions and newsletters."
PowerShell,PowerShell,C#,51890,8222,1414,3715,True,True,True,True,PowerShell for every system!
coolify,coollabsio,PHP,51773,3825,657,1876,True,True,True,True,"An open-source, self-hostable PaaS alternative to Vercel, Heroku & Netlify that lets you easily deploy static sites, databases, full-stack applications and 280+ one-click services on your own servers."
prettier,prettier,JavaScript,51770,4679,1450,3394,True,True,True,True,Prettier is an opinionated code formatter.
etcd,etcd-io,Go,51677,10344,225,4636,True,True,True,True,Distributed reliable key-value store for the most critical data of a distributed system
awesome-ios,vsouza,Swift,51548,6962,18,4267,True,True,True,True,"A curated list of awesome iOS ecosystem, including Objective-C and Swift Projects "
grok-1,xai-org,Python,51527,8479,126,729,True,False,True,True,Grok open release
guava,google,Java,51507,11151,722,4309,True,True,True,True,Google core libraries for Java
jekyll,jekyll,Ruby,51467,10299,242,6356,True,True,True,True,:globe_with_meridians: Jekyll is a blog-aware static site generator in Ruby
Semantic-UI,Semantic-Org,JavaScript,51130,4898,1074,4725,False,True,False,True,Semantic is a UI component framework based around useful principles from natural language.
chinese-poetry,chinese-poetry,JavaScript,51102,10328,129,3483,False,False,True,True,"The most comprehensive database of Chinese poetry 🧶最全中华古诗词数据库,  唐宋两朝近一万四千古诗人,  接近5.5万首唐诗加26万宋诗.  两宋时期1564位词人，21050首词。"
DefinitelyTyped,DefinitelyTyped,TypeScript,51076,30574,701,4910,False,False,True,True,The repository for high quality TypeScript type definitions.
Motrix,agalwood,JavaScript,51048,4825,773,2645,True,True,True,True,A full-featured download manager.
go-ethereum,ethereum,Go,50923,21858,382,4463,False,True,True,True,Go implementation of the Ethereum protocol
Flowise,FlowiseAI,TypeScript,50811,23965,811,1081,True,True,True,True,"Build AI Agents, Visually"
professional-programming,charlax,Python,50673,3977,2,3782,False,True,False,True,A collection of learning resources for curious software engineers
awesome-wechat-weapp,justjavac,,50621,9014,2,3462,False,False,False,True,微信小程序开发资源汇总 :100:
hiring-without-whiteboards,poteto,JavaScript,50494,3883,38,3288,True,True,True,True,⭐️  Companies that don't have a broken hiring process
windows,dockur,Shell,50460,4124,112,792,False,False,True,True,Windows inside a Docker container.
MoneyPrinterTurbo,harry0703,Python,50256,7158,233,736,False,False,True,True,利用AI大模型，一键生成高清短视频 Generate short videos with one click using AI LLM.
lazydocker,jesseduffield,Go,50161,1589,258,2494,True,True,True,True,The lazier way to manage everything docker
mem0,mem0ai,Python,50091,5580,808,1000,False,True,True,True,Universal memory layer for AI Agents
bulma,jgthms,CSS,50062,3904,520,3705,False,True,True,True,Modern CSS framework based on Flexbox
100-Days-Of-ML-Code,Avik-Jain,,49934,11342,66,2811,True,True,False,True,100 Days of ML Coding
mastodon,mastodon,Ruby,49757,7422,4429,3675,True,True,True,True,"Your self-hosted, globally interconnected microblogging community"
cypress,cypress-io,TypeScript,49611,3400,1216,4031,True,True,True,True,"Fast, easy and reliable testing for anything that runs in a browser."
odoo,odoo,Python,49568,31828,9483,4325,False,True,False,True,Odoo. Open Source Apps To Grow Your Business.
agency-agents,msitarzewski,Shell,49505,7383,51,154,False,True,True,True,"A complete AI agency at your fingertips - From frontend wizards to Reddit community ninjas, from whimsy injectors to reality checkers. Each agent is a specialized expert with personality, processes, and proven deliverables."
hacker-scripts,NARKOZ,JavaScript,49435,6668,69,3768,False,False,False,True,Based on a true story
jellyfin,jellyfin,C#,49391,4531,879,2654,True,True,True,True,The Free Software Media System - Server Backend & API
lx-music-desktop,lyswhut,TypeScript,49346,6658,1100,2406,False,False,True,True,一个基于 Electron 的音乐软件
context7,upstash,TypeScript,49330,2329,166,355,False,False,True,True,Context7 Platform -- Up-to-date code documentation for LLMs and AI code editors
open-source-ios-apps,dkhamsing,,49262,5737,2,4067,False,True,True,True,:iphone: Collaborative List of Open-Source iOS Apps
winutil,ChrisTitusTech,PowerShell,49174,2596,19,1419,True,True,True,True,"Chris Titus Tech's Windows Utility - Install Programs, Tweaks, Fixes, and Updates"
alist,AlistGo,Go,49171,7979,565,1909,True,True,True,True,"🗂️A file list/WebDAV program that supports multiple storages, powered by Gin and Solidjs. / 一个支持多存储的文件列表/WebDAV程序，使用 Gin 和 Solidjs。"
ai-hedge-fund,virattt,Python,49142,8562,89,472,False,False,True,True,An AI Hedge Fund Team
dbeaver,dbeaver,Java,49139,4074,3229,3799,True,True,True,True,Free universal database tool and SQL client
json,nlohmann,C++,49137,7338,101,4638,True,True,True,True,JSON for Modern C++
