repo_name,organization,language,stars,forks,open_issues,age_days,has_coc,has_contributing,has_workflows,has_readme,description
moby,moby,Go,71870,18958,3800,4910,False,True,True,True,The Moby Project - a collaborative project for the container ecosystem to assemble container-based systems
reveal.js,hakimel,JavaScript,71839,16808,908,5501,False,True,True,True,The HTML Presentation Framework
SecLists,danielmiessler,PHP,71839,25050,9,5245,False,True,True,True,"SecLists is the security tester's companion. It's a collection of multiple types of lists used during security assessments, collected in one place. List types include usernames, passwords, URLs, sensitive data patterns, fuzzing payloads, web shells, and many more."
protobuf,protocolbuffers,C++,71435,16170,253,4325,True,True,True,True,Protocol Buffers - Google's data interchange format
gpt_academic,binary-husky,Python,71010,8360,331,1197,False,False,True,True,"为GPT/GLM等LLM大语言模型提供实用化交互接口，特别优化论文阅读/润色/写作体验，模块化设计，支持自定义快捷按钮&函数插件，支持Python和C++等项目剖析&自译解功能，PDF/LaTex论文翻译&总结功能，支持并行问询多种LLM模型，支持chatglm3等本地模型。接入通义千问, deepseekcoder, 讯飞星火, 文心一言, llama2, rwkv, claude2, moss等。"
act,nektos,Go,70895,1963,343,2735,False,True,True,True,Run your GitHub Actions locally 🚀
anime,juliangarnier,JavaScript,70537,4761,110,3760,False,True,True,True,JavaScript animation engine
crawl4ai,unclecode,Python,70348,7211,117,781,True,True,True,True,"🚀🤖 Crawl4AI: Open-source LLM Friendly Web Crawler & Scraper. Don't be shy, join here: https://discord.gg/jP8KfhDhyN"
ghidra,NationalSecurityAgency,Java,70290,7704,1872,2678,False,True,True,True,Ghidra is a software reverse engineering (SRE) framework
swift,swiftlang,Swift,70122,10746,9060,3902,True,True,True,True,The Swift Programming Language
AFFiNE,toeverything,TypeScript,69911,4991,644,1429,True,True,True,True,"There can be more than Notion and Miro. AFFiNE(pronounced [ə‘fain]) is a next-gen knowledge base that brings planning, sorting and creating all together. Privacy first, open-source, customizable and ready to use. "
OpenBB,OpenBB-finance,Python,69855,7071,69,2017,True,False,True,True,"Financial data platform for analysts, quants and AI agents."
Understand-Anything,Egonex-AI,TypeScript,69412,5744,259,107,True,True,True,True,"Graphs that teach > graphs that impress. Turn any code into an interactive knowledge graph you can explore, search, and ask questions about. Works with Claude Code, Codex, Cursor, Copilot, Gemini CLI, and more."
awesome-courses,prakhar1989,,69395,8381,63,4244,False,True,False,True,:books: List of awesome university courses for learning Computer Science!
express,expressjs,JavaScript,69379,23910,216,6212,True,True,True,True,"Fast, unopinionated, minimalist web framework for node."
MetaGPT,FoundationAgents,Python,69119,8815,135,1095,False,False,True,True,"🌟 The Multi-Agent Framework: First AI Software Company, Towards Natural Language Programming"
ansible,ansible,Python,69086,24097,808,5228,True,True,True,True,"Ansible is a radically simple IT automation platform that makes your applications and systems easier to deploy and maintain. Automate everything from code deployment to network configuration to cloud management, in a language that approaches plain English, using SSH, with no agents to install on remote systems. https://docs.ansible.com."
learn-claude-code,shareAI-lab,Python,69067,11264,40,365,False,True,True,True,"Bash is all you need -  A nano claude code–like 「agent harness」, built from 0 to 1"
node,base,Shell,68501,3255,18,1244,False,True,True,True,Everything required to run your own Base node
ai-agents-for-beginners,microsoft,Jupyter Notebook,68200,22630,19,578,True,False,True,True,12 Lessons to Get Started Building AI Agents
Apollo-11,chrislgarry,Assembly,68175,7704,132,4470,False,True,True,True,Original Apollo 11 Guidance Computer (AGC) source code for the command and lunar modules.
agent-skills,addyosmani,Shell,68027,7383,146,134,False,True,True,True,Production-grade engineering skills for AI coding agents.
ponytail,DietrichGebert,JavaScript,67731,3488,126,18,False,False,True,True,Makes your AI agent think like the laziest senior dev in the room. The best code is the code you never wrote.
unsloth,unslothai,Python,67629,6073,1024,943,True,True,True,True,"Unsloth Studio is a web UI for training and running open models like Gemma 4, Qwen3.6, DeepSeek, gpt-oss locally."
Chart.js,chartjs,JavaScript,67543,11939,572,4852,False,False,True,True,Simple HTML5 Charts using the <canvas> tag
MiroFish,666ghj,Python,67524,10529,328,216,False,False,True,True,"A Simple and Universal Swarm Intelligence Engine, Predicting Anything. 简洁通用的群体智能引擎，预测万物"
Scrapling,D4Vinci,Python,67215,6634,8,624,True,True,True,True,🕷️ An adaptive Web Scraping framework that handles everything from a single request to a full-scale crawl!
rtk,rtk-ai,Rust,67101,4142,1445,158,False,True,True,True,"CLI proxy that reduces LLM token consumption by 60-90% on common dev commands. Single Rust binary, zero dependencies"
annotated_deep_learning_paper_implementations,labmlai,Python,67011,6725,32,2135,False,False,True,True,"🧑‍🏫 60+ Implementations/tutorials of deep learning papers with side-by-side notes 📝; including transformers (original, xl, switch, feedback, vit, ...), optimizers (adam, adabelief, sophia, ...), gans(cyclegan, stylegan2, ...), 🎮 reinforcement learning (ppo, dqn), capsnet, distillation, ... 🧠"
30-Days-Of-Python,Asabeneh,Python,66725,12457,164,2414,False,False,True,True,The 30 Days of Python programming challenge is a step-by-step guide to learn the Python programming language in 30 days. This challenge may take more than 100 days. Follow your own pace. These videos may help too: https://www.youtube.com/channel/UC7PNRuno1rzYPb1xLa4yktw
echarts,apache,TypeScript,66701,19802,1606,4836,True,True,True,True,"Apache ECharts is a powerful, interactive charting and data visualization library for browser"
scikit-learn,scikit-learn,Python,66628,27124,2107,5795,True,True,True,True,scikit-learn: machine learning in Python
pi,earendil-works,TypeScript,66576,8133,52,324,False,True,True,True,"AI agent toolkit: unified LLM API, agent loop, TUI, coding agent CLI"
33-js-concepts,leonardomso,JavaScript,66487,9168,2,2855,True,True,True,True,📜 33 JavaScript concepts every developer should know.
gpt4free,xtekky,Python,66464,13559,4,1188,True,True,True,True,The official gpt4free repository | various collection of powerful language models | opus 4.6 gpt 5.3 kimi 2.5 deepseek v3.2 gemini 3
awesome-claude-skills,ComposioHQ,Python,66355,7377,890,255,False,True,True,True,"A curated list of awesome Claude Skills, resources, and tools for customizing Claude AI workflows"
design-resources-for-developers,bradtraversy,,66250,12103,49,2245,False,True,True,True,"Curated list of design and UI resources from stock photos, web templates, CSS frameworks, UI libraries, tools and much more"
awesome-nodejs,sindresorhus,,66101,6225,26,4371,True,True,True,True,":zap: Delightful Node.js packages and resources [BECAUSE OF TOO MUCH SPAM AND LOW-QUALITY SUBMISSIONS, SUBMISSIONS ARE PAUSED UNTIL JULY]"
Java,TheAlgorithms,Java,65936,21215,13,3635,True,True,True,True,All Algorithms implemented in Java
uBlock,gorhill,JavaScript,65859,4197,17,4107,False,True,True,True,uBlock Origin - An efficient blocker for Chromium and Firefox. Fast and lean.
webpack,webpack,JavaScript,65851,9346,174,5224,True,True,True,True,"A bundler for javascript and friends. Packs many modules into a few bundled assets. Code Splitting allows for loading parts of the application on demand. Through ""loaders"", modules can be CommonJs, AMD, ES6 modules, CSS, Images, JSON, Coffeescript, LESS, ... and your custom stuff."
ripgrep,BurntSushi,Rust,65592,2618,204,3763,False,True,True,True,ripgrep recursively searches directories for a regex pattern while respecting your gitignore
docusaurus,facebook,TypeScript,65445,9947,377,3296,True,True,True,True,Easy to maintain open source documentation websites.
nocode,kelseyhightower,Dockerfile,65440,4822,4714,3065,False,True,False,True,The best way to write secure and reliable applications. Write nothing; deploy nowhere.
javascript-questions,lydiahallie,,65321,9215,53,2574,False,False,False,True,"A long list of (advanced) JavaScript questions, and their explanations :sparkles:  "
localstack,localstack,Python,65080,4742,0,3534,True,True,True,True,💻 A fully functional local AWS cloud stack. Develop and test your cloud & Serverless apps offline
interviews,kdn251,Java,65036,12893,120,3422,False,False,False,True,Everything you need to know to get the job.
prometheus,prometheus,Go,64854,10539,850,4965,True,True,True,True,The Prometheus monitoring system and time series database.
alacritty,alacritty,Rust,64717,3496,340,3785,False,True,True,True,"A cross-platform, OpenGL terminal emulator."
get-shit-done,gsd-build,JavaScript,64580,5477,0,197,False,True,True,True,"A light-weight and powerful meta-prompting, context engineering and spec-driven development system for Claude Code by TÂCHES."
ladybird,LadybirdBrowser,C++,64382,3078,520,760,True,True,True,True,Truly independent web browser
oh-my-openagent,code-yeongyu,TypeScript,64286,5242,792,209,False,True,True,True,"omo/lazycodex: The coding agent for tokenmaxxers;the one and only agent harness for complex codebases. For your Codex, for your OpenCode"
openinterpreter,openinterpreter,Rust,64182,5574,273,1081,False,True,True,True,"A lightweight coding agent for open models like Deepseek, Kimi, and Qwen"
keras,keras-team,Python,64102,19745,214,4112,False,True,True,True,Deep Learning for humans
cline,cline,TypeScript,64078,6801,1196,723,True,True,True,True,"Autonomous coding agent as an SDK, IDE extension, or CLI assistant."
traefik,traefik,Go,63784,6051,838,3942,True,True,True,True,The Cloud Native Application Proxy
nocodb,nocodb,TypeScript,63676,4884,658,3165,True,True,True,True,🔥 🔥 🔥 A Free & Self-hostable Airtable Alternative
nerd-fonts,ryanoasis,CSS,63536,3911,78,4225,True,True,True,True,"Iconic font aggregator, collection, & patcher. 3,600+ icons, 50+ patched fonts: Hack, Source Code Pro, more. Glyph collections: Font Awesome, Material Design Icons, Octicons, & more"
rustlings,rust-lang,Rust,63398,11215,40,3941,False,True,True,True,:crab: Small exercises to get you used to reading and writing Rust code!
socket.io,socketio,TypeScript,63206,10146,177,5954,False,True,True,True,Bidirectional and low-latency communication for every platform
vaultwarden,dani-garcia,Rust,63105,2957,62,3054,False,False,True,True,"Unofficial Bitwarden compatible server written in Rust, formerly known as bitwarden_rs"
tldr,tldr-pages,Markdown,62986,5329,281,4586,False,True,True,True,Collaborative cheatsheets for console commands 📚.
resume.github.com,resume,JavaScript,62875,1370,76,5622,False,False,False,True,Resumes generated using the GitHub informations
openpilot,commaai,Python,62830,11115,144,3505,False,True,True,True,"openpilot is an operating system for robotics. Currently, it upgrades the driver assistance system on 300+ supported cars."
pathway,pathwaycom,Python,62803,1677,44,1310,True,True,True,True,"Python ETL framework for stream processing, real-time analytics, LLM pipelines, and RAG."
hello-agents,datawhalechina,Python,62776,7763,146,295,False,False,True,True,📚 《从零开始构建智能体》——从零开始的智能体原理与实践教程
scrapy,scrapy,Python,62762,11732,607,5972,True,True,True,True,"Scrapy, a fast high-level web crawling & scraping framework for Python."
warp,warpdotdev,Rust,62602,5132,4472,1817,True,True,True,True,"Warp is an agentic development environment, born out of the terminal."
docling,docling-project,Python,62372,4378,934,720,True,True,True,True,Get your documents ready for gen AI
anything-llm,Mintplex-Labs,JavaScript,62311,6808,321,1122,False,True,True,True,Stop renting your intelligence. Own it with AnythingLLM. Everything you need for a powerful local-first agent experience 
ruflo,ruvnet,TypeScript,62114,7274,693,392,False,True,True,True,"🌊 The leading agent meta-harness. Deploy intelligent multi-player swarms, coordinate autonomous workflows, and build conversational AI systems. Features adaptive memory, self-learning swarm intelligence, RAG integration, and native Claude Code / Codex Integration"
drawio-desktop,jgraph,JavaScript,61883,5716,72,3322,True,False,True,True,Official electron build of draw.io
git,git,C,61878,28063,379,6550,True,True,True,True,Git Source Code Mirror - This is a publish-only repository but pull requests can be turned into patches to the mailing list via GitGitGadget (https://gitgitgadget.github.io/). Please follow Documentation/SubmittingPatches procedure for any of your improvements.
leetcode-master,youngyangyang04,Shell,61808,12330,248,2389,False,False,False,True,《代码随想录》LeetCode 刷题攻略：200道经典题目刷题顺序，共60w字的详细图解，视频难点剖析，50余张思维导图，支持C++，Java，Python，Go，JavaScript等多语言版本，从此算法学习不再迷茫！🔥🔥 来看看，你会发现相见恨晚！🚀 
claude-code-best-practice,shanraisshan,HTML,61597,6161,12,241,False,False,True,True,from vibe coding to agentic engineering - practice makes claude perfect
sway,FuelLabs,Rust,61588,5422,920,1987,False,False,True,True,🌴 Empowering everyone to build reliable and efficient smart contracts.
FFmpeg,FFmpeg,C,61563,13952,3,5555,False,True,False,True,Mirror of https://git.ffmpeg.org/ffmpeg.git
redux,reduxjs,TypeScript,61511,15060,48,4049,True,True,True,True,A JS library for predictable global state management
Magisk,topjohnwu,Kotlin,61422,17819,64,3581,False,False,True,True,The Magic Mask for Android
lodash,lodash,JavaScript,61241,7171,85,5197,False,True,True,True,"A modern JavaScript utility library delivering modularity, performance, & extras."
minio,minio,Go,61235,7632,81,4184,True,True,True,True,"MinIO is a high-performance, S3 compatible object store, open sourced under GNU AGPLv3 license."
memos,usememos,Go,61161,4510,17,1664,False,False,True,True,"Open-source, self-hosted note-taking tool built for quick capture. Markdown-native, lightweight, and fully yours."
worldmonitor,koala73,TypeScript,60969,9494,159,172,True,True,True,True,"Real-time global intelligence dashboard. AI-powered news aggregation, geopolitical monitoring, and infrastructure tracking in a unified situational awareness interface"
Front-end-Developer-Interview-Questions,h5bp,Nunjucks,60885,11030,62,5254,True,True,True,True,"A list of helpful front-end related questions you can use to interview potential candidates, test yourself or completely ignore."
architect-awesome,xingshaocheng,,60833,17678,63,3006,False,False,False,True,后端架构师技术图谱
atom,atom,JavaScript,60808,17201,994,5274,True,True,False,True,:atom: The hackable text editor
awesome-chatgpt-prompts-zh,PlexPt,,60804,13561,46,1296,False,False,False,True,ChatGPT 中文调教指南。各种场景使用指南。学习怎么让它听你的话。
ai-hedge-fund,virattt,Python,60679,10732,148,577,False,False,True,True,An AI Hedge Fund Team
astro,withastro,TypeScript,60615,3578,125,1932,True,True,True,True,The web framework for content-driven websites. ⭐️ Star to support our work!
OpenCut,OpenCut-app,TypeScript,60574,6551,330,372,True,False,True,True,The open-source CapCut alternative
nuxt,nuxt,TypeScript,60547,5679,819,3533,True,True,True,True,the full-stack Vue framework
awesome-flutter,Solido,Dart,60442,6895,38,3340,False,True,True,True,"An awesome list that curates the best Flutter libraries, tools, tutorials, articles and more."
nanoGPT,karpathy,Python,60327,10381,349,1280,False,False,False,True,"The simplest, fastest repository for training/finetuning medium-sized GPTs."
markdown-here,adam-p,JavaScript,60220,11043,318,5161,False,True,False,True,"Google Chrome, Firefox, and Thunderbird extension that lets you write email in Markdown and render it before sending."
spring-framework,spring-projects,Java,60074,38818,455,5683,True,True,True,True,Spring Framework
TrendRadar,sansan0,Python,60051,24745,50,427,False,False,True,True,"⭐AI-driven public opinion & trend monitor with multi-platform aggregation, RSS, and smart alerts.🎯 告别信息过载，你的 AI 舆情监控助手与热点筛选工具！聚合多平台热点 +  RSS 订阅，支持关键词精准筛选。AI 智能筛选新闻 + AI 翻译 +  AI 分析简报直推手机，也支持接入 MCP 架构，赋能 AI 自然语言对话分析、情感洞察与趋势预测等。支持 Docker ，数据本地/云端自持。集成微信/飞书/钉钉/Telegram/邮件/ntfy/bark/slack 等渠道智能推送。"
Real-Time-Voice-Cloning,CorentinJ,Python,59963,9402,172,2591,False,False,True,True,Clone a voice in 5 seconds to generate arbitrary speech in real-time
jquery,jquery,JavaScript,59817,20406,92,6296,True,True,True,True,jQuery JavaScript Library
mem0,mem0ai,Python,59731,6921,453,1105,False,True,True,True,Universal memory layer for AI Agents
shadowsocks-windows,shadowsocks,C#,59567,16237,199,4914,False,True,False,True,A C# port of shadowsocks
pi-hole,pi-hole,Shell,59502,3231,42,4404,True,True,True,True,A black hole for Internet advertisements
bat,sharkdp,Rust,59482,1575,384,2991,False,True,True,True,A cat(1) clone with wings.
llama,meta-llama,Python,59481,9790,523,1231,True,True,True,True,Inference code for Llama models
autogen,microsoft,Python,59366,8944,921,1046,True,True,True,True,A programming framework for agentic AI
pocketbase,pocketbase,Go,59342,3481,17,1456,False,True,True,True,Open Source realtime backend in 1 file
mkcert,FiloSottile,Go,59207,3129,172,2927,True,True,True,True,A simple zero-config tool to make locally trusted development certificates with any names you'd like.
llm-app,pathwaycom,Jupyter Notebook,59182,1435,10,1076,True,True,True,True,"Ready-to-run cloud templates for RAG, AI pipelines, and enterprise search with live data. 🐳Docker-friendly.⚡Always in sync with Sharepoint, Google Drive, S3, Kafka, PostgreSQL, real-time data APIs, and more."
GPT-SoVITS,RVC-Boss,Python,59153,6448,871,897,False,False,True,True,1 min voice data can also be used to train a good TTS model! (few shot voice cloning)
ultralytics,ultralytics,Python,58958,11290,284,1387,True,True,True,True,"Ultralytics YOLO26, YOLO11, YOLOv8 — object detection, instance segmentation, semantic segmentation, image classification, pose estimation, object tracking"
v2rayNG,2dust,Kotlin,58848,7682,21,2603,False,False,True,True,"A V2Ray client for Android, support Xray core and v2fly core"
rails,rails,Ruby,58727,22165,1522,6654,True,True,True,True,Ruby on Rails
angular.js,angular,JavaScript,58591,27086,461,6019,True,True,False,True,AngularJS - HTML enhanced for web apps!
Pake,tw93,Rust,58591,11719,39,1354,True,True,True,True,🤱🏻 Turn any webpage into a desktop app with one command.
starship,starship,Rust,58571,2566,998,2646,True,True,True,True,"☄🌌️  The minimal, blazing-fast, and infinitely customizable prompt for any shell!"
zustand,pmndrs,TypeScript,58429,2084,5,2638,False,True,True,True,🐻 Bear necessities for state management in React
meilisearch,meilisearch,Rust,58353,2601,302,2989,True,True,True,True,A lightning-fast search engine API bringing AI-powered hybrid search to your sites and applications.
context7,upstash,TypeScript,58326,2730,16,460,False,False,True,True,Context7 Platform -- Up-to-date code documentation for LLMs and AI code editors
awesome-rust,rust-unofficial,Rust,58083,3443,9,4365,False,True,True,True,A curated list of Rust code and resources.
rclone,rclone,Go,58078,5188,1189,4488,True,True,True,True,"""rsync for cloud storage"" - Google Drive, S3, Dropbox, Backblaze B2, One Drive, Swift, Hubic, Wasabi, Google Cloud Storage, Azure Blob, Azure Files, Yandex Files"
marktext,marktext,TypeScript,57991,4326,697,3151,False,True,True,True,"📝A simple and elegant markdown editor, available for Linux, macOS and Windows."
OpenSpec,Fission-AI,TypeScript,57778,4027,441,328,False,False,True,True,Spec-driven development (SDD) for AI coding assistants.
github-cheat-sheet,tiimgreen,,57640,5423,48,4461,False,True,False,True,A list of cool features of Git and GitHub.
yolov5,ultralytics,Python,57581,17467,42,2234,True,True,True,True,Ultralytics YOLOv5 in PyTorch > ONNX > CoreML > TFLite
coolify,coollabsio,PHP,57548,4860,807,1981,True,True,True,True,"An open-source, self-hostable PaaS alternative to Vercel, Heroku & Netlify that lets you easily deploy static sites, databases, full-stack applications and 280+ one-click services on your own servers."
html5-boilerplate,h5bp,JavaScript,57529,12285,25,6000,True,True,True,True,"A professional front-end template for building fast, robust, and adaptable web apps or sites."
Mole,tw93,Shell,57507,2025,2,280,False,True,True,True,"🐹 Clean, uninstall, analyze, optimize, and monitor your Mac from the terminal."
DeepLearning-500-questions,scutan90,JavaScript,57464,15908,120,2925,False,False,False,True,深度学习500问，以问答形式对常用的概率知识、线性代数、机器学习、深度学习、计算机视觉等热点问题进行阐述，以帮助自己及有需要的读者。 全书分为18个章节，50余万字。由于水平有限，书中不妥之处恳请广大读者批评指正。   未完待续............ 如有意合作，联系scutjy2015@163.com                     版权所有，违权必究       Tan 2018.06
private-gpt,zylon-ai,Python,57312,7600,5,1154,False,False,True,True,"Interact with your documents using the power of GPT, 100% privately, no data leaks"
ghostty,ghostty-org,Zig,57305,2979,250,1553,False,True,True,True,"👻 Ghostty is a fast, feature-rich, and cross-platform terminal emulator that uses platform-native UI and GPU acceleration."
termux-app,termux,Java,57029,6864,552,3902,False,False,True,True,Termux - a terminal emulator application for Android OS extendible by variety of packages.
fuel-core,FuelLabs,Rust,56986,2861,196,2132,False,True,True,True,Rust full node implementation of the Fuel v2 protocol.
you-get,soimort,Python,56847,9728,384,5061,False,True,True,True,:arrow_double_down: Dumb downloader that scrapes the web
winutil,ChrisTitusTech,PowerShell,56798,3253,43,1524,True,True,True,True,"Chris Titus Tech's Windows Utility - Install Programs, Tweaks, Fixes, and Updates"
mempalace,MemPalace,Python,56750,7341,559,86,False,True,True,True,The best-benchmarked open-source AI memory system. And it's free.
rich,Textualize,Python,56734,2208,359,2423,True,True,True,True,Rich is a Python library for rich text and beautiful formatting in the terminal.
career-ops,santifer,JavaScript,56701,11205,105,86,True,True,True,True,"AI-powered job search system built on Claude Code. 14 skill modes, Go dashboard, PDF generation, batch processing."
OpenManus,FoundationAgents,Python,56700,9865,517,480,True,False,True,True,"No fortress, purely open ground.  OpenManus is Coming."
awesome-android-ui,wasabeef,,56664,10250,39,4206,True,False,False,True,A curated list of awesome Android UI/UX libraries
gitea,go-gitea,Go,56603,6850,2755,3528,True,True,True,True,"Git with a cup of tea! Painless self-hosted all-in-one software development service, including Git hosting, code review, team collaboration, package registry and CI/CD"
face_recognition,ageitgey,Python,56549,13692,830,3405,False,True,True,True,The world's simplest facial recognition api for Python and the command line
react-router,remix-run,TypeScript,56477,10886,126,4427,True,True,True,True,Declarative routing for React
appwrite,appwrite,TypeScript,56447,5500,1015,2639,True,True,True,True,"Appwrite® - complete cloud infrastructure for your web, mobile and AI apps. Including Auth, Databases, Storage, Functions, Messaging, Hosting, Realtime and more"
project-layout,golang-standards,Makefile,56228,5436,95,3215,False,False,True,True,Standard Go Project Layout
codegraph,colbymchenry,TypeScript,56123,3460,254,162,False,False,True,True,"Pre-indexed code knowledge graph, auto syncs on code changes, for Claude Code, Codex, Gemini, Cursor, OpenCode, AntiGravity, Kiro, and Hermes Agent — fewer tokens, fewer tool calls, 100% local"
gatsby,gatsbyjs,JavaScript,55946,10160,398,4057,True,True,True,True,"React-based framework with performance, scalability, and security built in."
leetcode,azl397985856,JavaScript,55761,9405,10,3013,False,True,False,True,LeetCode Solutions: A Record of My Problem Solving Journey.( leetcode题解，记录自己的leetcode解题之路。)
nanochat,karpathy,Python,55614,7653,113,259,False,False,True,True,The best ChatGPT that $100 can buy.
n8n-workflows,Zie619,Python,55471,7365,32,411,False,False,True,True,all of the workflows of n8n i could find (also from the site itself)
joplin,laurent22,TypeScript,55382,6166,579,3451,False,True,True,True,"Joplin - the privacy-focused note taking app with sync capabilities for Windows, macOS, Linux, Android and iOS."
faceswap,deepfakes,Python,55327,13364,9,3114,True,False,True,True,Deepfakes Software For All
gpt-engineer,AntonOsika,Python,55205,7301,71,1157,True,True,True,True,CLI platform to experiment with codegen. Precursor to: https://lovable.dev
up,byoungd,,55099,5639,32,3317,False,False,True,True,An advanced guide which might benefit you a lot 🎉 . 人生进阶指南 离谱的人生 离谱的英语学习指南/英语学习教程/英语学习/学英语
first-contributions,firstcontributions,,54759,105221,46,3569,True,True,True,True,🚀✨ Help beginners to contribute to open source projects
typst,typst,Rust,54623,1631,1303,2470,False,True,True,True,A markup-based typesetting system that is powerful and easy to learn.
