repo_name,organization,language,stars,forks,open_issues,age_days,has_coc,has_contributing,has_workflows,has_readme,description
33-js-concepts,leonardomso,JavaScript,66280,9190,1,2748,True,True,True,True,📜 33 JavaScript concepts every developer should know.
webpack,webpack,JavaScript,66014,9322,200,5117,True,True,True,True,"A bundler for javascript and friends. Packs many modules into a few bundled assets. Code Splitting allows for loading parts of the application on demand. Through ""loaders"", modules can be CommonJs, AMD, ES6 modules, CSS, Images, JSON, Coffeescript, LESS, ... and your custom stuff."
annotated_deep_learning_paper_implementations,labmlai,Python,65975,6633,29,2028,False,False,True,True,"🧑‍🏫 60+ Implementations/tutorials of deep learning papers with side-by-side notes 📝; including transformers (original, xl, switch, feedback, vit, ...), optimizers (adam, adabelief, sophia, ...), gans(cyclegan, stylegan2, ...), 🎮 reinforcement learning (ppo, dqn), capsnet, distillation, ... 🧠"
AFFiNE,toeverything,TypeScript,65962,4602,582,1322,True,True,True,True,"There can be more than Notion and Miro. AFFiNE(pronounced [ə‘fain]) is a next-gen knowledge base that brings planning, sorting and creating all together. Privacy first, open-source, customizable and ready to use. "
echarts,apache,TypeScript,65932,19837,1767,4729,True,True,True,True,"Apache ECharts is a powerful, interactive charting and data visualization library for browser"
ChinaTextbook,TapXWorld,Roff,65836,14676,97,2261,False,False,False,True,所有小初高、大学PDF教材。
gpt4free,xtekky,Python,65756,13650,7,1081,True,True,True,True,The official gpt4free repository | various collection of powerful language models | opus 4.6 gpt 5.3 kimi 2.5 deepseek v3.2 gemini 3
ghidra,NationalSecurityAgency,Java,65747,7239,1853,2571,False,True,True,True,Ghidra is a software reverse engineering (SRE) framework
scikit-learn,scikit-learn,Python,65389,26792,2146,5688,True,True,True,True,scikit-learn: machine learning in Python
javascript-questions,lydiahallie,,65308,9236,48,2467,False,False,False,True,"A long list of (advanced) JavaScript questions, and their explanations :sparkles:  "
codex,openai,Rust,65300,8725,1950,335,False,True,True,True,Lightweight coding agent that runs in your terminal
awesome-nodejs,sindresorhus,,65297,6196,32,4264,True,True,True,True,:zap: Delightful Node.js packages and resources
Java,TheAlgorithms,Java,65205,21026,39,3528,True,True,True,True,All Algorithms implemented in Java
MetaGPT,FoundationAgents,Python,65172,8207,93,988,False,False,True,True,"🌟 The Multi-Agent Framework: First AI Software Company, Towards Natural Language Programming"
daytona,daytonaio,TypeScript,65118,5080,338,767,True,True,True,True,Daytona is a Secure and Elastic Infrastructure for Running AI-Generated Code
design-resources-for-developers,bradtraversy,,65018,11990,26,2138,False,True,False,True,"Curated list of design and UI resources from stock photos, web templates, CSS frameworks, UI libraries, tools and much more"
nocode,kelseyhightower,Dockerfile,64997,4816,4680,2958,False,True,False,True,The best way to write secure and reliable applications. Write nothing; deploy nowhere.
interviews,kdn251,Java,64945,12925,118,3315,False,False,False,True,Everything you need to know to get the job.
Apollo-11,chrislgarry,Assembly,64670,7377,126,4363,False,True,True,True,Original Apollo 11 Guidance Computer (AGC) source code for the command and lunar modules.
localstack,localstack,Python,64655,4598,0,3427,True,True,True,True,💻 A fully functional local AWS cloud stack. Develop and test your cloud & Serverless apps offline
docusaurus,facebook,TypeScript,64122,9778,354,3189,True,True,True,True,Easy to maintain open source documentation websites.
keras,keras-team,Python,63905,19737,267,4005,False,True,True,True,Deep Learning for humans
prometheus,prometheus,Go,63170,10245,761,4858,True,True,True,True,The Prometheus monitoring system and time series database.
OpenBB,OpenBB-finance,Python,63067,6190,64,1910,True,False,True,True,"Financial data platform for analysts, quants and AI agents."
socket.io,socketio,TypeScript,62949,10147,205,5847,False,True,True,True,Realtime application framework (Node.JS server)
alacritty,alacritty,Rust,62936,3344,337,3678,False,True,True,True,"A cross-platform, OpenGL terminal emulator."
resume.github.com,resume,JavaScript,62818,1362,71,5515,False,False,False,True,Resumes generated using the GitHub informations
open-interpreter,openinterpreter,Python,62712,5413,309,974,False,True,True,True,A natural language interface for computers
nocodb,nocodb,TypeScript,62420,4665,637,3058,True,True,True,True,🔥 🔥 🔥 A Free & Self-hostable Airtable Alternative
traefik,traefik,Go,62166,5882,781,3835,True,True,True,True,The Cloud Native Application Proxy
rustlings,rust-lang,Rust,62154,11171,82,3834,False,True,True,True,:crab: Small exercises to get you used to reading and writing Rust code!
uBlock,gorhill,JavaScript,62100,3975,17,4000,False,True,True,True,uBlock Origin - An efficient blocker for Chromium and Firefox. Fast and lean.
nerd-fonts,ryanoasis,CSS,62003,3869,61,4118,True,True,True,True,"Iconic font aggregator, collection, & patcher. 3,600+ icons, 50+ patched fonts: Hack, Source Code Pro, more. Glyph collections: Font Awesome, Material Design Icons, Octicons, & more"
crawl4ai,unclecode,Python,61957,6320,26,674,True,False,True,True,"🚀🤖 Crawl4AI: Open-source LLM Friendly Web Crawler & Scraper. Don't be shy, join here: https://discord.gg/jP8KfhDhyN"
sway,FuelLabs,Rust,61882,5427,891,1880,False,False,True,True,🌴 Empowering everyone to build reliable and efficient smart contracts.
tldr,tldr-pages,Markdown,61659,5112,240,4479,False,True,True,True,📚 Collaborative cheatsheets for console commands
lodash,lodash,JavaScript,61578,7128,132,5090,False,True,True,True,"A modern JavaScript utility library delivering modularity, performance, & extras."
redux,reduxjs,TypeScript,61438,15125,43,3942,True,True,True,True,A JS library for predictable global state management
ladybird,LadybirdBrowser,C++,61287,2867,654,653,True,True,True,True,Truly independent web browser
atom,atom,JavaScript,61001,17273,994,5167,True,True,False,True,:atom: The hackable text editor
ripgrep,BurntSushi,Rust,60919,2428,125,3656,False,False,True,True,ripgrep recursively searches directories for a regex pattern while respecting your gitignore
architect-awesome,xingshaocheng,,60842,17789,64,2899,False,False,False,True,后端架构师技术图谱
Front-end-Developer-Interview-Questions,h5bp,Nunjucks,60798,11070,50,5147,True,True,True,True,"A list of helpful front-end related questions you can use to interview potential candidates, test yourself or completely ignore."
scrapy,scrapy,Python,60743,11356,657,5865,True,True,True,True,"Scrapy, a fast high-level web crawling & scraping framework for Python."
leetcode-master,youngyangyang04,Shell,60735,12344,241,2282,False,False,False,True,《代码随想录》LeetCode 刷题攻略：200道经典题目刷题顺序，共60w字的详细图解，视频难点剖析，50余张思维导图，支持C++，Java，Python，Go，JavaScript等多语言版本，从此算法学习不再迷茫！🔥🔥 来看看，你会发现相见恨晚！🚀 
minio,minio,Go,60484,7250,80,4077,True,True,True,True,"MinIO is a high-performance, S3 compatible object store, open sourced under GNU AGPLv3 license."
openpilot,commaai,Python,60312,10705,268,3398,False,True,True,True,"openpilot is an operating system for robotics. Currently, it upgrades the driver assistance system on 300+ supported cars."
markdown-here,adam-p,JavaScript,60173,11114,317,5054,False,True,False,True,"Google Chrome, Firefox, and Thunderbird extension that lets you write email in Markdown and render it before sending."
jquery,jquery,JavaScript,59869,20471,97,6189,True,True,True,True,jQuery JavaScript Library
nuxt,nuxt,TypeScript,59837,5565,895,3426,True,True,True,True,The Full-Stack Vue Framework.
drawio-desktop,jgraph,JavaScript,59825,5608,64,3215,True,False,True,True,Official electron build of draw.io
spring-framework,spring-projects,Java,59758,38919,361,5576,True,True,True,True,Spring Framework
git,git,C,59676,27654,355,6443,True,True,True,True,Git Source Code Mirror - This is a publish-only repository but pull requests can be turned into patches to the mailing list via GitGitGadget (https://gitgitgadget.github.io/). Please follow Documentation/SubmittingPatches procedure for any of your improvements.
30-Days-Of-Python,Asabeneh,Python,59525,11347,100,2307,False,False,True,True,The 30 Days of Python programming challenge is a step-by-step guide to learn the Python programming language in 30 days. This challenge may take more than 100 days. Follow your own pace. These videos may help too: https://www.youtube.com/channel/UC7PNRuno1rzYPb1xLa4yktw
Real-Time-Voice-Cloning,CorentinJ,Python,59521,9424,169,2484,False,False,True,True,Clone a voice in 5 seconds to generate arbitrary speech in real-time
pathway,pathwaycom,Python,59392,1606,38,1203,True,True,True,True,"Python ETL framework for stream processing, real-time analytics, LLM pipelines, and RAG."
shadowsocks-windows,shadowsocks,C#,59281,16293,199,4807,False,True,False,True,A C# port of shadowsocks
Magisk,topjohnwu,Rust,59278,16972,47,3474,False,False,True,True,The Magic Mask for Android
awesome-flutter,Solido,Dart,59269,6869,24,3233,False,True,True,True,"An awesome list that curates the best Flutter libraries, tools, tutorials, articles and more."
llama,meta-llama,Python,59222,9826,516,1124,True,True,True,True,Inference code for Llama models
cline,cline,TypeScript,58975,5964,794,616,True,True,True,True,"Autonomous coding agent right in your IDE, capable of creating/editing files, executing commands, using the browser, and more with your permission every step of the way."
angular.js,angular,JavaScript,58915,27233,461,5912,True,True,False,True,AngularJS - HTML enhanced for web apps!
awesome-chatgpt-prompts-zh,PlexPt,,58723,13579,42,1189,False,False,False,True,ChatGPT 中文调教指南。各种场景使用指南。学习怎么让它听你的话。
rails,rails,Ruby,58321,22172,1505,6547,True,True,True,True,Ruby on Rails
mkcert,FiloSottile,Go,58299,3045,165,2819,True,True,True,True,A simple zero-config tool to make locally trusted development certificates with any names you'd like.
FFmpeg,FFmpeg,C,57908,13565,3,5448,False,True,False,True,Mirror of https://git.ffmpeg.org/ffmpeg.git
memos,usememos,Go,57863,4196,22,1557,False,False,True,True,"Open-source, self-hosted note-taking tool built for quick capture. Markdown-native, lightweight, and fully yours."
bat,sharkdp,Rust,57633,1490,338,2884,False,True,True,True,A cat(1) clone with wings.
astro,withastro,TypeScript,57549,3220,273,1825,True,True,True,True,The web framework for content-driven websites. ⭐️ Star to support our work!
html5-boilerplate,h5bp,JavaScript,57401,12306,23,5893,True,True,True,True,"A professional front-end template for building fast, robust, and adaptable web apps or sites."
zustand,pmndrs,TypeScript,57382,1977,5,2531,False,True,True,True,🐻 Bear necessities for state management in React
fuel-core,FuelLabs,Rust,57297,2867,190,2025,False,True,True,True,Rust full node implementation of the Fuel v2 protocol.
DeepLearning-500-questions,scutan90,JavaScript,57216,15971,121,2817,False,False,False,True,深度学习500问，以问答形式对常用的概率知识、线性代数、机器学习、深度学习、计算机视觉等热点问题进行阐述，以帮助自己及有需要的读者。 全书分为18个章节，50余万字。由于水平有限，书中不妥之处恳请广大读者批评指正。   未完待续............ 如有意合作，联系scutjy2015@163.com                     版权所有，违权必究       Tan 2018.06
private-gpt,zylon-ai,Python,57182,7607,293,1047,False,False,True,True,"Interact with your documents using the power of GPT, 100% privately, no data leaks"
yolov5,ultralytics,Python,57018,17443,46,2127,True,True,True,True,YOLOv5 🚀 in PyTorch > ONNX > CoreML > TFLite
you-get,soimort,Python,56775,9782,381,4954,False,True,True,True,:arrow_double_down: Dumb downloader that scrapes the web
vaultwarden,dani-garcia,Rust,56765,2625,40,2947,False,False,True,True,"Unofficial Bitwarden compatible server written in Rust, formerly known as bitwarden_rs"
pocketbase,pocketbase,Go,56745,3178,24,1348,False,True,True,True,Open Source realtime backend in 1 file
meilisearch,meilisearch,Rust,56398,2426,283,2882,True,True,True,True,A lightning-fast search engine API bringing AI-powered hybrid search to your sites and applications.
react-router,remix-run,TypeScript,56301,10844,157,4320,True,True,True,True,Declarative routing for React
anything-llm,Mintplex-Labs,JavaScript,56221,6080,300,1015,False,True,True,True,The all-in-one AI productivity accelerator. On device and privacy first with no annoying setup or configration.
face_recognition,ageitgey,Python,56197,13711,833,3298,False,True,True,True,The world's simplest facial recognition api for Python and the command line
MinerU,opendatalab,Python,56184,4658,193,744,False,False,True,True,Transforms complex documents like PDFs into LLM-ready markdown/JSON for your Agentic workflows.
awesome-rust,rust-unofficial,Rust,56149,3222,10,4258,False,True,True,True,A curated list of Rust code and resources.
llm-app,pathwaycom,Jupyter Notebook,56139,1379,8,969,True,True,True,True,"Ready-to-run cloud templates for RAG, AI pipelines, and enterprise search with live data. 🐳Docker-friendly.⚡Always in sync with Sharepoint, Google Drive, S3, Kafka, PostgreSQL, real-time data APIs, and more."
pi-hole,pi-hole,Shell,56114,2996,57,4297,True,True,True,True,A black hole for Internet advertisements
rclone,rclone,Go,56028,4972,1141,4381,True,True,True,True,"""rsync for cloud storage"" - Google Drive, S3, Dropbox, Backblaze B2, One Drive, Swift, Hubic, Wasabi, Google Cloud Storage, Azure Blob, Azure Files, Yandex Files"
gatsby,gatsbyjs,JavaScript,55947,10228,353,3950,True,True,True,True,"React-based framework with performance, scalability, and security built in."
docling,docling-project,Python,55824,3773,857,613,True,True,True,True,Get your documents ready for gen AI
leetcode,azl397985856,JavaScript,55820,9440,10,2906,False,True,False,True,LeetCode Solutions: A Record of My Problem Solving Journey.( leetcode题解，记录自己的leetcode解题之路。)
rich,Textualize,Python,55775,2059,307,2316,True,True,True,True,Rich is a Python library for rich text and beautiful formatting in the terminal.
GPT-SoVITS,RVC-Boss,Python,55774,6096,862,790,False,False,True,True,1 min voice data can also be used to train a good TTS model! (few shot voice cloning)
github-cheat-sheet,tiimgreen,,55654,5400,43,4354,False,True,False,True,A list of cool features of Git and GitHub.
awesome-android-ui,wasabeef,,55646,10273,38,4099,True,False,False,True,A curated list of awesome Android UI/UX libraries
autogen,microsoft,Python,55610,8395,674,939,True,True,True,True,A programming framework for agentic AI
project-layout,golang-standards,Makefile,55551,5441,98,3108,False,False,False,True,Standard Go Project Layout
OpenManus,FoundationAgents,Python,55240,9665,529,373,True,False,True,True,"No fortress, purely open ground.  OpenManus is Coming."
hackingtool,Z4nzu,Python,55237,6012,87,2163,False,False,True,True,ALL IN ONE Hacking Tool For Hackers
gpt-engineer,AntonOsika,Python,55222,7320,68,1050,True,True,True,True,CLI platform to experiment with codegen. Precursor to: https://lovable.dev
appwrite,appwrite,TypeScript,55098,5075,724,2532,True,True,True,True,"Appwrite® - complete cloud infrastructure for your web, mobile and AI apps. Including Auth, Databases, Storage, Functions, Messaging, Hosting, Realtime and more"
faceswap,deepfakes,Python,55041,13417,5,3007,True,False,True,True,Deepfakes Software For All
nanoGPT,karpathy,Python,54874,9340,336,1173,False,False,False,True,"The simplest, fastest repository for training/finetuning medium-sized GPTs."
starship,starship,Rust,54801,2418,983,2539,True,True,True,True,"☄🌌️  The minimal, blazing-fast, and infinitely customizable prompt for any shell!"
marktext,marktext,JavaScript,54436,4026,1403,3044,True,True,True,True,"📝A simple and elegant markdown editor, available for Linux, macOS and Windows."
ultralytics,ultralytics,Python,54401,10457,304,1280,True,True,True,True,Ultralytics YOLO 🚀
ChatGPT,lencx,Rust,54368,6196,923,1193,False,False,True,True,"🔮 ChatGPT Desktop Application (Mac, Windows and Linux)"
gitea,go-gitea,Go,54294,6477,2855,3421,True,True,True,True,"Git with a cup of tea! Painless self-hosted all-in-one software development service, including Git hosting, code review, team collaboration, package registry and CI/CD"
element,ElemeFE,Vue,54206,14536,2967,3479,False,False,True,True,A Vue.js 2.0 UI Toolkit for Web
maybe,maybe-finance,Ruby,54045,5439,0,803,False,True,True,True,The personal finance app for everyone
ai-agents-for-beginners,microsoft,Jupyter Notebook,54009,18739,6,471,True,False,True,True,12 Lessons to Get Started Building AI Agents
unsloth,unslothai,Python,53990,4514,933,836,True,True,True,True,"Fine-tuning & Reinforcement Learning for LLMs. 🦥 Train OpenAI gpt-oss, DeepSeek, Qwen, Llama, Gemma, TTS 2x faster with 70% less VRAM."
joplin,laurent22,TypeScript,53893,5939,594,3344,False,True,True,True,"Joplin - the privacy-focused note taking app with sync capabilities for Windows, macOS, Linux, Android and iOS."
requests,psf,Python,53853,9782,303,5508,True,True,True,True,"A simple, yet elegant, HTTP library."
normalize.css,necolas,CSS,53767,10466,73,5428,False,True,False,True,A modern alternative to CSS resets
segment-anything,facebookresearch,Jupyter Notebook,53668,6284,592,1087,True,True,True,True,"The repository provides code for running inference with the SegmentAnything Model (SAM), links for downloading the trained model checkpoints, and example notebooks that show how to use the model."
dive,wagoodman,Go,53575,1962,202,2862,False,False,True,True,A tool for exploring each layer in a docker image
powerlevel10k,romkatv,Shell,53289,2391,136,2575,False,False,False,True,A Zsh theme
core,vuejs,TypeScript,53236,9069,986,2832,False,True,True,True,"🖖 Vue.js is a progressive, incrementally-adoptable JavaScript framework for building UI on the web."
trackerslist,ngosang,,53194,6630,10,3611,False,False,True,True,Updated list of public BitTorrent trackers
first-contributions,firstcontributions,,52987,99504,205,3462,True,True,True,True,🚀✨ Help beginners to contribute to open source projects
pdf.js,mozilla,JavaScript,52982,10596,479,5436,True,True,True,True,PDF Reader in JavaScript
material-design-icons,google,,52980,9735,398,4175,True,True,True,True,Material Design icons by Google (Material Symbols)
n8n-workflows,Zie619,Python,52912,6830,20,304,False,False,True,True,all of the workflows of n8n i could find (also from the site itself)
ImHex,WerWolv,C++,52873,2342,334,1950,True,True,True,True,"🔍 A Hex Editor for Reverse Engineers, Programmers and people who value their retinas when working at 3 AM."
Free-Certifications,cloudcommunity,,52627,3495,67,2052,False,False,False,True,A curated list of free courses with certifications. Also available at https://free-certifications.com/
kotlin,JetBrains,Kotlin,52452,6248,224,5143,True,True,True,True,The Kotlin Programming Language. 
ionic-framework,ionic-team,TypeScript,52403,13397,624,4589,True,True,True,True,"A powerful cross-platform UI toolkit for building native-quality iOS, Android, and Progressive Web Apps with HTML, CSS, and JavaScript."
Docker-OSX,sickcodes,Shell,52270,2898,415,2109,False,False,True,True,Run macOS VM in a Docker! Run near native OSX-KVM in Docker! X11 Forwarding! CI/CD for OS X Security Research! Docker mac Containers.
v2rayNG,2dust,Kotlin,52142,7023,16,2496,False,False,True,True,"A V2Ray client for Android, support Xray core and v2fly core"
typst,typst,Rust,52044,1502,1152,2363,False,True,True,True,A markup-based typesetting system that is powerful and easy to learn.
Ghost,TryGhost,JavaScript,52041,11381,366,4697,True,True,True,True,"Independent technology for modern publishing, memberships, subscriptions and newsletters."
termux-app,termux,Java,51957,6194,501,3795,False,False,True,True,Termux - a terminal emulator application for Android OS extendible by variety of packages.
PowerShell,PowerShell,C#,51866,8221,1406,3713,True,True,True,True,PowerShell for every system!
prettier,prettier,JavaScript,51737,4676,1449,3392,True,True,True,True,Prettier is an opinionated code formatter.
coolify,coollabsio,PHP,51710,3809,658,1874,True,True,True,True,"An open-source, self-hostable PaaS alternative to Vercel, Heroku & Netlify that lets you easily deploy static sites, databases, full-stack applications and 280+ one-click services on your own servers."
etcd,etcd-io,Go,51616,10343,226,4634,True,True,True,True,Distributed reliable key-value store for the most critical data of a distributed system
grok-1,xai-org,Python,51532,8482,126,727,True,False,True,True,Grok open release
awesome-ios,vsouza,Swift,51532,6961,17,4265,True,True,True,True,"A curated list of awesome iOS ecosystem, including Objective-C and Swift Projects "
guava,google,Java,51505,11148,721,4307,True,True,True,True,Google core libraries for Java
jekyll,jekyll,Ruby,51447,10299,241,6354,True,True,True,True,:globe_with_meridians: Jekyll is a blog-aware static site generator in Ruby
Semantic-UI,Semantic-Org,JavaScript,51133,4898,1074,4723,False,True,False,True,Semantic is a UI component framework based around useful principles from natural language.
chinese-poetry,chinese-poetry,JavaScript,51092,10327,129,3481,False,False,True,True,"The most comprehensive database of Chinese poetry 🧶最全中华古诗词数据库,  唐宋两朝近一万四千古诗人,  接近5.5万首唐诗加26万宋诗.  两宋时期1564位词人，21050首词。"
DefinitelyTyped,DefinitelyTyped,TypeScript,51062,30567,708,4908,False,False,True,True,The repository for high quality TypeScript type definitions.
Motrix,agalwood,JavaScript,51032,4823,773,2643,True,True,True,True,A full-featured download manager.
go-ethereum,ethereum,Go,50918,21848,374,4461,False,True,True,True,Go implementation of the Ethereum protocol
Flowise,FlowiseAI,TypeScript,50752,23961,806,1079,True,True,True,True,"Build AI Agents, Visually"
professional-programming,charlax,Python,50668,3976,2,3781,False,True,False,True,A collection of learning resources for curious software engineers
awesome-wechat-weapp,justjavac,,50613,9014,2,3460,False,False,False,True,微信小程序开发资源汇总 :100:
hiring-without-whiteboards,poteto,JavaScript,50492,3884,38,3286,True,True,True,True,⭐️  Companies that don't have a broken hiring process
windows,dockur,Shell,50345,4111,111,790,False,False,True,True,Windows inside a Docker container.
MoneyPrinterTurbo,harry0703,Python,50208,7146,233,734,False,False,True,True,利用AI大模型，一键生成高清短视频 Generate short videos with one click using AI LLM.
lazydocker,jesseduffield,Go,50122,1586,256,2492,True,True,True,True,The lazier way to manage everything docker
bulma,jgthms,CSS,50062,3904,519,3703,False,True,True,True,Modern CSS framework based on Flexbox
100-Days-Of-ML-Code,Avik-Jain,,49881,11333,66,2809,True,True,False,True,100 Days of ML Coding
mem0,mem0ai,Python,49845,5569,814,998,False,True,True,True,Universal memory layer for AI Agents
mastodon,mastodon,Ruby,49750,7417,4433,3673,True,True,True,True,"Your self-hosted, globally interconnected microblogging community"
cypress,cypress-io,TypeScript,49610,3401,1225,4029,True,True,True,True,"Fast, easy and reliable testing for anything that runs in a browser."
odoo,odoo,Python,49525,31803,9453,4323,False,True,False,True,Odoo. Open Source Apps To Grow Your Business.
hacker-scripts,NARKOZ,JavaScript,49428,6668,69,3766,False,False,False,True,Based on a true story
jellyfin,jellyfin,C#,49328,4524,879,2652,True,True,True,True,The Free Software Media System - Server Backend & API
lx-music-desktop,lyswhut,TypeScript,49307,6655,1101,2404,False,False,True,True,一个基于 Electron 的音乐软件
open-source-ios-apps,dkhamsing,,49226,5738,0,4065,False,True,True,True,:iphone: Collaborative List of Open-Source iOS Apps
alist,AlistGo,Go,49169,7982,575,1907,True,True,True,True,"🗂️A file list/WebDAV program that supports multiple storages, powered by Gin and Solidjs. / 一个支持多存储的文件列表/WebDAV程序，使用 Gin 和 Solidjs。"
json,nlohmann,C++,49117,7339,99,4636,True,True,True,True,JSON for Modern C++
dbeaver,dbeaver,Java,49105,4072,3232,3797,True,True,True,True,Free universal database tool and SQL client
winutil,ChrisTitusTech,PowerShell,49093,2594,13,1417,True,True,True,True,"Chris Titus Tech's Windows Utility - Install Programs, Tweaks, Fixes, and Updates"
context7,upstash,TypeScript,49057,2313,163,353,False,False,True,True,Context7 Platform -- Up-to-date code documentation for LLMs and AI code editors
TrendRadar,sansan0,Python,48945,22639,42,320,False,False,True,True,"⭐AI-driven public opinion & trend monitor with multi-platform aggregation, RSS, and smart alerts.🎯 告别信息过载，你的 AI 舆情监控助手与热点筛选工具！聚合多平台热点 +  RSS 订阅，支持关键词精准筛选。AI 智能筛选新闻 + AI 翻译 +  AI 分析简报直推手机，也支持接入 MCP 架构，赋能 AI 自然语言对话分析、情感洞察与趋势预测等。支持 Docker ，数据本地/云端自持。集成微信/飞书/钉钉/Telegram/邮件/ntfy/bark/slack 等渠道智能推送。"
ai-hedge-fund,virattt,Python,48906,8531,84,470,False,False,True,True,An AI Hedge Fund Team
