repo_name,organization,language,stars,forks,open_issues,age_days,has_coc,has_contributing,has_workflows,has_readme,description
AFFiNE,toeverything,TypeScript,66955,4702,583,1343,True,True,True,True,"There can be more than Notion and Miro. AFFiNE(pronounced [ə‘fain]) is a next-gen knowledge base that brings planning, sorting and creating all together. Privacy first, open-source, customizable and ready to use. "
ChinaTextbook,TapXWorld,Roff,66681,14881,99,2282,False,False,False,True,所有小初高、大学PDF教材。
MetaGPT,FoundationAgents,Python,66638,8423,107,1009,False,False,True,True,"🌟 The Multi-Agent Framework: First AI Software Company, Towards Natural Language Programming"
ghidra,NationalSecurityAgency,Java,66568,7325,1869,2592,False,True,True,True,Ghidra is a software reverse engineering (SRE) framework
33-js-concepts,leonardomso,JavaScript,66301,9187,2,2769,True,True,True,True,📜 33 JavaScript concepts every developer should know.
annotated_deep_learning_paper_implementations,labmlai,Python,66220,6665,29,2049,False,False,True,True,"🧑‍🏫 60+ Implementations/tutorials of deep learning papers with side-by-side notes 📝; including transformers (original, xl, switch, feedback, vit, ...), optimizers (adam, adabelief, sophia, ...), gans(cyclegan, stylegan2, ...), 🎮 reinforcement learning (ppo, dqn), capsnet, distillation, ... 🧠"
echarts,apache,TypeScript,66068,19823,1733,4750,True,True,True,True,"Apache ECharts is a powerful, interactive charting and data visualization library for browser"
gpt4free,xtekky,Python,65974,13635,5,1102,True,True,True,True,The official gpt4free repository | various collection of powerful language models | opus 4.6 gpt 5.3 kimi 2.5 deepseek v3.2 gemini 3
webpack,webpack,JavaScript,65938,9381,207,5138,True,True,True,True,"A bundler for javascript and friends. Packs many modules into a few bundled assets. Code Splitting allows for loading parts of the application on demand. Through ""loaders"", modules can be CommonJs, AMD, ES6 modules, CSS, Images, JSON, Coffeescript, LESS, ... and your custom stuff."
autoresearch,karpathy,Python,65801,9412,171,29,False,False,True,True,AI agents running research on single-GPU nanochat training automatically
scikit-learn,scikit-learn,Python,65624,26870,2101,5709,True,True,True,True,scikit-learn: machine learning in Python
awesome-nodejs,sindresorhus,,65491,6210,27,4285,True,True,True,True,":zap: Delightful Node.js packages and resources [BECAUSE OF TOO MUCH SPAM AND LOW-QUALITY SUBMISSIONS, SUBMISSIONS ARE PAUSED UNTIL SEPTEMBER]"
OpenBB,OpenBB-finance,Python,65344,6467,72,1931,True,False,True,True,"Financial data platform for analysts, quants and AI agents."
Java,TheAlgorithms,Java,65316,21044,45,3549,True,True,True,True,All Algorithms implemented in Java
javascript-questions,lydiahallie,,65298,9237,50,2488,False,False,False,True,"A long list of (advanced) JavaScript questions, and their explanations :sparkles:  "
design-resources-for-developers,bradtraversy,,65170,11993,3,2159,False,True,False,True,"Curated list of design and UI resources from stock photos, web templates, CSS frameworks, UI libraries, tools and much more"
nocode,kelseyhightower,Dockerfile,65142,4829,4701,2979,False,True,False,True,The best way to write secure and reliable applications. Write nothing; deploy nowhere.
interviews,kdn251,Java,64897,12918,118,3336,False,False,False,True,Everything you need to know to get the job.
localstack,localstack,Python,64834,4672,0,3448,True,True,True,True,💻 A fully functional local AWS cloud stack. Develop and test your cloud & Serverless apps offline
Apollo-11,chrislgarry,Assembly,64756,7399,127,4384,False,True,True,True,Original Apollo 11 Guidance Computer (AGC) source code for the command and lunar modules.
docusaurus,facebook,TypeScript,64385,9794,366,3210,True,True,True,True,Easy to maintain open source documentation websites.
gstack,garrytan,TypeScript,64094,8695,322,24,False,True,True,True,"Use Garry Tan's exact Claude Code setup: 23 opinionated tools that serve as CEO, Designer, Eng Manager, Release Manager, Doc Engineer, and QA"
keras,keras-team,Python,63926,19744,278,4026,False,True,True,True,Deep Learning for humans
prometheus,prometheus,Go,63389,10303,761,4879,True,True,True,True,The Prometheus monitoring system and time series database.
crawl4ai,unclecode,Python,63380,6475,54,695,True,True,True,True,"🚀🤖 Crawl4AI: Open-source LLM Friendly Web Crawler & Scraper. Don't be shy, join here: https://discord.gg/jP8KfhDhyN"
pathway,pathwaycom,Python,63362,1629,30,1224,True,True,True,True,"Python ETL framework for stream processing, real-time analytics, LLM pipelines, and RAG."
alacritty,alacritty,Rust,63242,3394,337,3699,False,True,True,True,"A cross-platform, OpenGL terminal emulator."
socket.io,socketio,TypeScript,63006,10151,208,5868,False,True,True,True,Realtime application framework (Node.JS server)
open-interpreter,openinterpreter,Python,63006,5438,311,995,False,True,True,True,A natural language interface for computers
resume.github.com,resume,JavaScript,62830,1368,71,5536,False,False,False,True,Resumes generated using the GitHub informations
nocodb,nocodb,TypeScript,62607,4710,672,3079,True,True,True,True,🔥 🔥 🔥 A Free & Self-hostable Airtable Alternative
uBlock,gorhill,JavaScript,62521,3994,17,4021,False,True,True,True,uBlock Origin - An efficient blocker for Chromium and Firefox. Fast and lean.
traefik,traefik,Go,62471,5895,773,3856,True,True,True,True,The Cloud Native Application Proxy
rustlings,rust-lang,Rust,62377,11171,84,3855,False,True,True,True,:crab: Small exercises to get you used to reading and writing Rust code!
nerd-fonts,ryanoasis,CSS,62362,3877,64,4139,True,True,True,True,"Iconic font aggregator, collection, & patcher. 3,600+ icons, 50+ patched fonts: Hack, Source Code Pro, more. Glyph collections: Font Awesome, Material Design Icons, Octicons, & more"
ladybird,LadybirdBrowser,C++,62142,2918,653,674,True,True,True,True,Truly independent web browser
tldr,tldr-pages,Markdown,61905,5139,235,4500,False,True,True,True,Collaborative cheatsheets for console commands 📚.
ripgrep,BurntSushi,Rust,61905,2458,158,3677,False,False,True,True,ripgrep recursively searches directories for a regex pattern while respecting your gitignore
sway,FuelLabs,Rust,61817,5425,891,1901,False,False,True,True,🌴 Empowering everyone to build reliable and efficient smart contracts.
lodash,lodash,JavaScript,61516,7126,135,5111,False,True,True,True,"A modern JavaScript utility library delivering modularity, performance, & extras."
redux,reduxjs,TypeScript,61439,15110,41,3963,True,True,True,True,A JS library for predictable global state management
scrapy,scrapy,Python,61076,11421,649,5886,True,True,True,True,"Scrapy, a fast high-level web crawling & scraping framework for Python."
leetcode-master,youngyangyang04,Shell,60979,12318,243,2303,False,False,False,True,《代码随想录》LeetCode 刷题攻略：200道经典题目刷题顺序，共60w字的详细图解，视频难点剖析，50余张思维导图，支持C++，Java，Python，Go，JavaScript等多语言版本，从此算法学习不再迷茫！🔥🔥 来看看，你会发现相见恨晚！🚀 
atom,atom,JavaScript,60963,17255,994,5188,True,True,False,True,:atom: The hackable text editor
architect-awesome,xingshaocheng,,60824,17753,63,2920,False,False,False,True,后端架构师技术图谱
Front-end-Developer-Interview-Questions,h5bp,Nunjucks,60822,11059,52,5168,True,True,True,True,"A list of helpful front-end related questions you can use to interview potential candidates, test yourself or completely ignore."
minio,minio,Go,60611,7352,80,4098,True,True,True,True,"MinIO is a high-performance, S3 compatible object store, open sourced under GNU AGPLv3 license."
30-Days-Of-Python,Asabeneh,Python,60547,11544,106,2328,False,False,True,True,The 30 Days of Python programming challenge is a step-by-step guide to learn the Python programming language in 30 days. This challenge may take more than 100 days. Follow your own pace. These videos may help too: https://www.youtube.com/channel/UC7PNRuno1rzYPb1xLa4yktw
openpilot,commaai,Python,60517,10786,236,3419,False,True,True,True,"openpilot is an operating system for robotics. Currently, it upgrades the driver assistance system on 300+ supported cars."
drawio-desktop,jgraph,JavaScript,60218,5641,67,3236,True,False,True,True,Official electron build of draw.io
markdown-here,adam-p,JavaScript,60172,11092,319,5075,False,True,False,True,"Google Chrome, Firefox, and Thunderbird extension that lets you write email in Markdown and render it before sending."
git,git,C,60104,27788,366,6464,True,True,True,True,Git Source Code Mirror - This is a publish-only repository but pull requests can be turned into patches to the mailing list via GitGitGadget (https://gitgitgadget.github.io/). Please follow Documentation/SubmittingPatches procedure for any of your improvements.
nuxt,nuxt,TypeScript,59951,5579,929,3447,True,True,True,True,The Full-Stack Vue Framework.
llm-app,pathwaycom,Jupyter Notebook,59920,1416,9,990,True,True,True,True,"Ready-to-run cloud templates for RAG, AI pipelines, and enterprise search with live data. 🐳Docker-friendly.⚡Always in sync with Sharepoint, Google Drive, S3, Kafka, PostgreSQL, real-time data APIs, and more."
cline,cline,TypeScript,59888,6084,701,637,True,True,True,True,"Autonomous coding agent right in your IDE, capable of creating/editing files, executing commands, using the browser, and more with your permission every step of the way."
jquery,jquery,JavaScript,59852,20461,94,6210,True,True,True,True,jQuery JavaScript Library
spring-framework,spring-projects,Java,59809,38882,359,5597,True,True,True,True,Spring Framework
Magisk,topjohnwu,Kotlin,59674,17147,48,3495,False,False,True,True,The Magic Mask for Android
Real-Time-Voice-Cloning,CorentinJ,Python,59594,9412,170,2505,False,False,True,True,Clone a voice in 5 seconds to generate arbitrary speech in real-time
awesome-flutter,Solido,Dart,59522,6865,27,3254,False,True,True,True,"An awesome list that curates the best Flutter libraries, tools, tutorials, articles and more."
unsloth,unslothai,Python,59470,5042,1077,857,True,True,True,True,"Unsloth Studio is a web UI for training and running open models like Qwen3.5, Gemma 4, DeepSeek, gpt-oss locally."
llama,meta-llama,Python,59295,9826,517,1145,True,True,True,True,Inference code for Llama models
shadowsocks-windows,shadowsocks,C#,59284,16271,199,4828,False,True,False,True,A C# port of shadowsocks
awesome-chatgpt-prompts-zh,PlexPt,,58884,13552,44,1210,False,False,False,True,ChatGPT 中文调教指南。各种场景使用指南。学习怎么让它听你的话。
angular.js,angular,JavaScript,58861,27191,461,5933,True,True,False,True,AngularJS - HTML enhanced for web apps!
FFmpeg,FFmpeg,C,58600,13668,3,5469,False,True,False,True,Mirror of https://git.ffmpeg.org/ffmpeg.git
memos,usememos,Go,58549,4247,28,1578,False,False,True,True,"Open-source, self-hosted note-taking tool built for quick capture. Markdown-native, lightweight, and fully yours."
ui-ux-pro-max-skill,nextlevelbuilder,Python,58461,5773,73,125,False,False,True,True,An AI SKILL that provide design intelligence for building professional UI/UX multiple platforms
mkcert,FiloSottile,Go,58420,3057,166,2840,True,True,True,True,A simple zero-config tool to make locally trusted development certificates with any names you'd like.
rails,rails,Ruby,58313,22174,1555,6568,True,True,True,True,Ruby on Rails
astro,withastro,TypeScript,58145,3306,286,1846,True,True,True,True,The web framework for content-driven websites. ⭐️ Star to support our work!
MinerU,opendatalab,Python,58110,4798,157,765,False,False,True,True,Transforms complex documents like PDFs into LLM-ready markdown/JSON for your Agentic workflows.
bat,sharkdp,Rust,57964,1500,349,2905,False,True,True,True,A cat(1) clone with wings.
vaultwarden,dani-garcia,Rust,57931,2673,50,2968,False,False,True,True,"Unofficial Bitwarden compatible server written in Rust, formerly known as bitwarden_rs"
deer-flow,bytedance,Python,57890,7194,494,333,False,True,True,True,"An open-source long-horizon SuperAgent harness that researches, codes, and creates. With the help of sandboxes, memories, tools, skill, subagents and message gateway, it handles different levels of tasks that could take minutes to hours."
hackingtool,Z4nzu,Python,57739,6410,52,2184,False,False,True,True,ALL IN ONE Hacking Tool For Hackers
anything-llm,Mintplex-Labs,JavaScript,57655,6231,302,1036,False,True,True,True,The all-in-one AI productivity accelerator. On device and privacy first with no annoying setup or configuration.
zustand,pmndrs,TypeScript,57640,2018,4,2552,False,True,True,True,🐻 Bear necessities for state management in React
html5-boilerplate,h5bp,JavaScript,57423,12300,25,5914,True,True,True,True,"A professional front-end template for building fast, robust, and adaptable web apps or sites."
pocketbase,pocketbase,Go,57359,3249,24,1369,False,True,True,True,Open Source realtime backend in 1 file
DeepLearning-500-questions,scutan90,JavaScript,57286,15955,121,2838,False,False,False,True,深度学习500问，以问答形式对常用的概率知识、线性代数、机器学习、深度学习、计算机视觉等热点问题进行阐述，以帮助自己及有需要的读者。 全书分为18个章节，50余万字。由于水平有限，书中不妥之处恳请广大读者批评指正。   未完待续............ 如有意合作，联系scutjy2015@163.com                     版权所有，违权必究       Tan 2018.06
fuel-core,FuelLabs,Rust,57208,2866,198,2046,False,True,True,True,Rust full node implementation of the Fuel v2 protocol.
private-gpt,zylon-ai,Python,57202,7610,293,1068,False,False,True,True,"Interact with your documents using the power of GPT, 100% privately, no data leaks"
yolov5,ultralytics,Python,57157,17448,39,2148,True,True,True,True,YOLOv5 🚀 in PyTorch > ONNX > CoreML > TFLite
docling,docling-project,Python,57042,3872,862,634,True,True,True,True,Get your documents ready for gen AI
meilisearch,meilisearch,Rust,56956,2480,285,2903,True,True,True,True,A lightning-fast search engine API bringing AI-powered hybrid search to your sites and applications.
you-get,soimort,Python,56818,9766,381,4975,False,True,True,True,:arrow_double_down: Dumb downloader that scrapes the web
autogen,microsoft,Python,56700,8525,729,960,True,True,True,True,A programming framework for agentic AI
awesome-rust,rust-unofficial,Rust,56557,3274,11,4279,False,True,True,True,A curated list of Rust code and resources.
rclone,rclone,Go,56461,5007,1163,4402,True,True,True,True,"""rsync for cloud storage"" - Google Drive, S3, Dropbox, Backblaze B2, One Drive, Swift, Hubic, Wasabi, Google Cloud Storage, Azure Blob, Azure Files, Yandex Files"
pi-hole,pi-hole,Shell,56404,3003,51,4318,True,True,True,True,A black hole for Internet advertisements
GPT-SoVITS,RVC-Boss,Python,56361,6159,870,811,False,False,True,True,1 min voice data can also be used to train a good TTS model! (few shot voice cloning)
react-router,remix-run,TypeScript,56336,10843,162,4341,True,True,True,True,Declarative routing for React
face_recognition,ageitgey,Python,56263,13705,832,3319,False,True,True,True,The world's simplest facial recognition api for Python and the command line
nanoGPT,karpathy,Python,56085,9556,342,1194,False,False,False,True,"The simplest, fastest repository for training/finetuning medium-sized GPTs."
github-cheat-sheet,tiimgreen,,56055,5406,43,4375,False,True,False,True,A list of cool features of Git and GitHub.
rich,Textualize,Python,55973,2092,315,2337,True,True,True,True,Rich is a Python library for rich text and beautiful formatting in the terminal.
gatsby,gatsbyjs,JavaScript,55950,10212,362,3971,True,True,True,True,"React-based framework with performance, scalability, and security built in."
ai-agents-for-beginners,microsoft,Jupyter Notebook,55927,19329,21,492,True,False,True,True,12 Lessons to Get Started Building AI Agents
starship,starship,Rust,55846,2449,995,2560,True,True,True,True,"☄🌌️  The minimal, blazing-fast, and infinitely customizable prompt for any shell!"
awesome-android-ui,wasabeef,,55822,10269,39,4120,True,False,False,True,A curated list of awesome Android UI/UX libraries
leetcode,azl397985856,JavaScript,55797,9436,10,2927,False,True,False,True,LeetCode Solutions: A Record of My Problem Solving Journey.( leetcode题解，记录自己的leetcode解题之路。)
project-layout,golang-standards,Makefile,55695,5438,98,3129,False,False,True,True,Standard Go Project Layout
OpenManus,FoundationAgents,Python,55623,9701,540,394,True,False,True,True,"No fortress, purely open ground.  OpenManus is Coming."
appwrite,appwrite,TypeScript,55528,5182,792,2553,True,True,True,True,"Appwrite® - complete cloud infrastructure for your web, mobile and AI apps. Including Auth, Databases, Storage, Functions, Messaging, Hosting, Realtime and more"
ultralytics,ultralytics,Python,55411,10666,288,1301,True,True,True,True,Ultralytics YOLO 🚀
gpt-engineer,AntonOsika,Python,55218,7314,68,1071,True,True,True,True,CLI platform to experiment with codegen. Precursor to: https://lovable.dev
faceswap,deepfakes,Python,55111,13400,6,3028,True,False,True,True,Deepfakes Software For All
MoneyPrinterTurbo,harry0703,Python,54970,7789,0,755,False,False,True,True,利用AI大模型，一键生成高清短视频 Generate short videos with one click using AI LLM.
marktext,marktext,JavaScript,54905,4080,1419,3065,True,True,True,True,"📝A simple and elegant markdown editor, available for Linux, macOS and Windows."
gitea,go-gitea,Go,54736,6536,2829,3442,True,True,True,True,"Git with a cup of tea! Painless self-hosted all-in-one software development service, including Git hosting, code review, team collaboration, package registry and CI/CD"
ChatGPT,lencx,Rust,54357,6184,926,1214,False,False,True,True,"🔮 ChatGPT Desktop Application (Mac, Windows and Linux)"
joplin,laurent22,TypeScript,54214,6050,585,3365,False,True,True,True,"Joplin - the privacy-focused note taking app with sync capabilities for Windows, macOS, Linux, Android and iOS."
element,ElemeFE,Vue,54163,14513,2968,3500,False,False,True,True,A Vue.js 2.0 UI Toolkit for Web
maybe,maybe-finance,Ruby,54056,5501,0,824,False,True,True,True,The personal finance app for everyone
requests,psf,Python,53862,9824,231,5529,True,True,True,True,"A simple, yet elegant, HTTP library."
segment-anything,facebookresearch,Jupyter Notebook,53857,6310,592,1108,True,True,True,True,"The repository provides code for running inference with the SegmentAnything Model (SAM), links for downloading the trained model checkpoints, and example notebooks that show how to use the model."
normalize.css,necolas,CSS,53728,10445,74,5449,False,True,False,True,A modern alternative to CSS resets
dive,wagoodman,Go,53706,1975,201,2883,False,False,True,True,A tool for exploring each layer in a docker image
Free-Certifications,cloudcommunity,,53651,3543,73,2073,False,False,False,True,A curated list of free courses with certifications. Also available at https://free-certifications.com/
powerlevel10k,romkatv,Shell,53594,2399,145,2596,False,False,False,True,A Zsh theme
n8n-workflows,Zie619,Python,53524,6963,22,325,False,False,True,True,all of the workflows of n8n i could find (also from the site itself)
trackerslist,ngosang,,53401,6623,6,3632,False,False,True,True,Updated list of public BitTorrent trackers
core,vuejs,TypeScript,53375,9080,970,2853,False,True,True,True,"🖖 Vue.js is a progressive, incrementally-adoptable JavaScript framework for building UI on the web."
first-contributions,firstcontributions,,53303,100695,307,3483,True,True,True,True,🚀✨ Help beginners to contribute to open source projects
v2rayNG,2dust,Kotlin,53276,7122,5,2517,False,False,True,True,"A V2Ray client for Android, support Xray core and v2fly core"
pdf.js,mozilla,JavaScript,53073,10606,459,5457,True,True,True,True,PDF Reader in JavaScript
ImHex,WerWolv,C++,53059,2353,336,1971,True,True,True,True,"🔍 A Hex Editor for Reverse Engineers, Programmers and people who value their retinas when working at 3 AM."
material-design-icons,google,,53054,9723,402,4196,True,True,True,True,Material Design icons by Google (Material Symbols)
termux-app,termux,Java,52907,6321,514,3816,False,False,True,True,Termux - a terminal emulator application for Android OS extendible by variety of packages.
coolify,coollabsio,PHP,52594,3981,725,1895,True,True,True,True,"An open-source, self-hostable PaaS alternative to Vercel, Heroku & Netlify that lets you easily deploy static sites, databases, full-stack applications and 280+ one-click services on your own servers."
kotlin,JetBrains,Kotlin,52532,6279,223,5164,True,True,True,True,The Kotlin Programming Language. 
typst,typst,Rust,52446,1528,1171,2384,False,True,True,True,A markup-based typesetting system that is powerful and easy to learn.
ionic-framework,ionic-team,TypeScript,52439,13389,631,4610,True,True,True,True,"A powerful cross-platform UI toolkit for building native-quality iOS, Android, and Progressive Web Apps with HTML, CSS, and JavaScript."
Docker-OSX,sickcodes,Shell,52378,2903,415,2130,False,False,True,True,Run macOS VM in a Docker! Run near native OSX-KVM in Docker! X11 Forwarding! CI/CD for OS X Security Research! Docker mac Containers.
Ghost,TryGhost,JavaScript,52372,11428,257,4718,True,True,True,True,"Independent technology for modern publishing, memberships, subscriptions and newsletters."
PowerShell,PowerShell,C#,52268,8241,1446,3734,True,True,True,True,PowerShell for every system!
mem0,mem0ai,Python,51982,5820,218,1019,False,True,True,True,Universal memory layer for AI Agents
prettier,prettier,JavaScript,51727,4694,1470,3413,True,True,True,True,Prettier is an opinionated code formatter.
awesome-ios,vsouza,Swift,51698,6961,21,4286,True,True,True,True,"A curated list of awesome iOS ecosystem, including Objective-C and Swift Projects "
etcd,etcd-io,Go,51677,10339,216,4655,True,True,True,True,Distributed reliable key-value store for the most critical data of a distributed system
context7,upstash,TypeScript,51640,2450,130,374,False,False,True,True,Context7 Platform -- Up-to-date code documentation for LLMs and AI code editors
Flowise,FlowiseAI,TypeScript,51546,24057,821,1100,True,True,True,True,"Build AI Agents, Visually"
grok-1,xai-org,Python,51526,8461,126,748,True,False,True,True,Grok open release
guava,google,Java,51511,11154,728,4328,True,True,True,True,Google core libraries for Java
jekyll,jekyll,Ruby,51474,10296,245,6375,True,True,True,True,:globe_with_meridians: Jekyll is a blog-aware static site generator in Ruby
Motrix,agalwood,JavaScript,51239,4852,776,2664,True,True,True,True,A full-featured download manager.
chinese-poetry,chinese-poetry,JavaScript,51204,10332,130,3502,False,False,True,True,"The most comprehensive database of Chinese poetry 🧶最全中华古诗词数据库,  唐宋两朝近一万四千古诗人,  接近5.5万首唐诗加26万宋诗.  两宋时期1564位词人，21050首词。"
awesome-claude-skills,ComposioHQ,Python,51160,5387,452,169,False,True,True,True,"A curated list of awesome Claude Skills, resources, and tools for customizing Claude AI workflows"
DefinitelyTyped,DefinitelyTyped,TypeScript,51140,30553,699,4929,False,False,True,True,The repository for high quality TypeScript type definitions.
Semantic-UI,Semantic-Org,JavaScript,51119,4890,1074,4744,False,True,False,True,Semantic is a UI component framework based around useful principles from natural language.
nanochat,karpathy,Python,51028,6726,86,173,False,False,True,True,The best ChatGPT that $100 can buy.
go-ethereum,ethereum,Go,50966,21880,399,4482,False,True,True,True,Go implementation of the Ethereum protocol
winutil,ChrisTitusTech,PowerShell,50912,2750,11,1438,True,True,True,True,"Chris Titus Tech's Windows Utility - Install Programs, Tweaks, Fixes, and Updates"
TrendRadar,sansan0,Python,50870,22946,36,341,False,False,True,True,"⭐AI-driven public opinion & trend monitor with multi-platform aggregation, RSS, and smart alerts.🎯 告别信息过载，你的 AI 舆情监控助手与热点筛选工具！聚合多平台热点 +  RSS 订阅，支持关键词精准筛选。AI 智能筛选新闻 + AI 翻译 +  AI 分析简报直推手机，也支持接入 MCP 架构，赋能 AI 自然语言对话分析、情感洞察与趋势预测等。支持 Docker ，数据本地/云端自持。集成微信/飞书/钉钉/Telegram/邮件/ntfy/bark/slack 等渠道智能推送。"
windows,dockur,Shell,50812,4178,118,811,False,False,True,True,Windows inside a Docker container.
professional-programming,charlax,Python,50717,3972,4,3802,False,True,False,True,A collection of learning resources for curious software engineers
awesome-wechat-weapp,justjavac,,50697,9002,2,3481,False,False,False,True,微信小程序开发资源汇总 :100:
hiring-without-whiteboards,poteto,JavaScript,50528,3884,38,3308,True,True,True,True,⭐️  Companies that don't have a broken hiring process
lazydocker,jesseduffield,Go,50522,1592,266,2513,True,True,True,True,The lazier way to manage everything docker
100-Days-Of-ML-Code,Avik-Jain,,50321,11424,66,2830,True,True,False,True,100 Days of ML Coding
bulma,jgthms,CSS,50067,3903,521,3724,False,True,True,True,Modern CSS framework based on Flexbox
ai-hedge-fund,virattt,Python,50001,8679,93,491,False,False,True,True,An AI Hedge Fund Team
jellyfin,jellyfin,C#,50000,4612,879,2673,True,True,True,True,The Free Software Media System - Server Backend & API
odoo,odoo,Python,49919,31988,9429,4344,False,True,False,True,Odoo. Open Source Apps To Grow Your Business.
mastodon,mastodon,Ruby,49800,7428,4455,3694,True,True,True,True,"Your self-hosted, globally interconnected microblogging community"
