repo_name,organization,language,stars,forks,open_issues,age_days,has_coc,has_contributing,has_workflows,has_readme,description
huginn,huginn,Ruby,48897,4237,694,4757,False,False,True,True,Create agents that monitor and act on your behalf.  Your agents are standing by!
query,TanStack,TypeScript,48865,3739,148,2382,False,True,True,True,"🤖 Powerful asynchronous state management, server-state utilities and data fetching for the web. TS/JS, React Query, Solid Query, Svelte Query and Vue Query."
dayjs,iamkun,JavaScript,48604,2423,1199,2900,False,True,True,True,⏰ Day.js 2kB immutable date-time library alternative to Moment.js with the same modern API
julia,JuliaLang,Julia,48570,5750,4738,5446,True,True,True,True,The Julia Programming Language
RxJava,ReactiveX,Java,48480,7602,15,4818,False,True,True,True,RxJava – Reactive Extensions for the JVM – a library for composing asynchronous and event-based programs using observable sequences for the Java VM.
algorithm-visualizer,algorithm-visualizer,JavaScript,48387,7577,78,3596,True,True,False,True,:fireworks:Interactive Online Platform that Visualizes Algorithms from Code
pandas,pandas-dev,Python,48183,19760,3660,5687,True,True,True,True,"Flexible and powerful data analysis / manipulation library for Python, providing labeled data structures similar to R data.frame objects, statistical functions, and much more"
expo,expo,TypeScript,48086,11438,857,3503,False,True,True,True,"An open-source framework for making universal native apps with React. Expo runs on Android, iOS, and the web."
moment,moment,JavaScript,48038,7021,295,5498,False,True,True,True,"Parse, validate, manipulate, and display dates in javascript."
terraform,hashicorp,Go,47983,10253,1892,4389,True,True,True,True,"Terraform enables you to safely and predictably create, change, and improve infrastructure. It is a source-available tool that codifies APIs into declarative configuration files that can be shared amongst team members, treated as code, edited, reviewed, and versioned."
x64dbg,x64dbg,C++,47923,2686,584,3995,True,True,True,True,An open-source user mode debugger for Windows. Optimized for reverse engineering and malware analysis.
open-source-mac-os-apps,serhii-londar,,47894,2496,38,3059,False,True,True,True,🚀 Awesome list of open source applications for macOS. https://t.me/s/opensourcemacosapps
Fooocus,lllyasviel,Python,47884,7819,286,953,False,False,True,True,Focus on prompting and generating
type-challenges,type-challenges,TypeScript,47854,5230,33121,2065,True,False,True,True,Collection of TypeScript type challenges with online judge
freqtrade,freqtrade,Python,47835,9987,43,3228,False,True,True,True,"Free, open source crypto trading bot"
llama_index,run-llama,Python,47808,7051,265,1234,True,True,True,True,LlamaIndex is the leading document agent and OCR platform
kubernetes-the-hard-way,kelseyhightower,,47773,15573,47,3542,False,True,False,True,Bootstrap Kubernetes the hard way. No scripts.
ghostty,ghostty-org,Zig,47722,2052,199,1451,False,True,True,True,"👻 Ghostty is a fast, feature-rich, and cross-platform terminal emulator that uses platform-native UI and GPU acceleration."
whisper.cpp,ggml-org,C++,47718,5316,1154,1271,False,False,True,True,Port of OpenAI's Whisper model in C/C++
jadx,skylot,Java,47689,5461,414,4749,True,True,True,True,Dex to Java decompiler
htmx,bigskysoftware,JavaScript,47664,1581,658,2166,False,True,True,True,</> htmx - high power tools for HTML
design-patterns-for-humans,kamranahmedse,,47637,5504,17,3318,False,False,False,True,An ultra-simplified explanation to design patterns
big-list-of-naughty-strings,minimaxir,Python,47610,2164,108,3876,False,False,False,True,The Big List of Naughty Strings is a list of strings which have a high probability of causing issues when used as user-input data.
gogs,gogs,Go,47584,5071,964,4419,False,True,True,True,Gogs is a painless self-hosted Git service
Projects,karan,,47510,10675,118,4641,False,True,False,True,:page_with_curl: A list of practical projects that anyone can solve in any programming language.
awesome-java,akullpp,,47350,7649,19,4271,False,True,True,True,"A curated list of awesome frameworks, libraries and software for the Java programming language."
OpenCut,OpenCut-app,TypeScript,47126,4883,279,270,True,True,True,True,The open-source CapCut alternative
chinese-independent-developer,1c7,,47122,3991,2,3101,False,False,True,True,👩🏿‍💻👨🏾‍💻👩🏼‍💻👨🏽‍💻👩🏻‍💻中国独立开发者项目列表 -- 分享大家都在做什么
brew,Homebrew,Ruby,47107,11018,25,3665,True,True,True,True,🍺 The missing package manager for macOS (or Linux)
awesome-react-components,brillout,,47083,3745,34,3555,True,True,True,True,Curated List of React Components & Libraries.
PythonDataScienceHandbook,jakevdp,Jupyter Notebook,47081,18785,230,3508,True,True,False,True,Python Data Science Handbook: full text in Jupyter Notebooks
react,typescript-cheatsheets,JavaScript,47014,4301,1,2848,True,True,True,True,Cheatsheets for experienced React developers getting started with TypeScript
quill,slab,TypeScript,46983,3630,632,4980,True,True,True,True,Quill is a modern WYSIWYG editor built for compatibility and extensibility
v2ray-core,v2ray,Go,46967,8877,8,3849,True,False,True,True,A platform for building proxies to bypass network restrictions.
serverless,serverless,JavaScript,46946,5739,1224,3986,True,True,True,True,"⚡ Serverless Framework – Effortlessly build apps that auto-scale, incur zero costs when idle, and require minimal maintenance using AWS Lambda and other managed cloud services."
okhttp,square,Kotlin,46924,9282,93,4987,False,True,True,True,"Square’s meticulous HTTP client for the JVM, Android, and GraalVM."
Made-With-ML,GokuMohandas,Jupyter Notebook,46875,7356,24,2692,False,False,True,True,"Learn how to develop, deploy and iterate on production-grade ML applications."
pixijs,pixijs,TypeScript,46784,4987,316,4805,True,True,True,True,"The HTML5 Creation Engine: Create beautiful digital content with the fastest, most flexible 2D WebGL renderer."
plane,makeplane,TypeScript,46773,3765,696,1216,True,True,True,True,"🔥🔥🔥 Open-source Jira, Linear, Monday, and ClickUp alternative. Plane is a modern project management platform to manage tasks, sprints, docs, and triage."
Pake,tw93,Rust,46742,9152,1,1252,True,True,True,True,🤱🏻 Turn any webpage into a desktop app with one command.
crewAI,crewAIInc,Python,46614,6294,408,875,False,False,True,True,"Framework for orchestrating role-playing, autonomous AI agents. By fostering collaborative intelligence, CrewAI empowers agents to work together seamlessly, tackling complex tasks."
discourse,discourse,Ruby,46596,8853,145,4815,True,True,True,True,"A platform for community discussion. Free, open, simple."
awesome-design-patterns,DovAmir,,46493,3218,22,2845,False,True,False,True,A curated list of software and architecture related design patterns.
metabase,metabase,Clojure,46472,6318,4037,4063,False,True,True,True,The easy-to-use open source Business Intelligence and Embedded Analytics tool that lets everyone work with data :bar_chart:
ruff,astral-sh,Rust,46462,1922,1950,1318,True,True,True,True,"An extremely fast Python linter and code formatter, written in Rust."
ClickHouse,ClickHouse,C++,46414,8205,5509,3577,True,True,True,True,ClickHouse® is a real-time analytics database management system
text-generation-webui,oobabooga,Python,46308,5903,780,1185,False,False,True,True,"The original local LLM interface. Text, vision, tool-calling, training, and more. 100% offline."
ui-ux-pro-max-skill,nextlevelbuilder,Python,46301,4484,80,109,False,False,True,True,An AI SKILL that provide design intelligence for building professional UI/UX multiple platforms
frontend-dev-bookmarks,dypsilon,,46230,5153,124,4653,False,True,False,True,Manually curated collection of resources for frontend web developers.
MediaCrawler,NanmiCoder,Python,46221,9972,136,1014,False,False,True,True,小红书笔记 | 评论爬虫、抖音视频 | 评论爬虫、快手视频 | 评论爬虫、B 站视频 ｜ 评论爬虫、微博帖子 ｜ 评论爬虫、百度贴吧帖子 ｜ 百度贴吧评论回复爬虫  | 知乎问答文章｜评论爬虫
awesome-claude-skills,ComposioHQ,Python,46194,4698,338,153,False,True,True,True,"A curated list of awesome Claude Skills, resources, and tools for customizing Claude AI workflows"
30-Days-Of-JavaScript,Asabeneh,JavaScript,46187,10443,367,2278,False,False,False,True,"30 days of JavaScript programming challenge is a step-by-step guide to learn JavaScript programming language in 30 days. This challenge may take more than 100 days,  please just follow your own pace. These videos may help too: https://www.youtube.com/channel/UC7PNRuno1rzYPb1xLa4yktw"
learn-regex,ziishaned,,46154,6212,65,3162,False,False,False,True,Learn regex the easy way
AI-For-Beginners,microsoft,Jupyter Notebook,46147,9441,3,1842,True,False,True,True,"12 Weeks, 24 Lessons, AI for All!"
acme.sh,acmesh-official,Shell,46035,5543,1377,3736,False,False,True,True,A pure Unix shell script ACME client for SSL / TLS certificate automation
tldraw,tldraw,TypeScript,45942,3082,330,1775,True,True,True,True,very good whiteboard infinite canvas SDK
monaco-editor,microsoft,JavaScript,45782,4017,828,3572,True,True,True,True,A browser based code editor
GitHubDaily,GitHubDaily,,45692,4586,547,2636,False,False,False,True,"坚持分享 GitHub 上高质量、有趣实用的开源技术教程、开发者工具、编程网站、技术资讯。A list cool, interesting projects of GitHub."
architecture-samples,android,Kotlin,45616,11871,217,3695,False,True,True,True,A collection of samples to discuss and showcase different architectural tools and patterns for Android apps.
prisma,prisma,TypeScript,45562,2111,2522,2464,True,True,True,True,"Next-generation ORM for Node.js & TypeScript | PostgreSQL, MySQL, MariaDB, SQL Server, SQLite, MongoDB and CockroachDB"
nvm-windows,coreybutler,Go,45546,3775,95,4198,False,True,True,True,A node.js version management utility for Windows. Ironically written in Go.
awesome-cheatsheets,LeCoupa,JavaScript,45501,6672,133,3053,False,False,False,True,"👩‍💻👨‍💻 Awesome cheatsheets for popular programming languages, frameworks and development tools. They include everything you should know in one single file."
JeecgBoot,jeecgboot,Java,45462,15843,59,2670,False,False,True,True,"JeecgBoot 是一款 AI 驱动的低代码开发平台，提供""零代码""与""代码生成""双模式——零代码模式一句话搭建系统，代码生成模式自动输出前后端代码与建表 SQL，生成即可运行。平台内置 AI 聊天助手、AI大模型、知识库、AI流程编排、MCP 与插件体系，兼容主流大模型，支持一句话生成流程图、设计表单、聊天式业务操作，解决 Java 项目 80% 重复工作，高效且不失灵活。"
jest,jestjs,TypeScript,45325,6638,245,4483,True,True,True,True,Delightful JavaScript Testing.
AdminLTE,ColorlibHQ,CSS,45315,18272,2,4468,True,True,True,True,AdminLTE - Free admin dashboard template based on Bootstrap 5
zx,google,JavaScript,45305,1233,31,1779,True,True,True,True,A tool for writing better scripts
bevy,bevyengine,Rust,45165,4459,3297,2252,True,True,True,True,A refreshingly simple data-driven game engine built in Rust
spotube,KRTirtho,Dart,45087,2017,760,1860,True,False,True,True,🎧 Open source music streaming app! Available for both desktop & mobile!
slidev,slidevjs,TypeScript,44968,1968,182,1791,True,True,True,True,Presentation Slides for Developers
Rocket.Chat,RocketChat,TypeScript,44961,13420,3565,3957,True,True,True,True,The Secure CommsOS™ for mission-critical operations
legado,gedoor,Kotlin,44947,4965,67,2494,False,False,True,True,"Legado 3.0 Book Reader with powerful controls & full functions❤️阅读3.0, 阅读是一款可以自定义来源阅读网络内容的工具，为广大网络文学爱好者提供一种方便、快捷舒适的试读体验。"
penpot,penpot,Clojure,44926,2610,570,3733,True,True,True,True,Penpot: The open-source design tool for design and code collaboration
TTS,coqui-ai,Python,44865,6004,7,2129,True,True,True,True,"🐸💬 - a deep learning toolkit for Text-to-Speech, battle-tested in research and production"
CppCoreGuidelines,isocpp,CSS,44851,5546,250,3865,False,True,True,True,"The C++ Core Guidelines are a set of tried-and-true guidelines, rules, and best practices about coding in C++"
meteor,meteor,JavaScript,44776,5263,374,5174,True,True,True,True,"Meteor, the JavaScript App Platform"
hyper,vercel,TypeScript,44709,3548,1026,3548,False,False,True,True,A terminal built on web technologies
airflow,apache,Python,44704,16739,1803,3993,True,True,True,True,"Apache Airflow - A platform to programmatically author, schedule, and monitor workflows"
Leaflet,Leaflet,JavaScript,44680,6097,560,5657,True,True,True,True,🍃 JavaScript library for mobile-friendly interactive maps 🇺🇦
react-hook-form,react-hook-form,TypeScript,44611,2378,127,2571,True,True,True,True,📋 React Hooks for form state management and validation (Web + React Native)
grpc,grpc,C++,44515,11090,1201,4119,True,True,True,True,"C++ based gRPC (C++, Python, Ruby, Objective-C, PHP, C#)"
edex-ui,GitSquared,JavaScript,44460,3052,6,3337,False,False,True,True,"A cross-platform, customizable science fiction terminal emulator with advanced monitoring & touchscreen support."
pyenv,pyenv,Shell,44451,3244,55,4948,False,True,True,True,Simple Python version management
awesome-compose,docker,HTML,44446,8085,351,2226,False,True,True,True,Awesome Docker Compose samples
reactjs-interview-questions,sudheerj,JavaScript,44389,10302,10,2849,False,False,True,True,List of top 500 ReactJS Interview Questions & Answers....Coding exercise questions are coming soon!!
build-web-application-with-golang,astaxie,Go,44152,10535,138,4977,False,False,False,True,A golang ebook intro how to build a web with golang
awesome-remote-job,lukasz-madon,,44142,4504,43,4095,False,True,True,True,A curated list of awesome remote jobs and resources. Inspired by https://github.com/vinta/awesome-python
iina,iina,Swift,44126,2777,1965,3377,False,True,True,True,The modern video player for macOS.
EasySpider,NaiboWang,JavaScript,44106,5385,264,2071,False,False,True,True,A visual no-code/code-free web crawler/spider易采集：一个可视化浏览器自动化测试/数据采集/爬虫软件，可以无代码图形化的设计和执行爬虫任务。别名：ServiceWrapper面向Web应用的智能化服务封装系统。
LocalAI,mudler,Go,44057,3758,144,1097,False,True,True,True,":robot: The free, Open Source alternative to OpenAI, Claude and others. Self-hosted and local-first. Drop-in replacement,  running on consumer-grade hardware. No GPU required. Runs gguf, transformers, diffusers and many more. Features: Generate Text, MCP, Audio, Video, Images, Voice Cloning, Distributed, P2P and decentralized inference"
upscayl,upscayl,TypeScript,44055,2129,65,1328,False,False,True,True,"🆙 Upscayl - #1 Free and Open Source AI Image Upscaler for Linux, MacOS and Windows."
parcel,parcel-bundler,JavaScript,44049,2279,592,3146,True,True,True,True,The zero configuration build tool for the web. 📦🚀
autoresearch,karpathy,Python,43973,6091,140,13,False,False,True,True,AI agents running research on single-GPU nanochat training automatically
react-use,streamich,TypeScript,43952,3279,653,2700,False,True,True,True,React Hooks — 👍
streamlit,streamlit,Python,43950,4149,1308,2400,True,True,True,True,Streamlit — A faster way to build and share data apps.
front-end-interview-handbook,yangshun,MDX,43919,5957,14,2987,True,True,True,True,Front End interview preparation materials for busy engineers (updated for 2026)
retrofit,square,HTML,43908,7361,169,5673,False,True,True,True,A type-safe HTTP client for Android and the JVM
babel,babel,TypeScript,43906,5817,756,4190,True,True,True,True,🐠 Babel is a compiler for writing next generation JavaScript.
Summer2026-Internships,SimplifyJobs,Python,43835,3170,5,2126,False,True,True,True,Collection of Summer 2026 tech internships!
TensorFlow-Examples,aymericdamien,Jupyter Notebook,43788,14788,227,3781,False,False,False,True,TensorFlow Tutorial and Examples for Beginners (support TF v1 & v2)
jsoncrack.com,AykutSarac,TypeScript,43733,3528,41,1509,True,True,True,True,"✨ Innovative and open-source visualization application that transforms various data formats, such as JSON, YAML, XML and CSV into interactive graphs."
copyparty,9001,Python,43616,1778,246,2489,True,True,False,True,"Portable file server with accelerated resumable uploads, dedup, WebDAV, SFTP, FTP, TFTP, zeroconf, media indexer, thumbnails++ all in one file"
helix,helix-editor,Rust,43537,3371,1452,2118,False,True,True,True,A post-modern modal text editor.
TrafficMonitor,zhongyang219,C++,43527,3618,1266,3155,False,False,True,True,这是一个用于显示当前网速、CPU及内存利用率的桌面悬浮窗软件，并支持任务栏显示，支持更换皮肤。
cobra,spf13,Go,43514,3088,359,4580,False,True,True,True,A Commander for modern Go CLI interactions
milvus,milvus-io,Go,43407,3904,1092,2376,True,True,True,True,"Milvus is a high-performance, cloud-native vector database built for scalable vector ANN search"
sentry,getsentry,Python,43402,4641,2183,5680,True,True,True,True,Developer-first error tracking and performance monitoring
fuels-rs,FuelLabs,Rust,43361,1362,68,1600,False,False,True,True,Fuel Network Rust SDK
fuels-ts,FuelLabs,TypeScript,43316,1369,79,1658,True,True,True,True,Fuel Network Typescript SDK
tmux,tmux,C,43285,2500,58,3942,False,True,True,True,tmux source code
cli,cli,Go,43254,8118,942,2359,True,True,True,True,GitHub’s official command line tool
spark,apache,Scala,43006,29128,288,4405,True,True,True,True,Apache Spark - A unified analytics engine for large-scale data processing
kong,Kong,Lua,42999,5098,135,4140,True,True,True,True,🦍 The API and AI Gateway
pm2,Unitech,JavaScript,42997,2693,1095,4686,False,True,True,True,Node.js Production Process Manager with a built-in Load Balancer.
CPlusPlusThings,Light-City,C++,42990,8830,8,2440,False,False,False,True,C++那些事
what-happens-when,alex,,42867,5725,2071,4516,False,False,False,True,"An attempt to answer the age old interview question ""What happens when you type google.com into your browser and press enter?"""
zig,ziglang,Zig,42828,3079,3431,3879,False,False,False,True,Moved to Codeberg
RSSHub,DIYgod,TypeScript,42826,9446,370,2908,True,True,True,True,🧡 Everything is RSSible
python-patterns,faif,Python,42799,7046,13,5034,False,False,True,True,A collection of design patterns/idioms in Python
exo,exo-explore,Python,42747,2939,164,633,False,True,True,True,Run frontier AI locally.
mitmproxy,mitmproxy,Python,42731,4491,421,5876,True,True,True,True,An interactive TLS-capable intercepting HTTP proxy for penetration testers and software developers.
pandoc,jgm,Haskell,42720,3787,1054,5843,False,True,True,True,Universal markup converter
Umi-OCR,hiroi-sora,Python,42658,4212,328,1453,False,False,False,True,"OCR software, free and offline. 开源、免费的离线OCR软件。支持截屏/批量导入图片，PDF文档识别，排除水印/页眉页脚，扫描/生成二维码。内置多国语言库。"
fanqiang,bannedbook,Kotlin,42629,7588,325,4083,False,False,True,True,翻墙-科学上网
Files,files-community,C#,42515,2640,517,2631,True,True,True,True,A modern file manager that helps users organize their files and folders.
git-flight-rules,k88hudson,,42478,3190,16,4258,False,False,False,True,Flight rules for git
Alamofire,Alamofire,Swift,42365,7658,43,4249,False,True,True,True,Elegant HTTP Networking in Swift
chatgpt-on-wechat,zhayujie,Python,42319,9840,348,1320,False,False,True,True,CowAgent是基于大模型的超级AI助理，能主动思考和任务规划、访问操作系统和外部资源、创造和执行Skills、拥有长期记忆并不断成长。同时支持飞书、钉钉、企微、QQ、微信公众号、网页等接入，可选择OpenAI/Claude/Gemini/DeepSeek/ Qwen/GLM/Kimi/LinkAI，能处理文本、语音、图片和文件，可快速搭建个人AI助手和企业数字员工。
Win11Debloat,Raphire,PowerShell,42294,1666,28,1969,False,True,True,True,"A simple, lightweight PowerShell script that allows you to remove pre-installed apps, disable telemetry, as well as perform various other changes to declutter and customize your Windows experience. Win11Debloat works for both Windows 10 and Windows 11."
system-design,karanpratapsingh,,42244,5369,4,1312,True,True,False,True,Learn how to design systems at scale and prepare for system design interviews
zod,colinhacks,TypeScript,42174,1862,294,2203,True,True,True,True,TypeScript-first schema validation with static type inference
aider,Aider-AI,Python,42162,4056,1445,1045,False,True,True,True,aider is AI pair programming in your terminal
full-stack-fastapi-template,fastapi,TypeScript,42160,8244,13,2581,False,True,True,True,"Full stack, modern web application template. Using FastAPI, React, SQLModel, PostgreSQL, Docker, GitHub Actions, automatic HTTPS and more."
ailearning,apachecn,Python,42129,11593,3,3309,False,False,False,True,AiLearning：数据分析+机器学习实战+线性代数+PyTorch+NLTK+TF2
fd,sharkdp,Rust,42124,1015,174,3236,False,True,True,True,"A simple, fast and user-friendly alternative to 'find'"
Mole,tw93,Shell,42113,1202,6,177,False,True,True,True,🐹 Deep clean and optimize your Mac.
diagrams,mingrammer,Python,42107,2723,385,2237,False,True,True,True,:art: Diagram as Code for prototyping cloud system architectures
gradio,gradio-app,Python,42069,3337,451,2647,True,True,True,True,"Build and share delightful machine learning apps, all in Python. 🌟 Star to support our work!"
bruno,usebruno,JavaScript,41990,2220,1816,1269,False,True,True,True,Opensource IDE For Exploring and Testing API's (lightweight alternative to Postman/Insomnia)
siyuan,siyuan-note,TypeScript,41981,2610,333,2027,True,True,True,True,"A privacy-first, self-hosted, fully open source personal knowledge management software, written in typescript and golang."
DeepSpeed,deepspeedai,Python,41860,4756,1282,2247,True,True,True,True,"DeepSpeed is a deep learning optimization library that makes distributed training and inference easy, efficient, and effective."
cherry-studio,CherryHQ,TypeScript,41847,3888,753,665,True,True,True,True,"AI productivity studio with smart chat, autonomous agents, and 300+ assistants. Unified access to frontier LLMs"
swiper,nolimits4web,JavaScript,41821,9708,248,5118,True,True,True,True,Most modern mobile touch slider with hardware accelerated transitions
ray,ray-project,Python,41799,7365,3486,3432,False,True,True,True,Ray is an AI compute engine. Ray consists of a core distributed runtime and a set of AI Libraries for accelerating ML workloads.
English-level-up-tips,byoungd,,41767,4403,29,3215,False,False,True,True,An advanced guide to learn English which might benefit you a lot 🎉 .  离谱的英语学习指南/英语学习教程/英语学习/学英语
dubbo,apache,Java,41708,26534,928,5021,True,True,True,True,The java implementation of Apache Dubbo. An RPC and microservice framework.
hyperswitch,juspay,Rust,41705,4579,1432,1249,True,True,True,True,"An open source payments switch written in Rust to make payments fast, reliable and affordable"
minimind,jingyaogong,Python,41681,5028,40,601,True,False,True,True,🚀🚀 「大模型」2小时完全从0训练26M的小参数GPT！🌏 Train a 26M-parameter GPT from scratch in just 2h!
oh-my-openagent,code-yeongyu,TypeScript,41672,3114,430,107,False,True,True,True,omo; the best agent harness - previously oh-my-opencode
logseq,logseq,Clojure,41635,2509,1011,2127,True,True,True,True,"A privacy-first, open-source platform for knowledge management and collaboration. Download link:  http://github.com/logseq/logseq/releases. roadmap: https://discuss.logseq.com/t/logseq-product-roadmap/34267"
nw.js,nwjs,JavaScript,41574,3868,959,5188,False,False,False,True,Call all Node.js modules directly from DOM/WebWorker and enable a new way of writing applications with all Web technologies.
yarn,yarnpkg,JavaScript,41530,2730,2064,3712,True,True,True,True,The 1.x line is frozen - features and bugfixes now happen on https://github.com/yarnpkg/berry
uni-app,dcloudio,JavaScript,41445,3721,673,2807,False,True,True,True,A cross-platform framework using Vue.js
black,psf,Python,41434,2738,326,2927,True,True,True,True,The uncompromising Python code formatter
BMAD-METHOD,bmad-code-org,JavaScript,41432,5044,133,340,True,True,True,True,Breakthrough Method for Agile Ai Driven Development
pure-bash-bible,dylanaraps,Shell,41430,3638,62,2837,False,True,False,True,📖 A collection of pure bash alternatives to external processes.
ccxt,ccxt,Python,41428,8560,1369,3231,False,True,True,True,A cryptocurrency trading API with more than 100 exchanges in JavaScript / TypeScript / Python / C# / PHP / Go 
ColossalAI,hpcaitech,Python,41364,4522,492,1603,False,True,True,True,"Making large AI models cheaper, faster and more accessible"
payload,payloadcms,TypeScript,41323,3490,764,1899,False,True,True,True,"Payload is the open-source, fullstack Next.js framework, giving you instant backend superpowers. Get a full TypeScript backend and admin panel instantly. Use Payload as a headless CMS or for building powerful applications."
hexo,hexojs,TypeScript,41313,5034,104,4925,True,True,True,True,"A fast, simple & powerful blog framework, powered by Node.js."
worldmonitor,koala73,TypeScript,41258,6767,74,70,True,True,True,True,"Real-time global intelligence dashboard — AI-powered news aggregation, geopolitical monitoring, and infrastructure tracking in a unified situational awareness interface"
