repo_name,organization,language,stars,forks,open_issues,age_days,has_coc,has_contributing,has_workflows,has_readme,description
helix,helix-editor,Rust,45021,3577,1562,2220,False,True,True,True,A post-modern modal text editor.
milvus,milvus-io,Go,45020,4095,942,2479,True,True,True,True,"Milvus is a high-performance, cloud-native vector database built for scalable vector ANN search"
RSSHub,DIYgod,TypeScript,45009,9969,362,3010,True,True,True,True,🧡 Everything is RSSible
grpc,grpc,C++,44938,11167,1353,4221,True,True,True,True,"C++ based gRPC (C++, Python, Ruby, Objective-C, PHP, C#)"
edex-ui,GitSquared,JavaScript,44936,3138,6,3439,False,False,True,True,"A cross-platform, customizable science fiction terminal emulator with advanced monitoring & touchscreen support."
pyenv,pyenv,Shell,44930,3254,53,5050,False,True,True,True,Simple Python version management
nanobot,HKUDS,Python,44870,7913,876,148,False,True,True,True,"Lightweight, open-source AI agent for your tools, chats, and workflows."
container,apple,Swift,44856,1327,401,395,True,True,True,True,"A tool for creating and running Linux containers using lightweight virtual machines on a Mac. It is written in Swift, and optimized for Apple silicon. "
meteor,meteor,JavaScript,44793,5245,422,5276,True,True,True,True,"Meteor, the JavaScript App Platform"
react-hook-form,react-hook-form,TypeScript,44778,2424,49,2673,True,True,True,True,📋 React Hooks for form state management and validation (Web + React Native)
siyuan,siyuan-note,TypeScript,44758,2846,298,2129,True,True,True,True,"A privacy-first, self-hosted, fully open source personal knowledge management software, written in typescript and golang."
chrome-devtools-mcp,ChromeDevTools,TypeScript,44726,2901,87,291,False,True,True,True,Chrome DevTools for coding agents
reactjs-interview-questions,sudheerj,JavaScript,44664,10366,15,2951,False,False,True,True,List of top 500 ReactJS Interview Questions & Answers....Coding exercise questions are coming soon!!
hyper,vercel,TypeScript,44633,3565,1044,3651,False,False,True,True,A terminal built on web technologies
CLI-Anything,HKUDS,Python,44283,4135,67,113,False,True,True,True,"""CLI-Anything: Making ALL Software Agent-Native"" -- CLI-Hub: https://clianything.cc/"
system-design,karanpratapsingh,,44280,5754,3,1414,True,True,False,True,Learn how to design systems at scale and prepare for system design interviews
sentry,getsentry,Python,44196,4730,2098,5782,True,True,True,True,Developer-first error tracking and performance monitoring
jsoncrack.com,AykutSarac,TypeScript,44190,3560,35,1611,True,True,True,True,"✨ Innovative and open-source visualization application that transforms various data formats, such as JSON, YAML, XML and CSV into interactive graphs."
cobra,spf13,Go,44184,3155,382,4682,False,True,True,True,A Commander for modern Go CLI interactions
CL4R1T4S,elder-plinius,,44179,8996,114,482,False,False,False,True,"LEAKED SYSTEM PROMPTS FOR CHATGPT, CLAUDE, GEMINI, GROK, PERPLEXITY, CURSOR, LOVABLE, REPLIT, AND MORE! - AI SYSTEMS TRANSPARENCY FOR ALL! 👐"
EasySpider,NaiboWang,JavaScript,44165,5384,268,2173,False,False,True,True,A visual no-code/code-free web crawler/spider易采集：一个可视化浏览器自动化测试/数据采集/网页爬虫软件，可以无代码图形化的设计和执行爬虫任务。别名：ServiceWrapper面向Web应用的智能化服务封装系统。
mitmproxy,mitmproxy,Python,44108,4609,446,5978,True,True,True,True,An interactive TLS-capable intercepting HTTP proxy for penetration testers and software developers.
Files,files-community,C#,44095,2773,474,2733,True,True,True,True,A modern file manager that helps users organize their files and folders.
parcel,parcel-bundler,JavaScript,44025,2278,597,3248,True,True,True,True,The zero configuration build tool for the web. 📦🚀
babel,babel,TypeScript,44013,5829,759,4292,True,True,True,True,🐠 Babel is a compiler for writing next generation JavaScript.
react-use,streamich,TypeScript,43998,3272,663,2802,False,True,True,True,React Hooks — 👍
front-end-interview-handbook,yangshun,MDX,43974,5937,12,3089,True,True,True,True,Front End interview preparation materials for busy engineers (updated for 2026)
full-stack-fastapi-template,fastapi,TypeScript,43971,8729,17,2683,False,True,True,True,"Full stack, modern web application template. Using FastAPI, React, SQLModel, PostgreSQL, Docker, GitHub Actions, automatic HTTPS and more."
FlClash,chen08209,Dart,43934,2761,482,1049,False,False,True,True,"A multi-platform proxy client based on ClashMeta,simple and easy to use, open-source and ad-free."
build-web-application-with-golang,astaxie,Go,43924,10467,138,5079,False,False,False,True,A golang ebook intro how to build a web with golang
retrofit,square,HTML,43910,7336,170,5775,False,True,True,True,A type-safe HTTP client for Android and the JVM
TensorFlow-Examples,aymericdamien,Jupyter Notebook,43743,14700,228,3883,False,False,False,True,TensorFlow Tutorial and Examples for Beginners (support TF v1 & v2)
kong,Kong,Lua,43699,5161,157,4242,True,True,True,True,🦍 The API and AI Gateway
logseq,logseq,Clojure,43604,2683,912,2229,True,True,True,True,"A privacy-first, open-source platform for knowledge management and collaboration. Download link:  http://github.com/logseq/logseq/releases. roadmap: https://logseq.io/p/NX4mc_ggEV"
fd,sharkdp,Rust,43535,1082,171,3338,False,True,True,True,"A simple, fast and user-friendly alternative to 'find'"
spark,apache,Scala,43525,29259,427,4507,True,True,True,True,Apache Spark - A unified analytics engine for large-scale data processing
bubbletea,charmbracelet,Go,43452,1247,188,2362,False,True,True,True,A powerful little TUI framework 🏗
jan,janhq,TypeScript,43314,2876,470,1048,True,True,True,True,Jan is an open source alternative to ChatGPT that runs 100% offline on your computer.
payload,payloadcms,TypeScript,43303,3859,846,2001,False,True,True,True,"Payload is the open-source, fullstack Next.js framework, giving you instant backend superpowers. Get a full TypeScript backend and admin panel instantly. Use Payload as a headless CMS or for building powerful applications."
GitNexus,abhigyanpatwari,TypeScript,43267,4839,266,331,False,True,True,True,"GitNexus: The Zero-Server Code Intelligence Engine -       GitNexus is a client-side knowledge graph creator that runs entirely in your browser. Drop in a git repository (Github, Gitlab, Azure, Local) or ZIP file, and get an interactive knowledge graph with a built in Graph RAG Agent. Perfect for code exploration"
CPlusPlusThings,Light-City,C++,43257,8827,10,2542,False,False,False,True,C++那些事
pm2,Unitech,JavaScript,43231,2714,1082,4788,False,True,True,True,Node.js Production Process Manager with a built-in Load Balancer.
zig,ziglang,Zig,43224,3060,2897,3981,False,False,False,True,Moved to Codeberg
what-happens-when,alex,,43209,5737,2066,4618,False,False,True,True,"An attempt to answer the age old interview question ""What happens when you type google.com into your browser and press enter?"""
hyperswitch,juspay,Rust,43178,4922,1945,1351,True,True,True,True,"Open source, composable payments platform | PCI compliant | SaaS and Self-host options | Enables connectivity to multiple payment, payout, fraud, vault and tokenization providers | Uplifts authorization with intelligent routing and revenue recovery | Reduce payment processing costs with cost observability | Reduces payment ops with reconciliation"
fuels-rs,FuelLabs,Rust,43137,1362,71,1702,False,False,True,True,Fuel Network Rust SDK
ccxt,ccxt,Python,43134,8722,1315,3333,False,True,True,True,A cryptocurrency trading API with more than 100 exchanges in JavaScript / TypeScript / Python / C# / PHP / Go / Java 
desktop,zen-browser,JavaScript,43129,1592,545,824,True,False,True,True,Welcome to a calmer internet
fuels-ts,FuelLabs,TypeScript,43106,1371,78,1760,True,True,True,True,Fuel Network Typescript SDK
zod,colinhacks,TypeScript,43074,2044,228,2305,True,True,True,True,TypeScript-first schema validation with static type inference
ray,ray-project,Python,43058,7743,3477,3534,False,True,True,True,Ray is an AI compute engine. Ray consists of a core distributed runtime and a set of AI Libraries for accelerating ML workloads.
gradio,gradio-app,Python,43036,3521,246,2749,True,True,True,True,"Build and share delightful machine learning apps, all in Python. 🌟 Star to support our work!"
data-engineering-zoomcamp,DataTalksClub,Jupyter Notebook,42877,8481,0,1712,False,False,True,True,Data Engineering Zoomcamp is a free 9-week course on building production-ready data pipelines. The next cohort starts in January 2026. Join the course here 👇🏼
python-patterns,faif,Python,42830,7012,15,5136,False,False,True,True,A collection of design patterns/idioms in Python
Fabric,danielmiessler,Go,42718,4200,67,908,True,True,True,True,Fabric is an open-source framework for augmenting humans using AI. It provides a modular system for solving specific problems using a crowdsourced set of AI prompts that can be used anywhere.
DeepSpeed,deepspeedai,Python,42614,4870,1303,2349,True,True,True,True,"DeepSpeed is a deep learning optimization library that makes distributed training and inference easy, efficient, and effective."
paperless-ngx,paperless-ngx,Python,42603,2842,7,1598,True,True,True,True,"A community-supported supercharged document management system: scan, index and archive all your documents"
puter,HeyPuter,TypeScript,42527,3920,19,849,False,True,True,True,"🌐 The Internet Computer! Free, Open-Source, and Self-Hostable."
git-flight-rules,k88hudson,,42473,3174,14,4360,False,False,False,True,Flight rules for git
vnpy,vnpy,Python,42445,12029,19,4138,True,False,True,True,基于Python的开源量化交易平台开发框架
diagrams,mingrammer,Python,42409,2733,388,2339,False,True,True,True,:art: Diagram as Code for prototyping cloud system architectures
Alamofire,Alamofire,Swift,42398,7666,43,4352,False,True,True,True,Elegant HTTP Networking in Swift
ailearning,apachecn,Python,42355,11540,4,3411,False,False,False,True,AiLearning：数据分析+机器学习实战+线性代数+PyTorch+NLTK+TF2
impeccable,pbakaus,JavaScript,42327,2358,55,226,False,False,True,True,The design language that makes your AI harness better at design.
curl,curl,C,42254,7250,53,5947,True,True,True,True,"A command line tool and library for transferring data with URL syntax, supporting DICT, FILE, FTP, FTPS, GOPHER, GOPHERS, HTTP, HTTPS, IMAP, IMAPS, LDAP, LDAPS, MQTT, MQTTS, POP3, POP3S, RTSP, SCP, SFTP, SMB, SMBS, SMTP, SMTPS, TELNET, TFTP, WS and WSS. libcurl offers a myriad of powerful features"
react-bits,DavidHDev,JavaScript,42213,1939,0,692,False,True,True,True,"An open source collection of animated, interactive & fully customizable React components for building memorable websites."
HEU_KMS_Activator,zbezj,,42208,3892,174,2564,False,False,False,True,
antigravity-awesome-skills,sickn33,Python,42033,6719,1,166,True,True,True,True,"Installable GitHub library of 1,600+ agentic skills for Claude Code, Cursor, Codex CLI, Gemini CLI, Antigravity, and more. Includes specialized plugins, installer CLI, bundles, workflows, and official/community skill collections."
data-engineer-handbook,DataExpert-io,Jupyter Notebook,42030,7902,39,953,False,False,False,True,This is a repo with links to everything you'd ever want to learn about data engineering
3x-ui,MHSanaei,Go,41878,7809,93,1236,False,True,True,True,"Xray panel supporting multi-protocol multi-user expire day & traffic & IP limit (Vmess, Vless, Trojan, ShadowSocks, Wireguard, Hysteria, Tunnel, Mixed, HTTP, Tun) "
swiper,nolimits4web,TypeScript,41861,9649,250,5220,True,True,False,True,Most modern mobile touch slider with hardware accelerated transitions
hexo,hexojs,TypeScript,41772,27,98,5027,True,True,True,True,"A fast, simple & powerful blog framework, powered by Node.js."
WeChatMsg,LC044,,41749,5233,25,1266,False,False,False,True,
lossless-cut,mifi,TypeScript,41747,2042,259,3529,False,True,True,True,The swiss army knife of lossless video/audio editing
fastlane,fastlane,Ruby,41723,6018,731,4227,True,True,True,True,🚀 The easiest way to automate building and releasing your iOS and Android apps
pure-bash-bible,dylanaraps,Shell,41681,3626,62,2939,False,True,False,True,📖 A collection of pure bash alternatives to external processes.
black,psf,Python,41639,2784,287,3029,True,True,True,True,The uncompromising Python code formatter
dive-into-llms,Lordog,Jupyter Notebook,41601,5051,14,812,False,False,False,True,《动手学大模型Dive into LLMs》系列编程实践教程
BettaFish,666ghj,Python,41564,7602,35,728,True,True,True,True,微舆：人人可用的多Agent舆情分析助手，打破信息茧房，还原舆情原貌，预测未来走向，辅助决策！从0实现，不依赖任何框架。
uni-app,dcloudio,Objective-C,41558,3711,691,2909,False,True,True,True,A cross-platform framework using Vue.js
dubbo,apache,Java,41523,26418,997,5123,True,True,True,True,The java implementation of Apache Dubbo. An RPC and microservice framework.
yarn,yarnpkg,JavaScript,41500,2724,2056,3814,True,True,True,True,The 1.x line is frozen - features and bugfixes now happen on https://github.com/yarnpkg/berry
cheat.sh,chubin,Python,41499,1916,144,3340,False,True,True,True,the only cheat sheet you need
ColossalAI,hpcaitech,Python,41411,4504,500,1705,False,True,True,True,"Making large AI models cheaper, faster and more accessible"
aria2,aria2,C++,41334,3871,1148,5693,False,False,True,True,"aria2 is a lightweight multi-protocol & multi-source, cross platform download utility operated in command-line. It supports HTTP/HTTPS, FTP, SFTP, BitTorrent and Metalink."
airi,moeru-ai,TypeScript,41324,4158,189,575,True,True,True,True,"💖🧸 Self hosted, you-owned Grok Companion, a container of souls of waifu, cyber livings to bring them into our worlds, wishing to achieve Neuro-sama's altitude. Capable of realtime voice chat, Minecraft, Factorio playing. Web / macOS / Windows supported."
cobalt,imputnet,Svelte,41306,3548,254,1452,False,True,True,True,best way to save what you love
tabler,tabler,HTML,41241,4376,141,3070,True,False,True,True,Tabler is free and open-source HTML Dashboard UI Kit built on Bootstrap
daisyui,saadeghi,Svelte,41210,1634,28,2039,False,True,True,True,"🌼 🌼 🌼 🌼 🌼  The most popular, free and open-source Tailwind CSS component library"
nw.js,nwjs,JavaScript,41191,3850,900,5291,False,False,False,True,Call all Node.js modules directly from DOM/WebWorker and enable a new way of writing applications with all Web technologies.
styled-components,styled-components,TypeScript,41104,2525,12,3605,True,True,True,True,"Fast, expressive styling for React. Server components, client components, streaming SSR, React Native—one API."
vue2-elm,bailicangdu,Vue,41059,12267,121,3476,False,False,True,True,Large single page application with 45 pages built on vue2 + vuex. 基于 vue2 + vuex 构建一个具有 45 个页面的大型单页面应用
ChatGLM-6B,zai-org,Python,41038,5136,609,1204,False,False,False,True,ChatGLM-6B: An Open Bilingual Dialogue Language Model | 开源双语对话语言模型
vuetify,vuetifyjs,TypeScript,41006,7134,541,3578,True,True,True,True,🐉 Vue Component Framework
free,freefq,,41000,5629,586,2214,False,False,False,True,翻墙、免费翻墙、免费科学上网、免费节点、免费梯子、免费ss/v2ray/trojan节点、蓝灯、谷歌商店、翻墙梯子
agno,agno-agi,Python,40909,5573,973,1517,True,True,True,True,"Build, run, and manage agent platforms."
chatbox,chatboxai,TypeScript,40797,4130,1194,1211,False,False,True,True,Powerful AI Client
vim,vim,Vim Script,40710,6084,1629,3968,False,True,True,True,The official Vim repository
zju-icicles,QSCTech,HTML,40651,9574,10,3653,False,False,True,True,浙江大学课程攻略共享计划
50projects50days,bradtraversy,CSS,40604,9741,48,2051,False,False,False,True,"50+ mini web projects using HTML, CSS & JS"
new-api,QuantumNous,Go,40554,9334,890,962,True,False,True,True,"A unified AI model hub for aggregation & distribution. It supports cross-converting various LLMs into OpenAI-compatible, Claude-compatible, or Gemini-compatible formats. A centralized gateway for personal and enterprise model management. 🍥"
headscale,juanfont,Go,40553,2236,121,2199,True,True,True,True,"An open source, self-hosted implementation of the Tailscale control server"
remote-jobs,remoteintech,JavaScript,40509,3946,8,3913,True,True,True,True,Source for remoteintech.company — a community-maintained directory of remote-friendly tech companies
chakra-ui,chakra-ui,TypeScript,40483,3620,10,2508,True,True,True,True,Chakra UI is a component system for building SaaS products with speed ⚡️
faiss,facebookresearch,C++,40426,4438,291,3429,True,True,True,True,A library for efficient similarity search and clustering of dense vectors.
Awesome-Design-Tools,goabstract,JavaScript,40424,2283,160,2694,False,False,True,True,The best design tools and plugins for everything 👉
trpc,trpc,TypeScript,40382,1628,235,2173,False,True,True,True,🧙‍♀️  Move Fast and Break Nothing. End-to-end typesafe APIs made easy. 
wrk,wg,C,40337,3031,204,5214,False,False,True,True,Modern HTTP benchmarking tool
tidb,pingcap,Go,40232,6203,6384,3950,True,True,True,True,"TiDB is built for agentic workloads that grow unpredictably, with ACID guarantees and native support for transactions, analytics, and vector search. No data silos. No noisy neighbors. No infrastructure ceiling."
php-src,php,C,40209,8087,1838,5493,False,True,True,True,The PHP Interpreter
appsmith,appsmithorg,TypeScript,40195,4629,4459,2191,True,True,True,True,"Platform to build admin panels, internal tools, and dashboards. Integrates with 25+ databases and any API."
awesome-cursorrules,PatrickJS,JavaScript,40146,3436,32,651,True,True,True,True,📄  Configuration files that enhance Cursor AI editor experience with custom rules and behaviors
stats,exelban,Swift,40094,1398,19,2588,False,False,True,True,macOS system monitor in your menu bar
bert,google-research,Python,40051,9702,880,2804,False,True,False,True,TensorFlow code and pre-trained models for BERT
LibreChat,danny-avila,TypeScript,40024,8194,546,1234,True,True,True,True,"Enhanced ChatGPT Clone: Features Agents, MCP, Skills, DeepSeek, Anthropic, AWS, OpenAI, Responses API, Azure, Groq, o1, GPT-5, Mistral, OpenRouter, Vertex AI, Gemini, Artifacts, AI model switching, message search, Code Interpreter, langchain, DALL-E-3, OpenAPI Actions, Functions, Secure Multi-User Auth, Presets, open-source for self-hosting. Active"
esbuild,evanw,Go,39960,1316,620,3667,False,False,True,True,An extremely fast bundler for the web
Xray-core,XTLS,Go,39959,5540,54,2058,True,False,True,True,"Xray, Penetrates Everything. Also the best v2ray-core. Where the magic happens. An open platform for various uses."
photoprism,photoprism,Go,39910,2304,476,3075,True,True,True,True,AI-Powered Photos App 🌈💎✨
fiber,gofiber,Go,39909,2000,47,2357,True,True,True,True,⚡️ Express inspired web framework written in Go
yazi,sxyazi,Rust,39901,917,69,1087,True,True,True,True,"💥 Blazing fast terminal file manager written in Rust, based on async I/O."
gkd,gkd-kit,Kotlin,39882,1889,7,1092,False,False,True,True,"基于无障碍，高级选择器，订阅规则的自定义屏幕点击安卓应用 | An Android APP with custom screen tapping based on Accessibility, Advanced Selectors, and Subscription Rules"
phaser,phaserjs,JavaScript,39870,7145,117,4826,True,True,True,True,"Phaser is a fun, free and fast 2D game framework for making HTML5 games for desktop and mobile web browsers, supporting Canvas and WebGL rendering."
nushell,nushell,Rust,39835,2168,1438,2607,True,True,True,True,A new type of shell
insomnia,Kong,TypeScript,39826,2349,856,3720,True,True,True,True,"The open-source, cross-platform API client for GraphQL, REST, WebSockets, SSE and gRPC. With Cloud, Local and Git storage."
gorm,go-gorm,Go,39823,4154,526,4630,True,False,True,True,"The fantastic ORM library for Golang, aims to be developer friendly"
video.js,videojs,JavaScript,39806,7494,666,5890,True,True,True,True,Video.js - open source HTML5 video player
sniffnet,GyulyVGC,Rust,39656,1692,68,1429,True,True,True,True,Comfortably monitor your Internet traffic 🕵️‍♂️
shellcheck,koalaman,Haskell,39635,1934,1234,4973,False,False,True,True,"ShellCheck, a static analysis tool for shell scripts"
it-tools,CorentinTh,Vue,39573,5068,810,2276,False,False,True,True,"Collection of handy online tools for developers, with great UX. "
BitNet,microsoft,Python,39546,3625,325,693,True,False,True,True,Official inference framework for 1-bit LLMs
Deep-Learning-Papers-Reading-Roadmap,floodsung,Python,39528,7289,91,3545,False,False,False,True,Deep Learning papers reading roadmap for anyone who are eager to learn this amazing tech!
ChatTTS,2noise,Python,39525,4252,63,763,False,False,True,True,A generative speech model for daily dialogue.
FastChat,lm-sys,Python,39492,4790,1024,1199,False,False,True,True,"An open platform for training, serving, and evaluating large language models. Release repo for Vicuna and Chatbot Arena."
styleguide,google,HTML,39406,12963,169,4058,True,True,True,True,Style guides for Google-originated open-source projects
minds,mindsdb,Makefile,39358,6211,2,2888,True,True,True,True,Delegate anything. It comes back done.
manim,ManimCommunity,Python,39254,2935,501,2233,True,True,True,True,A community-maintained Python framework for creating mathematical animations. 
awesome-system-design-resources,ashishps1,Java,39238,8400,14,979,False,False,False,True,Learn System Design concepts and prepare for interviews using free resources.
novu,novuhq,TypeScript,39230,4344,92,1768,True,True,True,True,The open-source communication infrastructure for agents and products
CodeWhale,Hmbown,Rust,39207,3382,235,161,True,True,True,True,"Open-source, community-driven agent harness"
leveldb,google,C++,39188,8201,394,4324,True,True,True,True,LevelDB is a fast key-value storage library written at Google that provides an ordered mapping from string keys to string values.
bark,suno-ai,Jupyter Notebook,39185,4673,268,1179,False,False,False,True,🔊 Text-Prompted Generative Audio Model
quivr,QuivrHQ,Python,39184,3722,30,1144,False,False,True,True,"Opiniated RAG for integrating GenAI in your apps 🧠   Focus on your product rather than the RAG. Easy integration in existing products with customisation!  Any LLM: GPT4, Groq, Llama. Any Vectorstore: PGVector, Faiss. Any Files. Anyway you want."
halo,halo-dev,Java,39175,10313,133,3022,True,True,True,True,Halo 是一款强大易用的开源建站工具，从个人博客、知识库，到企业官网、在线商城，Halo 都能助您轻松实现，一站式满足您的多样化建站需求。
outline,outline,TypeScript,39143,3376,49,3690,True,False,True,True,"The fastest knowledge base for growing teams. Beautiful, realtime collaborative, feature packed, and markdown compatible."
reactive-resume,amruthpillai,TypeScript,39136,4401,101,2287,False,False,True,True,"A one-of-a-kind resume builder that keeps your privacy in mind. Completely secure, customizable, portable, open-source and free forever. Try it out today!"
devdocs,freeCodeCamp,Ruby,39131,2607,235,4631,True,True,True,True,API Documentation Browser
ink,vadimdemedes,TypeScript,39121,1018,29,3305,True,True,True,True,🌈 React for interactive command-line apps
duckdb,duckdb,C++,39110,3366,542,2925,True,True,True,True,DuckDB is an analytical in-process SQL database management system
llvm-project,llvm,LLVM,39033,17652,37267,3491,True,True,True,True,The LLVM Project is a collection of modular and reusable compiler and toolchain technologies.
openscreen,siddharthvaddem,TypeScript,39030,2822,49,263,False,True,True,True,"Create stunning demos for free. Open-source, no subscriptions, no watermarks, and free for commercial use. An alternative to Screen Studio."
obsidian-skills,kepano,,38947,2762,47,178,False,False,True,True,"Agent skills for Obsidian. Teach your agent to use Obsidian CLI and open formats including Markdown, Bases, JSON Canvas."
claude-howto,luongnv89,Python,38934,4688,23,234,True,True,True,True,"A visual, example-driven guide to Claude Code — from basic concepts to advanced agents, with copy-paste templates that bring immediate value."
polars,pola-rs,Rust,38891,2917,2794,2238,True,True,True,True,"Extremely fast Query Engine for DataFrames, written in Rust"
materialize,Dogfalo,JavaScript,38858,4625,793,4308,True,True,True,True,"Materialize, a CSS Framework based on Material Design"
NewPipe,TeamNewPipe,Java,38851,3658,1419,3952,False,True,True,True,A libre lightweight streaming front-end for Android.
Sunshine,LizardByte,C++,38784,2053,128,1657,True,True,True,True,Self-hosted game stream host for Moonlight.
googletest,google,C++,38753,10810,567,3989,True,True,True,True,GoogleTest - Google Testing and Mocking Framework
preact,preactjs,JavaScript,38727,2040,150,3945,True,True,True,True,⚛️ Fast 3kB React alternative with the same modern API. Components & Virtual DOM.
CLIProxyAPI,router-for-me,Go,38727,6404,236,363,False,False,True,True,"Wrap Antigravity, ChatGPT Codex, Claude Code, Grok Build as an OpenAI/Gemini/Claude/Codex compatible API service, allowing you to enjoy the free Gemini 3.1 Pro, GPT 5.5, Grok 4.3, Claude model through API"
GPT_API_free,chatanywhere,,38628,2657,20,1163,False,False,False,True,Free ChatGPT&DeepSeek API Key，免费ChatGPT&DeepSeek API。免费接入DeepSeek API和GPT4 API，支持 gpt | deepseek | claude | gemini | grok 等排名靠前的常用大模型。
lapce,lapce,Rust,38602,1296,887,3065,False,True,True,True,Lightning-fast and Powerful Code Editor written in Rust
Folo,RSSNext,TypeScript,38582,2098,372,813,True,True,True,True,🧡 Folo is the AI RSS Reader
