repo_name,organization,language,stars,forks,open_issues,age_days,has_coc,has_contributing,has_workflows,has_readme,description
penpot,penpot,Clojure,54623,3556,681,3835,True,True,True,True,Penpot: The open-source design tool for design and code collaboration
powerlevel10k,romkatv,Shell,54616,2427,147,2682,False,False,False,True,A Zsh theme
crewAI,crewAIInc,Python,54597,7647,582,977,False,True,True,True,"Framework for orchestrating role-playing, autonomous AI agents. By fostering collaborative intelligence, CrewAI empowers agents to work together seamlessly, tackling complex tasks."
segment-anything,facebookresearch,Jupyter Notebook,54433,6358,595,1194,True,True,True,True,"The repository provides code for running inference with the SegmentAnything Model (SAM), links for downloading the trained model checkpoints, and example notebooks that show how to use the model."
ChatGPT,lencx,Rust,54386,6151,937,1300,False,False,True,True,"🔮 ChatGPT Desktop Application (Mac, Windows and Linux)"
trackerslist,ngosang,,54330,6594,9,3718,False,False,True,True,Updated list of public BitTorrent trackers
MediaCrawler,NanmiCoder,Python,54319,11070,180,1116,False,False,True,True,小红书笔记 | 评论爬虫、抖音视频 | 评论爬虫、快手视频 | 评论爬虫、B 站视频 ｜ 评论爬虫、微博帖子 ｜ 评论爬虫、百度贴吧帖子 ｜ 百度贴吧评论回复爬虫  | 知乎问答文章｜评论爬虫
maybe,maybe-finance,Ruby,54301,5636,0,910,False,True,True,True,The personal finance app for everyone
dive,wagoodman,Go,54270,1988,208,2969,False,False,True,True,A tool for exploring each layer in a docker image
PowerShell,PowerShell,C#,54252,8361,1523,3820,True,True,True,True,PowerShell for every system!
Ghost,TryGhost,JavaScript,54210,11759,139,4804,True,True,True,True,"Independent technology for modern publishing, memberships, subscriptions and newsletters."
requests,psf,Python,54190,9994,230,5615,True,True,True,True,"A simple, yet elegant, HTTP library."
Flowise,FlowiseAI,TypeScript,54120,24614,970,1186,True,True,True,True,"Build AI Agents, Visually"
element,ElemeFE,Vue,54114,14446,2970,3587,False,False,True,True,A Vue.js 2.0 UI Toolkit for Web
headroom,headroomlabs-ai,Python,54045,3885,447,173,True,True,True,True,"Compress tool outputs, logs, files, and RAG chunks before they reach the LLM. 60-95% fewer tokens, same answers. Library, proxy, MCP server."
ImHex,WerWolv,C++,54034,2406,374,2057,True,True,True,True,"🔍 A Hex Editor for Reverse Engineers, Programmers and people who value their retinas when working at 3 AM."
core,vuejs,TypeScript,53897,9155,910,2939,False,True,True,True,"🖖 Vue.js is a progressive, incrementally-adoptable JavaScript framework for building UI on the web."
jellyfin,jellyfin,C#,53815,5049,546,2760,True,True,True,True,The Free Software Media System - Server Backend & API
plane,makeplane,TypeScript,53549,4806,953,1318,True,True,True,True,"🔥🔥🔥 Open-source Jira, Linear, Monday, and ClickUp alternative. Plane is a modern project management platform to manage tasks, sprints, docs, and triage."
normalize.css,necolas,CSS,53547,10364,76,5535,False,True,False,True,A modern alternative to CSS resets
material-design-icons,google,,53521,9735,409,4282,True,True,True,True,Material Design icons by Google (Material Symbols)
pdf.js,mozilla,JavaScript,53510,10636,415,5544,True,True,True,True,PDF Reader in JavaScript
taste-skill,Leonxlnx,JavaScript,53392,3682,36,130,False,False,True,True,"Taste-Skill - gives your AI good taste. stops the AI from generating boring, generic slop "
kotlin,JetBrains,Kotlin,53015,6348,312,5250,True,True,True,True,The Kotlin Programming Language. 
odoo,odoo,Python,52721,32941,9996,4430,False,True,True,True,Odoo. Open Source Apps To Grow Your Business.
awesome-ios,vsouza,Swift,52636,6980,14,4372,True,True,True,True,"A curated list of awesome iOS ecosystem, including Objective-C and Swift Projects "
Docker-OSX,sickcodes,Shell,52621,2877,417,2216,False,False,True,True,Run macOS VM in a Docker! Run near native OSX-KVM in Docker! X11 Forwarding! CI/CD for OS X Security Research! Docker mac Containers.
ionic-framework,ionic-team,TypeScript,52552,13355,626,4696,True,True,True,True,"A powerful cross-platform UI toolkit for building native-quality iOS, Android, and Progressive Web Apps with HTML, CSS, and JavaScript."
minimind,jingyaogong,Python,52357,6746,45,703,True,False,True,True,🧠「大模型」2小时完全从0训练64M的小参数LLM！Train a 64M-parameter LLM from scratch in just 2h!
windows,dockur,Shell,52220,4436,109,897,False,False,True,True,Windows inside a Docker container.
Motrix,agalwood,JavaScript,52139,4884,780,2750,True,True,True,True,A full-featured download manager.
chinese-poetry,chinese-poetry,JavaScript,52116,10519,136,3588,False,False,True,True,"The most comprehensive database of Chinese poetry 🧶最全中华古诗词数据库,  唐宋两朝近一万四千古诗人,  接近5.5万首唐诗加26万宋诗.  两宋时期1564位词人，21050首词。"
prettier,prettier,JavaScript,52108,4759,1406,3499,True,True,True,True,Prettier is an opinionated code formatter.
litellm,BerriAI,Python,52074,9307,3494,1069,False,True,True,True,"Python SDK, Proxy Server (AI Gateway) to call 100+ LLM APIs in OpenAI (or native) format, with cost tracking, guardrails, loadbalancing and logging. [Bedrock, Azure, OpenAI, VertexAI, Cohere, Anthropic, Sagemaker, HuggingFace, VLLM, NVIDIA NIM]"
daily_stock_analysis,ZhuLinsen,Python,51978,45118,58,171,False,True,True,True,"LLM 驱动的多市场股票智能分析系统：多源行情、实时新闻、决策看板与自动推送，支持零成本定时运行。  LLM-powered multi-market stock analysis system with multi-source market data, real-time news, decision dashboard, automated notifications, and cost-free scheduled runs."
freqtrade,freqtrade,Python,51946,10826,34,3330,False,True,True,True,"Free, open source crypto trading bot"
twenty,twentyhq,TypeScript,51928,7674,108,1306,True,True,True,True,"The open alternative to Salesforce, designed for AI."
etcd,etcd-io,Go,51913,10398,258,4741,True,True,True,True,Distributed reliable key-value store for the most critical data of a distributed system
lx-music-desktop,lyswhut,TypeScript,51866,6886,1221,2511,False,False,True,True,一个基于 Electron 的音乐软件
grok-1,xai-org,Python,51692,8467,125,834,True,False,True,True,Grok open release
remotion,remotion-dev,TypeScript,51666,3707,125,2197,True,True,True,True,🎥      Make videos programmatically with React
lazydocker,jesseduffield,Go,51528,1634,282,2599,True,True,True,True,The lazier way to manage everything docker
jekyll,jekyll,Ruby,51520,10285,248,6462,True,True,True,True,:globe_with_meridians: Jekyll is a blog-aware static site generator in Ruby
guava,google,Java,51499,11136,739,4414,True,True,True,True,Google core libraries for Java
100-Days-Of-ML-Code,Avik-Jain,,51336,11558,68,2916,True,True,False,True,100 Days of ML Coding
DefinitelyTyped,DefinitelyTyped,TypeScript,51313,30431,686,5015,False,False,True,True,The repository for high quality TypeScript type definitions.
go-ethereum,ethereum,Go,51218,21915,398,4568,False,True,True,True,Go implementation of the Ethereum protocol
professional-programming,charlax,Python,51210,3997,3,3888,False,True,False,True,A collection of learning resources for curious software engineers
awesome-wechat-weapp,justjavac,TypeScript,51173,9020,2,3567,False,False,True,True,微信小程序开发资源汇总 :100:
whisper.cpp,ggml-org,C++,51150,5706,1208,1373,False,True,True,True,Port of OpenAI's Whisper model in C/C++
Semantic-UI,Semantic-Org,JavaScript,51056,4870,1071,4830,False,True,False,True,Semantic is a UI component framework based around useful principles from natural language.
open-source-ios-apps,dkhamsing,,50992,5798,2,4172,False,True,True,True,:iphone: Collaborative List of Open-Source iOS Apps
hiring-without-whiteboards,poteto,JavaScript,50915,3898,10,3394,True,True,True,True,⭐️  Companies that don't have a broken hiring process
dbeaver,dbeaver,Java,50780,4264,3305,3904,True,True,True,True,Free universal database tool and SQL client
awesome-openclaw-skills,VoltAgent,,50763,4915,7,155,False,True,True,True,"The awesome collection of OpenClaw skills. 5,400+ skills filtered and categorized from the official OpenClaw Skills Registry.🦞"
Fooocus,lllyasviel,Python,50583,8138,301,1055,False,False,True,True,Focus on prompting and generating
llama_index,run-llama,Python,50521,7652,516,1336,True,True,True,True,LlamaIndex is the leading document agent and OCR platform
goose,aaif-goose,Rust,50441,5391,262,675,False,True,True,True,"an open source, extensible AI agent that goes beyond code suggestions - install, execute, edit, and test with any LLM"
cypress,cypress-io,TypeScript,50434,3429,1091,4136,True,True,True,True,"Fast, easy and reliable testing for anything that runs in a browser."
expo,expo,TypeScript,50340,12902,651,3605,False,True,True,True,"An open-source framework for making universal native apps with React. Expo runs on Android, iOS, and the web."
bulma,jgthms,CSS,50073,3890,522,3810,False,True,True,True,Modern CSS framework based on Flexbox
mastodon,mastodon,Ruby,50070,7484,4465,3780,True,True,True,True,"Your self-hosted, globally interconnected microblogging community"
json,nlohmann,C++,50038,7410,74,4743,True,True,True,True,JSON for Modern C++
BMAD-METHOD,bmad-code-org,JavaScript,49870,5748,77,442,True,True,True,True,Breakthrough Method for Agile Ai Driven Development
query,TanStack,TypeScript,49862,3908,172,2484,False,True,True,True,"🤖 Powerful asynchronous state management, server-state utilities and data fetching for the web. TS/JS, React Query, Solid Query, Svelte Query and Vue Query."
Win11Debloat,Raphire,PowerShell,49844,2007,28,2071,False,True,True,True,"A simple, lightweight PowerShell script that allows you to remove pre-installed apps, disable telemetry, as well as perform various other changes to declutter and customize your Windows experience. Win11Debloat works for both Windows 10 and Windows 11."
alist,AlistGo,Go,49765,7945,577,2014,True,True,True,True,"🗂️A file list/WebDAV program that supports multiple storages, powered by Gin and Solidjs. / 一个支持多存储的文件列表/WebDAV程序，使用 Gin 和 Solidjs。"
VibeVoice,microsoft,Python,49757,5558,174,308,True,True,True,True,Open-Source Frontier Voice AI
hacker-scripts,NARKOZ,JavaScript,49750,6664,70,3873,False,False,False,True,Based on a true story
huginn,huginn,Ruby,49546,4274,692,4860,False,False,True,True,Create agents that monitor and act on your behalf.  Your agents are standing by!
open-source-mac-os-apps,serhii-londar,,49377,2611,131,3161,False,True,True,True,🚀 Awesome list of open source applications for macOS. https://t.me/s/opensourcemacosapps
jadx,skylot,Java,49243,5572,428,4851,True,True,True,True,Dex to Java decompiler
pandas,pandas-dev,Python,49224,20060,3009,5789,True,True,True,True,"Flexible and powerful data analysis / manipulation library for Python, providing labeled data structures similar to R data.frame objects, statistical functions, and much more"
chinese-independent-developer,1c7,,49047,4210,1,3203,False,True,True,True,👩🏿‍💻👨🏾‍💻👩🏼‍💻👨🏽‍💻👩🏻‍💻中国独立开发者项目列表 -- 分享大家都在做什么
julia,JuliaLang,Julia,48893,5798,4700,5548,True,True,True,True,The Julia Programming Language
kubernetes-the-hard-way,kelseyhightower,,48880,15733,50,3644,False,True,False,True,Bootstrap Kubernetes the hard way. No scripts.
pretext,chenglou,TypeScript,48849,2714,85,114,False,False,True,True,"Fast, accurate & comprehensive text measurement & layout"
terraform,hashicorp,Go,48810,10371,1909,4491,True,True,True,True,"Terraform enables you to safely and predictably create, change, and improve infrastructure. It is a source-available tool that codifies APIs into declarative configuration files that can be shared amongst team members, treated as code, edited, reviewed, and versioned."
AI-For-Beginners,microsoft,Jupyter Notebook,48803,10117,12,1944,True,False,True,True,"12 Weeks, 24 Lessons, AI for All!"
brew,Homebrew,Ruby,48799,11194,20,3768,True,True,True,True,🍺 The Package Manager for Everywhere
x64dbg,x64dbg,C++,48763,2761,577,4097,True,True,True,True,An open-source user mode debugger for Windows. Optimized for reverse engineering and malware analysis.
PythonDataScienceHandbook,jakevdp,Jupyter Notebook,48713,18997,230,3610,True,True,False,True,Python Data Science Handbook: full text in Jupyter Notebooks
dayjs,iamkun,JavaScript,48665,2453,1280,3002,False,True,True,True,⏰ Day.js 2kB immutable date-time library alternative to Moment.js with the same modern API
algorithm-visualizer,algorithm-visualizer,JavaScript,48608,7581,79,3698,True,True,False,True,:fireworks:Interactive Online Platform that Visualizes Algorithms from Code
Made-With-ML,GokuMohandas,Jupyter Notebook,48443,7621,25,2794,False,False,True,True,"Learn how to develop, deploy and iterate on production-grade ML applications."
tldraw,tldraw,TypeScript,48423,3354,434,1877,True,True,True,True,"Build infinite canvas apps in React with the tldraw SDK. World's best, top-most agent recommended #1 five star SDK."
fanqiang,bannedbook,Kotlin,48396,8151,329,4185,False,False,True,True,翻墙-科学上网
ClickHouse,ClickHouse,C++,48367,8580,6196,3679,True,True,True,True,ClickHouse® is a real-time analytics database management system
awesome-java,akullpp,,48341,7688,3,4373,False,True,True,True,"A curated list of awesome frameworks, libraries and software for the Java programming language."
ruff,astral-sh,Rust,48301,2200,2055,1420,True,True,True,True,"An extremely fast Python linter and code formatter, written in Rust."
htmx,bigskysoftware,JavaScript,48300,1603,668,2268,False,True,True,True,</> htmx - high power tools for HTML
type-challenges,type-challenges,TypeScript,48274,5275,33225,2167,True,False,True,True,Collection of TypeScript type challenges with online judge
RxJava,ReactiveX,Java,48234,7586,16,4920,False,True,True,True,RxJava – Reactive Extensions for the JVM – a library for composing asynchronous and event-based programs using observable sequences for the Java VM.
metabase,metabase,Clojure,47992,6619,3981,4165,False,True,True,True,The easy-to-use open source Business Intelligence and Embedded Analytics tool that lets everyone work with data :bar_chart:
cherry-studio,CherryHQ,TypeScript,47985,4557,1236,767,True,True,True,True,"AI productivity studio with smart chat, autonomous agents, and 300+ assistants. Unified access to frontier LLMs"
design-patterns-for-humans,nilbuild,,47985,5507,16,3420,False,False,False,True,An ultra-simplified explanation to design patterns
awesome-design-patterns,DovAmir,,47980,3276,25,2947,False,True,False,True,A curated list of software and architecture related design patterns.
moment,moment,JavaScript,47960,6995,305,5600,False,True,True,True,"Parse, validate, manipulate, and display dates in javascript."
awesome-react-components,brillout,,47876,3792,56,3657,True,True,True,True,Curated List of React Components & Libraries.
Projects,karan,,47768,10626,122,4743,False,True,False,True,:page_with_curl: A list of practical projects that anyone can solve in any programming language.
last30days-skill,mvanhorn,Python,47741,3951,66,157,False,False,True,True,"AI agent skill that researches any topic across Reddit, X, YouTube, HN, Polymarket, and the web - then synthesizes a grounded summary"
big-list-of-naughty-strings,minimaxir,Python,47693,2158,108,3978,False,False,False,True,The Big List of Naughty Strings is a list of strings which have a high probability of causing issues when used as user-input data.
pixijs,pixijs,TypeScript,47643,5038,349,4907,True,True,True,True,"The HTML5 Creation Engine: Create beautiful digital content with the fastest, most flexible 2D WebGL renderer."
gogs,gogs,Go,47635,5076,1001,4521,False,True,True,True,The painless way to host your own Git service
awesome-claude-code,hesreallyhim,Python,47621,4161,568,436,True,True,True,True,"A curated list of awesome skills, hooks, slash-commands, agent orchestrators, applications, and plugins for Claude Code by Anthropic"
slidev,slidevjs,TypeScript,47443,2112,212,1893,True,True,True,True,Presentation Slides for Developers
textgen,oobabooga,Python,47390,5983,825,1287,False,False,True,True,"Open-source desktop app for local LLMs. Text, vision, tool-calling, OpenAI/Anthropic-compatible API. 100% private."
discourse,discourse,Ruby,47355,8944,181,4917,True,True,True,True,"A platform for community discussion. Free, open, simple."
tmux,tmux,C,47290,2721,29,4044,False,True,True,True,tmux source code
LocalAI,mudler,Go,47236,4183,210,1199,False,True,True,True,"LocalAI is the open-source AI engine. Run any model - LLMs, vision, voice, image, video - on any hardware. No GPU required."
quill,slab,TypeScript,47211,3657,649,5082,True,True,True,True,Quill is a modern WYSIWYG editor built for compatibility and extensibility
spotube,KRTirtho,Dart,47211,2178,814,1962,True,False,True,True,🎧 Open source music streaming app! Available for both desktop & mobile!
system_prompts_leaks,asgeirtj,JavaScript,47188,7702,25,423,False,True,True,True,"Extracted system prompts from Anthropic - Claude Fable 5, Opus 4.8, Claude Code, Claude Design. OpenAI - ChatGPT 5.5 Thinking, GPT 5.5 Instant, Codex. Google - Gemini 3.5 Flash, 3.1 Pro, Antigravity. xAI - Grok, Cursor, Copilot, VS Code, Perplexity, and more. Updated regularly."
frontend-dev-bookmarks,dypsilon,,47096,5148,132,4755,False,True,False,True,Manually curated collection of resources for frontend web developers.
react,typescript-cheatsheets,TypeScript,47085,4291,0,2950,True,True,True,True,Cheatsheets for experienced React developers getting started with TypeScript
acme.sh,acmesh-official,Shell,47029,5624,1421,3838,False,False,True,True,A pure Unix shell script ACME client for SSL / TLS certificate automation
okhttp,square,Kotlin,46992,9270,119,5089,False,True,True,True,"Square’s meticulous HTTP client for the JVM, Android, and GraalVM."
nvm-windows,coreybutler,Go,46938,3841,88,4300,False,True,True,True,A node.js version management utility for Windows. Ironically written in Go.
bevy,bevyengine,Rust,46937,4661,3295,2354,True,True,True,True,A refreshingly simple data-driven game engine built in Rust
GitHubDaily,GitHubDaily,,46927,4649,659,2738,False,False,False,True,"坚持分享 GitHub 上高质量、有趣实用的开源技术教程、开发者工具、编程网站、技术资讯。A list cool, interesting projects of GitHub."
serverless,serverless,JavaScript,46915,5730,1221,4088,True,True,True,True,"⚡ Serverless Framework – Effortlessly build apps that auto-scale, incur zero costs when idle, and require minimal maintenance using AWS Lambda and other managed cloud services."
JeecgBoot,jeecgboot,Java,46913,16071,32,2772,False,False,True,True,AI 低代码平台「低代码 + 零代码」双驱动！低代码可一键生成前后端代码;零代码可 5 分钟搭建系统;AI Skills 一句话画流程、设计表单、生成整套系统。内置 AI聊天、知识库、流程编排、MCP插件等，兼容主流大模型。引领「AI 生成 → 在线配置 → 代码生成 → 手工合并->AI修改」开发模式，消除 Java 项目 80% 的重复工作，提效而不失灵活。
v2ray-core,v2ray,Go,46896,8842,19,3951,True,False,True,True,A platform for building proxies to bypass network restrictions.
legado,gedoor,Kotlin,46872,5852,18,2596,False,False,True,True,"Legado 3.0 Book Reader with powerful controls & full functions❤️阅读3.0, 阅读是一款可以自定义来源阅读网络内容的工具，为广大网络文学爱好者提供一种方便、快捷舒适的试读体验。"
aider,Aider-AI,Python,46850,4671,1679,1147,False,True,True,True,aider is AI pair programming in your terminal
awesome-remote-job,lukasz-madon,,46553,4655,45,4197,False,True,True,True,A curated list of awesome remote jobs and resources. Inspired by https://github.com/vinta/awesome-python
30-Days-Of-JavaScript,Asabeneh,JavaScript,46515,10445,367,2380,False,False,False,True,"30 days of JavaScript programming challenge is a step-by-step guide to learn JavaScript programming language in 30 days. This challenge may take more than 100 days,  please just follow your own pace. These videos may help too: https://www.youtube.com/channel/UC7PNRuno1rzYPb1xLa4yktw"
upscayl,upscayl,TypeScript,46511,2298,56,1430,False,False,True,True,"🆙 Upscayl - #1 Free and Open Source AI Image Upscaler for Linux, MacOS and Windows."
prisma,prisma,TypeScript,46419,2256,2632,2566,True,True,True,True,"Next-generation ORM for Node.js & TypeScript | PostgreSQL, MySQL, MariaDB, SQL Server, SQLite, MongoDB and CockroachDB"
monaco-editor,microsoft,JavaScript,46275,4085,829,3674,True,True,True,True,A browser based code editor
claude-cookbooks,anthropics,Jupyter Notebook,46138,5440,267,1049,False,True,True,True,A collection of notebooks/recipes showcasing some fun and effective ways of using Claude.
Agent-Reach,Panniantong,Python,46132,3655,108,126,False,True,True,True,"Give your AI agent eyes to see the entire internet. Read & search Twitter, Reddit, YouTube, GitHub, Bilibili, XiaoHongShu — one CLI, zero API fees."
awesome-cheatsheets,LeCoupa,JavaScript,46115,6707,137,3155,False,False,True,True,"👩‍💻👨‍💻 Awesome cheatsheets for popular programming languages, frameworks and development tools. They include everything you should know in one single file."
learn-regex,ziishaned,,46088,6159,65,3264,False,False,False,True,Learn regex the easy way
airflow,apache,Python,45974,17310,1718,4095,True,True,True,True,"Apache Airflow - A platform to programmatically author, schedule, and monitor workflows"
cal.diy,calcom,TypeScript,45964,14270,1315,1925,True,True,True,True,Scheduling infrastructure for absolutely everyone.
exo,exo-explore,Python,45770,3292,278,735,False,True,True,True,Run frontier AI locally.
Rocket.Chat,RocketChat,TypeScript,45735,13685,3807,4059,True,True,True,True,The Secure CommsOS™ for mission-critical operations
architecture-samples,android,Kotlin,45733,11863,221,3797,False,True,True,True,A collection of samples to discuss and showcase different architectural tools and patterns for Android apps.
awesome-compose,docker,HTML,45707,8219,395,2328,False,True,True,True,Awesome Docker Compose samples
CowAgent,zhayujie,Python,45683,10241,21,1422,False,True,True,True,"Open-source super AI assistant & Agent Harness. Plans tasks, runs tools and skills, self-evolves with memory and knowledge. Multi-model, multi-channel. Lightweight, extensible, one-line install. (formerly chatgpt-on-wechat)"
Umi-OCR,hiroi-sora,Python,45670,4491,352,1555,False,False,False,True,"OCR software, free and offline. 开源、免费的离线OCR软件。支持截屏/批量导入图片，PDF文档识别，排除水印/页眉页脚，扫描/生成二维码。内置多国语言库。"
supervision,roboflow,Python,45667,4054,101,1309,True,True,True,True,We write your reusable computer vision tools. 💜
TTS,coqui-ai,Python,45651,6129,8,2231,True,True,True,True,"🐸💬 - a deep learning toolkit for Text-to-Speech, battle-tested in research and production"
zx,google,JavaScript,45587,1271,49,1882,True,True,True,True,A tool for writing better scripts
AdminLTE,ColorlibHQ,CSS,45482,18202,0,4570,True,True,True,True,AdminLTE - Free admin dashboard template based on Bootstrap 5
jest,jestjs,TypeScript,45462,6663,229,4585,True,True,True,True,Delightful JavaScript Testing.
copyparty,9001,Python,45424,1851,270,2591,True,True,False,True,"Portable file server with accelerated resumable uploads, dedup, WebDAV, SFTP, FTP, TFTP, zeroconf, media indexer, thumbnails++ all in one file"
qlib,microsoft,Python,45414,7227,452,2146,True,False,True,True,"Qlib is an AI-oriented Quant investment platform that aims to use AI tech to empower Quant Research, from exploring ideas to implementing productions. Qlib supports diverse ML modeling paradigms, including supervised learning, market dynamics modeling, and RL, and is now equipped with https://github.com/microsoft/RD-Agent to automate R&D process."
iina,iina,Swift,45396,2851,1879,3479,False,True,True,True,The modern video player for macOS.
shannon,KeygraphHQ,TypeScript,45276,5250,22,276,False,False,True,True,"Shannon is an autonomous, white-box AI pentester for web applications and APIs. It analyzes your source code, identifies attack vectors, and executes real exploits to prove vulnerabilities before they reach production."
Leaflet,Leaflet,JavaScript,45275,6141,569,5759,True,True,True,True,🍃 JavaScript library for mobile-friendly interactive maps 🇺🇦
bruno,usebruno,JavaScript,45237,2621,1742,1371,False,True,True,True,Opensource IDE For Exploring and Testing API's (lightweight alternative to Postman/Insomnia)
CppCoreGuidelines,isocpp,CSS,45135,5551,250,3967,False,True,True,True,"The C++ Core Guidelines are a set of tried-and-true guidelines, rules, and best practices about coding in C++"
Summer2026-Internships,SimplifyJobs,Python,45131,3183,35,2228,False,True,True,True,"Summer 2026 software engineering, data science, AI, quant, product management, and hardware internship postings. Updated daily by Simplify and Pitt CSC."
pandoc,jgm,Haskell,45131,3910,1066,5945,False,True,True,True,Universal markup converter
streamlit,streamlit,Python,45109,4306,1282,2502,True,True,True,True,Streamlit — A faster way to build and share data apps.
cli,cli,Go,45064,8624,1011,2461,True,True,True,True,GitHub’s official command line tool
TrafficMonitor,zhongyang219,C++,45030,3702,1330,3257,False,False,True,True,这是一个用于显示当前网速、CPU及内存利用率的桌面悬浮窗软件，并支持任务栏显示，支持更换皮肤。
