repo_name,organization,language,stars,forks,open_issues,age_days,has_coc,has_contributing,has_workflows,has_readme,description
Ghost,TryGhost,JavaScript,54000,11727,138,4792,True,True,True,True,"Independent technology for modern publishing, memberships, subscriptions and newsletters."
PowerShell,PowerShell,C#,53967,8357,1516,3808,True,True,True,True,PowerShell for every system!
ImHex,WerWolv,C++,53911,2400,371,2045,True,True,True,True,"🔍 A Hex Editor for Reverse Engineers, Programmers and people who value their retinas when working at 3 AM."
crewAI,crewAIInc,Python,53853,7536,477,965,False,True,True,True,"Framework for orchestrating role-playing, autonomous AI agents. By fostering collaborative intelligence, CrewAI empowers agents to work together seamlessly, tackling complex tasks."
core,vuejs,TypeScript,53844,9151,984,2927,False,True,True,True,"🖖 Vue.js is a progressive, incrementally-adoptable JavaScript framework for building UI on the web."
Flowise,FlowiseAI,TypeScript,53695,24532,928,1174,True,True,True,True,"Build AI Agents, Visually"
normalize.css,necolas,CSS,53541,10372,76,5523,False,True,False,True,A modern alternative to CSS resets
English-level-up-tips,byoungd,,53537,5523,30,3306,False,False,True,True,An advanced guide to learn English which might benefit you a lot 🎉 .  离谱的英语学习指南/英语学习教程/英语学习/学英语
pdf.js,mozilla,JavaScript,53461,10635,417,5532,True,True,True,True,PDF Reader in JavaScript
material-design-icons,google,,53456,9726,406,4270,True,True,True,True,Material Design icons by Google (Material Symbols)
jellyfin,jellyfin,C#,53397,5006,585,2748,True,True,True,True,The Free Software Media System - Server Backend & API
kotlin,JetBrains,Kotlin,52882,6337,286,5238,True,True,True,True,The Kotlin Programming Language. 
Docker-OSX,sickcodes,Shell,52594,2881,418,2204,False,False,True,True,Run macOS VM in a Docker! Run near native OSX-KVM in Docker! X11 Forwarding! CI/CD for OS X Security Research! Docker mac Containers.
ionic-framework,ionic-team,TypeScript,52515,13358,630,4684,True,True,True,True,"A powerful cross-platform UI toolkit for building native-quality iOS, Android, and Progressive Web Apps with HTML, CSS, and JavaScript."
awesome-ios,vsouza,Swift,52507,6976,12,4360,True,True,True,True,"A curated list of awesome iOS ecosystem, including Objective-C and Swift Projects "
odoo,odoo,Python,52479,32850,9810,4418,False,True,True,True,Odoo. Open Source Apps To Grow Your Business.
prettier,prettier,JavaScript,52051,4745,1404,3487,True,True,True,True,Prettier is an opinionated code formatter.
Motrix,agalwood,JavaScript,51995,4886,779,2738,True,True,True,True,A full-featured download manager.
chinese-poetry,chinese-poetry,JavaScript,51946,10464,136,3576,False,False,True,True,"The most comprehensive database of Chinese poetry 🧶最全中华古诗词数据库,  唐宋两朝近一万四千古诗人,  接近5.5万首唐诗加26万宋诗.  两宋时期1564位词人，21050首词。"
minimind,jingyaogong,Python,51915,6683,42,691,True,False,True,True,🧠「大模型」2小时完全从0训练64M的小参数LLM！Train a 64M-parameter LLM from scratch in just 2h!
etcd,etcd-io,Go,51851,10396,261,4729,True,True,True,True,Distributed reliable key-value store for the most critical data of a distributed system
windows,dockur,Shell,51723,4375,108,885,False,False,True,True,Windows inside a Docker container.
grok-1,xai-org,Python,51690,8477,125,822,True,False,True,True,Grok open release
lx-music-desktop,lyswhut,TypeScript,51622,6867,1212,2499,False,False,True,True,一个基于 Electron 的音乐软件
freqtrade,freqtrade,Python,51570,10744,32,3318,False,True,True,True,"Free, open source crypto trading bot"
jekyll,jekyll,Ruby,51499,10288,250,6450,True,True,True,True,:globe_with_meridians: Jekyll is a blog-aware static site generator in Ruby
guava,google,Java,51476,11140,742,4402,True,True,True,True,Google core libraries for Java
plane,makeplane,TypeScript,51457,4574,909,1306,True,True,True,True,"🔥🔥🔥 Open-source Jira, Linear, Monday, and ClickUp alternative. Plane is a modern project management platform to manage tasks, sprints, docs, and triage."
MediaCrawler,NanmiCoder,Python,51376,10752,172,1104,False,False,True,True,小红书笔记 | 评论爬虫、抖音视频 | 评论爬虫、快手视频 | 评论爬虫、B 站视频 ｜ 评论爬虫、微博帖子 ｜ 评论爬虫、百度贴吧帖子 ｜ 百度贴吧评论回复爬虫  | 知乎问答文章｜评论爬虫
lazydocker,jesseduffield,Go,51374,1626,277,2587,True,True,True,True,The lazier way to manage everything docker
DefinitelyTyped,DefinitelyTyped,TypeScript,51283,30450,680,5003,False,False,True,True,The repository for high quality TypeScript type definitions.
codegraph,colbymchenry,TypeScript,51268,3118,265,150,False,False,True,True,"Pre-indexed code knowledge graph, auto syncs on code changes, for Claude Code, Codex, Gemini, Cursor, OpenCode, AntiGravity, Kiro, and Hermes Agent — fewer tokens, fewer tool calls, 100% local"
100-Days-Of-ML-Code,Avik-Jain,,51261,11540,68,2904,True,True,False,True,100 Days of ML Coding
go-ethereum,ethereum,Go,51189,21910,373,4556,False,True,True,True,Go implementation of the Ethereum protocol
professional-programming,charlax,Python,51122,3994,3,3876,False,True,False,True,A collection of learning resources for curious software engineers
awesome-wechat-weapp,justjavac,,51110,9021,2,3555,False,False,False,True,微信小程序开发资源汇总 :100:
Semantic-UI,Semantic-Org,JavaScript,51062,4871,1071,4818,False,True,False,True,Semantic is a UI component framework based around useful principles from natural language.
hiring-without-whiteboards,poteto,JavaScript,50878,3895,9,3382,True,True,True,True,⭐️  Companies that don't have a broken hiring process
whisper.cpp,ggml-org,C++,50827,5670,1202,1361,False,True,True,True,Port of OpenAI's Whisper model in C/C++
open-source-ios-apps,dkhamsing,,50764,5788,1,4160,False,True,True,True,:iphone: Collaborative List of Open-Source iOS Apps
litellm,BerriAI,Python,50754,8970,3391,1057,False,True,True,True,"Python SDK, Proxy Server (AI Gateway) to call 100+ LLM APIs in OpenAI (or native) format, with cost tracking, guardrails, loadbalancing and logging. [Bedrock, Azure, OpenAI, VertexAI, Cohere, Anthropic, Sagemaker, HuggingFace, VLLM, NVIDIA NIM]"
dbeaver,dbeaver,Java,50602,4243,3301,3892,True,True,True,True,Free universal database tool and SQL client
Pake,tw93,Rust,50575,10382,0,1342,True,True,True,True,🤱🏻 Turn any webpage into a desktop app with one command.
remotion,remotion-dev,TypeScript,50488,3618,136,2185,True,True,True,True,🎥      Make videos programmatically with React
awesome-openclaw-skills,VoltAgent,,50344,4904,18,143,False,True,True,True,"The awesome collection of OpenClaw skills. 5,400+ skills filtered and categorized from the official OpenClaw Skills Registry.🦞"
Fooocus,lllyasviel,Python,50331,8101,299,1043,False,False,True,True,Focus on prompting and generating
twenty,twentyhq,TypeScript,50331,7321,151,1294,True,True,True,True,"The open alternative to Salesforce, designed for AI."
cypress,cypress-io,TypeScript,50322,3428,1158,4124,True,True,True,True,"Fast, easy and reliable testing for anything that runs in a browser."
penpot,penpot,Clojure,50204,3239,703,3823,True,True,True,True,Penpot: The open-source design tool for design and code collaboration
llama_index,run-llama,Python,50200,7581,481,1324,True,True,True,True,LlamaIndex is the leading document agent and OCR platform
expo,expo,TypeScript,50129,12784,604,3593,False,True,True,True,"An open-source framework for making universal native apps with React. Expo runs on Android, iOS, and the web."
bulma,jgthms,CSS,50070,3895,522,3798,False,True,True,True,Modern CSS framework based on Flexbox
mastodon,mastodon,Ruby,50038,7472,4443,3768,True,True,True,True,"Your self-hosted, globally interconnected microblogging community"
json,nlohmann,C++,49955,7413,73,4731,True,True,True,True,JSON for Modern C++
query,TanStack,TypeScript,49784,3891,197,2472,False,True,True,True,"🤖 Powerful asynchronous state management, server-state utilities and data fetching for the web. TS/JS, React Query, Solid Query, Svelte Query and Vue Query."
hacker-scripts,NARKOZ,JavaScript,49737,6662,70,3861,False,False,False,True,Based on a true story
goose,aaif-goose,Rust,49727,5262,222,663,False,True,True,True,"an open source, extensible AI agent that goes beyond code suggestions - install, execute, edit, and test with any LLM"
alist,AlistGo,Go,49673,7949,566,2002,True,True,True,True,"🗂️A file list/WebDAV program that supports multiple storages, powered by Gin and Solidjs. / 一个支持多存储的文件列表/WebDAV程序，使用 Gin 和 Solidjs。"
huginn,huginn,Ruby,49484,4273,696,4848,False,False,True,True,Create agents that monitor and act on your behalf.  Your agents are standing by!
VibeVoice,microsoft,Python,49459,5514,169,296,True,True,True,True,Open-Source Frontier Voice AI
BMAD-METHOD,bmad-code-org,JavaScript,49293,5703,64,430,True,True,True,True,Breakthrough Method for Agile Ai Driven Development
open-source-mac-os-apps,serhii-londar,,49195,2596,117,3149,False,True,True,True,🚀 Awesome list of open source applications for macOS. https://t.me/s/opensourcemacosapps
jadx,skylot,Java,49108,5550,421,4839,True,True,True,True,Dex to Java decompiler
pandas,pandas-dev,Python,49004,20020,3187,5777,True,True,True,True,"Flexible and powerful data analysis / manipulation library for Python, providing labeled data structures similar to R data.frame objects, statistical functions, and much more"
chinese-independent-developer,1c7,,48920,4197,1,3191,False,True,True,True,👩🏿‍💻👨🏾‍💻👩🏼‍💻👨🏽‍💻👩🏻‍💻中国独立开发者项目列表 -- 分享大家都在做什么
julia,JuliaLang,Julia,48865,5792,4718,5537,True,True,True,True,The Julia Programming Language
terraform,hashicorp,Go,48734,10370,1909,4479,True,True,True,True,"Terraform enables you to safely and predictably create, change, and improve infrastructure. It is a source-available tool that codifies APIs into declarative configuration files that can be shared amongst team members, treated as code, edited, reviewed, and versioned."
kubernetes-the-hard-way,kelseyhightower,,48724,15716,49,3632,False,True,False,True,Bootstrap Kubernetes the hard way. No scripts.
x64dbg,x64dbg,C++,48665,2753,571,4085,True,True,True,True,An open-source user mode debugger for Windows. Optimized for reverse engineering and malware analysis.
Win11Debloat,Raphire,PowerShell,48663,1969,34,2059,False,True,True,True,"A simple, lightweight PowerShell script that allows you to remove pre-installed apps, disable telemetry, as well as perform various other changes to declutter and customize your Windows experience. Win11Debloat works for both Windows 10 and Windows 11."
dayjs,iamkun,JavaScript,48657,2447,1286,2990,False,True,True,True,⏰ Day.js 2kB immutable date-time library alternative to Moment.js with the same modern API
PythonDataScienceHandbook,jakevdp,Jupyter Notebook,48589,18990,230,3598,True,True,False,True,Python Data Science Handbook: full text in Jupyter Notebooks
algorithm-visualizer,algorithm-visualizer,JavaScript,48561,7579,79,3686,True,True,False,True,:fireworks:Interactive Online Platform that Visualizes Algorithms from Code
brew,Homebrew,Ruby,48552,11173,22,3756,True,True,True,True,🍺 The Package Manager for Everywhere
pretext,chenglou,TypeScript,48527,2703,83,102,False,False,True,True,"Fast, accurate & comprehensive text measurement & layout"
awesome-java,akullpp,,48250,7688,27,4361,False,True,True,True,"A curated list of awesome frameworks, libraries and software for the Java programming language."
RxJava,ReactiveX,Java,48234,7585,21,4908,False,True,True,True,RxJava – Reactive Extensions for the JVM – a library for composing asynchronous and event-based programs using observable sequences for the Java VM.
type-challenges,type-challenges,TypeScript,48230,5268,33220,2155,True,False,True,True,Collection of TypeScript type challenges with online judge
htmx,bigskysoftware,JavaScript,48214,1601,666,2256,False,True,True,True,</> htmx - high power tools for HTML
Made-With-ML,GokuMohandas,Jupyter Notebook,48209,7585,25,2782,False,False,True,True,"Learn how to develop, deploy and iterate on production-grade ML applications."
AI-For-Beginners,microsoft,Jupyter Notebook,48190,9987,9,1932,True,False,True,True,"12 Weeks, 24 Lessons, AI for All!"
ClickHouse,ClickHouse,C++,48090,8528,6182,3667,True,True,True,True,ClickHouse® is a real-time analytics database management system
ruff,astral-sh,Rust,48035,2163,2022,1408,True,True,True,True,"An extremely fast Python linter and code formatter, written in Rust."
moment,moment,JavaScript,47967,6989,303,5588,False,True,True,True,"Parse, validate, manipulate, and display dates in javascript."
tldraw,tldraw,TypeScript,47958,3315,453,1865,True,True,True,True,"Build infinite canvas apps in React with the tldraw SDK. World's best, top-most agent recommended #1 five star SDK."
fanqiang,bannedbook,Kotlin,47887,8118,327,4173,False,False,True,True,翻墙-科学上网
design-patterns-for-humans,nilbuild,,47886,5503,16,3408,False,False,False,True,An ultra-simplified explanation to design patterns
awesome-design-patterns,DovAmir,,47801,3262,24,2935,False,True,False,True,A curated list of software and architecture related design patterns.
awesome-react-components,brillout,,47799,3786,56,3645,True,True,True,True,Curated List of React Components & Libraries.
Projects,karan,,47747,10635,122,4731,False,True,False,True,:page_with_curl: A list of practical projects that anyone can solve in any programming language.
metabase,metabase,Clojure,47715,6552,4058,4153,False,True,True,True,The easy-to-use open source Business Intelligence and Embedded Analytics tool that lets everyone work with data :bar_chart:
big-list-of-naughty-strings,minimaxir,Python,47685,2160,108,3966,False,False,False,True,The Big List of Naughty Strings is a list of strings which have a high probability of causing issues when used as user-input data.
gogs,gogs,Go,47609,5070,996,4509,False,True,True,True,The painless way to host your own Git service
cherry-studio,CherryHQ,TypeScript,47489,4499,1184,755,True,True,True,True,"AI productivity studio with smart chat, autonomous agents, and 300+ assistants. Unified access to frontier LLMs"
pixijs,pixijs,TypeScript,47430,5032,344,4895,True,True,True,True,"The HTML5 Creation Engine: Create beautiful digital content with the fastest, most flexible 2D WebGL renderer."
textgen,oobabooga,Python,47329,5977,820,1275,False,False,True,True,"Open-source desktop app for local LLMs. Text, vision, tool-calling, OpenAI/Anthropic-compatible API. 100% private."
discourse,discourse,Ruby,47280,8940,175,4905,True,True,True,True,"A platform for community discussion. Free, open, simple."
slidev,slidevjs,TypeScript,47240,2107,201,1881,True,True,True,True,Presentation Slides for Developers
quill,slab,TypeScript,47159,3655,649,5070,True,True,True,True,Quill is a modern WYSIWYG editor built for compatibility and extensibility
react,typescript-cheatsheets,TypeScript,47067,4294,0,2938,True,True,True,True,Cheatsheets for experienced React developers getting started with TypeScript
spotube,KRTirtho,Dart,47019,2162,812,1950,True,False,True,True,🎧 Open source music streaming app! Available for both desktop & mobile!
frontend-dev-bookmarks,dypsilon,,46983,5148,134,4743,False,True,False,True,Manually curated collection of resources for frontend web developers.
okhttp,square,Kotlin,46973,9271,112,5077,False,True,True,True,"Square’s meticulous HTTP client for the JVM, Android, and GraalVM."
LocalAI,mudler,Go,46952,4147,196,1187,False,True,True,True,"LocalAI is the open-source AI engine. Run any model - LLMs, vision, voice, image, video - on any hardware. No GPU required."
acme.sh,acmesh-official,Shell,46935,5604,1411,3826,False,False,True,True,A pure Unix shell script ACME client for SSL / TLS certificate automation
serverless,serverless,JavaScript,46917,5729,1218,4076,True,True,True,True,"⚡ Serverless Framework – Effortlessly build apps that auto-scale, incur zero costs when idle, and require minimal maintenance using AWS Lambda and other managed cloud services."
v2ray-core,v2ray,Go,46878,8843,19,3939,True,False,True,True,A platform for building proxies to bypass network restrictions.
legado,gedoor,Kotlin,46873,5796,18,2584,False,False,True,True,"Legado 3.0 Book Reader with powerful controls & full functions❤️阅读3.0, 阅读是一款可以自定义来源阅读网络内容的工具，为广大网络文学爱好者提供一种方便、快捷舒适的试读体验。"
nvm-windows,coreybutler,Go,46827,3838,91,4288,False,True,True,True,A node.js version management utility for Windows. Ironically written in Go.
GitHubDaily,GitHubDaily,,46815,4645,649,2726,False,False,False,True,"坚持分享 GitHub 上高质量、有趣实用的开源技术教程、开发者工具、编程网站、技术资讯。A list cool, interesting projects of GitHub."
JeecgBoot,jeecgboot,Java,46772,16058,33,2760,False,False,True,True,AI 低代码平台「低代码 + 零代码」双驱动！低代码可一键生成前后端代码;零代码可 5 分钟搭建系统;AI Skills 一句话画流程、设计表单、生成整套系统。内置 AI聊天、知识库、流程编排、MCP插件等，兼容主流大模型。引领「AI 生成 → 在线配置 → 代码生成 → 手工合并->AI修改」开发模式，消除 Java 项目 80% 的重复工作，提效而不失灵活。
awesome-claude-code,hesreallyhim,Python,46748,4075,489,424,True,True,True,True,"A curated list of awesome skills, hooks, slash-commands, agent orchestrators, applications, and plugins for Claude Code by Anthropic"
tmux,tmux,C,46675,2696,35,4032,False,True,True,True,tmux source code
bevy,bevyengine,Rust,46671,4630,3220,2342,True,True,True,True,A refreshingly simple data-driven game engine built in Rust
30-Days-Of-JavaScript,Asabeneh,JavaScript,46469,10441,367,2368,False,False,False,True,"30 days of JavaScript programming challenge is a step-by-step guide to learn JavaScript programming language in 30 days. This challenge may take more than 100 days,  please just follow your own pace. These videos may help too: https://www.youtube.com/channel/UC7PNRuno1rzYPb1xLa4yktw"
awesome-remote-job,lukasz-madon,,46418,4641,41,4185,False,True,True,True,A curated list of awesome remote jobs and resources. Inspired by https://github.com/vinta/awesome-python
aider,Aider-AI,Python,46402,4617,1631,1135,False,True,True,True,aider is AI pair programming in your terminal
prisma,prisma,TypeScript,46318,2244,2619,2554,True,True,True,True,"Next-generation ORM for Node.js & TypeScript | PostgreSQL, MySQL, MariaDB, SQL Server, SQLite, MongoDB and CockroachDB"
monaco-editor,microsoft,JavaScript,46203,4077,828,3662,True,True,True,True,A browser based code editor
taste-skill,Leonxlnx,JavaScript,46181,3216,28,118,False,False,True,True,"Taste-Skill - gives your AI good taste. stops the AI from generating boring, generic slop "
upscayl,upscayl,TypeScript,46131,2275,57,1418,False,False,True,True,"🆙 Upscayl - #1 Free and Open Source AI Image Upscaler for Linux, MacOS and Windows."
learn-regex,ziishaned,,46100,6163,65,3252,False,False,False,True,Learn regex the easy way
awesome-cheatsheets,LeCoupa,JavaScript,46038,6709,136,3143,False,False,True,True,"👩‍💻👨‍💻 Awesome cheatsheets for popular programming languages, frameworks and development tools. They include everything you should know in one single file."
airflow,apache,Python,45855,17256,1720,4083,True,True,True,True,"Apache Airflow - A platform to programmatically author, schedule, and monitor workflows"
architecture-samples,android,Kotlin,45720,11864,221,3785,False,True,True,True,A collection of samples to discuss and showcase different architectural tools and patterns for Android apps.
cal.diy,calcom,TypeScript,45638,14104,1305,1913,True,True,True,True,Scheduling infrastructure for absolutely everyone.
Rocket.Chat,RocketChat,TypeScript,45634,13658,3779,4047,True,True,True,True,The Secure CommsOS™ for mission-critical operations
claude-cookbooks,anthropics,Jupyter Notebook,45623,5320,244,1037,False,True,True,True,A collection of notebooks/recipes showcasing some fun and effective ways of using Claude.
TTS,coqui-ai,Python,45580,6117,8,2219,True,True,True,True,"🐸💬 - a deep learning toolkit for Text-to-Speech, battle-tested in research and production"
awesome-compose,docker,HTML,45574,8208,386,2316,False,True,True,True,Awesome Docker Compose samples
zx,google,JavaScript,45546,1268,53,1870,True,True,True,True,A tool for writing better scripts
AdminLTE,ColorlibHQ,CSS,45464,18208,2,4558,True,True,True,True,AdminLTE - Free admin dashboard template based on Bootstrap 5
jest,jestjs,TypeScript,45456,6664,239,4573,True,True,True,True,Delightful JavaScript Testing.
exo,exo-explore,Python,45411,3251,263,723,False,True,True,True,Run frontier AI locally.
CowAgent,zhayujie,Python,45387,10207,22,1410,False,True,True,True,"Open-source super AI assistant & Agent Harness. Plans tasks, runs tools and skills, self-evolves with memory and knowledge. Multi-model, multi-channel. Lightweight, extensible, one-line install. (formerly chatgpt-on-wechat)"
Umi-OCR,hiroi-sora,Python,45347,4457,350,1543,False,False,False,True,"OCR software, free and offline. 开源、免费的离线OCR软件。支持截屏/批量导入图片，PDF文档识别，排除水印/页眉页脚，扫描/生成二维码。内置多国语言库。"
copyparty,9001,Python,45255,1845,266,2579,True,True,False,True,"Portable file server with accelerated resumable uploads, dedup, WebDAV, SFTP, FTP, TFTP, zeroconf, media indexer, thumbnails++ all in one file"
iina,iina,Swift,45251,2840,1877,3468,False,True,True,True,The modern video player for macOS.
Leaflet,Leaflet,JavaScript,45209,6132,553,5747,True,True,True,True,🍃 JavaScript library for mobile-friendly interactive maps 🇺🇦
CppCoreGuidelines,isocpp,CSS,45103,5549,251,3955,False,True,True,True,"The C++ Core Guidelines are a set of tried-and-true guidelines, rules, and best practices about coding in C++"
streamlit,streamlit,Python,44996,4288,1306,2490,True,True,True,True,Streamlit — A faster way to build and share data apps.
bruno,usebruno,JavaScript,44980,2591,1730,1359,False,True,True,True,Opensource IDE For Exploring and Testing API's (lightweight alternative to Postman/Insomnia)
Summer2026-Internships,SimplifyJobs,Python,44954,3178,36,2216,False,True,True,True,"Summer 2026 software engineering, data science, AI, quant, product management, and hardware internship postings. Updated daily by Simplify and Pitt CSC."
helix,helix-editor,Rust,44937,3554,1562,2208,False,True,True,True,A post-modern modal text editor.
pyenv,pyenv,Shell,44901,3252,54,5039,False,True,True,True,Simple Python version management
grpc,grpc,C++,44892,11161,1316,4209,True,True,True,True,"C++ based gRPC (C++, Python, Ruby, Objective-C, PHP, C#)"
cli,cli,Go,44885,8571,1005,2449,True,True,True,True,GitHub’s official command line tool
edex-ui,GitSquared,JavaScript,44875,3131,6,3427,False,False,True,True,"A cross-platform, customizable science fiction terminal emulator with advanced monitoring & touchscreen support."
TrafficMonitor,zhongyang219,C++,44858,3702,1324,3245,False,False,True,True,这是一个用于显示当前网速、CPU及内存利用率的桌面悬浮窗软件，并支持任务栏显示，支持更换皮肤。
pandoc,jgm,Haskell,44853,3902,1064,5933,False,True,True,True,Universal markup converter
milvus,milvus-io,Go,44826,4072,890,2467,True,True,True,True,"Milvus is a high-performance, cloud-native vector database built for scalable vector ANN search"
meteor,meteor,JavaScript,44786,5247,396,5264,True,True,True,True,"Meteor, the JavaScript App Platform"
RSSHub,DIYgod,TypeScript,44784,9934,352,2998,True,True,True,True,🧡 Everything is RSSible
react-hook-form,react-hook-form,TypeScript,44763,2420,43,2661,True,True,True,True,📋 React Hooks for form state management and validation (Web + React Native)
shannon,KeygraphHQ,TypeScript,44758,5190,12,264,False,False,True,True,"Shannon Lite is an autonomous, white-box AI pentester for web applications and APIs. It analyzes your source code, identifies attack vectors, and executes real exploits to prove vulnerabilities before they reach production."
qlib,microsoft,Python,44682,7085,426,2134,True,False,True,True,"Qlib is an AI-oriented Quant investment platform that aims to use AI tech to empower Quant Research, from exploring ideas to implementing productions. Qlib supports diverse ML modeling paradigms, including supervised learning, market dynamics modeling, and RL, and is now equipped with https://github.com/microsoft/RD-Agent to automate R&D process."
reactjs-interview-questions,sudheerj,JavaScript,44647,10368,15,2939,False,False,True,True,List of top 500 ReactJS Interview Questions & Answers....Coding exercise questions are coming soon!!
hyper,vercel,TypeScript,44602,3565,1043,3639,False,False,True,True,A terminal built on web technologies
supervision,roboflow,Python,44552,3956,109,1297,True,True,True,True,We write your reusable computer vision tools. 💜
siyuan,siyuan-note,TypeScript,44495,2841,322,2117,True,True,True,True,"A privacy-first, self-hosted, fully open source personal knowledge management software, written in typescript and golang."
nanobot,HKUDS,Python,44406,7847,875,137,False,True,True,True,"Lightweight, open-source AI agent for your tools, chats, and workflows."
jsoncrack.com,AykutSarac,TypeScript,44136,3549,34,1599,True,True,True,True,"✨ Innovative and open-source visualization application that transforms various data formats, such as JSON, YAML, XML and CSV into interactive graphs."
