repo_name,organization,language,stars,forks,open_issues,age_days,has_coc,has_contributing,has_workflows,has_readme,description
AFFiNE,toeverything,TypeScript,66294,4635,559,1327,True,True,True,True,"There can be more than Notion and Miro. AFFiNE(pronounced [ə‘fain]) is a next-gen knowledge base that brings planning, sorting and creating all together. Privacy first, open-source, customizable and ready to use. "
annotated_deep_learning_paper_implementations,labmlai,Python,66055,6649,29,2033,False,False,True,True,"🧑‍🏫 60+ Implementations/tutorials of deep learning papers with side-by-side notes 📝; including transformers (original, xl, switch, feedback, vit, ...), optimizers (adam, adabelief, sophia, ...), gans(cyclegan, stylegan2, ...), 🎮 reinforcement learning (ppo, dqn), capsnet, distillation, ... 🧠"
webpack,webpack,JavaScript,66021,9331,201,5122,True,True,True,True,"A bundler for javascript and friends. Packs many modules into a few bundled assets. Code Splitting allows for loading parts of the application on demand. Through ""loaders"", modules can be CommonJs, AMD, ES6 modules, CSS, Images, JSON, Coffeescript, LESS, ... and your custom stuff."
echarts,apache,TypeScript,65973,19838,1755,4734,True,True,True,True,"Apache ECharts is a powerful, interactive charting and data visualization library for browser"
ChinaTextbook,TapXWorld,Roff,65961,14709,98,2266,False,False,False,True,所有小初高、大学PDF教材。
ghidra,NationalSecurityAgency,Java,65929,7261,1859,2576,False,True,True,True,Ghidra is a software reverse engineering (SRE) framework
gpt4free,xtekky,Python,65800,13646,8,1086,True,True,True,True,The official gpt4free repository | various collection of powerful language models | opus 4.6 gpt 5.3 kimi 2.5 deepseek v3.2 gemini 3
MetaGPT,FoundationAgents,Python,65637,8270,94,993,False,False,True,True,"🌟 The Multi-Agent Framework: First AI Software Company, Towards Natural Language Programming"
scikit-learn,scikit-learn,Python,65450,26823,2153,5693,True,True,True,True,scikit-learn: machine learning in Python
awesome-nodejs,sindresorhus,,65356,6208,30,4269,True,True,True,True,":zap: Delightful Node.js packages and resources [BECAUSE OF TOO MUCH SPAM AND LOW-QUALITY SUBMISSIONS, SUBMISSIONS ARE PAUSED UNTIL SEPTEMBER]"
javascript-questions,lydiahallie,,65303,9239,48,2472,False,False,False,True,"A long list of (advanced) JavaScript questions, and their explanations :sparkles:  "
Java,TheAlgorithms,Java,65243,21035,46,3533,True,True,True,True,All Algorithms implemented in Java
design-resources-for-developers,bradtraversy,,65053,11991,28,2143,False,True,False,True,"Curated list of design and UI resources from stock photos, web templates, CSS frameworks, UI libraries, tools and much more"
nocode,kelseyhightower,Dockerfile,65028,4822,4691,2963,False,True,False,True,The best way to write secure and reliable applications. Write nothing; deploy nowhere.
interviews,kdn251,Java,64939,12922,118,3320,False,False,False,True,Everything you need to know to get the job.
localstack,localstack,Python,64704,4606,1,3432,True,True,True,True,💻 A fully functional local AWS cloud stack. Develop and test your cloud & Serverless apps offline
Apollo-11,chrislgarry,Assembly,64702,7383,125,4368,False,True,True,True,Original Apollo 11 Guidance Computer (AGC) source code for the command and lunar modules.
docusaurus,facebook,TypeScript,64199,9787,360,3194,True,True,True,True,Easy to maintain open source documentation websites.
keras,keras-team,Python,63939,19748,263,4010,False,True,True,True,Deep Learning for humans
OpenBB,OpenBB-finance,Python,63338,6234,66,1915,True,False,True,True,"Financial data platform for analysts, quants and AI agents."
prometheus,prometheus,Go,63238,10252,755,4863,True,True,True,True,The Prometheus monitoring system and time series database.
alacritty,alacritty,Rust,63036,3350,335,3682,False,True,True,True,"A cross-platform, OpenGL terminal emulator."
socket.io,socketio,TypeScript,62978,10160,205,5852,False,True,True,True,Realtime application framework (Node.JS server)
resume.github.com,resume,JavaScript,62817,1363,71,5520,False,False,False,True,Resumes generated using the GitHub informations
open-interpreter,openinterpreter,Python,62794,5419,310,979,False,True,True,True,A natural language interface for computers
nocodb,nocodb,TypeScript,62499,4673,639,3063,True,True,True,True,🔥 🔥 🔥 A Free & Self-hostable Airtable Alternative
traefik,traefik,Go,62271,5884,774,3840,True,True,True,True,The Cloud Native Application Proxy
crawl4ai,unclecode,Python,62268,6353,32,679,True,False,True,True,"🚀🤖 Crawl4AI: Open-source LLM Friendly Web Crawler & Scraper. Don't be shy, join here: https://discord.gg/jP8KfhDhyN"
rustlings,rust-lang,Rust,62220,11172,84,3839,False,True,True,True,:crab: Small exercises to get you used to reading and writing Rust code!
uBlock,gorhill,JavaScript,62187,3982,17,4005,False,True,True,True,uBlock Origin - An efficient blocker for Chromium and Firefox. Fast and lean.
nerd-fonts,ryanoasis,CSS,62075,3872,64,4123,True,True,True,True,"Iconic font aggregator, collection, & patcher. 3,600+ icons, 50+ patched fonts: Hack, Source Code Pro, more. Glyph collections: Font Awesome, Material Design Icons, Octicons, & more"
sway,FuelLabs,Rust,61866,5428,890,1885,False,False,True,True,🌴 Empowering everyone to build reliable and efficient smart contracts.
tldr,tldr-pages,Markdown,61725,5121,255,4484,False,True,True,True,Collaborative cheatsheets for console commands 📚.
lodash,lodash,JavaScript,61580,7125,131,5095,False,True,True,True,"A modern JavaScript utility library delivering modularity, performance, & extras."
redux,reduxjs,TypeScript,61460,15120,41,3947,True,True,True,True,A JS library for predictable global state management
ladybird,LadybirdBrowser,C++,61408,2877,667,658,True,True,True,True,Truly independent web browser
ripgrep,BurntSushi,Rust,61140,2444,130,3661,False,False,True,True,ripgrep recursively searches directories for a regex pattern while respecting your gitignore
pathway,pathwaycom,Python,61095,1610,37,1208,True,True,True,True,"Python ETL framework for stream processing, real-time analytics, LLM pipelines, and RAG."
atom,atom,JavaScript,61002,17272,994,5172,True,True,False,True,:atom: The hackable text editor
scrapy,scrapy,Python,60886,11379,655,5870,True,True,True,True,"Scrapy, a fast high-level web crawling & scraping framework for Python."
architect-awesome,xingshaocheng,,60847,17781,64,2904,False,False,False,True,后端架构师技术图谱
Front-end-Developer-Interview-Questions,h5bp,Nunjucks,60804,11068,50,5152,True,True,True,True,"A list of helpful front-end related questions you can use to interview potential candidates, test yourself or completely ignore."
leetcode-master,youngyangyang04,Shell,60804,12337,242,2287,False,False,False,True,《代码随想录》LeetCode 刷题攻略：200道经典题目刷题顺序，共60w字的详细图解，视频难点剖析，50余张思维导图，支持C++，Java，Python，Go，JavaScript等多语言版本，从此算法学习不再迷茫！🔥🔥 来看看，你会发现相见恨晚！🚀 
minio,minio,Go,60516,7282,80,4082,True,True,True,True,"MinIO is a high-performance, S3 compatible object store, open sourced under GNU AGPLv3 license."
openpilot,commaai,Python,60370,10716,270,3403,False,True,True,True,"openpilot is an operating system for robotics. Currently, it upgrades the driver assistance system on 300+ supported cars."
markdown-here,adam-p,JavaScript,60175,11106,317,5059,False,True,False,True,"Google Chrome, Firefox, and Thunderbird extension that lets you write email in Markdown and render it before sending."
drawio-desktop,jgraph,JavaScript,59929,5617,66,3220,True,False,True,True,Official electron build of draw.io
nuxt,nuxt,TypeScript,59898,5576,915,3431,True,True,True,True,The Full-Stack Vue Framework.
jquery,jquery,JavaScript,59873,20472,97,6194,True,True,True,True,jQuery JavaScript Library
git,git,C,59791,27669,355,6448,True,True,True,True,Git Source Code Mirror - This is a publish-only repository but pull requests can be turned into patches to the mailing list via GitGitGadget (https://gitgitgadget.github.io/). Please follow Documentation/SubmittingPatches procedure for any of your improvements.
spring-framework,spring-projects,Java,59779,38911,362,5581,True,True,True,True,Spring Framework
30-Days-Of-Python,Asabeneh,Python,59758,11392,101,2312,False,False,True,True,The 30 Days of Python programming challenge is a step-by-step guide to learn the Python programming language in 30 days. This challenge may take more than 100 days. Follow your own pace. These videos may help too: https://www.youtube.com/channel/UC7PNRuno1rzYPb1xLa4yktw
Real-Time-Voice-Cloning,CorentinJ,Python,59536,9423,170,2489,False,False,True,True,Clone a voice in 5 seconds to generate arbitrary speech in real-time
Magisk,topjohnwu,Kotlin,59383,17022,48,3479,False,False,True,True,The Magic Mask for Android
awesome-flutter,Solido,Dart,59339,6873,24,3238,False,True,True,True,"An awesome list that curates the best Flutter libraries, tools, tutorials, articles and more."
shadowsocks-windows,shadowsocks,C#,59283,16289,199,4812,False,True,False,True,A C# port of shadowsocks
llama,meta-llama,Python,59241,9821,515,1129,True,True,True,True,Inference code for Llama models
cline,cline,TypeScript,59169,5998,796,621,True,True,True,True,"Autonomous coding agent right in your IDE, capable of creating/editing files, executing commands, using the browser, and more with your permission every step of the way."
angular.js,angular,JavaScript,58910,27223,461,5917,True,True,False,True,AngularJS - HTML enhanced for web apps!
awesome-chatgpt-prompts-zh,PlexPt,,58783,13573,43,1194,False,False,False,True,ChatGPT 中文调教指南。各种场景使用指南。学习怎么让它听你的话。
mkcert,FiloSottile,Go,58340,3047,165,2824,True,True,True,True,A simple zero-config tool to make locally trusted development certificates with any names you'd like.
rails,rails,Ruby,58338,22179,1508,6552,True,True,True,True,Ruby on Rails
FFmpeg,FFmpeg,C,58066,13590,3,5453,False,True,False,True,Mirror of https://git.ffmpeg.org/ffmpeg.git
memos,usememos,Go,58058,4209,25,1562,False,False,True,True,"Open-source, self-hosted note-taking tool built for quick capture. Markdown-native, lightweight, and fully yours."
llm-app,pathwaycom,Jupyter Notebook,57780,1392,8,974,True,True,True,True,"Ready-to-run cloud templates for RAG, AI pipelines, and enterprise search with live data. 🐳Docker-friendly.⚡Always in sync with Sharepoint, Google Drive, S3, Kafka, PostgreSQL, real-time data APIs, and more."
bat,sharkdp,Rust,57744,1496,346,2889,False,True,True,True,A cat(1) clone with wings.
astro,withastro,TypeScript,57699,3237,272,1830,True,True,True,True,The web framework for content-driven websites. ⭐️ Star to support our work!
zustand,pmndrs,TypeScript,57476,2006,4,2536,False,True,True,True,🐻 Bear necessities for state management in React
html5-boilerplate,h5bp,JavaScript,57401,12302,24,5898,True,True,True,True,"A professional front-end template for building fast, robust, and adaptable web apps or sites."
fuel-core,FuelLabs,Rust,57280,2866,190,2030,False,True,True,True,Rust full node implementation of the Fuel v2 protocol.
DeepLearning-500-questions,scutan90,JavaScript,57234,15969,121,2822,False,False,False,True,深度学习500问，以问答形式对常用的概率知识、线性代数、机器学习、深度学习、计算机视觉等热点问题进行阐述，以帮助自己及有需要的读者。 全书分为18个章节，50余万字。由于水平有限，书中不妥之处恳请广大读者批评指正。   未完待续............ 如有意合作，联系scutjy2015@163.com                     版权所有，违权必究       Tan 2018.06
private-gpt,zylon-ai,Python,57189,7607,292,1052,False,False,True,True,"Interact with your documents using the power of GPT, 100% privately, no data leaks"
yolov5,ultralytics,Python,57053,17445,45,2132,True,True,True,True,YOLOv5 🚀 in PyTorch > ONNX > CoreML > TFLite
vaultwarden,dani-garcia,Rust,57015,2645,39,2952,False,False,True,True,"Unofficial Bitwarden compatible server written in Rust, formerly known as bitwarden_rs"
pocketbase,pocketbase,Go,56832,3181,24,1353,False,True,True,True,Open Source realtime backend in 1 file
unsloth,unslothai,Python,56826,4768,997,841,True,True,True,True,"Unified web UI for training and running open models like Qwen, DeepSeek, gpt-oss and Gemma locally."
you-get,soimort,Python,56791,9780,381,4959,False,True,True,True,:arrow_double_down: Dumb downloader that scrapes the web
MinerU,opendatalab,Python,56610,4690,196,749,False,False,True,True,Transforms complex documents like PDFs into LLM-ready markdown/JSON for your Agentic workflows.
meilisearch,meilisearch,Rust,56540,2440,279,2887,True,True,True,True,A lightning-fast search engine API bringing AI-powered hybrid search to your sites and applications.
anything-llm,Mintplex-Labs,JavaScript,56490,6099,306,1020,False,True,True,True,The all-in-one AI productivity accelerator. On device and privacy first with no annoying setup or configuration.
react-router,remix-run,TypeScript,56319,10851,156,4325,True,True,True,True,Declarative routing for React
awesome-rust,rust-unofficial,Rust,56246,3241,12,4263,False,True,True,True,A curated list of Rust code and resources.
face_recognition,ageitgey,Python,56221,13716,831,3303,False,True,True,True,The world's simplest facial recognition api for Python and the command line
pi-hole,pi-hole,Shell,56186,2998,57,4302,True,True,True,True,A black hole for Internet advertisements
docling,docling-project,Python,56147,3808,857,618,True,True,True,True,Get your documents ready for gen AI
rclone,rclone,Go,56128,4986,1148,4386,True,True,True,True,"""rsync for cloud storage"" - Google Drive, S3, Dropbox, Backblaze B2, One Drive, Swift, Hubic, Wasabi, Google Cloud Storage, Azure Blob, Azure Files, Yandex Files"
gatsby,gatsbyjs,JavaScript,55952,10223,353,3955,True,True,True,True,"React-based framework with performance, scalability, and security built in."
GPT-SoVITS,RVC-Boss,Python,55941,6111,867,795,False,False,True,True,1 min voice data can also be used to train a good TTS model! (few shot voice cloning)
autogen,microsoft,Python,55907,8425,687,944,True,True,True,True,A programming framework for agentic AI
leetcode,azl397985856,JavaScript,55817,9438,10,2911,False,True,False,True,LeetCode Solutions: A Record of My Problem Solving Journey.( leetcode题解，记录自己的leetcode解题之路。)
rich,Textualize,Python,55810,2064,309,2321,True,True,True,True,Rich is a Python library for rich text and beautiful formatting in the terminal.
github-cheat-sheet,tiimgreen,,55737,5404,43,4359,False,True,False,True,A list of cool features of Git and GitHub.
agency-agents,msitarzewski,Shell,55713,8344,78,157,False,True,True,True,"A complete AI agency at your fingertips - From frontend wizards to Reddit community ninjas, from whimsy injectors to reality checkers. Each agent is a specialized expert with personality, processes, and proven deliverables."
awesome-android-ui,wasabeef,,55696,10273,38,4104,True,False,False,True,A curated list of awesome Android UI/UX libraries
project-layout,golang-standards,Makefile,55576,5442,98,3113,False,False,False,True,Standard Go Project Layout
OpenManus,FoundationAgents,Python,55376,9689,529,378,True,False,True,True,"No fortress, purely open ground.  OpenManus is Coming."
hackingtool,Z4nzu,Python,55267,6017,2,2168,False,False,True,True,ALL IN ONE Hacking Tool For Hackers
nanoGPT,karpathy,Python,55231,9408,340,1178,False,False,False,True,"The simplest, fastest repository for training/finetuning medium-sized GPTs."
gpt-engineer,AntonOsika,Python,55230,7320,68,1055,True,True,True,True,CLI platform to experiment with codegen. Precursor to: https://lovable.dev
appwrite,appwrite,TypeScript,55173,5104,735,2537,True,True,True,True,"Appwrite® - complete cloud infrastructure for your web, mobile and AI apps. Including Auth, Databases, Storage, Functions, Messaging, Hosting, Realtime and more"
faceswap,deepfakes,Python,55056,13417,5,3012,True,False,True,True,Deepfakes Software For All
starship,starship,Rust,54958,2423,985,2544,True,True,True,True,"☄🌌️  The minimal, blazing-fast, and infinitely customizable prompt for any shell!"
ultralytics,ultralytics,Python,54706,10522,305,1285,True,True,True,True,Ultralytics YOLO 🚀
marktext,marktext,JavaScript,54569,4039,1406,3049,True,True,True,True,"📝A simple and elegant markdown editor, available for Linux, macOS and Windows."
ai-agents-for-beginners,microsoft,Jupyter Notebook,54494,18858,2,476,True,False,True,True,12 Lessons to Get Started Building AI Agents
gitea,go-gitea,Go,54384,6490,2857,3426,True,True,True,True,"Git with a cup of tea! Painless self-hosted all-in-one software development service, including Git hosting, code review, team collaboration, package registry and CI/CD"
ChatGPT,lencx,Rust,54368,6194,924,1198,False,False,True,True,"🔮 ChatGPT Desktop Application (Mac, Windows and Linux)"
element,ElemeFE,Vue,54198,14529,2967,3484,False,False,True,True,A Vue.js 2.0 UI Toolkit for Web
maybe,maybe-finance,Ruby,54049,5453,0,808,False,True,True,True,The personal finance app for everyone
joplin,laurent22,TypeScript,53972,5975,615,3349,False,True,True,True,"Joplin - the privacy-focused note taking app with sync capabilities for Windows, macOS, Linux, Android and iOS."
requests,psf,Python,53876,9787,298,5513,True,True,True,True,"A simple, yet elegant, HTTP library."
normalize.css,necolas,CSS,53762,10462,74,5433,False,True,False,True,A modern alternative to CSS resets
segment-anything,facebookresearch,Jupyter Notebook,53711,6290,592,1092,True,True,True,True,"The repository provides code for running inference with the SegmentAnything Model (SAM), links for downloading the trained model checkpoints, and example notebooks that show how to use the model."
dive,wagoodman,Go,53613,1972,203,2867,False,False,True,True,A tool for exploring each layer in a docker image
powerlevel10k,romkatv,Shell,53375,2394,137,2580,False,False,False,True,A Zsh theme
core,vuejs,TypeScript,53276,9070,992,2837,False,True,True,True,"🖖 Vue.js is a progressive, incrementally-adoptable JavaScript framework for building UI on the web."
trackerslist,ngosang,,53234,6629,12,3616,False,False,True,True,Updated list of public BitTorrent trackers
first-contributions,firstcontributions,,53070,99780,265,3467,True,True,True,True,🚀✨ Help beginners to contribute to open source projects
n8n-workflows,Zie619,Python,53069,6871,20,309,False,False,True,True,all of the workflows of n8n i could find (also from the site itself)
pdf.js,mozilla,JavaScript,53002,10599,476,5441,True,True,True,True,PDF Reader in JavaScript
material-design-icons,google,,52998,9734,400,4180,True,True,True,True,Material Design icons by Google (Material Symbols)
ImHex,WerWolv,C++,52921,2342,336,1955,True,True,True,True,"🔍 A Hex Editor for Reverse Engineers, Programmers and people who value their retinas when working at 3 AM."
Free-Certifications,cloudcommunity,,52806,3501,67,2057,False,False,False,True,A curated list of free courses with certifications. Also available at https://free-certifications.com/
kotlin,JetBrains,Kotlin,52476,6262,218,5148,True,True,True,True,The Kotlin Programming Language. 
ionic-framework,ionic-team,TypeScript,52414,13400,626,4594,True,True,True,True,"A powerful cross-platform UI toolkit for building native-quality iOS, Android, and Progressive Web Apps with HTML, CSS, and JavaScript."
v2rayNG,2dust,Kotlin,52394,7043,19,2501,False,False,True,True,"A V2Ray client for Android, support Xray core and v2fly core"
Docker-OSX,sickcodes,Shell,52313,2906,415,2114,False,False,True,True,Run macOS VM in a Docker! Run near native OSX-KVM in Docker! X11 Forwarding! CI/CD for OS X Security Research! Docker mac Containers.
termux-app,termux,Java,52205,6231,503,3800,False,False,True,True,Termux - a terminal emulator application for Android OS extendible by variety of packages.
typst,typst,Rust,52167,1509,1148,2368,False,True,True,True,A markup-based typesetting system that is powerful and easy to learn.
Ghost,TryGhost,JavaScript,52101,11385,374,4702,True,True,True,True,"Independent technology for modern publishing, memberships, subscriptions and newsletters."
PowerShell,PowerShell,C#,51933,8223,1416,3718,True,True,True,True,PowerShell for every system!
coolify,coollabsio,PHP,51881,3849,673,1879,True,True,True,True,"An open-source, self-hostable PaaS alternative to Vercel, Heroku & Netlify that lets you easily deploy static sites, databases, full-stack applications and 280+ one-click services on your own servers."
prettier,prettier,JavaScript,51772,4685,1454,3397,True,True,True,True,Prettier is an opinionated code formatter.
etcd,etcd-io,Go,51684,10341,234,4639,True,True,True,True,Distributed reliable key-value store for the most critical data of a distributed system
awesome-ios,vsouza,Swift,51568,6965,18,4270,True,True,True,True,"A curated list of awesome iOS ecosystem, including Objective-C and Swift Projects "
grok-1,xai-org,Python,51532,8476,126,732,True,False,True,True,Grok open release
guava,google,Java,51506,11150,721,4312,True,True,True,True,Google core libraries for Java
jekyll,jekyll,Ruby,51480,10296,242,6359,True,True,True,True,:globe_with_meridians: Jekyll is a blog-aware static site generator in Ruby
chinese-poetry,chinese-poetry,JavaScript,51123,10328,128,3486,False,False,True,True,"The most comprehensive database of Chinese poetry 🧶最全中华古诗词数据库,  唐宋两朝近一万四千古诗人,  接近5.5万首唐诗加26万宋诗.  两宋时期1564位词人，21050首词。"
Semantic-UI,Semantic-Org,JavaScript,51122,4895,1074,4728,False,True,False,True,Semantic is a UI component framework based around useful principles from natural language.
DefinitelyTyped,DefinitelyTyped,TypeScript,51093,30572,693,4913,False,False,True,True,The repository for high quality TypeScript type definitions.
Motrix,agalwood,JavaScript,51070,4828,774,2648,True,True,True,True,A full-featured download manager.
go-ethereum,ethereum,Go,50933,21864,374,4466,False,True,True,True,Go implementation of the Ethereum protocol
Flowise,FlowiseAI,TypeScript,50925,23982,807,1084,True,True,True,True,"Build AI Agents, Visually"
professional-programming,charlax,Python,50675,3972,2,3785,False,True,False,True,A collection of learning resources for curious software engineers
awesome-wechat-weapp,justjavac,,50648,9012,2,3465,False,False,False,True,微信小程序开发资源汇总 :100:
windows,dockur,Shell,50643,4151,114,795,False,False,True,True,Windows inside a Docker container.
hiring-without-whiteboards,poteto,JavaScript,50506,3882,38,3291,True,True,True,True,⭐️  Companies that don't have a broken hiring process
mem0,mem0ai,Python,50458,5626,647,1003,False,True,True,True,Universal memory layer for AI Agents
MoneyPrinterTurbo,harry0703,Python,50396,7175,233,739,False,False,True,True,利用AI大模型，一键生成高清短视频 Generate short videos with one click using AI LLM.
lazydocker,jesseduffield,Go,50242,1592,261,2497,True,True,True,True,The lazier way to manage everything docker
bulma,jgthms,CSS,50062,3904,521,3708,False,True,True,True,Modern CSS framework based on Flexbox
100-Days-Of-ML-Code,Avik-Jain,,49987,11358,66,2814,True,True,False,True,100 Days of ML Coding
context7,upstash,TypeScript,49818,2350,162,358,False,False,True,True,Context7 Platform -- Up-to-date code documentation for LLMs and AI code editors
mastodon,mastodon,Ruby,49765,7415,4425,3678,True,True,True,True,"Your self-hosted, globally interconnected microblogging community"
odoo,odoo,Python,49640,31853,9433,4328,False,True,False,True,Odoo. Open Source Apps To Grow Your Business.
cypress,cypress-io,TypeScript,49609,3401,1215,4034,True,True,True,True,"Fast, easy and reliable testing for anything that runs in a browser."
nanochat,karpathy,Python,49589,6499,85,157,False,False,True,True,The best ChatGPT that $100 can buy.
winutil,ChrisTitusTech,PowerShell,49492,2624,16,1422,True,True,True,True,"Chris Titus Tech's Windows Utility - Install Programs, Tweaks, Fixes, and Updates"
jellyfin,jellyfin,C#,49466,4542,885,2657,True,True,True,True,The Free Software Media System - Server Backend & API
hacker-scripts,NARKOZ,JavaScript,49440,6666,69,3771,False,False,False,True,Based on a true story
lx-music-desktop,lyswhut,TypeScript,49399,6663,1100,2409,False,False,True,True,一个基于 Electron 的音乐软件
ai-hedge-fund,virattt,Python,49384,8590,90,475,False,False,True,True,An AI Hedge Fund Team
TrendRadar,sansan0,Python,49370,22714,50,325,False,False,True,True,"⭐AI-driven public opinion & trend monitor with multi-platform aggregation, RSS, and smart alerts.🎯 告别信息过载，你的 AI 舆情监控助手与热点筛选工具！聚合多平台热点 +  RSS 订阅，支持关键词精准筛选。AI 智能筛选新闻 + AI 翻译 +  AI 分析简报直推手机，也支持接入 MCP 架构，赋能 AI 自然语言对话分析、情感洞察与趋势预测等。支持 Docker ，数据本地/云端自持。集成微信/飞书/钉钉/Telegram/邮件/ntfy/bark/slack 等渠道智能推送。"
open-source-ios-apps,dkhamsing,,49306,5741,2,4070,False,True,True,True,:iphone: Collaborative List of Open-Source iOS Apps
dbeaver,dbeaver,Java,49192,4085,3228,3802,True,True,True,True,Free universal database tool and SQL client
alist,AlistGo,Go,49188,7976,566,1912,True,True,True,True,"🗂️A file list/WebDAV program that supports multiple storages, powered by Gin and Solidjs. / 一个支持多存储的文件列表/WebDAV程序，使用 Gin 和 Solidjs。"
json,nlohmann,C++,49168,7339,103,4641,True,True,True,True,JSON for Modern C++
