repo_name,organization,language,stars,forks,open_issues,age_days,has_coc,has_contributing,has_workflows,has_readme,description
parcel,parcel-bundler,JavaScript,44029,2279,597,3231,True,True,True,True,The zero configuration build tool for the web. 📦🚀
system-design,karanpratapsingh,,43997,5717,3,1397,True,True,False,True,Learn how to design systems at scale and prepare for system design interviews
supervision,roboflow,Python,43989,3913,103,1292,True,True,True,True,We write your reusable computer vision tools. 💜
react-use,streamich,TypeScript,43977,3272,656,2785,False,True,True,True,React Hooks — 👍
EasySpider,NaiboWang,JavaScript,43972,5341,267,2156,False,False,True,True,A visual no-code/code-free web crawler/spider易采集：一个可视化浏览器自动化测试/数据采集/网页爬虫软件，可以无代码图形化的设计和执行爬虫任务。别名：ServiceWrapper面向Web应用的智能化服务封装系统。
babel,babel,TypeScript,43972,5826,755,4275,True,True,True,True,🐠 Babel is a compiler for writing next generation JavaScript.
front-end-interview-handbook,yangshun,MDX,43964,5939,12,3072,True,True,True,True,Front End interview preparation materials for busy engineers (updated for 2026)
build-web-application-with-golang,astaxie,Go,43919,10473,138,5062,False,False,False,True,A golang ebook intro how to build a web with golang
mitmproxy,mitmproxy,Python,43895,4584,442,5961,True,True,True,True,An interactive TLS-capable intercepting HTTP proxy for penetration testers and software developers.
retrofit,square,HTML,43893,7340,170,5758,False,True,True,True,A type-safe HTTP client for Android and the JVM
Files,files-community,C#,43872,2751,504,2716,True,True,True,True,A modern file manager that helps users organize their files and folders.
TensorFlow-Examples,aymericdamien,Jupyter Notebook,43752,14711,228,3866,False,False,False,True,TensorFlow Tutorial and Examples for Beginners (support TF v1 & v2)
full-stack-fastapi-template,fastapi,TypeScript,43646,8652,14,2666,False,True,True,True,"Full stack, modern web application template. Using FastAPI, React, SQLModel, PostgreSQL, Docker, GitHub Actions, automatic HTTPS and more."
kong,Kong,Lua,43580,5151,151,4225,True,True,True,True,🦍 The API and AI Gateway
chrome-devtools-mcp,ChromeDevTools,TypeScript,43495,2788,84,274,False,True,True,True,Chrome DevTools for coding agents
spark,apache,Scala,43445,29220,410,4490,True,True,True,True,Apache Spark - A unified analytics engine for large-scale data processing
logseq,logseq,Clojure,43358,2668,923,2212,True,True,True,True,"A privacy-first, open-source platform for knowledge management and collaboration. Download link:  http://github.com/logseq/logseq/releases. roadmap: https://logseq.io/p/NX4mc_ggEV"
fd,sharkdp,Rust,43328,1067,180,3321,False,True,True,True,"A simple, fast and user-friendly alternative to 'find'"
CPlusPlusThings,Light-City,C++,43227,8836,10,2525,False,False,False,True,C++那些事
pm2,Unitech,JavaScript,43209,2713,1082,4771,False,True,True,True,Node.js Production Process Manager with a built-in Load Balancer.
what-happens-when,alex,,43173,5738,2065,4601,False,False,True,True,"An attempt to answer the age old interview question ""What happens when you type google.com into your browser and press enter?"""
fuels-rs,FuelLabs,Rust,43171,1361,71,1685,False,False,True,True,Fuel Network Rust SDK
fuels-ts,FuelLabs,TypeScript,43138,1372,78,1743,True,True,True,True,Fuel Network Typescript SDK
bubbletea,charmbracelet,Go,43095,1227,177,2345,False,True,True,True,A powerful little TUI framework 🏗
zig,ziglang,Zig,43071,3062,2912,3964,False,False,False,True,Moved to Codeberg
hyperswitch,juspay,Rust,43001,4807,1786,1334,True,True,True,True,"Open source, composable payments platform | PCI compliant | SaaS and Self-host options | Enables connectivity to multiple payment, payout, fraud, vault and tokenization providers | Uplifts authorization with intelligent routing and revenue recovery | Reduce payment processing costs with cost observability | Reduces payment ops with reconciliation"
jan,janhq,TypeScript,42990,2933,458,1031,True,True,True,True,Jan is an open source alternative to ChatGPT that runs 100% offline on your computer.
payload,payloadcms,TypeScript,42987,3798,802,1984,False,True,True,True,"Payload is the open-source, fullstack Next.js framework, giving you instant backend superpowers. Get a full TypeScript backend and admin panel instantly. Use Payload as a headless CMS or for building powerful applications."
zod,colinhacks,TypeScript,42954,2016,201,2288,True,True,True,True,TypeScript-first schema validation with static type inference
gradio,gradio-app,Python,42908,3485,259,2732,True,True,True,True,"Build and share delightful machine learning apps, all in Python. 🌟 Star to support our work!"
ccxt,ccxt,Python,42900,8692,1330,3316,False,True,True,True,A cryptocurrency trading API with more than 100 exchanges in JavaScript / TypeScript / Python / C# / PHP / Go / Java 
CLI-Anything,HKUDS,Python,42873,4030,58,96,False,True,True,True,"""CLI-Anything: Making ALL Software Agent-Native"" -- CLI-Hub: https://clianything.cc/"
ray,ray-project,Python,42856,7674,3459,3517,False,True,True,True,Ray is an AI compute engine. Ray consists of a core distributed runtime and a set of AI Libraries for accelerating ML workloads.
python-patterns,faif,Python,42802,7013,14,5119,False,False,True,True,A collection of design patterns/idioms in Python
desktop,zen-browser,JavaScript,42802,1565,522,807,True,False,True,True,Welcome to a calmer internet
taste-skill,Leonxlnx,Shell,42548,2974,26,113,False,False,True,True,"Taste-Skill - gives your AI good taste. stops the AI from generating boring, generic slop "
DeepSpeed,deepspeedai,Python,42508,4857,1299,2332,True,True,True,True,"DeepSpeed is a deep learning optimization library that makes distributed training and inference easy, efficient, and effective."
git-flight-rules,k88hudson,,42471,3174,14,4343,False,False,False,True,Flight rules for git
Alamofire,Alamofire,Swift,42389,7671,43,4335,False,True,True,True,Elegant HTTP Networking in Swift
data-engineering-zoomcamp,DataTalksClub,Jupyter Notebook,42377,8389,0,1695,False,False,True,True,Data Engineering Zoomcamp is a free 9-week course on building production-ready data pipelines. The next cohort starts in January 2026. Join the course here 👇🏼
diagrams,mingrammer,Python,42345,2726,385,2322,False,True,True,True,:art: Diagram as Code for prototyping cloud system architectures
daily_stock_analysis,ZhuLinsen,Python,42345,40129,39,154,False,True,True,True,LLM驱动的 A/H/美股智能分析：多数据源行情 + 实时新闻 + LLM决策仪表盘 + 多渠道推送，零成本定时运行，纯白嫖. LLM-powered stock analysis system for A/H/US markets.
Fabric,danielmiessler,Go,42327,4170,59,891,True,True,True,True,Fabric is an open-source framework for augmenting humans using AI. It provides a modular system for solving specific problems using a crowdsourced set of AI prompts that can be used anywhere.
ailearning,apachecn,Python,42316,11541,4,3394,False,False,False,True,AiLearning：数据分析+机器学习实战+线性代数+PyTorch+NLTK+TF2
puter,HeyPuter,TypeScript,42264,3876,20,832,False,True,True,True,"🌐 The Internet Computer! Free, Open-Source, and Self-Hostable."
FlClash,chen08209,Dart,42245,2649,847,1032,False,False,True,True,"A multi-platform proxy client based on ClashMeta,simple and easy to use, open-source and ad-free."
curl,curl,C,42119,7234,40,5930,True,True,True,True,"A command line tool and library for transferring data with URL syntax, supporting DICT, FILE, FTP, FTPS, GOPHER, GOPHERS, HTTP, HTTPS, IMAP, IMAPS, LDAP, LDAPS, MQTT, MQTTS, POP3, POP3S, RTSP, SCP, SFTP, SMB, SMBS, SMTP, SMTPS, TELNET, TFTP, WS and WSS. libcurl offers a myriad of powerful features"
paperless-ngx,paperless-ngx,Python,42109,2806,13,1581,True,True,True,True,"A community-supported supercharged document management system: scan, index and archive all your documents"
GitNexus,abhigyanpatwari,TypeScript,42038,4774,287,314,False,True,True,True,"GitNexus: The Zero-Server Code Intelligence Engine -       GitNexus is a client-side knowledge graph creator that runs entirely in your browser. Drop in a GitHub repo or ZIP file, and get an interactive knowledge graph wit a built in Graph RAG Agent. Perfect for code exploration"
HEU_KMS_Activator,zbezj,,41905,3875,173,2547,False,False,False,True,
system_prompts_leaks,asgeirtj,JavaScript,41893,6940,26,406,False,True,True,True,"Extracted system prompts from Anthropic - Claude Fable 5, Opus 4.8, Claude Code, Claude Design. OpenAI - ChatGPT 5.5 Thinking, GPT 5.5 Instant, Codex. Google - Gemini 3.5 Flash, 3.1 Pro, Antigravity. xAI - Grok, Cursor, Copilot, VS Code, Perplexity, and more. Updated regularly."
swiper,nolimits4web,JavaScript,41851,9658,249,5203,True,True,False,True,Most modern mobile touch slider with hardware accelerated transitions
hexo,hexojs,TypeScript,41755,25,96,5010,True,True,True,True,"A fast, simple & powerful blog framework, powered by Node.js."
pure-bash-bible,dylanaraps,Shell,41648,3629,62,2922,False,True,False,True,📖 A collection of pure bash alternatives to external processes.
fastlane,fastlane,Ruby,41648,6012,752,4210,True,True,True,True,🚀 The easiest way to automate building and releasing your iOS and Android apps
data-engineer-handbook,DataExpert-io,Jupyter Notebook,41646,7870,39,936,False,False,False,True,This is a repo with links to everything you'd ever want to learn about data engineering
WeChatMsg,LC044,,41637,5197,25,1249,False,False,False,True,
vnpy,vnpy,Python,41580,11893,12,4121,True,False,True,True,基于Python的开源量化交易平台开发框架
black,psf,Python,41559,2774,286,3012,True,True,True,True,The uncompromising Python code formatter
uni-app,dcloudio,Objective-C,41538,3708,690,2892,False,True,True,True,A cross-platform framework using Vue.js
dubbo,apache,Java,41520,26438,986,5106,True,True,True,True,The java implementation of Apache Dubbo. An RPC and microservice framework.
yarn,yarnpkg,JavaScript,41505,2723,2056,3797,True,True,True,True,The 1.x line is frozen - features and bugfixes now happen on https://github.com/yarnpkg/berry
cheat.sh,chubin,Python,41448,1915,144,3323,False,True,True,True,the only cheat sheet you need
ColossalAI,hpcaitech,Python,41397,4511,500,1688,False,True,True,True,"Making large AI models cheaper, faster and more accessible"
BettaFish,666ghj,Python,41359,7593,33,711,True,True,True,True,微舆：人人可用的多Agent舆情分析助手，打破信息茧房，还原舆情原貌，预测未来走向，辅助决策！从0实现，不依赖任何框架。
lossless-cut,mifi,TypeScript,41258,2011,255,3512,False,True,True,True,The swiss army knife of lossless video/audio editing
nw.js,nwjs,JavaScript,41185,3853,897,5274,False,False,False,True,Call all Node.js modules directly from DOM/WebWorker and enable a new way of writing applications with all Web technologies.
aria2,aria2,C++,41185,3863,1147,5676,False,False,True,True,"aria2 is a lightweight multi-protocol & multi-source, cross platform download utility operated in command-line. It supports HTTP/HTTPS, FTP, SFTP, BitTorrent and Metalink."
tabler,tabler,HTML,41170,4372,139,3053,True,False,True,True,Tabler is free and open-source HTML Dashboard UI Kit built on Bootstrap
daisyui,saadeghi,Svelte,41112,1639,66,2022,False,True,True,True,"🌼 🌼 🌼 🌼 🌼  The most popular, free and open-source Tailwind CSS component library"
styled-components,styled-components,TypeScript,41069,2528,12,3588,True,True,True,True,"Fast, expressive styling for React. Server components, client components, streaming SSR, React Native—one API."
vue2-elm,bailicangdu,Vue,41061,12277,121,3459,False,False,True,True,Large single page application with 45 pages built on vue2 + vuex. 基于 vue2 + vuex 构建一个具有 45 个页面的大型单页面应用
ChatGLM-6B,zai-org,Python,41042,5143,608,1187,False,False,False,True,ChatGLM-6B: An Open Bilingual Dialogue Language Model | 开源双语对话语言模型
vuetify,vuetifyjs,TypeScript,40998,7132,518,3561,True,True,True,True,🐉 Vue Component Framework
react-bits,DavidHDev,JavaScript,40974,1872,4,675,False,True,True,True,"An open source collection of animated, interactive & fully customizable React components for building memorable websites."
airi,moeru-ai,TypeScript,40961,4124,167,558,True,True,True,True,"💖🧸 Self hosted, you-owned Grok Companion, a container of souls of waifu, cyber livings to bring them into our worlds, wishing to achieve Neuro-sama's altitude. Capable of realtime voice chat, Minecraft, Factorio playing. Web / macOS / Windows supported."
cobalt,imputnet,Svelte,40850,3485,249,1435,False,True,True,True,best way to save what you love
dive-into-llms,Lordog,Jupyter Notebook,40802,4972,14,795,False,False,False,True,《动手学大模型Dive into LLMs》系列编程实践教程
free,freefq,,40796,5639,579,2197,False,False,False,True,翻墙、免费翻墙、免费科学上网、免费节点、免费梯子、免费ss/v2ray/trojan节点、蓝灯、谷歌商店、翻墙梯子
agno,agno-agi,Python,40664,5518,904,1500,True,True,True,True,"Build, run, and manage agent platforms."
zju-icicles,QSCTech,HTML,40596,9577,10,3636,False,False,True,True,浙江大学课程攻略共享计划
50projects50days,bradtraversy,CSS,40578,9747,48,2034,False,False,False,True,"50+ mini web projects using HTML, CSS & JS"
last30days-skill,mvanhorn,Python,40562,3268,156,140,False,False,True,True,"AI agent skill that researches any topic across Reddit, X, YouTube, HN, Polymarket, and the web - then synthesizes a grounded summary"
antigravity-awesome-skills,sickn33,Python,40546,6542,1,149,True,True,True,True,"Installable GitHub library of 1,500+ agentic skills for Claude Code, Cursor, Codex CLI, Gemini CLI, Antigravity, and more. Includes specialized plugins, installer CLI, bundles, workflows, and official/community skill collections."
vim,vim,Vim Script,40491,6075,1666,3951,False,True,True,True,The official Vim repository
3x-ui,MHSanaei,TypeScript,40485,7589,48,1219,False,True,True,True,"Xray panel supporting multi-protocol multi-user expire day & traffic & IP limit (Vmess, Vless, Trojan, ShadowSocks, Wireguard, Hysteria, Tunnel, Mixed, HTTP, Tun) "
remote-jobs,remoteintech,JavaScript,40467,3947,13,3896,True,True,True,True,Source for remoteintech.company — a community-maintained directory of remote-friendly tech companies
chatbox,chatboxai,TypeScript,40444,4102,1183,1194,False,False,True,True,Powerful AI Client
chakra-ui,chakra-ui,TypeScript,40438,3616,16,2491,True,True,True,True,Chakra UI is a component system for building SaaS products with speed ⚡️
wrk,wg,C,40326,3031,204,5197,False,False,True,True,Modern HTTP benchmarking tool
trpc,trpc,TypeScript,40322,1622,232,2156,False,True,True,True,🧙‍♀️  Move Fast and Break Nothing. End-to-end typesafe APIs made easy. 
faiss,facebookresearch,C++,40274,4420,278,3412,True,True,True,True,A library for efficient similarity search and clustering of dense vectors.
Awesome-Design-Tools,goabstract,JavaScript,40226,2276,159,2677,False,False,True,True,The best design tools and plugins for everything 👉
tidb,pingcap,Go,40158,6194,6284,3933,True,True,True,True,"TiDB is built for agentic workloads that grow unpredictably, with ACID guarantees and native support for transactions, analytics, and vector search. No data silos. No noisy neighbors. No infrastructure ceiling."
php-src,php,C,40143,8068,1847,5476,False,True,True,True,The PHP Interpreter
appsmith,appsmithorg,TypeScript,40040,4606,4458,2174,True,True,True,True,"Platform to build admin panels, internal tools, and dashboards. Integrates with 25+ databases and any API."
bert,google-research,Python,40026,9703,880,2787,False,True,False,True,TensorFlow code and pre-trained models for BERT
awesome-cursorrules,PatrickJS,JavaScript,39983,3417,19,634,True,True,True,True,📄  Configuration files that enhance Cursor AI editor experience with custom rules and behaviors
headscale,juanfont,Go,39962,2187,110,2182,True,True,True,True,"An open source, self-hosted implementation of the Tailscale control server"
esbuild,evanw,Go,39921,1310,615,3650,False,False,True,True,An extremely fast bundler for the web
fiber,gofiber,Go,39833,1995,53,2340,True,True,True,True,⚡️ Express inspired web framework written in Go
photoprism,photoprism,Go,39796,2294,458,3058,True,True,True,True,AI-Powered Photos App for the Decentralized Web 🌈💎✨
gorm,go-gorm,Go,39795,4155,536,4613,True,False,True,True,"The fantastic ORM library for Golang, aims to be developer friendly"
video.js,videojs,JavaScript,39795,7498,661,5873,True,True,True,True,Video.js - open source HTML5 video player
phaser,phaserjs,JavaScript,39771,7143,111,4809,True,True,True,True,"Phaser is a fun, free and fast 2D game framework for making HTML5 games for desktop and mobile web browsers, supporting Canvas and WebGL rendering."
nushell,nushell,Rust,39728,2157,1437,2590,True,True,True,True,A new type of shell
stats,exelban,Swift,39575,1372,27,2571,False,False,True,True,macOS system monitor in your menu bar
shellcheck,koalaman,Haskell,39564,1921,1229,4956,False,False,True,True,"ShellCheck, a static analysis tool for shell scripts"
Xray-core,XTLS,Go,39522,5490,53,2041,True,False,True,True,"Xray, Penetrates Everything. Also the best v2ray-core. Where the magic happens. An open platform for various uses."
Deep-Learning-Papers-Reading-Roadmap,floodsung,Python,39511,7292,92,3528,False,False,False,True,Deep Learning papers reading roadmap for anyone who are eager to learn this amazing tech!
FastChat,lm-sys,Python,39469,4786,1014,1182,False,False,True,True,"An open platform for training, serving, and evaluating large language models. Release repo for Vicuna and Chatbot Arena."
gkd,gkd-kit,Kotlin,39440,1869,8,1075,False,False,True,True,"基于无障碍，高级选择器，订阅规则的自定义屏幕点击安卓应用 | An Android APP with custom screen tapping based on Accessibility, Advanced Selectors, and Subscription Rules"
ChatTTS,2noise,Python,39439,4241,61,746,False,False,True,True,A generative speech model for daily dialogue.
styleguide,google,HTML,39366,12970,170,4041,True,True,True,True,Style guides for Google-originated open-source projects
yazi,sxyazi,Rust,39352,896,70,1070,True,True,True,True,"💥 Blazing fast terminal file manager written in Rust, based on async I/O."
minds,mindsdb,Dockerfile,39299,6212,88,2871,True,True,True,True,"General-purpose AI designed for knowledge workers — creators, strategists, and operators — and individuals seeking AI systems they can truly control to help them get work done, with full flexibility to extend and deploy anywhere (VPC, on-prem, or cloud)."
BitNet,microsoft,Python,39294,3591,318,676,True,False,True,True,Official inference framework for 1-bit LLMs
it-tools,CorentinTh,Vue,39291,5026,804,2259,False,False,True,True,"Collection of handy online tools for developers, with great UX. "
bark,suno-ai,Jupyter Notebook,39158,4682,269,1162,False,False,False,True,🔊 Text-Prompted Generative Audio Model
quivr,QuivrHQ,Python,39158,3727,27,1127,False,False,True,True,"Opiniated RAG for integrating GenAI in your apps 🧠   Focus on your product rather than the RAG. Easy integration in existing products with customisation!  Any LLM: GPT4, Groq, Llama. Any Vectorstore: PGVector, Faiss. Any Files. Anyway you want."
leveldb,google,C++,39149,8200,394,4307,True,True,True,True,LevelDB is a fast key-value storage library written at Google that provides an ordered mapping from string keys to string values.
sniffnet,GyulyVGC,Rust,39130,1647,67,1412,True,True,True,True,Comfortably monitor your Internet traffic 🕵️‍♂️
novu,novuhq,TypeScript,39112,4320,88,1751,True,True,True,True,The open-source communication infrastructure for agents and products
devdocs,freeCodeCamp,Ruby,39061,2604,234,4614,True,True,True,True,API Documentation Browser
LibreChat,danny-avila,TypeScript,39001,8016,509,1217,True,True,True,True,"Enhanced ChatGPT Clone: Features Agents, MCP, Skills, DeepSeek, Anthropic, AWS, OpenAI, Responses API, Azure, Groq, o1, GPT-5, Mistral, OpenRouter, Vertex AI, Gemini, Artifacts, AI model switching, message search, Code Interpreter, langchain, DALL-E-3, OpenAPI Actions, Functions, Secure Multi-User Auth, Presets, open-source for self-hosting. Active"
halo,halo-dev,Java,38978,10289,146,3005,True,True,True,True,Halo 是一款强大易用的开源建站工具，从个人博客、知识库，到企业官网、在线商城，Halo 都能助您轻松实现，一站式满足您的多样化建站需求。
manim,ManimCommunity,Python,38958,2906,529,2216,True,True,True,True,A community-maintained Python framework for creating mathematical animations. 
ink,vadimdemedes,TypeScript,38895,1011,30,3288,True,True,True,True,🌈 React for interactive command-line apps
outline,outline,TypeScript,38892,3341,54,3673,True,False,True,True,"The fastest knowledge base for growing teams. Beautiful, realtime collaborative, feature packed, and markdown compatible."
materialize,Dogfalo,JavaScript,38864,4632,793,4291,True,True,True,True,"Materialize, a CSS Framework based on Material Design"
llvm-project,llvm,LLVM,38793,17476,36922,3474,True,True,True,True,The LLVM Project is a collection of modular and reusable compiler and toolchain technologies.
duckdb,duckdb,C++,38754,3318,571,2908,True,True,True,True,DuckDB is an analytical in-process SQL database management system
polars,pola-rs,Rust,38747,2879,2791,2221,True,True,True,True,"Extremely fast Query Engine for DataFrames, written in Rust"
googletest,google,C++,38706,10790,567,3972,True,True,True,True,GoogleTest - Google Testing and Mocking Framework
preact,preactjs,JavaScript,38691,2036,151,3928,True,True,True,True,⚛️ Fast 3kB React alternative with the same modern API. Components & Virtual DOM.
awesome-system-design-resources,ashishps1,Java,38683,8318,13,962,False,False,False,True,Learn System Design concepts and prepare for interviews using free resources.
NewPipe,TeamNewPipe,Java,38657,3635,1401,3935,False,True,True,True,A libre lightweight streaming front-end for Android.
new-api,QuantumNous,Go,38560,8770,818,945,True,False,True,True,"A unified AI model hub for aggregation & distribution. It supports cross-converting various LLMs into OpenAI-compatible, Claude-compatible, or Gemini-compatible formats. A centralized gateway for personal and enterprise model management. 🍥"
lapce,lapce,Rust,38551,1289,887,3048,False,True,True,True,Lightning-fast and Powerful Code Editor written in Rust
openscreen,siddharthvaddem,TypeScript,38521,2724,49,246,False,True,True,True,"Create stunning demos for free. Open-source, no subscriptions, no watermarks, and free for commercial use. An alternative to Screen Studio. "
insomnia,Kong,TypeScript,38491,2279,854,3703,True,True,True,True,"The open-source, cross-platform API client for GraphQL, REST, WebSockets, SSE and gRPC. With Cloud, Local and Git storage."
python-cheatsheet,gto76,Python,38484,6708,0,3061,False,False,True,True,Comprehensive Python Cheatsheet
Folo,RSSNext,TypeScript,38469,2089,371,796,True,True,True,True,🧡 Folo is the AI RSS Reader
GPT_API_free,chatanywhere,,38415,2644,19,1146,False,False,False,True,Free ChatGPT&DeepSeek API Key，免费ChatGPT&DeepSeek API。免费接入DeepSeek API和GPT4 API，支持 gpt | deepseek | claude | gemini | grok 等排名靠前的常用大模型。
reactive-resume,amruthpillai,TypeScript,38402,4344,90,2270,False,False,True,True,"A one-of-a-kind resume builder that keeps your privacy in mind. Completely secure, customizable, portable, open-source and free forever. Try it out today!"
ant-design-pro,ant-design,TypeScript,38387,8248,44,3213,True,False,True,True,👨🏻‍💻👩🏻‍💻 Use Ant Design like a Pro!
metasploit-framework,rapid7,Ruby,38380,14871,592,5401,True,True,True,True,Metasploit Framework
spacedrive,spacedriveapp,Rust,38288,1292,34,1720,True,True,True,True,"Spacedrive is an open source cross-platform file explorer, powered by a virtual distributed filesystem written in Rust."
engineering-blogs,kilimchoi,Ruby,38287,2021,148,4017,False,True,True,True,A curated list of engineering blogs
istio,istio,Go,38214,8322,470,3493,False,True,True,True,"Connect, secure, control, and observe services."
MPAndroidChart,PhilJay,Java,38201,8993,2191,4431,False,True,False,True,"A powerful 🚀 Android chart view / graph view library, supporting line- bar- pie- radar- bubble- and candlestick charts as well as scaling, panning and animations."
cli,httpie,Python,38199,3944,292,5221,True,True,True,True,"🥧 HTTPie CLI  — modern, user-friendly command-line HTTP client for the API era. JSON support, colors, sessions, downloads, plugins & more."
impress.js,impress,JavaScript,38185,6591,59,5280,False,False,True,True,It's a presentation framework based on the power of CSS3 transforms and transitions in modern browsers and inspired by the idea behind prezi.com.
CodeWhale,Hmbown,Rust,38178,3282,422,144,True,True,True,True,"Open-source, community-driven agent harness"
Langchain-Chatchat,chatchat-space,Python,38164,6216,24,1169,False,False,True,True,"Langchain-Chatchat（原Langchain-ChatGLM）基于 Langchain 与 ChatGLM, Qwen 与 Llama 等语言模型的 RAG 与 Agent 应用 | Langchain-Chatchat (formerly langchain-ChatGLM), local knowledge based LLM (like ChatGLM, Qwen and Llama) RAG and Agent app with langchain "
Sunshine,LizardByte,C++,38164,1993,134,1640,True,True,True,True,Self-hosted game stream host for Moonlight.
tesseract.js,naptha,JavaScript,38137,2363,45,4007,False,False,True,True,Pure Javascript OCR for more than 100 Languages 📖🎉🖥
google-research,google-research,Jupyter Notebook,38126,8428,1964,2808,False,True,True,True,Google Research
