repo_name,organization,language,stars,forks,open_issues,age_days,has_coc,has_contributing,has_workflows,has_readme,description
strapi,strapi,TypeScript,72661,9792,520,3940,True,True,True,True,"🚀 Strapi is the leading open-source headless CMS. It’s 100% JavaScript/TypeScript, fully customizable, and developer-first."
awesome-scalability,binhnguyennus,,72416,7043,25,3122,True,True,True,True,"The Patterns of Scalable, Reliable, and Performant Large-Scale Systems"
daytona,daytonaio,,72249,5661,442,889,False,False,True,True,Daytona is a Secure and Elastic Infrastructure for Running AI-Generated Code
awesome-cpp,fffaraz,,72243,8311,313,4380,False,True,True,True,"A curated list of awesome C++ (or C) frameworks, libraries, resources, and shiny things. Inspired by awesome-... stuff."
SecLists,danielmiessler,PHP,72174,25047,9,5260,False,True,True,True,"SecLists is the security tester's companion. It's a collection of multiple types of lists used during security assessments, collected in one place. List types include usernames, passwords, URLs, sensitive data patterns, fuzzing payloads, web shells, and many more."
flask,pallets,Python,71946,16905,10,5943,True,True,True,True,The Python micro framework for building web applications.
reveal.js,hakimel,JavaScript,71933,16861,910,5516,False,True,True,True,The HTML Presentation Framework
moby,moby,Go,71919,19098,3820,4925,False,True,True,True,The Moby Project - a collaborative project for the container ecosystem to assemble container-based systems
protobuf,protocolbuffers,C++,71496,16182,266,4340,True,True,True,True,Protocol Buffers - Google's data interchange format
pi,earendil-works,TypeScript,71134,8762,58,339,False,True,True,True,"AI agent toolkit: unified LLM API, agent loop, TUI, coding agent CLI"
gpt_academic,binary-husky,Python,71084,8347,327,1212,False,False,True,True,"为GPT/GLM等LLM大语言模型提供实用化交互接口，特别优化论文阅读/润色/写作体验，模块化设计，支持自定义快捷按钮&函数插件，支持Python和C++等项目剖析&自译解功能，PDF/LaTex论文翻译&总结功能，支持并行问询多种LLM模型，支持chatglm3等本地模型。接入通义千问, deepseekcoder, 讯飞星火, 文心一言, llama2, rwkv, claude2, moss等。"
act,nektos,Go,71065,1973,342,2750,False,True,True,True,Run your GitHub Actions locally 🚀
rtk,rtk-ai,Rust,71060,4414,1601,173,False,True,True,True,"CLI proxy that reduces LLM token consumption by 60-90% on common dev commands. Single Rust binary, zero dependencies"
learn-claude-code,shareAI-lab,Python,71025,11554,65,380,False,True,True,True,"Bash is all you need -  A nano claude code–like 「agent harness」, built from 0 to 1"
anime,juliangarnier,JavaScript,71023,4787,110,3775,False,True,True,True,JavaScript animation engine
ghidra,NationalSecurityAgency,Java,70899,7781,1872,2693,False,True,True,True,Ghidra is a software reverse engineering (SRE) framework
OpenBB,OpenBB-finance,Python,70585,7170,75,2032,True,False,True,True,"Open Data Platform for analysts, quants and AI agents."
AFFiNE,toeverything,TypeScript,70446,5056,660,1444,True,True,True,True,"There can be more than Notion and Miro. AFFiNE(pronounced [ə‘fain]) is a next-gen knowledge base that brings planning, sorting and creating all together. Privacy first, open-source, customizable and ready to use. "
swift,swiftlang,Swift,70154,10756,9087,3917,True,True,True,True,The Swift Programming Language
awesome-courses,prakhar1989,,69711,8385,65,4259,False,True,False,True,:books: List of awesome university courses for learning Computer Science!
ansible,ansible,Python,69676,24280,809,5243,True,True,True,True,"Ansible is a radically simple IT automation platform that makes your applications and systems easier to deploy and maintain. Automate everything from code deployment to network configuration to cloud management, in a language that approaches plain English, using SSH, with no agents to install on remote systems. https://docs.ansible.com."
Scrapling,D4Vinci,Python,69573,6885,3,639,True,True,True,True,🕷️ An adaptive Web Scraping framework that handles everything from a single request to a full-scale crawl!
OpenCut,OpenCut-app,TypeScript,69444,7222,341,387,True,False,True,True,The open-source CapCut alternative
MetaGPT,FoundationAgents,Python,69379,8844,135,1110,False,False,True,True,"🌟 The Multi-Agent Framework: First AI Software Company, Towards Natural Language Programming"
ai-agents-for-beginners,microsoft,Jupyter Notebook,69378,23009,1,593,True,False,True,True,18 Lessons to Get Started Building AI Agents
express,expressjs,JavaScript,69367,24293,222,6227,True,True,True,True,"Fast, unopinionated, minimalist web framework for node."
MiroFish,666ghj,Python,68560,10705,330,231,False,False,True,True,"A Simple and Universal Swarm Intelligence Engine, Predicting Anything. 简洁通用的群体智能引擎，预测万物"
node,base,Shell,68480,3253,8,1259,False,True,True,True,Everything required to run your own Base node
Apollo-11,chrislgarry,Assembly,68267,7714,131,4485,False,True,True,True,Original Apollo 11 Guidance Computer (AGC) source code for the command and lunar modules.
30-Days-Of-Python,Asabeneh,Python,68230,12671,176,2429,False,False,True,True,The 30 Days of Python programming challenge is a step-by-step guide to learn the Python programming language in 30 days. This challenge may take more than 100 days. Follow your own pace. These videos may help too: https://www.youtube.com/channel/UC7PNRuno1rzYPb1xLa4yktw
unsloth,unslothai,Python,68225,6138,959,958,True,True,True,True,"Unsloth Studio is a web UI for training and running open models like Gemma 4, Qwen3.6, DeepSeek, gpt-oss locally."
awesome-claude-skills,ComposioHQ,Python,67741,7649,1007,270,False,True,True,True,"A curated list of awesome Claude Skills, resources, and tools for customizing Claude AI workflows"
Chart.js,chartjs,JavaScript,67577,11941,571,4867,False,False,True,True,Simple HTML5 Charts using the <canvas> tag
annotated_deep_learning_paper_implementations,labmlai,Python,67098,6738,33,2150,False,False,True,True,"🧑‍🏫 60+ Implementations/tutorials of deep learning papers with side-by-side notes 📝; including transformers (original, xl, switch, feedback, vit, ...), optimizers (adam, adabelief, sophia, ...), gans(cyclegan, stylegan2, ...), 🎮 reinforcement learning (ppo, dqn), capsnet, distillation, ... 🧠"
echarts,apache,TypeScript,66812,19805,1601,4851,True,True,True,True,"Apache ECharts is a powerful, interactive charting and data visualization library for browser"
scikit-learn,scikit-learn,Python,66679,27171,2110,5810,True,True,True,True,scikit-learn: machine learning in Python
33-js-concepts,leonardomso,JavaScript,66492,9155,2,2870,True,True,True,True,📜 33 JavaScript concepts every developer should know.
gpt4free,xtekky,Python,66469,13532,6,1203,True,True,True,True,The official gpt4free repository | various collection of powerful language models | opus 4.6 gpt 5.3 kimi 2.5 deepseek v3.2 gemini 3
design-resources-for-developers,bradtraversy,,66411,12108,53,2260,False,True,True,True,"Curated list of design and UI resources from stock photos, web templates, CSS frameworks, UI libraries, tools and much more"
awesome-nodejs,sindresorhus,,66241,6231,26,4386,True,True,True,True,":zap: Delightful Node.js packages and resources [BECAUSE OF TOO MUCH SPAM AND LOW-QUALITY SUBMISSIONS, SUBMISSIONS ARE PAUSED UNTIL JULY]"
uBlock,gorhill,JavaScript,66239,4218,20,4122,False,True,True,True,uBlock Origin - An efficient blocker for Chromium and Firefox. Fast and lean.
hello-agents,datawhalechina,Python,66224,8202,146,310,False,False,True,True,📚 《从零开始构建智能体》——从零开始的智能体原理与实践教程
ripgrep,BurntSushi,Rust,66140,2642,162,3778,False,True,True,True,ripgrep recursively searches directories for a regex pattern while respecting your gitignore
Java,TheAlgorithms,Java,66010,21227,23,3650,True,True,True,True,All Algorithms implemented in Java
webpack,webpack,JavaScript,65943,9513,150,5239,True,True,True,True,"A bundler for javascript and friends. Packs many modules into a few bundled assets. Code Splitting allows for loading parts of the application on demand. Through ""loaders"", modules can be CommonJs, AMD, ES6 modules, CSS, Images, JSON, Coffeescript, LESS, ... and your custom stuff."
oh-my-openagent,code-yeongyu,TypeScript,65817,5368,904,224,False,True,True,True,"omo/lazycodex: The coding agent for tokenmaxxers;the one and only agent harness for complex codebases. For your Codex, for your OpenCode"
docusaurus,facebook,TypeScript,65628,9969,389,3311,True,True,True,True,Easy to maintain open source documentation websites.
nocode,kelseyhightower,Dockerfile,65485,4820,4713,3080,False,True,False,True,The best way to write secure and reliable applications. Write nothing; deploy nowhere.
javascript-questions,lydiahallie,,65298,9208,53,2589,False,False,False,True,"A long list of (advanced) JavaScript questions, and their explanations :sparkles:  "
prometheus,prometheus,Go,65228,10749,873,4980,True,True,True,True,The Prometheus monitoring system and time series database.
localstack,localstack,Python,65124,4762,0,3549,True,True,True,True,💻 A fully functional local AWS cloud stack. Develop and test your cloud & Serverless apps offline
interviews,kdn251,Java,65053,12882,120,3437,False,False,False,True,Everything you need to know to get the job.
openinterpreter,openinterpreter,Rust,65041,5631,274,1096,False,True,True,True,A coding agent for low-cost models
alacritty,alacritty,Rust,64897,3518,335,3800,False,True,True,True,"A cross-platform, OpenGL terminal emulator."
get-shit-done,gsd-build,JavaScript,64750,5481,0,212,False,True,True,True,"A light-weight and powerful meta-prompting, context engineering and spec-driven development system for Claude Code by TÂCHES."
cline,cline,TypeScript,64668,6916,1251,738,True,True,True,True,"Autonomous coding agent as an SDK, IDE extension, or CLI assistant."
ladybird,LadybirdBrowser,C++,64573,3085,515,775,True,True,True,True,Truly independent web browser
ruflo,ruvnet,TypeScript,64450,7656,785,407,False,True,True,True,"🌊 The leading agent meta-harness. Deploy intelligent multi-player swarms, coordinate autonomous workflows, and build conversational AI systems. Features adaptive memory, self-learning intelligence, RAG integration, and native Claude Code / Codex / Hermes and many more Integrated"
keras,keras-team,Python,64170,19738,220,4127,False,True,True,True,Deep Learning for humans
traefik,traefik,Go,63991,6070,852,3957,True,True,True,True,The Cloud Native Application Proxy
nocodb,nocodb,TypeScript,63977,4918,664,3180,True,True,True,True,🔥 🔥 🔥 A Free & Self-hostable Airtable Alternative
nerd-fonts,ryanoasis,CSS,63720,3923,78,4240,True,True,True,True,"Iconic font aggregator, collection, & patcher. 3,600+ icons, 50+ patched fonts: Hack, Source Code Pro, more. Glyph collections: Font Awesome, Material Design Icons, Octicons, & more"
vaultwarden,dani-garcia,Rust,63707,2998,51,3069,False,False,True,True,"Unofficial Bitwarden compatible server written in Rust, formerly known as bitwarden_rs"
taste-skill,Leonxlnx,JavaScript,63583,4487,47,145,False,False,True,True,"Taste-Skill - gives your AI good taste. stops the AI from generating boring, generic slop "
rustlings,rust-lang,Rust,63532,11224,40,3956,False,True,True,True,:crab: Small exercises to get you used to reading and writing Rust code!
anything-llm,Mintplex-Labs,JavaScript,63307,6923,317,1137,False,True,True,True,Stop renting your intelligence. Own it with AnythingLLM. Everything you need for a powerful local-first agent experience 
socket.io,socketio,TypeScript,63301,10308,183,5969,False,True,True,True,Bidirectional and low-latency communication for every platform
warp,warpdotdev,Rust,63187,5226,4616,1832,True,True,True,True,"Warp is an agentic development environment, born out of the terminal."
docling,docling-project,Python,63164,4460,928,735,True,True,True,True,Get your documents ready for gen AI
scrapy,scrapy,Python,63153,11787,584,5987,True,True,True,True,"Scrapy, a fast high-level web crawling & scraping framework for Python."
openpilot,commaai,Python,63120,11157,147,3520,False,True,True,True,"openpilot is an operating system for robotics. Currently, it upgrades the driver assistance system on 300+ supported cars."
tldr,tldr-pages,Markdown,63116,5337,330,4601,False,True,True,True,Collaborative cheatsheets for console commands 📚.
resume.github.com,resume,JavaScript,62883,1370,76,5637,False,False,False,True,Resumes generated using the GitHub informations
pathway,pathwaycom,Python,62661,1668,35,1325,True,True,True,True,"Python ETL framework for stream processing, real-time analytics, LLM pipelines, and RAG."
claude-code-best-practice,shanraisshan,HTML,62617,6263,15,256,False,False,True,True,from vibe coding to agentic engineering - practice makes claude perfect
drawio-desktop,jgraph,JavaScript,62125,5728,38,3337,True,False,True,True,Official electron build of draw.io
FFmpeg,FFmpeg,C,62065,14007,3,5570,False,True,False,True,Mirror of https://git.ffmpeg.org/ffmpeg.git
git,git,C,62029,28130,374,6565,True,True,True,True,Git Source Code Mirror - This is a publish-only repository but pull requests can be turned into patches to the mailing list via GitGitGadget (https://gitgitgadget.github.io/). Please follow Documentation/SubmittingPatches procedure for any of your improvements.
ai-hedge-fund,virattt,Python,61957,10918,154,592,False,False,True,True,An AI Hedge Fund Team
leetcode-master,youngyangyang04,Shell,61924,12314,249,2404,False,False,False,True,《代码随想录》LeetCode 刷题攻略：200道经典题目刷题顺序，共60w字的详细图解，视频难点剖析，50余张思维导图，支持C++，Java，Python，Go，JavaScript等多语言版本，从此算法学习不再迷茫！🔥🔥 来看看，你会发现相见恨晚！🚀 
worldmonitor,koala73,TypeScript,61864,9636,182,187,True,True,True,True,"Real-time global intelligence dashboard. AI-powered news aggregation, geopolitical monitoring, and infrastructure tracking in a unified situational awareness interface"
Magisk,topjohnwu,Kotlin,61690,17975,70,3596,False,False,True,True,The Magic Mask for Android
redux,reduxjs,TypeScript,61592,15217,48,4064,True,True,True,True,A JS library for predictable global state management
sway,FuelLabs,Rust,61568,5415,919,2002,False,False,True,True,🌴 Empowering everyone to build reliable and efficient smart contracts.
memos,usememos,Go,61549,4564,16,1679,False,False,True,True,"Open-source, self-hosted note-taking tool built for quick capture. Markdown-native, lightweight, and fully yours."
minio,minio,Go,61335,7668,80,4199,True,True,True,True,"MinIO is a high-performance, S3 compatible object store, open sourced under GNU AGPLv3 license."
lodash,lodash,JavaScript,61244,7180,92,5212,False,True,True,True,"A modern JavaScript utility library delivering modularity, performance, & extras."
nanoGPT,karpathy,Python,61167,10516,350,1295,False,False,False,True,"The simplest, fastest repository for training/finetuning medium-sized GPTs."
astro,withastro,TypeScript,61028,3632,115,1947,True,True,True,True,The web framework for content-driven websites. ⭐️ Star to support our work!
awesome-chatgpt-prompts-zh,PlexPt,,60962,13549,45,1311,False,False,False,True,ChatGPT 中文调教指南。各种场景使用指南。学习怎么让它听你的话。
OpenSpec,Fission-AI,TypeScript,60917,4224,464,343,False,False,True,True,Spec-driven development (SDD) for AI coding assistants.
Front-end-Developer-Interview-Questions,h5bp,Nunjucks,60874,11016,62,5269,True,True,True,True,"A list of helpful front-end related questions you can use to interview potential candidates, test yourself or completely ignore."
mem0,mem0ai,TypeScript,60852,7089,605,1120,False,True,True,True,Universal memory layer for AI Agents
architect-awesome,xingshaocheng,,60844,17671,63,3021,False,False,False,True,后端架构师技术图谱
atom,atom,JavaScript,60807,17183,994,5289,True,True,False,True,:atom: The hackable text editor
nuxt,nuxt,TypeScript,60787,5848,826,3548,True,True,True,True,the full-stack Vue framework
awesome-flutter,Solido,Dart,60595,6904,31,3355,False,True,True,True,"An awesome list that curates the best Flutter libraries, tools, tutorials, articles and more."
TrendRadar,sansan0,Python,60563,24796,49,442,False,False,True,True,"⭐AI-driven public opinion & trend monitor with multi-platform aggregation, RSS, and smart alerts.🎯 告别信息过载，你的 AI 舆情监控助手与热点筛选工具！聚合多平台热点 +  RSS 订阅，支持关键词精准筛选。AI 智能筛选新闻 + AI 翻译 +  AI 分析简报直推手机，也支持接入 MCP 架构，赋能 AI 自然语言对话分析、情感洞察与趋势预测等。支持 Docker ，数据本地/云端自持。集成微信/飞书/钉钉/Telegram/邮件/ntfy/bark/slack 等渠道智能推送。"
markdown-here,adam-p,JavaScript,60232,11039,318,5176,False,True,False,True,"Google Chrome, Firefox, and Thunderbird extension that lets you write email in Markdown and render it before sending."
career-ops,santifer,JavaScript,60151,11920,176,101,True,True,True,True,"Open-source AI job search: scan job portals, score listings A-F, tailor your CV, track applications — runs locally in your AI coding CLI (Claude Code, Gemini, Codex, OpenCode…)"
spring-framework,spring-projects,Java,60117,38816,505,5698,True,True,True,True,Spring Framework
Real-Time-Voice-Cloning,CorentinJ,Python,60026,9397,172,2606,False,False,True,True,Clone a voice in 5 seconds to generate arbitrary speech in real-time
codegraph,colbymchenry,TypeScript,60019,3748,319,177,False,False,True,True,"Pre-indexed code knowledge graph, auto syncs on code changes, for Claude Code, Codex, Gemini, Cursor, OpenCode, AntiGravity, Kiro, and Hermes Agent — fewer tokens, fewer tool calls, 100% local"
Pake,tw93,Rust,59875,12099,3,1369,True,True,True,True,🤱🏻 Turn any webpage into a desktop app with one command.
pi-hole,pi-hole,Shell,59868,3257,35,4419,True,True,True,True,A black hole for Internet advertisements
jquery,jquery,JavaScript,59808,20395,96,6311,True,True,True,True,jQuery JavaScript Library
GPT-SoVITS,RVC-Boss,Python,59782,6515,873,912,False,False,True,True,1 min voice data can also be used to train a good TTS model! (few shot voice cloning)
autogen,microsoft,Python,59739,8992,952,1061,True,True,True,True,A programming framework for agentic AI
bat,sharkdp,Rust,59734,1588,400,3006,False,True,True,True,A cat(1) clone with wings.
pocketbase,pocketbase,Go,59683,3512,18,1470,False,True,True,True,Open Source realtime backend in 1 file
shadowsocks-windows,shadowsocks,C#,59581,16225,199,4929,False,True,False,True,A C# port of shadowsocks
v2rayNG,2dust,Kotlin,59555,7757,20,2618,False,False,True,True,"A V2Ray client for Android, support Xray core and v2fly core"
llama,meta-llama,Python,59511,9796,525,1246,True,True,True,True,Inference code for Llama models
ultralytics,ultralytics,Python,59494,11376,160,1402,True,True,True,True,"Ultralytics YOLO26, YOLO11, YOLOv8 — object detection, instance segmentation, semantic segmentation, image classification, pose estimation, object tracking"
mkcert,FiloSottile,Go,59294,3131,174,2941,True,True,True,True,A simple zero-config tool to make locally trusted development certificates with any names you'd like.
headroom,headroomlabs-ai,Python,59196,4389,454,188,True,True,True,True,"Compress tool outputs, logs, files, and RAG chunks before they reach the LLM. 20% fewer tokens for coding agents, 60-95% fewer tokens for JSON, same answers. Library, proxy, MCP server."
context7,upstash,TypeScript,59119,2791,23,475,False,False,True,True,Context7 Platform -- Up-to-date code documentation for LLMs and AI code editors
llm-app,pathwaycom,Jupyter Notebook,59034,1433,10,1091,True,True,True,True,"Ready-to-run cloud templates for RAG, AI pipelines, and enterprise search with live data. 🐳Docker-friendly.⚡Always in sync with Sharepoint, Google Drive, S3, Kafka, PostgreSQL, real-time data APIs, and more."
Mole,tw93,Shell,58960,2080,24,294,False,True,True,True,"🐹 Clean, uninstall, analyze, optimize, and monitor your Mac from the terminal."
starship,starship,Rust,58866,2588,1008,2661,True,True,True,True,"☄🌌️  The minimal, blazing-fast, and infinitely customizable prompt for any shell!"
rails,rails,Ruby,58803,22431,1567,6669,True,True,True,True,Ruby on Rails
marktext,marktext,TypeScript,58707,4352,483,3166,False,True,True,True,"📝A simple and elegant markdown editor, available for Linux, macOS and Windows."
meilisearch,meilisearch,Rust,58595,2622,316,3004,True,True,True,True,A lightning-fast search engine API bringing AI-powered hybrid search to your sites and applications.
zustand,pmndrs,TypeScript,58580,2256,4,2653,False,True,True,True,🐻 Bear necessities for state management in React
angular.js,angular,JavaScript,58577,27071,461,6034,True,True,False,True,AngularJS - HTML enhanced for web apps!
coolify,coollabsio,PHP,58545,5024,816,1996,True,True,True,True,"An open-source, self-hostable PaaS alternative to Vercel, Heroku & Netlify that lets you easily deploy static sites, databases, full-stack applications and 280+ one-click services on your own servers."
rclone,rclone,Go,58341,5209,1184,4503,True,True,True,True,"""rsync for cloud storage"" - Google Drive, S3, Dropbox, Backblaze B2, One Drive, Swift, Hubic, Wasabi, Google Cloud Storage, Azure Blob, Azure Files, Yandex Files"
awesome-rust,rust-unofficial,Rust,58324,3479,9,4380,False,True,True,True,A curated list of Rust code and resources.
ghostty,ghostty-org,Zig,58182,3074,259,1568,False,True,True,True,"👻 Ghostty is a fast, feature-rich, and cross-platform terminal emulator that uses platform-native UI and GPU acceleration."
winutil,ChrisTitusTech,PowerShell,58040,3360,12,1539,True,True,True,True,"Chris Titus Tech's Windows Utility - Install Programs, Tweaks, Fixes, and Updates"
github-cheat-sheet,tiimgreen,,57896,5422,49,4476,False,True,False,True,A list of cool features of Git and GitHub.
system_prompts_leaks,asgeirtj,JavaScript,57830,9557,36,438,False,True,True,True,"Extracted system prompts from Anthropic - Claude Fable 5, Opus 4.8, Claude Code, Claude Design. OpenAI - ChatGPT GPT-5.6, Codex GPT-5.6, GPT-5.5. Google - Gemini 3.5 Flash, 3.1 Pro, Antigravity. xAI - Grok, Cursor, Copilot, VS Code, Perplexity, and more. Updated regularly."
yolov5,ultralytics,Python,57681,17468,30,2249,True,True,True,True,Ultralytics YOLOv5 in PyTorch > ONNX > CoreML > TFLite
termux-app,termux,Java,57648,6960,557,3917,False,False,True,True,Termux - a terminal emulator application for Android OS extendible by variety of packages.
html5-boilerplate,h5bp,JavaScript,57554,12276,17,6015,True,True,True,True,"A professional front-end template for building fast, robust, and adaptable web apps or sites."
DeepLearning-500-questions,scutan90,JavaScript,57480,15894,120,2939,False,False,False,True,深度学习500问，以问答形式对常用的概率知识、线性代数、机器学习、深度学习、计算机视觉等热点问题进行阐述，以帮助自己及有需要的读者。 全书分为18个章节，50余万字。由于水平有限，书中不妥之处恳请广大读者批评指正。   未完待续............ 如有意合作，联系scutjy2015@163.com                     版权所有，违权必究       Tan 2018.06
OpenManus,FoundationAgents,Python,57435,9984,509,495,True,False,True,True,"No fortress, purely open ground.  OpenManus is Coming."
mempalace,MemPalace,Python,57332,7398,622,101,False,True,True,True,The best-benchmarked open-source AI memory system. And it's free.
private-gpt,zylon-ai,Python,57328,7597,7,1169,False,False,True,True,"Complete API layer for private AI applications on local models: RAG, skills, tools, MCP, text-to-sql, and more. Works with any OpenAI-compatible inference server."
daily_stock_analysis,ZhuLinsen,Python,57262,49265,61,185,False,True,True,True,"LLM 驱动的多市场股票智能分析系统：多源行情、实时新闻、决策看板与自动推送，支持零成本定时运行。  LLM-powered multi-market stock analysis system with multi-source market data, real-time news, decision dashboard, automated notifications, and cost-free scheduled runs."
fuel-core,FuelLabs,Rust,56964,2860,194,2147,False,True,True,True,Rust full node implementation of the Fuel v2 protocol.
rich,Textualize,Python,56854,2231,360,2438,True,True,True,True,Rich is a Python library for rich text and beautiful formatting in the terminal.
you-get,soimort,Python,56851,9716,382,5076,False,True,True,True,:arrow_double_down: Dumb downloader that scrapes the web
awesome-android-ui,wasabeef,,56833,10249,39,4221,True,False,False,True,A curated list of awesome Android UI/UX libraries
gitea,go-gitea,Go,56829,6906,2674,3543,True,True,True,True,"Git with a cup of tea! Painless self-hosted all-in-one software development service, including Git hosting, code review, team collaboration, package registry and CI/CD"
appwrite,appwrite,TypeScript,56588,5549,1052,2654,True,True,True,True,"Appwrite® - complete cloud infrastructure for your web, mobile and AI apps. Including Auth, Databases, Storage, Functions, Messaging, Hosting, Realtime and more"
face_recognition,ageitgey,Python,56580,13689,830,3420,False,True,True,True,The world's simplest facial recognition api for Python and the command line
MediaCrawler,NanmiCoder,Python,56550,11355,177,1131,False,False,True,True,小红书笔记 | 评论爬虫、抖音视频 | 评论爬虫、快手视频 | 评论爬虫、B 站视频 ｜ 评论爬虫、微博帖子 ｜ 评论爬虫、百度贴吧帖子 ｜ 百度贴吧评论回复爬虫  | 知乎问答文章｜评论爬虫
