repo_name,organization,language,stars,forks,open_issues,age_days,has_coc,has_contributing,has_workflows,has_readme,description
system-design,karanpratapsingh,,43250,5554,3,1368,True,True,False,True,Learn how to design systems at scale and prepare for system design interviews
fuels-rs,FuelLabs,Rust,43211,1360,68,1656,False,False,True,True,Fuel Network Rust SDK
fuels-ts,FuelLabs,TypeScript,43186,1370,78,1714,True,True,True,True,Fuel Network Typescript SDK
full-stack-fastapi-template,fastapi,TypeScript,43165,8543,34,2637,False,True,True,True,"Full stack, modern web application template. Using FastAPI, React, SQLModel, PostgreSQL, Docker, GitHub Actions, automatic HTTPS and more."
pm2,Unitech,JavaScript,43151,2716,1080,4742,False,True,True,True,Node.js Production Process Manager with a built-in Load Balancer.
CPlusPlusThings,Light-City,C++,43117,8836,9,2496,False,False,False,True,C++那些事
what-happens-when,alex,,43086,5737,2064,4572,False,False,True,True,"An attempt to answer the age old interview question ""What happens when you type google.com into your browser and press enter?"""
claude-cookbooks,anthropics,Jupyter Notebook,43006,4860,175,1003,False,True,True,True,A collection of notebooks/recipes showcasing some fun and effective ways of using Claude.
fd,sharkdp,Rust,42983,1059,183,3292,False,True,True,True,"A simple, fast and user-friendly alternative to 'find'"
zig,ziglang,Zig,42936,3068,2988,3935,False,False,False,True,Moved to Codeberg
qlib,microsoft,Python,42925,6742,399,2099,True,False,True,True,"Qlib is an AI-oriented Quant investment platform that aims to use AI tech to empower Quant Research, from exploring ideas to implementing productions. Qlib supports diverse ML modeling paradigms, including supervised learning, market dynamics modeling, and RL, and is now equipped with https://github.com/microsoft/RD-Agent to automate R&D process."
logseq,logseq,Clojure,42885,2628,925,2183,True,True,True,True,"A privacy-first, open-source platform for knowledge management and collaboration. Download link:  http://github.com/logseq/logseq/releases. roadmap: https://logseq.io/p/NX4mc_ggEV"
python-patterns,faif,Python,42738,7037,15,5090,False,False,True,True,A collection of design patterns/idioms in Python
hyperswitch,juspay,Rust,42690,4675,1687,1305,True,True,True,True,"An open source payments switch written in Rust to make payments fast, reliable and affordable"
zod,colinhacks,TypeScript,42673,1948,124,2259,True,True,True,True,TypeScript-first schema validation with static type inference
gradio,gradio-app,Python,42583,3465,466,2703,True,True,True,True,"Build and share delightful machine learning apps, all in Python. 🌟 Star to support our work!"
ray,ray-project,Python,42541,7565,3532,3488,False,True,True,True,Ray is an AI compute engine. Ray consists of a core distributed runtime and a set of AI Libraries for accelerating ML workloads.
jan,janhq,TypeScript,42520,2856,372,1002,True,True,True,True,Jan is an open source alternative to ChatGPT that runs 100% offline on your computer.
cal.diy,calcom,TypeScript,42511,13233,1325,1879,True,True,True,True,Scheduling infrastructure for absolutely everyone.
nanobot,HKUDS,Python,42483,7464,901,102,False,True,True,True,"""🐈 nanobot: The Ultra-Lightweight Personal AI Agent"""
git-flight-rules,k88hudson,,42481,3182,16,4314,False,False,False,True,Flight rules for git
ccxt,ccxt,Python,42448,8675,1314,3287,False,True,True,True,A cryptocurrency trading API with more than 100 exchanges in JavaScript / TypeScript / Python / C# / PHP / Go 
bubbletea,charmbracelet,Go,42398,1213,176,2316,False,True,True,True,A powerful little TUI framework 🏗
payload,payloadcms,TypeScript,42396,3715,727,1955,False,True,True,True,"Payload is the open-source, fullstack Next.js framework, giving you instant backend superpowers. Get a full TypeScript backend and admin panel instantly. Use Payload as a headless CMS or for building powerful applications."
Alamofire,Alamofire,Swift,42381,7656,40,4306,False,True,True,True,Elegant HTTP Networking in Swift
DeepSpeed,deepspeedai,Python,42334,4827,1300,2303,True,True,True,True,"DeepSpeed is a deep learning optimization library that makes distributed training and inference easy, efficient, and effective."
diagrams,mingrammer,Python,42259,2725,391,2293,False,True,True,True,:art: Diagram as Code for prototyping cloud system architectures
ailearning,apachecn,Python,42255,11585,3,3365,False,False,False,True,AiLearning：数据分析+机器学习实战+线性代数+PyTorch+NLTK+TF2
desktop,zen-browser,JavaScript,42033,1498,530,778,True,False,True,True,Welcome to a calmer internet
shannon,KeygraphHQ,TypeScript,41962,4761,39,230,False,False,True,True,"Shannon Lite is an autonomous, white-box AI pentester for web applications and APIs. It analyzes your source code, identifies attack vectors, and executes real exploits to prove vulnerabilities before they reach production."
curl,curl,C,41871,7199,48,5901,True,True,True,True,"A command line tool and library for transferring data with URL syntax, supporting DICT, FILE, FTP, FTPS, GOPHER, GOPHERS, HTTP, HTTPS, IMAP, IMAPS, LDAP, LDAPS, MQTT, MQTTS, POP3, POP3S, RTSP, SCP, SFTP, SMB, SMBS, SMTP, SMTPS, TELNET, TFTP, WS and WSS. libcurl offers a myriad of powerful features"
swiper,nolimits4web,JavaScript,41853,9669,249,5174,True,True,True,True,Most modern mobile touch slider with hardware accelerated transitions
Fabric,danielmiessler,Go,41706,4139,43,862,True,True,True,True,Fabric is an open-source framework for augmenting humans using AI. It provides a modular system for solving specific problems using a crowdsourced set of AI prompts that can be used anywhere.
hexo,hexojs,TypeScript,41706,7,99,4981,True,True,True,True,"A fast, simple & powerful blog framework, powered by Node.js."
agent-skills,addyosmani,Shell,41694,4578,89,88,False,True,True,True,Production-grade engineering skills for AI coding agents.
pure-bash-bible,dylanaraps,Shell,41574,3637,62,2893,False,True,False,True,📖 A collection of pure bash alternatives to external processes.
dubbo,apache,Java,41524,26453,963,5077,True,True,True,True,The java implementation of Apache Dubbo. An RPC and microservice framework.
uni-app,dcloudio,Objective-C,41521,3712,687,2863,False,True,True,True,A cross-platform framework using Vue.js
fastlane,fastlane,Ruby,41517,6004,784,4181,True,True,True,True,🚀 The easiest way to automate building and releasing your iOS and Android apps
yarn,yarnpkg,JavaScript,41514,2731,2064,3768,True,True,True,True,The 1.x line is frozen - features and bugfixes now happen on https://github.com/yarnpkg/berry
black,psf,Python,41508,2778,312,2983,True,True,True,True,The uncompromising Python code formatter
HEU_KMS_Activator,zbezj,,41450,3861,170,2518,False,False,False,True,
WeChatMsg,LC044,,41420,5114,25,1220,False,False,False,True,
ColossalAI,hpcaitech,Python,41382,4512,499,1659,False,True,True,True,"Making large AI models cheaper, faster and more accessible"
cheat.sh,chubin,Python,41371,1924,144,3294,False,True,True,True,the only cheat sheet you need
data-engineer-handbook,DataExpert-io,Jupyter Notebook,41314,7827,38,907,False,False,False,True,This is a repo with links to everything you'd ever want to learn about data engineering
puter,HeyPuter,JavaScript,41282,3752,14,803,False,True,True,True,"🌐 The Internet Computer! Free, Open-Source, and Self-Hostable."
nw.js,nwjs,JavaScript,41189,3860,897,5245,False,False,False,True,Call all Node.js modules directly from DOM/WebWorker and enable a new way of writing applications with all Web technologies.
ChatGLM-6B,zai-org,Python,41107,5165,606,1158,False,False,False,True,ChatGLM-6B: An Open Bilingual Dialogue Language Model | 开源双语对话语言模型
vue2-elm,bailicangdu,Vue,41090,12292,121,3430,False,False,True,True,Large single page application with 45 pages built on vue2 + vuex. 基于 vue2 + vuex 构建一个具有 45 个页面的大型单页面应用
tabler,tabler,HTML,41050,4363,129,3024,True,False,True,True,Tabler is free and open-source HTML Dashboard UI Kit built on Bootstrap
styled-components,styled-components,TypeScript,41023,2526,18,3558,True,True,True,True,"Fast, expressive styling for React. Server components, client components, streaming SSR, React Native—one API."
vuetify,vuetifyjs,TypeScript,41003,7132,585,3532,True,True,True,True,🐉 Vue Component Framework
daisyui,saadeghi,Svelte,40928,1630,59,1993,False,True,True,True,"🌼 🌼 🌼 🌼 🌼  The most popular, free and open-source Tailwind CSS component library"
aria2,aria2,C++,40923,3861,1144,5647,False,False,True,True,"aria2 is a lightweight multi-protocol & multi-source, cross platform download utility operated in command-line. It supports HTTP/HTTPS, FTP, SFTP, BitTorrent and Metalink."
BettaFish,666ghj,Python,40913,7553,27,682,True,True,True,True,微舆：人人可用的多Agent舆情分析助手，打破信息茧房，还原舆情原貌，预测未来走向，辅助决策！从0实现，不依赖任何框架。
data-engineering-zoomcamp,DataTalksClub,Jupyter Notebook,40863,8162,6,1666,False,False,True,True,Data Engineering Zoomcamp is a free 9-week course on building production-ready data pipelines. The next cohort starts in January 2026. Join the course here 👇🏼
open-design,nexu-io,TypeScript,40697,4651,366,17,False,True,True,True,"🎨 Local-first, open-source alternative to Anthropic's Claude Design. ⚡ 19 Skills · ✨ 71 brand-grade Design Systems 🖼 Generate web · desktop · mobile prototypes · slides · images · videos · HyperFrames 📦 Sandboxed preview · HTML/PDF/PPTX/MP4 export 🤖 Runs on Claude Code / Codex / Cursor / Gemini / OpenCode / Qwen / Copilot / Hermes / Kimi CLI."
paperless-ngx,paperless-ngx,Python,40688,2693,5,1552,True,True,True,True,"A community-supported supercharged document management system: scan, index and archive all your documents"
50projects50days,bradtraversy,CSS,40548,9759,47,2005,False,False,False,True,"50+ mini web projects using HTML, CSS & JS"
vnpy,vnpy,Python,40525,11681,6,4092,True,False,True,True,基于Python的开源量化交易平台开发框架
zju-icicles,QSCTech,HTML,40517,9585,10,3607,False,False,True,True,浙江大学课程攻略共享计划
lossless-cut,mifi,TypeScript,40439,1955,273,3483,False,True,True,True,The swiss army knife of lossless video/audio editing
free,freefq,,40431,5647,573,2168,False,False,False,True,翻墙、免费翻墙、免费科学上网、免费节点、免费梯子、免费ss/v2ray/trojan节点、蓝灯、谷歌商店、翻墙梯子
chakra-ui,chakra-ui,TypeScript,40426,3607,22,2462,True,True,True,True,Chakra UI is a component system for building SaaS products with speed ⚡️
remote-jobs,remoteintech,JavaScript,40354,3938,11,3867,True,True,True,True,Source for remoteintech.company — a community-maintained directory of remote-friendly tech companies
vim,vim,Vim Script,40353,6043,1665,3922,False,True,True,True,The official Vim repository
cobalt,imputnet,Svelte,40296,3418,240,1406,False,True,True,True,best way to save what you love
wrk,wg,C,40274,3030,203,5168,False,False,True,True,Modern HTTP benchmarking tool
system_prompts_leaks,asgeirtj,,40228,6687,20,377,False,True,True,True,"Extracted system prompts from ChatGPT (GPT-5.5 Thinking), Claude (Opus 4.7, Opus 4.6, Sonnet 4.6, Claude Code), Gemini (3.1 Pro, 3 Flash, Gemini CLI), Grok (4.3 beta), Perplexity, and more. Updated regularly."
trpc,trpc,TypeScript,40216,1612,214,2127,False,True,True,True,🧙‍♀️  Move Fast and Break Nothing. End-to-end typesafe APIs made easy. 
agno,agno-agi,Python,40132,5376,901,1471,True,True,True,True,"Build, run, and manage agent platforms."
tidb,pingcap,Go,40090,6185,6204,3904,True,True,True,True,"TiDB is built for agentic workloads that grow unpredictably, with ACID guarantees and native support for transactions, analytics, and vector search. No data silos. No noisy neighbors. No infrastructure ceiling."
php-src,php,C,40066,8047,1792,5447,False,True,True,True,The PHP Interpreter
faiss,facebookresearch,C++,40045,4380,295,3383,True,True,True,True,A library for efficient similarity search and clustering of dense vectors.
bert,google-research,Python,40016,9719,880,2758,False,True,False,True,TensorFlow code and pre-trained models for BERT
chatbox,chatboxai,TypeScript,39954,4056,1155,1165,False,False,True,True,Powerful AI Client
Awesome-Design-Tools,goabstract,JavaScript,39910,2248,149,2648,False,False,True,True,The best design tools and plugins for everything 👉
esbuild,evanw,Go,39896,1309,615,3621,False,False,True,True,An extremely fast bundler for the web
appsmith,appsmithorg,TypeScript,39810,4566,4469,2145,True,True,True,True,"Platform to build admin panels, internal tools, and dashboards. Integrates with 25+ databases and any API."
gorm,go-gorm,Go,39750,4145,518,4584,True,False,True,True,"The fantastic ORM library for Golang, aims to be developer friendly"
video.js,videojs,JavaScript,39743,7502,648,5844,True,True,True,True,Video.js - open source HTML5 video player
fiber,gofiber,Go,39735,1982,45,2311,True,True,True,True,⚡️ Express inspired web framework written in Go
photoprism,photoprism,Go,39670,2263,471,3029,True,True,True,True,AI-Powered Photos App for the Decentralized Web 🌈💎✨
chrome-devtools-mcp,ChromeDevTools,TypeScript,39640,2516,97,245,False,True,True,True,Chrome DevTools for coding agents
phaser,phaserjs,JavaScript,39624,7131,103,4780,True,True,True,True,"Phaser is a fun, free and fast 2D game framework for making HTML5 games for desktop and mobile web browsers, supporting Canvas and WebGL rendering."
awesome-cursorrules,PatrickJS,JavaScript,39526,3374,1,605,True,True,True,True,📄  Configuration files that enhance Cursor AI editor experience with custom rules and behaviors
Deep-Learning-Papers-Reading-Roadmap,floodsung,Python,39493,7306,92,3499,False,False,False,True,Deep Learning papers reading roadmap for anyone who are eager to learn this amazing tech!
nushell,nushell,Rust,39480,2129,1481,2561,True,True,True,True,A new type of shell
FastChat,lm-sys,Python,39472,4793,1032,1153,False,False,True,True,"An open platform for training, serving, and evaluating large language models. Release repo for Vicuna and Chatbot Arena."
react-bits,DavidHDev,JavaScript,39445,1781,4,646,False,True,True,True,"An open source collection of animated, interactive & fully customizable React components for building memorable websites."
shellcheck,koalaman,Haskell,39424,1914,1236,4927,False,False,True,True,"ShellCheck, a static analysis tool for shell scripts"
styleguide,google,HTML,39294,12977,170,4012,True,True,True,True,Style guides for Google-originated open-source projects
airi,moeru-ai,TypeScript,39294,3984,143,529,True,True,True,True,"💖🧸 Self hosted, you-owned Grok Companion, a container of souls of waifu, cyber livings to bring them into our worlds, wishing to achieve Neuro-sama's altitude. Capable of realtime voice chat, Minecraft, Factorio playing. Web / macOS / Windows supported."
ChatTTS,2noise,Python,39254,4256,59,717,False,False,True,True,A generative speech model for daily dialogue.
minds-platform,mindsdb,Python,39170,6205,82,2842,True,True,True,True,"Platform dedicated to building an open foundation for applied Artificial Intelligence, designed for people seeking production-ready AI systems they can truly control, extend and deploy anywhere."
quivr,QuivrHQ,Python,39156,3744,23,1098,False,False,True,True,"Opiniated RAG for integrating GenAI in your apps 🧠   Focus on your product rather than the RAG. Easy integration in existing products with customisation!  Any LLM: GPT4, Groq, Llama. Any Vectorstore: PGVector, Faiss. Any Files. Anyway you want."
bark,suno-ai,Jupyter Notebook,39121,4686,267,1133,False,False,False,True,🔊 Text-Prompted Generative Audio Model
leveldb,google,C++,39075,8199,388,4278,True,True,True,True,LevelDB is a fast key-value storage library written at Google that provides an ordered mapping from string keys to string values.
BitNet,microsoft,Python,38986,3554,312,647,True,False,True,True,Official inference framework for 1-bit LLMs
supervision,roboflow,Python,38982,3489,105,1263,True,True,True,True,We write your reusable computer vision tools. 💜
novu,novuhq,TypeScript,38979,4287,157,1722,True,True,True,True,"The open-source notification infrastructure. In-app Inbox component, E-mail, SMS, Push and Slack Integrations."
devdocs,freeCodeCamp,Ruby,38908,2598,233,4585,True,True,True,True,API Documentation Browser
materialize,Dogfalo,JavaScript,38879,4641,793,4262,True,True,True,True,"Materialize, a CSS Framework based on Material Design"
stats,exelban,Swift,38797,1317,36,2542,False,False,True,True,macOS system monitor in your menu bar
FlClash,chen08209,Dart,38756,2409,770,1003,False,False,True,True,"A multi-platform proxy client based on ClashMeta,simple and easy to use, open-source and ad-free."
preact,preactjs,JavaScript,38618,2032,151,3899,True,True,True,True,⚛️ Fast 3kB React alternative with the same modern API. Components & Virtual DOM.
Xray-core,XTLS,Go,38614,5383,46,2012,True,False,True,True,"Xray, Penetrates Everything. Also the best v2ray-core. Where the magic happens. An open platform for various uses."
halo,halo-dev,Java,38606,10257,175,2976,True,True,True,True,Halo 是一款强大易用的开源建站工具，从个人博客、知识库，到企业官网、在线商城，Halo 都能助您轻松实现，一站式满足您的多样化建站需求。
googletest,google,C++,38604,10772,551,3943,True,True,True,True,GoogleTest - Google Testing and Mocking Framework
gkd,gkd-kit,Kotlin,38542,1839,16,1046,False,False,True,True,"基于无障碍，高级选择器，订阅规则的自定义屏幕点击安卓应用 | An Android APP with custom screen tapping based on Accessibility, Advanced Selectors, and Subscription Rules"
it-tools,CorentinTh,Vue,38532,4858,788,2230,False,False,True,True,"Collection of handy online tools for developers, with great UX. "
polars,pola-rs,Rust,38496,2826,2743,2192,True,True,True,True,"Extremely fast Query Engine for DataFrames, written in Rust"
outline,outline,TypeScript,38484,3291,68,3644,True,False,True,True,"The fastest knowledge base for growing teams. Beautiful, realtime collaborative, feature packed, and markdown compatible."
insomnia,Kong,TypeScript,38404,2286,839,3674,True,True,True,True,"The open-source, cross-platform API client for GraphQL, REST, WebSockets, SSE and gRPC. With Cloud, Local and Git storage."
python-cheatsheet,gto76,Python,38397,6730,0,3032,False,False,True,True,Comprehensive Python Cheatsheet
GitNexus,abhigyanpatwari,TypeScript,38397,4396,297,285,False,True,True,True,"GitNexus: The Zero-Server Code Intelligence Engine -       GitNexus is a client-side knowledge graph creator that runs entirely in your browser. Drop in a GitHub repo or ZIP file, and get an interactive knowledge graph wit a built in Graph RAG Agent. Perfect for code exploration"
lapce,lapce,Rust,38376,1270,879,3019,False,True,True,True,Lightning-fast and Powerful Code Editor written in Rust
headscale,juanfont,Go,38375,2104,117,2153,True,True,True,True,"An open source, self-hosted implementation of the Tailscale control server"
ink,vadimdemedes,TypeScript,38374,987,27,3259,True,True,True,True,🌈 React for interactive command-line apps
llvm-project,llvm,LLVM,38339,17139,36118,3445,True,True,True,True,The LLVM Project is a collection of modular and reusable compiler and toolchain technologies.
manim,ManimCommunity,Python,38317,2829,513,2187,True,True,True,True,A community-maintained Python framework for creating mathematical animations. 
Folo,RSSNext,TypeScript,38295,2047,371,767,True,True,True,True,🧡 Folo is the AI RSS Reader
ant-design-pro,ant-design,TypeScript,38221,8240,28,3184,True,False,True,True,👨🏻‍💻👩🏻‍💻 Use Ant Design like a Pro!
MPAndroidChart,PhilJay,Java,38213,8995,2190,4402,False,True,False,True,"A powerful 🚀 Android chart view / graph view library, supporting line- bar- pie- radar- bubble- and candlestick charts as well as scaling, panning and animations."
duckdb,duckdb,C++,38208,3232,599,2879,True,True,True,True,DuckDB is an analytical in-process SQL database management system
istio,istio,Go,38200,8300,465,3464,False,True,True,True,"Connect, secure, control, and observe services."
impress.js,impress,JavaScript,38178,6605,59,5251,False,False,True,True,It's a presentation framework based on the power of CSS3 transforms and transitions in modern browsers and inspired by the idea behind prezi.com.
metasploit-framework,rapid7,Ruby,38177,14857,633,5372,True,True,True,True,Metasploit Framework
NewPipe,TeamNewPipe,Java,38154,3577,1400,3906,False,True,True,True,A libre lightweight streaming front-end for Android.
dive-into-llms,Lordog,Jupyter Notebook,38141,4683,13,766,False,False,False,True,《动手学大模型Dive into LLMs》系列编程实践教程
cli,httpie,Python,38132,3953,283,5192,True,True,True,True,"🥧 HTTPie CLI  — modern, user-friendly command-line HTTP client for the API era. JSON support, colors, sessions, downloads, plugins & more."
engineering-blogs,kilimchoi,Ruby,38096,2008,147,3988,False,True,True,True,A curated list of engineering blogs
tesseract.js,naptha,JavaScript,38077,2366,46,3978,False,False,True,True,Pure Javascript OCR for more than 100 Languages 📖🎉🖥
yazi,sxyazi,Rust,38074,865,62,1041,True,True,True,True,"💥 Blazing fast terminal file manager written in Rust, based on async I/O."
Langchain-Chatchat,chatchat-space,Python,38027,6209,29,1140,False,False,True,True,"Langchain-Chatchat（原Langchain-ChatGLM）基于 Langchain 与 ChatGLM, Qwen 与 Llama 等语言模型的 RAG 与 Agent 应用 | Langchain-Chatchat (formerly langchain-ChatGLM), local knowledge based LLM (like ChatGLM, Qwen and Llama) RAG and Agent app with langchain "
spacedrive,spacedriveapp,Rust,38013,1284,32,1691,True,True,True,True,"Spacedrive is an open source cross-platform file explorer, powered by a virtual distributed filesystem written in Rust."
GPT_API_free,chatanywhere,,37943,2645,16,1117,False,False,False,True,Free ChatGPT&DeepSeek API Key，免费ChatGPT&DeepSeek API。免费接入DeepSeek API和GPT4 API，支持 gpt | deepseek | claude | gemini | grok 等排名靠前的常用大模型。
aspnetcore,dotnet,C#,37933,10653,3911,4448,True,True,True,True,"ASP.NET Core is a cross-platform .NET framework for building modern cloud-based web applications on Windows, Mac, or Linux."
google-research,google-research,Jupyter Notebook,37917,8406,1916,2779,False,True,True,True,Google Research
ToolJet,ToolJet,JavaScript,37903,5062,1000,1871,True,True,True,True,"ToolJet is the open-source foundation of ToolJet AI - the enterprise app generation platform for building internal tools, dashboard, business applications, workflows and AI agents 🚀"
interview,huihut,C++,37805,8109,2,3016,False,False,True,True,"📚 C/C++ 技术面试基础知识总结，包括语言、程序库、数据结构、算法、系统、网络、链接装载库等知识及面试经验、招聘、内推等信息。This repository is a summary of the basic knowledge of recruiting job seekers and beginners in the direction of C/C++ technology, including language, program library, data structure, algorithm, system, network, link loading library, interview experience, recruitment, recommendation, etc."
freecodecamp.cn,FreeCodeCampChina,CSS,37704,1414,159,3514,False,True,False,True,FCC China open source codebase and curriculum. Learn to code and help nonprofits.
RevokeMsgPatcher,huiyadanli,C#,37608,3991,51,2489,False,False,True,True,:trollface: A hex editor for WeChat/QQ/TIM - PC版微信/QQ/TIM防撤回补丁（我已经看到了，撤回也没用了）
wtfjs,denysdovhan,JavaScript,37599,2693,44,3226,False,True,True,True,🤪 A list of funny and tricky JavaScript examples
v,vlang,V,37576,2244,90,2653,True,True,True,True,"Simple, fast, safe, compiled language for developing maintainable software. Compiles itself in <1s with zero library dependencies. Supports automatic C => V translation. https://vlang.io"
antigravity-awesome-skills,sickn33,Python,37551,6142,2,120,True,True,True,True,"Installable GitHub library of 1,400+ agentic skills for Claude Code, Cursor, Codex CLI, Gemini CLI, Antigravity, and more. Includes installer CLI, bundles, workflows, and official/community skill collections."
ShareX,ShareX,C#,37516,3736,636,4601,False,False,True,True,"ShareX is a free and open-source application that enables users to capture or record any area of their screen with a single keystroke. It also supports uploading images, text, and various file types to a wide range of destinations."
taro,NervJS,TypeScript,37472,4884,1720,2958,False,True,True,True,开放式跨端跨框架解决方案，支持使用 React/Vue 等框架来开发微信/京东/百度/支付宝/字节跳动/ QQ 小程序/H5/React Native 等应用。  https://taro.zone/
sniffnet,GyulyVGC,Rust,37469,1509,58,1383,True,True,True,True,Comfortably monitor your Internet traffic 🕵️‍♂️
qBittorrent,qbittorrent,C++,37451,4675,2591,5213,False,True,True,True,qBittorrent BitTorrent client
GFPGAN,TencentARC,Python,37450,6277,403,1883,True,False,True,True,GFPGAN aims at developing Practical Algorithms for Real-world Face Restoration.
portainer,portainer,TypeScript,37432,2820,742,3647,True,True,True,True,Making Docker and Kubernetes management easy.
Open-Assistant,LAION-AI,Python,37411,3307,296,1249,False,True,True,True,"OpenAssistant is a chat-based assistant that understands tasks, can interact with third-party systems, and retrieve information dynamically to do so."
compose,docker,Go,37386,5795,106,4539,False,True,True,True,Define and run multi-container applications with Docker
sqlmap,sqlmapproject,Python,37368,6256,60,5070,True,True,True,True,Automatic SQL injection and database takeover tool
