repo_name,organization,language,stars,forks,open_issues,age_days,has_coc,has_contributing,has_workflows,has_readme,description
jest,jestjs,TypeScript,45537,6809,231,4600,True,True,True,True,Delightful JavaScript Testing.
AdminLTE,ColorlibHQ,Astro,45507,18193,0,4585,True,True,True,True,AdminLTE - Free admin dashboard template based on Bootstrap 5
CL4R1T4S,elder-plinius,,45498,9274,118,497,False,False,False,True,"LEAKED SYSTEM PROMPTS FOR CHATGPT, CLAUDE, GEMINI, GROK, PERPLEXITY, CURSOR, LOVABLE, REPLIT, AND MORE! - AI SYSTEMS TRANSPARENCY FOR ALL! 👐"
helix,helix-editor,Rust,45424,3610,1534,2235,False,True,True,True,A post-modern modal text editor.
pandoc,jgm,Haskell,45405,3917,1046,5960,False,True,True,True,Universal markup converter
Summer2026-Internships,SimplifyJobs,Python,45384,3197,54,2243,False,True,True,True,"Summer 2026 software engineering, data science, AI, quant, product management, and hardware internship postings. Updated daily by Simplify and Pitt CSC."
Leaflet,Leaflet,JavaScript,45338,6141,547,5774,True,True,True,True,🍃 JavaScript library for mobile-friendly interactive maps 🇺🇦
CLI-Anything,HKUDS,Python,45337,4239,72,128,False,True,True,True,"""CLI-Anything: Making ALL Software Agent-Native"" -- CLI-Hub: https://clianything.cc/"
cli,cli,Go,45276,8689,1037,2476,True,True,True,True,GitHub’s official command line tool
RSSHub,DIYgod,TypeScript,45265,10009,360,3025,True,True,True,True,🧡 Everything is RSSible
streamlit,streamlit,Python,45238,4316,1286,2517,True,True,True,True,Streamlit — A faster way to build and share data apps.
milvus,milvus-io,Go,45226,4121,1044,2493,True,True,True,True,"Milvus is a high-performance, cloud-native vector database built for scalable vector ANN search"
TrafficMonitor,zhongyang219,C++,45220,3723,1317,3272,False,False,True,True,这是一个用于显示当前网速、CPU及内存利用率的桌面悬浮窗软件，并支持任务栏显示，支持更换皮肤。
grpc,grpc,C++,45203,11330,1349,4236,True,True,True,True,"C++ based gRPC (C++, Python, Ruby, Objective-C, PHP, C#)"
CppCoreGuidelines,isocpp,CSS,45177,5553,251,3982,False,True,True,True,"The C++ Core Guidelines are a set of tried-and-true guidelines, rules, and best practices about coding in C++"
siyuan,siyuan-note,TypeScript,45121,2886,316,2144,True,True,True,True,"A privacy-first, self-hosted, fully open source personal knowledge management software, written in typescript and golang."
edex-ui,GitSquared,JavaScript,44971,3153,6,3454,False,False,True,True,"A cross-platform, customizable science fiction terminal emulator with advanced monitoring & touchscreen support."
pyenv,pyenv,Shell,44950,3261,54,5065,False,True,True,True,Simple Python version management
meteor,meteor,JavaScript,44800,5242,451,5291,True,True,True,True,"Meteor, the JavaScript App Platform"
react-hook-form,react-hook-form,TypeScript,44794,2444,45,2688,True,True,True,True,📋 React Hooks for form state management and validation (Web + React Native)
reactjs-interview-questions,sudheerj,JavaScript,44692,10365,6,2966,False,False,True,True,List of top 500 ReactJS Interview Questions & Answers....Coding exercise questions are coming soon!!
hyper,vercel,TypeScript,44653,3565,1043,3665,False,False,True,True,A terminal built on web technologies
system-design,karanpratapsingh,,44513,5796,3,1429,True,True,False,True,Learn how to design systems at scale and prepare for system design interviews
mitmproxy,mitmproxy,Python,44304,4629,453,5993,True,True,True,True,An interactive TLS-capable intercepting HTTP proxy for penetration testers and software developers.
Files,files-community,C#,44303,2790,476,2748,True,True,True,True,A modern file manager that helps users organize their files and folders.
sentry,getsentry,Python,44293,4750,2131,5797,True,True,True,True,Developer-first error tracking and performance monitoring
cobra,spf13,Go,44270,3163,386,4697,False,True,True,True,A Commander for modern Go CLI interactions
jsoncrack.com,AykutSarac,TypeScript,44242,3563,36,1626,True,True,True,True,"✨ Innovative and open-source visualization application that transforms various data formats, such as JSON, YAML, XML and CSV into interactive graphs."
full-stack-fastapi-template,fastapi,TypeScript,44238,8792,15,2698,False,True,True,True,"Full stack, modern web application template. Using FastAPI, React, SQLModel, PostgreSQL, Docker, GitHub Actions, automatic HTTPS and more."
EasySpider,NaiboWang,JavaScript,44233,5377,268,2188,False,False,True,True,A visual no-code/code-free web crawler/spider易采集：一个可视化浏览器自动化测试/数据采集/网页爬虫软件，可以无代码图形化的设计和执行爬虫任务。别名：ServiceWrapper面向Web应用的智能化服务封装系统。
GitNexus,abhigyanpatwari,TypeScript,44124,4912,298,346,False,True,True,True,"GitNexus: The Zero-Server Code Intelligence Engine -       GitNexus is a client-side knowledge graph creator that runs entirely in your browser. Drop in a git repository (Github, Gitlab, Azure, Local) or ZIP file, and get an interactive knowledge graph with a built in Graph RAG Agent. Perfect for code exploration"
babel,babel,TypeScript,44105,5970,766,4307,True,True,True,True,🐠 Babel is a compiler for writing next generation JavaScript.
parcel,parcel-bundler,JavaScript,44026,2278,596,3263,True,True,True,True,The zero configuration build tool for the web. 📦🚀
react-use,streamich,TypeScript,43997,3265,661,2817,False,True,True,True,React Hooks — 👍
front-end-interview-handbook,yangshun,MDX,43976,5934,12,3104,True,True,True,True,Front End interview preparation materials for busy engineers (updated for 2026)
build-web-application-with-golang,astaxie,Go,43924,10451,138,5094,False,False,False,True,A golang ebook intro how to build a web with golang
retrofit,square,HTML,43912,7335,170,5790,False,True,True,True,A type-safe HTTP client for Android and the JVM
logseq,logseq,Clojure,43875,2715,935,2244,True,True,True,True,"A privacy-first, open-source platform for knowledge management and collaboration. Download link:  http://github.com/logseq/logseq/releases. roadmap: https://logseq.io/p/NX4mc_ggEV"
kong,Kong,Lua,43786,5176,161,4257,True,True,True,True,🦍 The API and AI Gateway
bubbletea,charmbracelet,Go,43744,1263,190,2377,False,True,True,True,A powerful little TUI framework 🏗
fd,sharkdp,Rust,43743,1095,177,3353,False,True,True,True,"A simple, fast and user-friendly alternative to 'find'"
TensorFlow-Examples,aymericdamien,Jupyter Notebook,43737,14696,228,3898,False,False,False,True,TensorFlow Tutorial and Examples for Beginners (support TF v1 & v2)
spark,apache,Scala,43615,29275,447,4522,True,True,True,True,Apache Spark - A unified analytics engine for large-scale data processing
data-engineering-zoomcamp,DataTalksClub,Jupyter Notebook,43595,8581,1,1727,False,False,True,True,Data Engineering Zoomcamp is a free 9-week course on building production-ready data pipelines. The next cohort starts in January 2026. Join the course here 👇🏼
payload,payloadcms,TypeScript,43587,3921,865,2016,False,True,True,True,"Payload is the open-source, fullstack Next.js framework, giving you instant backend superpowers. Get a full TypeScript backend and admin panel instantly. Use Payload as a headless CMS or for building powerful applications."
jan,janhq,TypeScript,43574,2902,388,1063,True,True,True,True,Jan is an open source alternative to ChatGPT that runs 100% offline on your computer.
react-bits,DavidHDev,JavaScript,43409,2028,2,707,False,True,True,True,"An open source collection of animated, interactive & fully customizable React components for building memorable websites."
desktop,zen-browser,JavaScript,43403,1633,581,839,True,False,True,True,Welcome to a calmer internet
zig,ziglang,Zig,43369,3222,2893,3996,False,False,False,True,Moved to Codeberg
ccxt,ccxt,Python,43302,8739,1288,3348,False,True,True,True,A cryptocurrency trading API with more than 100 exchanges in JavaScript / TypeScript / Python / C# / PHP / Go / Java 
CPlusPlusThings,Light-City,C++,43275,8811,9,2557,False,False,False,True,C++那些事
zod,colinhacks,TypeScript,43269,2073,265,2320,True,True,True,True,TypeScript-first schema validation with static type inference
hyperswitch,juspay,Rust,43258,4933,2022,1366,True,True,True,True,"Open source, composable payments platform | PCI compliant | SaaS and Self-host options | Enables connectivity to multiple payment, payout, fraud, vault and tokenization providers | Uplifts authorization with intelligent routing and revenue recovery | Reduce payment processing costs with cost observability | Reduces payment ops with reconciliation"
agentic-awesome-skills,sickn33,Python,43258,6857,1,181,True,True,True,True,"Installable GitHub library of 1,900+ agentic skills for Claude Code, Cursor, Codex CLI, Autohand Code, Gemini CLI, Antigravity, and more. Includes specialized plugins, installer CLI, bundles, workflows, and official/community skill collections."
ray,ray-project,Python,43247,7795,3467,3549,False,True,True,True,Ray is an AI compute engine. Ray consists of a core distributed runtime and a set of AI Libraries for accelerating ML workloads.
pm2,Unitech,JavaScript,43232,2710,1083,4803,False,True,True,True,Node.js/Bun Production Process Manager with a built-in Load Balancer.
what-happens-when,alex,,43223,5736,2065,4633,False,False,True,True,"An attempt to answer the age old interview question ""What happens when you type google.com into your browser and press enter?"""
gradio,gradio-app,Python,43135,3548,219,2764,True,True,True,True,"Build and share delightful machine learning apps, all in Python. 🌟 Star to support our work!"
fuels-rs,FuelLabs,Rust,43114,1360,70,1717,False,False,True,True,Fuel Network Rust SDK
fuels-ts,FuelLabs,TypeScript,43081,1369,78,1775,True,True,True,True,Fuel Network Typescript SDK
Fabric,danielmiessler,Go,43077,4204,67,923,True,True,True,True,Fabric is an open-source framework for augmenting humans using AI. It provides a modular system for solving specific problems using a crowdsourced set of AI prompts that can be used anywhere.
paperless-ngx,paperless-ngx,Python,43034,2895,18,1613,True,True,True,True,"A community-supported supercharged document management system: scan, index and archive all your documents"
vnpy,vnpy,Python,42987,12126,20,4153,True,False,True,True,基于Python的开源量化交易平台开发框架
3x-ui,MHSanaei,Go,42970,8182,106,1251,False,True,True,True,"Xray panel supporting multi-protocol multi-user expire day & traffic & IP limit (Vmess, Vless, Trojan, ShadowSocks, Wireguard, Hysteria, Tunnel, Mixed, HTTP, Tun, MTProto) "
dive-into-llms,Lordog,Jupyter Notebook,42964,5202,14,827,False,False,False,True,《动手学大模型Dive into LLMs》系列编程实践教程
python-patterns,faif,Python,42864,7012,15,5151,False,False,True,True,A collection of design patterns/idioms in Python
puter,HeyPuter,TypeScript,42717,3952,17,864,False,True,True,True,"🌐 The Internet Computer! Free, Open-Source, and Self-Hostable."
DeepSpeed,deepspeedai,Python,42707,4883,1299,2364,True,True,True,True,"DeepSpeed is a deep learning optimization library that makes distributed training and inference easy, efficient, and effective."
git-flight-rules,k88hudson,,42552,3174,14,4375,False,False,False,True,Flight rules for git
HEU_KMS_Activator,zbezj,,42488,3903,174,2579,False,False,False,True,
diagrams,mingrammer,Python,42442,2728,392,2354,False,True,True,True,:art: Diagram as Code for prototyping cloud system architectures
Alamofire,Alamofire,Swift,42406,7665,44,4366,False,True,True,True,Elegant HTTP Networking in Swift
curl,curl,C,42404,7266,73,5962,True,True,True,True,"A command line tool and library for transferring data with URL syntax, supporting DICT, FILE, FTP, FTPS, GOPHER, GOPHERS, HTTP, HTTPS, IMAP, IMAPS, LDAP, LDAPS, MQTT, MQTTS, POP3, POP3S, RTSP, SCP, SFTP, SMB, SMBS, SMTP, SMTPS, TELNET, TFTP, WS and WSS. libcurl offers a myriad of powerful features"
ailearning,apachecn,Python,42378,11539,4,3426,False,False,False,True,AiLearning：数据分析+机器学习实战+线性代数+PyTorch+NLTK+TF2
airi,moeru-ai,TypeScript,42287,4239,183,590,True,True,True,True,"💖🧸 Self hosted, you-owned Grok Companion, a container of souls of waifu, cyber livings to bring them into our worlds, wishing to achieve Neuro-sama's altitude. Capable of realtime voice chat, Minecraft, Factorio playing. Web / macOS / Windows supported."
new-api,QuantumNous,Go,42252,9796,1021,977,True,False,True,True,"A unified AI model hub for aggregation & distribution. It supports cross-converting various LLMs into OpenAI-compatible, Claude-compatible, or Gemini-compatible formats. A centralized gateway for personal and enterprise model management. 🍥"
data-engineer-handbook,DataExpert-io,Jupyter Notebook,42211,7914,39,968,False,False,False,True,This is a repo with links to everything you'd ever want to learn about data engineering
lossless-cut,mifi,TypeScript,42083,2070,269,3544,False,True,True,True,The swiss army knife of lossless video/audio editing
obsidian-skills,kepano,,41960,2988,54,193,False,False,True,True,"Agent skills for Obsidian. Teach your agent to use Obsidian CLI and open formats including Markdown, Bases, JSON Canvas."
CLIProxyAPI,router-for-me,Go,41957,6706,280,378,False,False,True,True,"Wrap Antigravity, ChatGPT Codex, Claude Code, Grok Build as an OpenAI/Gemini/Claude/Codex compatible API service, allowing you to enjoy the free Gemini 3.1 Pro, GPT 5.5, Grok 4.3, Claude model through API"
swiper,nolimits4web,TypeScript,41870,9645,249,5235,True,True,False,True,Most modern mobile touch slider with hardware accelerated transitions
WeChatMsg,LC044,,41832,5242,25,1281,False,False,False,True,
fastlane,fastlane,Ruby,41795,6021,724,4242,True,True,True,True,🚀 The easiest way to automate building and releasing your iOS and Android apps
hexo,hexojs,TypeScript,41770,27,99,5042,True,True,True,True,"A fast, simple & powerful blog framework, powered by Node.js."
headscale,juanfont,Go,41740,2446,130,2214,True,True,True,True,"An open source, self-hosted implementation of the Tailscale control server"
BettaFish,666ghj,Python,41738,7616,37,743,True,True,True,True,微舆：人人可用的多Agent舆情分析助手，打破信息茧房，还原舆情原貌，预测未来走向，辅助决策！从0实现，不依赖任何框架。
black,psf,Python,41731,2809,294,3044,True,True,True,True,The uncompromising Python code formatter
pure-bash-bible,dylanaraps,Shell,41708,3629,62,2954,False,True,False,True,📖 A collection of pure bash alternatives to external processes.
daisyui,saadeghi,Svelte,41662,1656,34,2054,False,True,True,True,"🌼 🌼 🌼 🌼 🌼  The most popular, free and open-source Tailwind CSS component library"
strix,usestrix,Python,41591,4370,184,343,False,True,True,True,Open-source AI penetration testing tool to find and fix your app’s vulnerabilities.
uni-app,dcloudio,Objective-C,41581,3709,693,2924,False,True,True,True,A cross-platform framework using Vue.js
cobalt,imputnet,Svelte,41563,3581,259,1467,False,True,True,True,best way to save what you love
cheat.sh,chubin,Python,41543,1919,147,3355,False,True,True,True,the only cheat sheet you need
dubbo,apache,Java,41529,26401,997,5138,True,True,True,True,The java implementation of Apache Dubbo. An RPC and microservice framework.
yarn,yarnpkg,JavaScript,41498,2722,2056,3829,True,True,True,True,The 1.x line is frozen - features and bugfixes now happen on https://github.com/yarnpkg/berry
aria2,aria2,C++,41439,3871,1148,5708,False,False,True,True,"aria2 is a lightweight multi-protocol & multi-source, cross platform download utility operated in command-line. It supports HTTP/HTTPS, FTP, SFTP, BitTorrent and Metalink."
ColossalAI,hpcaitech,Python,41412,4501,499,1720,False,True,True,True,"Making large AI models cheaper, faster and more accessible"
voicebox,jamiepine,TypeScript,41362,5009,557,170,False,True,True,True,"The open-source AI voice studio. Clone, dictate, create."
tabler,tabler,HTML,41298,4381,137,3085,True,False,True,True,Tabler is free and open-source HTML Dashboard UI Kit built on Bootstrap
styled-components,styled-components,TypeScript,41203,2675,13,3619,True,True,True,True,"Fast, expressive styling for React. Server components, client components, streaming SSR, React Native—one API."
nw.js,nwjs,JavaScript,41184,3853,900,5305,False,False,False,True,Call all Node.js modules directly from DOM/WebWorker and enable a new way of writing applications with all Web technologies.
agno,agno-agi,Python,41167,5635,1008,1532,True,True,True,True,"Build, run, and manage agent platforms."
free,freefq,,41164,5626,586,2229,False,False,False,True,翻墙、免费翻墙、免费科学上网、免费节点、免费梯子、免费ss/v2ray/trojan节点、蓝灯、谷歌商店、翻墙梯子
vue2-elm,bailicangdu,Vue,41046,12265,121,3491,False,False,True,True,Large single page application with 45 pages built on vue2 + vuex. 基于 vue2 + vuex 构建一个具有 45 个页面的大型单页面应用
ChatGLM-6B,zai-org,Python,41023,5131,610,1219,False,False,False,True,ChatGLM-6B: An Open Bilingual Dialogue Language Model | 开源双语对话语言模型
vuetify,vuetifyjs,TypeScript,41008,7124,515,3593,True,True,True,True,🐉 Vue Component Framework
chatbox,chatboxai,TypeScript,41004,4148,1206,1226,False,False,True,True,Powerful AI Client
LibreChat,danny-avila,TypeScript,40745,8361,566,1249,True,True,True,True,"Enhanced ChatGPT Clone: Features Agents, MCP, Skills, DeepSeek, Anthropic, AWS, OpenAI, Responses API, Azure, Groq, o1, GPT-5, Mistral, OpenRouter, Vertex AI, Gemini, Artifacts, AI model switching, message search, Code Interpreter, langchain, DALL-E-3, OpenAPI Actions, Functions, Secure Multi-User Auth, Presets, open-source for self-hosting. Active"
zju-icicles,QSCTech,HTML,40697,9577,10,3668,False,False,True,True,浙江大学课程攻略共享计划
vim,vim,Vim Script,40624,6096,1691,3983,False,True,True,True,The official Vim repository
50projects50days,bradtraversy,CSS,40613,9729,48,2066,False,False,False,True,"50+ mini web projects using HTML, CSS & JS"
Awesome-Design-Tools,goabstract,JavaScript,40563,2295,166,2709,False,False,True,True,The best design tools and plugins for everything 👉
remote-jobs,remoteintech,JavaScript,40542,3943,10,3928,True,True,True,True,Source for remoteintech.company — a community-maintained directory of remote-friendly tech companies
faiss,facebookresearch,C++,40514,4456,288,3444,True,True,True,True,A library for efficient similarity search and clustering of dense vectors.
chakra-ui,chakra-ui,TypeScript,40503,3626,17,2523,True,True,True,True,Chakra UI is a component system for building SaaS products with speed ⚡️
multica,multica-ai,Go,40497,5089,1243,182,False,True,True,True,"The open-source managed agents platform. Turn coding agents into real teammates — assign tasks, track progress, compound skills."
stats,exelban,Swift,40448,1413,25,2603,False,False,True,True,macOS system monitor in your menu bar
trpc,trpc,TypeScript,40434,1636,245,2188,False,True,True,True,🧙‍♀️  Move Fast and Break Nothing. End-to-end typesafe APIs made easy. 
Xray-core,XTLS,Go,40416,5679,55,2073,True,False,True,True,"Xray, Penetrates Everything. Also the best v2ray-core. Where the magic happens. An open platform for various uses."
wrk,wg,C,40358,3029,203,5229,False,False,True,True,Modern HTTP benchmarking tool
appsmith,appsmithorg,TypeScript,40337,4645,4470,2206,True,True,True,True,"Platform to build admin panels, internal tools, and dashboards. Integrates with 25+ databases and any API."
awesome-cursorrules,PatrickJS,JavaScript,40320,3444,36,666,True,True,True,True,📄  Configuration files that enhance Cursor AI editor experience with custom rules and behaviors
yazi,sxyazi,Rust,40305,937,74,1102,True,True,True,True,"💥 Blazing fast terminal file manager written in Rust, based on async I/O."
tidb,pingcap,Go,40291,6209,6526,3965,True,True,True,True,"TiDB is built for agentic workloads that grow unpredictably, with ACID guarantees and native support for transactions, analytics, and vector search. No data silos. No noisy neighbors. No infrastructure ceiling."
php-src,php,C,40237,8104,1855,5508,False,True,True,True,The PHP Interpreter
gkd,gkd-kit,Kotlin,40223,1901,11,1107,False,False,True,True,"基于无障碍，高级选择器，订阅规则的自定义屏幕点击安卓应用 | An Android APP with custom screen tapping based on Accessibility, Advanced Selectors, and Subscription Rules"
free-claude-code,Alishahryar1,Python,40136,6558,326,167,False,True,True,True,"Use claude code, codex or pi for free from the terminal, IDE, or you phone like OpenClaw (voice supported)"
sniffnet,GyulyVGC,Rust,40121,1882,67,1444,True,True,True,True,Comfortably monitor your Internet traffic 🕵️‍♂️
bert,google-research,Python,40052,9689,880,2819,False,True,False,True,TensorFlow code and pre-trained models for BERT
nushell,nushell,Rust,40016,2177,1432,2622,True,True,True,True,A new type of shell
esbuild,evanw,Go,39986,1320,633,3682,False,False,True,True,An extremely fast bundler for the web
photoprism,photoprism,Go,39967,2311,483,3090,True,True,True,True,AI-Powered Photos App 🌈💎✨
phaser,phaserjs,JavaScript,39960,7143,115,4841,True,True,True,True,"Phaser is a fun, free and fast 2D game framework for making HTML5 games for desktop and mobile web browsers, supporting Canvas and WebGL rendering."
fiber,gofiber,Go,39956,2005,43,2372,True,True,True,True,⚡️ Express inspired web framework written in Go
insomnia,Kong,TypeScript,39899,2353,857,3735,True,True,True,True,"The open-source, cross-platform API client for GraphQL, REST, WebSockets, SSE and gRPC. With Cloud, Local and Git storage."
gorm,go-gorm,Go,39863,4158,509,4645,True,False,True,True,"The fantastic ORM library for Golang, aims to be developer friendly"
claude-howto,luongnv89,Python,39854,4816,26,249,True,True,True,True,"A visual, example-driven guide to Claude Code — from basic concepts to advanced agents, with copy-paste templates that bring immediate value."
video.js,videojs,JavaScript,39819,7489,667,5905,True,True,True,True,Video.js - open source HTML5 video player
it-tools,CorentinTh,Vue,39808,5202,813,2291,False,False,True,True,"Collection of handy online tools for developers, with great UX. "
CodeWhale,Hmbown,Rust,39794,3426,290,176,True,True,True,True,"Open-source, community-driven agent harness"
BitNet,microsoft,Python,39731,3653,302,708,True,False,True,True,Official inference framework for 1-bit LLMs
shellcheck,koalaman,Haskell,39715,1937,1165,4988,False,False,True,True,"ShellCheck, a static analysis tool for shell scripts"
outline,outline,TypeScript,39689,3435,56,3705,True,False,True,True,"The fastest knowledge base for growing teams. Beautiful, realtime collaborative, feature packed, and markdown compatible."
awesome-system-design-resources,ashishps1,Java,39620,8475,14,994,False,False,False,True,Learn System Design concepts and prepare for interviews using free resources.
ChatTTS,2noise,Python,39615,4246,62,778,False,False,True,True,A generative speech model for daily dialogue.
reactive-resume,amruthpillai,TypeScript,39577,4476,96,2302,False,False,True,True,"A one-of-a-kind resume builder that keeps your privacy in mind. Completely secure, customizable, portable, open-source and free forever. Try it out today!"
Deep-Learning-Papers-Reading-Roadmap,floodsung,Python,39542,7278,91,3560,False,False,False,True,Deep Learning papers reading roadmap for anyone who are eager to learn this amazing tech!
manim,ManimCommunity,Python,39529,2956,508,2248,True,True,True,True,A community-maintained Python framework for creating mathematical animations. 
FastChat,lm-sys,Python,39491,4785,1028,1214,False,False,True,True,"An open platform for training, serving, and evaluating large language models. Release repo for Vicuna and Chatbot Arena."
styleguide,google,HTML,39441,12959,169,4073,True,True,True,True,Style guides for Google-originated open-source projects
mindshub,mindsdb,Makefile,39435,6226,3,2903,True,True,True,True,Make AI do actual work. Swap the model anytime — keep everything you've built.
duckdb,duckdb,C++,39414,3433,591,2940,True,True,True,True,DuckDB is an analytical in-process SQL database management system
openscreen,siddharthvaddem,TypeScript,39356,2903,49,277,False,True,True,True,"Create stunning demos for free. Open-source, no subscriptions, no watermarks, and free for commercial use. An alternative to Screen Studio."
novu,novuhq,TypeScript,39317,4360,99,1783,True,True,True,True,The open-source communication infrastructure for agents and products
ink,vadimdemedes,TypeScript,39299,1021,31,3319,True,True,True,True,🌈 React for interactive command-line apps
llvm-project,llvm,LLVM,39274,17833,37524,3506,True,True,True,True,The LLVM Project is a collection of modular and reusable compiler and toolchain technologies.
halo,halo-dev,Java,39268,10308,131,3037,True,True,True,True,Halo 是一款强大易用的开源建站工具，从个人博客、知识库，到企业官网、在线商城，Halo 都能助您轻松实现，一站式满足您的多样化建站需求。
marketingskills,coreyhaines31,JavaScript,39265,6265,60,180,False,True,True,True,"Marketing skills for Claude Code and AI agents. CRO, copywriting, SEO, analytics, and growth engineering."
Sunshine,LizardByte,C++,39244,2102,131,1672,True,True,True,True,Self-hosted game stream host for Moonlight.
leveldb,google,C++,39242,8208,395,4339,True,True,True,True,LevelDB is a fast key-value storage library written at Google that provides an ordered mapping from string keys to string values.
