repo_name,organization,language,stars,forks,open_issues,age_days,has_coc,has_contributing,has_workflows,has_readme,description
EasySpider,NaiboWang,JavaScript,43927,5341,267,2149,False,False,True,True,A visual no-code/code-free web crawler/spider易采集：一个可视化浏览器自动化测试/数据采集/网页爬虫软件，可以无代码图形化的设计和执行爬虫任务。别名：ServiceWrapper面向Web应用的智能化服务封装系统。
build-web-application-with-golang,astaxie,Go,43918,10476,138,5055,False,False,False,True,A golang ebook intro how to build a web with golang
retrofit,square,HTML,43895,7341,170,5751,False,True,True,True,A type-safe HTTP client for Android and the JVM
system-design,karanpratapsingh,,43858,5689,3,1390,True,True,False,True,Learn how to design systems at scale and prepare for system design interviews
mitmproxy,mitmproxy,Python,43808,4573,435,5954,True,True,True,True,An interactive TLS-capable intercepting HTTP proxy for penetration testers and software developers.
Files,files-community,C#,43791,2744,520,2709,True,True,True,True,A modern file manager that helps users organize their files and folders.
TensorFlow-Examples,aymericdamien,Jupyter Notebook,43750,14715,228,3859,False,False,False,True,TensorFlow Tutorial and Examples for Beginners (support TF v1 & v2)
nanobot,HKUDS,Python,43748,7734,862,124,False,True,True,True,"Lightweight, open-source AI agent for your tools, chats, and workflows."
kong,Kong,Lua,43529,5144,140,4218,True,True,True,True,🦍 The API and AI Gateway
full-stack-fastapi-template,fastapi,TypeScript,43525,8613,24,2659,False,True,True,True,"Full stack, modern web application template. Using FastAPI, React, SQLModel, PostgreSQL, Docker, GitHub Actions, automatic HTTPS and more."
spark,apache,Scala,43401,29219,410,4483,True,True,True,True,Apache Spark - A unified analytics engine for large-scale data processing
fd,sharkdp,Rust,43249,1070,185,3314,False,True,True,True,"A simple, fast and user-friendly alternative to 'find'"
logseq,logseq,Clojure,43246,2659,920,2205,True,True,True,True,"A privacy-first, open-source platform for knowledge management and collaboration. Download link:  http://github.com/logseq/logseq/releases. roadmap: https://logseq.io/p/NX4mc_ggEV"
CPlusPlusThings,Light-City,C++,43208,8832,10,2518,False,False,False,True,C++那些事
pm2,Unitech,JavaScript,43203,2714,1082,4764,False,True,True,True,Node.js Production Process Manager with a built-in Load Balancer.
fuels-rs,FuelLabs,Rust,43183,1361,69,1678,False,False,True,True,Fuel Network Rust SDK
fuels-ts,FuelLabs,TypeScript,43152,1372,78,1736,True,True,True,True,Fuel Network Typescript SDK
what-happens-when,alex,,43142,5739,2064,4594,False,False,True,True,"An attempt to answer the age old interview question ""What happens when you type google.com into your browser and press enter?"""
zig,ziglang,Zig,43015,3063,2918,3957,False,False,False,True,Moved to Codeberg
chrome-devtools-mcp,ChromeDevTools,TypeScript,42932,2753,87,267,False,True,True,True,Chrome DevTools for coding agents
bubbletea,charmbracelet,Go,42910,1232,173,2338,False,True,True,True,A powerful little TUI framework 🏗
jan,janhq,TypeScript,42885,2910,437,1024,True,True,True,True,Jan is an open source alternative to ChatGPT that runs 100% offline on your computer.
zod,colinhacks,TypeScript,42869,1999,184,2281,True,True,True,True,TypeScript-first schema validation with static type inference
hyperswitch,juspay,Rust,42836,4779,1737,1327,True,True,True,True,"Open source, composable payments platform | PCI compliant | SaaS and Self-host options | Enables connectivity to multiple payment, payout, fraud, vault and tokenization providers | Uplifts authorization with intelligent routing and revenue recovery | Reduce payment processing costs with cost observability | Reduces payment ops with reconciliation"
payload,payloadcms,TypeScript,42823,3778,785,1977,False,True,True,True,"Payload is the open-source, fullstack Next.js framework, giving you instant backend superpowers. Get a full TypeScript backend and admin panel instantly. Use Payload as a headless CMS or for building powerful applications."
gradio,gradio-app,Python,42821,3474,281,2725,True,True,True,True,"Build and share delightful machine learning apps, all in Python. 🌟 Star to support our work!"
ccxt,ccxt,Python,42818,8698,1336,3309,False,True,True,True,A cryptocurrency trading API with more than 100 exchanges in JavaScript / TypeScript / Python / C# / PHP / Go / Java 
ray,ray-project,Python,42789,7647,3447,3510,False,True,True,True,Ray is an AI compute engine. Ray consists of a core distributed runtime and a set of AI Libraries for accelerating ML workloads.
python-patterns,faif,Python,42788,7014,14,5112,False,False,True,True,A collection of design patterns/idioms in Python
desktop,zen-browser,JavaScript,42569,1535,519,800,True,False,True,True,Welcome to a calmer internet
codegraph,colbymchenry,TypeScript,42503,2611,217,138,False,False,True,True,"Pre-indexed code knowledge graph for Claude Code, Codex, Gemini, Cursor, OpenCode, AntiGravity, Kiro, and Hermes Agent — fewer tokens, fewer tool calls, 100% local"
DeepSpeed,deepspeedai,Python,42475,4850,1295,2325,True,True,True,True,"DeepSpeed is a deep learning optimization library that makes distributed training and inference easy, efficient, and effective."
git-flight-rules,k88hudson,,42465,3175,14,4336,False,False,False,True,Flight rules for git
Alamofire,Alamofire,Swift,42393,7665,43,4328,False,True,True,True,Elegant HTTP Networking in Swift
diagrams,mingrammer,Python,42322,2725,390,2315,False,True,True,True,:art: Diagram as Code for prototyping cloud system architectures
ailearning,apachecn,Python,42300,11544,4,3387,False,False,False,True,AiLearning：数据分析+机器学习实战+线性代数+PyTorch+NLTK+TF2
CLI-Anything,HKUDS,Python,42149,3982,64,89,False,True,True,True,"""CLI-Anything: Making ALL Software Agent-Native"" -- CLI-Hub: https://clianything.cc/"
puter,HeyPuter,JavaScript,42142,3856,19,825,False,True,True,True,"🌐 The Internet Computer! Free, Open-Source, and Self-Hostable."
data-engineering-zoomcamp,DataTalksClub,Jupyter Notebook,42132,8337,9,1688,False,False,True,True,Data Engineering Zoomcamp is a free 9-week course on building production-ready data pipelines. The next cohort starts in January 2026. Join the course here 👇🏼
Fabric,danielmiessler,Go,42086,4166,59,884,True,True,True,True,Fabric is an open-source framework for augmenting humans using AI. It provides a modular system for solving specific problems using a crowdsourced set of AI prompts that can be used anywhere.
curl,curl,C,42065,7229,44,5923,True,True,True,True,"A command line tool and library for transferring data with URL syntax, supporting DICT, FILE, FTP, FTPS, GOPHER, GOPHERS, HTTP, HTTPS, IMAP, IMAPS, LDAP, LDAPS, MQTT, MQTTS, POP3, POP3S, RTSP, SCP, SFTP, SMB, SMBS, SMTP, SMTPS, TELNET, TFTP, WS and WSS. libcurl offers a myriad of powerful features"
paperless-ngx,paperless-ngx,Python,41928,2794,13,1574,True,True,True,True,"A community-supported supercharged document management system: scan, index and archive all your documents"
swiper,nolimits4web,JavaScript,41851,9660,248,5196,True,True,False,True,Most modern mobile touch slider with hardware accelerated transitions
HEU_KMS_Activator,zbezj,,41783,3868,173,2540,False,False,False,True,
hexo,hexojs,TypeScript,41745,21,96,5003,True,True,True,True,"A fast, simple & powerful blog framework, powered by Node.js."
pure-bash-bible,dylanaraps,Shell,41634,3627,62,2915,False,True,False,True,📖 A collection of pure bash alternatives to external processes.
fastlane,fastlane,Ruby,41615,6012,753,4203,True,True,True,True,🚀 The easiest way to automate building and releasing your iOS and Android apps
WeChatMsg,LC044,,41580,5184,25,1242,False,False,False,True,
black,psf,Python,41560,2774,292,3005,True,True,True,True,The uncompromising Python code formatter
data-engineer-handbook,DataExpert-io,Jupyter Notebook,41538,7860,39,929,False,False,False,True,This is a repo with links to everything you'd ever want to learn about data engineering
uni-app,dcloudio,Objective-C,41537,3710,692,2885,False,True,True,True,A cross-platform framework using Vue.js
dubbo,apache,Java,41514,26438,978,5099,True,True,True,True,The java implementation of Apache Dubbo. An RPC and microservice framework.
yarn,yarnpkg,JavaScript,41508,2726,2063,3790,True,True,True,True,The 1.x line is frozen - features and bugfixes now happen on https://github.com/yarnpkg/berry
GitNexus,abhigyanpatwari,TypeScript,41501,4735,294,307,False,True,True,True,"GitNexus: The Zero-Server Code Intelligence Engine -       GitNexus is a client-side knowledge graph creator that runs entirely in your browser. Drop in a GitHub repo or ZIP file, and get an interactive knowledge graph wit a built in Graph RAG Agent. Perfect for code exploration"
cheat.sh,chubin,Python,41440,1925,144,3316,False,True,True,True,the only cheat sheet you need
FlClash,chen08209,Dart,41405,2590,830,1025,False,False,True,True,"A multi-platform proxy client based on ClashMeta,simple and easy to use, open-source and ad-free."
ColossalAI,hpcaitech,Python,41385,4507,500,1681,False,True,True,True,"Making large AI models cheaper, faster and more accessible"
vnpy,vnpy,Python,41355,11852,11,4114,True,False,True,True,基于Python的开源量化交易平台开发框架
system_prompts_leaks,asgeirtj,JavaScript,41301,6848,26,399,False,True,True,True,"Extracted system prompts from Anthropic - Claude Code, Claude Design, Opus 4.8, Sonnet 4.6. OpenAI - ChatGPT 5.5 Thinking, GPT 5.5 Instant, Codex, Google - Gemini - 3.5 Flash, 3.1 Pro, Antigravity, xAI - Grok, Cursor, Copilot, VS Code, Perplexity, and more. Updated regularly."
BettaFish,666ghj,Python,41241,7588,31,704,True,True,True,True,微舆：人人可用的多Agent舆情分析助手，打破信息茧房，还原舆情原貌，预测未来走向，辅助决策！从0实现，不依赖任何框架。
nw.js,nwjs,JavaScript,41181,3855,898,5267,False,False,False,True,Call all Node.js modules directly from DOM/WebWorker and enable a new way of writing applications with all Web technologies.
tabler,tabler,HTML,41126,4367,139,3046,True,False,True,True,Tabler is free and open-source HTML Dashboard UI Kit built on Bootstrap
aria2,aria2,C++,41118,3861,1146,5669,False,False,True,True,"aria2 is a lightweight multi-protocol & multi-source, cross platform download utility operated in command-line. It supports HTTP/HTTPS, FTP, SFTP, BitTorrent and Metalink."
daisyui,saadeghi,Svelte,41078,1637,68,2015,False,True,True,True,"🌼 🌼 🌼 🌼 🌼  The most popular, free and open-source Tailwind CSS component library"
vue2-elm,bailicangdu,Vue,41067,12280,121,3452,False,False,True,True,Large single page application with 45 pages built on vue2 + vuex. 基于 vue2 + vuex 构建一个具有 45 个页面的大型单页面应用
ChatGLM-6B,zai-org,Python,41056,5147,608,1180,False,False,False,True,ChatGLM-6B: An Open Bilingual Dialogue Language Model | 开源双语对话语言模型
styled-components,styled-components,TypeScript,41033,2526,12,3580,True,True,True,True,"Fast, expressive styling for React. Server components, client components, streaming SSR, React Native—one API."
vuetify,vuetifyjs,TypeScript,40989,7131,506,3554,True,True,True,True,🐉 Vue Component Framework
daily_stock_analysis,ZhuLinsen,Python,40985,39143,28,146,False,True,True,True,LLM驱动的 A/H/美股智能分析：多数据源行情 + 实时新闻 + LLM决策仪表盘 + 多渠道推送，零成本定时运行，纯白嫖. LLM-powered stock analysis system for A/H/US markets.
lossless-cut,mifi,TypeScript,40983,1993,249,3505,False,True,True,True,The swiss army knife of lossless video/audio editing
airi,moeru-ai,TypeScript,40734,4097,173,551,True,True,True,True,"💖🧸 Self hosted, you-owned Grok Companion, a container of souls of waifu, cyber livings to bring them into our worlds, wishing to achieve Neuro-sama's altitude. Capable of realtime voice chat, Minecraft, Factorio playing. Web / macOS / Windows supported."
cobalt,imputnet,Svelte,40727,3464,248,1428,False,True,True,True,best way to save what you love
free,freefq,,40711,5643,577,2190,False,False,False,True,翻墙、免费翻墙、免费科学上网、免费节点、免费梯子、免费ss/v2ray/trojan节点、蓝灯、谷歌商店、翻墙梯子
50projects50days,bradtraversy,CSS,40577,9752,48,2027,False,False,False,True,"50+ mini web projects using HTML, CSS & JS"
zju-icicles,QSCTech,HTML,40576,9579,10,3629,False,False,True,True,浙江大学课程攻略共享计划
agno,agno-agi,Python,40537,5479,858,1493,True,True,True,True,"Build, run, and manage agent platforms."
react-bits,DavidHDev,JavaScript,40496,1855,2,668,False,True,True,True,"An open source collection of animated, interactive & fully customizable React components for building memorable websites."
remote-jobs,remoteintech,JavaScript,40451,3946,12,3889,True,True,True,True,Source for remoteintech.company — a community-maintained directory of remote-friendly tech companies
vim,vim,Vim Script,40445,6062,1640,3944,False,True,True,True,The official Vim repository
chakra-ui,chakra-ui,TypeScript,40428,3613,23,2484,True,True,True,True,Chakra UI is a component system for building SaaS products with speed ⚡️
wrk,wg,C,40320,3030,204,5190,False,False,True,True,Modern HTTP benchmarking tool
chatbox,chatboxai,TypeScript,40314,4087,1171,1187,False,False,True,True,Powerful AI Client
trpc,trpc,TypeScript,40306,1631,233,2149,False,True,True,True,🧙‍♀️  Move Fast and Break Nothing. End-to-end typesafe APIs made easy. 
dive-into-llms,Lordog,Jupyter Notebook,40304,4914,14,788,False,False,False,True,《动手学大模型Dive into LLMs》系列编程实践教程
faiss,facebookresearch,C++,40212,4405,274,3405,True,True,True,True,A library for efficient similarity search and clustering of dense vectors.
Awesome-Design-Tools,goabstract,JavaScript,40142,2267,155,2670,False,False,True,True,The best design tools and plugins for everything 👉
php-src,php,C,40136,8068,1837,5469,False,True,True,True,The PHP Interpreter
tidb,pingcap,Go,40134,6197,6285,3926,True,True,True,True,"TiDB is built for agentic workloads that grow unpredictably, with ACID guarantees and native support for transactions, analytics, and vector search. No data silos. No noisy neighbors. No infrastructure ceiling."
supervision,roboflow,Python,40056,3615,103,1285,True,True,True,True,We write your reusable computer vision tools. 💜
bert,google-research,Python,40024,9711,880,2780,False,True,False,True,TensorFlow code and pre-trained models for BERT
appsmith,appsmithorg,TypeScript,39979,4590,4460,2167,True,True,True,True,"Platform to build admin panels, internal tools, and dashboards. Integrates with 25+ databases and any API."
esbuild,evanw,Go,39904,1310,622,3643,False,False,True,True,An extremely fast bundler for the web
awesome-cursorrules,PatrickJS,JavaScript,39880,3403,13,627,True,True,True,True,📄  Configuration files that enhance Cursor AI editor experience with custom rules and behaviors
antigravity-awesome-skills,sickn33,Python,39844,6450,3,142,True,True,True,True,"Installable GitHub library of 1,500+ agentic skills for Claude Code, Cursor, Codex CLI, Gemini CLI, Antigravity, and more. Includes specialized plugins, installer CLI, bundles, workflows, and official/community skill collections."
fiber,gofiber,Go,39811,1988,57,2333,True,True,True,True,⚡️ Express inspired web framework written in Go
video.js,videojs,JavaScript,39777,7499,659,5866,True,True,True,True,Video.js - open source HTML5 video player
gorm,go-gorm,Go,39773,4154,535,4606,True,False,True,True,"The fantastic ORM library for Golang, aims to be developer friendly"
photoprism,photoprism,Go,39746,2286,446,3051,True,True,True,True,AI-Powered Photos App for the Decentralized Web 🌈💎✨
headscale,juanfont,Go,39729,2172,105,2175,True,True,True,True,"An open source, self-hosted implementation of the Tailscale control server"
phaser,phaserjs,JavaScript,39726,7136,110,4802,True,True,True,True,"Phaser is a fun, free and fast 2D game framework for making HTML5 games for desktop and mobile web browsers, supporting Canvas and WebGL rendering."
3x-ui,MHSanaei,TypeScript,39679,7438,34,1212,False,True,True,True,"Xray panel supporting multi-protocol multi-user expire day & traffic & IP limit (Vmess, Vless, Trojan, ShadowSocks, Wireguard, Hysteria, Tunnel, Mixed, HTTP, Tun) "
nushell,nushell,Rust,39668,2153,1474,2583,True,True,True,True,A new type of shell
shellcheck,koalaman,Haskell,39538,1917,1232,4949,False,False,True,True,"ShellCheck, a static analysis tool for shell scripts"
Deep-Learning-Papers-Reading-Roadmap,floodsung,Python,39505,7295,92,3521,False,False,False,True,Deep Learning papers reading roadmap for anyone who are eager to learn this amazing tech!
FastChat,lm-sys,Python,39478,4786,1016,1175,False,False,True,True,"An open platform for training, serving, and evaluating large language models. Release repo for Vicuna and Chatbot Arena."
ChatTTS,2noise,Python,39395,4238,60,739,False,False,True,True,A generative speech model for daily dialogue.
stats,exelban,Swift,39365,1358,24,2564,False,False,True,True,macOS system monitor in your menu bar
styleguide,google,HTML,39359,12971,171,4034,True,True,True,True,Style guides for Google-originated open-source projects
Xray-core,XTLS,Go,39271,5471,55,2034,True,False,True,True,"Xray, Penetrates Everything. Also the best v2ray-core. Where the magic happens. An open platform for various uses."
minds-platform,mindsdb,Python,39252,6210,91,2864,True,True,True,True,"General-purpose AI designed for knowledge workers — creators, strategists, and operators — and individuals seeking AI systems they can truly control to help them get work done, with full flexibility to extend and deploy anywhere (VPC, on-prem, or cloud)."
gkd,gkd-kit,Kotlin,39229,1856,6,1068,False,False,True,True,"基于无障碍，高级选择器，订阅规则的自定义屏幕点击安卓应用 | An Android APP with custom screen tapping based on Accessibility, Advanced Selectors, and Subscription Rules"
BitNet,microsoft,Python,39224,3586,316,669,True,False,True,True,Official inference framework for 1-bit LLMs
quivr,QuivrHQ,Python,39171,3742,23,1120,False,False,True,True,"Opiniated RAG for integrating GenAI in your apps 🧠   Focus on your product rather than the RAG. Easy integration in existing products with customisation!  Any LLM: GPT4, Groq, Llama. Any Vectorstore: PGVector, Faiss. Any Files. Anyway you want."
it-tools,CorentinTh,Vue,39160,5003,801,2252,False,False,True,True,"Collection of handy online tools for developers, with great UX. "
bark,suno-ai,Jupyter Notebook,39147,4685,268,1155,False,False,False,True,🔊 Text-Prompted Generative Audio Model
leveldb,google,C++,39125,8199,389,4300,True,True,True,True,LevelDB is a fast key-value storage library written at Google that provides an ordered mapping from string keys to string values.
yazi,sxyazi,Rust,39121,890,67,1063,True,True,True,True,"💥 Blazing fast terminal file manager written in Rust, based on async I/O."
novu,novuhq,TypeScript,39077,4310,90,1744,True,True,True,True,The open-source communication infrastructure for agents and products
devdocs,freeCodeCamp,Ruby,39026,2605,234,4607,True,True,True,True,API Documentation Browser
halo,halo-dev,Java,38893,10281,156,2998,True,True,True,True,Halo 是一款强大易用的开源建站工具，从个人博客、知识库，到企业官网、在线商城，Halo 都能助您轻松实现，一站式满足您的多样化建站需求。
materialize,Dogfalo,JavaScript,38868,4631,793,4284,True,True,True,True,"Materialize, a CSS Framework based on Material Design"
manim,ManimCommunity,Python,38824,2891,537,2209,True,True,True,True,A community-maintained Python framework for creating mathematical animations. 
ink,vadimdemedes,TypeScript,38788,1004,30,3281,True,True,True,True,🌈 React for interactive command-line apps
outline,outline,TypeScript,38779,3325,59,3666,True,False,True,True,"The fastest knowledge base for growing teams. Beautiful, realtime collaborative, feature packed, and markdown compatible."
polars,pola-rs,Rust,38689,2867,2764,2214,True,True,True,True,"Extremely fast Query Engine for DataFrames, written in Rust"
googletest,google,C++,38683,10788,564,3965,True,True,True,True,GoogleTest - Google Testing and Mocking Framework
preact,preactjs,JavaScript,38676,2037,148,3921,True,True,True,True,⚛️ Fast 3kB React alternative with the same modern API. Components & Virtual DOM.
llvm-project,llvm,LLVM,38667,17390,36650,3467,True,True,True,True,The LLVM Project is a collection of modular and reusable compiler and toolchain technologies.
lapce,lapce,Rust,38639,1286,884,3041,False,True,True,True,Lightning-fast and Powerful Code Editor written in Rust
duckdb,duckdb,C++,38636,3301,580,2901,True,True,True,True,DuckDB is an analytical in-process SQL database management system
NewPipe,TeamNewPipe,Java,38556,3625,1404,3928,False,True,True,True,A libre lightweight streaming front-end for Android.
awesome-system-design-resources,ashishps1,Java,38484,8281,13,955,False,False,False,True,Learn System Design concepts and prepare for interviews using free resources.
insomnia,Kong,TypeScript,38472,2289,857,3696,True,True,True,True,"The open-source, cross-platform API client for GraphQL, REST, WebSockets, SSE and gRPC. With Cloud, Local and Git storage."
python-cheatsheet,gto76,Python,38457,6702,0,3054,False,False,True,True,Comprehensive Python Cheatsheet
Folo,RSSNext,TypeScript,38390,2067,369,789,True,True,True,True,🧡 Folo is the AI RSS Reader
GPT_API_free,chatanywhere,,38342,2655,19,1139,False,False,False,True,Free ChatGPT&DeepSeek API Key，免费ChatGPT&DeepSeek API。免费接入DeepSeek API和GPT4 API，支持 gpt | deepseek | claude | gemini | grok 等排名靠前的常用大模型。
ant-design-pro,ant-design,TypeScript,38338,8242,45,3206,True,False,True,True,👨🏻‍💻👩🏻‍💻 Use Ant Design like a Pro!
metasploit-framework,rapid7,Ruby,38330,14866,614,5394,True,True,True,True,Metasploit Framework
openscreen,siddharthvaddem,TypeScript,38245,2665,44,239,False,True,True,True,"Create stunning demos for free. Open-source, no subscriptions, no watermarks, and free for commercial use. An alternative to Screen Studio. "
engineering-blogs,kilimchoi,Ruby,38244,2020,148,4010,False,True,True,True,A curated list of engineering blogs
reactive-resume,amruthpillai,TypeScript,38239,4318,82,2263,False,False,True,True,"A one-of-a-kind resume builder that keeps your privacy in mind. Completely secure, customizable, portable, open-source and free forever. Try it out today!"
LibreChat,danny-avila,TypeScript,38224,7857,481,1210,True,True,True,True,"Enhanced ChatGPT Clone: Features Agents, MCP, DeepSeek, Anthropic, AWS, OpenAI, Responses API, Azure, Groq, o1, GPT-5, Mistral, OpenRouter, Vertex AI, Gemini, Artifacts, AI model switching, message search, Code Interpreter, langchain, DALL-E-3, OpenAPI Actions, Functions, Secure Multi-User Auth, Presets, open-source for self-hosting. Active."
istio,istio,Go,38202,8318,471,3486,False,True,True,True,"Connect, secure, control, and observe services."
cli,httpie,Python,38202,3955,294,5214,True,True,True,True,"🥧 HTTPie CLI  — modern, user-friendly command-line HTTP client for the API era. JSON support, colors, sessions, downloads, plugins & more."
spacedrive,spacedriveapp,Rust,38202,1287,33,1713,True,True,True,True,"Spacedrive is an open source cross-platform file explorer, powered by a virtual distributed filesystem written in Rust."
MPAndroidChart,PhilJay,Java,38198,8991,2189,4424,False,True,False,True,"A powerful 🚀 Android chart view / graph view library, supporting line- bar- pie- radar- bubble- and candlestick charts as well as scaling, panning and animations."
impress.js,impress,JavaScript,38189,6592,59,5273,False,False,True,True,It's a presentation framework based on the power of CSS3 transforms and transitions in modern browsers and inspired by the idea behind prezi.com.
Langchain-Chatchat,chatchat-space,Python,38138,6214,21,1162,False,False,True,True,"Langchain-Chatchat（原Langchain-ChatGLM）基于 Langchain 与 ChatGLM, Qwen 与 Llama 等语言模型的 RAG 与 Agent 应用 | Langchain-Chatchat (formerly langchain-ChatGLM), local knowledge based LLM (like ChatGLM, Qwen and Llama) RAG and Agent app with langchain "
tesseract.js,naptha,JavaScript,38124,2364,45,4000,False,False,True,True,Pure Javascript OCR for more than 100 Languages 📖🎉🖥
google-research,google-research,Jupyter Notebook,38076,8425,1949,2801,False,True,True,True,Google Research
aspnetcore,dotnet,C#,37992,10688,4002,4470,True,True,True,True,"ASP.NET Core is a cross-platform .NET framework for building modern cloud-based web applications on Windows, Mac, or Linux."
qBittorrent,qbittorrent,C++,37988,4716,2625,5235,False,True,True,True,qBittorrent BitTorrent client
ToolJet,ToolJet,JavaScript,37985,5091,963,1893,True,True,True,True,"ToolJet is the open-source foundation of ToolJet AI - the enterprise app generation platform for building internal tools, dashboard, business applications, workflows and AI agents 🚀"
ShareX,ShareX,C#,37963,3787,656,4623,False,False,True,True,"ShareX is a free and open-source application that enables users to capture or record any area of their screen with a single keystroke. It also supports uploading images, text, and various file types to a wide range of destinations."
sniffnet,GyulyVGC,Rust,37953,1542,68,1405,True,True,True,True,Comfortably monitor your Internet traffic 🕵️‍♂️
