repo_name,organization,language,stars,forks,open_issues,age_days,has_coc,has_contributing,has_workflows,has_readme,description
caveman,JuliusBrussee,JavaScript,69336,3908,274,62,False,True,True,True,🪨 why use many token when few token do trick — Claude Code skill that cuts 65% of tokens by talking like caveman
paperclip,paperclipai,TypeScript,69292,12851,4810,95,False,True,True,True,The open-source app everyone uses to manage agents at work
ghidra,NationalSecurityAgency,Java,69275,7614,1909,2654,False,True,True,True,Ghidra is a software reverse engineering (SRE) framework
AFFiNE,toeverything,TypeScript,69115,4913,629,1405,True,True,True,True,"There can be more than Notion and Miro. AFFiNE(pronounced [ə‘fain]) is a next-gen knowledge base that brings planning, sorting and creating all together. Privacy first, open-source, customizable and ready to use. "
express,expressjs,JavaScript,69104,23612,217,6188,True,True,True,True,"Fast, unopinionated, minimalist web framework for node."
awesome-courses,prakhar1989,,68885,8367,63,4220,False,True,False,True,:books: List of awesome university courses for learning Computer Science!
ansible,ansible,Python,68776,24143,800,5204,True,True,True,True,"Ansible is a radically simple IT automation platform that makes your applications and systems easier to deploy and maintain. Automate everything from code deployment to network configuration to cloud management, in a language that approaches plain English, using SSH, with no agents to install on remote systems. https://docs.ansible.com."
OpenBB,OpenBB-finance,Python,68662,6927,69,1993,True,False,True,True,"Financial data platform for analysts, quants and AI agents."
MetaGPT,FoundationAgents,Python,68590,8758,122,1071,False,False,True,True,"🌟 The Multi-Agent Framework: First AI Software Company, Towards Natural Language Programming"
node,base,Shell,68537,3240,40,1220,False,True,True,True,Everything required to run your own Base node
Apollo-11,chrislgarry,Assembly,68034,7692,132,4446,False,True,True,True,Original Apollo 11 Guidance Computer (AGC) source code for the command and lunar modules.
crawl4ai,unclecode,Python,67880,6936,89,757,True,True,True,True,"🚀🤖 Crawl4AI: Open-source LLM Friendly Web Crawler & Scraper. Don't be shy, join here: https://discord.gg/jP8KfhDhyN"
Chart.js,chartjs,JavaScript,67480,11948,568,4828,False,False,True,True,Simple HTML5 Charts using the <canvas> tag
annotated_deep_learning_paper_implementations,labmlai,Python,66902,6711,33,2111,False,False,True,True,"🧑‍🏫 60+ Implementations/tutorials of deep learning papers with side-by-side notes 📝; including transformers (original, xl, switch, feedback, vit, ...), optimizers (adam, adabelief, sophia, ...), gans(cyclegan, stylegan2, ...), 🎮 reinforcement learning (ppo, dqn), capsnet, distillation, ... 🧠"
MinerU,opendatalab,Python,66609,5612,16,827,False,False,True,True,Transforms complex documents like PDFs and Office docs into LLM-ready markdown/JSON for your Agentic workflows.
ai-agents-for-beginners,microsoft,Jupyter Notebook,66547,21966,19,554,True,False,True,True,12 Lessons to Get Started Building AI Agents
echarts,apache,TypeScript,66508,19794,1624,4812,True,True,True,True,"Apache ECharts is a powerful, interactive charting and data visualization library for browser"
33-js-concepts,leonardomso,JavaScript,66473,9185,3,2831,True,True,True,True,📜 33 JavaScript concepts every developer should know.
gpt4free,xtekky,Python,66295,13579,10,1164,True,True,True,True,The official gpt4free repository | various collection of powerful language models | opus 4.6 gpt 5.3 kimi 2.5 deepseek v3.2 gemini 3
scikit-learn,scikit-learn,Python,66261,27048,2039,5771,True,True,True,True,scikit-learn: machine learning in Python
design-resources-for-developers,bradtraversy,,65948,12078,31,2221,False,True,True,True,"Curated list of design and UI resources from stock photos, web templates, CSS frameworks, UI libraries, tools and much more"
awesome-nodejs,sindresorhus,,65903,6237,26,4347,True,True,True,True,":zap: Delightful Node.js packages and resources [BECAUSE OF TOO MUCH SPAM AND LOW-QUALITY SUBMISSIONS, SUBMISSIONS ARE PAUSED UNTIL JULY]"
unsloth,unslothai,Python,65892,5893,1382,919,True,True,True,True,"Unsloth Studio is a web UI for training and running open models like Gemma 4, Qwen3.6, DeepSeek, gpt-oss locally."
Java,TheAlgorithms,Java,65790,21183,21,3611,True,True,True,True,All Algorithms implemented in Java
webpack,webpack,JavaScript,65759,9356,179,5200,True,True,True,True,"A bundler for javascript and friends. Packs many modules into a few bundled assets. Code Splitting allows for loading parts of the application on demand. Through ""loaders"", modules can be CommonJs, AMD, ES6 modules, CSS, Images, JSON, Coffeescript, LESS, ... and your custom stuff."
nocode,kelseyhightower,Dockerfile,65349,4823,4708,3041,False,True,False,True,The best way to write secure and reliable applications. Write nothing; deploy nowhere.
javascript-questions,lydiahallie,,65318,9220,51,2550,False,False,False,True,"A long list of (advanced) JavaScript questions, and their explanations :sparkles:  "
uBlock,gorhill,JavaScript,65259,4146,17,4083,False,True,True,True,uBlock Origin - An efficient blocker for Chromium and Firefox. Fast and lean.
docusaurus,facebook,TypeScript,65129,9923,392,3272,True,True,True,True,Easy to maintain open source documentation websites.
localstack,localstack,Python,65012,4730,0,3510,True,True,True,True,💻 A fully functional local AWS cloud stack. Develop and test your cloud & Serverless apps offline
learn-claude-code,shareAI-lab,Python,64963,10589,68,341,False,False,True,True,"Bash is all you need -  A nano claude code–like 「agent harness」, built from 0 to 1"
interviews,kdn251,Java,64944,12886,120,3398,False,False,False,True,Everything you need to know to get the job.
ripgrep,BurntSushi,Rust,64853,2596,198,3739,False,True,True,True,ripgrep recursively searches directories for a regex pattern while respecting your gitignore
MiroFish,666ghj,Python,64806,10094,302,192,False,False,False,True,"A Simple and Universal Swarm Intelligence Engine, Predicting Anything. 简洁通用的群体智能引擎，预测万物"
alacritty,alacritty,Rust,64505,3485,339,3761,False,True,True,True,"A cross-platform, OpenGL terminal emulator."
prometheus,prometheus,Go,64322,10484,811,4941,True,True,True,True,The Prometheus monitoring system and time series database.
keras,keras-team,Python,64087,19747,174,4088,False,True,True,True,Deep Learning for humans
30-Days-Of-Python,Asabeneh,Python,63996,12060,136,2390,False,False,True,True,The 30 Days of Python programming challenge is a step-by-step guide to learn the Python programming language in 30 days. This challenge may take more than 100 days. Follow your own pace. These videos may help too: https://www.youtube.com/channel/UC7PNRuno1rzYPb1xLa4yktw
get-shit-done,gsd-build,JavaScript,63965,5449,0,173,False,True,True,True,"A light-weight and powerful meta-prompting, context engineering and spec-driven development system for Claude Code by TÂCHES."
ladybird,LadybirdBrowser,C++,63858,3077,532,736,True,True,True,True,Truly independent web browser
open-interpreter,openinterpreter,Python,63823,5547,333,1057,False,True,True,True,A natural language interface for computers
traefik,traefik,Go,63611,6037,845,3918,True,True,True,True,The Cloud Native Application Proxy
awesome-claude-skills,ComposioHQ,Python,63394,6973,759,231,False,True,True,True,"A curated list of awesome Claude Skills, resources, and tools for customizing Claude AI workflows"
nocodb,nocodb,TypeScript,63281,4818,700,3141,True,True,True,True,🔥 🔥 🔥 A Free & Self-hostable Airtable Alternative
nerd-fonts,ryanoasis,CSS,63249,3899,76,4201,True,True,True,True,"Iconic font aggregator, collection, & patcher. 3,600+ icons, 50+ patched fonts: Hack, Source Code Pro, more. Glyph collections: Font Awesome, Material Design Icons, Octicons, & more"
socket.io,socketio,TypeScript,63117,10146,178,5930,False,True,True,True,Bidirectional and low-latency communication for every platform
rustlings,rust-lang,Rust,63094,11198,38,3917,False,True,True,True,:crab: Small exercises to get you used to reading and writing Rust code!
pathway,pathwaycom,Python,63090,1678,37,1286,True,True,True,True,"Python ETL framework for stream processing, real-time analytics, LLM pipelines, and RAG."
resume.github.com,resume,JavaScript,62866,1369,76,5598,False,False,False,True,Resumes generated using the GitHub informations
cline,cline,TypeScript,62817,6616,1004,699,True,True,True,True,"Autonomous coding agent as an SDK, IDE extension, or CLI assistant."
tldr,tldr-pages,Markdown,62776,5279,305,4562,False,True,True,True,Collaborative cheatsheets for console commands 📚.
scrapy,scrapy,Python,62119,11623,627,5948,True,True,True,True,"Scrapy, a fast high-level web crawling & scraping framework for Python."
vaultwarden,dani-garcia,Rust,61926,2884,48,3030,False,False,True,True,"Unofficial Bitwarden compatible server written in Rust, formerly known as bitwarden_rs"
sway,FuelLabs,Rust,61652,5423,914,1963,False,False,True,True,🌴 Empowering everyone to build reliable and efficient smart contracts.
leetcode-master,youngyangyang04,Shell,61614,12333,246,2365,False,False,False,True,《代码随想录》LeetCode 刷题攻略：200道经典题目刷题顺序，共60w字的详细图解，视频难点剖析，50余张思维导图，支持C++，Java，Python，Go，JavaScript等多语言版本，从此算法学习不再迷茫！🔥🔥 来看看，你会发现相见恨晚！🚀 
drawio-desktop,jgraph,JavaScript,61467,5686,69,3298,True,False,True,True,Official electron build of draw.io
redux,reduxjs,TypeScript,61462,15062,43,4025,True,True,True,True,A JS library for predictable global state management
git,git,C,61327,27982,376,6526,True,True,True,True,Git Source Code Mirror - This is a publish-only repository but pull requests can be turned into patches to the mailing list via GitGitGadget (https://gitgitgadget.github.io/). Please follow Documentation/SubmittingPatches procedure for any of your improvements.
Scrapling,D4Vinci,Python,61313,5930,25,600,True,True,True,True,🕷️ An adaptive Web Scraping framework that handles everything from a single request to a full-scale crawl!
openpilot,commaai,Python,61290,10960,158,3481,False,True,True,True,"openpilot is an operating system for robotics. Currently, it upgrades the driver assistance system on 300+ supported cars."
lodash,lodash,JavaScript,61231,7170,150,5173,False,True,True,True,"A modern JavaScript utility library delivering modularity, performance, & extras."
minio,minio,Go,61226,7560,81,4160,True,True,True,True,"MinIO is a high-performance, S3 compatible object store, open sourced under GNU AGPLv3 license."
oh-my-openagent,code-yeongyu,TypeScript,61179,4951,637,185,False,True,True,True,"omo; the one and only agent harness for complex codebases. the pickaxe for complex software engineering. For your Codex, for your OpenCode"
anything-llm,Mintplex-Labs,JavaScript,61124,6637,328,1098,False,True,True,True,Stop renting your intelligence. Own it with AnythingLLM. Everything you need for a powerful local-first agent experience 
warp,warpdotdev,Rust,61101,4905,4326,1793,True,True,True,True,"Warp is an agentic development environment, born out of the terminal."
docling,docling-project,Python,61044,4262,926,696,True,True,True,True,Get your documents ready for gen AI
Front-end-Developer-Interview-Questions,h5bp,Nunjucks,60872,11035,61,5230,True,True,True,True,"A list of helpful front-end related questions you can use to interview potential candidates, test yourself or completely ignore."
architect-awesome,xingshaocheng,,60811,17698,63,2982,False,False,False,True,后端架构师技术图谱
Magisk,topjohnwu,Kotlin,60808,17621,61,3557,False,False,True,True,The Magic Mask for Android
FFmpeg,FFmpeg,C,60797,13882,3,5531,False,True,False,True,Mirror of https://git.ffmpeg.org/ffmpeg.git
atom,atom,JavaScript,60795,17221,994,5250,True,True,False,True,:atom: The hackable text editor
awesome-chatgpt-prompts-zh,PlexPt,,60570,13579,44,1272,False,False,False,True,ChatGPT 中文调教指南。各种场景使用指南。学习怎么让它听你的话。
memos,usememos,Go,60428,4455,27,1640,False,False,True,True,"Open-source, self-hosted note-taking tool built for quick capture. Markdown-native, lightweight, and fully yours."
nuxt,nuxt,TypeScript,60353,5640,801,3509,True,True,True,True,the full-stack Vue framework
awesome-flutter,Solido,Dart,60226,6890,34,3316,False,True,True,True,"An awesome list that curates the best Flutter libraries, tools, tutorials, articles and more."
pi,earendil-works,TypeScript,60204,7224,55,300,False,True,True,True,"AI agent toolkit: coding agent CLI, unified LLM API, TUI & web UI libraries, Slack bot, vLLM pods"
markdown-here,adam-p,JavaScript,60203,11058,318,5137,False,True,False,True,"Google Chrome, Firefox, and Thunderbird extension that lets you write email in Markdown and render it before sending."
spring-framework,spring-projects,Java,60011,38827,426,5659,True,True,True,True,Spring Framework
graphify,safishamsi,Python,59963,6225,289,63,False,False,True,True,"AI coding assistant skill (Claude Code, Codex, OpenCode, Cursor, Gemini CLI, and more). Turn any folder of code, SQL schemas, R scripts, shell scripts, docs, papers, images, or videos into a queryable knowledge graph. App code + database schema + infrastructure in one graph."
Real-Time-Voice-Cloning,CorentinJ,Python,59891,9406,171,2567,False,False,True,True,Clone a voice in 5 seconds to generate arbitrary speech in real-time
astro,withastro,TypeScript,59877,3515,201,1908,True,True,True,True,The web framework for content-driven websites. ⭐️ Star to support our work!
jquery,jquery,JavaScript,59832,20420,93,6272,True,True,True,True,jQuery JavaScript Library
ai-hedge-fund,virattt,Python,59826,10566,139,553,False,False,True,True,An AI Hedge Fund Team
shadowsocks-windows,shadowsocks,C#,59562,16262,202,4890,False,True,False,True,A C# port of shadowsocks
open-design,nexu-io,TypeScript,59535,6711,320,39,False,True,True,True,"🎨 Local-first, open-source Claude Design alternative. 🖥️ Native desktop app. ⚡ 259+ Skills · ✨ 142+ Design Systems 🖼️ Web · desktop · mobile prototypes · slides · images · videos · HyperFrames 📦 Sandboxed preview · HTML/PDF/PPTX/MP4 export 🤖 Claude Code / OpenClaw / Codex / Cursor / OpenCode / Qwen / Copilot / Hermes / Kimi & 17+ CLIs."
llama,meta-llama,Python,59454,9786,521,1207,True,True,True,True,Inference code for Llama models
llm-app,pathwaycom,Jupyter Notebook,59433,1429,10,1052,True,True,True,True,"Ready-to-run cloud templates for RAG, AI pipelines, and enterprise search with live data. 🐳Docker-friendly.⚡Always in sync with Sharepoint, Google Drive, S3, Kafka, PostgreSQL, real-time data APIs, and more."
bat,sharkdp,Rust,59294,1573,396,2967,False,True,True,True,A cat(1) clone with wings.
rtk,rtk-ai,Rust,59273,3649,1107,134,False,True,True,True,"CLI proxy that reduces LLM token consumption by 60-90% on common dev commands. Single Rust binary, zero dependencies"
nanoGPT,karpathy,Python,59267,10227,347,1256,False,False,False,True,"The simplest, fastest repository for training/finetuning medium-sized GPTs."
pi-hole,pi-hole,Shell,59144,3215,46,4380,True,True,True,True,A black hole for Internet advertisements
TrendRadar,sansan0,Python,59031,24572,44,403,False,False,True,True,"⭐AI-driven public opinion & trend monitor with multi-platform aggregation, RSS, and smart alerts.🎯 告别信息过载，你的 AI 舆情监控助手与热点筛选工具！聚合多平台热点 +  RSS 订阅，支持关键词精准筛选。AI 智能筛选新闻 + AI 翻译 +  AI 分析简报直推手机，也支持接入 MCP 架构，赋能 AI 自然语言对话分析、情感洞察与趋势预测等。支持 Docker ，数据本地/云端自持。集成微信/飞书/钉钉/Telegram/邮件/ntfy/bark/slack 等渠道智能推送。"
mkcert,FiloSottile,Go,59025,3126,169,2903,True,True,True,True,A simple zero-config tool to make locally trusted development certificates with any names you'd like.
pocketbase,pocketbase,Go,58916,3437,17,1432,False,True,True,True,Open Source realtime backend in 1 file
autogen,microsoft,Python,58724,8863,876,1022,True,True,True,True,A programming framework for agentic AI
rails,rails,Ruby,58614,22297,1477,6630,True,True,True,True,Ruby on Rails
angular.js,angular,JavaScript,58607,27108,461,5995,True,True,False,True,AngularJS - HTML enhanced for web apps!
GPT-SoVITS,RVC-Boss,Python,58404,6392,870,873,False,False,True,True,1 min voice data can also be used to train a good TTS model! (few shot voice cloning)
zustand,pmndrs,TypeScript,58207,2066,3,2614,False,True,True,True,🐻 Bear necessities for state management in React
starship,starship,Rust,58148,2538,1012,2622,True,True,True,True,"☄🌌️  The minimal, blazing-fast, and infinitely customizable prompt for any shell!"
ruflo,ruvnet,TypeScript,58096,6648,615,368,False,False,True,True,"🌊 The leading agent meta-harness for Claude. Deploy intelligent multi-agent swarms, coordinate autonomous workflows, and build conversational AI systems. Features adaptive memory, self-learning swarm intelligence, RAG integration, and native Claude Code / Codex Integration"
ultralytics,ultralytics,Python,58064,11149,314,1363,True,True,True,True,Ultralytics YOLO 🚀
meilisearch,meilisearch,Rust,57964,2570,314,2965,True,True,True,True,A lightning-fast search engine API bringing AI-powered hybrid search to your sites and applications.
mem0,mem0ai,Python,57840,6611,398,1081,False,True,True,True,Universal memory layer for AI Agents
rclone,rclone,Go,57784,5132,1188,4464,True,True,True,True,"""rsync for cloud storage"" - Google Drive, S3, Dropbox, Backblaze B2, One Drive, Swift, Hubic, Wasabi, Google Cloud Storage, Azure Blob, Azure Files, Yandex Files"
awesome-rust,rust-unofficial,Rust,57723,3397,8,4341,False,True,True,True,A curated list of Rust code and resources.
v2rayNG,2dust,Kotlin,57573,7535,4,2579,False,False,True,True,"A V2Ray client for Android, support Xray core and v2fly core"
yolov5,ultralytics,Python,57497,17475,44,2210,True,True,True,True,YOLOv5 🚀 in PyTorch > ONNX > CoreML > TFLite
html5-boilerplate,h5bp,JavaScript,57483,12294,31,5976,True,True,True,True,"A professional front-end template for building fast, robust, and adaptable web apps or sites."
DeepLearning-500-questions,scutan90,JavaScript,57426,15928,119,2900,False,False,False,True,深度学习500问，以问答形式对常用的概率知识、线性代数、机器学习、深度学习、计算机视觉等热点问题进行阐述，以帮助自己及有需要的读者。 全书分为18个章节，50余万字。由于水平有限，书中不妥之处恳请广大读者批评指正。   未完待续............ 如有意合作，联系scutjy2015@163.com                     版权所有，违权必究       Tan 2018.06
github-cheat-sheet,tiimgreen,,57230,5422,48,4437,False,True,False,True,A list of cool features of Git and GitHub.
private-gpt,zylon-ai,Python,57210,7605,1,1130,False,False,True,True,"Interact with your documents using the power of GPT, 100% privately, no data leaks"
fuel-core,FuelLabs,Rust,57033,2863,194,2108,False,True,True,True,Rust full node implementation of the Fuel v2 protocol.
marktext,marktext,TypeScript,56958,4270,1076,3127,False,True,True,True,"📝A simple and elegant markdown editor, available for Linux, macOS and Windows."
hello-agents,datawhalechina,Python,56895,6942,141,271,False,False,True,True,📚 《从零开始构建智能体》——从零开始的智能体原理与实践教程
you-get,soimort,Python,56843,9736,384,5037,False,True,True,True,:arrow_double_down: Dumb downloader that scrapes the web
context7,upstash,TypeScript,56825,2686,132,436,False,False,True,True,Context7 Platform -- Up-to-date code documentation for LLMs and AI code editors
claude-code-best-practice,shanraisshan,HTML,56566,5691,9,217,False,False,True,True,from vibe coding to agentic engineering - practice makes claude perfect
rich,Textualize,Python,56557,2165,344,2399,True,True,True,True,Rich is a Python library for rich text and beautiful formatting in the terminal.
coolify,coollabsio,PHP,56525,4724,763,1957,True,True,True,True,"An open-source, self-hostable PaaS alternative to Vercel, Heroku & Netlify that lets you easily deploy static sites, databases, full-stack applications and 280+ one-click services on your own servers."
face_recognition,ageitgey,Python,56470,13719,837,3381,False,True,True,True,The world's simplest facial recognition api for Python and the command line
OpenManus,FoundationAgents,Python,56455,9828,539,456,True,False,True,True,"No fortress, purely open ground.  OpenManus is Coming."
react-router,remix-run,TypeScript,56440,10864,137,4403,True,True,True,True,Declarative routing for React
awesome-android-ui,wasabeef,,56334,10254,39,4182,True,False,False,True,A curated list of awesome Android UI/UX libraries
odysseus,pewdiepie-archdaemon,Python,56249,6711,915,5,False,True,True,True,Self-hosted AI workspace. 
appwrite,appwrite,TypeScript,56217,5418,938,2615,True,True,True,True,"Appwrite® - complete cloud infrastructure for your web, mobile and AI apps. Including Auth, Databases, Storage, Functions, Messaging, Hosting, Realtime and more"
gitea,go-gitea,Go,56138,6777,2792,3504,True,True,True,True,"Git with a cup of tea! Painless self-hosted all-in-one software development service, including Git hosting, code review, team collaboration, package registry and CI/CD"
project-layout,golang-standards,Makefile,56076,5444,94,3191,False,False,True,True,Standard Go Project Layout
termux-app,termux,Java,56000,6719,548,3878,False,False,True,True,Termux - a terminal emulator application for Android OS extendible by variety of packages.
ghostty,ghostty-org,Zig,55998,2847,241,1529,False,True,True,True,"👻 Ghostty is a fast, feature-rich, and cross-platform terminal emulator that uses platform-native UI and GPU acceleration."
gatsby,gatsbyjs,JavaScript,55950,10182,388,4033,True,True,True,True,"React-based framework with performance, scalability, and security built in."
worldmonitor,koala73,TypeScript,55892,8969,190,148,True,True,True,True,"Real-time global intelligence dashboard. AI-powered news aggregation, geopolitical monitoring, and infrastructure tracking in a unified situational awareness interface"
leetcode,azl397985856,JavaScript,55767,9414,10,2989,False,True,False,True,LeetCode Solutions: A Record of My Problem Solving Journey.( leetcode题解，记录自己的leetcode解题之路。)
winutil,ChrisTitusTech,PowerShell,55559,3146,37,1500,True,True,True,True,"Chris Titus Tech's Windows Utility - Install Programs, Tweaks, Fixes, and Updates"
faceswap,deepfakes,Python,55265,13372,8,3090,True,False,True,True,Deepfakes Software For All
gpt-engineer,AntonOsika,Python,55205,7311,71,1133,True,True,True,True,CLI platform to experiment with codegen. Precursor to: https://lovable.dev
joplin,laurent22,TypeScript,55102,6142,587,3427,False,True,True,True,"Joplin - the privacy-focused note taking app with sync capabilities for Windows, macOS, Linux, Android and iOS."
n8n-workflows,Zie619,Python,54985,7265,27,387,False,False,True,True,all of the workflows of n8n i could find (also from the site itself)
Mole,tw93,Shell,54925,1767,13,255,False,True,True,True,"🐹 Clean, uninstall, analyze, optimize, and monitor your Mac from the terminal."
nanochat,karpathy,Python,54646,7422,108,235,False,False,True,True,The best ChatGPT that $100 can buy.
ChatGPT,lencx,Rust,54388,6154,936,1276,False,False,True,True,"🔮 ChatGPT Desktop Application (Mac, Windows and Linux)"
powerlevel10k,romkatv,Shell,54361,2425,146,2658,False,False,False,True,A Zsh theme
first-contributions,firstcontributions,,54343,103737,68,3545,True,True,True,True,🚀✨ Help beginners to contribute to open source projects
segment-anything,facebookresearch,Jupyter Notebook,54301,6350,594,1170,True,True,True,True,"The repository provides code for running inference with the SegmentAnything Model (SAM), links for downloading the trained model checkpoints, and example notebooks that show how to use the model."
dive,wagoodman,Go,54234,1990,202,2945,False,False,True,True,A tool for exploring each layer in a docker image
OpenCut,OpenCut-app,TypeScript,54216,5914,318,348,True,False,True,True,The open-source CapCut alternative
maybe,maybe-finance,Ruby,54155,5605,0,886,False,True,True,True,The personal finance app for everyone
element,ElemeFE,Vue,54117,14459,2970,3563,False,False,True,True,A Vue.js 2.0 UI Toolkit for Web
trackerslist,ngosang,,54072,6602,11,3694,False,False,True,True,Updated list of public BitTorrent trackers
requests,psf,Python,54033,9948,229,5591,True,True,True,True,"A simple, yet elegant, HTTP library."
typst,typst,Rust,54022,1592,1229,2446,False,True,True,True,A markup-based typesetting system that is powerful and easy to learn.
mempalace,MemPalace,Python,53965,7086,569,62,False,True,True,True,The best-benchmarked open-source AI memory system. And it's free.
Ghost,TryGhost,JavaScript,53810,11697,247,4780,True,True,True,True,"Independent technology for modern publishing, memberships, subscriptions and newsletters."
PowerShell,PowerShell,C#,53801,8335,1508,3796,True,True,True,True,PowerShell for every system!
ImHex,WerWolv,C++,53787,2395,365,2033,True,True,True,True,"🔍 A Hex Editor for Reverse Engineers, Programmers and people who value their retinas when working at 3 AM."
core,vuejs,TypeScript,53777,9127,989,2915,False,True,True,True,"🖖 Vue.js is a progressive, incrementally-adoptable JavaScript framework for building UI on the web."
normalize.css,necolas,CSS,53531,10380,76,5511,False,True,False,True,A modern alternative to CSS resets
