repo_name,organization,language,stars,forks,open_issues,age_days,has_coc,has_contributing,has_workflows,has_readme,description
ansible,ansible,Python,68548,24176,801,5182,True,True,False,True,"Ansible is a radically simple IT automation platform that makes your applications and systems easier to deploy and maintain. Automate everything from code deployment to network configuration to cloud management, in a language that approaches plain English, using SSH, with no agents to install on remote systems. https://docs.ansible.com."
ghidra,NationalSecurityAgency,Java,68475,7516,1883,2632,False,True,True,True,Ghidra is a software reverse engineering (SRE) framework
awesome-courses,prakhar1989,,68409,8362,60,4198,False,True,False,True,:books: List of awesome university courses for learning Computer Science!
AFFiNE,toeverything,TypeScript,68397,4853,614,1383,True,True,True,True,"There can be more than Notion and Miro. AFFiNE(pronounced [ə‘fain]) is a next-gen knowledge base that brings planning, sorting and creating all together. Privacy first, open-source, customizable and ready to use. "
anime,juliangarnier,JavaScript,68167,4581,102,3714,False,True,True,True,JavaScript animation engine
MetaGPT,FoundationAgents,Python,67983,8663,129,1049,False,False,True,True,"🌟 The Multi-Agent Framework: First AI Software Company, Towards Natural Language Programming"
Apollo-11,chrislgarry,Assembly,67852,7685,130,4424,False,True,True,True,Original Apollo 11 Guidance Computer (AGC) source code for the command and lunar modules.
deer-flow,bytedance,Python,67782,9006,794,373,True,True,True,True,"An open-source long-horizon SuperAgent harness that researches, codes, and creates. With the help of sandboxes, memories, tools, skill, subagents and message gateway, it handles different levels of tasks that could take minutes to hours."
OpenBB,OpenBB-finance,Python,67587,6793,79,1971,True,False,True,True,"Financial data platform for analysts, quants and AI agents."
Chart.js,chartjs,JavaScript,67416,11951,564,4806,False,False,True,True,Simple HTML5 Charts using the <canvas> tag
annotated_deep_learning_paper_implementations,labmlai,Python,66701,6713,32,2089,False,False,True,True,"🧑‍🏫 60+ Implementations/tutorials of deep learning papers with side-by-side notes 📝; including transformers (original, xl, switch, feedback, vit, ...), optimizers (adam, adabelief, sophia, ...), gans(cyclegan, stylegan2, ...), 🎮 reinforcement learning (ppo, dqn), capsnet, distillation, ... 🧠"
33-js-concepts,leonardomso,JavaScript,66420,9189,4,2809,True,True,True,True,📜 33 JavaScript concepts every developer should know.
echarts,apache,TypeScript,66344,19807,1657,4790,True,True,True,True,"Apache ECharts is a powerful, interactive charting and data visualization library for browser"
gpt4free,xtekky,Python,66226,13586,3,1142,True,True,True,True,The official gpt4free repository | various collection of powerful language models | opus 4.6 gpt 5.3 kimi 2.5 deepseek v3.2 gemini 3
scikit-learn,scikit-learn,Python,66086,27021,2019,5749,True,True,True,True,scikit-learn: machine learning in Python
webpack,webpack,JavaScript,65766,9356,202,5178,True,True,True,True,"A bundler for javascript and friends. Packs many modules into a few bundled assets. Code Splitting allows for loading parts of the application on demand. Through ""loaders"", modules can be CommonJs, AMD, ES6 modules, CSS, Images, JSON, Coffeescript, LESS, ... and your custom stuff."
awesome-nodejs,sindresorhus,,65697,6226,26,4325,True,True,True,True,":zap: Delightful Node.js packages and resources [BECAUSE OF TOO MUCH SPAM AND LOW-QUALITY SUBMISSIONS, SUBMISSIONS ARE PAUSED UNTIL JULY]"
Java,TheAlgorithms,Java,65641,21143,35,3589,True,True,True,True,All Algorithms implemented in Java
crawl4ai,unclecode,Python,65548,6709,88,735,True,True,True,True,"🚀🤖 Crawl4AI: Open-source LLM Friendly Web Crawler & Scraper. Don't be shy, join here: https://discord.gg/jP8KfhDhyN"
design-resources-for-developers,bradtraversy,,65536,12026,19,2199,False,True,False,True,"Curated list of design and UI resources from stock photos, web templates, CSS frameworks, UI libraries, tools and much more"
paperclip,paperclipai,TypeScript,65510,11886,3749,73,False,True,True,True,The open-source app everyone uses to manage agents at work
javascript-questions,lydiahallie,,65330,9219,50,2528,False,False,False,True,"A long list of (advanced) JavaScript questions, and their explanations :sparkles:  "
nocode,kelseyhightower,Dockerfile,65277,4828,4715,3019,False,True,False,True,The best way to write secure and reliable applications. Write nothing; deploy nowhere.
interviews,kdn251,Java,64936,12898,119,3376,False,False,False,True,Everything you need to know to get the job.
localstack,localstack,Python,64934,4734,0,3488,True,True,True,True,💻 A fully functional local AWS cloud stack. Develop and test your cloud & Serverless apps offline
docusaurus,facebook,TypeScript,64918,9882,388,3250,True,True,True,True,Easy to maintain open source documentation websites.
uBlock,gorhill,JavaScript,64680,4110,17,4061,False,True,True,True,uBlock Origin - An efficient blocker for Chromium and Firefox. Fast and lean.
unsloth,unslothai,Python,64273,5659,1214,897,True,True,True,True,"Unsloth Studio is a web UI for training and running open models like Gemma 4, Qwen3.6, DeepSeek, gpt-oss locally."
alacritty,alacritty,Rust,64071,3461,336,3739,False,True,True,True,"A cross-platform, OpenGL terminal emulator."
keras,keras-team,Python,64067,19774,185,4066,False,True,True,True,Deep Learning for humans
prometheus,prometheus,Go,64042,10408,768,4919,True,True,True,True,The Prometheus monitoring system and time series database.
ripgrep,BurntSushi,Rust,63774,2559,189,3717,False,False,True,True,ripgrep recursively searches directories for a regex pattern while respecting your gitignore
open-interpreter,openinterpreter,Python,63530,5542,324,1035,False,True,True,True,A natural language interface for computers
ladybird,LadybirdBrowser,C++,63351,3028,658,714,True,True,True,True,Truly independent web browser
pathway,pathwaycom,Python,63319,1669,38,1264,True,True,True,True,"Python ETL framework for stream processing, real-time analytics, LLM pipelines, and RAG."
traefik,traefik,Go,63170,5987,815,3896,True,True,True,True,The Cloud Native Application Proxy
MinerU,opendatalab,Python,63079,5315,13,805,False,False,True,True,Transforms complex documents like PDFs and Office docs into LLM-ready markdown/JSON for your Agentic workflows.
socket.io,socketio,TypeScript,63078,10148,209,5908,False,True,True,True,Realtime application framework (Node.JS server)
nocodb,nocodb,TypeScript,63047,4769,699,3119,True,True,True,True,🔥 🔥 🔥 A Free & Self-hostable Airtable Alternative
nerd-fonts,ryanoasis,CSS,62983,3917,74,4179,True,True,True,True,"Iconic font aggregator, collection, & patcher. 3,600+ icons, 50+ patched fonts: Hack, Source Code Pro, more. Glyph collections: Font Awesome, Material Design Icons, Octicons, & more"
resume.github.com,resume,JavaScript,62847,1371,72,5576,False,False,False,True,Resumes generated using the GitHub informations
rustlings,rust-lang,Rust,62815,11188,50,3895,False,True,True,True,:crab: Small exercises to get you used to reading and writing Rust code!
30-Days-Of-Python,Asabeneh,Python,62558,11873,121,2368,False,False,True,True,The 30 Days of Python programming challenge is a step-by-step guide to learn the Python programming language in 30 days. This challenge may take more than 100 days. Follow your own pace. These videos may help too: https://www.youtube.com/channel/UC7PNRuno1rzYPb1xLa4yktw
tldr,tldr-pages,Markdown,62519,5233,296,4540,False,True,True,True,Collaborative cheatsheets for console commands 📚.
get-shit-done,gsd-build,JavaScript,62284,5286,48,151,False,True,True,True,"A light-weight and powerful meta-prompting, context engineering and spec-driven development system for Claude Code by TÂCHES."
cline,cline,TypeScript,61799,6427,863,677,True,True,True,True,"Autonomous coding agent as an SDK, IDE extension, or CLI assistant."
sway,FuelLabs,Rust,61702,5421,903,1941,False,False,True,True,🌴 Empowering everyone to build reliable and efficient smart contracts.
scrapy,scrapy,Python,61658,11547,621,5926,True,True,True,True,"Scrapy, a fast high-level web crawling & scraping framework for Python."
ai-agents-for-beginners,microsoft,Jupyter Notebook,61486,20824,7,532,True,False,True,True,12 Lessons to Get Started Building AI Agents
redux,reduxjs,TypeScript,61443,15071,42,4003,True,True,True,True,A JS library for predictable global state management
leetcode-master,youngyangyang04,Shell,61396,12339,245,2343,False,False,False,True,《代码随想录》LeetCode 刷题攻略：200道经典题目刷题顺序，共60w字的详细图解，视频难点剖析，50余张思维导图，支持C++，Java，Python，Go，JavaScript等多语言版本，从此算法学习不再迷茫！🔥🔥 来看看，你会发现相见恨晚！🚀 
lodash,lodash,JavaScript,61227,7163,142,5151,False,True,True,True,"A modern JavaScript utility library delivering modularity, performance, & extras."
drawio-desktop,jgraph,JavaScript,61103,5675,62,3276,True,False,True,True,Official electron build of draw.io
git,git,C,60953,27900,376,6504,True,True,True,True,Git Source Code Mirror - This is a publish-only repository but pull requests can be turned into patches to the mailing list via GitGitGadget (https://gitgitgadget.github.io/). Please follow Documentation/SubmittingPatches procedure for any of your improvements.
minio,minio,Go,60930,7494,81,4138,True,True,True,True,"MinIO is a high-performance, S3 compatible object store, open sourced under GNU AGPLv3 license."
openpilot,commaai,Python,60911,10898,153,3459,False,True,True,True,"openpilot is an operating system for robotics. Currently, it upgrades the driver assistance system on 300+ supported cars."
Front-end-Developer-Interview-Questions,h5bp,Nunjucks,60878,11043,58,5208,True,True,True,True,"A list of helpful front-end related questions you can use to interview potential candidates, test yourself or completely ignore."
architect-awesome,xingshaocheng,,60820,17728,63,2960,False,False,False,True,后端架构师技术图谱
atom,atom,JavaScript,60802,17233,994,5228,True,True,False,True,:atom: The hackable text editor
MiroFish,666ghj,Python,60729,9481,272,170,False,False,True,True,"A Simple and Universal Swarm Intelligence Engine, Predicting Anything. 简洁通用的群体智能引擎，预测万物"
learn-claude-code,shareAI-lab,TypeScript,60530,9911,124,319,False,False,True,True,"Bash is all you need -  A nano claude code–like 「agent harness」, built from 0 to 1"
Magisk,topjohnwu,Kotlin,60437,17447,59,3535,False,False,True,True,The Magic Mask for Android
caveman,JuliusBrussee,JavaScript,60373,3346,198,40,False,True,True,True,🪨 why use many token when few token do trick — Claude Code skill that cuts 65% of tokens by talking like caveman
vaultwarden,dani-garcia,Rust,60270,2786,46,3008,False,False,True,True,"Unofficial Bitwarden compatible server written in Rust, formerly known as bitwarden_rs"
nuxt,nuxt,TypeScript,60221,5606,799,3487,True,True,True,True,The Full-Stack Vue Framework.
markdown-here,adam-p,JavaScript,60198,11071,318,5115,False,True,False,True,"Google Chrome, Firefox, and Thunderbird extension that lets you write email in Markdown and render it before sending."
FFmpeg,FFmpeg,C,60126,13822,3,5509,False,True,False,True,Mirror of https://git.ffmpeg.org/ffmpeg.git
awesome-chatgpt-prompts-zh,PlexPt,,60064,13590,44,1250,False,False,False,True,ChatGPT 中文调教指南。各种场景使用指南。学习怎么让它听你的话。
anything-llm,Mintplex-Labs,JavaScript,60057,6495,364,1076,False,True,True,True,The all-in-one AI productivity accelerator. On device and privacy first with no annoying setup or configuration.
awesome-flutter,Solido,Dart,59998,6873,24,3294,False,True,True,True,"An awesome list that curates the best Flutter libraries, tools, tutorials, articles and more."
spring-framework,spring-projects,Java,59940,38838,428,5637,True,True,True,True,Spring Framework
awesome-claude-skills,ComposioHQ,Python,59882,6511,628,209,False,True,True,True,"A curated list of awesome Claude Skills, resources, and tools for customizing Claude AI workflows"
jquery,jquery,JavaScript,59842,20438,95,6250,True,True,True,True,jQuery JavaScript Library
docling,docling-project,Python,59756,4140,898,674,True,True,True,True,Get your documents ready for gen AI
Real-Time-Voice-Cloning,CorentinJ,Python,59743,9412,170,2545,False,False,True,True,Clone a voice in 5 seconds to generate arbitrary speech in real-time
llm-app,pathwaycom,Jupyter Notebook,59731,1435,10,1030,True,True,True,True,"Ready-to-run cloud templates for RAG, AI pipelines, and enterprise search with live data. 🐳Docker-friendly.⚡Always in sync with Sharepoint, Google Drive, S3, Kafka, PostgreSQL, real-time data APIs, and more."
memos,usememos,Go,59622,4357,23,1618,False,False,True,True,"Open-source, self-hosted note-taking tool built for quick capture. Markdown-native, lightweight, and fully yours."
shadowsocks-windows,shadowsocks,C#,59558,16275,201,4868,False,True,False,True,A C# port of shadowsocks
llama,meta-llama,Python,59417,9801,519,1185,True,True,True,True,Inference code for Llama models
astro,withastro,TypeScript,59283,3444,208,1886,True,True,True,True,The web framework for content-driven websites. ⭐️ Star to support our work!
mkcert,FiloSottile,Go,58912,3114,167,2881,True,True,True,True,A simple zero-config tool to make locally trusted development certificates with any names you'd like.
bat,sharkdp,Rust,58888,1557,359,2945,False,True,True,True,A cat(1) clone with wings.
ai-hedge-fund,virattt,Python,58802,10332,130,531,False,False,True,True,An AI Hedge Fund Team
angular.js,angular,JavaScript,58644,27132,461,5973,True,True,False,True,AngularJS - HTML enhanced for web apps!
pi-hole,pi-hole,Shell,58617,3159,48,4358,True,True,True,True,A black hole for Internet advertisements
warp,warpdotdev,Rust,58475,4518,3773,1771,True,True,True,True,"Warp is an agentic development environment, born out of the terminal."
rails,rails,Ruby,58423,22218,1550,6608,True,True,True,True,Ruby on Rails
pocketbase,pocketbase,Go,58332,3374,17,1410,False,True,True,True,Open Source realtime backend in 1 file
nanoGPT,karpathy,Python,58098,9982,347,1234,False,False,False,True,"The simplest, fastest repository for training/finetuning medium-sized GPTs."
autogen,microsoft,Python,58036,8759,825,1000,True,True,True,True,A programming framework for agentic AI
zustand,pmndrs,TypeScript,58027,2053,5,2592,False,True,True,True,🐻 Bear necessities for state management in React
oh-my-openagent,code-yeongyu,TypeScript,57838,4692,645,163,False,True,True,True,omo; the best agent harness - previously oh-my-opencode
TrendRadar,sansan0,Python,57579,24283,35,381,False,False,True,True,"⭐AI-driven public opinion & trend monitor with multi-platform aggregation, RSS, and smart alerts.🎯 告别信息过载，你的 AI 舆情监控助手与热点筛选工具！聚合多平台热点 +  RSS 订阅，支持关键词精准筛选。AI 智能筛选新闻 + AI 翻译 +  AI 分析简报直推手机，也支持接入 MCP 架构，赋能 AI 自然语言对话分析、情感洞察与趋势预测等。支持 Docker ，数据本地/云端自持。集成微信/飞书/钉钉/Telegram/邮件/ntfy/bark/slack 等渠道智能推送。"
meilisearch,meilisearch,Rust,57573,2542,291,2943,True,True,True,True,A lightning-fast search engine API bringing AI-powered hybrid search to your sites and applications.
GPT-SoVITS,RVC-Boss,Python,57476,6271,859,851,False,False,True,True,1 min voice data can also be used to train a good TTS model! (few shot voice cloning)
starship,starship,Rust,57454,2515,1009,2600,True,True,True,True,"☄🌌️  The minimal, blazing-fast, and infinitely customizable prompt for any shell!"
html5-boilerplate,h5bp,JavaScript,57435,12308,27,5954,True,True,True,True,"A professional front-end template for building fast, robust, and adaptable web apps or sites."
DeepLearning-500-questions,scutan90,JavaScript,57388,15945,120,2878,False,False,False,True,深度学习500问，以问答形式对常用的概率知识、线性代数、机器学习、深度学习、计算机视觉等热点问题进行阐述，以帮助自己及有需要的读者。 全书分为18个章节，50余万字。由于水平有限，书中不妥之处恳请广大读者批评指正。   未完待续............ 如有意合作，联系scutjy2015@163.com                     版权所有，违权必究       Tan 2018.06
yolov5,ultralytics,Python,57369,17478,43,2188,True,True,True,True,YOLOv5 🚀 in PyTorch > ONNX > CoreML > TFLite
awesome-rust,rust-unofficial,Rust,57295,3353,11,4319,False,True,True,True,A curated list of Rust code and resources.
MoneyPrinterTurbo,harry0703,Python,57226,8265,1,795,False,False,True,True,利用AI大模型，一键生成高清短视频 Generate short videos with one click using AI LLM.
private-gpt,zylon-ai,Python,57213,7594,301,1108,False,False,True,True,"Interact with your documents using the power of GPT, 100% privately, no data leaks"
rclone,rclone,Go,57186,5090,1180,4442,True,True,True,True,"""rsync for cloud storage"" - Google Drive, S3, Dropbox, Backblaze B2, One Drive, Swift, Hubic, Wasabi, Google Cloud Storage, Azure Blob, Azure Files, Yandex Files"
ultralytics,ultralytics,Python,57151,11000,320,1341,True,True,True,True,Ultralytics YOLO 🚀
fuel-core,FuelLabs,Rust,57084,2861,187,2086,False,True,True,True,Rust full node implementation of the Fuel v2 protocol.
you-get,soimort,Python,56856,9753,384,5015,False,True,True,True,:arrow_double_down: Dumb downloader that scrapes the web
github-cheat-sheet,tiimgreen,,56854,5419,46,4415,False,True,False,True,A list of cool features of Git and GitHub.
react-router,remix-run,TypeScript,56413,10855,149,4381,True,True,True,True,Declarative routing for React
face_recognition,ageitgey,Python,56403,13741,835,3359,False,True,True,True,The world's simplest facial recognition api for Python and the command line
RuView,ruvnet,Rust,56394,7445,145,342,False,False,True,True,"π RuView turns commodity WiFi signals into real-time spatial intelligence, vital sign monitoring, and presence detection — all without a single pixel of video."
rich,Textualize,Python,56355,2156,324,2377,True,True,True,True,Rich is a Python library for rich text and beautiful formatting in the terminal.
OpenManus,FoundationAgents,Python,56264,9801,550,434,True,False,True,True,"No fortress, purely open ground.  OpenManus is Coming."
v2rayNG,2dust,Kotlin,56114,7395,8,2557,False,False,True,True,"A V2Ray client for Android, support Xray core and v2fly core"
awesome-android-ui,wasabeef,,56098,10256,40,4160,True,False,False,True,A curated list of awesome Android UI/UX libraries
marktext,marktext,JavaScript,56089,4201,1310,3105,False,True,True,True,"📝A simple and elegant markdown editor, available for Linux, macOS and Windows."
appwrite,appwrite,TypeScript,56075,5345,877,2593,True,True,True,True,"Appwrite® - complete cloud infrastructure for your web, mobile and AI apps. Including Auth, Databases, Storage, Functions, Messaging, Hosting, Realtime and more"
project-layout,golang-standards,Makefile,55971,5451,94,3169,False,False,True,True,Standard Go Project Layout
gatsby,gatsbyjs,JavaScript,55950,10198,373,4011,True,True,True,True,"React-based framework with performance, scalability, and security built in."
leetcode,azl397985856,JavaScript,55777,9440,10,2967,False,True,False,True,LeetCode Solutions: A Record of My Problem Solving Journey.( leetcode题解，记录自己的leetcode解题之路。)
mem0,mem0ai,Python,55741,6344,351,1059,False,True,True,True,Universal memory layer for AI Agents
gitea,go-gitea,Go,55685,6698,2803,3482,True,True,True,True,"Git with a cup of tea! Painless self-hosted all-in-one software development service, including Git hosting, code review, team collaboration, package registry and CI/CD"
context7,upstash,TypeScript,55331,2623,146,414,False,False,True,True,Context7 Platform -- Up-to-date code documentation for LLMs and AI code editors
faceswap,deepfakes,Python,55234,13393,7,3068,True,False,True,True,Deepfakes Software For All
gpt-engineer,AntonOsika,Python,55217,7352,71,1111,True,True,True,True,CLI platform to experiment with codegen. Precursor to: https://lovable.dev
coolify,coollabsio,PHP,55104,4473,753,1935,True,True,True,True,"An open-source, self-hostable PaaS alternative to Vercel, Heroku & Netlify that lets you easily deploy static sites, databases, full-stack applications and 280+ one-click services on your own servers."
termux-app,termux,Java,54918,6574,539,3856,False,False,True,True,Termux - a terminal emulator application for Android OS extendible by variety of packages.
joplin,laurent22,TypeScript,54814,6103,568,3405,False,True,True,True,"Joplin - the privacy-focused note taking app with sync capabilities for Windows, macOS, Linux, Android and iOS."
ghostty,ghostty-org,Zig,54548,2699,248,1507,False,True,True,True,"👻 Ghostty is a fast, feature-rich, and cross-platform terminal emulator that uses platform-native UI and GPU acceleration."
winutil,ChrisTitusTech,PowerShell,54477,3060,18,1478,True,True,True,True,"Chris Titus Tech's Windows Utility - Install Programs, Tweaks, Fixes, and Updates"
n8n-workflows,Zie619,Python,54380,7146,24,365,False,False,True,True,all of the workflows of n8n i could find (also from the site itself)
ChatGPT,lencx,Rust,54379,6172,933,1254,False,False,True,True,"🔮 ChatGPT Desktop Application (Mac, Windows and Linux)"
worldmonitor,koala73,TypeScript,54207,8712,172,126,True,True,True,True,"Real-time global intelligence dashboard. AI-powered news aggregation, geopolitical monitoring, and infrastructure tracking in a unified situational awareness interface"
powerlevel10k,romkatv,Shell,54176,2419,147,2636,False,False,False,True,A Zsh theme
segment-anything,facebookresearch,Jupyter Notebook,54152,6335,593,1148,True,True,True,True,"The repository provides code for running inference with the SegmentAnything Model (SAM), links for downloading the trained model checkpoints, and example notebooks that show how to use the model."
element,ElemeFE,Vue,54128,14482,2968,3541,False,False,True,True,A Vue.js 2.0 UI Toolkit for Web
maybe,maybe-finance,Ruby,54113,5611,0,864,False,True,True,True,The personal finance app for everyone
requests,psf,Python,53990,9920,225,5569,True,True,True,True,"A simple, yet elegant, HTTP library."
first-contributions,firstcontributions,,53971,102615,165,3523,True,True,True,True,🚀✨ Help beginners to contribute to open source projects
dive,wagoodman,Go,53932,1995,203,2923,False,False,True,True,A tool for exploring each layer in a docker image
trackerslist,ngosang,,53836,6612,5,3672,False,False,True,True,Updated list of public BitTorrent trackers
core,vuejs,TypeScript,53673,9111,980,2893,False,True,True,True,"🖖 Vue.js is a progressive, incrementally-adoptable JavaScript framework for building UI on the web."
ImHex,WerWolv,C++,53569,2385,353,2011,True,True,True,True,"🔍 A Hex Editor for Reverse Engineers, Programmers and people who value their retinas when working at 3 AM."
normalize.css,necolas,CSS,53541,10398,75,5489,False,True,False,True,A modern alternative to CSS resets
typst,typst,Rust,53539,1575,1252,2424,False,True,True,True,A markup-based typesetting system that is powerful and easy to learn.
nanochat,karpathy,Python,53454,7184,104,213,False,False,True,True,The best ChatGPT that $100 can buy.
PowerShell,PowerShell,C#,53438,8314,1480,3774,True,True,True,True,PowerShell for every system!
pdf.js,mozilla,JavaScript,53316,10616,451,5498,True,True,True,True,PDF Reader in JavaScript
material-design-icons,google,,53286,9724,403,4236,True,True,True,True,Material Design icons by Google (Material Symbols)
claude-code-best-practice,shanraisshan,HTML,53076,5306,14,195,False,False,True,True,from vibe coding to agentic engineering - practice makes claude perfect
Flowise,FlowiseAI,TypeScript,52824,24336,844,1140,True,True,True,True,"Build AI Agents, Visually"
Ghost,TryGhost,JavaScript,52799,11551,272,4758,True,True,True,True,"Independent technology for modern publishing, memberships, subscriptions and newsletters."
kotlin,JetBrains,Kotlin,52727,6300,241,5204,True,True,True,True,The Kotlin Programming Language. 
ionic-framework,ionic-team,TypeScript,52503,13381,630,4650,True,True,True,True,"A powerful cross-platform UI toolkit for building native-quality iOS, Android, and Progressive Web Apps with HTML, CSS, and JavaScript."
Docker-OSX,sickcodes,Shell,52497,2888,417,2170,False,False,True,True,Run macOS VM in a Docker! Run near native OSX-KVM in Docker! X11 Forwarding! CI/CD for OS X Security Research! Docker mac Containers.
mempalace,MemPalace,Python,52215,6895,546,40,False,True,True,True,The best-benchmarked open-source AI memory system. And it's free.
awesome-ios,vsouza,Swift,52170,6961,7,4326,True,True,True,True,"A curated list of awesome iOS ecosystem, including Objective-C and Swift Projects "
prettier,prettier,JavaScript,51868,4716,1481,3453,True,True,True,True,Prettier is an opinionated code formatter.
etcd,etcd-io,Go,51701,10352,240,4695,True,True,True,True,Distributed reliable key-value store for the most critical data of a distributed system
Motrix,agalwood,JavaScript,51672,4868,779,2704,True,True,True,True,A full-featured download manager.
jellyfin,jellyfin,C#,51585,4791,701,2713,True,True,True,True,The Free Software Media System - Server Backend & API
grok-1,xai-org,Python,51550,8459,125,788,True,False,True,True,Grok open release
guava,google,Java,51495,11143,736,4368,True,True,True,True,Google core libraries for Java
