repo_name,organization,language,stars,forks,open_issues,age_days,has_coc,has_contributing,has_workflows,has_readme,description
sentry,getsentry,Python,44120,4727,2097,5770,True,True,True,True,Developer-first error tracking and performance monitoring
last30days-skill,mvanhorn,Python,44117,3622,52,145,False,False,True,True,"AI agent skill that researches any topic across Reddit, X, YouTube, HN, Polymarket, and the web - then synthesizes a grounded summary"
cobra,spf13,Go,44114,3152,378,4670,False,True,True,True,A Commander for modern Go CLI interactions
EasySpider,NaiboWang,JavaScript,44110,5380,267,2161,False,False,True,True,A visual no-code/code-free web crawler/spider易采集：一个可视化浏览器自动化测试/数据采集/网页爬虫软件，可以无代码图形化的设计和执行爬虫任务。别名：ServiceWrapper面向Web应用的智能化服务封装系统。
system-design,karanpratapsingh,,44077,5736,3,1402,True,True,False,True,Learn how to design systems at scale and prepare for system design interviews
parcel,parcel-bundler,JavaScript,44030,2279,597,3236,True,True,True,True,The zero configuration build tool for the web. 📦🚀
babel,babel,TypeScript,43998,5827,748,4280,True,True,True,True,🐠 Babel is a compiler for writing next generation JavaScript.
react-use,streamich,TypeScript,43976,3274,660,2790,False,True,True,True,React Hooks — 👍
mitmproxy,mitmproxy,Python,43964,4594,443,5966,True,True,True,True,An interactive TLS-capable intercepting HTTP proxy for penetration testers and software developers.
front-end-interview-handbook,yangshun,MDX,43963,5938,12,3077,True,True,True,True,Front End interview preparation materials for busy engineers (updated for 2026)
Files,files-community,C#,43941,2753,499,2721,True,True,True,True,A modern file manager that helps users organize their files and folders.
build-web-application-with-golang,astaxie,Go,43919,10471,138,5067,False,False,False,True,A golang ebook intro how to build a web with golang
retrofit,square,HTML,43898,7340,170,5763,False,True,True,True,A type-safe HTTP client for Android and the JVM
chrome-devtools-mcp,ChromeDevTools,TypeScript,43895,2823,92,279,False,True,True,True,Chrome DevTools for coding agents
TensorFlow-Examples,aymericdamien,Jupyter Notebook,43752,14708,228,3871,False,False,False,True,TensorFlow Tutorial and Examples for Beginners (support TF v1 & v2)
full-stack-fastapi-template,fastapi,TypeScript,43723,8674,15,2671,False,True,True,True,"Full stack, modern web application template. Using FastAPI, React, SQLModel, PostgreSQL, Docker, GitHub Actions, automatic HTTPS and more."
kong,Kong,Lua,43606,5152,150,4230,True,True,True,True,🦍 The API and AI Gateway
spark,apache,Scala,43472,29241,412,4495,True,True,True,True,Apache Spark - A unified analytics engine for large-scale data processing
logseq,logseq,Clojure,43446,2676,915,2217,True,True,True,True,"A privacy-first, open-source platform for knowledge management and collaboration. Download link:  http://github.com/logseq/logseq/releases. roadmap: https://logseq.io/p/NX4mc_ggEV"
fd,sharkdp,Rust,43380,1068,175,3326,False,True,True,True,"A simple, fast and user-friendly alternative to 'find'"
CLI-Anything,HKUDS,Python,43367,4058,59,101,False,True,True,True,"""CLI-Anything: Making ALL Software Agent-Native"" -- CLI-Hub: https://clianything.cc/"
CPlusPlusThings,Light-City,C++,43238,8836,10,2530,False,False,False,True,C++那些事
pm2,Unitech,JavaScript,43216,2714,1083,4776,False,True,True,True,Node.js Production Process Manager with a built-in Load Balancer.
bubbletea,charmbracelet,Go,43213,1239,184,2350,False,True,True,True,A powerful little TUI framework 🏗
system_prompts_leaks,asgeirtj,JavaScript,43200,7161,28,411,False,True,True,True,"Extracted system prompts from Anthropic - Claude Fable 5, Opus 4.8, Claude Code, Claude Design. OpenAI - ChatGPT 5.5 Thinking, GPT 5.5 Instant, Codex. Google - Gemini 3.5 Flash, 3.1 Pro, Antigravity. xAI - Grok, Cursor, Copilot, VS Code, Perplexity, and more. Updated regularly."
what-happens-when,alex,,43194,5737,2065,4606,False,False,True,True,"An attempt to answer the age old interview question ""What happens when you type google.com into your browser and press enter?"""
fuels-rs,FuelLabs,Rust,43157,1361,71,1690,False,False,True,True,Fuel Network Rust SDK
fuels-ts,FuelLabs,TypeScript,43128,1372,78,1748,True,True,True,True,Fuel Network Typescript SDK
zig,ziglang,Zig,43124,3063,2910,3969,False,False,False,True,Moved to Codeberg
payload,payloadcms,TypeScript,43080,3809,810,1989,False,True,True,True,"Payload is the open-source, fullstack Next.js framework, giving you instant backend superpowers. Get a full TypeScript backend and admin panel instantly. Use Payload as a headless CMS or for building powerful applications."
jan,janhq,TypeScript,43060,2944,464,1036,True,True,True,True,Jan is an open source alternative to ChatGPT that runs 100% offline on your computer.
daily_stock_analysis,ZhuLinsen,Python,43017,40701,40,159,False,True,True,True,LLM驱动的 A/H/美股智能分析：多数据源行情 + 实时新闻 + LLM决策仪表盘 + 多渠道推送，零成本定时运行，纯白嫖. LLM-powered stock analysis system for A/H/US markets.
hyperswitch,juspay,Rust,43016,4807,1819,1339,True,True,True,True,"Open source, composable payments platform | PCI compliant | SaaS and Self-host options | Enables connectivity to multiple payment, payout, fraud, vault and tokenization providers | Uplifts authorization with intelligent routing and revenue recovery | Reduce payment processing costs with cost observability | Reduces payment ops with reconciliation"
zod,colinhacks,TypeScript,42997,2025,203,2293,True,True,True,True,TypeScript-first schema validation with static type inference
ccxt,ccxt,Python,42959,8698,1323,3321,False,True,True,True,A cryptocurrency trading API with more than 100 exchanges in JavaScript / TypeScript / Python / C# / PHP / Go / Java 
gradio,gradio-app,Python,42956,3494,254,2737,True,True,True,True,"Build and share delightful machine learning apps, all in Python. 🌟 Star to support our work!"
ray,ray-project,Python,42923,7699,3488,3522,False,True,True,True,Ray is an AI compute engine. Ray consists of a core distributed runtime and a set of AI Libraries for accelerating ML workloads.
desktop,zen-browser,JavaScript,42919,1578,529,812,True,False,True,True,Welcome to a calmer internet
python-patterns,faif,Python,42806,7014,14,5124,False,False,True,True,A collection of design patterns/idioms in Python
FlClash,chen08209,Dart,42788,2691,862,1037,False,False,True,True,"A multi-platform proxy client based on ClashMeta,simple and easy to use, open-source and ad-free."
data-engineering-zoomcamp,DataTalksClub,Jupyter Notebook,42548,8425,0,1700,False,False,True,True,Data Engineering Zoomcamp is a free 9-week course on building production-ready data pipelines. The next cohort starts in January 2026. Join the course here 👇🏼
DeepSpeed,deepspeedai,Python,42538,4860,1306,2337,True,True,True,True,"DeepSpeed is a deep learning optimization library that makes distributed training and inference easy, efficient, and effective."
git-flight-rules,k88hudson,,42470,3173,14,4348,False,False,False,True,Flight rules for git
Fabric,danielmiessler,Go,42443,4172,61,896,True,True,True,True,Fabric is an open-source framework for augmenting humans using AI. It provides a modular system for solving specific problems using a crowdsourced set of AI prompts that can be used anywhere.
GitNexus,abhigyanpatwari,TypeScript,42404,4796,260,319,False,True,True,True,"GitNexus: The Zero-Server Code Intelligence Engine -       GitNexus is a client-side knowledge graph creator that runs entirely in your browser. Drop in a git repository (Github, Gitlab, Azure, Local) or ZIP file, and get an interactive knowledge graph with a built in Graph RAG Agent. Perfect for code exploration"
Alamofire,Alamofire,Swift,42382,7670,43,4340,False,True,True,True,Elegant HTTP Networking in Swift
diagrams,mingrammer,Python,42367,2727,385,2327,False,True,True,True,:art: Diagram as Code for prototyping cloud system architectures
puter,HeyPuter,TypeScript,42347,3893,24,837,False,True,True,True,"🌐 The Internet Computer! Free, Open-Source, and Self-Hostable."
ailearning,apachecn,Python,42325,11542,4,3399,False,False,False,True,AiLearning：数据分析+机器学习实战+线性代数+PyTorch+NLTK+TF2
paperless-ngx,paperless-ngx,Python,42208,2812,9,1586,True,True,True,True,"A community-supported supercharged document management system: scan, index and archive all your documents"
curl,curl,C,42149,7241,43,5935,True,True,True,True,"A command line tool and library for transferring data with URL syntax, supporting DICT, FILE, FTP, FTPS, GOPHER, GOPHERS, HTTP, HTTPS, IMAP, IMAPS, LDAP, LDAPS, MQTT, MQTTS, POP3, POP3S, RTSP, SCP, SFTP, SMB, SMBS, SMTP, SMTPS, TELNET, TFTP, WS and WSS. libcurl offers a myriad of powerful features"
HEU_KMS_Activator,zbezj,,41997,3880,174,2552,False,False,False,True,
CL4R1T4S,elder-plinius,,41992,8387,111,470,False,False,False,True,"LEAKED SYSTEM PROMPTS FOR CHATGPT, CLAUDE, GEMINI, GROK, PERPLEXITY, CURSOR, LOVABLE, REPLIT, AND MORE! - AI SYSTEMS TRANSPARENCY FOR ALL! 👐"
swiper,nolimits4web,JavaScript,41853,9654,247,5208,True,True,False,True,Most modern mobile touch slider with hardware accelerated transitions
hexo,hexojs,TypeScript,41759,27,96,5015,True,True,True,True,"A fast, simple & powerful blog framework, powered by Node.js."
vnpy,vnpy,Python,41752,11922,14,4126,True,False,True,True,基于Python的开源量化交易平台开发框架
data-engineer-handbook,DataExpert-io,Jupyter Notebook,41704,7881,38,941,False,False,False,True,This is a repo with links to everything you'd ever want to learn about data engineering
WeChatMsg,LC044,,41673,5213,25,1254,False,False,False,True,
fastlane,fastlane,Ruby,41670,6012,745,4215,True,True,True,True,🚀 The easiest way to automate building and releasing your iOS and Android apps
pure-bash-bible,dylanaraps,Shell,41652,3627,62,2927,False,True,False,True,📖 A collection of pure bash alternatives to external processes.
black,psf,Python,41564,2779,287,3017,True,True,True,True,The uncompromising Python code formatter
uni-app,dcloudio,Objective-C,41552,3710,692,2897,False,True,True,True,A cross-platform framework using Vue.js
dubbo,apache,Java,41517,26426,995,5111,True,True,True,True,The java implementation of Apache Dubbo. An RPC and microservice framework.
yarn,yarnpkg,JavaScript,41501,2724,2057,3802,True,True,True,True,The 1.x line is frozen - features and bugfixes now happen on https://github.com/yarnpkg/berry
cheat.sh,chubin,Python,41463,1915,144,3328,False,True,True,True,the only cheat sheet you need
BettaFish,666ghj,Python,41438,7592,34,716,True,True,True,True,微舆：人人可用的多Agent舆情分析助手，打破信息茧房，还原舆情原貌，预测未来走向，辅助决策！从0实现，不依赖任何框架。
lossless-cut,mifi,TypeScript,41412,2014,250,3517,False,True,True,True,The swiss army knife of lossless video/audio editing
ColossalAI,hpcaitech,Python,41396,4510,500,1693,False,True,True,True,"Making large AI models cheaper, faster and more accessible"
react-bits,DavidHDev,JavaScript,41340,1893,2,681,False,True,True,True,"An open source collection of animated, interactive & fully customizable React components for building memorable websites."
aria2,aria2,C++,41231,3867,1147,5681,False,False,True,True,"aria2 is a lightweight multi-protocol & multi-source, cross platform download utility operated in command-line. It supports HTTP/HTTPS, FTP, SFTP, BitTorrent and Metalink."
tabler,tabler,HTML,41187,4369,140,3058,True,False,True,True,Tabler is free and open-source HTML Dashboard UI Kit built on Bootstrap
nw.js,nwjs,JavaScript,41182,3852,898,5279,False,False,False,True,Call all Node.js modules directly from DOM/WebWorker and enable a new way of writing applications with all Web technologies.
daisyui,saadeghi,Svelte,41133,1637,68,2027,False,True,True,True,"🌼 🌼 🌼 🌼 🌼  The most popular, free and open-source Tailwind CSS component library"
styled-components,styled-components,TypeScript,41099,2529,12,3593,True,True,True,True,"Fast, expressive styling for React. Server components, client components, streaming SSR, React Native—one API."
dive-into-llms,Lordog,Jupyter Notebook,41083,5003,14,800,False,False,False,True,《动手学大模型Dive into LLMs》系列编程实践教程
airi,moeru-ai,TypeScript,41076,4138,182,563,True,True,True,True,"💖🧸 Self hosted, you-owned Grok Companion, a container of souls of waifu, cyber livings to bring them into our worlds, wishing to achieve Neuro-sama's altitude. Capable of realtime voice chat, Minecraft, Factorio playing. Web / macOS / Windows supported."
vue2-elm,bailicangdu,Vue,41061,12271,121,3464,False,False,True,True,Large single page application with 45 pages built on vue2 + vuex. 基于 vue2 + vuex 构建一个具有 45 个页面的大型单页面应用
ChatGLM-6B,zai-org,Python,41039,5140,608,1192,False,False,False,True,ChatGLM-6B: An Open Bilingual Dialogue Language Model | 开源双语对话语言模型
antigravity-awesome-skills,sickn33,Python,41018,6615,4,154,True,True,True,True,"Installable GitHub library of 1,500+ agentic skills for Claude Code, Cursor, Codex CLI, Gemini CLI, Antigravity, and more. Includes specialized plugins, installer CLI, bundles, workflows, and official/community skill collections."
vuetify,vuetifyjs,TypeScript,40998,7131,518,3566,True,True,True,True,🐉 Vue Component Framework
cobalt,imputnet,Svelte,40929,3495,249,1440,False,True,True,True,best way to save what you love
3x-ui,MHSanaei,Go,40920,7662,96,1224,False,True,True,True,"Xray panel supporting multi-protocol multi-user expire day & traffic & IP limit (Vmess, Vless, Trojan, ShadowSocks, Wireguard, Hysteria, Tunnel, Mixed, HTTP, Tun) "
free,freefq,,40856,5636,579,2202,False,False,False,True,翻墙、免费翻墙、免费科学上网、免费节点、免费梯子、免费ss/v2ray/trojan节点、蓝灯、谷歌商店、翻墙梯子
agno,agno-agi,Python,40754,5534,958,1505,True,True,True,True,"Build, run, and manage agent platforms."
zju-icicles,QSCTech,HTML,40613,9577,10,3641,False,False,True,True,浙江大学课程攻略共享计划
50projects50days,bradtraversy,CSS,40581,9748,48,2039,False,False,False,True,"50+ mini web projects using HTML, CSS & JS"
chatbox,chatboxai,TypeScript,40526,4115,1185,1199,False,False,True,True,Powerful AI Client
vim,vim,Vim Script,40525,6074,1638,3956,False,True,True,True,The official Vim repository
remote-jobs,remoteintech,JavaScript,40478,3947,14,3901,True,True,True,True,Source for remoteintech.company — a community-maintained directory of remote-friendly tech companies
chakra-ui,chakra-ui,TypeScript,40442,3615,17,2496,True,True,True,True,Chakra UI is a component system for building SaaS products with speed ⚡️
trpc,trpc,TypeScript,40359,1624,234,2161,False,True,True,True,🧙‍♀️  Move Fast and Break Nothing. End-to-end typesafe APIs made easy. 
wrk,wg,C,40326,3031,204,5202,False,False,True,True,Modern HTTP benchmarking tool
faiss,facebookresearch,C++,40322,4424,280,3417,True,True,True,True,A library for efficient similarity search and clustering of dense vectors.
Awesome-Design-Tools,goabstract,JavaScript,40293,2277,160,2682,False,False,True,True,The best design tools and plugins for everything 👉
tidb,pingcap,Go,40173,6195,6349,3938,True,True,True,True,"TiDB is built for agentic workloads that grow unpredictably, with ACID guarantees and native support for transactions, analytics, and vector search. No data silos. No noisy neighbors. No infrastructure ceiling."
php-src,php,C,40155,8071,1859,5481,False,True,True,True,The PHP Interpreter
headscale,juanfont,Go,40140,2196,115,2187,True,True,True,True,"An open source, self-hosted implementation of the Tailscale control server"
appsmith,appsmithorg,TypeScript,40070,4611,4464,2179,True,True,True,True,"Platform to build admin panels, internal tools, and dashboards. Integrates with 25+ databases and any API."
bert,google-research,Python,40032,9701,880,2792,False,True,False,True,TensorFlow code and pre-trained models for BERT
awesome-cursorrules,PatrickJS,JavaScript,40024,3420,21,639,True,True,True,True,📄  Configuration files that enhance Cursor AI editor experience with custom rules and behaviors
esbuild,evanw,Go,39937,1313,616,3655,False,False,True,True,An extremely fast bundler for the web
fiber,gofiber,Go,39857,1995,49,2345,True,True,True,True,⚡️ Express inspired web framework written in Go
photoprism,photoprism,Go,39824,2296,461,3063,True,True,True,True,AI-Powered Photos App for the Decentralized Web 🌈💎✨
gorm,go-gorm,Go,39804,4154,534,4618,True,False,True,True,"The fantastic ORM library for Golang, aims to be developer friendly"
phaser,phaserjs,JavaScript,39804,7141,113,4814,True,True,True,True,"Phaser is a fun, free and fast 2D game framework for making HTML5 games for desktop and mobile web browsers, supporting Canvas and WebGL rendering."
video.js,videojs,JavaScript,39801,7494,667,5878,True,True,True,True,Video.js - open source HTML5 video player
nushell,nushell,Rust,39753,2160,1444,2595,True,True,True,True,A new type of shell
stats,exelban,Swift,39737,1382,17,2576,False,False,True,True,macOS system monitor in your menu bar
Xray-core,XTLS,Go,39663,5497,54,2046,True,False,True,True,"Xray, Penetrates Everything. Also the best v2ray-core. Where the magic happens. An open platform for various uses."
gkd,gkd-kit,Kotlin,39593,1879,7,1080,False,False,True,True,"基于无障碍，高级选择器，订阅规则的自定义屏幕点击安卓应用 | An Android APP with custom screen tapping based on Accessibility, Advanced Selectors, and Subscription Rules"
shellcheck,koalaman,Haskell,39583,1926,1231,4961,False,False,True,True,"ShellCheck, a static analysis tool for shell scripts"
Deep-Learning-Papers-Reading-Roadmap,floodsung,Python,39524,7292,91,3533,False,False,False,True,Deep Learning papers reading roadmap for anyone who are eager to learn this amazing tech!
yazi,sxyazi,Rust,39512,902,72,1075,True,True,True,True,"💥 Blazing fast terminal file manager written in Rust, based on async I/O."
FastChat,lm-sys,Python,39477,4790,1015,1187,False,False,True,True,"An open platform for training, serving, and evaluating large language models. Release repo for Vicuna and Chatbot Arena."
ChatTTS,2noise,Python,39470,4248,61,751,False,False,True,True,A generative speech model for daily dialogue.
LibreChat,danny-avila,TypeScript,39383,8080,513,1222,True,True,True,True,"Enhanced ChatGPT Clone: Features Agents, MCP, Skills, DeepSeek, Anthropic, AWS, OpenAI, Responses API, Azure, Groq, o1, GPT-5, Mistral, OpenRouter, Vertex AI, Gemini, Artifacts, AI model switching, message search, Code Interpreter, langchain, DALL-E-3, OpenAPI Actions, Functions, Secure Multi-User Auth, Presets, open-source for self-hosting. Active"
styleguide,google,HTML,39374,12968,170,4046,True,True,True,True,Style guides for Google-originated open-source projects
it-tools,CorentinTh,Vue,39367,5043,805,2264,False,False,True,True,"Collection of handy online tools for developers, with great UX. "
sniffnet,GyulyVGC,Rust,39352,1669,59,1417,True,True,True,True,Comfortably monitor your Internet traffic 🕵️‍♂️
BitNet,microsoft,Python,39334,3595,319,681,True,False,True,True,Official inference framework for 1-bit LLMs
minds,mindsdb,Makefile,39318,6207,0,2876,True,True,True,True,"General-purpose AI designed for knowledge workers — creators, strategists, and operators — and individuals seeking AI systems they can truly control to help them get work done, with full flexibility to extend and deploy anywhere (VPC, on-prem, or cloud)."
impeccable,pbakaus,JavaScript,39304,2167,37,214,False,False,True,True,The design language that makes your AI harness better at design.
new-api,QuantumNous,Go,39265,8937,833,950,True,False,True,True,"A unified AI model hub for aggregation & distribution. It supports cross-converting various LLMs into OpenAI-compatible, Claude-compatible, or Gemini-compatible formats. A centralized gateway for personal and enterprise model management. 🍥"
quivr,QuivrHQ,Python,39164,3726,23,1132,False,False,True,True,"Opiniated RAG for integrating GenAI in your apps 🧠   Focus on your product rather than the RAG. Easy integration in existing products with customisation!  Any LLM: GPT4, Groq, Llama. Any Vectorstore: PGVector, Faiss. Any Files. Anyway you want."
bark,suno-ai,Jupyter Notebook,39159,4684,269,1167,False,False,False,True,🔊 Text-Prompted Generative Audio Model
leveldb,google,C++,39153,8203,395,4312,True,True,True,True,LevelDB is a fast key-value storage library written at Google that provides an ordered mapping from string keys to string values.
novu,novuhq,TypeScript,39143,4334,96,1756,True,True,True,True,The open-source communication infrastructure for agents and products
devdocs,freeCodeCamp,Ruby,39083,2606,236,4619,True,True,True,True,API Documentation Browser
halo,halo-dev,Java,39069,10302,141,3010,True,True,True,True,Halo 是一款强大易用的开源建站工具，从个人博客、知识库，到企业官网、在线商城，Halo 都能助您轻松实现，一站式满足您的多样化建站需求。
manim,ManimCommunity,Python,39053,2917,490,2221,True,True,True,True,A community-maintained Python framework for creating mathematical animations. 
outline,outline,TypeScript,38981,3356,50,3678,True,False,True,True,"The fastest knowledge base for growing teams. Beautiful, realtime collaborative, feature packed, and markdown compatible."
ink,vadimdemedes,TypeScript,38953,1013,27,3293,True,True,True,True,🌈 React for interactive command-line apps
llvm-project,llvm,LLVM,38864,17521,36923,3479,True,True,True,True,The LLVM Project is a collection of modular and reusable compiler and toolchain technologies.
materialize,Dogfalo,JavaScript,38863,4630,793,4296,True,True,True,True,"Materialize, a CSS Framework based on Material Design"
duckdb,duckdb,C++,38836,3333,551,2913,True,True,True,True,DuckDB is an analytical in-process SQL database management system
awesome-system-design-resources,ashishps1,Java,38816,8341,13,967,False,False,False,True,Learn System Design concepts and prepare for interviews using free resources.
polars,pola-rs,Rust,38810,2889,2797,2226,True,True,True,True,"Extremely fast Query Engine for DataFrames, written in Rust"
googletest,google,C++,38724,10797,569,3977,True,True,True,True,GoogleTest - Google Testing and Mocking Framework
NewPipe,TeamNewPipe,Java,38718,3642,1404,3940,False,True,True,True,A libre lightweight streaming front-end for Android.
preact,preactjs,JavaScript,38706,2037,150,3933,True,True,True,True,⚛️ Fast 3kB React alternative with the same modern API. Components & Virtual DOM.
openscreen,siddharthvaddem,TypeScript,38680,2749,49,251,False,True,True,True,"Create stunning demos for free. Open-source, no subscriptions, no watermarks, and free for commercial use. An alternative to Screen Studio."
reactive-resume,amruthpillai,TypeScript,38653,4365,86,2275,False,False,True,True,"A one-of-a-kind resume builder that keeps your privacy in mind. Completely secure, customizable, portable, open-source and free forever. Try it out today!"
CodeWhale,Hmbown,Rust,38604,3320,280,149,True,True,True,True,"Open-source, community-driven agent harness"
lapce,lapce,Rust,38572,1291,888,3053,False,True,True,True,Lightning-fast and Powerful Code Editor written in Rust
Folo,RSSNext,TypeScript,38513,2090,372,801,True,True,True,True,🧡 Folo is the AI RSS Reader
insomnia,Kong,TypeScript,38509,2283,856,3708,True,True,True,True,"The open-source, cross-platform API client for GraphQL, REST, WebSockets, SSE and gRPC. With Cloud, Local and Git storage."
python-cheatsheet,gto76,Python,38501,6709,0,3066,False,False,True,True,Comprehensive Python Cheatsheet
GPT_API_free,chatanywhere,,38481,2651,19,1151,False,False,False,True,Free ChatGPT&DeepSeek API Key，免费ChatGPT&DeepSeek API。免费接入DeepSeek API和GPT4 API，支持 gpt | deepseek | claude | gemini | grok 等排名靠前的常用大模型。
metasploit-framework,rapid7,Ruby,38433,14876,589,5406,True,True,True,True,Metasploit Framework
ant-design-pro,ant-design,TypeScript,38404,8250,46,3218,True,False,True,True,👨🏻‍💻👩🏻‍💻 Use Ant Design like a Pro!
Sunshine,LizardByte,C++,38388,2017,127,1645,True,True,True,True,Self-hosted game stream host for Moonlight.
spacedrive,spacedriveapp,Rust,38335,1296,34,1725,True,True,True,True,"Spacedrive is an open source cross-platform file explorer, powered by a virtual distributed filesystem written in Rust."
container,apple,Swift,38334,1103,341,383,True,True,True,True,"A tool for creating and running Linux containers using lightweight virtual machines on a Mac. It is written in Swift, and optimized for Apple silicon. "
engineering-blogs,kilimchoi,Ruby,38309,2021,148,4022,False,True,True,True,A curated list of engineering blogs
qBittorrent,qbittorrent,C++,38282,4729,2642,5247,False,True,True,True,qBittorrent BitTorrent client
istio,istio,Go,38229,8324,470,3498,False,True,True,True,"Connect, secure, control, and observe services."
cli,httpie,Python,38214,3949,297,5226,True,True,True,True,"🥧 HTTPie CLI  — modern, user-friendly command-line HTTP client for the API era. JSON support, colors, sessions, downloads, plugins & more."
MPAndroidChart,PhilJay,Java,38198,8992,2191,4436,False,True,False,True,"A powerful 🚀 Android chart view / graph view library, supporting line- bar- pie- radar- bubble- and candlestick charts as well as scaling, panning and animations."
