repo_name,organization,language,stars,forks,open_issues,age_days,has_coc,has_contributing,has_workflows,has_readme,description
huginn,huginn,Ruby,48871,4232,695,4752,False,False,True,True,Create agents that monitor and act on your behalf.  Your agents are standing by!
query,TanStack,TypeScript,48812,3730,177,2377,False,True,True,True,"🤖 Powerful asynchronous state management, server-state utilities and data fetching for the web. TS/JS, React Query, Solid Query, Svelte Query and Vue Query."
dayjs,iamkun,JavaScript,48592,2423,1198,2895,False,True,True,True,⏰ Day.js 2kB immutable date-time library alternative to Moment.js with the same modern API
julia,JuliaLang,Julia,48537,5750,4731,5441,True,True,True,True,The Julia Programming Language
RxJava,ReactiveX,Java,48487,7604,21,4813,False,True,True,True,RxJava – Reactive Extensions for the JVM – a library for composing asynchronous and event-based programs using observable sequences for the Java VM.
nanochat,karpathy,Python,48474,6336,81,152,False,False,True,True,The best ChatGPT that $100 can buy.
algorithm-visualizer,algorithm-visualizer,JavaScript,48383,7575,78,3591,True,True,False,True,:fireworks:Interactive Online Platform that Visualizes Algorithms from Code
pandas,pandas-dev,Python,48137,19741,3673,5682,True,True,True,True,"Flexible and powerful data analysis / manipulation library for Python, providing labeled data structures similar to R data.frame objects, statistical functions, and much more"
moment,moment,JavaScript,48043,7023,294,5493,False,True,True,True,"Parse, validate, manipulate, and display dates in javascript."
expo,expo,TypeScript,47949,11370,847,3498,False,True,True,True,"An open-source framework for making universal native apps with React. Expo runs on Android, iOS, and the web."
terraform,hashicorp,Go,47921,10250,1896,4384,True,True,True,True,"Terraform enables you to safely and predictably create, change, and improve infrastructure. It is a source-available tool that codifies APIs into declarative configuration files that can be shared amongst team members, treated as code, edited, reviewed, and versioned."
x64dbg,x64dbg,C++,47892,2682,584,3990,True,True,True,True,An open-source user mode debugger for Windows. Optimized for reverse engineering and malware analysis.
Fooocus,lllyasviel,Python,47862,7816,283,948,False,False,True,True,Focus on prompting and generating
open-source-mac-os-apps,serhii-londar,,47823,2484,34,3054,False,True,True,True,🚀 Awesome list of open source applications for macOS. https://t.me/s/opensourcemacosapps
type-challenges,type-challenges,TypeScript,47821,5224,33106,2060,True,False,True,True,Collection of TypeScript type challenges with online judge
kubernetes-the-hard-way,kelseyhightower,,47724,15557,47,3537,False,True,False,True,Bootstrap Kubernetes the hard way. No scripts.
llama_index,run-llama,Python,47679,7019,269,1229,True,True,True,True,LlamaIndex is the leading document agent and OCR platform
freqtrade,freqtrade,Python,47650,9945,43,3223,False,True,True,True,"Free, open source crypto trading bot"
jadx,skylot,Java,47627,5449,418,4744,True,True,True,True,Dex to Java decompiler
design-patterns-for-humans,kamranahmedse,,47625,5504,17,3313,False,False,False,True,An ultra-simplified explanation to design patterns
htmx,bigskysoftware,JavaScript,47621,1576,661,2161,False,True,True,True,</> htmx - high power tools for HTML
big-list-of-naughty-strings,minimaxir,Python,47607,2162,108,3871,False,False,False,True,The Big List of Naughty Strings is a list of strings which have a high probability of causing issues when used as user-input data.
gogs,gogs,Go,47581,5072,965,4414,False,True,True,True,Gogs is a painless self-hosted Git service
whisper.cpp,ggml-org,C++,47546,5293,1157,1266,False,False,True,True,Port of OpenAI's Whisper model in C/C++
Projects,karan,,47474,10665,117,4636,False,True,False,True,:page_with_curl: A list of practical projects that anyone can solve in any programming language.
awesome-java,akullpp,,47309,7645,15,4266,False,True,True,True,"A curated list of awesome frameworks, libraries and software for the Java programming language."
chinese-independent-developer,1c7,,47092,3985,2,3096,False,False,True,True,👩🏿‍💻👨🏾‍💻👩🏼‍💻👨🏽‍💻👩🏻‍💻中国独立开发者项目列表 -- 分享大家都在做什么
PythonDataScienceHandbook,jakevdp,Jupyter Notebook,47052,18779,230,3503,True,True,False,True,Python Data Science Handbook: full text in Jupyter Notebooks
awesome-react-components,brillout,,47034,3738,33,3550,True,True,True,True,Curated List of React Components & Libraries.
brew,Homebrew,Ruby,47020,11002,20,3660,True,True,True,True,🍺 The missing package manager for macOS (or Linux)
react,typescript-cheatsheets,JavaScript,47006,4298,1,2843,True,True,True,True,Cheatsheets for experienced React developers getting started with TypeScript
v2ray-core,v2ray,Go,46952,8881,8,3844,True,False,True,True,A platform for building proxies to bypass network restrictions.
quill,slab,TypeScript,46951,3628,628,4975,True,True,True,True,Quill is a modern WYSIWYG editor built for compatibility and extensibility
serverless,serverless,JavaScript,46950,5739,1221,3981,True,True,True,True,"⚡ Serverless Framework – Effortlessly build apps that auto-scale, incur zero costs when idle, and require minimal maintenance using AWS Lambda and other managed cloud services."
okhttp,square,Kotlin,46926,9279,94,4982,False,True,True,True,"Square’s meticulous HTTP client for the JVM, Android, and GraalVM."
Made-With-ML,GokuMohandas,Jupyter Notebook,46766,7338,24,2687,False,False,True,True,"Learn how to develop, deploy and iterate on production-grade ML applications."
pixijs,pixijs,TypeScript,46741,4984,315,4800,True,True,True,True,"The HTML5 Creation Engine: Create beautiful digital content with the fastest, most flexible 2D WebGL renderer."
ghostty,ghostty-org,Zig,46731,1937,194,1446,False,True,True,True,"👻 Ghostty is a fast, feature-rich, and cross-platform terminal emulator that uses platform-native UI and GPU acceleration."
Pake,tw93,Rust,46643,9124,0,1247,True,True,True,True,🤱🏻 Turn any webpage into a desktop app with one command.
plane,makeplane,TypeScript,46590,3718,692,1211,True,True,True,True,"🔥🔥🔥 Open-source Jira, Linear, Monday, and ClickUp alternative. Plane is a modern project management platform to manage tasks, sprints, docs, and triage."
OpenCut,OpenCut-app,TypeScript,46569,4821,273,265,True,True,True,True,The open-source CapCut alternative
discourse,discourse,Ruby,46554,8839,148,4810,True,True,True,True,"A platform for community discussion. Free, open, simple."
awesome-design-patterns,DovAmir,,46410,3218,22,2840,False,True,False,True,A curated list of software and architecture related design patterns.
metabase,metabase,Clojure,46405,6303,3982,4058,False,True,True,True,The easy-to-use open source Business Intelligence and Embedded Analytics tool that lets everyone work with data :bar_chart:
ClickHouse,ClickHouse,C++,46333,8183,5483,3572,True,True,True,True,ClickHouse® is a real-time analytics database management system
ruff,astral-sh,Rust,46282,1848,1934,1313,True,True,True,True,"An extremely fast Python linter and code formatter, written in Rust."
text-generation-webui,oobabooga,Python,46247,5898,840,1180,False,False,True,True,"The best local UI for large language models, with easy setup and powerful features. 100% offline."
frontend-dev-bookmarks,dypsilon,,46189,5152,124,4648,False,True,False,True,Manually curated collection of resources for frontend web developers.
30-Days-Of-JavaScript,Asabeneh,JavaScript,46174,10436,367,2273,False,False,False,True,"30 days of JavaScript programming challenge is a step-by-step guide to learn JavaScript programming language in 30 days. This challenge may take more than 100 days,  please just follow your own pace. These videos may help too: https://www.youtube.com/channel/UC7PNRuno1rzYPb1xLa4yktw"
learn-regex,ziishaned,,46156,6213,64,3157,False,False,False,True,Learn regex the easy way
crewAI,crewAIInc,Python,46088,6218,473,870,False,False,True,True,"Framework for orchestrating role-playing, autonomous AI agents. By fostering collaborative intelligence, CrewAI empowers agents to work together seamlessly, tackling complex tasks."
AI-For-Beginners,microsoft,Jupyter Notebook,46062,9411,3,1837,True,False,True,True,"12 Weeks, 24 Lessons, AI for All!"
acme.sh,acmesh-official,Shell,45969,5543,1376,3731,False,False,True,True,A pure Unix shell script ACME client for SSL / TLS certificate automation
MediaCrawler,NanmiCoder,Python,45840,9912,135,1009,False,False,True,True,小红书笔记 | 评论爬虫、抖音视频 | 评论爬虫、快手视频 | 评论爬虫、B 站视频 ｜ 评论爬虫、微博帖子 ｜ 评论爬虫、百度贴吧帖子 ｜ 百度贴吧评论回复爬虫  | 知乎问答文章｜评论爬虫
tldraw,tldraw,TypeScript,45824,3067,316,1770,True,True,True,True,very good whiteboard infinite canvas SDK
monaco-editor,microsoft,JavaScript,45748,4012,827,3567,True,True,True,True,A browser based code editor
GitHubDaily,GitHubDaily,,45621,4579,543,2631,False,False,False,True,"坚持分享 GitHub 上高质量、有趣实用的开源技术教程、开发者工具、编程网站、技术资讯。A list cool, interesting projects of GitHub."
architecture-samples,android,Kotlin,45610,11874,217,3690,False,True,True,True,A collection of samples to discuss and showcase different architectural tools and patterns for Android apps.
prisma,prisma,TypeScript,45524,2108,2515,2459,True,True,True,True,"Next-generation ORM for Node.js & TypeScript | PostgreSQL, MySQL, MariaDB, SQL Server, SQLite, MongoDB and CockroachDB"
awesome-cheatsheets,LeCoupa,JavaScript,45482,6672,133,3048,False,False,False,True,"👩‍💻👨‍💻 Awesome cheatsheets for popular programming languages, frameworks and development tools. They include everything you should know in one single file."
nvm-windows,coreybutler,Go,45453,3765,91,4193,False,True,True,True,A node.js version management utility for Windows. Ironically written in Go.
JeecgBoot,jeecgboot,Java,45397,15839,35,2665,False,False,True,True,【AI低代码平台】“低代码+零代码”双模驱动AI智能平台  AI low-code platform empowers enterprises to quickly develop low-code solutions and build AI applications.  助力企业快速实现低代码开发和构建AI应用！ AI应用平台涵盖：AI应用、AI模型、AI聊天助手、知识库、AI流程编排、MCP和插件，聊天式业务操作等。 强大代码生成器：实现前后端一键生成，无需手写代码! 显著提升效率节省成本，又不失灵活~
jest,jestjs,TypeScript,45328,6639,244,4478,True,True,True,True,Delightful JavaScript Testing.
AdminLTE,ColorlibHQ,CSS,45321,18269,3,4463,True,True,True,True,AdminLTE - Free admin dashboard template based on Bootstrap 5
zx,google,JavaScript,45282,1222,31,1774,True,True,True,True,A tool for writing better scripts
bevy,bevyengine,Rust,45079,4443,3312,2247,True,True,True,True,A refreshingly simple data-driven game engine built in Rust
spotube,KRTirtho,Dart,44957,2009,755,1855,True,False,True,True,🎧 Open source music streaming app! Available for both desktop & mobile!
Rocket.Chat,RocketChat,TypeScript,44888,13392,3553,3952,True,True,True,True,The Secure CommsOS™ for mission-critical operations
slidev,slidevjs,TypeScript,44841,1961,183,1786,True,True,True,True,Presentation Slides for Developers
CppCoreGuidelines,isocpp,CSS,44840,5546,250,3860,False,True,True,True,"The C++ Core Guidelines are a set of tried-and-true guidelines, rules, and best practices about coding in C++"
penpot,penpot,Clojure,44827,2590,578,3728,True,True,True,True,Penpot: The open-source design tool for design and code collaboration
TTS,coqui-ai,Python,44811,6003,8,2124,True,True,True,True,"🐸💬 - a deep learning toolkit for Text-to-Speech, battle-tested in research and production"
legado,gedoor,Kotlin,44788,4951,65,2489,False,False,True,True,"Legado 3.0 Book Reader with powerful controls & full functions❤️阅读3.0, 阅读是一款可以自定义来源阅读网络内容的工具，为广大网络文学爱好者提供一种方便、快捷舒适的试读体验。"
meteor,meteor,JavaScript,44778,5264,371,5169,True,True,True,True,"Meteor, the JavaScript App Platform"
hyper,vercel,TypeScript,44716,3550,1026,3543,False,False,True,True,A terminal built on web technologies
Leaflet,Leaflet,JavaScript,44642,6095,559,5652,True,True,True,True,🍃 JavaScript library for mobile-friendly interactive maps 🇺🇦
airflow,apache,Python,44640,16697,1759,3988,True,True,True,True,"Apache Airflow - A platform to programmatically author, schedule, and monitor workflows"
react-hook-form,react-hook-form,TypeScript,44593,2374,123,2566,True,True,True,True,📋 React Hooks for form state management and validation (Web + React Native)
grpc,grpc,C++,44491,11085,1185,4114,True,True,True,True,"C++ based gRPC (C++, Python, Ruby, Objective-C, PHP, C#)"
edex-ui,GitSquared,JavaScript,44426,3047,6,3332,False,False,True,True,"A cross-platform, customizable science fiction terminal emulator with advanced monitoring & touchscreen support."
pyenv,pyenv,Shell,44418,3243,55,4943,False,True,True,True,Simple Python version management
awesome-compose,docker,HTML,44375,8076,348,2221,False,True,True,True,Awesome Docker Compose samples
reactjs-interview-questions,sudheerj,JavaScript,44360,10301,10,2844,False,False,True,True,List of top 500 ReactJS Interview Questions & Answers....Coding exercise questions are coming soon!!
agency-agents,msitarzewski,Shell,44184,6608,38,152,False,True,True,True,"A complete AI agency at your fingertips - From frontend wizards to Reddit community ninjas, from whimsy injectors to reality checkers. Each agent is a specialized expert with personality, processes, and proven deliverables."
build-web-application-with-golang,astaxie,Go,44151,10537,137,4972,False,False,False,True,A golang ebook intro how to build a web with golang
awesome-claude-skills,ComposioHQ,Python,44130,4445,303,148,False,True,True,True,"A curated list of awesome Claude Skills, resources, and tools for customizing Claude AI workflows"
EasySpider,NaiboWang,JavaScript,44081,5387,264,2066,False,False,True,True,A visual no-code/code-free web crawler/spider易采集：一个可视化浏览器自动化测试/数据采集/爬虫软件，可以无代码图形化的设计和执行爬虫任务。别名：ServiceWrapper面向Web应用的智能化服务封装系统。
iina,iina,Swift,44070,2775,1965,3372,False,True,True,True,The modern video player for macOS.
awesome-remote-job,lukasz-madon,,44056,4494,40,4090,False,True,True,True,A curated list of awesome remote jobs and resources. Inspired by https://github.com/vinta/awesome-python
parcel,parcel-bundler,JavaScript,44047,2276,592,3141,True,True,True,True,The zero configuration build tool for the web. 📦🚀
react-use,streamich,TypeScript,43951,3278,653,2695,False,True,True,True,React Hooks — 👍
upscayl,upscayl,TypeScript,43950,2124,63,1323,False,False,True,True,"🆙 Upscayl - #1 Free and Open Source AI Image Upscaler for Linux, MacOS and Windows."
retrofit,square,HTML,43907,7360,168,5668,False,True,True,True,A type-safe HTTP client for Android and the JVM
front-end-interview-handbook,yangshun,MDX,43904,5952,14,2982,True,True,True,True,Front End interview preparation materials for busy engineers (updated for 2026)
babel,babel,TypeScript,43903,5809,752,4185,True,True,True,True,🐠 Babel is a compiler for writing next generation JavaScript.
streamlit,streamlit,Python,43888,4136,1304,2395,True,True,True,True,Streamlit — A faster way to build and share data apps.
TensorFlow-Examples,aymericdamien,Jupyter Notebook,43799,14795,227,3776,False,False,False,True,TensorFlow Tutorial and Examples for Beginners (support TF v1 & v2)
Summer2026-Internships,SimplifyJobs,Python,43772,3174,5,2121,False,True,True,True,Collection of Summer 2026 tech internships!
LocalAI,mudler,Go,43620,3696,148,1092,False,True,True,True,":robot: The free, Open Source alternative to OpenAI, Claude and others. Self-hosted and local-first. Drop-in replacement,  running on consumer-grade hardware. No GPU required. Runs gguf, transformers, diffusers and many more. Features: Generate Text, MCP, Audio, Video, Images, Voice Cloning, Distributed, P2P and decentralized inference"
copyparty,9001,Python,43462,1768,244,2484,True,True,False,True,"Portable file server with accelerated resumable uploads, dedup, WebDAV, SFTP, FTP, TFTP, zeroconf, media indexer, thumbnails++ all in one file"
TrafficMonitor,zhongyang219,C++,43447,3615,1265,3150,False,False,True,True,这是一个用于显示当前网速、CPU及内存利用率的桌面悬浮窗软件，并支持任务栏显示，支持更换皮肤。
helix,helix-editor,Rust,43443,3361,1431,2113,False,True,True,True,A post-modern modal text editor.
cobra,spf13,Go,43436,3080,358,4575,False,True,True,True,A Commander for modern Go CLI interactions
jsoncrack.com,AykutSarac,TypeScript,43428,3487,42,1504,True,True,True,True,"✨ Innovative and open-source visualization application that transforms various data formats, such as JSON, YAML, XML and CSV into interactive graphs."
fuels-rs,FuelLabs,Rust,43372,1362,68,1595,False,False,True,True,Fuel Network Rust SDK
sentry,getsentry,Python,43362,4631,2260,5675,True,True,True,True,Developer-first error tracking and performance monitoring
fuels-ts,FuelLabs,TypeScript,43325,1369,79,1653,True,True,True,True,Fuel Network Typescript SDK
milvus,milvus-io,Go,43296,3902,1038,2371,True,True,True,True,"Milvus is a high-performance, cloud-native vector database built for scalable vector ANN search"
cli,cli,Go,43110,8083,930,2354,True,True,True,True,GitHub’s official command line tool
tmux,tmux,C,43011,2479,46,3937,False,True,True,True,tmux source code
pm2,Unitech,JavaScript,42986,2693,1093,4681,False,True,True,True,Node.js Production Process Manager with a built-in Load Balancer.
spark,apache,Scala,42981,29125,300,4400,True,True,True,True,Apache Spark - A unified analytics engine for large-scale data processing
CPlusPlusThings,Light-City,C++,42969,8830,8,2435,False,False,False,True,C++那些事
kong,Kong,Lua,42956,5096,135,4135,True,True,True,True,🦍 The API and AI Gateway
what-happens-when,alex,,42817,5721,2071,4511,False,False,False,True,"An attempt to answer the age old interview question ""What happens when you type google.com into your browser and press enter?"""
zig,ziglang,Zig,42813,3082,3442,3874,False,False,False,True,Moved to Codeberg
python-patterns,faif,Python,42798,7047,13,5029,False,False,True,True,A collection of design patterns/idioms in Python
mitmproxy,mitmproxy,Python,42666,4484,418,5871,True,True,True,True,An interactive TLS-capable intercepting HTTP proxy for penetration testers and software developers.
RSSHub,DIYgod,TypeScript,42650,9408,373,2903,True,True,True,True,🧡 Everything is RSSible
exo,exo-explore,Python,42608,2928,160,628,False,True,True,True,Run frontier AI locally.
pandoc,jgm,Haskell,42599,3785,1050,5838,False,True,True,True,Universal markup converter
Umi-OCR,hiroi-sora,Python,42582,4204,327,1448,False,False,False,True,"OCR software, free and offline. 开源、免费的离线OCR软件。支持截屏/批量导入图片，PDF文档识别，排除水印/页眉页脚，扫描/生成二维码。内置多国语言库。"
fanqiang,bannedbook,Kotlin,42575,7586,329,4078,False,False,True,True,翻墙-科学上网
git-flight-rules,k88hudson,,42479,3192,16,4253,False,False,False,True,Flight rules for git
Files,files-community,C#,42409,2634,519,2626,True,True,True,True,A modern file manager that helps users organize their files and folders.
Alamofire,Alamofire,Swift,42363,7658,41,4244,False,True,True,True,Elegant HTTP Networking in Swift
chatgpt-on-wechat,zhayujie,Python,42209,9826,354,1315,False,False,True,True,CowAgent是基于大模型的超级AI助理，能主动思考和任务规划、访问操作系统和外部资源、创造和执行Skills、拥有长期记忆并不断成长。同时支持飞书、钉钉、企业微信应用、微信公众号、网页等接入，可选择OpenAI/Claude/Gemini/DeepSeek/ Qwen/GLM/Kimi/LinkAI，能处理文本、语音、图片和文件，可快速搭建个人AI助手和企业数字员工。
ailearning,apachecn,Python,42126,11602,3,3304,False,False,False,True,AiLearning：数据分析+机器学习实战+线性代数+PyTorch+NLTK+TF2
zod,colinhacks,TypeScript,42114,1851,284,2198,True,True,True,True,TypeScript-first schema validation with static type inference
diagrams,mingrammer,Python,42074,2722,383,2232,False,True,True,True,:art: Diagram as Code for prototyping cloud system architectures
system-design,karanpratapsingh,,42058,5337,3,1307,True,True,False,True,Learn how to design systems at scale and prepare for system design interviews
full-stack-fastapi-template,fastapi,TypeScript,42050,8218,15,2576,False,True,True,True,"Full stack, modern web application template. Using FastAPI, React, SQLModel, PostgreSQL, Docker, GitHub Actions, automatic HTTPS and more."
fd,sharkdp,Rust,42039,1004,172,3231,False,True,True,True,"A simple, fast and user-friendly alternative to 'find'"
gradio,gradio-app,Python,42020,3322,448,2642,True,True,True,True,"Build and share delightful machine learning apps, all in Python. 🌟 Star to support our work!"
aider,Aider-AI,Python,41948,4016,1430,1040,False,True,True,True,aider is AI pair programming in your terminal
siyuan,siyuan-note,TypeScript,41860,2607,350,2022,True,True,True,True,"A privacy-first, self-hosted, fully open source personal knowledge management software, written in typescript and golang."
swiper,nolimits4web,JavaScript,41814,9710,249,5113,True,True,True,True,Most modern mobile touch slider with hardware accelerated transitions
DeepSpeed,deepspeedai,Python,41810,4751,1277,2242,True,True,True,True,"DeepSpeed is a deep learning optimization library that makes distributed training and inference easy, efficient, and effective."
Win11Debloat,Raphire,PowerShell,41807,1643,30,1964,False,True,True,True,"A simple, lightweight PowerShell script that allows you to remove pre-installed apps, disable telemetry, as well as perform various other changes to declutter and customize your Windows experience. Win11Debloat works for both Windows 10 and Windows 11."
bruno,usebruno,JavaScript,41794,2199,1792,1264,False,True,True,True,Opensource IDE For Exploring and Testing API's (lightweight alternative to Postman/Insomnia)
ray,ray-project,Python,41719,7339,3472,3427,False,True,True,True,Ray is an AI compute engine. Ray consists of a core distributed runtime and a set of AI Libraries for accelerating ML workloads.
English-level-up-tips,byoungd,,41718,4404,29,3210,False,False,True,True,An advanced guide to learn English which might benefit you a lot 🎉 .  离谱的英语学习指南/英语学习教程/英语学习/学英语
dubbo,apache,Java,41712,26542,932,5016,True,True,True,True,The java implementation of Apache Dubbo. An RPC and microservice framework.
nw.js,nwjs,JavaScript,41573,3869,961,5183,False,False,False,True,Call all Node.js modules directly from DOM/WebWorker and enable a new way of writing applications with all Web technologies.
yarn,yarnpkg,JavaScript,41530,2731,2063,3707,True,True,True,True,The 1.x line is frozen - features and bugfixes now happen on https://github.com/yarnpkg/berry
logseq,logseq,Clojure,41512,2495,1014,2122,True,True,True,True,"A privacy-first, open-source platform for knowledge management and collaboration. Download link:  http://github.com/logseq/logseq/releases. roadmap: https://discuss.logseq.com/t/logseq-product-roadmap/34267"
ui-ux-pro-max-skill,nextlevelbuilder,Python,41510,4025,70,104,False,False,True,True,An AI SKILL that provide design intelligence for building professional UI/UX multiple platforms
cherry-studio,CherryHQ,TypeScript,41503,3839,665,660,True,True,True,True,"AI productivity studio with smart chat, autonomous agents, and 300+ assistants. Unified access to frontier LLMs"
uni-app,dcloudio,JavaScript,41448,3720,717,2802,False,True,True,True,A cross-platform framework using Vue.js
black,psf,Python,41430,2735,324,2922,True,True,True,True,The uncompromising Python code formatter
pure-bash-bible,dylanaraps,Shell,41425,3635,62,2832,False,True,False,True,📖 A collection of pure bash alternatives to external processes.
ColossalAI,hpcaitech,Python,41364,4526,492,1598,False,True,True,True,"Making large AI models cheaper, faster and more accessible"
ccxt,ccxt,Python,41331,8545,1366,3226,False,True,True,True,A cryptocurrency trading API with more than 100 exchanges in JavaScript / TypeScript / Python / C# / PHP / Go 
hyperswitch,juspay,Rust,41317,4576,1420,1244,True,True,True,True,"An open source payments switch written in Rust to make payments fast, reliable and affordable"
hexo,hexojs,TypeScript,41304,5034,103,4920,True,True,True,True,"A fast, simple & powerful blog framework, powered by Node.js."
minimind,jingyaogong,Python,41229,4989,38,596,True,False,True,True,🚀🚀 「大模型」2小时完全从0训练26M的小参数GPT！🌏 Train a 26M-parameter GPT from scratch in just 2h!
ChatGLM-6B,zai-org,Python,41223,5204,605,1097,False,False,False,True,ChatGLM-6B: An Open Bilingual Dialogue Language Model | 开源双语对话语言模型
payload,payloadcms,TypeScript,41192,3469,761,1894,False,True,True,True,"Payload is the open-source, fullstack Next.js framework, giving you instant backend superpowers. Get a full TypeScript backend and admin panel instantly. Use Payload as a headless CMS or for building powerful applications."
fastlane,fastlane,Ruby,41179,5981,876,4120,True,True,True,True,🚀 The easiest way to automate building and releasing your iOS and Android apps
