repo_name,organization,language,stars,forks,open_issues,age_days,has_coc,has_contributing,has_workflows,has_readme,description
rtk,rtk-ai,Rust,72902,4550,1715,182,False,True,True,True,"CLI proxy that reduces LLM token consumption by 60-90% on common dev commands. Single Rust binary, zero dependencies"
strapi,strapi,TypeScript,72713,9807,478,3949,True,True,True,True,"🚀 Strapi is the leading open-source headless CMS. It’s 100% JavaScript/TypeScript, fully customizable, and developer-first."
awesome-scalability,binhnguyennus,,72646,7048,26,3131,True,True,True,True,"The Patterns of Scalable, Reliable, and Performant Large-Scale Systems"
awesome-cpp,fffaraz,,72398,8320,312,4389,False,True,True,True,"A curated list of awesome C++ (or C) frameworks, libraries, resources, and shiny things. Inspired by awesome-... stuff."
SecLists,danielmiessler,PHP,72373,25074,9,5269,False,True,True,True,"SecLists is the security tester's companion. It's a collection of multiple types of lists used during security assessments, collected in one place. List types include usernames, passwords, URLs, sensitive data patterns, fuzzing payloads, web shells, and many more."
daytona,daytonaio,,72175,5669,443,898,False,False,True,True,Daytona is a Secure and Elastic Infrastructure for Running AI-Generated Code
learn-claude-code,shareAI-lab,Python,72095,11687,71,389,False,True,True,True,"Bash is all you need -  A nano claude code–like 「agent harness」, built from 0 to 1"
reveal.js,hakimel,JavaScript,72007,16966,910,5525,False,True,True,True,The HTML Presentation Framework
flask,pallets,Python,71998,16913,10,5952,True,True,True,True,The Python micro framework for building web applications.
worldmonitor,koala73,TypeScript,71992,10833,261,196,True,True,True,True,"Real-time global intelligence dashboard. AI-powered news aggregation, geopolitical monitoring, and infrastructure tracking in a unified situational awareness interface"
moby,moby,Go,71893,19044,3841,4934,False,True,True,True,The Moby Project - a collaborative project for the container ecosystem to assemble container-based systems
protobuf,protocolbuffers,C++,71621,16200,313,4349,True,True,True,True,Protocol Buffers - Google's data interchange format
anime,juliangarnier,JavaScript,71400,4795,112,3784,False,True,True,True,JavaScript animation engine
ghidra,NationalSecurityAgency,Java,71278,7817,1873,2702,False,True,True,True,Ghidra is a software reverse engineering (SRE) framework
act,nektos,Go,71193,1980,346,2759,False,True,True,True,Run your GitHub Actions locally 🚀
Apollo-11,chrislgarry,Assembly,71172,7924,131,4494,False,True,True,True,Original Apollo 11 Guidance Computer (AGC) source code for the command and lunar modules.
gpt_academic,binary-husky,Python,71126,8336,328,1221,False,False,True,True,"为GPT/GLM等LLM大语言模型提供实用化交互接口，特别优化论文阅读/润色/写作体验，模块化设计，支持自定义快捷按钮&函数插件，支持Python和C++等项目剖析&自译解功能，PDF/LaTex论文翻译&总结功能，支持并行问询多种LLM模型，支持chatglm3等本地模型。接入通义千问, deepseekcoder, 讯飞星火, 文心一言, llama2, rwkv, claude2, moss等。"
Scrapling,D4Vinci,Python,71030,7048,6,648,True,True,True,True,🕷️ An adaptive Web Scraping framework that handles everything from a single request to a full-scale crawl!
OpenBB,OpenBB-finance,Python,70949,7215,79,2041,True,False,True,True,"Open Data Platform for analysts, quants and AI agents."
AFFiNE,toeverything,TypeScript,70740,5089,684,1453,True,True,True,True,"There can be more than Notion and Miro. AFFiNE(pronounced [ə‘fain]) is a next-gen knowledge base that brings planning, sorting and creating all together. Privacy first, open-source, customizable and ready to use. "
ai-agents-for-beginners,microsoft,Jupyter Notebook,70202,23249,6,602,True,False,True,True,18 Lessons to Get Started Building AI Agents
swift,swiftlang,Swift,70187,10772,9115,3926,True,True,True,True,The Swift Programming Language
awesome-courses,prakhar1989,,69917,8387,65,4268,False,True,False,True,:books: List of awesome university courses for learning Computer Science!
ansible,ansible,Python,69669,24186,814,5252,True,True,True,True,"Ansible is a radically simple IT automation platform that makes your applications and systems easier to deploy and maintain. Automate everything from code deployment to network configuration to cloud management, in a language that approaches plain English, using SSH, with no agents to install on remote systems. https://docs.ansible.com."
awesome-claude-skills,ComposioHQ,Python,69557,7863,1083,279,False,True,True,True,"A curated list of awesome Claude Skills, resources, and tools for customizing Claude AI workflows"
MetaGPT,FoundationAgents,Python,69494,8865,144,1119,False,False,True,True,"🌟 The Multi-Agent Framework: First AI Software Company, Towards Natural Language Programming"
express,expressjs,JavaScript,69233,24309,224,6236,True,True,True,True,"Fast, unopinionated, minimalist web framework for node."
MiroFish,666ghj,Python,69186,10807,104,240,False,False,True,True,"A Simple and Universal Swarm Intelligence Engine, Predicting Anything. 简洁通用的群体智能引擎，预测万物"
30-Days-Of-Python,Asabeneh,Python,68935,12784,180,2438,False,False,True,True,The 30 Days of Python programming challenge is a step-by-step guide to learn the Python programming language in 30 days. This challenge may take more than 100 days. Follow your own pace. These videos may help too: https://www.youtube.com/channel/UC7PNRuno1rzYPb1xLa4yktw
unsloth,unslothai,Python,68808,6190,978,967,True,True,True,True,"Unsloth is a local UI for training and running Gemma 4, Qwen3.6, DeepSeek, Kimi, GLM and other models."
node,base,Shell,68474,3251,9,1268,False,True,True,True,Everything required to run your own Base node
hello-agents,datawhalechina,Python,68271,8492,154,319,False,False,True,True,📚 《从零开始构建智能体》——从零开始的智能体原理与实践教程
Chart.js,chartjs,JavaScript,67601,11946,574,4876,False,False,True,True,Simple HTML5 Charts using the <canvas> tag
annotated_deep_learning_paper_implementations,labmlai,Python,67213,6749,34,2159,False,False,True,True,"🧑‍🏫 60+ Implementations/tutorials of deep learning papers with side-by-side notes 📝; including transformers (original, xl, switch, feedback, vit, ...), optimizers (adam, adabelief, sophia, ...), gans(cyclegan, stylegan2, ...), 🎮 reinforcement learning (ppo, dqn), capsnet, distillation, ... 🧠"
openinterpreter,openinterpreter,Rust,67211,5769,292,1105,False,True,True,True,A coding agent for open models like Kimi K3
taste-skill,Leonxlnx,JavaScript,66948,4607,51,154,False,False,True,True,"Taste-Skill - gives your AI good taste. stops the AI from generating boring, generic slop "
echarts,apache,TypeScript,66890,19812,1591,4860,True,True,True,True,"Apache ECharts is a powerful, interactive charting and data visualization library for browser"
scikit-learn,scikit-learn,Python,66767,27209,2115,5819,True,True,True,True,scikit-learn: machine learning in Python
33-js-concepts,leonardomso,JavaScript,66502,9154,2,2879,True,True,True,True,📜 33 JavaScript concepts every developer should know.
design-resources-for-developers,bradtraversy,,66487,12119,62,2269,False,True,True,True,"Curated list of design and UI resources from stock photos, web templates, CSS frameworks, UI libraries, tools and much more"
gpt4free,xtekky,Python,66485,13529,7,1212,True,True,True,True,The official gpt4free repository | various collection of powerful language models | opus 4.6 gpt 5.3 kimi 2.5 deepseek v3.2 gemini 3
oh-my-openagent,code-yeongyu,TypeScript,66483,5420,903,233,False,True,True,True,"omo/lazycodex: The coding agent for tokenmaxxers;the one and only agent harness for complex codebases. For your Codex, for your OpenCode"
ripgrep,BurntSushi,Rust,66475,2658,164,3787,False,True,True,True,ripgrep recursively searches directories for a regex pattern while respecting your gitignore
uBlock,gorhill,JavaScript,66461,4238,20,4131,False,True,True,True,uBlock Origin - An efficient blocker for Chromium and Firefox. Fast and lean.
awesome-nodejs,sindresorhus,,66338,6234,26,4395,True,True,True,True,":zap: Delightful Node.js packages and resources [BECAUSE OF TOO MUCH SPAM AND LOW-QUALITY SUBMISSIONS, SUBMISSIONS ARE PAUSED UNTIL JULY]"
Java,TheAlgorithms,Java,66044,21229,26,3659,True,True,True,True,All Algorithms implemented in Java
webpack,webpack,JavaScript,65845,9415,141,5248,True,True,True,True,"A bundler for javascript and friends. Packs many modules into a few bundled assets. Code Splitting allows for loading parts of the application on demand. Through ""loaders"", modules can be CommonJs, AMD, ES6 modules, CSS, Images, JSON, Coffeescript, LESS, ... and your custom stuff."
ruflo,ruvnet,TypeScript,65736,7809,819,416,False,True,True,True,"🌊 The leading agent meta-harness. Deploy intelligent multi-player swarms, coordinate autonomous workflows, and build conversational AI systems. Features adaptive memory, self-learning intelligence, RAG integration, and native Claude Code / Codex / Hermes and many more Integrated"
docusaurus,facebook,TypeScript,65721,9977,386,3320,True,True,True,True,Easy to maintain open source documentation websites.
nocode,kelseyhightower,Dockerfile,65548,4822,4715,3089,False,True,False,True,The best way to write secure and reliable applications. Write nothing; deploy nowhere.
javascript-questions,lydiahallie,,65307,9205,53,2598,False,False,False,True,"A long list of (advanced) JavaScript questions, and their explanations :sparkles:  "
prometheus,prometheus,Go,65277,10678,881,4989,True,True,True,True,The Prometheus monitoring system and time series database.
localstack,localstack,Python,65152,4772,0,3558,True,True,True,True,💻 A fully functional local AWS cloud stack. Develop and test your cloud & Serverless apps offline
interviews,kdn251,Java,65056,12878,121,3446,False,False,False,True,Everything you need to know to get the job.
alacritty,alacritty,Rust,65034,3524,335,3809,False,True,True,True,"A cross-platform, OpenGL terminal emulator."
cline,cline,TypeScript,64991,6975,1117,747,True,True,True,True,"Autonomous coding agent as an SDK, IDE extension, or CLI assistant."
get-shit-done,gsd-build,JavaScript,64781,5479,0,221,False,True,True,True,"A light-weight and powerful meta-prompting, context engineering and spec-driven development system for Claude Code by TÂCHES."
ladybird,LadybirdBrowser,C++,64659,3089,521,784,True,True,True,True,Truly independent web browser
nocodb,nocodb,TypeScript,64258,4951,683,3189,True,True,True,True,🔥 🔥 🔥 A Free & Self-hostable Airtable Alternative
keras,keras-team,Python,64175,19744,211,4136,False,True,True,True,Deep Learning for humans
vaultwarden,dani-garcia,Rust,64134,3026,67,3078,False,False,True,True,"Unofficial Bitwarden compatible server written in Rust, formerly known as bitwarden_rs"
traefik,traefik,Go,64086,6087,863,3966,True,True,True,True,The Cloud Native Application Proxy
nerd-fonts,ryanoasis,CSS,63815,3930,39,4249,True,True,True,True,"Iconic font aggregator, collection, & patcher. 3,600+ icons, 50+ patched fonts: Hack, Source Code Pro, more. Glyph collections: Font Awesome, Material Design Icons, Octicons, & more"
anything-llm,Mintplex-Labs,JavaScript,63759,6982,336,1146,False,True,True,True,Stop renting your intelligence. Own it with AnythingLLM. Everything you need for a powerful local-first agent experience 
docling,docling-project,Python,63701,4514,936,744,True,True,True,True,Get your documents ready for gen AI
warp,warpdotdev,Rust,63608,5321,4688,1841,True,True,True,True,"Warp is an agentic development environment, born out of the terminal."
rustlings,rust-lang,Rust,63604,11231,40,3965,False,True,True,True,:crab: Small exercises to get you used to reading and writing Rust code!
claude-code-best-practice,shanraisshan,HTML,63399,6327,17,265,False,False,True,True,from vibe coding to agentic engineering - practice makes claude perfect
scrapy,scrapy,Python,63373,11815,578,5996,True,True,True,True,"Scrapy, a fast high-level web crawling & scraping framework for Python."
openpilot,commaai,Python,63198,11185,139,3529,False,True,True,True,"openpilot is an operating system for robotics. Currently, it upgrades the driver assistance system on 300+ supported cars."
tldr,tldr-pages,Markdown,63195,5345,314,4610,False,True,True,True,Collaborative cheatsheets for console commands 📚.
socket.io,socketio,TypeScript,63162,10197,185,5978,False,True,True,True,Bidirectional and low-latency communication for every platform
resume.github.com,resume,JavaScript,62877,1369,76,5646,False,False,False,True,Resumes generated using the GitHub informations
pathway,pathwaycom,Python,62580,1668,36,1334,True,True,True,True,"Python ETL framework for stream processing, real-time analytics, LLM pipelines, and RAG."
ai-hedge-fund,virattt,Python,62387,10982,160,601,False,False,True,True,An AI Hedge Fund Team
OpenSpec,Fission-AI,TypeScript,62358,4316,372,352,False,False,True,True,Spec-driven development (SDD) for AI coding assistants.
FFmpeg,FFmpeg,C,62346,14051,3,5579,False,True,False,True,Mirror of https://git.ffmpeg.org/ffmpeg.git
drawio-desktop,jgraph,JavaScript,62262,5731,6,3346,True,False,True,True,Official electron build of draw.io
git,git,C,62171,28172,373,6574,True,True,True,True,Git Source Code Mirror - This is a publish-only repository but pull requests can be turned into patches to the mailing list via GitGitGadget (https://gitgitgadget.github.io/). Please follow Documentation/SubmittingPatches procedure for any of your improvements.
codegraph,colbymchenry,C,62049,3888,349,186,False,False,True,True,"Pre-indexed code knowledge graph, auto syncs on code changes, for Claude Code, Codex, Gemini, Cursor, OpenCode, AntiGravity, Kiro, and Hermes Agent — fewer tokens, fewer tool calls, 100% local"
leetcode-master,youngyangyang04,Shell,62008,12313,249,2413,False,False,False,True,《代码随想录》LeetCode 刷题攻略：200道经典题目刷题顺序，共60w字的详细图解，视频难点剖析，50余张思维导图，支持C++，Java，Python，Go，JavaScript等多语言版本，从此算法学习不再迷茫！🔥🔥 来看看，你会发现相见恨晚！🚀 
headroom,headroomlabs-ai,Python,61916,4666,512,197,True,True,True,True,"Compress tool outputs, logs, files, and RAG chunks before they reach the LLM. 20% fewer tokens for coding agents, 60-95% fewer tokens for JSON, same answers. Library, proxy, MCP server."
Magisk,topjohnwu,Kotlin,61866,18062,73,3605,False,False,True,True,The Magic Mask for Android
odysseus,odysseus-dev,Python,61780,23,909,53,False,True,True,True,Self-hosted AI workspace. 
memos,usememos,Go,61750,4587,20,1688,False,False,True,True,"Open-source, self-hosted note-taking tool built for quick capture. Markdown-native, lightweight, and fully yours."
mem0,mem0ai,TypeScript,61576,7174,679,1129,False,True,True,True,Universal memory layer for AI Agents
sway,FuelLabs,Rust,61557,5416,923,2011,False,False,True,True,🌴 Empowering everyone to build reliable and efficient smart contracts.
redux,reduxjs,TypeScript,61508,15102,49,4073,True,True,True,True,A JS library for predictable global state management
nanoGPT,karpathy,Python,61464,10575,350,1304,False,False,False,True,"The simplest, fastest repository for training/finetuning medium-sized GPTs."
minio,minio,Go,61384,7681,80,4208,True,True,True,True,"MinIO is a high-performance, S3 compatible object store, open sourced under GNU AGPLv3 license."
career-ops,santifer,JavaScript,61266,12067,253,110,True,True,True,True,"Open-source AI job search: scan job portals, evaluate listings with a structured A-F rubric into a 1.0-5.0 score, tailor your CV, track applications — runs locally in your AI coding CLI (Claude Code, Codex, OpenCode, Antigravity…)"
astro,withastro,TypeScript,61259,3655,136,1956,True,True,True,True,The web framework for content-driven websites. ⭐️ Star to support our work!
lodash,lodash,JavaScript,61241,7184,97,5221,False,True,True,True,"A modern JavaScript utility library delivering modularity, performance, & extras."
awesome-chatgpt-prompts-zh,PlexPt,,61122,13552,45,1320,False,False,False,True,ChatGPT 中文调教指南。各种场景使用指南。学习怎么让它听你的话。
Front-end-Developer-Interview-Questions,h5bp,Nunjucks,60877,11012,62,5278,True,True,True,True,"A list of helpful front-end related questions you can use to interview potential candidates, test yourself or completely ignore."
architect-awesome,xingshaocheng,,60843,17663,63,3030,False,False,False,True,后端架构师技术图谱
TrendRadar,sansan0,Python,60840,24806,50,451,False,False,True,True,"⭐AI-driven public opinion & trend monitor with multi-platform aggregation, RSS, and smart alerts.🎯 告别信息过载，你的 AI 舆情监控助手与热点筛选工具！聚合多平台热点 +  RSS 订阅，支持关键词精准筛选。AI 智能筛选新闻 + AI 翻译 +  AI 分析简报直推手机，也支持接入 MCP 架构，赋能 AI 自然语言对话分析、情感洞察与趋势预测等。支持 Docker ，数据本地/云端自持。集成微信/飞书/钉钉/Telegram/邮件/ntfy/bark/slack 等渠道智能推送。"
atom,atom,JavaScript,60806,17170,994,5298,True,True,False,True,:atom: The hackable text editor
awesome-flutter,Solido,Dart,60702,6904,33,3364,False,True,True,True,"An awesome list that curates the best Flutter libraries, tools, tutorials, articles and more."
nuxt,nuxt,TypeScript,60674,5751,549,3557,True,True,True,True,the full-stack Vue framework
Agent-Reach,Panniantong,Python,60285,4846,171,150,False,True,True,True,"Give your AI agent eyes to see the entire internet. Read & search Twitter, Reddit, YouTube, GitHub, Bilibili, XiaoHongShu — one CLI, zero API fees."
markdown-here,adam-p,JavaScript,60235,11036,318,5185,False,True,False,True,"Google Chrome, Firefox, and Thunderbird extension that lets you write email in Markdown and render it before sending."
pocketbase,pocketbase,Go,60189,3582,19,1479,False,True,True,True,Open Source realtime backend in 1 file
Pake,tw93,Rust,60163,12184,5,1378,True,True,True,True,🤱🏻 Turn any webpage into a desktop app with one command.
spring-framework,spring-projects,Java,60136,38816,516,5707,True,True,True,True,Spring Framework
system_prompts_leaks,asgeirtj,JavaScript,60105,9793,41,447,False,True,True,True,"Extracted system prompts from Anthropic - Claude Fable 5, Opus 4.8, Claude Code, Claude Design. OpenAI - ChatGPT GPT-5.6, Codex GPT-5.6, GPT-5.5. Google - Gemini 3.5 Flash, 3.1 Pro, Antigravity. xAI - Grok, Cursor, Copilot, VS Code, Perplexity, and more. Updated regularly."
GPT-SoVITS,RVC-Boss,Python,60061,6543,874,921,False,False,True,True,1 min voice data can also be used to train a good TTS model! (few shot voice cloning)
Real-Time-Voice-Cloning,CorentinJ,Python,60056,9404,175,2615,False,False,True,True,Clone a voice in 5 seconds to generate arbitrary speech in real-time
pi-hole,pi-hole,Shell,60016,3257,34,4428,True,True,True,True,A black hole for Internet advertisements
v2rayNG,2dust,Kotlin,59988,7799,19,2627,False,False,True,True,"A V2Ray client for Android, support Xray core and v2fly core"
autogen,microsoft,Python,59927,9019,969,1070,True,True,True,True,A programming framework for agentic AI
bat,sharkdp,Rust,59852,1600,415,3015,False,True,True,True,A cat(1) clone with wings.
ultralytics,ultralytics,Python,59806,11433,163,1411,True,True,True,True,"Ultralytics YOLO26, YOLO11, YOLOv8 — object detection, instance segmentation, semantic segmentation, image classification, pose estimation, object tracking"
jquery,jquery,JavaScript,59798,20394,92,6320,True,True,True,True,jQuery JavaScript Library
Mole,tw93,Shell,59706,2100,21,303,False,True,True,True,"🐹 Clean, uninstall, analyze, optimize, and monitor your Mac from the terminal."
context7,upstash,TypeScript,59665,2859,25,484,False,False,True,True,Context7 Platform -- Up-to-date code documentation for LLMs and AI code editors
shadowsocks-windows,shadowsocks,C#,59580,16224,200,4938,False,True,False,True,A C# port of shadowsocks
chinese-independent-developer,1c7,Python,59559,5144,2,3227,False,True,True,True,👩🏿‍💻👨🏾‍💻👩🏼‍💻👨🏽‍💻👩🏻‍💻中国独立开发者项目列表 -- 分享大家都在做什么
llama,meta-llama,Python,59525,9798,527,1255,True,True,True,True,Inference code for Llama models
coolify,coollabsio,PHP,59393,5126,803,2005,True,True,True,True,"An open-source, self-hostable PaaS alternative to Vercel, Heroku & Netlify that lets you easily deploy static sites, databases, full-stack applications and 280+ one-click services on your own servers."
mkcert,FiloSottile,Go,59363,3132,176,2951,True,True,True,True,A simple zero-config tool to make locally trusted development certificates with any names you'd like.
marktext,marktext,TypeScript,59080,4385,542,3175,False,True,True,True,"📝A simple and elegant markdown editor, available for Linux, macOS and Windows."
starship,starship,Rust,59038,2594,1019,2670,True,True,True,True,"☄🌌️  The minimal, blazing-fast, and infinitely customizable prompt for any shell!"
llm-app,pathwaycom,Jupyter Notebook,58988,1440,10,1100,True,True,True,True,"Ready-to-run cloud templates for RAG, AI pipelines, and enterprise search with live data. 🐳Docker-friendly.⚡Always in sync with Sharepoint, Google Drive, S3, Kafka, PostgreSQL, real-time data APIs, and more."
winutil,ChrisTitusTech,PowerShell,58857,3413,8,1548,True,True,True,True,"Chris Titus Tech's Windows Utility - Install Programs, Tweaks, Fixes, and Updates"
meilisearch,meilisearch,Rust,58709,2635,302,3013,True,True,True,True,A lightning-fast search engine API bringing AI-powered hybrid search to your sites and applications.
rclone,rclone,Go,58665,5247,1206,4512,True,True,True,True,"""rsync for cloud storage"" - Google Drive, S3, Dropbox, Backblaze B2, One Drive, Swift, Hubic, Wasabi, Google Cloud Storage, Azure Blob, Azure Files, Yandex Files"
rails,rails,Ruby,58637,22217,1547,6678,True,True,True,True,Ruby on Rails
ghostty,ghostty-org,Zig,58593,3121,262,1577,False,True,True,True,"👻 Ghostty is a fast, feature-rich, and cross-platform terminal emulator that uses platform-native UI and GPU acceleration."
angular.js,angular,JavaScript,58572,27058,461,6043,True,True,False,True,AngularJS - HTML enhanced for web apps!
daily_stock_analysis,ZhuLinsen,Python,58504,50250,52,194,False,True,True,True,"LLM 驱动的多市场股票智能分析系统：多源行情、实时新闻、决策看板与自动推送，支持零成本定时运行。  LLM-powered multi-market stock analysis system with multi-source market data, real-time news, decision dashboard, automated notifications, and cost-free scheduled runs."
awesome-rust,rust-unofficial,Rust,58495,3503,9,4389,False,True,True,True,A curated list of Rust code and resources.
zustand,pmndrs,TypeScript,58472,2161,5,2662,False,True,True,True,🐻 Bear necessities for state management in React
github-cheat-sheet,tiimgreen,,58084,5428,48,4485,False,True,False,True,A list of cool features of Git and GitHub.
termux-app,termux,Java,58038,7027,562,3926,False,False,True,True,Termux - a terminal emulator application for Android OS extendible by variety of packages.
yolov5,ultralytics,Python,57728,17470,31,2258,True,True,True,True,"Ultralytics YOLOv5 in PyTorch for object detection, instance segmentation, classification, training, and export."
mempalace,MemPalace,Python,57673,7431,649,110,False,True,True,True,The best-benchmarked open-source AI memory system. And it's free.
OpenManus,FoundationAgents,Python,57574,10019,493,504,True,False,True,True,"No fortress, purely open ground.  OpenManus is Coming."
html5-boilerplate,h5bp,JavaScript,57572,12273,15,6024,True,True,True,True,"A professional front-end template for building fast, robust, and adaptable web apps or sites."
DeepLearning-500-questions,scutan90,JavaScript,57493,15889,120,2948,False,False,False,True,深度学习500问，以问答形式对常用的概率知识、线性代数、机器学习、深度学习、计算机视觉等热点问题进行阐述，以帮助自己及有需要的读者。 全书分为18个章节，50余万字。由于水平有限，书中不妥之处恳请广大读者批评指正。   未完待续............ 如有意合作，联系scutjy2015@163.com                     版权所有，违权必究       Tan 2018.06
private-gpt,zylon-ai,Python,57358,7605,7,1178,False,False,True,True,"Complete API layer for private AI applications on local models: RAG, skills, tools, MCP, text-to-sql, and more. Works with any OpenAI-compatible inference server."
penpot,penpot,Clojure,57267,3791,718,3859,True,True,True,True,Penpot: The open-source design platform for Product teams that need scalable collaboration.
MediaCrawler,NanmiCoder,Python,57205,11436,181,1140,False,False,True,True,小红书笔记 | 评论爬虫、抖音视频 | 评论爬虫、快手视频 | 评论爬虫、B 站视频 ｜ 评论爬虫、微博帖子 ｜ 评论爬虫、百度贴吧帖子 ｜ 百度贴吧评论回复爬虫  | 知乎问答文章｜评论爬虫
gitea,go-gitea,Go,57004,6937,2662,3552,True,True,True,True,"Git with a cup of tea! Painless self-hosted all-in-one software development service, including Git hosting, code review, team collaboration, package registry and CI/CD"
awesome-android-ui,wasabeef,,56955,10253,40,4230,True,False,False,True,A curated list of awesome Android UI/UX libraries
fuel-core,FuelLabs,Rust,56945,2859,196,2156,False,True,True,True,Rust full node implementation of the Fuel v2 protocol.
rich,Textualize,Python,56927,2264,363,2447,True,True,True,True,Rich is a Python library for rich text and beautiful formatting in the terminal.
