repo_name,organization,language,stars,forks,open_issues,age_days,has_coc,has_contributing,has_workflows,has_readme,description
career-ops,santifer,JavaScript,53958,10729,162,72,True,True,True,True,"AI-powered job search system built on Claude Code. 14 skill modes, Go dashboard, PDF generation, batch processing."
PowerShell,PowerShell,C#,53938,8355,1519,3806,True,True,True,True,PowerShell for every system!
ImHex,WerWolv,C++,53889,2399,369,2043,True,True,True,True,"🔍 A Hex Editor for Reverse Engineers, Programmers and people who value their retinas when working at 3 AM."
core,vuejs,TypeScript,53836,9146,983,2925,False,True,True,True,"🖖 Vue.js is a progressive, incrementally-adoptable JavaScript framework for building UI on the web."
crewAI,crewAIInc,Python,53666,7509,458,963,False,True,True,True,"Framework for orchestrating role-playing, autonomous AI agents. By fostering collaborative intelligence, CrewAI empowers agents to work together seamlessly, tackling complex tasks."
Flowise,FlowiseAI,TypeScript,53631,24522,925,1172,True,True,True,True,"Build AI Agents, Visually"
normalize.css,necolas,CSS,53541,10372,76,5521,False,True,False,True,A modern alternative to CSS resets
pdf.js,mozilla,JavaScript,53452,10635,422,5530,True,True,True,True,PDF Reader in JavaScript
English-level-up-tips,byoungd,,53450,5518,30,3304,False,False,True,True,An advanced guide to learn English which might benefit you a lot 🎉 .  离谱的英语学习指南/英语学习教程/英语学习/学英语
material-design-icons,google,,53448,9727,406,4268,True,True,True,True,Material Design icons by Google (Material Symbols)
jellyfin,jellyfin,C#,53322,4988,620,2746,True,True,True,True,The Free Software Media System - Server Backend & API
kotlin,JetBrains,Kotlin,52860,6331,280,5236,True,True,True,True,The Kotlin Programming Language. 
Docker-OSX,sickcodes,Shell,52595,2881,418,2202,False,False,True,True,Run macOS VM in a Docker! Run near native OSX-KVM in Docker! X11 Forwarding! CI/CD for OS X Security Research! Docker mac Containers.
ionic-framework,ionic-team,TypeScript,52514,13358,626,4682,True,True,True,True,"A powerful cross-platform UI toolkit for building native-quality iOS, Android, and Progressive Web Apps with HTML, CSS, and JavaScript."
awesome-ios,vsouza,Swift,52492,6975,11,4358,True,True,True,True,"A curated list of awesome iOS ecosystem, including Objective-C and Swift Projects "
odoo,odoo,Python,52440,32817,9763,4416,False,True,True,True,Odoo. Open Source Apps To Grow Your Business.
prettier,prettier,JavaScript,52034,4744,1405,3485,True,True,True,True,Prettier is an opinionated code formatter.
Motrix,agalwood,JavaScript,51974,4885,779,2736,True,True,True,True,A full-featured download manager.
chinese-poetry,chinese-poetry,JavaScript,51898,10450,136,3574,False,False,True,True,"The most comprehensive database of Chinese poetry 🧶最全中华古诗词数据库,  唐宋两朝近一万四千古诗人,  接近5.5万首唐诗加26万宋诗.  两宋时期1564位词人，21050首词。"
etcd,etcd-io,Go,51836,10398,260,4727,True,True,True,True,Distributed reliable key-value store for the most critical data of a distributed system
minimind,jingyaogong,Python,51807,6657,42,689,True,False,True,True,🧠「大模型」2小时完全从0训练64M的小参数LLM！Train a 64M-parameter LLM from scratch in just 2h!
windows,dockur,Shell,51714,4372,108,883,False,False,True,True,Windows inside a Docker container.
grok-1,xai-org,Python,51690,8477,125,820,True,False,True,True,Grok open release
lx-music-desktop,lyswhut,TypeScript,51585,6861,1208,2497,False,False,True,True,一个基于 Electron 的音乐软件
freqtrade,freqtrade,Python,51514,10737,32,3316,False,True,True,True,"Free, open source crypto trading bot"
jekyll,jekyll,Ruby,51497,10287,250,6448,True,True,True,True,:globe_with_meridians: Jekyll is a blog-aware static site generator in Ruby
guava,google,Java,51471,11139,740,4400,True,True,True,True,Google core libraries for Java
lazydocker,jesseduffield,Go,51368,1627,277,2585,True,True,True,True,The lazier way to manage everything docker
DefinitelyTyped,DefinitelyTyped,TypeScript,51279,30453,674,5001,False,False,True,True,The repository for high quality TypeScript type definitions.
MediaCrawler,NanmiCoder,Python,51273,10745,175,1102,False,False,True,True,小红书笔记 | 评论爬虫、抖音视频 | 评论爬虫、快手视频 | 评论爬虫、B 站视频 ｜ 评论爬虫、微博帖子 ｜ 评论爬虫、百度贴吧帖子 ｜ 百度贴吧评论回复爬虫  | 知乎问答文章｜评论爬虫
100-Days-Of-ML-Code,Avik-Jain,,51257,11541,68,2902,True,True,False,True,100 Days of ML Coding
go-ethereum,ethereum,Go,51176,21922,384,4554,False,True,True,True,Go implementation of the Ethereum protocol
professional-programming,charlax,Python,51116,3994,3,3874,False,True,False,True,A collection of learning resources for curious software engineers
awesome-wechat-weapp,justjavac,,51106,9018,2,3553,False,False,False,True,微信小程序开发资源汇总 :100:
Semantic-UI,Semantic-Org,JavaScript,51066,4872,1071,4816,False,True,False,True,Semantic is a UI component framework based around useful principles from natural language.
plane,makeplane,TypeScript,50909,4526,898,1304,True,True,True,True,"🔥🔥🔥 Open-source Jira, Linear, Monday, and ClickUp alternative. Plane is a modern project management platform to manage tasks, sprints, docs, and triage."
hiring-without-whiteboards,poteto,JavaScript,50880,3896,9,3380,True,True,True,True,⭐️  Companies that don't have a broken hiring process
whisper.cpp,ggml-org,C++,50764,5666,1199,1359,False,True,True,True,Port of OpenAI's Whisper model in C/C++
open-source-ios-apps,dkhamsing,,50738,5787,1,4158,False,True,True,True,:iphone: Collaborative List of Open-Source iOS Apps
dbeaver,dbeaver,Java,50568,4234,3312,3890,True,True,True,True,Free universal database tool and SQL client
litellm,BerriAI,Python,50531,8908,3458,1055,False,True,True,True,"Python SDK, Proxy Server (AI Gateway) to call 100+ LLM APIs in OpenAI (or native) format, with cost tracking, guardrails, loadbalancing and logging. [Bedrock, Azure, OpenAI, VertexAI, Cohere, Anthropic, Sagemaker, HuggingFace, VLLM, NVIDIA NIM]"
Pake,tw93,Rust,50520,10353,2,1340,True,True,True,True,🤱🏻 Turn any webpage into a desktop app with one command.
awesome-openclaw-skills,VoltAgent,,50283,4897,14,141,False,True,True,True,"The awesome collection of OpenClaw skills. 5,400+ skills filtered and categorized from the official OpenClaw Skills Registry.🦞"
remotion,remotion-dev,TypeScript,50275,3593,150,2183,True,True,True,True,🎥      Make videos programmatically with React
Fooocus,lllyasviel,Python,50247,8090,299,1041,False,False,True,True,Focus on prompting and generating
llama_index,run-llama,Python,50165,7568,460,1322,True,True,True,True,LlamaIndex is the leading document agent and OCR platform
expo,expo,TypeScript,50106,12753,606,3591,False,True,True,True,"An open-source framework for making universal native apps with React. Expo runs on Android, iOS, and the web."
cypress,cypress-io,TypeScript,50097,3424,1168,4122,True,True,True,True,"Fast, easy and reliable testing for anything that runs in a browser."
twenty,twentyhq,TypeScript,50079,7251,150,1292,True,True,True,True,"The open alternative to Salesforce, designed for AI."
bulma,jgthms,CSS,50073,3895,521,3796,False,True,True,True,Modern CSS framework based on Flexbox
mastodon,mastodon,Ruby,50036,7470,4437,3766,True,True,True,True,"Your self-hosted, globally interconnected microblogging community"
json,nlohmann,C++,49944,7416,74,4729,True,True,True,True,JSON for Modern C++
codegraph,colbymchenry,TypeScript,49930,3053,253,148,False,False,True,True,"Pre-indexed code knowledge graph, auto syncs on code changes, for Claude Code, Codex, Gemini, Cursor, OpenCode, AntiGravity, Kiro, and Hermes Agent — fewer tokens, fewer tool calls, 100% local"
penpot,penpot,Clojure,49795,3213,676,3821,True,True,True,True,Penpot: The open-source design tool for design and code collaboration
query,TanStack,TypeScript,49759,3889,196,2470,False,True,True,True,"🤖 Powerful asynchronous state management, server-state utilities and data fetching for the web. TS/JS, React Query, Solid Query, Svelte Query and Vue Query."
hacker-scripts,NARKOZ,JavaScript,49733,6663,70,3859,False,False,False,True,Based on a true story
alist,AlistGo,Go,49653,7947,564,2000,True,True,True,True,"🗂️A file list/WebDAV program that supports multiple storages, powered by Gin and Solidjs. / 一个支持多存储的文件列表/WebDAV程序，使用 Gin 和 Solidjs。"
goose,aaif-goose,Rust,49526,5234,321,661,False,True,True,True,"an open source, extensible AI agent that goes beyond code suggestions - install, execute, edit, and test with any LLM"
huginn,huginn,Ruby,49478,4276,696,4846,False,False,True,True,Create agents that monitor and act on your behalf.  Your agents are standing by!
VibeVoice,microsoft,Python,49379,5497,169,294,True,True,True,True,Open-Source Frontier Voice AI
BMAD-METHOD,bmad-code-org,JavaScript,49182,5694,65,428,True,True,True,True,Breakthrough Method for Agile Ai Driven Development
open-source-mac-os-apps,serhii-londar,,49153,2591,113,3147,False,True,True,True,🚀 Awesome list of open source applications for macOS. https://t.me/s/opensourcemacosapps
jadx,skylot,Java,49085,5549,421,4837,True,True,True,True,Dex to Java decompiler
pandas,pandas-dev,Python,48986,20015,3196,5775,True,True,True,True,"Flexible and powerful data analysis / manipulation library for Python, providing labeled data structures similar to R data.frame objects, statistical functions, and much more"
chinese-independent-developer,1c7,,48898,4194,1,3189,False,True,True,True,👩🏿‍💻👨🏾‍💻👩🏼‍💻👨🏽‍💻👩🏻‍💻中国独立开发者项目列表 -- 分享大家都在做什么
julia,JuliaLang,Julia,48855,5791,4722,5535,True,True,True,True,The Julia Programming Language
terraform,hashicorp,Go,48719,10374,1908,4477,True,True,True,True,"Terraform enables you to safely and predictably create, change, and improve infrastructure. It is a source-available tool that codifies APIs into declarative configuration files that can be shared amongst team members, treated as code, edited, reviewed, and versioned."
kubernetes-the-hard-way,kelseyhightower,,48690,15717,49,3630,False,True,False,True,Bootstrap Kubernetes the hard way. No scripts.
dayjs,iamkun,JavaScript,48658,2444,1280,2988,False,True,True,True,⏰ Day.js 2kB immutable date-time library alternative to Moment.js with the same modern API
x64dbg,x64dbg,C++,48649,2752,570,4083,True,True,True,True,An open-source user mode debugger for Windows. Optimized for reverse engineering and malware analysis.
algorithm-visualizer,algorithm-visualizer,JavaScript,48567,7580,79,3684,True,True,False,True,:fireworks:Interactive Online Platform that Visualizes Algorithms from Code
PythonDataScienceHandbook,jakevdp,Jupyter Notebook,48558,18987,230,3596,True,True,False,True,Python Data Science Handbook: full text in Jupyter Notebooks
brew,Homebrew,Ruby,48525,11160,14,3754,True,True,True,True,🍺 The Package Manager for Everywhere
pretext,chenglou,TypeScript,48469,2699,83,100,False,False,True,True,"Fast, accurate & comprehensive text measurement & layout"
RxJava,ReactiveX,Java,48234,7586,20,4906,False,True,True,True,RxJava – Reactive Extensions for the JVM – a library for composing asynchronous and event-based programs using observable sequences for the Java VM.
awesome-java,akullpp,,48232,7689,26,4359,False,True,True,True,"A curated list of awesome frameworks, libraries and software for the Java programming language."
type-challenges,type-challenges,TypeScript,48216,5268,33213,2153,True,False,True,True,Collection of TypeScript type challenges with online judge
htmx,bigskysoftware,JavaScript,48207,1600,663,2254,False,True,True,True,</> htmx - high power tools for HTML
AI-For-Beginners,microsoft,Jupyter Notebook,48170,9978,9,1930,True,False,True,True,"12 Weeks, 24 Lessons, AI for All!"
Win11Debloat,Raphire,PowerShell,48151,1944,38,2057,False,True,True,True,"A simple, lightweight PowerShell script that allows you to remove pre-installed apps, disable telemetry, as well as perform various other changes to declutter and customize your Windows experience. Win11Debloat works for both Windows 10 and Windows 11."
Made-With-ML,GokuMohandas,Jupyter Notebook,48136,7576,25,2780,False,False,True,True,"Learn how to develop, deploy and iterate on production-grade ML applications."
ClickHouse,ClickHouse,C++,48029,8517,6220,3665,True,True,True,True,ClickHouse® is a real-time analytics database management system
ruff,astral-sh,Rust,47996,2156,2015,1406,True,True,True,True,"An extremely fast Python linter and code formatter, written in Rust."
moment,moment,JavaScript,47970,6989,304,5586,False,True,True,True,"Parse, validate, manipulate, and display dates in javascript."
design-patterns-for-humans,nilbuild,,47879,5502,16,3406,False,False,False,True,An ultra-simplified explanation to design patterns
tldraw,tldraw,TypeScript,47867,3307,430,1863,True,True,True,True,"Build infinite canvas apps in React with the tldraw SDK. World's best, top-most agent recommended #1 five star SDK."
fanqiang,bannedbook,Kotlin,47818,8113,327,4171,False,False,True,True,翻墙-科学上网
awesome-react-components,brillout,,47783,3781,56,3643,True,True,True,True,Curated List of React Components & Libraries.
awesome-design-patterns,DovAmir,,47765,3261,24,2933,False,True,False,True,A curated list of software and architecture related design patterns.
Projects,karan,,47742,10635,122,4729,False,True,False,True,:page_with_curl: A list of practical projects that anyone can solve in any programming language.
metabase,metabase,Clojure,47693,6547,4103,4151,False,True,True,True,The easy-to-use open source Business Intelligence and Embedded Analytics tool that lets everyone work with data :bar_chart:
big-list-of-naughty-strings,minimaxir,Python,47686,2160,108,3964,False,False,False,True,The Big List of Naughty Strings is a list of strings which have a high probability of causing issues when used as user-input data.
gogs,gogs,Go,47606,5071,994,4507,False,True,True,True,The painless way to host your own Git service
pixijs,pixijs,TypeScript,47417,5031,342,4893,True,True,True,True,"The HTML5 Creation Engine: Create beautiful digital content with the fastest, most flexible 2D WebGL renderer."
cherry-studio,CherryHQ,TypeScript,47400,4486,1183,753,True,True,True,True,"AI productivity studio with smart chat, autonomous agents, and 300+ assistants. Unified access to frontier LLMs"
textgen,oobabooga,Python,47320,5978,820,1273,False,False,True,True,"Open-source desktop app for local LLMs. Text, vision, tool-calling, OpenAI/Anthropic-compatible API. 100% private."
discourse,discourse,Ruby,47273,8935,177,4903,True,True,True,True,"A platform for community discussion. Free, open, simple."
slidev,slidevjs,TypeScript,47202,2101,200,1879,True,True,True,True,Presentation Slides for Developers
quill,slab,TypeScript,47156,3655,649,5068,True,True,True,True,Quill is a modern WYSIWYG editor built for compatibility and extensibility
react,typescript-cheatsheets,TypeScript,47065,4293,0,2936,True,True,True,True,Cheatsheets for experienced React developers getting started with TypeScript
spotube,KRTirtho,Dart,46986,2157,811,1948,True,False,True,True,🎧 Open source music streaming app! Available for both desktop & mobile!
okhttp,square,Kotlin,46971,9272,111,5075,False,True,True,True,"Square’s meticulous HTTP client for the JVM, Android, and GraalVM."
frontend-dev-bookmarks,dypsilon,,46971,5149,133,4741,False,True,False,True,Manually curated collection of resources for frontend web developers.
serverless,serverless,JavaScript,46918,5728,1216,4074,True,True,True,True,"⚡ Serverless Framework – Effortlessly build apps that auto-scale, incur zero costs when idle, and require minimal maintenance using AWS Lambda and other managed cloud services."
acme.sh,acmesh-official,Shell,46905,5598,1406,3824,False,False,True,True,A pure Unix shell script ACME client for SSL / TLS certificate automation
LocalAI,mudler,Go,46881,4138,197,1185,False,True,True,True,"LocalAI is the open-source AI engine. Run any model - LLMs, vision, voice, image, video - on any hardware. No GPU required."
legado,gedoor,Kotlin,46879,5788,18,2582,False,False,True,True,"Legado 3.0 Book Reader with powerful controls & full functions❤️阅读3.0, 阅读是一款可以自定义来源阅读网络内容的工具，为广大网络文学爱好者提供一种方便、快捷舒适的试读体验。"
v2ray-core,v2ray,Go,46872,8842,19,3937,True,False,True,True,A platform for building proxies to bypass network restrictions.
nvm-windows,coreybutler,Go,46812,3836,91,4286,False,True,True,True,A node.js version management utility for Windows. Ironically written in Go.
GitHubDaily,GitHubDaily,,46791,4642,646,2724,False,False,False,True,"坚持分享 GitHub 上高质量、有趣实用的开源技术教程、开发者工具、编程网站、技术资讯。A list cool, interesting projects of GitHub."
JeecgBoot,jeecgboot,Java,46751,16055,35,2758,False,False,True,True,AI 低代码平台「低代码 + 零代码」双驱动！低代码可一键生成前后端代码;零代码可 5 分钟搭建系统;AI Skills 一句话画流程、设计表单、生成整套系统。内置 AI聊天、知识库、流程编排、MCP插件等，兼容主流大模型。引领「AI 生成 → 在线配置 → 代码生成 → 手工合并->AI修改」开发模式，消除 Java 项目 80% 的重复工作，提效而不失灵活。
bevy,bevyengine,Rust,46633,4628,3234,2340,True,True,True,True,A refreshingly simple data-driven game engine built in Rust
tmux,tmux,C,46608,2698,36,4030,False,True,True,True,tmux source code
awesome-claude-code,hesreallyhim,Python,46582,4059,475,422,True,True,True,True,"A curated list of awesome skills, hooks, slash-commands, agent orchestrators, applications, and plugins for Claude Code by Anthropic"
30-Days-Of-JavaScript,Asabeneh,JavaScript,46461,10438,367,2366,False,False,False,True,"30 days of JavaScript programming challenge is a step-by-step guide to learn JavaScript programming language in 30 days. This challenge may take more than 100 days,  please just follow your own pace. These videos may help too: https://www.youtube.com/channel/UC7PNRuno1rzYPb1xLa4yktw"
awesome-remote-job,lukasz-madon,,46388,4639,44,4183,False,True,True,True,A curated list of awesome remote jobs and resources. Inspired by https://github.com/vinta/awesome-python
prisma,prisma,TypeScript,46286,2240,2619,2552,True,True,True,True,"Next-generation ORM for Node.js & TypeScript | PostgreSQL, MySQL, MariaDB, SQL Server, SQLite, MongoDB and CockroachDB"
aider,Aider-AI,Python,46285,4592,1625,1133,False,True,True,True,aider is AI pair programming in your terminal
monaco-editor,microsoft,JavaScript,46198,4078,828,3660,True,True,True,True,A browser based code editor
learn-regex,ziishaned,,46101,6163,65,3250,False,False,False,True,Learn regex the easy way
upscayl,upscayl,TypeScript,46099,2269,55,1416,False,False,True,True,"🆙 Upscayl - #1 Free and Open Source AI Image Upscaler for Linux, MacOS and Windows."
awesome-cheatsheets,LeCoupa,JavaScript,46025,6713,138,3141,False,False,True,True,"👩‍💻👨‍💻 Awesome cheatsheets for popular programming languages, frameworks and development tools. They include everything you should know in one single file."
airflow,apache,Python,45826,17247,1708,4081,True,True,True,True,"Apache Airflow - A platform to programmatically author, schedule, and monitor workflows"
architecture-samples,android,Kotlin,45718,11866,220,3783,False,True,True,True,A collection of samples to discuss and showcase different architectural tools and patterns for Android apps.
cal.diy,calcom,TypeScript,45577,14072,1298,1911,True,True,True,True,Scheduling infrastructure for absolutely everyone.
TTS,coqui-ai,Python,45565,6116,8,2217,True,True,True,True,"🐸💬 - a deep learning toolkit for Text-to-Speech, battle-tested in research and production"
awesome-compose,docker,HTML,45557,8205,386,2314,False,True,True,True,Awesome Docker Compose samples
zx,google,JavaScript,45536,1270,53,1868,True,True,True,True,A tool for writing better scripts
claude-cookbooks,anthropics,Jupyter Notebook,45501,5297,234,1035,False,True,True,True,A collection of notebooks/recipes showcasing some fun and effective ways of using Claude.
Rocket.Chat,RocketChat,TypeScript,45474,13651,3774,4046,True,True,True,True,The Secure CommsOS™ for mission-critical operations
AdminLTE,ColorlibHQ,CSS,45466,18209,0,4556,True,True,True,True,AdminLTE - Free admin dashboard template based on Bootstrap 5
jest,jestjs,TypeScript,45448,6662,236,4571,True,True,True,True,Delightful JavaScript Testing.
exo,exo-explore,Python,45376,3250,263,721,False,True,True,True,Run frontier AI locally.
CowAgent,zhayujie,Python,45337,10205,21,1408,False,True,True,True,"Open-source super AI assistant & Agent Harness. Plans tasks, runs tools and skills, self-evolves with memory and knowledge. Multi-model, multi-channel. Lightweight, extensible, one-line install. (formerly chatgpt-on-wechat)"
Umi-OCR,hiroi-sora,Python,45261,4453,346,1541,False,False,False,True,"OCR software, free and offline. 开源、免费的离线OCR软件。支持截屏/批量导入图片，PDF文档识别，排除水印/页眉页脚，扫描/生成二维码。内置多国语言库。"
iina,iina,Swift,45233,2840,1893,3466,False,True,True,True,The modern video player for macOS.
copyparty,9001,Python,45232,1844,268,2577,True,True,False,True,"Portable file server with accelerated resumable uploads, dedup, WebDAV, SFTP, FTP, TFTP, zeroconf, media indexer, thumbnails++ all in one file"
Leaflet,Leaflet,JavaScript,45199,6133,549,5745,True,True,True,True,🍃 JavaScript library for mobile-friendly interactive maps 🇺🇦
CppCoreGuidelines,isocpp,CSS,45099,5550,251,3953,False,True,True,True,"The C++ Core Guidelines are a set of tried-and-true guidelines, rules, and best practices about coding in C++"
streamlit,streamlit,Python,44981,4278,1304,2488,True,True,True,True,Streamlit — A faster way to build and share data apps.
Summer2026-Internships,SimplifyJobs,Python,44935,3181,5,2214,False,True,True,True,"Summer 2026 software engineering, data science, AI, quant, product management, and hardware internship postings. Updated daily by Simplify and Pitt CSC."
bruno,usebruno,JavaScript,44924,2581,1720,1357,False,True,True,True,Opensource IDE For Exploring and Testing API's (lightweight alternative to Postman/Insomnia)
helix,helix-editor,Rust,44907,3547,1556,2206,False,True,True,True,A post-modern modal text editor.
pyenv,pyenv,Shell,44894,3252,54,5037,False,True,True,True,Simple Python version management
grpc,grpc,C++,44890,11162,1309,4207,True,True,True,True,"C++ based gRPC (C++, Python, Ruby, Objective-C, PHP, C#)"
edex-ui,GitSquared,JavaScript,44871,3127,6,3425,False,False,True,True,"A cross-platform, customizable science fiction terminal emulator with advanced monitoring & touchscreen support."
cli,cli,Go,44843,8556,1009,2447,True,True,True,True,GitHub’s official command line tool
TrafficMonitor,zhongyang219,C++,44839,3701,1323,3243,False,False,True,True,这是一个用于显示当前网速、CPU及内存利用率的桌面悬浮窗软件，并支持任务栏显示，支持更换皮肤。
pandoc,jgm,Haskell,44816,3901,1059,5931,False,True,True,True,Universal markup converter
milvus,milvus-io,Go,44801,4067,877,2465,True,True,True,True,"Milvus is a high-performance, cloud-native vector database built for scalable vector ANN search"
meteor,meteor,JavaScript,44779,5246,402,5262,True,True,True,True,"Meteor, the JavaScript App Platform"
taste-skill,Leonxlnx,Shell,44773,3122,27,116,False,False,True,True,"Taste-Skill - gives your AI good taste. stops the AI from generating boring, generic slop "
react-hook-form,react-hook-form,TypeScript,44759,2420,44,2659,True,True,True,True,📋 React Hooks for form state management and validation (Web + React Native)
RSSHub,DIYgod,TypeScript,44736,9930,350,2996,True,True,True,True,🧡 Everything is RSSible
shannon,KeygraphHQ,TypeScript,44657,5179,11,262,False,False,True,True,"Shannon Lite is an autonomous, white-box AI pentester for web applications and APIs. It analyzes your source code, identifies attack vectors, and executes real exploits to prove vulnerabilities before they reach production."
reactjs-interview-questions,sudheerj,JavaScript,44645,10369,15,2937,False,False,True,True,List of top 500 ReactJS Interview Questions & Answers....Coding exercise questions are coming soon!!
hyper,vercel,TypeScript,44602,3565,1043,3637,False,False,True,True,A terminal built on web technologies
siyuan,siyuan-note,TypeScript,44475,2840,333,2115,True,True,True,True,"A privacy-first, self-hosted, fully open source personal knowledge management software, written in typescript and golang."
qlib,microsoft,Python,44472,7030,424,2132,True,False,True,True,"Qlib is an AI-oriented Quant investment platform that aims to use AI tech to empower Quant Research, from exploring ideas to implementing productions. Qlib supports diverse ML modeling paradigms, including supervised learning, market dynamics modeling, and RL, and is now equipped with https://github.com/microsoft/RD-Agent to automate R&D process."
supervision,roboflow,Python,44395,3941,105,1295,True,True,True,True,We write your reusable computer vision tools. 💜
nanobot,HKUDS,Python,44262,7824,882,135,False,True,True,True,"Lightweight, open-source AI agent for your tools, chats, and workflows."
jsoncrack.com,AykutSarac,TypeScript,44133,3556,34,1597,True,True,True,True,"✨ Innovative and open-source visualization application that transforms various data formats, such as JSON, YAML, XML and CSV into interactive graphs."
