repo_name,organization,language,stars,forks,open_issues,age_days,has_coc,has_contributing,has_workflows,has_readme,description
lx-music-desktop,lyswhut,TypeScript,49782,6683,1115,2425,False,False,True,True,一个基于 Electron 的音乐软件
ghostty,ghostty-org,Zig,49712,2230,221,1467,False,True,True,True,"👻 Ghostty is a fast, feature-rich, and cross-platform terminal emulator that uses platform-native UI and GPU acceleration."
cypress,cypress-io,TypeScript,49611,3401,1216,4050,True,True,True,True,"Fast, easy and reliable testing for anything that runs in a browser."
open-source-ios-apps,dkhamsing,,49595,5758,0,4086,False,True,True,True,:iphone: Collaborative List of Open-Source iOS Apps
hacker-scripts,NARKOZ,JavaScript,49447,6656,69,3787,False,False,False,True,Based on a true story
MiroFish,666ghj,Python,49424,7235,201,130,False,False,True,True,"A Simple and Universal Swarm Intelligence Engine, Predicting Anything. 简洁通用的群体智能引擎，预测万物"
dbeaver,dbeaver,Java,49391,4099,3270,3818,True,True,True,True,Free universal database tool and SQL client
json,nlohmann,C++,49312,7346,102,4657,True,True,True,True,JSON for Modern C++
alist,AlistGo,Go,49252,7957,559,1928,True,True,True,True,"🗂️A file list/WebDAV program that supports multiple storages, powered by Gin and Solidjs. / 一个支持多存储的文件列表/WebDAV程序，使用 Gin 和 Solidjs。"
huginn,huginn,Ruby,49046,4246,694,4773,False,False,True,True,Create agents that monitor and act on your behalf.  Your agents are standing by!
query,TanStack,TypeScript,49016,3754,162,2398,False,True,True,True,"🤖 Powerful asynchronous state management, server-state utilities and data fetching for the web. TS/JS, React Query, Solid Query, Svelte Query and Vue Query."
dayjs,iamkun,JavaScript,48629,2427,1208,2916,False,True,True,True,⏰ Day.js 2kB immutable date-time library alternative to Moment.js with the same modern API
julia,JuliaLang,Julia,48537,5759,4752,5462,True,True,True,True,The Julia Programming Language
expo,expo,TypeScript,48492,11669,882,3519,False,True,True,True,"An open-source framework for making universal native apps with React. Expo runs on Android, iOS, and the web."
algorithm-visualizer,algorithm-visualizer,JavaScript,48475,7583,78,3612,True,True,False,True,:fireworks:Interactive Online Platform that Visualizes Algorithms from Code
RxJava,ReactiveX,Java,48432,7599,21,4834,False,True,True,True,RxJava – Reactive Extensions for the JVM – a library for composing asynchronous and event-based programs using observable sequences for the Java VM.
pandas,pandas-dev,Python,48347,19827,3478,5703,True,True,True,True,"Flexible and powerful data analysis / manipulation library for Python, providing labeled data structures similar to R data.frame objects, statistical functions, and much more"
freqtrade,freqtrade,Python,48346,10072,40,3244,False,True,True,True,"Free, open source crypto trading bot"
whisper.cpp,ggml-org,C++,48312,5381,1161,1287,False,False,True,True,Port of OpenAI's Whisper model in C/C++
learn-claude-code,shareAI-lab,TypeScript,48303,7791,45,279,False,False,True,True,"Bash is all you need -  A nano claude code–like 「agent harness」, built from 0 to 1"
llama_index,run-llama,Python,48298,7161,271,1250,True,True,True,True,LlamaIndex is the leading document agent and OCR platform
oh-my-openagent,code-yeongyu,TypeScript,48257,3763,414,123,False,True,True,True,omo; the best agent harness - previously oh-my-opencode
open-source-mac-os-apps,serhii-londar,,48126,2507,55,3075,False,True,True,True,🚀 Awesome list of open source applications for macOS. https://t.me/s/opensourcemacosapps
crewAI,crewAIInc,Python,48048,6542,506,891,False,True,True,True,"Framework for orchestrating role-playing, autonomous AI agents. By fostering collaborative intelligence, CrewAI empowers agents to work together seamlessly, tackling complex tasks."
x64dbg,x64dbg,C++,48023,2702,587,4011,True,True,True,True,An open-source user mode debugger for Windows. Optimized for reverse engineering and malware analysis.
terraform,hashicorp,Go,48020,10263,1890,4405,True,True,True,True,"Terraform enables you to safely and predictably create, change, and improve infrastructure. It is a source-available tool that codifies APIs into declarative configuration files that can be shared amongst team members, treated as code, edited, reviewed, and versioned."
moment,moment,JavaScript,48015,7018,296,5514,False,True,True,True,"Parse, validate, manipulate, and display dates in javascript."
Fooocus,lllyasviel,Python,48014,7839,291,969,False,False,True,True,Focus on prompting and generating
jadx,skylot,Java,47955,5477,417,4765,True,True,True,True,Dex to Java decompiler
type-challenges,type-challenges,TypeScript,47923,5239,33136,2081,True,False,True,True,Collection of TypeScript type challenges with online judge
kubernetes-the-hard-way,kelseyhightower,,47909,15601,47,3558,False,True,False,True,Bootstrap Kubernetes the hard way. No scripts.
get-shit-done,gsd-build,JavaScript,47817,3933,36,111,False,True,True,True,"A light-weight and powerful meta-prompting, context engineering and spec-driven development system for Claude Code by TÂCHES."
htmx,bigskysoftware,JavaScript,47741,1582,662,2182,False,True,True,True,</> htmx - high power tools for HTML
OpenCut,OpenCut-app,TypeScript,47683,4987,281,286,True,True,True,True,The open-source CapCut alternative
design-patterns-for-humans,kamranahmedse,,47671,5504,17,3334,False,False,False,True,An ultra-simplified explanation to design patterns
big-list-of-naughty-strings,minimaxir,Python,47619,2162,108,3892,False,False,False,True,The Big List of Naughty Strings is a list of strings which have a high probability of causing issues when used as user-input data.
gogs,gogs,Go,47591,5065,977,4435,False,True,True,True,Gogs is a painless self-hosted Git service
chinese-independent-developer,1c7,,47589,4052,2,3117,False,False,True,True,👩🏿‍💻👨🏾‍💻👩🏼‍💻👨🏽‍💻👩🏻‍💻中国独立开发者项目列表 -- 分享大家都在做什么
Projects,karan,,47560,10664,118,4657,False,True,False,True,:page_with_curl: A list of practical projects that anyone can solve in any programming language.
Pake,tw93,Rust,47554,9458,0,1268,True,True,True,True,🤱🏻 Turn any webpage into a desktop app with one command.
awesome-java,akullpp,,47507,7657,29,4287,False,True,True,True,"A curated list of awesome frameworks, libraries and software for the Java programming language."
brew,Homebrew,Ruby,47372,11061,36,3682,True,True,True,True,🍺 The missing package manager for macOS (or Linux)
plane,makeplane,TypeScript,47312,3888,713,1232,True,True,True,True,"🔥🔥🔥 Open-source Jira, Linear, Monday, and ClickUp alternative. Plane is a modern project management platform to manage tasks, sprints, docs, and triage."
MediaCrawler,NanmiCoder,Python,47287,10172,145,1030,False,False,True,True,小红书笔记 | 评论爬虫、抖音视频 | 评论爬虫、快手视频 | 评论爬虫、B 站视频 ｜ 评论爬虫、微博帖子 ｜ 评论爬虫、百度贴吧帖子 ｜ 百度贴吧评论回复爬虫  | 知乎问答文章｜评论爬虫
awesome-react-components,brillout,,47218,3750,39,3571,True,True,True,True,Curated List of React Components & Libraries.
PythonDataScienceHandbook,jakevdp,Jupyter Notebook,47204,18812,230,3524,True,True,False,True,Python Data Science Handbook: full text in Jupyter Notebooks
paperclip,paperclipai,TypeScript,47145,7550,1740,33,False,True,True,True,Open-source orchestration for zero-human companies
TradingAgents,TauricResearch,Python,47131,8557,266,463,False,False,True,True,TradingAgents: Multi-Agents LLM Financial Trading Framework
Made-With-ML,GokuMohandas,Jupyter Notebook,47103,7398,24,2708,False,False,True,True,"Learn how to develop, deploy and iterate on production-grade ML applications."
quill,slab,TypeScript,47025,3630,635,4996,True,True,True,True,Quill is a modern WYSIWYG editor built for compatibility and extensibility
react,typescript-cheatsheets,JavaScript,47017,4292,1,2864,True,True,True,True,Cheatsheets for experienced React developers getting started with TypeScript
v2ray-core,v2ray,Go,46962,8867,8,3865,True,False,True,True,A platform for building proxies to bypass network restrictions.
serverless,serverless,JavaScript,46933,5736,1230,4002,True,True,True,True,"⚡ Serverless Framework – Effortlessly build apps that auto-scale, incur zero costs when idle, and require minimal maintenance using AWS Lambda and other managed cloud services."
okhttp,square,Kotlin,46924,9281,96,5003,False,True,True,True,"Square’s meticulous HTTP client for the JVM, Android, and GraalVM."
pixijs,pixijs,TypeScript,46854,4991,327,4821,True,True,True,True,"The HTML5 Creation Engine: Create beautiful digital content with the fastest, most flexible 2D WebGL renderer."
ruff,astral-sh,Rust,46847,1986,1919,1334,True,True,True,True,"An extremely fast Python linter and code formatter, written in Rust."
metabase,metabase,Clojure,46742,6361,4038,4079,False,True,True,True,The easy-to-use open source Business Intelligence and Embedded Analytics tool that lets everyone work with data :bar_chart:
ClickHouse,ClickHouse,C++,46701,8269,5797,3593,True,True,True,True,ClickHouse® is a real-time analytics database management system
awesome-design-patterns,DovAmir,,46700,3226,23,2861,False,True,False,True,A curated list of software and architecture related design patterns.
discourse,discourse,Ruby,46691,8865,155,4831,True,True,True,True,"A platform for community discussion. Free, open, simple."
worldmonitor,koala73,TypeScript,46618,7510,93,86,True,True,True,True,"Real-time global intelligence dashboard. AI-powered news aggregation, geopolitical monitoring, and infrastructure tracking in a unified situational awareness interface"
AI-For-Beginners,microsoft,Jupyter Notebook,46424,9497,4,1858,True,False,True,True,"12 Weeks, 24 Lessons, AI for All!"
text-generation-webui,oobabooga,Python,46402,5903,768,1201,False,False,True,True,"The original local LLM interface. Text, vision, tool-calling, training, and more. 100% offline."
frontend-dev-bookmarks,dypsilon,,46367,5150,123,4669,False,True,False,True,Manually curated collection of resources for frontend web developers.
30-Days-Of-JavaScript,Asabeneh,JavaScript,46210,10435,370,2294,False,False,False,True,"30 days of JavaScript programming challenge is a step-by-step guide to learn JavaScript programming language in 30 days. This challenge may take more than 100 days,  please just follow your own pace. These videos may help too: https://www.youtube.com/channel/UC7PNRuno1rzYPb1xLa4yktw"
tldraw,tldraw,TypeScript,46210,3125,320,1791,True,True,True,True,very good whiteboard infinite canvas SDK
acme.sh,acmesh-official,Shell,46179,5553,1379,3752,False,False,True,True,A pure Unix shell script ACME client for SSL / TLS certificate automation
learn-regex,ziishaned,,46143,6204,65,3178,False,False,False,True,Learn regex the easy way
GitHubDaily,GitHubDaily,,45940,4600,562,2652,False,False,False,True,"坚持分享 GitHub 上高质量、有趣实用的开源技术教程、开发者工具、编程网站、技术资讯。A list cool, interesting projects of GitHub."
monaco-editor,microsoft,JavaScript,45874,4026,800,3588,True,True,True,True,A browser based code editor
nvm-windows,coreybutler,Go,45805,3778,84,4214,False,True,True,True,A node.js version management utility for Windows. Ironically written in Go.
JeecgBoot,jeecgboot,Java,45730,15876,35,2686,False,False,True,True,"一款 AI 驱动的低代码平台，提供""零代码""与""代码生成""双模式——零代码模式一句话搭建系统，代码生成模式自动输出前后端代码与建表 SQL，生成即可运行。平台内置 AI 聊天助手、AI大模型、知识库、AI流程编排、MCP 与插件体系，兼容主流大模型，支持一句话生成流程图、设计表单、聊天式业务操作，解决 Java 项目 80% 重复工作，高效且不失灵活。"
RuView,ruvnet,Rust,45682,6157,45,302,False,False,True,True,"π RuView: WiFi DensePose turns commodity WiFi signals into real-time human pose estimation, vital sign monitoring, and presence detection — all without a single pixel of video. "
prisma,prisma,TypeScript,45659,2140,2544,2480,True,True,True,True,"Next-generation ORM for Node.js & TypeScript | PostgreSQL, MySQL, MariaDB, SQL Server, SQLite, MongoDB and CockroachDB"
minimind,jingyaogong,Python,45635,5577,29,617,True,False,True,True,🚀🚀 「大模型」2小时完全从0训练64M的小参数GPT！🌏 Train a 64M-parameter GPT from scratch in just 2h!
architecture-samples,android,Kotlin,45633,11877,219,3711,False,True,True,True,A collection of samples to discuss and showcase different architectural tools and patterns for Android apps.
awesome-cheatsheets,LeCoupa,JavaScript,45615,6673,136,3069,False,False,True,True,"👩‍💻👨‍💻 Awesome cheatsheets for popular programming languages, frameworks and development tools. They include everything you should know in one single file."
legado,gedoor,Kotlin,45606,5240,71,2510,False,False,True,True,"Legado 3.0 Book Reader with powerful controls & full functions❤️阅读3.0, 阅读是一款可以自定义来源阅读网络内容的工具，为广大网络文学爱好者提供一种方便、快捷舒适的试读体验。"
slidev,slidevjs,TypeScript,45432,2000,197,1807,True,True,True,True,Presentation Slides for Developers
bevy,bevyengine,Rust,45431,4489,3303,2268,True,True,True,True,A refreshingly simple data-driven game engine built in Rust
Mole,tw93,Shell,45405,1349,0,193,False,True,True,True,🐹 Deep clean and optimize your Mac.
spotube,KRTirtho,Dart,45386,2028,771,1876,True,False,True,True,🎧 Open source music streaming app! Available for both desktop & mobile!
jest,jestjs,TypeScript,45336,6642,249,4499,True,True,True,True,Delightful JavaScript Testing.
AdminLTE,ColorlibHQ,CSS,45333,18257,15,4484,True,True,True,True,AdminLTE - Free admin dashboard template based on Bootstrap 5
zx,google,JavaScript,45333,1239,39,1795,True,True,True,True,A tool for writing better scripts
claude-mem,thedotmack,TypeScript,45211,3432,245,216,False,False,True,True,"A Claude Code plugin that automatically captures everything Claude does during your coding sessions, compresses it with AI (using Claude's agent-sdk), and injects relevant context back into future sessions."
penpot,penpot,Clojure,45188,2651,580,3749,True,True,True,True,Penpot: The open-source design tool for design and code collaboration
Rocket.Chat,RocketChat,TypeScript,45096,13501,3705,3973,True,True,True,True,The Secure CommsOS™ for mission-critical operations
TTS,coqui-ai,Python,44983,6025,7,2145,True,True,True,True,"🐸💬 - a deep learning toolkit for Text-to-Speech, battle-tested in research and production"
LocalAI,mudler,Go,44893,3862,158,1113,False,True,True,True,"LocalAI is the open-source AI engine. Run any model - LLMs, vision, voice, image, video - on any hardware. No GPU required."
airflow,apache,Python,44884,16797,1715,4009,True,True,True,True,"Apache Airflow - A platform to programmatically author, schedule, and monitor workflows"
CppCoreGuidelines,isocpp,CSS,44881,5544,251,3881,False,True,True,True,"The C++ Core Guidelines are a set of tried-and-true guidelines, rules, and best practices about coding in C++"
awesome-remote-job,lukasz-madon,,44815,4548,48,4111,False,True,True,True,A curated list of awesome remote jobs and resources. Inspired by https://github.com/vinta/awesome-python
meteor,meteor,JavaScript,44785,5267,367,5190,True,True,True,True,"Meteor, the JavaScript App Platform"
Leaflet,Leaflet,JavaScript,44778,6104,556,5673,True,True,True,True,🍃 JavaScript library for mobile-friendly interactive maps 🇺🇦
awesome-compose,docker,HTML,44707,8093,364,2242,False,True,True,True,Awesome Docker Compose samples
hyper,vercel,TypeScript,44683,3553,1024,3564,False,False,True,True,A terminal built on web technologies
react-hook-form,react-hook-form,TypeScript,44639,2381,125,2587,True,True,True,True,📋 React Hooks for form state management and validation (Web + React Native)
grpc,grpc,C++,44594,11101,1217,4135,True,True,True,True,"C++ based gRPC (C++, Python, Ruby, Objective-C, PHP, C#)"
edex-ui,GitSquared,JavaScript,44584,3068,6,3353,False,False,True,True,"A cross-platform, customizable science fiction terminal emulator with advanced monitoring & touchscreen support."
pyenv,pyenv,Shell,44542,3241,54,4964,False,True,True,True,Simple Python version management
reactjs-interview-questions,sudheerj,JavaScript,44445,10318,12,2865,False,False,True,True,List of top 500 ReactJS Interview Questions & Answers....Coding exercise questions are coming soon!!
upscayl,upscayl,TypeScript,44391,2151,59,1344,False,False,True,True,"🆙 Upscayl - #1 Free and Open Source AI Image Upscaler for Linux, MacOS and Windows."
iina,iina,Swift,44304,2783,1954,3393,False,True,True,True,The modern video player for macOS.
awesome-openclaw-skills,VoltAgent,,44282,4272,2,69,False,True,True,True,"The awesome collection of OpenClaw skills. 5,400+ skills filtered and categorized from the official OpenClaw Skills Registry.🦞"
streamlit,streamlit,Python,44117,4181,1324,2416,True,True,True,True,Streamlit — A faster way to build and share data apps.
build-web-application-with-golang,astaxie,Go,44115,10516,138,4993,False,False,False,True,A golang ebook intro how to build a web with golang
EasySpider,NaiboWang,JavaScript,44100,5369,266,2087,False,False,True,True,A visual no-code/code-free web crawler/spider易采集：一个可视化浏览器自动化测试/数据采集/爬虫软件，可以无代码图形化的设计和执行爬虫任务。别名：ServiceWrapper面向Web应用的智能化服务封装系统。
Summer2026-Internships,SimplifyJobs,Python,44063,3167,31,2142,False,True,True,True,Collection of Summer 2026 tech internships!
parcel,parcel-bundler,JavaScript,44048,2276,593,3162,True,True,True,True,The zero configuration build tool for the web. 📦🚀
copyparty,9001,Python,44021,1797,258,2505,True,True,False,True,"Portable file server with accelerated resumable uploads, dedup, WebDAV, SFTP, FTP, TFTP, zeroconf, media indexer, thumbnails++ all in one file"
tmux,tmux,C,44008,2541,64,3958,False,True,True,True,tmux source code
react-use,streamich,TypeScript,43967,3277,654,2716,False,True,True,True,React Hooks — 👍
front-end-interview-handbook,yangshun,MDX,43912,5947,11,3003,True,True,True,True,Front End interview preparation materials for busy engineers (updated for 2026)
retrofit,square,HTML,43907,7355,169,5689,False,True,True,True,A type-safe HTTP client for Android and the JVM
babel,babel,TypeScript,43904,5817,765,4206,True,True,True,True,🐠 Babel is a compiler for writing next generation JavaScript.
jsoncrack.com,AykutSarac,TypeScript,43829,3535,44,1525,True,True,True,True,"✨ Innovative and open-source visualization application that transforms various data formats, such as JSON, YAML, XML and CSV into interactive graphs."
TrafficMonitor,zhongyang219,C++,43795,3635,1275,3171,False,False,True,True,这是一个用于显示当前网速、CPU及内存利用率的桌面悬浮窗软件，并支持任务栏显示，支持更换皮肤。
TensorFlow-Examples,aymericdamien,Jupyter Notebook,43790,14771,227,3797,False,False,False,True,TensorFlow Tutorial and Examples for Beginners (support TF v1 & v2)
helix,helix-editor,Rust,43765,3393,1485,2134,False,True,True,True,A post-modern modal text editor.
milvus,milvus-io,Go,43602,3934,1102,2392,True,True,True,True,"Milvus is a high-performance, cloud-native vector database built for scalable vector ANN search"
twenty,twentyhq,TypeScript,43588,5817,88,1220,True,True,True,True,"Building a modern alternative to Salesforce, powered by the community."
BMAD-METHOD,bmad-code-org,JavaScript,43576,5193,167,356,True,True,True,True,Breakthrough Method for Agile Ai Driven Development
cobra,spf13,Go,43570,3100,361,4596,False,True,True,True,A Commander for modern Go CLI interactions
cli,cli,Go,43559,8203,956,2375,True,True,True,True,GitHub’s official command line tool
sentry,getsentry,Python,43499,4649,2065,5696,True,True,True,True,Developer-first error tracking and performance monitoring
exo,exo-explore,Python,43311,2979,176,649,False,True,True,True,Run frontier AI locally.
fuels-rs,FuelLabs,Rust,43307,1361,70,1616,False,False,True,True,Fuel Network Rust SDK
fuels-ts,FuelLabs,TypeScript,43267,1371,82,1674,True,True,True,True,Fuel Network Typescript SDK
Win11Debloat,Raphire,PowerShell,43238,1720,28,1985,False,True,True,True,"A simple, lightweight PowerShell script that allows you to remove pre-installed apps, disable telemetry, as well as perform various other changes to declutter and customize your Windows experience. Win11Debloat works for both Windows 10 and Windows 11."
RSSHub,DIYgod,TypeScript,43216,9549,362,2924,True,True,True,True,🧡 Everything is RSSible
kong,Kong,Lua,43107,5109,133,4156,True,True,True,True,🦍 The API and AI Gateway
pandoc,jgm,Haskell,43095,3806,1057,5859,False,True,True,True,Universal markup converter
spark,apache,Scala,43084,29150,326,4421,True,True,True,True,Apache Spark - A unified analytics engine for large-scale data processing
pm2,Unitech,JavaScript,43030,2698,1098,4702,False,True,True,True,Node.js Production Process Manager with a built-in Load Balancer.
CPlusPlusThings,Light-City,C++,43028,8829,9,2456,False,False,False,True,C++那些事
fanqiang,bannedbook,Kotlin,43027,7692,324,4099,False,False,True,True,翻墙-科学上网
Umi-OCR,hiroi-sora,Python,42988,4247,332,1469,False,False,False,True,"OCR software, free and offline. 开源、免费的离线OCR软件。支持截屏/批量导入图片，PDF文档识别，排除水印/页眉页脚，扫描/生成二维码。内置多国语言库。"
what-happens-when,alex,,42979,5730,2070,4532,False,False,False,True,"An attempt to answer the age old interview question ""What happens when you type google.com into your browser and press enter?"""
mitmproxy,mitmproxy,Python,42958,4506,437,5892,True,True,True,True,An interactive TLS-capable intercepting HTTP proxy for penetration testers and software developers.
cherry-studio,CherryHQ,TypeScript,42919,4021,866,681,True,True,True,True,"AI productivity studio with smart chat, autonomous agents, and 300+ assistants. Unified access to frontier LLMs"
Files,files-community,C#,42861,2666,528,2647,True,True,True,True,A modern file manager that helps users organize their files and folders.
aider,Aider-AI,Python,42826,4129,1467,1061,False,True,True,True,aider is AI pair programming in your terminal
zig,ziglang,Zig,42809,3070,3415,3895,False,False,False,True,Moved to Codeberg
python-patterns,faif,Python,42799,7041,13,5050,False,False,True,True,A collection of design patterns/idioms in Python
chatgpt-on-wechat,zhayujie,Python,42757,9866,352,1336,False,False,True,True,CowAgent是基于大模型的超级AI助理，能主动思考和任务规划、访问操作系统和外部资源、创造和执行Skills、拥有长期记忆并不断成长，比OpenClaw更轻量和便捷。同时支持微信、飞书、钉钉、企微、QQ、公众号、网页等接入，可选择OpenAI/Claude/Gemini/DeepSeek/ Qwen/GLM/Kimi/LinkAI，能处理文本、语音、图片和文件，可快速搭建个人AI助理和企业数字员工。
system-design,karanpratapsingh,,42645,5429,3,1328,True,True,False,True,Learn how to design systems at scale and prepare for system design interviews
bruno,usebruno,JavaScript,42613,2270,1595,1285,False,True,True,True,Opensource IDE For Exploring and Testing API's (lightweight alternative to Postman/Insomnia)
full-stack-fastapi-template,fastapi,TypeScript,42470,8316,19,2597,False,True,True,True,"Full stack, modern web application template. Using FastAPI, React, SQLModel, PostgreSQL, Docker, GitHub Actions, automatic HTTPS and more."
git-flight-rules,k88hudson,,42468,3183,16,4274,False,False,False,True,Flight rules for git
Alamofire,Alamofire,Swift,42363,7654,41,4265,False,True,True,True,Elegant HTTP Networking in Swift
fd,sharkdp,Rust,42336,1023,173,3252,False,True,True,True,"A simple, fast and user-friendly alternative to 'find'"
siyuan,siyuan-note,TypeScript,42309,2636,358,2043,True,True,True,True,"A privacy-first, self-hosted, fully open source personal knowledge management software, written in typescript and golang."
zod,colinhacks,TypeScript,42304,1886,309,2219,True,True,True,True,TypeScript-first schema validation with static type inference
gradio,gradio-app,Python,42254,3368,491,2663,True,True,True,True,"Build and share delightful machine learning apps, all in Python. 🌟 Star to support our work!"
litellm,BerriAI,Python,42186,6993,2221,983,False,True,True,True,"Python SDK, Proxy Server (AI Gateway) to call 100+ LLM APIs in OpenAI (or native) format, with cost tracking, guardrails, loadbalancing and logging. [Bedrock, Azure, OpenAI, VertexAI, Cohere, Anthropic, Sagemaker, HuggingFace, VLLM, NVIDIA NIM]"
ailearning,apachecn,Python,42161,11583,3,3325,False,False,False,True,AiLearning：数据分析+机器学习实战+线性代数+PyTorch+NLTK+TF2
diagrams,mingrammer,Python,42145,2723,386,2253,False,True,True,True,:art: Diagram as Code for prototyping cloud system architectures
DeepSpeed,deepspeedai,Python,41984,4774,1285,2263,True,True,True,True,"DeepSpeed is a deep learning optimization library that makes distributed training and inference easy, efficient, and effective."
ray,ray-project,Python,41948,7405,3561,3448,False,True,True,True,Ray is an AI compute engine. Ray consists of a core distributed runtime and a set of AI Libraries for accelerating ML workloads.
English-level-up-tips,byoungd,,41915,4413,28,3231,False,False,True,True,An advanced guide to learn English which might benefit you a lot 🎉 .  离谱的英语学习指南/英语学习教程/英语学习/学英语
