repo_name,organization,language,stars,forks,open_issues,age_days,has_coc,has_contributing,has_workflows,has_readme,description
ghidra,NationalSecurityAgency,Java,67912,7447,1867,2618,False,True,True,True,Ghidra is a software reverse engineering (SRE) framework
AFFiNE,toeverything,TypeScript,67870,4796,607,1369,True,True,True,True,"There can be more than Notion and Miro. AFFiNE(pronounced [ə‘fain]) is a next-gen knowledge base that brings planning, sorting and creating all together. Privacy first, open-source, customizable and ready to use. "
Apollo-11,chrislgarry,Assembly,67715,7677,130,4410,False,True,True,True,Original Apollo 11 Guidance Computer (AGC) source code for the command and lunar modules.
anime,juliangarnier,JavaScript,67647,4543,100,3700,False,True,True,True,JavaScript animation engine
MetaGPT,FoundationAgents,Python,67584,8582,121,1035,False,False,True,True,"🌟 The Multi-Agent Framework: First AI Software Company, Towards Natural Language Programming"
Chart.js,chartjs,JavaScript,67393,11954,558,4792,False,False,True,True,Simple HTML5 Charts using the <canvas> tag
OpenBB,OpenBB-finance,Python,66812,6678,78,1957,True,False,True,True,"Financial data platform for analysts, quants and AI agents."
annotated_deep_learning_paper_implementations,labmlai,Python,66478,6704,30,2075,False,False,True,True,"🧑‍🏫 60+ Implementations/tutorials of deep learning papers with side-by-side notes 📝; including transformers (original, xl, switch, feedback, vit, ...), optimizers (adam, adabelief, sophia, ...), gans(cyclegan, stylegan2, ...), 🎮 reinforcement learning (ppo, dqn), capsnet, distillation, ... 🧠"
33-js-concepts,leonardomso,JavaScript,66358,9192,3,2795,True,True,True,True,📜 33 JavaScript concepts every developer should know.
echarts,apache,TypeScript,66246,19812,1683,4776,True,True,True,True,"Apache ECharts is a powerful, interactive charting and data visualization library for browser"
gpt4free,xtekky,Python,66150,13597,2,1128,True,True,True,True,The official gpt4free repository | various collection of powerful language models | opus 4.6 gpt 5.3 kimi 2.5 deepseek v3.2 gemini 3
scikit-learn,scikit-learn,Python,65954,26984,2062,5735,True,True,True,True,scikit-learn: machine learning in Python
webpack,webpack,JavaScript,65779,9357,201,5164,True,True,True,True,"A bundler for javascript and friends. Packs many modules into a few bundled assets. Code Splitting allows for loading parts of the application on demand. Through ""loaders"", modules can be CommonJs, AMD, ES6 modules, CSS, Images, JSON, Coffeescript, LESS, ... and your custom stuff."
awesome-nodejs,sindresorhus,,65572,6216,26,4311,True,True,True,True,":zap: Delightful Node.js packages and resources [BECAUSE OF TOO MUCH SPAM AND LOW-QUALITY SUBMISSIONS, SUBMISSIONS ARE PAUSED UNTIL SEPTEMBER]"
Java,TheAlgorithms,Java,65509,21100,32,3575,True,True,True,True,All Algorithms implemented in Java
design-resources-for-developers,bradtraversy,,65434,12024,14,2185,False,True,False,True,"Curated list of design and UI resources from stock photos, web templates, CSS frameworks, UI libraries, tools and much more"
javascript-questions,lydiahallie,,65315,9223,50,2514,False,False,False,True,"A long list of (advanced) JavaScript questions, and their explanations :sparkles:  "
nocode,kelseyhightower,Dockerfile,65236,4819,4710,3005,False,True,False,True,The best way to write secure and reliable applications. Write nothing; deploy nowhere.
interviews,kdn251,Java,64943,12907,118,3362,False,False,False,True,Everything you need to know to get the job.
localstack,localstack,Python,64886,4702,0,3474,True,True,True,True,💻 A fully functional local AWS cloud stack. Develop and test your cloud & Serverless apps offline
crawl4ai,unclecode,Python,64840,6632,80,721,True,True,True,True,"🚀🤖 Crawl4AI: Open-source LLM Friendly Web Crawler & Scraper. Don't be shy, join here: https://discord.gg/jP8KfhDhyN"
docusaurus,facebook,TypeScript,64774,9864,383,3236,True,True,True,True,Easy to maintain open source documentation websites.
deer-flow,bytedance,Python,64391,8459,729,359,True,True,True,True,"An open-source long-horizon SuperAgent harness that researches, codes, and creates. With the help of sandboxes, memories, tools, skill, subagents and message gateway, it handles different levels of tasks that could take minutes to hours."
uBlock,gorhill,JavaScript,64215,4080,17,4047,False,True,True,True,uBlock Origin - An efficient blocker for Chromium and Firefox. Fast and lean.
keras,keras-team,Python,64051,19762,242,4052,False,True,True,True,Deep Learning for humans
prometheus,prometheus,Go,63854,10370,763,4905,True,True,True,True,The Prometheus monitoring system and time series database.
alacritty,alacritty,Rust,63797,3442,339,3725,False,True,True,True,"A cross-platform, OpenGL terminal emulator."
unsloth,unslothai,Python,63373,5549,1189,883,True,True,True,True,"Web UI for training and running open models like Gemma 4, Qwen3.6, DeepSeek, gpt-oss locally."
pathway,pathwaycom,Python,63369,1631,34,1250,True,True,True,True,"Python ETL framework for stream processing, real-time analytics, LLM pipelines, and RAG."
open-interpreter,openinterpreter,Python,63356,5523,324,1021,False,True,True,True,A natural language interface for computers
ripgrep,BurntSushi,Rust,63153,2531,182,3703,False,False,True,True,ripgrep recursively searches directories for a regex pattern while respecting your gitignore
socket.io,socketio,TypeScript,63064,10146,206,5894,False,True,True,True,Realtime application framework (Node.JS server)
traefik,traefik,Go,62942,5953,784,3882,True,True,True,True,The Cloud Native Application Proxy
nocodb,nocodb,TypeScript,62891,4751,688,3105,True,True,True,True,🔥 🔥 🔥 A Free & Self-hostable Airtable Alternative
resume.github.com,resume,JavaScript,62831,1370,72,5562,False,False,False,True,Resumes generated using the GitHub informations
nerd-fonts,ryanoasis,CSS,62785,3905,73,4165,True,True,True,True,"Iconic font aggregator, collection, & patcher. 3,600+ icons, 50+ patched fonts: Hack, Source Code Pro, more. Glyph collections: Font Awesome, Material Design Icons, Octicons, & more"
rustlings,rust-lang,Rust,62670,11178,78,3881,False,True,True,True,:crab: Small exercises to get you used to reading and writing Rust code!
ladybird,LadybirdBrowser,C++,62616,2965,672,700,True,True,True,True,Truly independent web browser
tldr,tldr-pages,Markdown,62319,5205,291,4526,False,True,True,True,Collaborative cheatsheets for console commands 📚.
30-Days-Of-Python,Asabeneh,Python,61893,11769,116,2354,False,False,True,True,The 30 Days of Python programming challenge is a step-by-step guide to learn the Python programming language in 30 days. This challenge may take more than 100 days. Follow your own pace. These videos may help too: https://www.youtube.com/channel/UC7PNRuno1rzYPb1xLa4yktw
sway,FuelLabs,Rust,61731,5422,903,1927,False,False,True,True,🌴 Empowering everyone to build reliable and efficient smart contracts.
MinerU,opendatalab,Python,61657,5173,17,791,False,False,True,True,Transforms complex documents like PDFs and Office docs into LLM-ready markdown/JSON for your Agentic workflows.
scrapy,scrapy,Python,61508,11514,634,5912,True,True,True,True,"Scrapy, a fast high-level web crawling & scraping framework for Python."
redux,reduxjs,TypeScript,61447,15077,42,3989,True,True,True,True,A JS library for predictable global state management
leetcode-master,youngyangyang04,Shell,61265,12326,246,2329,False,False,False,True,《代码随想录》LeetCode 刷题攻略：200道经典题目刷题顺序，共60w字的详细图解，视频难点剖析，50余张思维导图，支持C++，Java，Python，Go，JavaScript等多语言版本，从此算法学习不再迷茫！🔥🔥 来看看，你会发现相见恨晚！🚀 
lodash,lodash,JavaScript,61263,7154,141,5137,False,True,True,True,"A modern JavaScript utility library delivering modularity, performance, & extras."
cline,cline,TypeScript,61226,6330,757,663,True,True,True,True,"Autonomous coding agent right in your IDE, capable of creating/editing files, executing commands, using the browser, and more with your permission every step of the way."
paperclip,paperclipai,TypeScript,61100,10756,3014,59,False,True,True,True,Open-source orchestration for zero-human companies
minio,minio,Go,60837,7453,81,4124,True,True,True,True,"MinIO is a high-performance, S3 compatible object store, open sourced under GNU AGPLv3 license."
atom,atom,JavaScript,60836,17232,994,5214,True,True,False,True,:atom: The hackable text editor
Front-end-Developer-Interview-Questions,h5bp,Nunjucks,60824,11042,57,5194,True,True,True,True,"A list of helpful front-end related questions you can use to interview potential candidates, test yourself or completely ignore."
architect-awesome,xingshaocheng,,60819,17737,63,2946,False,False,False,True,后端架构师技术图谱
drawio-desktop,jgraph,JavaScript,60805,5660,68,3262,True,False,True,True,Official electron build of draw.io
openpilot,commaai,Python,60760,10865,153,3445,False,True,True,True,"openpilot is an operating system for robotics. Currently, it upgrades the driver assistance system on 300+ supported cars."
git,git,C,60679,27857,374,6490,True,True,True,True,Git Source Code Mirror - This is a publish-only repository but pull requests can be turned into patches to the mailing list via GitGitGadget (https://gitgitgadget.github.io/). Please follow Documentation/SubmittingPatches procedure for any of your improvements.
ai-agents-for-beginners,microsoft,Jupyter Notebook,60239,20392,5,518,True,False,True,True,12 Lessons to Get Started Building AI Agents
markdown-here,adam-p,JavaScript,60184,11079,319,5101,False,True,False,True,"Google Chrome, Firefox, and Thunderbird extension that lets you write email in Markdown and render it before sending."
Magisk,topjohnwu,Kotlin,60157,17318,56,3521,False,False,True,True,The Magic Mask for Android
nuxt,nuxt,TypeScript,60145,5589,892,3473,True,True,True,True,The Full-Stack Vue Framework.
spring-framework,spring-projects,Java,59883,38841,393,5623,True,True,True,True,Spring Framework
llm-app,pathwaycom,Jupyter Notebook,59867,1434,10,1016,True,True,True,True,"Ready-to-run cloud templates for RAG, AI pipelines, and enterprise search with live data. 🐳Docker-friendly.⚡Always in sync with Sharepoint, Google Drive, S3, Kafka, PostgreSQL, real-time data APIs, and more."
jquery,jquery,JavaScript,59837,20455,90,6236,True,True,True,True,jQuery JavaScript Library
awesome-flutter,Solido,Dart,59832,6867,22,3280,False,True,True,True,"An awesome list that curates the best Flutter libraries, tools, tutorials, articles and more."
Real-Time-Voice-Cloning,CorentinJ,Python,59682,9404,170,2531,False,False,True,True,Clone a voice in 5 seconds to generate arbitrary speech in real-time
awesome-chatgpt-prompts-zh,PlexPt,,59558,13567,44,1236,False,False,False,True,ChatGPT 中文调教指南。各种场景使用指南。学习怎么让它听你的话。
vaultwarden,dani-garcia,Rust,59526,2750,41,2994,False,False,True,True,"Unofficial Bitwarden compatible server written in Rust, formerly known as bitwarden_rs"
FFmpeg,FFmpeg,C,59429,13759,3,5495,False,True,False,True,Mirror of https://git.ffmpeg.org/ffmpeg.git
shadowsocks-windows,shadowsocks,C#,59406,16248,200,4854,False,True,False,True,A C# port of shadowsocks
llama,meta-llama,Python,59378,9818,522,1171,True,True,True,True,Inference code for Llama models
anything-llm,Mintplex-Labs,JavaScript,59330,6408,347,1062,False,True,True,True,The all-in-one AI productivity accelerator. On device and privacy first with no annoying setup or configuration.
memos,usememos,Go,59310,4317,25,1604,False,False,True,True,"Open-source, self-hosted note-taking tool built for quick capture. Markdown-native, lightweight, and fully yours."
get-shit-done,gsd-build,JavaScript,59083,5003,25,137,False,True,True,True,"A light-weight and powerful meta-prompting, context engineering and spec-driven development system for Claude Code by TÂCHES."
docling,docling-project,Python,58881,4036,883,660,True,True,True,True,Get your documents ready for gen AI
astro,withastro,TypeScript,58873,3398,320,1872,True,True,True,True,The web framework for content-driven websites. ⭐️ Star to support our work!
mkcert,FiloSottile,Go,58725,3090,167,2867,True,True,True,True,A simple zero-config tool to make locally trusted development certificates with any names you'd like.
angular.js,angular,JavaScript,58689,27150,461,5959,True,True,False,True,AngularJS - HTML enhanced for web apps!
bat,sharkdp,Rust,58632,1541,352,2931,False,True,True,True,A cat(1) clone with wings.
MiroFish,666ghj,Python,58538,9085,262,156,False,False,True,True,"A Simple and Universal Swarm Intelligence Engine, Predicting Anything. 简洁通用的群体智能引擎，预测万物"
rails,rails,Ruby,58393,22228,1595,6594,True,True,True,True,Ruby on Rails
pi-hole,pi-hole,Shell,58242,3126,48,4344,True,True,True,True,A black hole for Internet advertisements
TradingAgents,TauricResearch,Python,58123,11065,293,489,False,False,True,True,TradingAgents: Multi-Agents LLM Financial Trading Framework
pocketbase,pocketbase,Go,58045,3339,18,1396,False,True,True,True,Open Source realtime backend in 1 file
zustand,pmndrs,TypeScript,57911,2047,7,2578,False,True,True,True,🐻 Bear necessities for state management in React
ai-hedge-fund,virattt,Python,57746,10085,120,517,False,False,True,True,An AI Hedge Fund Team
learn-claude-code,shareAI-lab,TypeScript,57652,9466,112,305,False,False,True,True,"Bash is all you need -  A nano claude code–like 「agent harness」, built from 0 to 1"
autogen,microsoft,Python,57616,8687,796,986,True,True,True,True,A programming framework for agentic AI
html5-boilerplate,h5bp,JavaScript,57439,12312,28,5940,True,True,True,True,"A professional front-end template for building fast, robust, and adaptable web apps or sites."
nanoGPT,karpathy,Python,57379,9836,346,1220,False,False,False,True,"The simplest, fastest repository for training/finetuning medium-sized GPTs."
meilisearch,meilisearch,Rust,57373,2530,294,2929,True,True,True,True,A lightning-fast search engine API bringing AI-powered hybrid search to your sites and applications.
DeepLearning-500-questions,scutan90,JavaScript,57360,15957,121,2864,False,False,False,True,深度学习500问，以问答形式对常用的概率知识、线性代数、机器学习、深度学习、计算机视觉等热点问题进行阐述，以帮助自己及有需要的读者。 全书分为18个章节，50余万字。由于水平有限，书中不妥之处恳请广大读者批评指正。   未完待续............ 如有意合作，联系scutjy2015@163.com                     版权所有，违权必究       Tan 2018.06
yolov5,ultralytics,Python,57319,17487,39,2174,True,True,True,True,YOLOv5 🚀 in PyTorch > ONNX > CoreML > TFLite
awesome-claude-skills,ComposioHQ,Python,57289,6192,562,195,False,True,True,True,"A curated list of awesome Claude Skills, resources, and tools for customizing Claude AI workflows"
private-gpt,zylon-ai,Python,57205,7599,298,1094,False,False,True,True,"Interact with your documents using the power of GPT, 100% privately, no data leaks"
fuel-core,FuelLabs,Rust,57110,2860,192,2072,False,True,True,True,Rust full node implementation of the Fuel v2 protocol.
GPT-SoVITS,RVC-Boss,Python,57083,6230,866,837,False,False,True,True,1 min voice data can also be used to train a good TTS model! (few shot voice cloning)
starship,starship,Rust,57039,2503,1006,2586,True,True,True,True,"☄🌌️  The minimal, blazing-fast, and infinitely customizable prompt for any shell!"
awesome-rust,rust-unofficial,Rust,57030,3326,10,4305,False,True,True,True,A curated list of Rust code and resources.
rclone,rclone,Go,56955,5067,1178,4428,True,True,True,True,"""rsync for cloud storage"" - Google Drive, S3, Dropbox, Backblaze B2, One Drive, Swift, Hubic, Wasabi, Google Cloud Storage, Azure Blob, Azure Files, Yandex Files"
you-get,soimort,Python,56846,9757,384,5001,False,True,True,True,:arrow_double_down: Dumb downloader that scrapes the web
cc-switch,farion1231,Rust,56660,3678,694,269,True,True,True,True,"A cross-platform desktop All-in-One assistant tool for Claude Code, Codex, OpenCode, openclaw & Gemini CLI."
ultralytics,ultralytics,Python,56638,10896,327,1327,True,True,True,True,Ultralytics YOLO 🚀
github-cheat-sheet,tiimgreen,,56612,5417,46,4401,False,True,False,True,A list of cool features of Git and GitHub.
MoneyPrinterTurbo,harry0703,Python,56611,8146,3,781,False,False,True,True,利用AI大模型，一键生成高清短视频 Generate short videos with one click using AI LLM.
react-router,remix-run,TypeScript,56381,10850,161,4367,True,True,True,True,Declarative routing for React
face_recognition,ageitgey,Python,56359,13719,833,3345,False,True,True,True,The world's simplest facial recognition api for Python and the command line
rich,Textualize,Python,56227,2129,316,2363,True,True,True,True,Rich is a Python library for rich text and beautiful formatting in the terminal.
OpenManus,FoundationAgents,Python,55981,9754,546,420,True,False,True,True,"No fortress, purely open ground.  OpenManus is Coming."
awesome-android-ui,wasabeef,,55976,10257,40,4146,True,False,False,True,A curated list of awesome Android UI/UX libraries
gatsby,gatsbyjs,JavaScript,55949,10206,368,3997,True,True,True,True,"React-based framework with performance, scalability, and security built in."
appwrite,appwrite,TypeScript,55929,5294,1014,2579,True,True,True,True,"Appwrite® - complete cloud infrastructure for your web, mobile and AI apps. Including Auth, Databases, Storage, Functions, Messaging, Hosting, Realtime and more"
TrendRadar,sansan0,Python,55921,23941,32,367,False,False,True,True,"⭐AI-driven public opinion & trend monitor with multi-platform aggregation, RSS, and smart alerts.🎯 告别信息过载，你的 AI 舆情监控助手与热点筛选工具！聚合多平台热点 +  RSS 订阅，支持关键词精准筛选。AI 智能筛选新闻 + AI 翻译 +  AI 分析简报直推手机，也支持接入 MCP 架构，赋能 AI 自然语言对话分析、情感洞察与趋势预测等。支持 Docker ，数据本地/云端自持。集成微信/飞书/钉钉/Telegram/邮件/ntfy/bark/slack 等渠道智能推送。"
project-layout,golang-standards,Makefile,55886,5441,94,3155,False,False,True,True,Standard Go Project Layout
leetcode,azl397985856,JavaScript,55788,9428,10,2953,False,True,False,True,LeetCode Solutions: A Record of My Problem Solving Journey.( leetcode题解，记录自己的leetcode解题之路。)
marktext,marktext,JavaScript,55682,4164,1432,3091,True,True,True,True,"📝A simple and elegant markdown editor, available for Linux, macOS and Windows."
gitea,go-gitea,Go,55259,6642,2773,3468,True,True,True,True,"Git with a cup of tea! Painless self-hosted all-in-one software development service, including Git hosting, code review, team collaboration, package registry and CI/CD"
oh-my-openagent,code-yeongyu,TypeScript,55243,4478,676,149,False,True,True,True,omo; the best agent harness - previously oh-my-opencode
gpt-engineer,AntonOsika,Python,55231,7322,71,1097,True,True,True,True,CLI platform to experiment with codegen. Precursor to: https://lovable.dev
faceswap,deepfakes,Python,55197,13403,7,3054,True,False,True,True,Deepfakes Software For All
v2rayNG,2dust,Kotlin,55190,7292,9,2543,False,False,True,True,"A V2Ray client for Android, support Xray core and v2fly core"
joplin,laurent22,TypeScript,54565,6077,557,3391,False,True,True,True,"Joplin - the privacy-focused note taking app with sync capabilities for Windows, macOS, Linux, Android and iOS."
mem0,mem0ai,Python,54512,6152,277,1045,False,True,True,True,Universal memory layer for AI Agents
coolify,coollabsio,PHP,54452,4300,725,1921,True,True,True,True,"An open-source, self-hostable PaaS alternative to Vercel, Heroku & Netlify that lets you easily deploy static sites, databases, full-stack applications and 280+ one-click services on your own servers."
ChatGPT,lencx,Rust,54366,6173,929,1240,False,False,True,True,"🔮 ChatGPT Desktop Application (Mac, Windows and Linux)"
context7,upstash,TypeScript,54215,2570,138,400,False,False,True,True,Context7 Platform -- Up-to-date code documentation for LLMs and AI code editors
termux-app,termux,Java,54203,6488,538,3842,False,False,True,True,Termux - a terminal emulator application for Android OS extendible by variety of packages.
element,ElemeFE,Vue,54150,14495,2968,3527,False,False,True,True,A Vue.js 2.0 UI Toolkit for Web
maybe,maybe-finance,Ruby,54101,5588,0,850,False,True,True,True,The personal finance app for everyone
segment-anything,facebookresearch,Jupyter Notebook,54068,6332,593,1134,True,True,True,True,"The repository provides code for running inference with the SegmentAnything Model (SAM), links for downloading the trained model checkpoints, and example notebooks that show how to use the model."
n8n-workflows,Zie619,Python,54054,7075,23,351,False,False,True,True,all of the workflows of n8n i could find (also from the site itself)
powerlevel10k,romkatv,Shell,54003,2415,147,2622,False,False,False,True,A Zsh theme
requests,psf,Python,53945,9886,227,5555,True,True,True,True,"A simple, yet elegant, HTTP library."
dive,wagoodman,Go,53858,1992,203,2909,False,False,True,True,A tool for exploring each layer in a docker image
first-contributions,firstcontributions,,53767,101896,394,3509,True,True,True,True,🚀✨ Help beginners to contribute to open source projects
trackerslist,ngosang,,53688,6619,13,3658,False,False,True,True,Updated list of public BitTorrent trackers
winutil,ChrisTitusTech,PowerShell,53614,3017,4,1464,True,True,True,True,"Chris Titus Tech's Windows Utility - Install Programs, Tweaks, Fixes, and Updates"
normalize.css,necolas,CSS,53580,10409,75,5475,False,True,False,True,A modern alternative to CSS resets
core,vuejs,TypeScript,53573,9102,986,2879,False,True,True,True,"🖖 Vue.js is a progressive, incrementally-adoptable JavaScript framework for building UI on the web."
ImHex,WerWolv,C++,53365,2368,348,1997,True,True,True,True,"🔍 A Hex Editor for Reverse Engineers, Programmers and people who value their retinas when working at 3 AM."
PowerShell,PowerShell,C#,53246,8297,1476,3760,True,True,True,True,PowerShell for every system!
pdf.js,mozilla,JavaScript,53217,10604,444,5483,True,True,True,True,PDF Reader in JavaScript
material-design-icons,google,,53206,9723,403,4222,True,True,True,True,Material Design icons by Google (Material Symbols)
typst,typst,Rust,53205,1556,1211,2410,False,True,True,True,A markup-based typesetting system that is powerful and easy to learn.
worldmonitor,koala73,TypeScript,53124,8521,125,112,True,True,True,True,"Real-time global intelligence dashboard. AI-powered news aggregation, geopolitical monitoring, and infrastructure tracking in a unified situational awareness interface"
ghostty,ghostty-org,Zig,52977,2573,236,1493,False,True,True,True,"👻 Ghostty is a fast, feature-rich, and cross-platform terminal emulator that uses platform-native UI and GPU acceleration."
nanochat,karpathy,Python,52744,7060,99,199,False,False,True,True,The best ChatGPT that $100 can buy.
Ghost,TryGhost,JavaScript,52723,11523,239,4744,True,True,True,True,"Independent technology for modern publishing, memberships, subscriptions and newsletters."
kotlin,JetBrains,Kotlin,52659,6286,239,5190,True,True,True,True,The Kotlin Programming Language. 
ionic-framework,ionic-team,TypeScript,52487,13387,630,4636,True,True,True,True,"A powerful cross-platform UI toolkit for building native-quality iOS, Android, and Progressive Web Apps with HTML, CSS, and JavaScript."
Docker-OSX,sickcodes,Shell,52462,2892,417,2156,False,False,True,True,Run macOS VM in a Docker! Run near native OSX-KVM in Docker! X11 Forwarding! CI/CD for OS X Security Research! Docker mac Containers.
Flowise,FlowiseAI,TypeScript,52439,24244,828,1126,True,True,True,True,"Build AI Agents, Visually"
awesome-ios,vsouza,Swift,52028,6954,2,4312,True,True,True,True,"A curated list of awesome iOS ecosystem, including Objective-C and Swift Projects "
prettier,prettier,JavaScript,51837,4710,1470,3439,True,True,True,True,Prettier is an opinionated code formatter.
etcd,etcd-io,Go,51665,10328,237,4681,True,True,True,True,Distributed reliable key-value store for the most critical data of a distributed system
Motrix,agalwood,JavaScript,51570,4867,777,2690,True,True,True,True,A full-featured download manager.
grok-1,xai-org,Python,51530,8455,125,774,True,False,True,True,Grok open release
caveman,JuliusBrussee,Python,51506,2742,169,26,False,True,True,True,🪨 why use many token when few token do trick — Claude Code skill that cuts 65% of tokens by talking like caveman
guava,google,Java,51499,11142,733,4354,True,True,True,True,Google core libraries for Java
jekyll,jekyll,Ruby,51407,10283,245,6401,True,True,True,True,:globe_with_meridians: Jekyll is a blog-aware static site generator in Ruby
chinese-poetry,chinese-poetry,JavaScript,51369,10363,135,3528,False,False,True,True,"The most comprehensive database of Chinese poetry 🧶最全中华古诗词数据库,  唐宋两朝近一万四千古诗人,  接近5.5万首唐诗加26万宋诗.  两宋时期1564位词人，21050首词。 欢迎参加飞书AI先锋诗活动  https://bytedance.aiforce.cloud/app/app_4jvnd48x7khm1"
DefinitelyTyped,DefinitelyTyped,TypeScript,51210,30509,694,4955,False,False,True,True,The repository for high quality TypeScript type definitions.
windows,dockur,Shell,51139,4249,125,837,False,False,True,True,Windows inside a Docker container.
RuView,ruvnet,Rust,51109,6759,114,328,False,False,True,True,"π RuView: WiFi DensePose turns commodity WiFi signals into real-time human pose estimation, vital sign monitoring, and presence detection — all without a single pixel of video. "
