repo_name,organization,language,stars,forks,open_issues,age_days,has_coc,has_contributing,has_workflows,has_readme,description
sentry,getsentry,Python,44106,4725,2123,5768,True,True,True,True,Developer-first error tracking and performance monitoring
cobra,spf13,Go,44104,3151,377,4668,False,True,True,True,A Commander for modern Go CLI interactions
EasySpider,NaiboWang,JavaScript,44084,5374,267,2159,False,False,True,True,A visual no-code/code-free web crawler/spider易采集：一个可视化浏览器自动化测试/数据采集/网页爬虫软件，可以无代码图形化的设计和执行爬虫任务。别名：ServiceWrapper面向Web应用的智能化服务封装系统。
system-design,karanpratapsingh,,44047,5730,3,1400,True,True,False,True,Learn how to design systems at scale and prepare for system design interviews
parcel,parcel-bundler,JavaScript,44031,2279,597,3234,True,True,True,True,The zero configuration build tool for the web. 📦🚀
babel,babel,TypeScript,43997,5827,752,4278,True,True,True,True,🐠 Babel is a compiler for writing next generation JavaScript.
react-use,streamich,TypeScript,43974,3275,659,2788,False,True,True,True,React Hooks — 👍
front-end-interview-handbook,yangshun,MDX,43959,5939,12,3075,True,True,True,True,Front End interview preparation materials for busy engineers (updated for 2026)
mitmproxy,mitmproxy,Python,43937,4588,442,5964,True,True,True,True,An interactive TLS-capable intercepting HTTP proxy for penetration testers and software developers.
Files,files-community,C#,43923,2750,505,2719,True,True,True,True,A modern file manager that helps users organize their files and folders.
build-web-application-with-golang,astaxie,Go,43921,10472,138,5065,False,False,False,True,A golang ebook intro how to build a web with golang
retrofit,square,HTML,43894,7339,170,5761,False,True,True,True,A type-safe HTTP client for Android and the JVM
TensorFlow-Examples,aymericdamien,Jupyter Notebook,43749,14709,228,3869,False,False,False,True,TensorFlow Tutorial and Examples for Beginners (support TF v1 & v2)
chrome-devtools-mcp,ChromeDevTools,TypeScript,43724,2816,94,277,False,True,True,True,Chrome DevTools for coding agents
full-stack-fastapi-template,fastapi,TypeScript,43694,8662,17,2669,False,True,True,True,"Full stack, modern web application template. Using FastAPI, React, SQLModel, PostgreSQL, Docker, GitHub Actions, automatic HTTPS and more."
kong,Kong,Lua,43594,5150,151,4228,True,True,True,True,🦍 The API and AI Gateway
spark,apache,Scala,43461,29228,414,4494,True,True,True,True,Apache Spark - A unified analytics engine for large-scale data processing
logseq,logseq,Clojure,43411,2669,915,2215,True,True,True,True,"A privacy-first, open-source platform for knowledge management and collaboration. Download link:  http://github.com/logseq/logseq/releases. roadmap: https://logseq.io/p/NX4mc_ggEV"
fd,sharkdp,Rust,43358,1067,180,3324,False,True,True,True,"A simple, fast and user-friendly alternative to 'find'"
CPlusPlusThings,Light-City,C++,43232,8837,10,2528,False,False,False,True,C++那些事
pm2,Unitech,JavaScript,43213,2714,1083,4774,False,True,True,True,Node.js Production Process Manager with a built-in Load Balancer.
what-happens-when,alex,,43186,5737,2065,4604,False,False,True,True,"An attempt to answer the age old interview question ""What happens when you type google.com into your browser and press enter?"""
CLI-Anything,HKUDS,Python,43166,4044,55,99,False,True,True,True,"""CLI-Anything: Making ALL Software Agent-Native"" -- CLI-Hub: https://clianything.cc/"
fuels-rs,FuelLabs,Rust,43164,1361,71,1688,False,False,True,True,Fuel Network Rust SDK
bubbletea,charmbracelet,Go,43155,1234,182,2348,False,True,True,True,A powerful little TUI framework 🏗
fuels-ts,FuelLabs,TypeScript,43134,1372,78,1746,True,True,True,True,Fuel Network Typescript SDK
zig,ziglang,Zig,43098,3063,2910,3967,False,False,False,True,Moved to Codeberg
last30days-skill,mvanhorn,Python,43076,3522,178,143,False,False,True,True,"AI agent skill that researches any topic across Reddit, X, YouTube, HN, Polymarket, and the web - then synthesizes a grounded summary"
payload,payloadcms,TypeScript,43043,3805,812,1987,False,True,True,True,"Payload is the open-source, fullstack Next.js framework, giving you instant backend superpowers. Get a full TypeScript backend and admin panel instantly. Use Payload as a headless CMS or for building powerful applications."
jan,janhq,TypeScript,43043,2935,460,1034,True,True,True,True,Jan is an open source alternative to ChatGPT that runs 100% offline on your computer.
hyperswitch,juspay,Rust,43021,4806,1788,1337,True,True,True,True,"Open source, composable payments platform | PCI compliant | SaaS and Self-host options | Enables connectivity to multiple payment, payout, fraud, vault and tokenization providers | Uplifts authorization with intelligent routing and revenue recovery | Reduce payment processing costs with cost observability | Reduces payment ops with reconciliation"
zod,colinhacks,TypeScript,42978,2021,200,2291,True,True,True,True,TypeScript-first schema validation with static type inference
ccxt,ccxt,Python,42936,8697,1320,3319,False,True,True,True,A cryptocurrency trading API with more than 100 exchanges in JavaScript / TypeScript / Python / C# / PHP / Go / Java 
gradio,gradio-app,Python,42927,3489,261,2735,True,True,True,True,"Build and share delightful machine learning apps, all in Python. 🌟 Star to support our work!"
ray,ray-project,Python,42893,7690,3466,3520,False,True,True,True,Ray is an AI compute engine. Ray consists of a core distributed runtime and a set of AI Libraries for accelerating ML workloads.
desktop,zen-browser,JavaScript,42873,1574,522,810,True,False,True,True,Welcome to a calmer internet
python-patterns,faif,Python,42802,7015,14,5122,False,False,True,True,A collection of design patterns/idioms in Python
daily_stock_analysis,ZhuLinsen,Python,42699,40439,34,157,False,True,True,True,LLM驱动的 A/H/美股智能分析：多数据源行情 + 实时新闻 + LLM决策仪表盘 + 多渠道推送，零成本定时运行，纯白嫖. LLM-powered stock analysis system for A/H/US markets.
FlClash,chen08209,Dart,42587,2672,855,1036,False,False,True,True,"A multi-platform proxy client based on ClashMeta,simple and easy to use, open-source and ad-free."
system_prompts_leaks,asgeirtj,JavaScript,42549,7070,27,409,False,True,True,True,"Extracted system prompts from Anthropic - Claude Fable 5, Opus 4.8, Claude Code, Claude Design. OpenAI - ChatGPT 5.5 Thinking, GPT 5.5 Instant, Codex. Google - Gemini 3.5 Flash, 3.1 Pro, Antigravity. xAI - Grok, Cursor, Copilot, VS Code, Perplexity, and more. Updated regularly."
DeepSpeed,deepspeedai,Python,42528,4859,1302,2335,True,True,True,True,"DeepSpeed is a deep learning optimization library that makes distributed training and inference easy, efficient, and effective."
data-engineering-zoomcamp,DataTalksClub,Jupyter Notebook,42477,8408,0,1698,False,False,True,True,Data Engineering Zoomcamp is a free 9-week course on building production-ready data pipelines. The next cohort starts in January 2026. Join the course here 👇🏼
git-flight-rules,k88hudson,,42472,3173,14,4346,False,False,False,True,Flight rules for git
Fabric,danielmiessler,Go,42399,4173,60,894,True,True,True,True,Fabric is an open-source framework for augmenting humans using AI. It provides a modular system for solving specific problems using a crowdsourced set of AI prompts that can be used anywhere.
Alamofire,Alamofire,Swift,42385,7670,43,4338,False,True,True,True,Elegant HTTP Networking in Swift
diagrams,mingrammer,Python,42357,2726,385,2325,False,True,True,True,:art: Diagram as Code for prototyping cloud system architectures
ailearning,apachecn,Python,42319,11542,4,3397,False,False,False,True,AiLearning：数据分析+机器学习实战+线性代数+PyTorch+NLTK+TF2
puter,HeyPuter,TypeScript,42314,3890,23,835,False,True,True,True,"🌐 The Internet Computer! Free, Open-Source, and Self-Hostable."
GitNexus,abhigyanpatwari,TypeScript,42243,4782,261,317,False,True,True,True,"GitNexus: The Zero-Server Code Intelligence Engine -       GitNexus is a client-side knowledge graph creator that runs entirely in your browser. Drop in a git repository (Github, Gitlab, Azure, Local) or ZIP file, and get an interactive knowledge graph with a built in Graph RAG Agent. Perfect for code exploration"
paperless-ngx,paperless-ngx,Python,42164,2812,8,1584,True,True,True,True,"A community-supported supercharged document management system: scan, index and archive all your documents"
curl,curl,C,42137,7239,39,5933,True,True,True,True,"A command line tool and library for transferring data with URL syntax, supporting DICT, FILE, FTP, FTPS, GOPHER, GOPHERS, HTTP, HTTPS, IMAP, IMAPS, LDAP, LDAPS, MQTT, MQTTS, POP3, POP3S, RTSP, SCP, SFTP, SMB, SMBS, SMTP, SMTPS, TELNET, TFTP, WS and WSS. libcurl offers a myriad of powerful features"
HEU_KMS_Activator,zbezj,,41963,3879,173,2550,False,False,False,True,
swiper,nolimits4web,JavaScript,41853,9654,247,5206,True,True,False,True,Most modern mobile touch slider with hardware accelerated transitions
hexo,hexojs,TypeScript,41758,26,96,5013,True,True,True,True,"A fast, simple & powerful blog framework, powered by Node.js."
data-engineer-handbook,DataExpert-io,Jupyter Notebook,41685,7876,39,939,False,False,False,True,This is a repo with links to everything you'd ever want to learn about data engineering
fastlane,fastlane,Ruby,41663,6012,750,4213,True,True,True,True,🚀 The easiest way to automate building and releasing your iOS and Android apps
vnpy,vnpy,Python,41657,11904,13,4124,True,False,True,True,基于Python的开源量化交易平台开发框架
WeChatMsg,LC044,,41653,5206,25,1252,False,False,False,True,
pure-bash-bible,dylanaraps,Shell,41647,3627,62,2925,False,True,False,True,📖 A collection of pure bash alternatives to external processes.
black,psf,Python,41558,2777,285,3015,True,True,True,True,The uncompromising Python code formatter
uni-app,dcloudio,Objective-C,41544,3710,691,2895,False,True,True,True,A cross-platform framework using Vue.js
dubbo,apache,Java,41517,26429,994,5110,True,True,True,True,The java implementation of Apache Dubbo. An RPC and microservice framework.
yarn,yarnpkg,JavaScript,41504,2724,2057,3800,True,True,True,True,The 1.x line is frozen - features and bugfixes now happen on https://github.com/yarnpkg/berry
cheat.sh,chubin,Python,41459,1915,144,3326,False,True,True,True,the only cheat sheet you need
ColossalAI,hpcaitech,Python,41397,4512,500,1691,False,True,True,True,"Making large AI models cheaper, faster and more accessible"
BettaFish,666ghj,Python,41394,7589,33,714,True,True,True,True,微舆：人人可用的多Agent舆情分析助手，打破信息茧房，还原舆情原貌，预测未来走向，辅助决策！从0实现，不依赖任何框架。
lossless-cut,mifi,TypeScript,41355,2010,255,3515,False,True,True,True,The swiss army knife of lossless video/audio editing
aria2,aria2,C++,41210,3865,1147,5679,False,False,True,True,"aria2 is a lightweight multi-protocol & multi-source, cross platform download utility operated in command-line. It supports HTTP/HTTPS, FTP, SFTP, BitTorrent and Metalink."
nw.js,nwjs,JavaScript,41184,3852,897,5277,False,False,False,True,Call all Node.js modules directly from DOM/WebWorker and enable a new way of writing applications with all Web technologies.
tabler,tabler,HTML,41180,4369,140,3056,True,False,True,True,Tabler is free and open-source HTML Dashboard UI Kit built on Bootstrap
react-bits,DavidHDev,JavaScript,41172,1884,6,679,False,True,True,True,"An open source collection of animated, interactive & fully customizable React components for building memorable websites."
daisyui,saadeghi,Svelte,41121,1637,65,2025,False,True,True,True,"🌼 🌼 🌼 🌼 🌼  The most popular, free and open-source Tailwind CSS component library"
styled-components,styled-components,TypeScript,41093,2529,12,3591,True,True,True,True,"Fast, expressive styling for React. Server components, client components, streaming SSR, React Native—one API."
vue2-elm,bailicangdu,Vue,41061,12275,121,3462,False,False,True,True,Large single page application with 45 pages built on vue2 + vuex. 基于 vue2 + vuex 构建一个具有 45 个页面的大型单页面应用
ChatGLM-6B,zai-org,Python,41039,5141,608,1190,False,False,False,True,ChatGLM-6B: An Open Bilingual Dialogue Language Model | 开源双语对话语言模型
airi,moeru-ai,TypeScript,41026,4131,177,561,True,True,True,True,"💖🧸 Self hosted, you-owned Grok Companion, a container of souls of waifu, cyber livings to bring them into our worlds, wishing to achieve Neuro-sama's altitude. Capable of realtime voice chat, Minecraft, Factorio playing. Web / macOS / Windows supported."
vuetify,vuetifyjs,TypeScript,41001,7132,520,3564,True,True,True,True,🐉 Vue Component Framework
dive-into-llms,Lordog,Jupyter Notebook,40940,4986,14,798,False,False,False,True,《动手学大模型Dive into LLMs》系列编程实践教程
cobalt,imputnet,Svelte,40894,3491,249,1438,False,True,True,True,best way to save what you love
antigravity-awesome-skills,sickn33,Python,40845,6589,5,152,True,True,True,True,"Installable GitHub library of 1,500+ agentic skills for Claude Code, Cursor, Codex CLI, Gemini CLI, Antigravity, and more. Includes specialized plugins, installer CLI, bundles, workflows, and official/community skill collections."
free,freefq,,40834,5638,580,2200,False,False,False,True,翻墙、免费翻墙、免费科学上网、免费节点、免费梯子、免费ss/v2ray/trojan节点、蓝灯、谷歌商店、翻墙梯子
3x-ui,MHSanaei,Go,40757,7641,66,1222,False,True,True,True,"Xray panel supporting multi-protocol multi-user expire day & traffic & IP limit (Vmess, Vless, Trojan, ShadowSocks, Wireguard, Hysteria, Tunnel, Mixed, HTTP, Tun) "
agno,agno-agi,Python,40711,5530,931,1503,True,True,True,True,"Build, run, and manage agent platforms."
zju-icicles,QSCTech,HTML,40604,9575,10,3639,False,False,True,True,浙江大学课程攻略共享计划
50projects50days,bradtraversy,CSS,40579,9748,48,2037,False,False,False,True,"50+ mini web projects using HTML, CSS & JS"
vim,vim,Vim Script,40515,6074,1638,3954,False,True,True,True,The official Vim repository
chatbox,chatboxai,TypeScript,40490,4110,1184,1197,False,False,True,True,Powerful AI Client
remote-jobs,remoteintech,JavaScript,40478,3949,14,3899,True,True,True,True,Source for remoteintech.company — a community-maintained directory of remote-friendly tech companies
chakra-ui,chakra-ui,TypeScript,40438,3615,15,2494,True,True,True,True,Chakra UI is a component system for building SaaS products with speed ⚡️
trpc,trpc,TypeScript,40343,1624,233,2159,False,True,True,True,🧙‍♀️  Move Fast and Break Nothing. End-to-end typesafe APIs made easy. 
wrk,wg,C,40327,3031,204,5200,False,False,True,True,Modern HTTP benchmarking tool
faiss,facebookresearch,C++,40296,4421,279,3415,True,True,True,True,A library for efficient similarity search and clustering of dense vectors.
Awesome-Design-Tools,goabstract,JavaScript,40269,2276,160,2680,False,False,True,True,The best design tools and plugins for everything 👉
tidb,pingcap,Go,40165,6194,6313,3936,True,True,True,True,"TiDB is built for agentic workloads that grow unpredictably, with ACID guarantees and native support for transactions, analytics, and vector search. No data silos. No noisy neighbors. No infrastructure ceiling."
php-src,php,C,40150,8071,1847,5479,False,True,True,True,The PHP Interpreter
headscale,juanfont,Go,40059,2192,113,2185,True,True,True,True,"An open source, self-hosted implementation of the Tailscale control server"
appsmith,appsmithorg,TypeScript,40051,4606,4463,2177,True,True,True,True,"Platform to build admin panels, internal tools, and dashboards. Integrates with 25+ databases and any API."
CL4R1T4S,elder-plinius,,40037,7815,110,468,False,False,False,True,"LEAKED SYSTEM PROMPTS FOR CHATGPT, CLAUDE, GEMINI, GROK, PERPLEXITY, CURSOR, LOVABLE, REPLIT, AND MORE! - AI SYSTEMS TRANSPARENCY FOR ALL! 👐"
bert,google-research,Python,40029,9701,880,2790,False,True,False,True,TensorFlow code and pre-trained models for BERT
awesome-cursorrules,PatrickJS,JavaScript,39998,3418,22,637,True,True,True,True,📄  Configuration files that enhance Cursor AI editor experience with custom rules and behaviors
esbuild,evanw,Go,39931,1312,616,3653,False,False,True,True,An extremely fast bundler for the web
fiber,gofiber,Go,39847,1995,51,2343,True,True,True,True,⚡️ Express inspired web framework written in Go
photoprism,photoprism,Go,39816,2295,459,3061,True,True,True,True,AI-Powered Photos App for the Decentralized Web 🌈💎✨
gorm,go-gorm,Go,39799,4154,536,4616,True,False,True,True,"The fantastic ORM library for Golang, aims to be developer friendly"
video.js,videojs,JavaScript,39795,7494,664,5876,True,True,True,True,Video.js - open source HTML5 video player
phaser,phaserjs,JavaScript,39788,7142,113,4812,True,True,True,True,"Phaser is a fun, free and fast 2D game framework for making HTML5 games for desktop and mobile web browsers, supporting Canvas and WebGL rendering."
nushell,nushell,Rust,39741,2156,1435,2593,True,True,True,True,A new type of shell
stats,exelban,Swift,39683,1377,15,2574,False,False,True,True,macOS system monitor in your menu bar
Xray-core,XTLS,Go,39595,5495,56,2044,True,False,True,True,"Xray, Penetrates Everything. Also the best v2ray-core. Where the magic happens. An open platform for various uses."
shellcheck,koalaman,Haskell,39571,1924,1230,4959,False,False,True,True,"ShellCheck, a static analysis tool for shell scripts"
gkd,gkd-kit,Kotlin,39523,1875,7,1078,False,False,True,True,"基于无障碍，高级选择器，订阅规则的自定义屏幕点击安卓应用 | An Android APP with custom screen tapping based on Accessibility, Advanced Selectors, and Subscription Rules"
Deep-Learning-Papers-Reading-Roadmap,floodsung,Python,39518,7292,92,3531,False,False,False,True,Deep Learning papers reading roadmap for anyone who are eager to learn this amazing tech!
FastChat,lm-sys,Python,39471,4789,1014,1185,False,False,True,True,"An open platform for training, serving, and evaluating large language models. Release repo for Vicuna and Chatbot Arena."
ChatTTS,2noise,Python,39459,4246,62,749,False,False,True,True,A generative speech model for daily dialogue.
yazi,sxyazi,Rust,39444,900,70,1073,True,True,True,True,"💥 Blazing fast terminal file manager written in Rust, based on async I/O."
styleguide,google,HTML,39368,12969,170,4044,True,True,True,True,Style guides for Google-originated open-source projects
it-tools,CorentinTh,Vue,39340,5028,805,2262,False,False,True,True,"Collection of handy online tools for developers, with great UX. "
BitNet,microsoft,Python,39325,3596,319,679,True,False,True,True,Official inference framework for 1-bit LLMs
minds,mindsdb,Makefile,39311,6210,88,2874,True,True,True,True,"General-purpose AI designed for knowledge workers — creators, strategists, and operators — and individuals seeking AI systems they can truly control to help them get work done, with full flexibility to extend and deploy anywhere (VPC, on-prem, or cloud)."
sniffnet,GyulyVGC,Rust,39309,1668,59,1415,True,True,True,True,Comfortably monitor your Internet traffic 🕵️‍♂️
LibreChat,danny-avila,TypeScript,39252,8054,506,1220,True,True,True,True,"Enhanced ChatGPT Clone: Features Agents, MCP, Skills, DeepSeek, Anthropic, AWS, OpenAI, Responses API, Azure, Groq, o1, GPT-5, Mistral, OpenRouter, Vertex AI, Gemini, Artifacts, AI model switching, message search, Code Interpreter, langchain, DALL-E-3, OpenAPI Actions, Functions, Secure Multi-User Auth, Presets, open-source for self-hosting. Active"
quivr,QuivrHQ,Python,39164,3727,27,1130,False,False,True,True,"Opiniated RAG for integrating GenAI in your apps 🧠   Focus on your product rather than the RAG. Easy integration in existing products with customisation!  Any LLM: GPT4, Groq, Llama. Any Vectorstore: PGVector, Faiss. Any Files. Anyway you want."
bark,suno-ai,Jupyter Notebook,39160,4683,269,1165,False,False,False,True,🔊 Text-Prompted Generative Audio Model
leveldb,google,C++,39151,8203,395,4310,True,True,True,True,LevelDB is a fast key-value storage library written at Google that provides an ordered mapping from string keys to string values.
novu,novuhq,TypeScript,39135,4330,99,1754,True,True,True,True,The open-source communication infrastructure for agents and products
devdocs,freeCodeCamp,Ruby,39074,2604,236,4617,True,True,True,True,API Documentation Browser
halo,halo-dev,Java,39050,10298,150,3008,True,True,True,True,Halo 是一款强大易用的开源建站工具，从个人博客、知识库，到企业官网、在线商城，Halo 都能助您轻松实现，一站式满足您的多样化建站需求。
manim,ManimCommunity,Python,39023,2912,502,2219,True,True,True,True,A community-maintained Python framework for creating mathematical animations. 
new-api,QuantumNous,Go,38985,8854,849,948,True,False,True,True,"A unified AI model hub for aggregation & distribution. It supports cross-converting various LLMs into OpenAI-compatible, Claude-compatible, or Gemini-compatible formats. A centralized gateway for personal and enterprise model management. 🍥"
outline,outline,TypeScript,38944,3351,49,3676,True,False,True,True,"The fastest knowledge base for growing teams. Beautiful, realtime collaborative, feature packed, and markdown compatible."
ink,vadimdemedes,TypeScript,38930,1013,30,3291,True,True,True,True,🌈 React for interactive command-line apps
materialize,Dogfalo,JavaScript,38864,4632,793,4294,True,True,True,True,"Materialize, a CSS Framework based on Material Design"
llvm-project,llvm,LLVM,38834,17496,37007,3477,True,True,True,True,The LLVM Project is a collection of modular and reusable compiler and toolchain technologies.
duckdb,duckdb,C++,38797,3322,557,2911,True,True,True,True,DuckDB is an analytical in-process SQL database management system
polars,pola-rs,Rust,38780,2887,2798,2224,True,True,True,True,"Extremely fast Query Engine for DataFrames, written in Rust"
awesome-system-design-resources,ashishps1,Java,38769,8331,13,965,False,False,False,True,Learn System Design concepts and prepare for interviews using free resources.
googletest,google,C++,38714,10791,568,3975,True,True,True,True,GoogleTest - Google Testing and Mocking Framework
impeccable,pbakaus,JavaScript,38712,2136,32,212,False,False,True,True,The design language that makes your AI harness better at design.
preact,preactjs,JavaScript,38699,2035,149,3931,True,True,True,True,⚛️ Fast 3kB React alternative with the same modern API. Components & Virtual DOM.
NewPipe,TeamNewPipe,Java,38697,3638,1402,3938,False,True,True,True,A libre lightweight streaming front-end for Android.
openscreen,siddharthvaddem,TypeScript,38623,2740,49,249,False,True,True,True,"Create stunning demos for free. Open-source, no subscriptions, no watermarks, and free for commercial use. An alternative to Screen Studio. "
reactive-resume,amruthpillai,TypeScript,38600,4358,92,2273,False,False,True,True,"A one-of-a-kind resume builder that keeps your privacy in mind. Completely secure, customizable, portable, open-source and free forever. Try it out today!"
lapce,lapce,Rust,38564,1291,887,3051,False,True,True,True,Lightning-fast and Powerful Code Editor written in Rust
python-cheatsheet,gto76,Python,38499,6709,0,3064,False,False,True,True,Comprehensive Python Cheatsheet
insomnia,Kong,TypeScript,38496,2279,860,3706,True,True,True,True,"The open-source, cross-platform API client for GraphQL, REST, WebSockets, SSE and gRPC. With Cloud, Local and Git storage."
Folo,RSSNext,TypeScript,38489,2088,372,799,True,True,True,True,🧡 Folo is the AI RSS Reader
GPT_API_free,chatanywhere,,38459,2649,19,1149,False,False,False,True,Free ChatGPT&DeepSeek API Key，免费ChatGPT&DeepSeek API。免费接入DeepSeek API和GPT4 API，支持 gpt | deepseek | claude | gemini | grok 等排名靠前的常用大模型。
CodeWhale,Hmbown,Rust,38449,3304,301,147,True,True,True,True,"Open-source, community-driven agent harness"
metasploit-framework,rapid7,Ruby,38406,14878,596,5404,True,True,True,True,Metasploit Framework
ant-design-pro,ant-design,TypeScript,38401,8247,45,3216,True,False,True,True,👨🏻‍💻👩🏻‍💻 Use Ant Design like a Pro!
Sunshine,LizardByte,C++,38321,2013,137,1643,True,True,True,True,Self-hosted game stream host for Moonlight.
spacedrive,spacedriveapp,Rust,38319,1293,34,1723,True,True,True,True,"Spacedrive is an open source cross-platform file explorer, powered by a virtual distributed filesystem written in Rust."
engineering-blogs,kilimchoi,Ruby,38300,2023,148,4020,False,True,True,True,A curated list of engineering blogs
istio,istio,Go,38225,8324,466,3496,False,True,True,True,"Connect, secure, control, and observe services."
cli,httpie,Python,38209,3944,292,5224,True,True,True,True,"🥧 HTTPie CLI  — modern, user-friendly command-line HTTP client for the API era. JSON support, colors, sessions, downloads, plugins & more."
MPAndroidChart,PhilJay,Java,38200,8992,2191,4434,False,True,False,True,"A powerful 🚀 Android chart view / graph view library, supporting line- bar- pie- radar- bubble- and candlestick charts as well as scaling, panning and animations."
qBittorrent,qbittorrent,C++,38193,4727,2638,5245,False,True,True,True,qBittorrent BitTorrent client
impress.js,impress,JavaScript,38184,6589,59,5283,False,False,True,True,It's a presentation framework based on the power of CSS3 transforms and transitions in modern browsers and inspired by the idea behind prezi.com.
