repo_name,organization,language,stars,forks,open_issues,age_days,has_coc,has_contributing,has_workflows,has_readme,description
Semantic-UI,Semantic-Org,JavaScript,51101,4879,1072,4770,False,True,False,True,Semantic is a UI component framework based around useful principles from natural language.
go-ethereum,ethereum,Go,51009,21892,413,4508,False,True,True,True,Go implementation of the Ethereum protocol
jellyfin,jellyfin,C#,50901,4724,853,2699,True,True,True,True,The Free Software Media System - Server Backend & API
awesome-wechat-weapp,justjavac,,50868,9010,2,3507,False,False,False,True,微信小程序开发资源汇总 :100:
lazydocker,jesseduffield,Go,50868,1608,273,2539,True,True,True,True,The lazier way to manage everything docker
100-Days-Of-ML-Code,Avik-Jain,,50813,11498,67,2856,True,True,False,True,100 Days of ML Coding
professional-programming,charlax,Python,50774,3966,1,3828,False,True,False,True,A collection of learning resources for curious software engineers
hiring-without-whiteboards,poteto,JavaScript,50587,3885,38,3334,True,True,True,True,⭐️  Companies that don't have a broken hiring process
lx-music-desktop,lyswhut,TypeScript,50570,6770,1138,2451,False,False,True,True,一个基于 Electron 的音乐软件
mempalace,MemPalace,Python,50560,6645,515,26,False,True,True,True,The best-benchmarked open-source AI memory system. And it's free.
odoo,odoo,Python,50404,32235,9614,4370,False,True,False,True,Odoo. Open Source Apps To Grow Your Business.
crewAI,crewAIInc,Python,50387,6939,386,917,False,True,True,True,"Framework for orchestrating role-playing, autonomous AI agents. By fostering collaborative intelligence, CrewAI empowers agents to work together seamlessly, tackling complex tasks."
skills,mattpocock,Shell,50113,4116,5,86,False,False,True,True,Skills for Real Engineers. Straight from my .claude directory.
bulma,jgthms,CSS,50078,3901,522,3750,False,True,True,True,Modern CSS framework based on Flexbox
open-source-ios-apps,dkhamsing,,50046,5763,2,4112,False,True,True,True,:iphone: Collaborative List of Open-Source iOS Apps
claude-code-best-practice,shanraisshan,HTML,49961,4974,14,181,False,False,True,True,from vibe coding to agentic engineering - practice makes claude perfect
mastodon,mastodon,Ruby,49897,7435,4443,3720,True,True,True,True,"Your self-hosted, globally interconnected microblogging community"
dbeaver,dbeaver,Java,49815,4152,3316,3844,True,True,True,True,Free universal database tool and SQL client
warp,warpdotdev,Rust,49760,3272,3274,1757,True,True,True,True,"Warp is an agentic development environment, born out of the terminal."
Mole,tw93,Shell,49675,1534,0,219,False,True,True,True,🐹 Deep clean and optimize your Mac.
freqtrade,freqtrade,Python,49626,10344,32,3270,False,True,True,True,"Free, open source crypto trading bot"
cypress,cypress-io,TypeScript,49622,3396,1220,4076,True,True,True,True,"Fast, easy and reliable testing for anything that runs in a browser."
json,nlohmann,C++,49537,7376,103,4683,True,True,True,True,JSON for Modern C++
hacker-scripts,NARKOZ,JavaScript,49468,6645,69,3813,False,False,False,True,Based on a true story
alist,AlistGo,Go,49390,7945,567,1954,True,True,True,True,"🗂️A file list/WebDAV program that supports multiple storages, powered by Gin and Solidjs. / 一个支持多存储的文件列表/WebDAV程序，使用 Gin 和 Solidjs。"
query,TanStack,TypeScript,49291,3802,160,2424,False,True,True,True,"🤖 Powerful asynchronous state management, server-state utilities and data fetching for the web. TS/JS, React Query, Solid Query, Svelte Query and Vue Query."
whisper.cpp,ggml-org,C++,49225,5476,1190,1313,False,False,True,True,Port of OpenAI's Whisper model in C/C++
huginn,huginn,Ruby,49214,4252,696,4800,False,False,True,True,Create agents that monitor and act on your behalf.  Your agents are standing by!
expo,expo,TypeScript,49121,12012,894,3545,False,True,True,True,"An open-source framework for making universal native apps with React. Expo runs on Android, iOS, and the web."
llama_index,run-llama,Python,49067,7337,312,1276,True,True,True,True,LlamaIndex is the leading document agent and OCR platform
MediaCrawler,NanmiCoder,Python,48713,10395,154,1056,False,False,True,True,小红书笔记 | 评论爬虫、抖音视频 | 评论爬虫、快手视频 | 评论爬虫、B 站视频 ｜ 评论爬虫、微博帖子 ｜ 评论爬虫、百度贴吧帖子 ｜ 百度贴吧评论回复爬虫  | 知乎问答文章｜评论爬虫
minimind,jingyaogong,Python,48665,6156,30,643,True,False,True,True,🚀 「大模型」2小时完全从0训练64M的小参数LLM！🌏 Train a 64M-parameter LLM from scratch in just 2h!
julia,JuliaLang,Julia,48649,5766,4713,5488,True,True,True,True,The Julia Programming Language
pandas,pandas-dev,Python,48635,19889,3393,5729,True,True,True,True,"Flexible and powerful data analysis / manipulation library for Python, providing labeled data structures similar to R data.frame objects, statistical functions, and much more"
dayjs,iamkun,JavaScript,48633,2428,1208,2942,False,True,True,True,⏰ Day.js 2kB immutable date-time library alternative to Moment.js with the same modern API
OpenCut,OpenCut-app,TypeScript,48613,5172,296,312,True,True,True,True,The open-source CapCut alternative
plane,makeplane,TypeScript,48590,4135,749,1258,True,True,True,True,"🔥🔥🔥 Open-source Jira, Linear, Monday, and ClickUp alternative. Plane is a modern project management platform to manage tasks, sprints, docs, and triage."
algorithm-visualizer,algorithm-visualizer,JavaScript,48520,7589,78,3638,True,True,False,True,:fireworks:Interactive Online Platform that Visualizes Algorithms from Code
open-source-mac-os-apps,serhii-londar,,48388,2534,68,3101,False,True,True,True,🚀 Awesome list of open source applications for macOS. https://t.me/s/opensourcemacosapps
chinese-independent-developer,1c7,,48319,4138,1,3143,False,True,True,True,👩🏿‍💻👨🏾‍💻👩🏼‍💻👨🏽‍💻👩🏻‍💻中国独立开发者项目列表 -- 分享大家都在做什么
jadx,skylot,Java,48307,5502,418,4791,True,True,True,True,Dex to Java decompiler
terraform,hashicorp,Go,48296,10329,1891,4431,True,True,True,True,"Terraform enables you to safely and predictably create, change, and improve infrastructure. It is a source-available tool that codifies APIs into declarative configuration files that can be shared amongst team members, treated as code, edited, reviewed, and versioned."
RxJava,ReactiveX,Java,48287,7589,20,4860,False,True,True,True,RxJava – Reactive Extensions for the JVM – a library for composing asynchronous and event-based programs using observable sequences for the Java VM.
Pake,tw93,Rust,48258,9660,2,1294,True,True,True,True,🤱🏻 Turn any webpage into a desktop app with one command.
Fooocus,lllyasviel,Python,48251,7866,293,995,False,False,True,True,Focus on prompting and generating
x64dbg,x64dbg,C++,48246,2726,570,4037,True,True,True,True,An open-source user mode debugger for Windows. Optimized for reverse engineering and malware analysis.
kubernetes-the-hard-way,kelseyhightower,,48094,15634,49,3584,False,True,False,True,Bootstrap Kubernetes the hard way. No scripts.
type-challenges,type-challenges,TypeScript,48023,5250,33168,2107,True,False,True,True,Collection of TypeScript type challenges with online judge
moment,moment,JavaScript,47985,7001,297,5540,False,True,True,True,"Parse, validate, manipulate, and display dates in javascript."
htmx,bigskysoftware,JavaScript,47925,1589,657,2208,False,True,True,True,</> htmx - high power tools for HTML
brew,Homebrew,Ruby,47802,11088,16,3708,True,True,True,True,🍺 The missing package manager for macOS (or Linux)
awesome-java,akullpp,,47796,7666,4,4313,False,True,True,True,"A curated list of awesome frameworks, libraries and software for the Java programming language."
design-patterns-for-humans,nilbuild,,47783,5510,16,3360,False,False,False,True,An ultra-simplified explanation to design patterns
PythonDataScienceHandbook,jakevdp,Jupyter Notebook,47720,18886,231,3550,True,True,False,True,Python Data Science Handbook: full text in Jupyter Notebooks
awesome-openclaw-skills,VoltAgent,,47671,4670,18,95,False,True,True,True,"The awesome collection of OpenClaw skills. 5,400+ skills filtered and categorized from the official OpenClaw Skills Registry.🦞"
big-list-of-naughty-strings,minimaxir,Python,47634,2160,108,3918,False,False,False,True,The Big List of Naughty Strings is a list of strings which have a high probability of causing issues when used as user-input data.
Projects,karan,,47622,10645,117,4683,False,True,False,True,:page_with_curl: A list of practical projects that anyone can solve in any programming language.
gogs,gogs,Go,47502,5057,987,4461,False,True,True,True,Gogs is a painless self-hosted Git service
Made-With-ML,GokuMohandas,Jupyter Notebook,47462,7467,24,2734,False,False,True,True,"Learn how to develop, deploy and iterate on production-grade ML applications."
awesome-react-components,brillout,,47431,3758,44,3597,True,True,True,True,Curated List of React Components & Libraries.
ruff,astral-sh,Rust,47317,2034,1953,1360,True,True,True,True,"An extremely fast Python linter and code formatter, written in Rust."
ClickHouse,ClickHouse,C++,47147,8360,5989,3619,True,True,True,True,ClickHouse® is a real-time analytics database management system
awesome-design-patterns,DovAmir,,47140,3234,23,2887,False,True,False,True,A curated list of software and architecture related design patterns.
metabase,metabase,Clojure,47128,6422,4102,4105,False,True,True,True,The easy-to-use open source Business Intelligence and Embedded Analytics tool that lets everyone work with data :bar_chart:
penpot,penpot,Clojure,47112,2854,610,3775,True,True,True,True,Penpot: The open-source design tool for design and code collaboration
AI-For-Beginners,microsoft,Jupyter Notebook,47092,9675,2,1884,True,False,True,True,"12 Weeks, 24 Lessons, AI for All!"
quill,slab,TypeScript,47087,3631,645,5022,True,True,True,True,Quill is a modern WYSIWYG editor built for compatibility and extensibility
pixijs,pixijs,TypeScript,47082,5008,324,4847,True,True,True,True,"The HTML5 Creation Engine: Create beautiful digital content with the fastest, most flexible 2D WebGL renderer."
react,typescript-cheatsheets,JavaScript,47039,4294,1,2890,True,True,True,True,Cheatsheets for experienced React developers getting started with TypeScript
okhttp,square,Kotlin,46947,9270,106,5029,False,True,True,True,"Square’s meticulous HTTP client for the JVM, Android, and GraalVM."
discourse,discourse,Ruby,46940,8898,146,4857,True,True,True,True,"A platform for community discussion. Free, open, simple."
serverless,serverless,JavaScript,46916,5736,1232,4028,True,True,True,True,"⚡ Serverless Framework – Effortlessly build apps that auto-scale, incur zero costs when idle, and require minimal maintenance using AWS Lambda and other managed cloud services."
textgen,oobabooga,Python,46905,5965,785,1227,False,False,True,True,"The original local LLM interface. Text, vision, tool-calling, training. UI + API, 100% offline and private."
v2ray-core,v2ray,Go,46856,8856,18,3891,True,False,True,True,A platform for building proxies to bypass network restrictions.
tldraw,tldraw,TypeScript,46727,3182,341,1817,True,True,True,True,very good whiteboard infinite canvas SDK
frontend-dev-bookmarks,dypsilon,,46588,5147,123,4695,False,True,False,True,Manually curated collection of resources for frontend web developers.
acme.sh,acmesh-official,Shell,46454,5561,1392,3778,False,False,True,True,A pure Unix shell script ACME client for SSL / TLS certificate automation
legado,gedoor,Kotlin,46325,5306,62,2536,False,False,True,True,"Legado 3.0 Book Reader with powerful controls & full functions❤️阅读3.0, 阅读是一款可以自定义来源阅读网络内容的工具，为广大网络文学爱好者提供一种方便、快捷舒适的试读体验。"
GitHubDaily,GitHubDaily,,46307,4636,583,2678,False,False,False,True,"坚持分享 GitHub 上高质量、有趣实用的开源技术教程、开发者工具、编程网站、技术资讯。A list cool, interesting projects of GitHub."
30-Days-Of-JavaScript,Asabeneh,JavaScript,46284,10444,369,2320,False,False,False,True,"30 days of JavaScript programming challenge is a step-by-step guide to learn JavaScript programming language in 30 days. This challenge may take more than 100 days,  please just follow your own pace. These videos may help too: https://www.youtube.com/channel/UC7PNRuno1rzYPb1xLa4yktw"
nvm-windows,coreybutler,Go,46187,3806,81,4240,False,True,True,True,A node.js version management utility for Windows. Ironically written in Go.
slidev,slidevjs,TypeScript,46142,2039,189,1833,True,True,True,True,Presentation Slides for Developers
learn-regex,ziishaned,,46133,6192,65,3204,False,False,False,True,Learn regex the easy way
VibeVoice,microsoft,Python,46110,5098,150,248,True,True,True,True,Open-Source Frontier Voice AI
BMAD-METHOD,bmad-code-org,JavaScript,46107,5446,50,382,True,True,True,True,Breakthrough Method for Agile Ai Driven Development
JeecgBoot,jeecgboot,Java,46048,15961,11,2712,False,False,True,True,AI低代码平台，支持「低代码 + 零代码」双模式：零代码 5 分钟搭建业务系统，低代码模式一键生成前后端代码。 内置AI 应用，支持AI聊天、知识库、流程编排、MCP与插件，支持各种模型。Skills能力实现：一句话画流程图、设计表单、生成系统。 引领 AI生成→在线配置→代码生成→手工合并的开发模式，解决Java项目80%的重复工作，快速提高效率，又不失灵活性。
LocalAI,mudler,Go,45957,4036,155,1139,False,True,True,True,"LocalAI is the open-source AI engine. Run any model - LLMs, vision, voice, image, video - on any hardware. No GPU required."
monaco-editor,microsoft,JavaScript,45929,4058,813,3614,True,True,True,True,A browser based code editor
pretext,chenglou,TypeScript,45925,2539,82,54,False,False,True,True,"Fast, accurate & comprehensive text measurement & layout"
spotube,KRTirtho,Dart,45909,2060,788,1902,True,False,True,True,🎧 Open source music streaming app! Available for both desktop & mobile!
prisma,prisma,TypeScript,45861,2180,2580,2506,True,True,True,True,"Next-generation ORM for Node.js & TypeScript | PostgreSQL, MySQL, MariaDB, SQL Server, SQLite, MongoDB and CockroachDB"
bevy,bevyengine,Rust,45826,4532,3329,2294,True,True,True,True,A refreshingly simple data-driven game engine built in Rust
awesome-cheatsheets,LeCoupa,JavaScript,45738,6687,137,3095,False,False,True,True,"👩‍💻👨‍💻 Awesome cheatsheets for popular programming languages, frameworks and development tools. They include everything you should know in one single file."
architecture-samples,android,Kotlin,45650,11871,219,3737,False,True,True,True,A collection of samples to discuss and showcase different architectural tools and patterns for Android apps.
Win11Debloat,Raphire,PowerShell,45609,1856,33,2011,False,True,True,True,"A simple, lightweight PowerShell script that allows you to remove pre-installed apps, disable telemetry, as well as perform various other changes to declutter and customize your Windows experience. Win11Debloat works for both Windows 10 and Windows 11."
awesome-remote-job,lukasz-madon,,45504,4594,53,4137,False,True,True,True,A curated list of awesome remote jobs and resources. Inspired by https://github.com/vinta/awesome-python
zx,google,JavaScript,45453,1262,39,1822,True,True,True,True,A tool for writing better scripts
AdminLTE,ColorlibHQ,CSS,45375,18238,24,4510,True,True,True,True,AdminLTE - Free admin dashboard template based on Bootstrap 5
litellm,BerriAI,Python,45370,7694,2823,1009,False,True,True,True,"Python SDK, Proxy Server (AI Gateway) to call 100+ LLM APIs in OpenAI (or native) format, with cost tracking, guardrails, loadbalancing and logging. [Bedrock, Azure, OpenAI, VertexAI, Cohere, Anthropic, Sagemaker, HuggingFace, VLLM, NVIDIA NIM]"
twenty,twentyhq,TypeScript,45368,6273,101,1246,True,True,True,True,"The open alternative to Salesforce, designed for AI."
remotion,remotion-dev,TypeScript,45349,3082,97,2137,True,True,True,True,🎥      Make videos programmatically with React
jest,jestjs,TypeScript,45338,6648,244,4525,True,True,True,True,Delightful JavaScript Testing.
airflow,apache,Python,45250,16974,1718,4035,True,True,True,True,"Apache Airflow - A platform to programmatically author, schedule, and monitor workflows"
Rocket.Chat,RocketChat,TypeScript,45221,13541,3669,3999,True,True,True,True,The Secure CommsOS™ for mission-critical operations
TTS,coqui-ai,Python,45201,6065,7,2171,True,True,True,True,"🐸💬 - a deep learning toolkit for Text-to-Speech, battle-tested in research and production"
awesome-compose,docker,HTML,45061,8130,365,2268,False,True,True,True,Awesome Docker Compose samples
tmux,tmux,C,45033,2595,60,3984,False,True,True,True,tmux source code
upscayl,upscayl,TypeScript,44984,2186,57,1370,False,False,True,True,"🆙 Upscayl - #1 Free and Open Source AI Image Upscaler for Linux, MacOS and Windows."
Leaflet,Leaflet,JavaScript,44942,6116,545,5699,True,True,True,True,🍃 JavaScript library for mobile-friendly interactive maps 🇺🇦
CppCoreGuidelines,isocpp,CSS,44935,5543,247,3907,False,True,True,True,"The C++ Core Guidelines are a set of tried-and-true guidelines, rules, and best practices about coding in C++"
cherry-studio,CherryHQ,TypeScript,44834,4260,1122,707,True,True,True,True,"AI productivity studio with smart chat, autonomous agents, and 300+ assistants. Unified access to frontier LLMs"
meteor,meteor,JavaScript,44769,5256,357,5216,True,True,True,True,"Meteor, the JavaScript App Platform"
edex-ui,GitSquared,JavaScript,44740,3098,6,3379,False,False,True,True,"A cross-platform, customizable science fiction terminal emulator with advanced monitoring & touchscreen support."
grpc,grpc,C++,44694,11144,1305,4161,True,True,True,True,"C++ based gRPC (C++, Python, Ruby, Objective-C, PHP, C#)"
pyenv,pyenv,Shell,44693,3246,56,4990,False,True,True,True,Simple Python version management
react-hook-form,react-hook-form,TypeScript,44690,2392,128,2613,True,True,True,True,📋 React Hooks for form state management and validation (Web + React Native)
iina,iina,Swift,44668,2805,1908,3419,False,True,True,True,The modern video player for macOS.
hyper,vercel,TypeScript,44589,3549,1040,3591,False,False,True,True,A terminal built on web technologies
copyparty,9001,Python,44588,1816,248,2531,True,True,False,True,"Portable file server with accelerated resumable uploads, dedup, WebDAV, SFTP, FTP, TFTP, zeroconf, media indexer, thumbnails++ all in one file"
reactjs-interview-questions,sudheerj,JavaScript,44540,10357,14,2891,False,False,True,True,List of top 500 ReactJS Interview Questions & Answers....Coding exercise questions are coming soon!!
OpenSpec,Fission-AI,TypeScript,44475,3081,305,268,False,False,True,True,Spec-driven development (SDD) for AI coding assistants.
streamlit,streamlit,Python,44408,4220,1306,2442,True,True,True,True,Streamlit — A faster way to build and share data apps.
Summer2026-Internships,SimplifyJobs,Python,44382,3177,5,2168,False,True,True,True,Collection of Summer 2026 tech internships!
TrafficMonitor,zhongyang219,C++,44255,3672,1294,3197,False,False,True,True,这是一个用于显示当前网速、CPU及内存利用率的桌面悬浮窗软件，并支持任务栏显示，支持更换皮肤。
exo,exo-explore,Python,44255,3106,200,675,False,True,True,True,Run frontier AI locally.
helix,helix-editor,Rust,44193,3440,1524,2160,False,True,True,True,A post-modern modal text editor.
aider,Aider-AI,Python,44181,4333,1513,1087,False,True,True,True,aider is AI pair programming in your terminal
cli,cli,Go,44153,8356,989,2401,True,True,True,True,GitHub’s official command line tool
milvus,milvus-io,Go,44074,3985,1073,2418,True,True,True,True,"Milvus is a high-performance, cloud-native vector database built for scalable vector ANN search"
parcel,parcel-bundler,JavaScript,44031,2273,592,3188,True,True,True,True,The zero configuration build tool for the web. 📦🚀
build-web-application-with-golang,astaxie,Go,43979,10500,138,5019,False,False,False,True,A golang ebook intro how to build a web with golang
react-use,streamich,TypeScript,43969,3272,654,2742,False,True,True,True,React Hooks — 👍
front-end-interview-handbook,yangshun,MDX,43945,5956,11,3029,True,True,True,True,Front End interview preparation materials for busy engineers (updated for 2026)
CowAgent,zhayujie,Python,43920,10022,357,1362,False,False,True,True,CowAgent (chatgpt-on-wechat) 是基于大模型的超级AI助理，能主动思考和任务规划、访问操作系统和外部资源、创造和执行Skills、通过长期记忆和知识库不断成长，比OpenClaw更轻量和便捷。同时支持微信、飞书、钉钉、企微、QQ、公众号、网页等接入，可选择DeepSeek/OpenAI/Claude/Gemini/ MiniMax/Qwen/GLM/LinkAI，能处理文本、语音、图片和文件，可快速搭建个人AI助理和企业数字员工。
jsoncrack.com,AykutSarac,TypeScript,43916,3537,34,1551,True,True,True,True,"✨ Innovative and open-source visualization application that transforms various data formats, such as JSON, YAML, XML and CSV into interactive graphs."
retrofit,square,HTML,43905,7350,170,5715,False,True,True,True,A type-safe HTTP client for Android and the JVM
babel,babel,TypeScript,43895,5814,755,4232,True,True,True,True,🐠 Babel is a compiler for writing next generation JavaScript.
English-level-up-tips,byoungd,,43852,4640,23,3257,False,False,True,True,An advanced guide to learn English which might benefit you a lot 🎉 .  离谱的英语学习指南/英语学习教程/英语学习/学英语
Umi-OCR,hiroi-sora,Python,43821,4325,337,1495,False,False,False,True,"OCR software, free and offline. 开源、免费的离线OCR软件。支持截屏/批量导入图片，PDF文档识别，排除水印/页眉页脚，扫描/生成二维码。内置多国语言库。"
pandoc,jgm,Haskell,43811,3838,1069,5885,False,True,True,True,Universal markup converter
cobra,spf13,Go,43808,3137,365,4622,False,True,True,True,A Commander for modern Go CLI interactions
TensorFlow-Examples,aymericdamien,Jupyter Notebook,43781,14754,228,3823,False,False,False,True,TensorFlow Tutorial and Examples for Beginners (support TF v1 & v2)
RSSHub,DIYgod,TypeScript,43744,9701,360,2950,True,True,True,True,🧡 Everything is RSSible
EasySpider,NaiboWang,JavaScript,43743,5323,266,2113,False,False,True,True,A visual no-code/code-free web crawler/spider易采集：一个可视化浏览器自动化测试/数据采集/爬虫软件，可以无代码图形化的设计和执行爬虫任务。别名：ServiceWrapper面向Web应用的智能化服务封装系统。
sentry,getsentry,Python,43742,4675,2132,5722,True,True,True,True,Developer-first error tracking and performance monitoring
goose,aaif-goose,Rust,43609,4455,404,615,False,True,True,True,"an open source, extensible AI agent that goes beyond code suggestions - install, execute, edit, and test with any LLM"
fanqiang,bannedbook,Kotlin,43468,7720,322,4125,False,False,True,True,翻墙-科学上网
bruno,usebruno,JavaScript,43417,2370,1655,1311,False,True,True,True,Opensource IDE For Exploring and Testing API's (lightweight alternative to Postman/Insomnia)
mitmproxy,mitmproxy,Python,43346,4536,431,5918,True,True,True,True,An interactive TLS-capable intercepting HTTP proxy for penetration testers and software developers.
siyuan,siyuan-note,TypeScript,43308,2742,366,2069,True,True,True,True,"A privacy-first, self-hosted, fully open source personal knowledge management software, written in typescript and golang."
kong,Kong,Lua,43295,5123,137,4182,True,True,True,True,🦍 The API and AI Gateway
pi-mono,badlogic,TypeScript,43295,5078,15,264,False,True,True,True,"AI agent toolkit: coding agent CLI, unified LLM API, TUI & web UI libraries, Slack bot, vLLM pods"
fuels-rs,FuelLabs,Rust,43229,1360,68,1642,False,False,True,True,Fuel Network Rust SDK
Files,files-community,C#,43226,2704,524,2673,True,True,True,True,A modern file manager that helps users organize their files and folders.
spark,apache,Scala,43216,29167,365,4447,True,True,True,True,Apache Spark - A unified analytics engine for large-scale data processing
fuels-ts,FuelLabs,TypeScript,43202,1369,77,1700,True,True,True,True,Fuel Network Typescript SDK
pm2,Unitech,JavaScript,43105,2716,1103,4728,False,True,True,True,Node.js Production Process Manager with a built-in Load Balancer.
CPlusPlusThings,Light-City,C++,43090,8833,9,2482,False,False,False,True,C++那些事
system-design,karanpratapsingh,,43062,5515,3,1354,True,True,False,True,Learn how to design systems at scale and prepare for system design interviews
what-happens-when,alex,,43044,5733,2066,4558,False,False,True,True,"An attempt to answer the age old interview question ""What happens when you type google.com into your browser and press enter?"""
full-stack-fastapi-template,fastapi,TypeScript,42939,8472,28,2623,False,True,True,True,"Full stack, modern web application template. Using FastAPI, React, SQLModel, PostgreSQL, Docker, GitHub Actions, automatic HTTPS and more."
zig,ziglang,Zig,42883,3067,3161,3921,False,False,False,True,Moved to Codeberg
fd,sharkdp,Rust,42776,1054,177,3278,False,True,True,True,"A simple, fast and user-friendly alternative to 'find'"
python-patterns,faif,Python,42730,7032,15,5076,False,False,True,True,A collection of design patterns/idioms in Python
hyperswitch,juspay,Rust,42573,4609,1606,1291,True,True,True,True,"An open source payments switch written in Rust to make payments fast, reliable and affordable"
zod,colinhacks,TypeScript,42545,1929,87,2245,True,True,True,True,TypeScript-first schema validation with static type inference
