repo_name,organization,language,stars,forks,open_issues,age_days,has_coc,has_contributing,has_workflows,has_readme,description
ghostty,ghostty-org,Zig,50663,2338,238,1476,False,True,True,True,"👻 Ghostty is a fast, feature-rich, and cross-platform terminal emulator that uses platform-native UI and GPU acceleration."
lazydocker,jesseduffield,Go,50630,1597,267,2522,True,True,True,True,The lazier way to manage everything docker
hiring-without-whiteboards,poteto,JavaScript,50544,3885,38,3317,True,True,True,True,⭐️  Companies that don't have a broken hiring process
100-Days-Of-ML-Code,Avik-Jain,,50525,11446,66,2839,True,True,False,True,100 Days of ML Coding
jellyfin,jellyfin,C#,50299,4635,875,2682,True,True,True,True,The Free Software Media System - Server Backend & API
lx-music-desktop,lyswhut,TypeScript,50220,6737,1127,2434,False,False,True,True,一个基于 Electron 的音乐软件
TradingAgents,TauricResearch,Python,50194,9080,256,472,False,False,True,True,TradingAgents: Multi-Agents LLM Financial Trading Framework
odoo,odoo,Python,50077,32084,9487,4353,False,True,False,True,Odoo. Open Source Apps To Grow Your Business.
bulma,jgthms,CSS,50070,3904,521,3733,False,True,True,True,Modern CSS framework based on Flexbox
mastodon,mastodon,Ruby,49831,7434,4457,3703,True,True,True,True,"Your self-hosted, globally interconnected microblogging community"
open-source-ios-apps,dkhamsing,,49736,5759,0,4095,False,True,True,True,:iphone: Collaborative List of Open-Source iOS Apps
cypress,cypress-io,TypeScript,49618,3408,1218,4059,True,True,True,True,"Fast, easy and reliable testing for anything that runs in a browser."
dbeaver,dbeaver,Java,49558,4114,3266,3827,True,True,True,True,Free universal database tool and SQL client
hacker-scripts,NARKOZ,JavaScript,49450,6651,69,3796,False,False,False,True,Based on a true story
json,nlohmann,C++,49398,7357,105,4666,True,True,True,True,JSON for Modern C++
alist,AlistGo,Go,49304,7955,563,1937,True,True,True,True,"🗂️A file list/WebDAV program that supports multiple storages, powered by Gin and Solidjs. / 一个支持多存储的文件列表/WebDAV程序，使用 Gin 和 Solidjs。"
query,TanStack,TypeScript,49118,3777,156,2407,False,True,True,True,"🤖 Powerful asynchronous state management, server-state utilities and data fetching for the web. TS/JS, React Query, Solid Query, Svelte Query and Vue Query."
huginn,huginn,Ruby,49096,4245,693,4782,False,False,True,True,Create agents that monitor and act on your behalf.  Your agents are standing by!
crewAI,crewAIInc,Python,48819,6668,513,900,False,True,True,True,"Framework for orchestrating role-playing, autonomous AI agents. By fostering collaborative intelligence, CrewAI empowers agents to work together seamlessly, tackling complex tasks."
expo,expo,TypeScript,48722,11768,902,3528,False,True,True,True,"An open-source framework for making universal native apps with React. Expo runs on Android, iOS, and the web."
awesome-design-md,VoltAgent,,48711,6025,262,13,False,True,True,True,A collection of DESIGN.md files inspired by popular brand design systems. Drop one into your project and let coding agents generate a matching UI.
freqtrade,freqtrade,Python,48674,10149,35,3253,False,True,True,True,"Free, open source crypto trading bot"
dayjs,iamkun,JavaScript,48625,2429,1210,2925,False,True,True,True,⏰ Day.js 2kB immutable date-time library alternative to Moment.js with the same modern API
julia,JuliaLang,Julia,48586,5760,4731,5471,True,True,True,True,The Julia Programming Language
whisper.cpp,ggml-org,C++,48585,5406,1167,1296,False,False,True,True,Port of OpenAI's Whisper model in C/C++
llama_index,run-llama,Python,48563,7197,281,1259,True,True,True,True,LlamaIndex is the leading document agent and OCR platform
pandas,pandas-dev,Python,48494,19867,3434,5712,True,True,True,True,"Flexible and powerful data analysis / manipulation library for Python, providing labeled data structures similar to R data.frame objects, statistical functions, and much more"
algorithm-visualizer,algorithm-visualizer,JavaScript,48487,7582,78,3621,True,True,False,True,:fireworks:Interactive Online Platform that Visualizes Algorithms from Code
RxJava,ReactiveX,Java,48336,7596,22,4843,False,True,True,True,RxJava – Reactive Extensions for the JVM – a library for composing asynchronous and event-based programs using observable sequences for the Java VM.
worldmonitor,koala73,TypeScript,48162,7861,106,95,True,True,True,True,"Real-time global intelligence dashboard. AI-powered news aggregation, geopolitical monitoring, and infrastructure tracking in a unified situational awareness interface"
open-source-mac-os-apps,serhii-londar,,48138,2517,63,3084,False,True,True,True,🚀 Awesome list of open source applications for macOS. https://t.me/s/opensourcemacosapps
terraform,hashicorp,Go,48133,10283,1891,4414,True,True,True,True,"Terraform enables you to safely and predictably create, change, and improve infrastructure. It is a source-available tool that codifies APIs into declarative configuration files that can be shared amongst team members, treated as code, edited, reviewed, and versioned."
x64dbg,x64dbg,C++,48083,2709,580,4020,True,True,True,True,An open-source user mode debugger for Windows. Optimized for reverse engineering and malware analysis.
jadx,skylot,Java,48060,5490,414,4774,True,True,True,True,Dex to Java decompiler
Fooocus,lllyasviel,Python,48059,7834,292,978,False,False,True,True,Focus on prompting and generating
OpenCut,OpenCut-app,TypeScript,48010,5044,286,295,True,True,True,True,The open-source CapCut alternative
moment,moment,JavaScript,48008,7015,297,5523,False,True,True,True,"Parse, validate, manipulate, and display dates in javascript."
kubernetes-the-hard-way,kelseyhightower,,47975,15613,47,3567,False,True,False,True,Bootstrap Kubernetes the hard way. No scripts.
type-challenges,type-challenges,TypeScript,47944,5236,33152,2090,True,False,True,True,Collection of TypeScript type challenges with online judge
chinese-independent-developer,1c7,,47905,4091,3,3126,False,True,True,True,👩🏿‍💻👨🏾‍💻👩🏼‍💻👨🏽‍💻👩🏻‍💻中国独立开发者项目列表 -- 分享大家都在做什么
MediaCrawler,NanmiCoder,Python,47820,10248,149,1039,False,False,True,True,小红书笔记 | 评论爬虫、抖音视频 | 评论爬虫、快手视频 | 评论爬虫、B 站视频 ｜ 评论爬虫、微博帖子 ｜ 评论爬虫、百度贴吧帖子 ｜ 百度贴吧评论回复爬虫  | 知乎问答文章｜评论爬虫
htmx,bigskysoftware,JavaScript,47812,1584,659,2191,False,True,True,True,</> htmx - high power tools for HTML
plane,makeplane,TypeScript,47755,3970,717,1241,True,True,True,True,"🔥🔥🔥 Open-source Jira, Linear, Monday, and ClickUp alternative. Plane is a modern project management platform to manage tasks, sprints, docs, and triage."
Pake,tw93,Rust,47747,9517,0,1277,True,True,True,True,🤱🏻 Turn any webpage into a desktop app with one command.
design-patterns-for-humans,kamranahmedse,,47693,5503,16,3343,False,False,False,True,An ultra-simplified explanation to design patterns
awesome-java,akullpp,,47623,7657,2,4296,False,True,True,True,"A curated list of awesome frameworks, libraries and software for the Java programming language."
big-list-of-naughty-strings,minimaxir,Python,47621,2160,108,3901,False,False,False,True,The Big List of Naughty Strings is a list of strings which have a high probability of causing issues when used as user-input data.
Projects,karan,,47593,10654,117,4666,False,True,False,True,:page_with_curl: A list of practical projects that anyone can solve in any programming language.
brew,Homebrew,Ruby,47510,11083,31,3691,True,True,True,True,🍺 The missing package manager for macOS (or Linux)
gogs,gogs,Go,47501,5043,980,4444,False,True,True,True,Gogs is a painless self-hosted Git service
awesome-react-components,brillout,,47309,3753,40,3580,True,True,True,True,Curated List of React Components & Libraries.
Made-With-ML,GokuMohandas,Jupyter Notebook,47287,7427,24,2717,False,False,True,True,"Learn how to develop, deploy and iterate on production-grade ML applications."
PythonDataScienceHandbook,jakevdp,Jupyter Notebook,47268,18817,230,3533,True,True,False,True,Python Data Science Handbook: full text in Jupyter Notebooks
quill,slab,TypeScript,47043,3632,636,5005,True,True,True,True,Quill is a modern WYSIWYG editor built for compatibility and extensibility
ruff,astral-sh,Rust,47032,2007,1952,1343,True,True,True,True,"An extremely fast Python linter and code formatter, written in Rust."
react,typescript-cheatsheets,JavaScript,47024,4288,2,2873,True,True,True,True,Cheatsheets for experienced React developers getting started with TypeScript
pixijs,pixijs,TypeScript,46921,5003,317,4830,True,True,True,True,"The HTML5 Creation Engine: Create beautiful digital content with the fastest, most flexible 2D WebGL renderer."
okhttp,square,Kotlin,46920,9281,97,5012,False,True,True,True,"Square’s meticulous HTTP client for the JVM, Android, and GraalVM."
serverless,serverless,JavaScript,46914,5735,1237,4011,True,True,True,True,"⚡ Serverless Framework – Effortlessly build apps that auto-scale, incur zero costs when idle, and require minimal maintenance using AWS Lambda and other managed cloud services."
awesome-design-patterns,DovAmir,,46911,3233,23,2870,False,True,False,True,A curated list of software and architecture related design patterns.
v2ray-core,v2ray,Go,46863,8865,8,3874,True,False,True,True,A platform for building proxies to bypass network restrictions.
ClickHouse,ClickHouse,C++,46863,8297,5820,3602,True,True,True,True,ClickHouse® is a real-time analytics database management system
metabase,metabase,Clojure,46836,6371,4096,4088,False,True,True,True,The easy-to-use open source Business Intelligence and Embedded Analytics tool that lets everyone work with data :bar_chart:
Mole,tw93,Shell,46833,1419,17,202,False,True,True,True,🐹 Deep clean and optimize your Mac.
minimind,jingyaogong,Python,46766,5801,29,626,True,False,True,True,🚀🚀 「大模型」2小时完全从0训练64M的小参数GPT！🌏 Train a 64M-parameter GPT from scratch in just 2h!
discourse,discourse,Ruby,46764,8875,164,4840,True,True,True,True,"A platform for community discussion. Free, open, simple."
RuView,ruvnet,Rust,46600,6294,59,311,False,False,True,True,"π RuView: WiFi DensePose turns commodity WiFi signals into real-time human pose estimation, vital sign monitoring, and presence detection — all without a single pixel of video. "
AI-For-Beginners,microsoft,Jupyter Notebook,46538,9532,6,1867,True,False,True,True,"12 Weeks, 24 Lessons, AI for All!"
textgen,oobabooga,Python,46488,5915,786,1210,False,False,True,True,"The original local LLM interface. Text, vision, tool-calling, training. UI + API, 100% offline and private."
frontend-dev-bookmarks,dypsilon,,46446,5146,123,4678,False,True,False,True,Manually curated collection of resources for frontend web developers.
tldraw,tldraw,TypeScript,46333,3142,328,1800,True,True,True,True,very good whiteboard infinite canvas SDK
acme.sh,acmesh-official,Shell,46285,5550,1384,3761,False,False,True,True,A pure Unix shell script ACME client for SSL / TLS certificate automation
30-Days-Of-JavaScript,Asabeneh,JavaScript,46234,10436,369,2303,False,False,False,True,"30 days of JavaScript programming challenge is a step-by-step guide to learn JavaScript programming language in 30 days. This challenge may take more than 100 days,  please just follow your own pace. These videos may help too: https://www.youtube.com/channel/UC7PNRuno1rzYPb1xLa4yktw"
learn-regex,ziishaned,,46136,6201,65,3187,False,False,False,True,Learn regex the easy way
GitHubDaily,GitHubDaily,,46036,4611,571,2661,False,False,False,True,"坚持分享 GitHub 上高质量、有趣实用的开源技术教程、开发者工具、编程网站、技术资讯。A list cool, interesting projects of GitHub."
nvm-windows,coreybutler,Go,45926,3789,84,4223,False,True,True,True,A node.js version management utility for Windows. Ironically written in Go.
awesome-openclaw-skills,VoltAgent,,45919,4461,26,78,False,True,True,True,"The awesome collection of OpenClaw skills. 5,400+ skills filtered and categorized from the official OpenClaw Skills Registry.🦞"
legado,gedoor,Kotlin,45899,5263,67,2519,False,False,True,True,"Legado 3.0 Book Reader with powerful controls & full functions❤️阅读3.0, 阅读是一款可以自定义来源阅读网络内容的工具，为广大网络文学爱好者提供一种方便、快捷舒适的试读体验。"
monaco-editor,microsoft,JavaScript,45835,4041,806,3597,True,True,True,True,A browser based code editor
JeecgBoot,jeecgboot,Java,45835,15904,34,2695,False,False,True,True,"一款 AI 驱动的低代码平台，提供""零代码""与""代码生成""双模式——零代码模式一句话搭建系统，代码生成模式自动输出前后端代码与建表 SQL，生成即可运行。平台内置 AI 聊天助手、AI大模型、知识库、AI流程编排、MCP 与插件体系，兼容主流大模型，支持一句话生成流程图、设计表单、聊天式业务操作，解决 Java 项目 80% 重复工作，高效且不失灵活。"
prisma,prisma,TypeScript,45755,2173,2553,2489,True,True,True,True,"Next-generation ORM for Node.js & TypeScript | PostgreSQL, MySQL, MariaDB, SQL Server, SQLite, MongoDB and CockroachDB"
awesome-cheatsheets,LeCoupa,JavaScript,45652,6682,132,3078,False,False,True,True,"👩‍💻👨‍💻 Awesome cheatsheets for popular programming languages, frameworks and development tools. They include everything you should know in one single file."
slidev,slidevjs,TypeScript,45645,2010,185,1816,True,True,True,True,Presentation Slides for Developers
architecture-samples,android,Kotlin,45633,11873,220,3720,False,True,True,True,A collection of samples to discuss and showcase different architectural tools and patterns for Android apps.
bevy,bevyengine,Rust,45575,4508,3313,2277,True,True,True,True,A refreshingly simple data-driven game engine built in Rust
spotube,KRTirtho,Dart,45546,2041,775,1885,True,False,True,True,🎧 Open source music streaming app! Available for both desktop & mobile!
LocalAI,mudler,Go,45373,3947,170,1122,False,True,True,True,"LocalAI is the open-source AI engine. Run any model - LLMs, vision, voice, image, video - on any hardware. No GPU required."
zx,google,JavaScript,45369,1245,40,1804,True,True,True,True,A tool for writing better scripts
penpot,penpot,Clojure,45342,2683,592,3758,True,True,True,True,Penpot: The open-source design tool for design and code collaboration
AdminLTE,ColorlibHQ,CSS,45337,18246,20,4493,True,True,True,True,AdminLTE - Free admin dashboard template based on Bootstrap 5
jest,jestjs,TypeScript,45330,6640,246,4508,True,True,True,True,Delightful JavaScript Testing.
Rocket.Chat,RocketChat,TypeScript,45142,13517,3716,3982,True,True,True,True,The Secure CommsOS™ for mission-critical operations
awesome-remote-job,lukasz-madon,,45101,4567,49,4120,False,True,True,True,A curated list of awesome remote jobs and resources. Inspired by https://github.com/vinta/awesome-python
TTS,coqui-ai,Python,45061,6034,7,2154,True,True,True,True,"🐸💬 - a deep learning toolkit for Text-to-Speech, battle-tested in research and production"
airflow,apache,Python,45036,16856,1696,4018,True,True,True,True,"Apache Airflow - A platform to programmatically author, schedule, and monitor workflows"
mempalace,MemPalace,Python,45020,5809,374,9,False,True,True,True,The highest-scoring AI memory system ever benchmarked. And it's free.
CppCoreGuidelines,isocpp,CSS,44899,5540,251,3890,False,True,True,True,"The C++ Core Guidelines are a set of tried-and-true guidelines, rules, and best practices about coding in C++"
Leaflet,Leaflet,JavaScript,44840,6109,539,5682,True,True,True,True,🍃 JavaScript library for mobile-friendly interactive maps 🇺🇦
awesome-compose,docker,HTML,44820,8099,365,2251,False,True,True,True,Awesome Docker Compose samples
meteor,meteor,JavaScript,44777,5264,372,5199,True,True,True,True,"Meteor, the JavaScript App Platform"
react-hook-form,react-hook-form,TypeScript,44660,2383,131,2596,True,True,True,True,📋 React Hooks for form state management and validation (Web + React Native)
grpc,grpc,C++,44628,11118,1259,4144,True,True,True,True,"C++ based gRPC (C++, Python, Ruby, Objective-C, PHP, C#)"
edex-ui,GitSquared,JavaScript,44628,3083,6,3362,False,False,True,True,"A cross-platform, customizable science fiction terminal emulator with advanced monitoring & touchscreen support."
hyper,vercel,TypeScript,44608,3551,1040,3573,False,False,True,True,A terminal built on web technologies
pyenv,pyenv,Shell,44607,3240,54,4973,False,True,True,True,Simple Python version management
upscayl,upscayl,TypeScript,44577,2173,59,1353,False,False,True,True,"🆙 Upscayl - #1 Free and Open Source AI Image Upscaler for Linux, MacOS and Windows."
BMAD-METHOD,bmad-code-org,JavaScript,44532,5292,158,365,True,True,True,True,Breakthrough Method for Agile Ai Driven Development
reactjs-interview-questions,sudheerj,JavaScript,44486,10347,13,2874,False,False,True,True,List of top 500 ReactJS Interview Questions & Answers....Coding exercise questions are coming soon!!
tmux,tmux,C,44486,2577,86,3967,False,True,True,True,tmux source code
Win11Debloat,Raphire,PowerShell,44482,1802,32,1994,False,True,True,True,"A simple, lightweight PowerShell script that allows you to remove pre-installed apps, disable telemetry, as well as perform various other changes to declutter and customize your Windows experience. Win11Debloat works for both Windows 10 and Windows 11."
iina,iina,Swift,44413,2794,1945,3402,False,True,True,True,The modern video player for macOS.
copyparty,9001,Python,44266,1804,257,2514,True,True,False,True,"Portable file server with accelerated resumable uploads, dedup, WebDAV, SFTP, FTP, TFTP, zeroconf, media indexer, thumbnails++ all in one file"
cc-switch,farion1231,Rust,44221,2791,486,252,True,True,True,True,"A cross-platform desktop All-in-One assistant tool for Claude Code, Codex, OpenCode, openclaw & Gemini CLI."
streamlit,streamlit,Python,44208,4196,1302,2425,True,True,True,True,Streamlit — A faster way to build and share data apps.
Summer2026-Internships,SimplifyJobs,Python,44170,3171,4,2151,False,True,True,True,Collection of Summer 2026 tech internships!
parcel,parcel-bundler,JavaScript,44040,2277,590,3171,True,True,True,True,The zero configuration build tool for the web. 📦🚀
build-web-application-with-golang,astaxie,Go,44022,10510,138,5002,False,False,False,True,A golang ebook intro how to build a web with golang
TrafficMonitor,zhongyang219,C++,43985,3649,1278,3180,False,False,True,True,这是一个用于显示当前网速、CPU及内存利用率的桌面悬浮窗软件，并支持任务栏显示，支持更换皮肤。
react-use,streamich,TypeScript,43967,3276,654,2725,False,True,True,True,React Hooks — 👍
helix,helix-editor,Rust,43942,3415,1489,2143,False,True,True,True,A post-modern modal text editor.
twenty,twentyhq,TypeScript,43942,5937,76,1229,True,True,True,True,"Building a modern alternative to Salesforce, powered by the community."
front-end-interview-handbook,yangshun,MDX,43922,5951,11,3012,True,True,True,True,Front End interview preparation materials for busy engineers (updated for 2026)
retrofit,square,HTML,43904,7356,169,5698,False,True,True,True,A type-safe HTTP client for Android and the JVM
babel,babel,TypeScript,43899,5822,765,4215,True,True,True,True,🐠 Babel is a compiler for writing next generation JavaScript.
jsoncrack.com,AykutSarac,TypeScript,43864,3532,43,1534,True,True,True,True,"✨ Innovative and open-source visualization application that transforms various data formats, such as JSON, YAML, XML and CSV into interactive graphs."
cli,cli,Go,43802,8253,959,2384,True,True,True,True,GitHub’s official command line tool
EasySpider,NaiboWang,JavaScript,43786,5336,266,2096,False,False,True,True,A visual no-code/code-free web crawler/spider易采集：一个可视化浏览器自动化测试/数据采集/爬虫软件，可以无代码图形化的设计和执行爬虫任务。别名：ServiceWrapper面向Web应用的智能化服务封装系统。
TensorFlow-Examples,aymericdamien,Jupyter Notebook,43785,14764,227,3806,False,False,False,True,TensorFlow Tutorial and Examples for Beginners (support TF v1 & v2)
milvus,milvus-io,Go,43784,3961,1172,2401,True,True,True,True,"Milvus is a high-performance, cloud-native vector database built for scalable vector ANN search"
cobra,spf13,Go,43666,3110,363,4605,False,True,True,True,A Commander for modern Go CLI interactions
pretext,chenglou,TypeScript,43596,2370,72,37,False,False,True,True,"Fast, accurate & comprehensive text measurement & layout"
sentry,getsentry,Python,43573,4657,2052,5705,True,True,True,True,Developer-first error tracking and performance monitoring
exo,exo-explore,Python,43567,3015,193,658,False,True,True,True,Run frontier AI locally.
cherry-studio,CherryHQ,TypeScript,43443,4078,956,690,True,True,True,True,"AI productivity studio with smart chat, autonomous agents, and 300+ assistants. Unified access to frontier LLMs"
RSSHub,DIYgod,TypeScript,43393,9602,346,2933,True,True,True,True,🧡 Everything is RSSible
pandoc,jgm,Haskell,43342,3811,1062,5868,False,True,True,True,Universal markup converter
aider,Aider-AI,Python,43286,4198,1481,1070,False,True,True,True,aider is AI pair programming in your terminal
Umi-OCR,hiroi-sora,Python,43281,4278,332,1478,False,False,False,True,"OCR software, free and offline. 开源、免费的离线OCR软件。支持截屏/批量导入图片，PDF文档识别，排除水印/页眉页脚，扫描/生成二维码。内置多国语言库。"
fuels-rs,FuelLabs,Rust,43280,1359,68,1625,False,False,True,True,Fuel Network Rust SDK
fuels-ts,FuelLabs,TypeScript,43249,1369,82,1683,True,True,True,True,Fuel Network Typescript SDK
litellm,BerriAI,Python,43197,7218,2445,992,False,True,True,True,"Python SDK, Proxy Server (AI Gateway) to call 100+ LLM APIs in OpenAI (or native) format, with cost tracking, guardrails, loadbalancing and logging. [Bedrock, Azure, OpenAI, VertexAI, Cohere, Anthropic, Sagemaker, HuggingFace, VLLM, NVIDIA NIM]"
kong,Kong,Lua,43186,5110,134,4165,True,True,True,True,🦍 The API and AI Gateway
fanqiang,bannedbook,Kotlin,43172,7707,325,4108,False,False,True,True,翻墙-科学上网
remotion,remotion-dev,TypeScript,43148,2849,84,2120,True,True,True,True,🎥      Make videos programmatically with React
CowAgent,zhayujie,Python,43122,9908,357,1345,False,False,True,True,CowAgent (chatgpt-on-wechat) 是基于大模型的超级AI助理，能主动思考和任务规划、访问操作系统和外部资源、创造和执行Skills、通过长期记忆和知识库不断成长，比OpenClaw更轻量和便捷。同时支持微信、飞书、钉钉、企微、QQ、公众号、网页等接入，可选择OpenAI/Claude/Gemini/DeepSeek/ Qwen/GLM/Kimi/LinkAI，能处理文本、语音、图片和文件，可快速搭建个人AI助理和企业数字员工。
spark,apache,Scala,43118,29160,340,4430,True,True,True,True,Apache Spark - A unified analytics engine for large-scale data processing
mitmproxy,mitmproxy,Python,43069,4514,421,5901,True,True,True,True,An interactive TLS-capable intercepting HTTP proxy for penetration testers and software developers.
pm2,Unitech,JavaScript,43060,2708,1102,4711,False,True,True,True,Node.js Production Process Manager with a built-in Load Balancer.
CPlusPlusThings,Light-City,C++,43045,8826,9,2465,False,False,False,True,C++那些事
what-happens-when,alex,,42998,5731,2069,4541,False,False,False,True,"An attempt to answer the age old interview question ""What happens when you type google.com into your browser and press enter?"""
Files,files-community,C#,42981,2685,526,2656,True,True,True,True,A modern file manager that helps users organize their files and folders.
bruno,usebruno,JavaScript,42884,2303,1633,1294,False,True,True,True,Opensource IDE For Exploring and Testing API's (lightweight alternative to Postman/Insomnia)
zig,ziglang,Zig,42825,3066,3416,3904,False,False,False,True,Moved to Codeberg
system-design,karanpratapsingh,,42804,5450,3,1337,True,True,False,True,Learn how to design systems at scale and prepare for system design interviews
python-patterns,faif,Python,42704,7036,13,5059,False,False,True,True,A collection of design patterns/idioms in Python
full-stack-fastapi-template,fastapi,TypeScript,42625,8369,23,2606,False,True,True,True,"Full stack, modern web application template. Using FastAPI, React, SQLModel, PostgreSQL, Docker, GitHub Actions, automatic HTTPS and more."
siyuan,siyuan-note,TypeScript,42601,2668,353,2052,True,True,True,True,"A privacy-first, self-hosted, fully open source personal knowledge management software, written in typescript and golang."
fd,sharkdp,Rust,42516,1031,178,3261,False,True,True,True,"A simple, fast and user-friendly alternative to 'find'"
git-flight-rules,k88hudson,,42475,3182,16,4283,False,False,False,True,Flight rules for git
hyperswitch,juspay,Rust,42464,4589,1482,1274,True,True,True,True,"An open source payments switch written in Rust to make payments fast, reliable and affordable"
zod,colinhacks,TypeScript,42393,1902,316,2228,True,True,True,True,TypeScript-first schema validation with static type inference
Alamofire,Alamofire,Swift,42365,7651,43,4274,False,True,True,True,Elegant HTTP Networking in Swift
gradio,gradio-app,Python,42318,3388,463,2672,True,True,True,True,"Build and share delightful machine learning apps, all in Python. 🌟 Star to support our work!"
claude-code-best-practice,shanraisshan,HTML,42224,4028,10,164,False,False,True,True,practice made claude perfect
diagrams,mingrammer,Python,42181,2720,386,2262,False,True,True,True,:art: Diagram as Code for prototyping cloud system architectures
