repo_name,organization,language,stars,forks,open_issues,age_days,has_coc,has_contributing,has_workflows,has_readme,description
segment-anything,facebookresearch,Jupyter Notebook,54396,6362,595,1189,True,True,True,True,"The repository provides code for running inference with the SegmentAnything Model (SAM), links for downloading the trained model checkpoints, and example notebooks that show how to use the model."
ChatGPT,lencx,Rust,54385,6147,937,1295,False,False,True,True,"🔮 ChatGPT Desktop Application (Mac, Windows and Linux)"
crewAI,crewAIInc,Python,54325,7604,551,972,False,True,True,True,"Framework for orchestrating role-playing, autonomous AI agents. By fostering collaborative intelligence, CrewAI empowers agents to work together seamlessly, tackling complex tasks."
codegraph,colbymchenry,TypeScript,54292,3326,224,157,False,False,True,True,"Pre-indexed code knowledge graph, auto syncs on code changes, for Claude Code, Codex, Gemini, Cursor, OpenCode, AntiGravity, Kiro, and Hermes Agent — fewer tokens, fewer tool calls, 100% local"
maybe,maybe-finance,Ruby,54287,5629,0,905,False,True,True,True,The personal finance app for everyone
trackerslist,ngosang,,54277,6592,8,3713,False,False,True,True,Updated list of public BitTorrent trackers
dive,wagoodman,Go,54245,1985,207,2964,False,False,True,True,A tool for exploring each layer in a docker image
PowerShell,PowerShell,C#,54163,8359,1526,3815,True,True,True,True,PowerShell for every system!
Ghost,TryGhost,JavaScript,54139,11750,132,4799,True,True,True,True,"Independent technology for modern publishing, memberships, subscriptions and newsletters."
element,ElemeFE,Vue,54111,14447,2970,3582,False,False,True,True,A Vue.js 2.0 UI Toolkit for Web
requests,psf,Python,54069,9985,227,5610,True,True,True,True,"A simple, yet elegant, HTTP library."
ImHex,WerWolv,C++,54001,2401,372,2052,True,True,True,True,"🔍 A Hex Editor for Reverse Engineers, Programmers and people who value their retinas when working at 3 AM."
Flowise,FlowiseAI,TypeScript,53994,24589,957,1181,True,True,True,True,"Build AI Agents, Visually"
core,vuejs,TypeScript,53870,9154,934,2934,False,True,True,True,"🖖 Vue.js is a progressive, incrementally-adoptable JavaScript framework for building UI on the web."
jellyfin,jellyfin,C#,53655,5029,575,2755,True,True,True,True,The Free Software Media System - Server Backend & API
penpot,penpot,Clojure,53554,3446,659,3830,True,True,True,True,Penpot: The open-source design tool for design and code collaboration
normalize.css,necolas,CSS,53545,10365,76,5530,False,True,False,True,A modern alternative to CSS resets
material-design-icons,google,,53492,9730,409,4277,True,True,True,True,Material Design icons by Google (Material Symbols)
pdf.js,mozilla,JavaScript,53492,10629,417,5539,True,True,True,True,PDF Reader in JavaScript
kotlin,JetBrains,Kotlin,52983,6347,311,5245,True,True,True,True,The Kotlin Programming Language. 
plane,makeplane,TypeScript,52924,4717,938,1313,True,True,True,True,"🔥🔥🔥 Open-source Jira, Linear, Monday, and ClickUp alternative. Plane is a modern project management platform to manage tasks, sprints, docs, and triage."
odoo,odoo,Python,52639,32906,9895,4425,False,True,True,True,Odoo. Open Source Apps To Grow Your Business.
Docker-OSX,sickcodes,Shell,52615,2878,418,2211,False,False,True,True,Run macOS VM in a Docker! Run near native OSX-KVM in Docker! X11 Forwarding! CI/CD for OS X Security Research! Docker mac Containers.
awesome-ios,vsouza,Swift,52584,6978,13,4367,True,True,True,True,"A curated list of awesome iOS ecosystem, including Objective-C and Swift Projects "
ionic-framework,ionic-team,TypeScript,52543,13353,629,4691,True,True,True,True,"A powerful cross-platform UI toolkit for building native-quality iOS, Android, and Progressive Web Apps with HTML, CSS, and JavaScript."
MediaCrawler,NanmiCoder,Python,52465,10891,173,1111,False,False,True,True,小红书笔记 | 评论爬虫、抖音视频 | 评论爬虫、快手视频 | 评论爬虫、B 站视频 ｜ 评论爬虫、微博帖子 ｜ 评论爬虫、百度贴吧帖子 ｜ 百度贴吧评论回复爬虫  | 知乎问答文章｜评论爬虫
minimind,jingyaogong,Python,52173,6715,45,698,True,False,True,True,🧠「大模型」2小时完全从0训练64M的小参数LLM！Train a 64M-parameter LLM from scratch in just 2h!
prettier,prettier,JavaScript,52096,4751,1408,3494,True,True,True,True,Prettier is an opinionated code formatter.
Motrix,agalwood,JavaScript,52095,4887,779,2745,True,True,True,True,A full-featured download manager.
chinese-poetry,chinese-poetry,JavaScript,52028,10486,136,3583,False,False,True,True,"The most comprehensive database of Chinese poetry 🧶最全中华古诗词数据库,  唐宋两朝近一万四千古诗人,  接近5.5万首唐诗加26万宋诗.  两宋时期1564位词人，21050首词。"
etcd,etcd-io,Go,51884,10392,254,4736,True,True,True,True,Distributed reliable key-value store for the most critical data of a distributed system
freqtrade,freqtrade,Python,51817,10799,31,3325,False,True,True,True,"Free, open source crypto trading bot"
windows,dockur,Shell,51786,4384,108,892,False,False,True,True,Windows inside a Docker container.
lx-music-desktop,lyswhut,TypeScript,51767,6879,1219,2506,False,False,True,True,一个基于 Electron 的音乐软件
grok-1,xai-org,Python,51691,8469,125,829,True,False,True,True,Grok open release
twenty,twentyhq,TypeScript,51553,7577,103,1301,True,True,True,True,"The open alternative to Salesforce, designed for AI."
jekyll,jekyll,Ruby,51521,10285,248,6457,True,True,True,True,:globe_with_meridians: Jekyll is a blog-aware static site generator in Ruby
guava,google,Java,51493,11133,741,4409,True,True,True,True,Google core libraries for Java
lazydocker,jesseduffield,Go,51459,1629,281,2594,True,True,True,True,The lazier way to manage everything docker
litellm,BerriAI,Python,51454,9155,3440,1064,False,True,True,True,"Python SDK, Proxy Server (AI Gateway) to call 100+ LLM APIs in OpenAI (or native) format, with cost tracking, guardrails, loadbalancing and logging. [Bedrock, Azure, OpenAI, VertexAI, Cohere, Anthropic, Sagemaker, HuggingFace, VLLM, NVIDIA NIM]"
100-Days-Of-ML-Code,Avik-Jain,,51306,11552,68,2911,True,True,False,True,100 Days of ML Coding
DefinitelyTyped,DefinitelyTyped,TypeScript,51295,30436,671,5010,False,False,True,True,The repository for high quality TypeScript type definitions.
go-ethereum,ethereum,Go,51206,21913,376,4563,False,True,True,True,Go implementation of the Ethereum protocol
professional-programming,charlax,Python,51165,3996,3,3883,False,True,False,True,A collection of learning resources for curious software engineers
remotion,remotion-dev,TypeScript,51155,3669,137,2192,True,True,True,True,🎥      Make videos programmatically with React
awesome-wechat-weapp,justjavac,,51138,9021,2,3562,False,False,False,True,微信小程序开发资源汇总 :100:
Semantic-UI,Semantic-Org,JavaScript,51061,4869,1071,4825,False,True,False,True,Semantic is a UI component framework based around useful principles from natural language.
whisper.cpp,ggml-org,C++,51028,5696,1204,1368,False,True,True,True,Port of OpenAI's Whisper model in C/C++
hiring-without-whiteboards,poteto,JavaScript,50903,3897,9,3389,True,True,True,True,⭐️  Companies that don't have a broken hiring process
open-source-ios-apps,dkhamsing,,50874,5793,1,4167,False,True,True,True,:iphone: Collaborative List of Open-Source iOS Apps
dbeaver,dbeaver,Java,50705,4252,3310,3899,True,True,True,True,Free universal database tool and SQL client
awesome-openclaw-skills,VoltAgent,,50584,4908,2,150,False,True,True,True,"The awesome collection of OpenClaw skills. 5,400+ skills filtered and categorized from the official OpenClaw Skills Registry.🦞"
Fooocus,lllyasviel,Python,50510,8127,300,1050,False,False,True,True,Focus on prompting and generating
taste-skill,Leonxlnx,JavaScript,50477,3489,32,125,False,False,True,True,"Taste-Skill - gives your AI good taste. stops the AI from generating boring, generic slop "
cypress,cypress-io,TypeScript,50416,3430,1169,4131,True,True,True,True,"Fast, easy and reliable testing for anything that runs in a browser."
llama_index,run-llama,Python,50365,7627,489,1331,True,True,True,True,LlamaIndex is the leading document agent and OCR platform
expo,expo,TypeScript,50271,12855,635,3600,False,True,True,True,"An open-source framework for making universal native apps with React. Expo runs on Android, iOS, and the web."
goose,aaif-goose,Rust,50154,5336,215,670,False,True,True,True,"an open source, extensible AI agent that goes beyond code suggestions - install, execute, edit, and test with any LLM"
headroom,headroomlabs-ai,Python,50150,3522,368,168,True,True,True,True,"Compress tool outputs, logs, files, and RAG chunks before they reach the LLM. 60-95% fewer tokens, same answers. Library, proxy, MCP server."
bulma,jgthms,CSS,50073,3892,523,3805,False,True,True,True,Modern CSS framework based on Flexbox
mastodon,mastodon,Ruby,50059,7476,4462,3775,True,True,True,True,"Your self-hosted, globally interconnected microblogging community"
json,nlohmann,C++,50000,7409,72,4738,True,True,True,True,JSON for Modern C++
query,TanStack,TypeScript,49833,3898,200,2479,False,True,True,True,"🤖 Powerful asynchronous state management, server-state utilities and data fetching for the web. TS/JS, React Query, Solid Query, Svelte Query and Vue Query."
hacker-scripts,NARKOZ,JavaScript,49741,6662,70,3868,False,False,False,True,Based on a true story
alist,AlistGo,Go,49725,7946,572,2009,True,True,True,True,"🗂️A file list/WebDAV program that supports multiple storages, powered by Gin and Solidjs. / 一个支持多存储的文件列表/WebDAV程序，使用 Gin 和 Solidjs。"
BMAD-METHOD,bmad-code-org,JavaScript,49636,5737,70,437,True,True,True,True,Breakthrough Method for Agile Ai Driven Development
VibeVoice,microsoft,Python,49600,5538,174,303,True,True,True,True,Open-Source Frontier Voice AI
Win11Debloat,Raphire,PowerShell,49534,1988,25,2066,False,True,True,True,"A simple, lightweight PowerShell script that allows you to remove pre-installed apps, disable telemetry, as well as perform various other changes to declutter and customize your Windows experience. Win11Debloat works for both Windows 10 and Windows 11."
huginn,huginn,Ruby,49514,4274,692,4855,False,False,True,True,Create agents that monitor and act on your behalf.  Your agents are standing by!
open-source-mac-os-apps,serhii-londar,,49291,2607,125,3156,False,True,True,True,🚀 Awesome list of open source applications for macOS. https://t.me/s/opensourcemacosapps
jadx,skylot,Java,49178,5565,430,4846,True,True,True,True,Dex to Java decompiler
pandas,pandas-dev,Python,49052,20037,3140,5784,True,True,True,True,"Flexible and powerful data analysis / manipulation library for Python, providing labeled data structures similar to R data.frame objects, statistical functions, and much more"
chinese-independent-developer,1c7,,48959,4202,2,3198,False,True,True,True,👩🏿‍💻👨🏾‍💻👩🏼‍💻👨🏽‍💻👩🏻‍💻中国独立开发者项目列表 -- 分享大家都在做什么
daily_stock_analysis,ZhuLinsen,Python,48892,43124,42,166,False,True,True,True,"LLM 驱动的多市场股票智能分析系统：多源行情、实时新闻、决策看板与自动推送，支持零成本定时运行。  LLM-powered multi-market stock analysis system with multi-source market data, real-time news, decision dashboard, automated notifications, and cost-free scheduled runs."
julia,JuliaLang,Julia,48889,5795,4722,5543,True,True,True,True,The Julia Programming Language
kubernetes-the-hard-way,kelseyhightower,,48833,15733,49,3639,False,True,False,True,Bootstrap Kubernetes the hard way. No scripts.
terraform,hashicorp,Go,48777,10372,1917,4486,True,True,True,True,"Terraform enables you to safely and predictably create, change, and improve infrastructure. It is a source-available tool that codifies APIs into declarative configuration files that can be shared amongst team members, treated as code, edited, reviewed, and versioned."
pretext,chenglou,TypeScript,48743,2711,84,109,False,False,True,True,"Fast, accurate & comprehensive text measurement & layout"
x64dbg,x64dbg,C++,48723,2758,574,4092,True,True,True,True,An open-source user mode debugger for Windows. Optimized for reverse engineering and malware analysis.
PythonDataScienceHandbook,jakevdp,Jupyter Notebook,48677,18995,230,3605,True,True,False,True,Python Data Science Handbook: full text in Jupyter Notebooks
dayjs,iamkun,JavaScript,48664,2451,1278,2997,False,True,True,True,⏰ Day.js 2kB immutable date-time library alternative to Moment.js with the same modern API
brew,Homebrew,Ruby,48620,11185,17,3763,True,True,True,True,🍺 The Package Manager for Everywhere
algorithm-visualizer,algorithm-visualizer,JavaScript,48584,7580,79,3693,True,True,False,True,:fireworks:Interactive Online Platform that Visualizes Algorithms from Code
AI-For-Beginners,microsoft,Jupyter Notebook,48440,10046,10,1939,True,False,True,True,"12 Weeks, 24 Lessons, AI for All!"
Made-With-ML,GokuMohandas,Jupyter Notebook,48361,7608,25,2789,False,False,True,True,"Learn how to develop, deploy and iterate on production-grade ML applications."
awesome-java,akullpp,,48309,7689,2,4368,False,True,True,True,"A curated list of awesome frameworks, libraries and software for the Java programming language."
tldraw,tldraw,TypeScript,48278,3341,423,1872,True,True,True,True,"Build infinite canvas apps in React with the tldraw SDK. World's best, top-most agent recommended #1 five star SDK."
ClickHouse,ClickHouse,C++,48274,8553,6202,3674,True,True,True,True,ClickHouse® is a real-time analytics database management system
type-challenges,type-challenges,TypeScript,48257,5271,33225,2162,True,False,True,True,Collection of TypeScript type challenges with online judge
htmx,bigskysoftware,JavaScript,48246,1602,664,2263,False,True,True,True,</> htmx - high power tools for HTML
RxJava,ReactiveX,Java,48237,7586,16,4915,False,True,True,True,RxJava – Reactive Extensions for the JVM – a library for composing asynchronous and event-based programs using observable sequences for the Java VM.
ruff,astral-sh,Rust,48210,2186,2032,1415,True,True,True,True,"An extremely fast Python linter and code formatter, written in Rust."
fanqiang,bannedbook,Kotlin,48034,8127,328,4180,False,False,True,True,翻墙-科学上网
moment,moment,JavaScript,47963,6987,304,5595,False,True,True,True,"Parse, validate, manipulate, and display dates in javascript."
design-patterns-for-humans,nilbuild,,47926,5502,16,3415,False,False,False,True,An ultra-simplified explanation to design patterns
awesome-design-patterns,DovAmir,,47912,3271,25,2942,False,True,False,True,A curated list of software and architecture related design patterns.
metabase,metabase,Clojure,47863,6593,4031,4160,False,True,True,True,The easy-to-use open source Business Intelligence and Embedded Analytics tool that lets everyone work with data :bar_chart:
awesome-react-components,brillout,,47842,3788,57,3652,True,True,True,True,Curated List of React Components & Libraries.
cherry-studio,CherryHQ,TypeScript,47768,4527,1213,762,True,True,True,True,"AI productivity studio with smart chat, autonomous agents, and 300+ assistants. Unified access to frontier LLMs"
Projects,karan,,47754,10629,122,4738,False,True,False,True,:page_with_curl: A list of practical projects that anyone can solve in any programming language.
big-list-of-naughty-strings,minimaxir,Python,47687,2160,108,3973,False,False,False,True,The Big List of Naughty Strings is a list of strings which have a high probability of causing issues when used as user-input data.
gogs,gogs,Go,47623,5072,999,4516,False,True,True,True,The painless way to host your own Git service
pixijs,pixijs,TypeScript,47580,5039,348,4902,True,True,True,True,"The HTML5 Creation Engine: Create beautiful digital content with the fastest, most flexible 2D WebGL renderer."
textgen,oobabooga,Python,47373,5974,821,1282,False,False,True,True,"Open-source desktop app for local LLMs. Text, vision, tool-calling, OpenAI/Anthropic-compatible API. 100% private."
slidev,slidevjs,TypeScript,47372,2111,210,1888,True,True,True,True,Presentation Slides for Developers
discourse,discourse,Ruby,47322,8940,172,4912,True,True,True,True,"A platform for community discussion. Free, open, simple."
awesome-claude-code,hesreallyhim,Python,47244,4128,547,431,True,True,True,True,"A curated list of awesome skills, hooks, slash-commands, agent orchestrators, applications, and plugins for Claude Code by Anthropic"
quill,slab,TypeScript,47190,3655,649,5077,True,True,True,True,Quill is a modern WYSIWYG editor built for compatibility and extensibility
spotube,KRTirtho,Dart,47136,2174,813,1957,True,False,True,True,🎧 Open source music streaming app! Available for both desktop & mobile!
LocalAI,mudler,Go,47125,4165,201,1194,False,True,True,True,"LocalAI is the open-source AI engine. Run any model - LLMs, vision, voice, image, video - on any hardware. No GPU required."
react,typescript-cheatsheets,TypeScript,47076,4290,0,2945,True,True,True,True,Cheatsheets for experienced React developers getting started with TypeScript
frontend-dev-bookmarks,dypsilon,,47051,5147,134,4750,False,True,False,True,Manually curated collection of resources for frontend web developers.
okhttp,square,Kotlin,46984,9271,117,5084,False,True,True,True,"Square’s meticulous HTTP client for the JVM, Android, and GraalVM."
acme.sh,acmesh-official,Shell,46981,5614,1421,3833,False,False,True,True,A pure Unix shell script ACME client for SSL / TLS certificate automation
tmux,tmux,C,46943,2710,33,4039,False,True,True,True,tmux source code
serverless,serverless,JavaScript,46916,5730,1223,4083,True,True,True,True,"⚡ Serverless Framework – Effortlessly build apps that auto-scale, incur zero costs when idle, and require minimal maintenance using AWS Lambda and other managed cloud services."
v2ray-core,v2ray,Go,46897,8843,19,3946,True,False,True,True,A platform for building proxies to bypass network restrictions.
nvm-windows,coreybutler,Go,46878,3838,89,4295,False,True,True,True,A node.js version management utility for Windows. Ironically written in Go.
GitHubDaily,GitHubDaily,,46872,4648,652,2733,False,False,False,True,"坚持分享 GitHub 上高质量、有趣实用的开源技术教程、开发者工具、编程网站、技术资讯。A list cool, interesting projects of GitHub."
JeecgBoot,jeecgboot,Java,46871,16061,31,2767,False,False,True,True,AI 低代码平台「低代码 + 零代码」双驱动！低代码可一键生成前后端代码;零代码可 5 分钟搭建系统;AI Skills 一句话画流程、设计表单、生成整套系统。内置 AI聊天、知识库、流程编排、MCP插件等，兼容主流大模型。引领「AI 生成 → 在线配置 → 代码生成 → 手工合并->AI修改」开发模式，消除 Java 项目 80% 的重复工作，提效而不失灵活。
legado,gedoor,Kotlin,46871,5830,18,2591,False,False,True,True,"Legado 3.0 Book Reader with powerful controls & full functions❤️阅读3.0, 阅读是一款可以自定义来源阅读网络内容的工具，为广大网络文学爱好者提供一种方便、快捷舒适的试读体验。"
bevy,bevyengine,Rust,46836,4646,3256,2349,True,True,True,True,A refreshingly simple data-driven game engine built in Rust
aider,Aider-AI,Python,46669,4645,1655,1142,False,True,True,True,aider is AI pair programming in your terminal
awesome-remote-job,lukasz-madon,,46505,4648,41,4192,False,True,True,True,A curated list of awesome remote jobs and resources. Inspired by https://github.com/vinta/awesome-python
last30days-skill,mvanhorn,Python,46497,3852,47,152,False,False,True,True,"AI agent skill that researches any topic across Reddit, X, YouTube, HN, Polymarket, and the web - then synthesizes a grounded summary"
30-Days-Of-JavaScript,Asabeneh,JavaScript,46489,10442,367,2375,False,False,False,True,"30 days of JavaScript programming challenge is a step-by-step guide to learn JavaScript programming language in 30 days. This challenge may take more than 100 days,  please just follow your own pace. These videos may help too: https://www.youtube.com/channel/UC7PNRuno1rzYPb1xLa4yktw"
prisma,prisma,TypeScript,46403,2250,2624,2561,True,True,True,True,"Next-generation ORM for Node.js & TypeScript | PostgreSQL, MySQL, MariaDB, SQL Server, SQLite, MongoDB and CockroachDB"
upscayl,upscayl,TypeScript,46382,2295,57,1425,False,False,True,True,"🆙 Upscayl - #1 Free and Open Source AI Image Upscaler for Linux, MacOS and Windows."
monaco-editor,microsoft,JavaScript,46240,4079,828,3669,True,True,True,True,A browser based code editor
learn-regex,ziishaned,,46095,6161,65,3259,False,False,False,True,Learn regex the easy way
awesome-cheatsheets,LeCoupa,JavaScript,46089,6708,137,3150,False,False,True,True,"👩‍💻👨‍💻 Awesome cheatsheets for popular programming languages, frameworks and development tools. They include everything you should know in one single file."
claude-cookbooks,anthropics,Jupyter Notebook,45933,5397,263,1044,False,True,True,True,A collection of notebooks/recipes showcasing some fun and effective ways of using Claude.
airflow,apache,Python,45915,17294,1712,4090,True,True,True,True,"Apache Airflow - A platform to programmatically author, schedule, and monitor workflows"
system_prompts_leaks,asgeirtj,JavaScript,45837,7522,22,418,False,True,True,True,"Extracted system prompts from Anthropic - Claude Fable 5, Opus 4.8, Claude Code, Claude Design. OpenAI - ChatGPT 5.5 Thinking, GPT 5.5 Instant, Codex. Google - Gemini 3.5 Flash, 3.1 Pro, Antigravity. xAI - Grok, Cursor, Copilot, VS Code, Perplexity, and more. Updated regularly."
cal.diy,calcom,TypeScript,45819,14191,1299,1920,True,True,True,True,Scheduling infrastructure for absolutely everyone.
architecture-samples,android,Kotlin,45729,11863,221,3792,False,True,True,True,A collection of samples to discuss and showcase different architectural tools and patterns for Android apps.
Rocket.Chat,RocketChat,TypeScript,45708,13677,3795,4054,True,True,True,True,The Secure CommsOS™ for mission-critical operations
awesome-compose,docker,HTML,45623,8216,394,2323,False,True,True,True,Awesome Docker Compose samples
TTS,coqui-ai,Python,45614,6126,9,2226,True,True,True,True,"🐸💬 - a deep learning toolkit for Text-to-Speech, battle-tested in research and production"
exo,exo-explore,Python,45601,3276,268,730,False,True,True,True,Run frontier AI locally.
CowAgent,zhayujie,Python,45601,10229,16,1417,False,True,True,True,"Open-source super AI assistant & Agent Harness. Plans tasks, runs tools and skills, self-evolves with memory and knowledge. Multi-model, multi-channel. Lightweight, extensible, one-line install. (formerly chatgpt-on-wechat)"
zx,google,JavaScript,45575,1269,53,1877,True,True,True,True,A tool for writing better scripts
Umi-OCR,hiroi-sora,Python,45531,4476,351,1550,False,False,False,True,"OCR software, free and offline. 开源、免费的离线OCR软件。支持截屏/批量导入图片，PDF文档识别，排除水印/页眉页脚，扫描/生成二维码。内置多国语言库。"
AdminLTE,ColorlibHQ,CSS,45474,18206,2,4565,True,True,True,True,AdminLTE - Free admin dashboard template based on Bootstrap 5
jest,jestjs,TypeScript,45458,6664,233,4580,True,True,True,True,Delightful JavaScript Testing.
copyparty,9001,Python,45349,1848,269,2586,True,True,False,True,"Portable file server with accelerated resumable uploads, dedup, WebDAV, SFTP, FTP, TFTP, zeroconf, media indexer, thumbnails++ all in one file"
iina,iina,Swift,45335,2849,1877,3474,False,True,True,True,The modern video player for macOS.
Leaflet,Leaflet,JavaScript,45241,6136,565,5754,True,True,True,True,🍃 JavaScript library for mobile-friendly interactive maps 🇺🇦
bruno,usebruno,JavaScript,45143,2616,1737,1366,False,True,True,True,Opensource IDE For Exploring and Testing API's (lightweight alternative to Postman/Insomnia)
qlib,microsoft,Python,45135,7184,447,2141,True,False,True,True,"Qlib is an AI-oriented Quant investment platform that aims to use AI tech to empower Quant Research, from exploring ideas to implementing productions. Qlib supports diverse ML modeling paradigms, including supervised learning, market dynamics modeling, and RL, and is now equipped with https://github.com/microsoft/RD-Agent to automate R&D process."
CppCoreGuidelines,isocpp,CSS,45125,5549,250,3962,False,True,True,True,"The C++ Core Guidelines are a set of tried-and-true guidelines, rules, and best practices about coding in C++"
streamlit,streamlit,Python,45064,4299,1285,2497,True,True,True,True,Streamlit — A faster way to build and share data apps.
shannon,KeygraphHQ,TypeScript,45053,5224,22,271,False,False,True,True,"Shannon is an autonomous, white-box AI pentester for web applications and APIs. It analyzes your source code, identifies attack vectors, and executes real exploits to prove vulnerabilities before they reach production."
Summer2026-Internships,SimplifyJobs,Python,45051,3179,8,2223,False,True,True,True,"Summer 2026 software engineering, data science, AI, quant, product management, and hardware internship postings. Updated daily by Simplify and Pitt CSC."
cli,cli,Go,44998,8601,1013,2456,True,True,True,True,GitHub’s official command line tool
pandoc,jgm,Haskell,44995,3906,1067,5940,False,True,True,True,Universal markup converter
helix,helix-editor,Rust,44979,3566,1553,2215,False,True,True,True,A post-modern modal text editor.
TrafficMonitor,zhongyang219,C++,44967,3703,1329,3252,False,False,True,True,这是一个用于显示当前网速、CPU及内存利用率的桌面悬浮窗软件，并支持任务栏显示，支持更换皮肤。
