repo_name,organization,language,stars,forks,open_issues,age_days,has_coc,has_contributing,has_workflows,has_readme,description
pdf.js,mozilla,JavaScript,53400,10626,423,5520,True,True,True,True,PDF Reader in JavaScript
material-design-icons,google,,53392,9727,406,4258,True,True,True,True,Material Design icons by Google (Material Symbols)
Flowise,FlowiseAI,TypeScript,53372,24495,890,1162,True,True,True,True,"Build AI Agents, Visually"
OpenSpec,Fission-AI,TypeScript,53145,3725,384,304,False,False,True,True,Spec-driven development (SDD) for AI coding assistants.
Understand-Anything,Lum1104,TypeScript,53037,4339,179,83,True,True,True,True,"Graphs that teach > graphs that impress. Turn any code into an interactive knowledge graph you can explore, search, and ask questions about. Works with Claude Code, Codex, Cursor, Copilot, Gemini CLI, and more."
jellyfin,jellyfin,C#,52950,4930,630,2735,True,True,True,True,The Free Software Media System - Server Backend & API
crewAI,crewAIInc,Python,52911,7391,398,953,False,True,True,True,"Framework for orchestrating role-playing, autonomous AI agents. By fostering collaborative intelligence, CrewAI empowers agents to work together seamlessly, tackling complex tasks."
kotlin,JetBrains,Kotlin,52819,6324,259,5226,True,True,True,True,The Kotlin Programming Language. 
Docker-OSX,sickcodes,Shell,52563,2883,418,2192,False,False,True,True,Run macOS VM in a Docker! Run near native OSX-KVM in Docker! X11 Forwarding! CI/CD for OS X Security Research! Docker mac Containers.
ionic-framework,ionic-team,TypeScript,52521,13367,625,4672,True,True,True,True,"A powerful cross-platform UI toolkit for building native-quality iOS, Android, and Progressive Web Apps with HTML, CSS, and JavaScript."
awesome-ios,vsouza,Swift,52390,6971,9,4348,True,True,True,True,"A curated list of awesome iOS ecosystem, including Objective-C and Swift Projects "
odoo,odoo,Python,52224,32706,9743,4406,False,True,True,True,Odoo. Open Source Apps To Grow Your Business.
prettier,prettier,JavaScript,51934,4743,1431,3475,True,True,True,True,Prettier is an opinionated code formatter.
Motrix,agalwood,JavaScript,51914,4880,778,2726,True,True,True,True,A full-featured download manager.
English-level-up-tips,byoungd,,51856,5387,34,3293,False,False,True,True,An advanced guide to learn English which might benefit you a lot 🎉 .  离谱的英语学习指南/英语学习教程/英语学习/学英语
etcd,etcd-io,Go,51774,10386,256,4717,True,True,True,True,Distributed reliable key-value store for the most critical data of a distributed system
grok-1,xai-org,Python,51682,8477,125,810,True,False,True,True,Grok open release
windows,dockur,Shell,51623,4349,108,873,False,False,True,True,Windows inside a Docker container.
chinese-poetry,chinese-poetry,JavaScript,51574,10386,135,3564,False,False,True,True,"The most comprehensive database of Chinese poetry 🧶最全中华古诗词数据库,  唐宋两朝近一万四千古诗人,  接近5.5万首唐诗加26万宋诗.  两宋时期1564位词人，21050首词。"
guava,google,Java,51479,11138,738,4390,True,True,True,True,Google core libraries for Java
jekyll,jekyll,Ruby,51476,10283,250,6438,True,True,True,True,:globe_with_meridians: Jekyll is a blog-aware static site generator in Ruby
lx-music-desktop,lyswhut,TypeScript,51391,6848,1195,2487,False,False,True,True,一个基于 Electron 的音乐软件
lazydocker,jesseduffield,Go,51261,1620,277,2575,True,True,True,True,The lazier way to manage everything docker
DefinitelyTyped,DefinitelyTyped,TypeScript,51250,30468,672,4991,False,False,True,True,The repository for high quality TypeScript type definitions.
minimind,jingyaogong,Python,51198,6574,42,679,True,False,True,True,🧠「大模型」2小时完全从0训练64M的小参数LLM！Train a 64M-parameter LLM from scratch in just 2h!
100-Days-Of-ML-Code,Avik-Jain,,51169,11536,68,2892,True,True,False,True,100 Days of ML Coding
freqtrade,freqtrade,Python,51169,10663,37,3306,False,True,True,True,"Free, open source crypto trading bot"
go-ethereum,ethereum,Go,51093,21927,359,4544,False,True,True,True,Go implementation of the Ethereum protocol
Semantic-UI,Semantic-Org,JavaScript,51069,4871,1071,4806,False,True,False,True,Semantic is a UI component framework based around useful principles from natural language.
awesome-wechat-weapp,justjavac,,51063,9012,2,3543,False,False,False,True,微信小程序开发资源汇总 :100:
professional-programming,charlax,Python,51046,3994,3,3864,False,True,False,True,A collection of learning resources for curious software engineers
hiring-without-whiteboards,poteto,JavaScript,50835,3899,9,3370,True,True,True,True,⭐️  Companies that don't have a broken hiring process
MediaCrawler,NanmiCoder,Python,50756,10680,168,1092,False,False,True,True,小红书笔记 | 评论爬虫、抖音视频 | 评论爬虫、快手视频 | 评论爬虫、B 站视频 ｜ 评论爬虫、微博帖子 ｜ 评论爬虫、百度贴吧帖子 ｜ 百度贴吧评论回复爬虫  | 知乎问答文章｜评论爬虫
open-source-ios-apps,dkhamsing,,50609,5784,6,4148,False,True,True,True,:iphone: Collaborative List of Open-Source iOS Apps
whisper.cpp,ggml-org,C++,50493,5621,1192,1349,False,True,True,True,Port of OpenAI's Whisper model in C/C++
dbeaver,dbeaver,Java,50420,4222,3315,3880,True,True,True,True,Free universal database tool and SQL client
plane,makeplane,TypeScript,50381,4436,885,1294,True,True,True,True,"🔥🔥🔥 Open-source Jira, Linear, Monday, and ClickUp alternative. Plane is a modern project management platform to manage tasks, sprints, docs, and triage."
bulma,jgthms,CSS,50072,3897,521,3786,False,True,True,True,Modern CSS framework based on Flexbox
mastodon,mastodon,Ruby,49999,7456,4442,3756,True,True,True,True,"Your self-hosted, globally interconnected microblogging community"
Pake,tw93,Rust,49948,10148,1,1330,True,True,True,True,🤱🏻 Turn any webpage into a desktop app with one command.
llama_index,run-llama,Python,49943,7516,432,1312,True,True,True,True,LlamaIndex is the leading document agent and OCR platform
expo,expo,TypeScript,49908,12626,616,3581,False,True,True,True,"An open-source framework for making universal native apps with React. Expo runs on Android, iOS, and the web."
json,nlohmann,C++,49880,7406,73,4719,True,True,True,True,JSON for Modern C++
awesome-openclaw-skills,VoltAgent,,49875,4856,3,131,False,True,True,True,"The awesome collection of OpenClaw skills. 5,400+ skills filtered and categorized from the official OpenClaw Skills Registry.🦞"
cypress,cypress-io,TypeScript,49681,3406,1185,4112,True,True,True,True,"Fast, easy and reliable testing for anything that runs in a browser."
Fooocus,lllyasviel,Python,49659,8039,297,1031,False,False,True,True,Focus on prompting and generating
query,TanStack,TypeScript,49637,3867,171,2460,False,True,True,True,"🤖 Powerful asynchronous state management, server-state utilities and data fetching for the web. TS/JS, React Query, Solid Query, Svelte Query and Vue Query."
alist,AlistGo,Go,49597,7942,561,1990,True,True,True,True,"🗂️A file list/WebDAV program that supports multiple storages, powered by Gin and Solidjs. / 一个支持多存储的文件列表/WebDAV程序，使用 Gin 和 Solidjs。"
hacker-scripts,NARKOZ,JavaScript,49507,6639,70,3849,False,False,False,True,Based on a true story
litellm,BerriAI,Python,49443,8638,3521,1045,False,True,True,True,"Python SDK, Proxy Server (AI Gateway) to call 100+ LLM APIs in OpenAI (or native) format, with cost tracking, guardrails, loadbalancing and logging. [Bedrock, Azure, OpenAI, VertexAI, Cohere, Anthropic, Sagemaker, HuggingFace, VLLM, NVIDIA NIM]"
huginn,huginn,Ruby,49404,4271,700,4836,False,False,True,True,Create agents that monitor and act on your behalf.  Your agents are standing by!
penpot,penpot,Clojure,49127,3137,643,3811,True,True,True,True,Penpot: The open-source design tool for design and code collaboration
twenty,twentyhq,TypeScript,49121,7031,131,1282,True,True,True,True,"The open alternative to Salesforce, designed for AI."
remotion,remotion-dev,TypeScript,49084,3467,112,2173,True,True,True,True,🎥      Make videos programmatically with React
open-source-mac-os-apps,serhii-londar,,48945,2566,97,3137,False,True,True,True,🚀 Awesome list of open source applications for macOS. https://t.me/s/opensourcemacosapps
career-ops,santifer,JavaScript,48921,10154,142,62,True,True,True,True,"AI-powered job search system built on Claude Code. 14 skill modes, Go dashboard, PDF generation, batch processing."
pandas,pandas-dev,Python,48908,19991,3226,5765,True,True,True,True,"Flexible and powerful data analysis / manipulation library for Python, providing labeled data structures similar to R data.frame objects, statistical functions, and much more"
jadx,skylot,Java,48904,5536,418,4827,True,True,True,True,Dex to Java decompiler
chinese-independent-developer,1c7,,48795,4183,2,3179,False,True,True,True,👩🏿‍💻👨🏾‍💻👩🏼‍💻👨🏽‍💻👩🏻‍💻中国独立开发者项目列表 -- 分享大家都在做什么
julia,JuliaLang,Julia,48771,5785,4692,5524,True,True,True,True,The Julia Programming Language
BMAD-METHOD,bmad-code-org,JavaScript,48656,5654,60,418,True,True,True,True,Breakthrough Method for Agile Ai Driven Development
dayjs,iamkun,JavaScript,48654,2438,1266,2978,False,True,True,True,⏰ Day.js 2kB immutable date-time library alternative to Moment.js with the same modern API
terraform,hashicorp,Go,48581,10357,1904,4467,True,True,True,True,"Terraform enables you to safely and predictably create, change, and improve infrastructure. It is a source-available tool that codifies APIs into declarative configuration files that can be shared amongst team members, treated as code, edited, reviewed, and versioned."
x64dbg,x64dbg,C++,48574,2752,569,4073,True,True,True,True,An open-source user mode debugger for Windows. Optimized for reverse engineering and malware analysis.
algorithm-visualizer,algorithm-visualizer,JavaScript,48553,7584,79,3674,True,True,False,True,:fireworks:Interactive Online Platform that Visualizes Algorithms from Code
kubernetes-the-hard-way,kelseyhightower,,48538,15695,49,3620,False,True,False,True,Bootstrap Kubernetes the hard way. No scripts.
agent-skills,addyosmani,Shell,48493,5385,97,110,False,True,True,True,Production-grade engineering skills for AI coding agents.
PythonDataScienceHandbook,jakevdp,Jupyter Notebook,48418,18965,232,3586,True,True,False,True,Python Data Science Handbook: full text in Jupyter Notebooks
brew,Homebrew,Ruby,48311,11150,18,3744,True,True,True,True,🍺 The missing package manager for macOS (or Linux)
VibeVoice,microsoft,Python,48269,5377,161,284,True,True,True,True,Open-Source Frontier Voice AI
RxJava,ReactiveX,Java,48237,7586,23,4896,False,True,True,True,RxJava – Reactive Extensions for the JVM – a library for composing asynchronous and event-based programs using observable sequences for the Java VM.
pretext,chenglou,TypeScript,48175,2687,81,90,False,False,True,True,"Fast, accurate & comprehensive text measurement & layout"
type-challenges,type-challenges,TypeScript,48169,5255,33198,2143,True,False,True,True,Collection of TypeScript type challenges with online judge
htmx,bigskysoftware,JavaScript,48162,1599,659,2244,False,True,True,True,</> htmx - high power tools for HTML
awesome-java,akullpp,,48150,7681,19,4349,False,True,True,True,"A curated list of awesome frameworks, libraries and software for the Java programming language."
moment,moment,JavaScript,47974,6989,299,5576,False,True,True,True,"Parse, validate, manipulate, and display dates in javascript."
AI-For-Beginners,microsoft,Jupyter Notebook,47974,9927,7,1920,True,False,True,True,"12 Weeks, 24 Lessons, AI for All!"
Made-With-ML,GokuMohandas,Jupyter Notebook,47886,7532,25,2770,False,False,True,True,"Learn how to develop, deploy and iterate on production-grade ML applications."
design-patterns-for-humans,nilbuild,,47859,5506,16,3396,False,False,False,True,An ultra-simplified explanation to design patterns
ClickHouse,ClickHouse,C++,47847,8473,6173,3655,True,True,True,True,ClickHouse® is a real-time analytics database management system
ruff,astral-sh,Rust,47837,2130,1997,1396,True,True,True,True,"An extremely fast Python linter and code formatter, written in Rust."
awesome-react-components,brillout,,47712,3775,53,3633,True,True,True,True,Curated List of React Components & Libraries.
Projects,karan,,47711,10640,122,4719,False,True,False,True,:page_with_curl: A list of practical projects that anyone can solve in any programming language.
big-list-of-naughty-strings,minimaxir,Python,47665,2162,108,3954,False,False,False,True,The Big List of Naughty Strings is a list of strings which have a high probability of causing issues when used as user-input data.
awesome-design-patterns,DovAmir,,47628,3254,24,2923,False,True,False,True,A curated list of software and architecture related design patterns.
tldraw,tldraw,TypeScript,47627,3280,398,1853,True,True,True,True,very good whiteboard infinite canvas SDK
gogs,gogs,Go,47586,5070,981,4497,False,True,True,True,The painless way to host your own Git service
metabase,metabase,Clojure,47582,6519,4193,4141,False,True,True,True,The easy-to-use open source Business Intelligence and Embedded Analytics tool that lets everyone work with data :bar_chart:
pixijs,pixijs,TypeScript,47331,5029,325,4883,True,True,True,True,"The HTML5 Creation Engine: Create beautiful digital content with the fastest, most flexible 2D WebGL renderer."
textgen,oobabooga,Python,47278,5978,814,1263,False,False,True,True,"Open-source desktop app for local LLMs. Text, vision, tool-calling, OpenAI/Anthropic-compatible API. 100% private."
discourse,discourse,Ruby,47190,8926,143,4893,True,True,True,True,"A platform for community discussion. Free, open, simple."
Win11Debloat,Raphire,PowerShell,47172,1900,38,2047,False,True,True,True,"A simple, lightweight PowerShell script that allows you to remove pre-installed apps, disable telemetry, as well as perform various other changes to declutter and customize your Windows experience. Win11Debloat works for both Windows 10 and Windows 11."
quill,slab,TypeScript,47126,3650,650,5058,True,True,True,True,Quill is a modern WYSIWYG editor built for compatibility and extensibility
react,typescript-cheatsheets,TypeScript,47068,4295,0,2926,True,True,True,True,Cheatsheets for experienced React developers getting started with TypeScript
slidev,slidevjs,TypeScript,46997,2091,191,1869,True,True,True,True,Presentation Slides for Developers
okhttp,square,Kotlin,46970,9274,115,5065,False,True,True,True,"Square’s meticulous HTTP client for the JVM, Android, and GraalVM."
cherry-studio,CherryHQ,TypeScript,46944,4457,1132,743,True,True,True,True,"AI productivity studio with smart chat, autonomous agents, and 300+ assistants. Unified access to frontier LLMs"
serverless,serverless,JavaScript,46922,5734,1225,4064,True,True,True,True,"⚡ Serverless Framework – Effortlessly build apps that auto-scale, incur zero costs when idle, and require minimal maintenance using AWS Lambda and other managed cloud services."
legado,gedoor,Kotlin,46893,5715,18,2572,False,False,True,True,"Legado 3.0 Book Reader with powerful controls & full functions❤️阅读3.0, 阅读是一款可以自定义来源阅读网络内容的工具，为广大网络文学爱好者提供一种方便、快捷舒适的试读体验。"
frontend-dev-bookmarks,dypsilon,,46880,5149,131,4731,False,True,False,True,Manually curated collection of resources for frontend web developers.
v2ray-core,v2ray,Go,46853,8844,19,3927,True,False,True,True,A platform for building proxies to bypass network restrictions.
acme.sh,acmesh-official,Shell,46803,5585,1400,3814,False,False,True,True,A pure Unix shell script ACME client for SSL / TLS certificate automation
goose,aaif-goose,Rust,46781,4898,297,651,False,True,True,True,"an open source, extensible AI agent that goes beyond code suggestions - install, execute, edit, and test with any LLM"
spotube,KRTirtho,Dart,46742,2130,804,1938,True,False,True,True,🎧 Open source music streaming app! Available for both desktop & mobile!
GitHubDaily,GitHubDaily,,46700,4641,625,2714,False,False,False,True,"坚持分享 GitHub 上高质量、有趣实用的开源技术教程、开发者工具、编程网站、技术资讯。A list cool, interesting projects of GitHub."
LocalAI,mudler,Go,46697,4137,199,1175,False,True,True,True,"LocalAI is the open-source AI engine. Run any model - LLMs, vision, voice, image, video - on any hardware. No GPU required."
nvm-windows,coreybutler,Go,46692,3833,88,4276,False,True,True,True,A node.js version management utility for Windows. Ironically written in Go.
JeecgBoot,jeecgboot,Java,46630,16038,30,2748,False,False,True,True,AI 低代码平台「低代码 + 零代码」双驱动！低代码可一键生成前后端代码;零代码可 5 分钟搭建系统;AI Skills 一句话画流程、设计表单、生成整套系统。内置 AI聊天、知识库、流程编排、MCP插件等，兼容主流大模型。引领「AI 生成 → 在线配置 → 代码生成 → 手工合并->AI修改」开发模式，消除 Java 项目 80% 的重复工作，提效而不失灵活。
bevy,bevyengine,Rust,46472,4612,3226,2330,True,True,True,True,A refreshingly simple data-driven game engine built in Rust
30-Days-Of-JavaScript,Asabeneh,JavaScript,46418,10438,368,2356,False,False,False,True,"30 days of JavaScript programming challenge is a step-by-step guide to learn JavaScript programming language in 30 days. This challenge may take more than 100 days,  please just follow your own pace. These videos may help too: https://www.youtube.com/channel/UC7PNRuno1rzYPb1xLa4yktw"
tmux,tmux,C,46313,2670,46,4020,False,True,True,True,tmux source code
prisma,prisma,TypeScript,46204,2236,2612,2542,True,True,True,True,"Next-generation ORM for Node.js & TypeScript | PostgreSQL, MySQL, MariaDB, SQL Server, SQLite, MongoDB and CockroachDB"
awesome-remote-job,lukasz-madon,,46201,4622,33,4173,False,True,True,True,A curated list of awesome remote jobs and resources. Inspired by https://github.com/vinta/awesome-python
monaco-editor,microsoft,JavaScript,46139,4072,827,3650,True,True,True,True,A browser based code editor
learn-regex,ziishaned,,46116,6164,65,3240,False,False,False,True,Learn regex the easy way
awesome-cheatsheets,LeCoupa,JavaScript,45970,6713,139,3131,False,False,True,True,"👩‍💻👨‍💻 Awesome cheatsheets for popular programming languages, frameworks and development tools. They include everything you should know in one single file."
fanqiang,bannedbook,Kotlin,45873,7938,327,4161,False,False,True,True,翻墙-科学上网
aider,Aider-AI,Python,45821,4553,1599,1123,False,True,True,True,aider is AI pair programming in your terminal
upscayl,upscayl,TypeScript,45808,2252,63,1406,False,False,True,True,"🆙 Upscayl - #1 Free and Open Source AI Image Upscaler for Linux, MacOS and Windows."
awesome-claude-code,hesreallyhim,Python,45798,3992,399,412,True,True,True,True,"A curated list of awesome skills, hooks, slash-commands, agent orchestrators, applications, and plugins for Claude Code by Anthropic"
architecture-samples,android,Kotlin,45713,11873,221,3773,False,True,True,True,A collection of samples to discuss and showcase different architectural tools and patterns for Android apps.
airflow,apache,Python,45710,17181,1714,4071,True,True,True,True,"Apache Airflow - A platform to programmatically author, schedule, and monitor workflows"
zx,google,JavaScript,45532,1276,48,1858,True,True,True,True,A tool for writing better scripts
TTS,coqui-ai,Python,45498,6111,8,2207,True,True,True,True,"🐸💬 - a deep learning toolkit for Text-to-Speech, battle-tested in research and production"
awesome-compose,docker,HTML,45483,8191,380,2304,False,True,True,True,Awesome Docker Compose samples
AdminLTE,ColorlibHQ,CSS,45440,18215,0,4546,True,True,True,True,AdminLTE - Free admin dashboard template based on Bootstrap 5
Rocket.Chat,RocketChat,TypeScript,45419,13620,3766,4035,True,True,True,True,The Secure CommsOS™ for mission-critical operations
jest,jestjs,TypeScript,45381,6663,233,4561,True,True,True,True,Delightful JavaScript Testing.
exo,exo-explore,Python,45177,3229,253,711,False,True,True,True,Run frontier AI locally.
Leaflet,Leaflet,JavaScript,45149,6131,546,5735,True,True,True,True,🍃 JavaScript library for mobile-friendly interactive maps 🇺🇦
cal.diy,calcom,TypeScript,45142,13902,1318,1901,True,True,True,True,Scheduling infrastructure for absolutely everyone.
iina,iina,Swift,45126,2833,1887,3455,False,True,True,True,The modern video player for macOS.
copyparty,9001,Python,45122,1840,262,2567,True,True,False,True,"Portable file server with accelerated resumable uploads, dedup, WebDAV, SFTP, FTP, TFTP, zeroconf, media indexer, thumbnails++ all in one file"
CowAgent,zhayujie,Python,45081,10170,11,1398,False,True,True,True,"Open-source super AI assistant & Agent Harness. Plans tasks, runs tools and skills, autonomously grows with memory and knowledge. Multi-model, multi-channel. Lightweight, extensible, one-line install. (formerly chatgpt-on-wechat)"
CppCoreGuidelines,isocpp,CSS,45052,5541,249,3943,False,True,True,True,"The C++ Core Guidelines are a set of tried-and-true guidelines, rules, and best practices about coding in C++"
claude-cookbooks,anthropics,Jupyter Notebook,45009,5201,220,1025,False,True,True,True,A collection of notebooks/recipes showcasing some fun and effective ways of using Claude.
Umi-OCR,hiroi-sora,Python,44913,4424,341,1531,False,False,False,True,"OCR software, free and offline. 开源、免费的离线OCR软件。支持截屏/批量导入图片，PDF文档识别，排除水印/页眉页脚，扫描/生成二维码。内置多国语言库。"
pyenv,pyenv,Shell,44875,3247,54,5026,False,True,True,True,Simple Python version management
grpc,grpc,C++,44861,11156,1323,4197,True,True,True,True,"C++ based gRPC (C++, Python, Ruby, Objective-C, PHP, C#)"
edex-ui,GitSquared,JavaScript,44857,3122,6,3415,False,False,True,True,"A cross-platform, customizable science fiction terminal emulator with advanced monitoring & touchscreen support."
streamlit,streamlit,Python,44850,4267,1314,2478,True,True,True,True,Streamlit — A faster way to build and share data apps.
Summer2026-Internships,SimplifyJobs,Python,44821,3183,5,2204,False,True,True,True,"Summer 2026 software engineering, data science, AI, quant, product management, and hardware internship postings. Updated daily by Simplify and Pitt CSC."
helix,helix-editor,Rust,44814,3519,1542,2196,False,True,True,True,A post-modern modal text editor.
meteor,meteor,JavaScript,44781,5251,385,5252,True,True,True,True,"Meteor, the JavaScript App Platform"
react-hook-form,react-hook-form,TypeScript,44756,2410,67,2649,True,True,True,True,📋 React Hooks for form state management and validation (Web + React Native)
cli,cli,Go,44726,8537,1003,2437,True,True,True,True,GitHub’s official command line tool
bruno,usebruno,JavaScript,44714,2552,1691,1347,False,True,True,True,Opensource IDE For Exploring and Testing API's (lightweight alternative to Postman/Insomnia)
TrafficMonitor,zhongyang219,C++,44707,3693,1318,3233,False,False,True,True,这是一个用于显示当前网速、CPU及内存利用率的桌面悬浮窗软件，并支持任务栏显示，支持更换皮肤。
milvus,milvus-io,Go,44649,4041,934,2454,True,True,True,True,"Milvus is a high-performance, cloud-native vector database built for scalable vector ANN search"
pandoc,jgm,Haskell,44622,3887,1059,5921,False,True,True,True,Universal markup converter
reactjs-interview-questions,sudheerj,JavaScript,44617,10368,15,2927,False,False,True,True,List of top 500 ReactJS Interview Questions & Answers....Coding exercise questions are coming soon!!
hyper,vercel,TypeScript,44605,3560,1042,3627,False,False,True,True,A terminal built on web technologies
RSSHub,DIYgod,TypeScript,44517,9893,354,2986,True,True,True,True,🧡 Everything is RSSible
shannon,KeygraphHQ,TypeScript,44297,5130,10,252,False,False,True,True,"Shannon Lite is an autonomous, white-box AI pentester for web applications and APIs. It analyzes your source code, identifies attack vectors, and executes real exploits to prove vulnerabilities before they reach production."
siyuan,siyuan-note,TypeScript,44291,2827,348,2105,True,True,True,True,"A privacy-first, self-hosted, fully open source personal knowledge management software, written in typescript and golang."
jsoncrack.com,AykutSarac,TypeScript,44077,3546,35,1587,True,True,True,True,"✨ Innovative and open-source visualization application that transforms various data formats, such as JSON, YAML, XML and CSV into interactive graphs."
qlib,microsoft,Python,44076,6938,420,2121,True,False,True,True,"Qlib is an AI-oriented Quant investment platform that aims to use AI tech to empower Quant Research, from exploring ideas to implementing productions. Qlib supports diverse ML modeling paradigms, including supervised learning, market dynamics modeling, and RL, and is now equipped with https://github.com/microsoft/RD-Agent to automate R&D process."
cobra,spf13,Go,44062,3158,371,4658,False,True,True,True,A Commander for modern Go CLI interactions
sentry,getsentry,Python,44052,4720,2079,5758,True,True,True,True,Developer-first error tracking and performance monitoring
parcel,parcel-bundler,JavaScript,44026,2278,595,3224,True,True,True,True,The zero configuration build tool for the web. 📦🚀
react-use,streamich,TypeScript,43979,3269,657,2778,False,True,True,True,React Hooks — 👍
front-end-interview-handbook,yangshun,MDX,43966,5950,12,3065,True,True,True,True,Front End interview preparation materials for busy engineers (updated for 2026)
babel,babel,TypeScript,43939,5827,761,4268,True,True,True,True,🐠 Babel is a compiler for writing next generation JavaScript.
