repo_name,organization,language,stars,forks,open_issues,age_days,has_coc,has_contributing,has_workflows,has_readme,description
agency-agents,msitarzewski,Shell,66661,10072,91,168,False,True,True,True,"A complete AI agency at your fingertips - From frontend wizards to Reddit community ninjas, from whimsy injectors to reality checkers. Each agent is a specialized expert with personality, processes, and proven deliverables."
MetaGPT,FoundationAgents,Python,66475,8391,102,1004,False,False,True,True,"🌟 The Multi-Agent Framework: First AI Software Company, Towards Natural Language Programming"
ghidra,NationalSecurityAgency,Java,66373,7313,1870,2587,False,True,True,True,Ghidra is a software reverse engineering (SRE) framework
33-js-concepts,leonardomso,JavaScript,66300,9191,2,2764,True,True,True,True,📜 33 JavaScript concepts every developer should know.
annotated_deep_learning_paper_implementations,labmlai,Python,66193,6660,29,2044,False,False,True,True,"🧑‍🏫 60+ Implementations/tutorials of deep learning papers with side-by-side notes 📝; including transformers (original, xl, switch, feedback, vit, ...), optimizers (adam, adabelief, sophia, ...), gans(cyclegan, stylegan2, ...), 🎮 reinforcement learning (ppo, dqn), capsnet, distillation, ... 🧠"
ChinaTextbook,TapXWorld,Roff,66164,14744,98,2277,False,False,False,True,所有小初高、大学PDF教材。
echarts,apache,TypeScript,66046,19823,1740,4745,True,True,True,True,"Apache ECharts is a powerful, interactive charting and data visualization library for browser"
webpack,webpack,JavaScript,65956,9377,202,5133,True,True,True,True,"A bundler for javascript and friends. Packs many modules into a few bundled assets. Code Splitting allows for loading parts of the application on demand. Through ""loaders"", modules can be CommonJs, AMD, ES6 modules, CSS, Images, JSON, Coffeescript, LESS, ... and your custom stuff."
gpt4free,xtekky,Python,65950,13644,7,1097,True,True,True,True,The official gpt4free repository | various collection of powerful language models | opus 4.6 gpt 5.3 kimi 2.5 deepseek v3.2 gemini 3
scikit-learn,scikit-learn,Python,65562,26864,2129,5704,True,True,True,True,scikit-learn: machine learning in Python
awesome-nodejs,sindresorhus,,65430,6202,27,4280,True,True,True,True,":zap: Delightful Node.js packages and resources [BECAUSE OF TOO MUCH SPAM AND LOW-QUALITY SUBMISSIONS, SUBMISSIONS ARE PAUSED UNTIL SEPTEMBER]"
javascript-questions,lydiahallie,,65296,9236,50,2483,False,False,False,True,"A long list of (advanced) JavaScript questions, and their explanations :sparkles:  "
Java,TheAlgorithms,Java,65290,21044,54,3544,True,True,True,True,All Algorithms implemented in Java
design-resources-for-developers,bradtraversy,,65121,11998,3,2154,False,True,False,True,"Curated list of design and UI resources from stock photos, web templates, CSS frameworks, UI libraries, tools and much more"
nocode,kelseyhightower,Dockerfile,65121,4828,4700,2974,False,True,False,True,The best way to write secure and reliable applications. Write nothing; deploy nowhere.
interviews,kdn251,Java,64901,12920,118,3331,False,False,False,True,Everything you need to know to get the job.
localstack,localstack,Python,64831,4666,0,3443,True,True,True,True,💻 A fully functional local AWS cloud stack. Develop and test your cloud & Serverless apps offline
Apollo-11,chrislgarry,Assembly,64691,7391,126,4379,False,True,True,True,Original Apollo 11 Guidance Computer (AGC) source code for the command and lunar modules.
OpenBB,OpenBB-finance,Python,64627,6355,79,1926,True,False,True,True,"Financial data platform for analysts, quants and AI agents."
docusaurus,facebook,TypeScript,64315,9793,368,3205,True,True,True,True,Easy to maintain open source documentation websites.
keras,keras-team,Python,63924,19746,302,4021,False,True,True,True,Deep Learning for humans
prometheus,prometheus,Go,63317,10287,773,4874,True,True,True,True,The Prometheus monitoring system and time series database.
alacritty,alacritty,Rust,63171,3374,338,3694,False,True,True,True,"A cross-platform, OpenGL terminal emulator."
pathway,pathwaycom,Python,63141,1628,31,1219,True,True,True,True,"Python ETL framework for stream processing, real-time analytics, LLM pipelines, and RAG."
socket.io,socketio,TypeScript,62992,10154,207,5863,False,True,True,True,Realtime application framework (Node.JS server)
crawl4ai,unclecode,Python,62934,6422,50,690,True,True,True,True,"🚀🤖 Crawl4AI: Open-source LLM Friendly Web Crawler & Scraper. Don't be shy, join here: https://discord.gg/jP8KfhDhyN"
open-interpreter,openinterpreter,Python,62932,5427,310,990,False,True,True,True,A natural language interface for computers
resume.github.com,resume,JavaScript,62828,1368,71,5531,False,False,False,True,Resumes generated using the GitHub informations
nocodb,nocodb,TypeScript,62560,4700,669,3074,True,True,True,True,🔥 🔥 🔥 A Free & Self-hostable Airtable Alternative
uBlock,gorhill,JavaScript,62417,3991,17,4016,False,True,True,True,uBlock Origin - An efficient blocker for Chromium and Firefox. Fast and lean.
traefik,traefik,Go,62406,5895,774,3851,True,True,True,True,The Cloud Native Application Proxy
rustlings,rust-lang,Rust,62329,11166,84,3850,False,True,True,True,:crab: Small exercises to get you used to reading and writing Rust code!
nerd-fonts,ryanoasis,CSS,62266,3871,63,4134,True,True,True,True,"Iconic font aggregator, collection, & patcher. 3,600+ icons, 50+ patched fonts: Hack, Source Code Pro, more. Glyph collections: Font Awesome, Material Design Icons, Octicons, & more"
autoresearch,karpathy,Python,61943,8646,160,24,False,False,True,True,AI agents running research on single-GPU nanochat training automatically
ladybird,LadybirdBrowser,C++,61901,2903,637,669,True,True,True,True,Truly independent web browser
tldr,tldr-pages,Markdown,61856,5142,279,4495,False,True,True,True,Collaborative cheatsheets for console commands 📚.
sway,FuelLabs,Rust,61836,5426,892,1896,False,False,True,True,🌴 Empowering everyone to build reliable and efficient smart contracts.
ripgrep,BurntSushi,Rust,61615,2451,151,3672,False,False,True,True,ripgrep recursively searches directories for a regex pattern while respecting your gitignore
lodash,lodash,JavaScript,61527,7124,142,5106,False,True,True,True,"A modern JavaScript utility library delivering modularity, performance, & extras."
redux,reduxjs,TypeScript,61452,15113,43,3958,True,True,True,True,A JS library for predictable global state management
scrapy,scrapy,Python,60996,11404,653,5881,True,True,True,True,"Scrapy, a fast high-level web crawling & scraping framework for Python."
atom,atom,JavaScript,60969,17254,994,5183,True,True,False,True,:atom: The hackable text editor
leetcode-master,youngyangyang04,Shell,60919,12330,243,2298,False,False,False,True,《代码随想录》LeetCode 刷题攻略：200道经典题目刷题顺序，共60w字的详细图解，视频难点剖析，50余张思维导图，支持C++，Java，Python，Go，JavaScript等多语言版本，从此算法学习不再迷茫！🔥🔥 来看看，你会发现相见恨晚！🚀 
architect-awesome,xingshaocheng,,60829,17760,63,2915,False,False,False,True,后端架构师技术图谱
Front-end-Developer-Interview-Questions,h5bp,Nunjucks,60813,11062,52,5163,True,True,True,True,"A list of helpful front-end related questions you can use to interview potential candidates, test yourself or completely ignore."
minio,minio,Go,60588,7335,80,4093,True,True,True,True,"MinIO is a high-performance, S3 compatible object store, open sourced under GNU AGPLv3 license."
openpilot,commaai,Python,60455,10768,247,3414,False,True,True,True,"openpilot is an operating system for robotics. Currently, it upgrades the driver assistance system on 300+ supported cars."
30-Days-Of-Python,Asabeneh,Python,60288,11495,105,2323,False,False,True,True,The 30 Days of Python programming challenge is a step-by-step guide to learn the Python programming language in 30 days. This challenge may take more than 100 days. Follow your own pace. These videos may help too: https://www.youtube.com/channel/UC7PNRuno1rzYPb1xLa4yktw
markdown-here,adam-p,JavaScript,60169,11095,319,5070,False,True,False,True,"Google Chrome, Firefox, and Thunderbird extension that lets you write email in Markdown and render it before sending."
drawio-desktop,jgraph,JavaScript,60115,5634,65,3231,True,False,True,True,Official electron build of draw.io
git,git,C,60011,27713,361,6459,True,True,True,True,Git Source Code Mirror - This is a publish-only repository but pull requests can be turned into patches to the mailing list via GitGitGadget (https://gitgitgadget.github.io/). Please follow Documentation/SubmittingPatches procedure for any of your improvements.
nuxt,nuxt,TypeScript,59923,5578,936,3442,True,True,True,True,The Full-Stack Vue Framework.
jquery,jquery,JavaScript,59860,20465,93,6205,True,True,True,True,jQuery JavaScript Library
spring-framework,spring-projects,Java,59794,38897,370,5592,True,True,True,True,Spring Framework
llm-app,pathwaycom,Jupyter Notebook,59716,1410,9,985,True,True,True,True,"Ready-to-run cloud templates for RAG, AI pipelines, and enterprise search with live data. 🐳Docker-friendly.⚡Always in sync with Sharepoint, Google Drive, S3, Kafka, PostgreSQL, real-time data APIs, and more."
cline,cline,TypeScript,59685,6069,696,632,True,True,True,True,"Autonomous coding agent right in your IDE, capable of creating/editing files, executing commands, using the browser, and more with your permission every step of the way."
Magisk,topjohnwu,Kotlin,59604,17102,52,3490,False,False,True,True,The Magic Mask for Android
Real-Time-Voice-Cloning,CorentinJ,Python,59567,9416,170,2500,False,False,True,True,Clone a voice in 5 seconds to generate arbitrary speech in real-time
awesome-flutter,Solido,Dart,59452,6871,27,3249,False,True,True,True,"An awesome list that curates the best Flutter libraries, tools, tutorials, articles and more."
shadowsocks-windows,shadowsocks,C#,59280,16282,199,4823,False,True,False,True,A C# port of shadowsocks
llama,meta-llama,Python,59279,9827,517,1140,True,True,True,True,Inference code for Llama models
angular.js,angular,JavaScript,58865,27202,461,5928,True,True,False,True,AngularJS - HTML enhanced for web apps!
awesome-chatgpt-prompts-zh,PlexPt,,58852,13556,44,1205,False,False,False,True,ChatGPT 中文调教指南。各种场景使用指南。学习怎么让它听你的话。
unsloth,unslothai,Python,58701,4979,1051,852,True,True,True,True,"Unsloth Studio is a web UI for training and running open models like Qwen, DeepSeek, gpt-oss and Gemma locally."
FFmpeg,FFmpeg,C,58450,13642,3,5464,False,True,False,True,Mirror of https://git.ffmpeg.org/ffmpeg.git
memos,usememos,Go,58400,4230,24,1573,False,False,True,True,"Open-source, self-hosted note-taking tool built for quick capture. Markdown-native, lightweight, and fully yours."
mkcert,FiloSottile,Go,58375,3053,165,2835,True,True,True,True,A simple zero-config tool to make locally trusted development certificates with any names you'd like.
rails,rails,Ruby,58317,22179,1539,6563,True,True,True,True,Ruby on Rails
gstack,garrytan,TypeScript,58209,7601,291,19,False,True,True,True,"Use Garry Tan's exact Claude Code setup: 23 opinionated tools that serve as CEO, Designer, Eng Manager, Release Manager, Doc Engineer, and QA"
astro,withastro,TypeScript,57979,3283,276,1841,True,True,True,True,The web framework for content-driven websites. ⭐️ Star to support our work!
bat,sharkdp,Rust,57884,1499,342,2900,False,True,True,True,A cat(1) clone with wings.
MinerU,opendatalab,Python,57639,4769,155,760,False,False,True,True,Transforms complex documents like PDFs into LLM-ready markdown/JSON for your Agentic workflows.
vaultwarden,dani-garcia,Rust,57580,2667,52,2963,False,False,True,True,"Unofficial Bitwarden compatible server written in Rust, formerly known as bitwarden_rs"
zustand,pmndrs,TypeScript,57567,2015,4,2547,False,True,True,True,🐻 Bear necessities for state management in React
html5-boilerplate,h5bp,JavaScript,57414,12300,12,5909,True,True,True,True,"A professional front-end template for building fast, robust, and adaptable web apps or sites."
DeepLearning-500-questions,scutan90,JavaScript,57273,15963,121,2833,False,False,False,True,深度学习500问，以问答形式对常用的概率知识、线性代数、机器学习、深度学习、计算机视觉等热点问题进行阐述，以帮助自己及有需要的读者。 全书分为18个章节，50余万字。由于水平有限，书中不妥之处恳请广大读者批评指正。   未完待续............ 如有意合作，联系scutjy2015@163.com                     版权所有，违权必究       Tan 2018.06
pocketbase,pocketbase,Go,57249,3235,24,1364,False,True,True,True,Open Source realtime backend in 1 file
fuel-core,FuelLabs,Rust,57230,2864,190,2041,False,True,True,True,Rust full node implementation of the Fuel v2 protocol.
private-gpt,zylon-ai,Python,57199,7611,292,1063,False,False,True,False,"Interact with your documents using the power of GPT, 100% privately, no data leaks"
anything-llm,Mintplex-Labs,JavaScript,57195,6188,300,1031,False,True,True,True,The all-in-one AI productivity accelerator. On device and privacy first with no annoying setup or configuration.
yolov5,ultralytics,Python,57119,17451,44,2143,True,True,True,True,YOLOv5 🚀 in PyTorch > ONNX > CoreML > TFLite
hackingtool,Z4nzu,Python,56909,6249,50,2179,False,False,True,True,ALL IN ONE Hacking Tool For Hackers
meilisearch,meilisearch,Rust,56843,2465,279,2898,True,True,True,True,A lightning-fast search engine API bringing AI-powered hybrid search to your sites and applications.
you-get,soimort,Python,56828,9770,381,4970,False,True,True,True,:arrow_double_down: Dumb downloader that scrapes the web
docling,docling-project,Python,56773,3858,866,629,True,True,True,True,Get your documents ready for gen AI
autogen,microsoft,Python,56469,8485,722,955,True,True,True,True,A programming framework for agentic AI
awesome-rust,rust-unofficial,Rust,56466,3263,14,4274,False,True,True,True,A curated list of Rust code and resources.
rclone,rclone,Go,56382,5003,1163,4397,True,True,True,True,"""rsync for cloud storage"" - Google Drive, S3, Dropbox, Backblaze B2, One Drive, Swift, Hubic, Wasabi, Google Cloud Storage, Azure Blob, Azure Files, Yandex Files"
pi-hole,pi-hole,Shell,56340,3001,54,4313,True,True,True,True,A black hole for Internet advertisements
react-router,remix-run,TypeScript,56330,10836,162,4336,True,True,True,True,Declarative routing for React
GPT-SoVITS,RVC-Boss,Python,56264,6146,869,806,False,False,True,True,1 min voice data can also be used to train a good TTS model! (few shot voice cloning)
face_recognition,ageitgey,Python,56248,13704,831,3314,False,True,True,True,The world's simplest facial recognition api for Python and the command line
gatsby,gatsbyjs,JavaScript,55951,10213,366,3966,True,True,True,True,"React-based framework with performance, scalability, and security built in."
github-cheat-sheet,tiimgreen,,55939,5406,43,4370,False,True,False,True,A list of cool features of Git and GitHub.
rich,Textualize,Python,55924,2084,312,2332,True,True,True,True,Rich is a Python library for rich text and beautiful formatting in the terminal.
nanoGPT,karpathy,Python,55855,9523,339,1189,False,False,False,True,"The simplest, fastest repository for training/finetuning medium-sized GPTs."
leetcode,azl397985856,JavaScript,55811,9437,10,2922,False,True,False,True,LeetCode Solutions: A Record of My Problem Solving Journey.( leetcode题解，记录自己的leetcode解题之路。)
awesome-android-ui,wasabeef,,55747,10275,38,4115,True,False,False,True,A curated list of awesome Android UI/UX libraries
project-layout,golang-standards,Makefile,55664,5438,98,3124,False,False,True,True,Standard Go Project Layout
starship,starship,Rust,55606,2443,1005,2555,True,True,True,True,"☄🌌️  The minimal, blazing-fast, and infinitely customizable prompt for any shell!"
OpenManus,FoundationAgents,Python,55560,9705,530,389,True,False,True,True,"No fortress, purely open ground.  OpenManus is Coming."
ai-agents-for-beginners,microsoft,Jupyter Notebook,55490,19165,15,487,True,False,True,True,12 Lessons to Get Started Building AI Agents
appwrite,appwrite,TypeScript,55420,5161,766,2548,True,True,True,True,"Appwrite® - complete cloud infrastructure for your web, mobile and AI apps. Including Auth, Databases, Storage, Functions, Messaging, Hosting, Realtime and more"
ui-ux-pro-max-skill,nextlevelbuilder,Python,55311,5370,71,120,False,False,True,True,An AI SKILL that provide design intelligence for building professional UI/UX multiple platforms
gpt-engineer,AntonOsika,Python,55234,7309,68,1066,True,True,True,True,CLI platform to experiment with codegen. Precursor to: https://lovable.dev
ultralytics,ultralytics,Python,55226,10621,305,1296,True,True,True,True,Ultralytics YOLO 🚀
faceswap,deepfakes,Python,55101,13410,4,3023,True,False,True,True,Deepfakes Software For All
marktext,marktext,JavaScript,54783,4069,1417,3060,True,True,True,True,"📝A simple and elegant markdown editor, available for Linux, macOS and Windows."
gitea,go-gitea,Go,54608,6515,2863,3437,True,True,True,True,"Git with a cup of tea! Painless self-hosted all-in-one software development service, including Git hosting, code review, team collaboration, package registry and CI/CD"
ChatGPT,lencx,Rust,54372,6188,925,1209,False,False,True,True,"🔮 ChatGPT Desktop Application (Mac, Windows and Linux)"
deer-flow,bytedance,Python,54309,6556,438,328,False,True,True,True,"An open-source long-horizon SuperAgent harness that researches, codes, and creates. With the help of sandboxes, memories, tools, skill, subagents and message gateway, it handles different levels of tasks that could take minutes to hours."
MoneyPrinterTurbo,harry0703,Python,54205,7648,238,750,False,False,True,True,利用AI大模型，一键生成高清短视频 Generate short videos with one click using AI LLM.
element,ElemeFE,Vue,54175,14519,2967,3495,False,False,True,True,A Vue.js 2.0 UI Toolkit for Web
joplin,laurent22,TypeScript,54156,6038,617,3360,False,True,True,True,"Joplin - the privacy-focused note taking app with sync capabilities for Windows, macOS, Linux, Android and iOS."
maybe,maybe-finance,Ruby,54049,5484,0,819,False,True,True,True,The personal finance app for everyone
requests,psf,Python,53850,9812,239,5524,True,True,True,True,"A simple, yet elegant, HTTP library."
segment-anything,facebookresearch,Jupyter Notebook,53814,6300,592,1103,True,True,True,True,"The repository provides code for running inference with the SegmentAnything Model (SAM), links for downloading the trained model checkpoints, and example notebooks that show how to use the model."
normalize.css,necolas,CSS,53733,10447,74,5444,False,True,False,True,A modern alternative to CSS resets
dive,wagoodman,Go,53671,1972,202,2878,False,False,True,True,A tool for exploring each layer in a docker image
powerlevel10k,romkatv,Shell,53521,2396,142,2591,False,False,False,True,A Zsh theme
n8n-workflows,Zie619,Python,53393,6939,21,320,False,False,True,True,all of the workflows of n8n i could find (also from the site itself)
Free-Certifications,cloudcommunity,,53390,3526,69,2068,False,False,False,True,A curated list of free courses with certifications. Also available at https://free-certifications.com/
core,vuejs,TypeScript,53349,9073,976,2848,False,True,True,True,"🖖 Vue.js is a progressive, incrementally-adoptable JavaScript framework for building UI on the web."
trackerslist,ngosang,,53341,6623,6,3627,False,False,True,True,Updated list of public BitTorrent trackers
first-contributions,firstcontributions,,53240,100462,251,3478,True,True,True,True,🚀✨ Help beginners to contribute to open source projects
pdf.js,mozilla,JavaScript,53059,10602,467,5452,True,True,True,True,PDF Reader in JavaScript
material-design-icons,google,,53041,9724,402,4191,True,True,True,True,Material Design icons by Google (Material Symbols)
ImHex,WerWolv,C++,53001,2343,333,1966,True,True,True,True,"🔍 A Hex Editor for Reverse Engineers, Programmers and people who value their retinas when working at 3 AM."
v2rayNG,2dust,Kotlin,52994,7093,5,2512,False,False,True,True,"A V2Ray client for Android, support Xray core and v2fly core"
termux-app,termux,Java,52691,6296,509,3811,False,False,True,True,Termux - a terminal emulator application for Android OS extendible by variety of packages.
kotlin,JetBrains,Kotlin,52517,6275,224,5159,True,True,True,True,The Kotlin Programming Language. 
ionic-framework,ionic-team,TypeScript,52426,13386,627,4605,True,True,True,True,"A powerful cross-platform UI toolkit for building native-quality iOS, Android, and Progressive Web Apps with HTML, CSS, and JavaScript."
coolify,coollabsio,PHP,52409,3942,728,1890,True,True,True,True,"An open-source, self-hostable PaaS alternative to Vercel, Heroku & Netlify that lets you easily deploy static sites, databases, full-stack applications and 280+ one-click services on your own servers."
typst,typst,Rust,52359,1519,1164,2379,False,True,True,True,A markup-based typesetting system that is powerful and easy to learn.
Docker-OSX,sickcodes,Shell,52355,2909,415,2125,False,False,True,True,Run macOS VM in a Docker! Run near native OSX-KVM in Docker! X11 Forwarding! CI/CD for OS X Security Research! Docker mac Containers.
Ghost,TryGhost,JavaScript,52260,11407,363,4713,True,True,True,True,"Independent technology for modern publishing, memberships, subscriptions and newsletters."
PowerShell,PowerShell,C#,52189,8235,1437,3729,True,True,True,True,PowerShell for every system!
prettier,prettier,JavaScript,51741,4696,1469,3408,True,True,True,True,Prettier is an opinionated code formatter.
etcd,etcd-io,Go,51672,10339,212,4650,True,True,True,True,Distributed reliable key-value store for the most critical data of a distributed system
awesome-ios,vsouza,Swift,51655,6958,20,4281,True,True,True,True,"A curated list of awesome iOS ecosystem, including Objective-C and Swift Projects "
mem0,mem0ai,Python,51527,5765,256,1014,False,True,True,True,Universal memory layer for AI Agents
grok-1,xai-org,Python,51517,8469,123,743,True,False,True,True,Grok open release
guava,google,Java,51514,11154,726,4323,True,True,True,True,Google core libraries for Java
jekyll,jekyll,Ruby,51469,10296,242,6370,True,True,True,True,:globe_with_meridians: Jekyll is a blog-aware static site generator in Ruby
Flowise,FlowiseAI,TypeScript,51267,24001,832,1095,True,True,True,True,"Build AI Agents, Visually"
Motrix,agalwood,JavaScript,51191,4840,775,2659,True,True,True,True,A full-featured download manager.
chinese-poetry,chinese-poetry,JavaScript,51179,10336,130,3497,False,False,True,True,"The most comprehensive database of Chinese poetry 🧶最全中华古诗词数据库,  唐宋两朝近一万四千古诗人,  接近5.5万首唐诗加26万宋诗.  两宋时期1564位词人，21050首词。"
context7,upstash,TypeScript,51143,2427,169,369,False,False,True,True,Context7 Platform -- Up-to-date code documentation for LLMs and AI code editors
Semantic-UI,Semantic-Org,JavaScript,51120,4891,1074,4739,False,True,False,True,Semantic is a UI component framework based around useful principles from natural language.
DefinitelyTyped,DefinitelyTyped,TypeScript,51109,30567,699,4924,False,False,True,True,The repository for high quality TypeScript type definitions.
go-ethereum,ethereum,Go,50963,21884,385,4477,False,True,True,True,Go implementation of the Ethereum protocol
windows,dockur,Shell,50766,4168,117,806,False,False,True,True,Windows inside a Docker container.
nanochat,karpathy,Python,50713,6651,83,168,False,False,True,True,The best ChatGPT that $100 can buy.
professional-programming,charlax,Python,50699,3970,1,3797,False,True,False,True,A collection of learning resources for curious software engineers
awesome-wechat-weapp,justjavac,,50677,9004,2,3476,False,False,False,True,微信小程序开发资源汇总 :100:
winutil,ChrisTitusTech,PowerShell,50582,2723,26,1433,True,True,True,True,"Chris Titus Tech's Windows Utility - Install Programs, Tweaks, Fixes, and Updates"
hiring-without-whiteboards,poteto,JavaScript,50525,3883,38,3303,True,True,True,True,⭐️  Companies that don't have a broken hiring process
lazydocker,jesseduffield,Go,50453,1594,266,2508,True,True,True,True,The lazier way to manage everything docker
100-Days-Of-ML-Code,Avik-Jain,,50157,11392,66,2825,True,True,False,True,100 Days of ML Coding
TrendRadar,sansan0,Python,50142,22839,36,336,False,False,True,True,"⭐AI-driven public opinion & trend monitor with multi-platform aggregation, RSS, and smart alerts.🎯 告别信息过载，你的 AI 舆情监控助手与热点筛选工具！聚合多平台热点 +  RSS 订阅，支持关键词精准筛选。AI 智能筛选新闻 + AI 翻译 +  AI 分析简报直推手机，也支持接入 MCP 架构，赋能 AI 自然语言对话分析、情感洞察与趋势预测等。支持 Docker ，数据本地/云端自持。集成微信/飞书/钉钉/Telegram/邮件/ntfy/bark/slack 等渠道智能推送。"
bulma,jgthms,CSS,50071,3905,521,3719,False,True,True,True,Modern CSS framework based on Flexbox
odoo,odoo,Python,49824,31944,9406,4339,False,True,False,True,Odoo. Open Source Apps To Grow Your Business.
ai-hedge-fund,virattt,Python,49811,8649,92,486,False,False,True,True,An AI Hedge Fund Team
jellyfin,jellyfin,C#,49792,4590,885,2668,True,True,True,True,The Free Software Media System - Server Backend & API
mastodon,mastodon,Ruby,49788,7422,4453,3689,True,True,True,True,"Your self-hosted, globally interconnected microblogging community"
lx-music-desktop,lyswhut,TypeScript,49672,6676,1111,2420,False,False,True,True,一个基于 Electron 的音乐软件
cypress,cypress-io,TypeScript,49609,3402,1215,4045,True,True,True,True,"Fast, easy and reliable testing for anything that runs in a browser."
