repo_name,organization,language,stars,forks,open_issues,age_days,has_coc,has_contributing,has_workflows,has_readme,description
react-router,remix-run,TypeScript,56498,10898,127,4442,True,True,True,True,Declarative routing for React
Agent-Reach,Panniantong,Python,56381,4638,155,141,False,True,True,True,"Give your AI agent eyes to see the entire internet. Read & search Twitter, Reddit, YouTube, GitHub, Bilibili, XiaoHongShu — one CLI, zero API fees."
project-layout,golang-standards,Makefile,56299,5436,95,3230,False,False,True,True,Standard Go Project Layout
nanochat,karpathy,Python,56274,7771,90,274,False,False,True,True,The best ChatGPT that $100 can buy.
penpot,penpot,Clojure,56250,3694,721,3850,True,True,True,True,Penpot: The open-source design platform for Product teams that need scalable collaboration.
gatsby,gatsbyjs,JavaScript,55952,10153,396,4072,True,True,True,True,"React-based framework with performance, scalability, and security built in."
up,byoungd,JavaScript,55829,5720,33,3332,False,False,True,True,An advanced guide which might benefit you a lot 🎉 . 人生进阶指南 离谱的人生 离谱的英语学习指南/英语学习教程/英语学习/学英语
leetcode,azl397985856,JavaScript,55774,9396,11,3028,False,True,False,True,LeetCode Solutions: A Record of My Problem Solving Journey.( leetcode题解，记录自己的leetcode解题之路。)
n8n-workflows,Zie619,Python,55693,7409,31,426,False,False,True,True,all of the workflows of n8n i could find (also from the site itself)
joplin,laurent22,TypeScript,55584,6178,594,3466,False,True,True,True,"Joplin - the privacy-focused note taking app with sync capabilities for Windows, macOS, Linux, Android and iOS."
crewAI,crewAIInc,Python,55542,7832,650,992,False,True,True,True,"Framework for orchestrating role-playing, autonomous AI agents. By fostering collaborative intelligence, CrewAI empowers agents to work together seamlessly, tackling complex tasks."
faceswap,deepfakes,Python,55342,13355,9,3129,True,False,True,True,Deepfakes Software For All
gpt-engineer,AntonOsika,Python,55185,7294,69,1172,True,True,True,True,CLI platform to experiment with codegen. Precursor to: https://lovable.dev
first-contributions,firstcontributions,,55002,106125,70,3584,True,True,True,True,🚀✨ Help beginners to contribute to open source projects
typst,typst,Rust,54906,1642,1253,2485,False,True,True,True,A markup-based typesetting system that is powerful and easy to learn.
powerlevel10k,romkatv,Shell,54714,2433,148,2697,False,False,False,True,A Zsh theme
Flowise,FlowiseAI,TypeScript,54624,24715,997,1201,True,True,True,True,"Build AI Agents, Visually"
segment-anything,facebookresearch,Jupyter Notebook,54545,6355,596,1209,True,True,True,True,"The repository provides code for running inference with the SegmentAnything Model (SAM), links for downloading the trained model checkpoints, and example notebooks that show how to use the model."
plane,makeplane,TypeScript,54483,4988,996,1333,True,True,True,True,"🔥🔥🔥 Open-source Jira, Linear, Monday, and ClickUp alternative. Plane is a modern project management platform to manage tasks, sprints, docs, and triage."
trackerslist,ngosang,,54482,6591,12,3733,False,False,True,True,Updated list of public BitTorrent trackers
Ghost,TryGhost,JavaScript,54424,11800,129,4819,True,True,True,True,"Independent technology for modern publishing, memberships, subscriptions and newsletters."
PowerShell,PowerShell,C#,54416,8376,1535,3835,True,True,True,True,PowerShell for every system!
ChatGPT,lencx,Rust,54396,6139,937,1315,False,False,True,True,"🔮 ChatGPT Desktop Application (Mac, Windows and Linux)"
chinese-independent-developer,1c7,Python,54346,4756,2,3218,False,True,True,True,👩🏿‍💻👨🏾‍💻👩🏼‍💻👨🏽‍💻👩🏻‍💻中国独立开发者项目列表 -- 分享大家都在做什么
maybe,maybe-finance,Ruby,54338,5647,0,925,False,True,True,True,The personal finance app for everyone
dive,wagoodman,Go,54321,1989,208,2984,False,False,True,True,A tool for exploring each layer in a docker image
jellyfin,jellyfin,C#,54284,5098,574,2774,True,True,True,True,The Free Software Media System - Server Backend & API
ImHex,WerWolv,C++,54169,2415,367,2072,True,True,True,True,"🔍 A Hex Editor for Reverse Engineers, Programmers and people who value their retinas when working at 3 AM."
requests,psf,Python,54140,10011,233,5630,True,True,True,True,"A simple, yet elegant, HTTP library."
element,ElemeFE,Vue,54105,14440,2969,3601,False,False,True,True,A Vue.js 2.0 UI Toolkit for Web
core,vuejs,TypeScript,53958,9164,925,2954,False,True,True,True,"🖖 Vue.js is a progressive, incrementally-adoptable JavaScript framework for building UI on the web."
litellm,BerriAI,Python,53615,9769,3907,1084,False,True,True,True,"Python SDK, Proxy Server (AI Gateway) to call 100+ LLM APIs in OpenAI (or native) format, with cost tracking, guardrails, loadbalancing and logging. [Bedrock, Azure, OpenAI, VertexAI, Cohere, Anthropic, Sagemaker, HuggingFace, VLLM, NVIDIA NIM]"
material-design-icons,google,,53590,9735,412,4297,True,True,True,True,Material Design icons by Google (Material Symbols)
pdf.js,mozilla,JavaScript,53569,10647,413,5558,True,True,True,True,PDF Reader in JavaScript
normalize.css,necolas,CSS,53542,10357,76,5550,False,True,False,True,A modern alternative to CSS resets
minimind,jingyaogong,Python,53402,6917,47,718,True,False,True,True,🧠「大模型」2小时完全从0训练64M的小参数LLM！Train a 64M-parameter LLM from scratch in just 2h!
remotion,remotion-dev,TypeScript,53224,3850,150,2212,True,True,True,True,🎥      Make videos programmatically with React
kotlin,JetBrains,Kotlin,53163,6358,338,5265,True,True,True,True,The Kotlin Programming Language. 
odoo,odoo,Python,53020,33092,10167,4445,False,True,True,True,Odoo. Open Source Apps To Grow Your Business.
twenty,twentyhq,TypeScript,52991,8003,103,1321,True,True,True,True,"The open alternative to Salesforce, designed for AI."
awesome-ios,vsouza,Swift,52754,6983,14,4387,True,True,True,True,"A curated list of awesome iOS ecosystem, including Objective-C and Swift Projects "
Docker-OSX,sickcodes,Shell,52667,2879,417,2231,False,False,True,True,Run macOS VM in a Docker! Run near native OSX-KVM in Docker! X11 Forwarding! CI/CD for OS X Security Research! Docker mac Containers.
ionic-framework,ionic-team,TypeScript,52582,13339,629,4711,True,True,True,True,"A powerful cross-platform UI toolkit for building native-quality iOS, Android, and Progressive Web Apps with HTML, CSS, and JavaScript."
chinese-poetry,chinese-poetry,JavaScript,52507,10587,134,3603,False,False,True,True,"The most comprehensive database of Chinese poetry 🧶最全中华古诗词数据库,  唐宋两朝近一万四千古诗人,  接近5.5万首唐诗加26万宋诗.  两宋时期1564位词人，21050首词。"
windows,dockur,Shell,52432,4481,29,912,False,False,True,True,Windows inside a Docker container.
freqtrade,freqtrade,Python,52336,10893,40,3345,False,True,True,True,"Free, open source crypto trading bot"
AI-For-Beginners,microsoft,Jupyter Notebook,52293,10574,4,1959,True,True,True,True,"12 Weeks, 24 Lessons, AI for All!"
Motrix,agalwood,JavaScript,52271,4891,777,2765,True,True,True,True,A full-featured download manager.
last30days-skill,mvanhorn,Python,52231,4547,90,172,False,False,True,True,"AI agent skill that researches any topic across Reddit, X, YouTube, HN, Polymarket, and the web - then synthesizes a grounded summary"
prettier,prettier,JavaScript,52230,4929,1429,3514,True,True,True,True,Prettier is an opinionated code formatter.
lx-music-desktop,lyswhut,TypeScript,52140,6907,1229,2526,False,False,True,True,一个基于 Electron 的音乐软件
lazydocker,jesseduffield,Go,52041,1651,284,2614,True,True,True,True,The lazier way to manage everything docker
etcd,etcd-io,Go,51987,10410,286,4756,True,True,True,True,Distributed reliable key-value store for the most critical data of a distributed system
Win11Debloat,Raphire,PowerShell,51862,2142,25,2086,False,True,True,True,"A simple, lightweight PowerShell script that allows you to remove pre-installed apps, disable telemetry, as well as perform various other changes to declutter and customize your Windows experience. Win11Debloat works for both Windows 10 and Windows 11."
whisper.cpp,ggml-org,C++,51811,5914,1215,1388,False,True,True,True,Port of OpenAI's Whisper model in C/C++
grok-1,xai-org,Python,51697,8457,124,849,True,False,True,True,Grok open release
jekyll,jekyll,Ruby,51565,10290,249,6476,True,True,True,True,:globe_with_meridians: Jekyll is a blog-aware static site generator in Ruby
guava,google,Java,51520,11139,740,4429,True,True,True,True,Google core libraries for Java
100-Days-Of-ML-Code,Avik-Jain,,51442,11578,68,2931,True,True,False,True,100 Days of ML Coding
go-ethereum,ethereum,Go,51352,22082,375,4583,False,True,True,True,Go implementation of the Ethereum protocol
DefinitelyTyped,DefinitelyTyped,TypeScript,51340,30420,693,5030,False,False,True,True,The repository for high quality TypeScript type definitions.
professional-programming,charlax,Python,51259,4000,4,3903,False,True,False,True,A collection of learning resources for curious software engineers
open-source-ios-apps,dkhamsing,,51234,5877,4,4187,False,True,True,True,:iphone: Collaborative List of Open-Source iOS Apps
awesome-openclaw-skills,VoltAgent,,51230,4955,10,170,False,True,True,True,"The awesome collection of OpenClaw skills. 5,400+ skills filtered and categorized from the official OpenClaw Skills Registry.🦞"
goose,aaif-goose,Rust,51222,5684,325,690,True,True,True,True,"an open source, extensible AI agent that goes beyond code suggestions - install, execute, edit, and test with any LLM"
wechat-miniapp-radar,justjavac,TypeScript,51218,9021,0,3582,False,False,True,True,小程序雷达：AI 驱动的小程序技术选型、趋势追踪和迁移诊断工具
Fooocus,lllyasviel,Python,51075,8361,306,1070,False,False,True,True,Focus on prompting and generating
Semantic-UI,Semantic-Org,JavaScript,51047,4864,1071,4845,False,True,False,True,Semantic is a UI component framework based around useful principles from natural language.
dbeaver,dbeaver,Java,51012,4289,3292,3919,True,True,True,True,Free universal database tool and SQL client
hiring-without-whiteboards,poteto,JavaScript,50994,3900,9,3409,True,True,True,True,⭐️  Companies that don't have a broken hiring process
llama_index,run-llama,Python,50855,7751,548,1351,True,True,True,True,LlamaIndex is the leading document agent and OCR platform
cypress,cypress-io,TypeScript,50684,3597,1103,4151,True,True,True,True,"Fast, easy and reliable testing for anything that runs in a browser."
expo,expo,TypeScript,50652,13062,682,3620,False,True,True,True,"An open-source framework for making universal native apps with React. Expo runs on Android, iOS, and the web."
BMAD-METHOD,bmad-code-org,JavaScript,50606,5822,93,457,True,True,True,True,Breakthrough Method for Agile Ai Driven Development
json,nlohmann,C++,50122,7429,65,4758,True,True,True,True,JSON for Modern C++
mastodon,mastodon,Ruby,50119,7484,4485,3795,True,True,True,True,"Your self-hosted, globally interconnected microblogging community"
VibeVoice,microsoft,Python,50076,5610,175,323,True,True,True,True,Open-Source Frontier Voice AI
bulma,jgthms,CSS,50065,3887,522,3825,False,True,True,True,Modern CSS framework based on Flexbox
awesome-claude-code,hesreallyhim,Python,50045,4365,671,451,True,True,True,True,"A hand-picked collection of the finest of resources for the most awesome of agents, Claude Code, the undisputed champion of coding companions, from the unstoppable team at Anthropic PBC. A delectable showcase of top tier skills, ambidextrous agents, scintillating status lines, top notch developer tooling, and also we have plugins"
query,TanStack,TypeScript,50000,4075,193,2499,False,True,True,True,"🤖 Powerful asynchronous state management, server-state utilities and data fetching for the web. TS/JS, React Query, Solid Query, Svelte Query and Vue Query."
alist,AlistGo,Go,49866,7953,558,2029,True,True,True,True,"🗂️A file list/WebDAV program that supports multiple storages, powered by Gin and Solidjs. / 一个支持多存储的文件列表/WebDAV程序，使用 Gin 和 Solidjs。"
hacker-scripts,NARKOZ,JavaScript,49757,6663,71,3888,False,False,False,True,Based on a true story
jadx,skylot,Java,49692,5726,434,4866,True,True,True,True,Dex to Java decompiler
huginn,huginn,Ruby,49618,4276,697,4874,False,False,True,True,Create agents that monitor and act on your behalf.  Your agents are standing by!
open-source-mac-os-apps,serhii-londar,,49610,2627,144,3176,False,True,True,True,🚀 Awesome list of open source applications for macOS. https://t.me/s/opensourcemacosapps
terraform,hashicorp,Go,49455,10686,1914,4506,True,True,True,True,"Terraform enables you to safely and predictably create, change, and improve infrastructure. It is a source-available tool that codifies APIs into declarative configuration files that can be shared amongst team members, treated as code, edited, reviewed, and versioned."
PythonDataScienceHandbook,jakevdp,Jupyter Notebook,49217,19050,230,3625,True,True,False,True,Python Data Science Handbook: full text in Jupyter Notebooks
pandas,pandas-dev,Python,49192,20118,2987,5804,True,True,True,True,"Flexible and powerful data analysis / manipulation library for Python, providing labeled data structures similar to R data.frame objects, statistical functions, and much more"
pretext,chenglou,TypeScript,49137,2719,84,129,False,False,True,True,"Fast, accurate & comprehensive text measurement & layout"
kubernetes-the-hard-way,kelseyhightower,,49088,15758,50,3659,False,True,False,True,Bootstrap Kubernetes the hard way. No scripts.
julia,JuliaLang,Julia,49028,5930,4690,5563,True,True,True,True,The Julia Programming Language
fanqiang,bannedbook,Kotlin,48953,8184,328,4200,False,False,True,True,翻墙-科学上网
x64dbg,x64dbg,C++,48896,2781,577,4112,True,True,True,True,An open-source user mode debugger for Windows. Optimized for reverse engineering and malware analysis.
claude-cookbooks,anthropics,Jupyter Notebook,48860,5788,288,1064,False,True,True,True,A collection of notebooks/recipes showcasing some fun and effective ways of using Claude.
brew,Homebrew,Ruby,48827,11232,16,3783,True,True,True,True,🍺 The Package Manager for Everywhere
tldraw,tldraw,TypeScript,48772,3373,444,1892,True,True,True,True,"Build infinite canvas apps in React with the tldraw SDK. World's best, top-most agent recommended #1 five star SDK."
Made-With-ML,GokuMohandas,Jupyter Notebook,48696,7661,27,2809,False,False,True,True,"Learn how to develop, deploy and iterate on production-grade ML applications."
dayjs,iamkun,JavaScript,48664,2453,1283,3017,False,True,True,True,⏰ Day.js 2kB immutable date-time library alternative to Moment.js with the same modern API
ClickHouse,ClickHouse,C++,48648,8649,6325,3694,True,True,True,True,ClickHouse® is a real-time analytics database management system
algorithm-visualizer,algorithm-visualizer,JavaScript,48640,7585,80,3713,True,True,False,True,:fireworks:Interactive Online Platform that Visualizes Algorithms from Code
ruff,astral-sh,Rust,48594,2238,2057,1435,True,True,True,True,"An extremely fast Python linter and code formatter, written in Rust."
cherry-studio,CherryHQ,TypeScript,48590,4614,1211,782,True,True,True,True,"AI productivity studio with smart chat, autonomous agents, and 300+ assistants. Unified access to frontier LLMs"
htmx,bigskysoftware,JavaScript,48483,1613,664,2283,False,True,True,True,</> htmx - high power tools for HTML
awesome-java,akullpp,,48464,7697,5,4388,False,True,True,True,"A curated list of awesome frameworks, libraries and software for the Java programming language."
type-challenges,type-challenges,TypeScript,48324,5272,33231,2182,True,False,True,True,Collection of TypeScript type challenges with online judge
RxJava,ReactiveX,Java,48238,7588,13,4935,False,True,True,True,RxJava – Reactive Extensions for the JVM – a library for composing asynchronous and event-based programs using observable sequences for the Java VM.
metabase,metabase,Clojure,48205,6669,4088,4180,False,True,True,True,The easy-to-use open source Business Intelligence and Embedded Analytics tool that lets everyone work with data :bar_chart:
awesome-design-patterns,DovAmir,,48164,3281,25,2962,False,True,False,True,A curated list of software and architecture related design patterns.
supervision,roboflow,Python,48045,4490,97,1324,True,True,True,True,We write your reusable computer vision tools. 💜
design-patterns-for-humans,nilbuild,,48013,5509,16,3435,False,False,False,True,An ultra-simplified explanation to design patterns
awesome-react-components,brillout,,47981,3794,59,3672,True,True,True,True,Curated List of React Components & Libraries.
moment,moment,JavaScript,47945,6990,304,5615,False,True,True,True,"Parse, validate, manipulate, and display dates in javascript."
container,apple,Swift,47870,1604,443,410,True,True,True,True,"A tool for creating and running Linux containers using lightweight virtual machines on a Mac. It is written in Swift, and optimized for Apple silicon. "
Projects,karan,,47802,10625,123,4758,False,True,False,True,:page_with_curl: A list of practical projects that anyone can solve in any programming language.
pixijs,pixijs,TypeScript,47782,5044,346,4922,True,True,True,True,"The HTML5 Creation Engine: Create beautiful digital content with the fastest, most flexible 2D WebGL renderer."
tmux,tmux,C,47734,2775,28,4059,False,True,True,True,tmux source code
big-list-of-naughty-strings,minimaxir,Python,47698,2157,108,3993,False,False,False,True,The Big List of Naughty Strings is a list of strings which have a high probability of causing issues when used as user-input data.
gogs,gogs,Go,47680,5075,999,4536,False,True,True,True,The painless way to host your own Git service
slidev,slidevjs,TypeScript,47668,2117,203,1908,True,True,True,True,Presentation Slides for Developers
spotube,KRTirtho,Dart,47565,2198,822,1977,True,False,True,True,🎧 Open source music streaming app! Available for both desktop & mobile!
LocalAI,mudler,Go,47539,4236,216,1214,False,True,True,True,"LocalAI is the open-source AI engine. Run any model - LLMs, vision, voice, image, video - on any hardware. No GPU required."
discourse,discourse,Ruby,47464,8953,205,4932,True,True,True,True,"A platform for community discussion. Free, open, simple."
textgen,oobabooga,Python,47450,5982,828,1302,False,False,True,True,"Open-source desktop app for local LLMs. Text, vision, tool-calling, OpenAI/Anthropic-compatible API. 100% private."
aider,Aider-AI,Python,47399,4733,1741,1162,False,True,True,True,aider is AI pair programming in your terminal
prisma,prisma,TypeScript,47366,2475,2648,2581,True,True,True,True,"Next-generation ORM for Node.js & TypeScript | PostgreSQL, MySQL, MariaDB, SQL Server, SQLite, MongoDB and CockroachDB"
quill,slab,TypeScript,47216,3655,653,5097,True,True,True,True,Quill is a modern WYSIWYG editor built for compatibility and extensibility
acme.sh,acmesh-official,Shell,47180,5630,85,3853,False,True,True,True,A pure Unix shell script ACME client for SSL / TLS certificate automation
bevy,bevyengine,Rust,47168,4691,3299,2369,True,True,True,True,A refreshingly simple data-driven game engine built in Rust
upscayl,upscayl,TypeScript,47168,2335,55,1445,False,False,True,True,"🆙 Upscayl - #1 Free and Open Source AI Image Upscaler for Linux, MacOS and Windows."
frontend-dev-bookmarks,dypsilon,,47157,5148,132,4770,False,True,False,True,Manually curated collection of resources for frontend web developers.
react,typescript-cheatsheets,TypeScript,47091,4285,0,2965,True,True,True,True,Cheatsheets for experienced React developers getting started with TypeScript
GitHubDaily,GitHubDaily,,47078,4654,702,2753,False,False,False,True,"坚持分享 GitHub 上高质量、有趣实用的开源技术教程、开发者工具、编程网站、技术资讯。A list cool, interesting projects of GitHub."
JeecgBoot,jeecgboot,Java,47071,16084,53,2787,False,False,True,True,【低代码迈入 v2.0】AI低代码平台，AI Skills 一句话生成整个系统；一键生成前后端代码甚至整个模块。 AI Skills 一句话画流程、设计表单、生成报表、大屏。内置 AI应用平台涵盖：AI聊天、知识库、流程编排、MCP插件等，兼容主流大模型。引领AI低代码「Skills 生成 → 在线配置 → 代码生成 → 手工合并->AI修改」开发模式，解决 Java 项目 90% 重复工作，提高效率又不失灵活。
nvm-windows,coreybutler,Go,47060,3856,89,4315,False,True,True,True,A node.js version management utility for Windows. Ironically written in Go.
okhttp,square,Kotlin,46998,9277,129,5104,False,True,True,True,"Square’s meticulous HTTP client for the JVM, Android, and GraalVM."
chrome-devtools-mcp,ChromeDevTools,TypeScript,46953,3218,97,306,False,True,True,True,Chrome DevTools for coding agents
serverless,serverless,JavaScript,46922,5730,1222,4103,True,True,True,True,"⚡ Serverless Framework – Effortlessly build apps that auto-scale, incur zero costs when idle, and require minimal maintenance using AWS Lambda and other managed cloud services."
v2ray-core,v2ray,Go,46910,8842,16,3966,True,False,True,True,A platform for building proxies to bypass network restrictions.
legado,gedoor,Kotlin,46871,5476,18,2611,False,False,True,True,"Legado 3.0 Book Reader with powerful controls & full functions❤️阅读3.0, 阅读是一款可以自定义来源阅读网络内容的工具，为广大网络文学爱好者提供一种方便、快捷舒适的试读体验。"
impeccable,pbakaus,JavaScript,46774,2816,29,241,False,False,True,True,The design language that makes your AI harness better at design.
awesome-remote-job,lukasz-madon,,46710,4674,57,4212,False,True,True,True,A curated list of awesome remote jobs and resources. Inspired by https://github.com/vinta/awesome-python
30-Days-Of-JavaScript,Asabeneh,JavaScript,46563,10451,368,2395,False,False,False,True,"30 days of JavaScript programming challenge is a step-by-step guide to learn JavaScript programming language in 30 days. This challenge may take more than 100 days,  please just follow your own pace. These videos may help too: https://www.youtube.com/channel/UC7PNRuno1rzYPb1xLa4yktw"
cal.diy,calcom,TypeScript,46422,14439,1340,1940,True,True,True,True,Scheduling infrastructure for absolutely everyone.
monaco-editor,microsoft,JavaScript,46342,4094,828,3689,True,True,True,True,A browser based code editor
exo,exo-explore,Python,46271,3355,305,750,False,True,True,True,Run frontier AI locally.
qlib,microsoft,Python,46242,7365,462,2160,True,False,True,True,"Qlib is an AI-oriented Quant investment platform that aims to use AI tech to empower Quant Research, from exploring ideas to implementing productions. Qlib supports diverse ML modeling paradigms, including supervised learning, market dynamics modeling, and RL, and is now equipped with https://github.com/microsoft/RD-Agent to automate R&D process."
awesome-cheatsheets,LeCoupa,JavaScript,46201,6705,136,3170,False,False,True,True,"👩‍💻👨‍💻 Awesome cheatsheets for popular programming languages, frameworks and development tools. They include everything you should know in one single file."
airflow,apache,Python,46121,17385,1723,4110,True,True,True,True,"Apache Airflow - A platform to programmatically author, schedule, and monitor workflows"
learn-regex,ziishaned,,46080,6153,65,3279,False,False,False,True,Learn regex the easy way
Umi-OCR,hiroi-sora,Python,46066,4529,354,1570,False,False,False,True,"OCR software, free and offline. 开源、免费的离线OCR软件。支持截屏/批量导入图片，PDF文档识别，排除水印/页眉页脚，扫描/生成二维码。内置多国语言库。"
CowAgent,zhayujie,Python,45980,10265,25,1437,False,True,True,True,"Open-source super AI assistant & Agent Harness. Plans tasks, runs tools and skills, self-evolves with memory and knowledge. Multi-model, multi-channel. Lightweight, extensible, one-line install. (formerly chatgpt-on-wechat)"
awesome-compose,docker,HTML,45839,8245,402,2343,False,True,True,True,Awesome Docker Compose samples
Rocket.Chat,RocketChat,TypeScript,45793,13726,3881,4074,True,True,True,True,The Secure CommsOS™ for mission-critical operations
TTS,coqui-ai,Python,45753,6152,4,2246,True,True,True,True,"🐸💬 - a deep learning toolkit for Text-to-Speech, battle-tested in research and production"
architecture-samples,android,Kotlin,45751,11861,221,3812,False,True,True,True,A collection of samples to discuss and showcase different architectural tools and patterns for Android apps.
shannon,KeygraphHQ,TypeScript,45702,5307,23,291,False,False,True,True,"Shannon is an autonomous, white-box AI pentester for web applications and APIs. It analyzes your source code, identifies attack vectors, and executes real exploits to prove vulnerabilities before they reach production."
copyparty,9001,Python,45675,1865,266,2606,True,True,False,True,"Portable file server with accelerated resumable uploads, dedup, WebDAV, SFTP, FTP, TFTP, zeroconf, media indexer, thumbnails++ all in one file"
FlClash,chen08209,Dart,45653,2883,541,1064,False,False,True,True,"A multi-platform proxy client based on ClashMeta,simple and easy to use, open-source and ad-free."
bruno,usebruno,JavaScript,45622,2680,1767,1386,False,True,True,True,Opensource IDE For Exploring and Testing API's (lightweight alternative to Postman/Insomnia)
zx,google,JavaScript,45603,1274,53,1896,True,True,True,True,A tool for writing better scripts
nanobot,HKUDS,Python,45599,8039,883,163,False,True,True,True,"Lightweight, open-source AI agent for your tools, chats, and workflows."
iina,iina,Swift,45559,2863,1900,3494,False,True,True,True,The modern video player for macOS.
