repo_name,organization,language,stars,forks,open_issues,age_days,has_coc,has_contributing,has_workflows,has_readme,description
build-your-own-x,codecrafters-io,Markdown,525254,49680,522,2988,False,False,True,True,Master programming by recreating your favorite technologies from scratch.
awesome,sindresorhus,,485018,35864,93,4386,True,True,True,True,😎 Awesome lists about all kinds of interesting topics
freeCodeCamp,freeCodeCamp,TypeScript,451903,45621,260,4220,True,True,True,True,"freeCodeCamp.org's open-source codebase and curriculum. Learn math, programming, and computer science for free."
public-apis,public-apis,Python,450151,49496,1554,3768,False,True,True,True,A collective list of free APIs
free-programming-books,EbookFoundation,Python,392129,66526,72,4659,True,True,True,True,:books: Freely available programming books
openclaw,openclaw,TypeScript,382960,80401,6677,232,False,True,True,True,Your own personal AI assistant. Any OS. Any Platform. The lobster way. 🦞 
developer-roadmap,nilbuild,TypeScript,360976,44533,12,3408,True,True,True,True,"Interactive roadmaps, guides and other educational content to help developers grow in their careers."
system-design-primer,donnemartin,Python,357630,57214,571,3425,False,True,True,True,Learn how to design large-scale systems. Prep for the system design interview.  Includes Anki flashcards.
coding-interview-university,jwasham,,356231,84286,123,3691,False,False,True,True,A complete computer science study plan to become a software engineer.
awesome-python,vinta,Python,308223,28315,17,4400,True,True,True,True,"An opinionated list of Python frameworks, libraries, tools, and resources"
awesome-selfhosted,awesome-selfhosted,,305534,14315,0,4062,False,False,False,True,A list of Free Software network services and web applications which can be hosted on your own servers
996.ICU,996icu,,276384,20797,16697,2667,False,False,False,True,Repo for counting stars and contributing. Press F to pay respect to glorious developers.
project-based-learning,practical-tutorials,Python,273372,35263,287,3381,False,True,True,True,Curated list of project-based tutorials
superpowers,obra,Shell,254830,22781,327,278,True,False,True,True,An agentic skills framework & software development methodology that works.
react,react,JavaScript,246497,51228,1201,4799,True,True,True,True,The library for web and native user interfaces.
linux,torvalds,C,239511,63488,3,5427,False,False,True,True,Linux kernel source tree
the-book-of-secret-knowledge,trimstray,,233307,13906,158,2943,True,True,True,True,"A collection of inspiring lists, manuals, cheatsheets, blogs, hacks, one-liners, cli/web tools and more."
ECC,affaan-m,JavaScript,229805,35170,108,178,True,True,True,True,"The agent harness performance optimization system. Skills, instincts, memory, security, and research-first development for Claude Code, Codex, Opencode, Cursor and beyond."
Python,TheAlgorithms,Python,222697,50837,1016,3650,True,True,True,True,All Algorithms implemented in Python
hermes-agent,NousResearch,Python,214971,40015,23578,357,False,True,True,True,The agent that grows with you
vue,vuejs,TypeScript,210157,33947,635,4734,True,True,True,True,"This is the repo for Vue 2. For Vue 3, go to https://github.com/vuejs/core"
computer-science,ossu,HTML,206097,25595,23,4455,False,True,True,True,🎓 Path to a free self-taught education in Computer Science!
n8n,n8n-io,TypeScript,196471,59326,1375,2579,True,True,True,True,"Fair-code workflow automation platform with native AI capabilities. Combine visual building with custom code, self-host or cloud, 400+ integrations."
tensorflow,tensorflow,C++,196359,75559,2704,3903,True,True,True,True,An Open Source Machine Learning Framework for Everyone
javascript-algorithms,trekhleb,JavaScript,196236,31046,403,3034,True,True,True,True,📝 Algorithms and data structures implemented in JavaScript with explanations and links to further readings
claw-code,ultraworkers,Rust,194765,109661,31,105,True,True,True,True,"An agent-managed museum exhibit, built in Rust with Gajae-Code / LazyCodex — developed and maintained with no human intervention."
andrej-karpathy-skills,multica-ai,,192379,19759,125,169,False,False,True,True,"A single CLAUDE.md file to improve Claude Code behavior, derived from Andrej Karpathy's observations on LLM coding pitfalls."
ohmyzsh,ohmyzsh,Shell,188725,26566,581,6164,True,True,True,True,"🙃   A delightful community-driven (with 2,500+ contributors) framework for managing your zsh configuration. Includes 300+ optional plugins (rails, git, macOS, hub, docker, homebrew, node, php, python, etc), 140+ themes to spice up your morning, and an auto-update tool that makes it easy to keep up with the latest updates from the community."
vscode,microsoft,TypeScript,187594,41281,19271,3967,True,True,True,True,Visual Studio Code
opencode,anomalyco,TypeScript,185910,23255,4684,440,False,True,True,True,The open source coding agent.
FreeDomain,DigitalPlatDev,HTML,185755,3890,34,775,False,False,False,True,DigitalPlat FreeDomain: Free Domain For Everyone
AutoGPT,Significant-Gravitas,Python,185544,46079,499,1216,True,True,True,True,"AutoGPT is the vision of accessible AI for everyone, to use and to build on. Our mission is to provide the tools, so that you can focus on what matters."
CS-Notes,CyC2018,,184771,50847,195,3073,False,False,True,True,:books: 技术面试必备基础知识、Leetcode、计算机操作系统、计算机网络、系统设计
You-Dont-Know-JS,getify,,184598,33480,2,4624,False,True,True,True,A book series (2 published editions) on the JS language.
Python-100-Days,jackfrued,Jupyter Notebook,184158,55684,702,3057,False,False,True,True,Python - 100天从新手到大师
Microsoft-Activation-Scripts,massgravel,Batchfile,183170,17546,1,2375,False,False,False,True,"Open-source Windows and Office activator featuring HWID, Ohook, TSforge, and Online KMS activation methods, along with advanced troubleshooting."
awesome-go,avelino,Go,178194,13412,189,4391,True,True,True,True,"A curated list of awesome Go frameworks, libraries and software"
yt-dlp,yt-dlp,Python,178060,15227,2510,2088,False,True,True,True,A feature-rich command-line audio/video downloader
flutter,flutter,Dart,177911,30812,12934,4148,True,True,True,True,Flutter makes it easy and fast to build beautiful apps for mobile and beyond
ollama,ollama,Go,176124,16964,3445,1114,False,True,True,True,"Get up and running with Kimi-K2.6, GLM-5.1, MiniMax, DeepSeek, gpt-oss, Qwen, Gemma and other models."
gitignore,github,,174874,82338,74,5727,True,True,True,True,A collection of useful .gitignore templates
bootstrap,twbs,MDX,174475,78739,283,5464,True,True,True,True,"The most popular HTML, CSS, and JavaScript framework for developing responsive, mobile first projects on the web."
skills,mattpocock,Shell,170710,14689,165,161,False,False,True,True,Skills for Real Engineers. Straight from my .claude directory.
markitdown,microsoft,Python,166039,11888,835,608,True,False,True,True,Python tool for converting files and office documents to Markdown.
prompts.chat,f,HTML,165762,21439,63,1317,False,True,True,True,"f.k.a. Awesome ChatGPT Prompts. Share, discover, and collect prompts from the community. Free and open source — self-host for your organization with complete privacy."
HelloGitHub,521xueweihan,Python,165247,12317,515,3723,False,False,False,True,":octocat: 分享 GitHub 上有趣、入门级的开源项目。Share interesting, entry-level open source projects on GitHub."
stable-diffusion-webui,AUTOMATIC1111,Python,164241,30516,2498,1422,False,False,True,True,Stable Diffusion web UI
transformers,huggingface,Python,162613,33880,2482,2815,True,True,True,True,"🤗 Transformers: the model-definition framework for state-of-the-art machine learning models in text, vision, audio, and multimodal models, for both inference and training. "
the-art-of-command-line,jlevy,,161750,14829,255,4073,False,True,False,True,"Master the command line, in one page"
skills,anthropics,Python,161203,19043,1029,295,False,False,True,True,Public repository for Agent Skills
JavaGuide,Snailclimb,JavaScript,157046,46163,58,2990,False,False,True,True,Java 面试 & 后端通用面试指南，覆盖计算机基础、数据库、分布式、高并发、系统设计与 AI 应用开发
langflow,langflow-ai,Python,151887,9674,971,1252,True,True,True,True,Langflow is a powerful tool for building and deploying AI-powered agents and workflows.
firecrawl,firecrawl,TypeScript,151133,8635,402,820,False,True,True,True,"The API to search, scrape, and interact with the web at scale. 🔥"
dify,langgenius,TypeScript,148863,23436,953,1189,True,True,True,True,Production-ready platform for agentic workflow development.
javascript,airbnb,JavaScript,148085,26624,160,5003,True,False,True,True,JavaScript Style Guide
scrcpy,Genymobile,C,145740,13437,2846,3157,False,False,True,True,Display and control your Android device
open-webui,open-webui,Python,145460,21058,436,1012,True,False,True,True,"User-friendly AI Interface (Supports Ollama, OpenAI API, ...)"
system-prompts-and-models-of-ai-tools,x1xhlol,,141926,34801,156,496,False,False,True,True,"FULL Augment Code, Claude Code, Cluely, CodeBuddy, Comet, Cursor, Devin AI, Junie, Kiro, Leap.new, Lovable, Manus, NotionAI, Orchids.app, Perplexity, Poke, Qoder, Replit, Same.dev, Trae, Traycer AI, VSCode Agent, Warp.dev, Windsurf, Xcode, Z.ai Code, Dia & v0. (And other Open Sourced) System Prompts, Internal Tools & AI Models"
langchain,langchain-ai,Python,141797,23555,421,1367,True,True,True,True,The agent engineering platform.
next.js,vercel,JavaScript,141107,31574,4181,3569,True,True,True,True,The React Framework
tech-interview-handbook,yangshun,TypeScript,140906,16674,45,3662,True,True,True,True,Curated coding interview preparation materials for busy software engineers
youtube-dl,ytdl-org,Python,140711,10677,4130,5735,False,True,True,True,Command-line program to download videos from YouTube.com and other video sites
claude-code,anthropics,Python,137898,22237,11473,507,False,False,True,True,"Claude Code is an agentic coding tool that lives in your terminal, understands your codebase, and helps you code faster by executing routine tasks, explaining complex code, and handling git workflows - all through natural language commands."
PowerToys,microsoft,C,136607,8366,7374,2631,True,True,True,True,Microsoft PowerToys is a collection of utilities that supercharge productivity and customization on Windows
go,golang,Go,135397,19338,10191,4348,True,True,True,True,The Go programming language
fucking-algorithm,labuladong,Markdown,134828,23599,3,2337,False,False,True,True,"Crack LeetCode, not only how, but also why. "
iptv,iptv-org,TypeScript,133005,7587,8,2799,True,True,True,True,Collection of publicly available IPTV channels from all over the world
clash-verge-rev,clash-verge-rev,TypeScript,131556,9512,413,966,False,True,True,True,"A modern GUI client based on Tauri, designed to run in Windows, macOS and Linux for tailored proxy experience"
agency-agents,msitarzewski,Shell,131524,21594,103,274,False,True,True,True,"A complete AI agency at your fingertips - From frontend wizards to Reddit community ninjas, from whimsy injectors to reality checkers. Each agent is a specialized expert with personality, processes, and proven deliverables."
free-for-dev,ripienaar,HTML,129232,13491,12,4136,True,True,True,True,"A list of SaaS, PaaS and IaaS offerings that have free tiers of interest to devops and infradev"
hello-algo,krahets,Java,128517,15419,38,1348,False,False,True,True,"《Hello 算法》：动画图解、一键运行的数据结构与算法教程。支持简中、繁中、English、日本語，提供 Python, Java, C++, C, C#, JS, Go, Swift, Rust, Ruby, Kotlin, TS, Dart 等代码实现"
30-seconds-of-code,Chalarangelo,JavaScript,128386,12481,0,3149,True,True,True,True,Coding articles to level up your development skills
excalidraw,excalidraw,TypeScript,127496,14397,3206,2386,False,True,True,True,Virtual whiteboard for sketching hand-drawn like diagrams
react-native,react,C++,126199,25183,1033,4204,True,True,True,True,A framework for building native applications using React
kubernetes,kubernetes,Go,123793,43754,2752,4421,True,True,True,True,Production-Grade Container Scheduling and Management
electron,electron,C++,122000,17303,898,4842,True,True,True,True,":electron: Build cross-platform desktop apps with JavaScript, HTML, and CSS"
gstack,garrytan,TypeScript,121939,18231,765,125,False,True,True,True,"Use Garry Tan's exact Claude Code setup: 23 opinionated tools that serve as CEO, Designer, Eng Manager, Release Manager, Doc Engineer, and QA"
spec-kit,github,Python,121337,10790,344,327,True,True,True,True,💫 Toolkit to help you get started with Spec-Driven Development
awesome-llm-apps,Shubhamsaboo,Python,121082,17907,19,807,False,False,True,True,"100+ AI Agent & RAG apps you can actually run — clone, customize, ship."
ComfyUI,Comfy-Org,Python,120762,14195,4274,1275,False,True,True,True,"The most powerful and modular diffusion model GUI, api and backend with a graph/nodes interface."
llama.cpp,ggml-org,C++,120406,20587,1854,1222,False,True,True,True,LLM inference in C/C++
ui,shadcn-ui,TypeScript,119126,9507,2123,1287,False,True,True,True,"A set of beautifully-designed, accessible components and a code distribution platform. Works with your favorite frameworks. Open Source. Open Code."
node,nodejs,JavaScript,118369,36211,2358,4248,True,True,True,True,Node.js JavaScript runtime ✨🐢🚀✨
rustdesk,rustdesk,Rust,118255,17975,118,2115,True,True,True,True,"An open-source remote desktop application designed for self-hosting, as an alternative to TeamViewer."
free-programming-books-zh_CN,justjavac,,117350,28211,33,4636,True,True,False,True,:books: 免费的计算机编程类中文书籍，欢迎投稿
cc-switch,farion1231,Rust,117300,7851,1885,344,True,True,True,True,"A cross-platform desktop All-in-One assistant for Claude Code, Codex, OpenCode, OpenClaw, Gemini CLI & Hermes Agent. Only official website: ccswitch.io"
Awesome-Hacking,Hack-with-Github,,116226,10526,43,3758,False,True,True,True,"A collection of various awesome lists for hackers, pentesters and security researchers"
rust,rust-lang,Rust,114750,15422,12599,5872,True,True,True,True,Empowering everyone to build reliable and efficient software.
godot,godotengine,C++,114113,25996,18541,4574,True,True,True,True,Godot Engine – Multi-platform 2D and 3D game engine
three.js,mrdoob,JavaScript,113741,36421,392,5957,True,True,True,True,JavaScript 3D Library.
d3,d3,Shell,113221,22703,20,5769,False,False,True,True,"Bring data to life with SVG, Canvas and HTML. :bar_chart::chart_with_upwards_trend::tada:"
generative-ai-for-beginners,microsoft,Jupyter Notebook,113004,60711,2,1121,True,True,True,True,"21 Lessons, Get Started Building with Generative AI "
v2rayN,2dust,C#,111370,15523,12,2542,False,False,True,True,"A GUI client for Windows, Linux and macOS, support Xray and sing-box and others"
TypeScript,microsoft,TypeScript,109918,13649,5063,4410,True,True,True,True,TypeScript is a superset of JavaScript that compiles to clean JavaScript output.
axios,axios,JavaScript,109107,11752,65,4348,True,True,True,True,Promise based HTTP client for the browser and node.js
tauri,tauri-apps,Rust,109064,3774,1426,2558,True,True,True,True,"Build smaller, faster, and more secure desktop and mobile applications with a web frontend."
frp,fatedier,Go,108044,15109,55,3858,False,False,True,True,A fast reverse proxy to help you expose a local server behind a NAT or firewall to the internet.
awesome-mac,jaywcjlove,Swift,107835,8090,460,3649,True,True,True,True, This project is dedicated to collecting high-quality macOS software and organizing them systematically by different categories for easy search and use.
papers-we-love,papers-we-love,Shell,107831,6387,2,4594,True,True,True,True,Papers from the computer science community to read and discuss.
deno,denoland,Rust,107806,6282,1388,2983,True,True,True,True,A modern runtime for JavaScript and TypeScript.
immich,immich-app,TypeScript,107697,6212,758,1622,True,True,True,True,High performance self-hosted photo and video management solution.
supabase,supabase,TypeScript,106410,13225,1089,2467,True,True,True,True,"The Postgres development platform. Supabase gives you a dedicated Postgres database to build your web, mobile, and AI applications."
gemini-cli,google-gemini,TypeScript,105991,14261,1379,453,False,True,True,True,An open-source AI agent that brings the power of Gemini directly into your terminal.
ui-ux-pro-max-skill,nextlevelbuilder,Python,105667,11212,123,226,True,True,True,True,An AI SKILL that provide design intelligence for building professional UI/UX multiple platforms
nodebestpractices,goldbergyoni,Dockerfile,105419,10710,133,3224,False,False,True,True,✅ The Node.js best practices list (July 2026)
whisper,openai,Python,104962,12755,134,1397,False,False,True,True,Robust Speech Recognition via Large-Scale Weak Supervision
browser-use,browser-use,Python,104782,11543,314,621,False,True,True,True,🌐 Make websites accessible for AI agents. Automate tasks online with ease.
terminal,microsoft,C++,103956,9412,1730,3259,True,True,True,True,"The new Windows Terminal and the original Windows console host, all in the same place!"
DeepSeek-V3,deepseek-ai,Python,103925,16718,239,565,False,False,True,True,
create-react-app,react,JavaScript,103313,26957,2410,3649,True,True,True,True,Set up a modern web app by running one command.
awesome-design-md,VoltAgent,,101919,11748,306,105,False,True,True,True,A collection of DESIGN.md files analysis by popular brand design systems. Drop one into your project and let coding agents generate a matching UI.
pytorch,pytorch,Python,101818,28494,18319,3623,True,True,True,True,Tensors and Dynamic neural networks in Python with strong GPU acceleration
HowToCook,Anduin2017,,101183,11021,459,2327,True,False,True,True,Programmer's guide about how to cook at home.
neovim,neovim,Vim Script,101148,6971,1887,4547,False,True,True,True,Vim-fork focused on extensibility and usability
angular,angular,TypeScript,100671,27513,1126,4317,True,True,True,True,Deliver web apps with confidence 🚀
fastapi,fastapi,Python,100517,9611,96,2775,False,True,True,True,"FastAPI framework, high performance, easy to learn, fast to code, ready for production"
every-programmer-should-know,mtdvio,,100099,8778,26,3246,False,True,False,True,A collection of (mostly) technical things every software developer should know about
LLMs-from-scratch,rasbt,Jupyter Notebook,99106,15217,3,1087,False,False,True,True,"Implement a ChatGPT-like LLM in PyTorch from scratch, step by step"
ant-design,ant-design,TypeScript,98725,54647,1269,4099,True,True,True,True,An enterprise-class UI design language and React UI library
material-ui,mui,JavaScript,98589,32573,1522,4348,True,True,True,True,Material UI: Comprehensive React component library that implements Google's Material Design. Free forever.
codex,openai,Rust,98128,14630,9499,457,False,True,True,True,Lightweight coding agent that runs in your terminal
thefuck,nvbn,Python,97526,3955,454,4115,False,True,True,True,Magnificent app which corrects your previous console command.
MoneyPrinterTurbo,harry0703,Python,97486,14416,2,856,False,False,True,True,利用AI大模型，一键生成高清短视频 Generate short videos with one click using AI LLM.
weekly,ruanyf,,96766,4248,8353,2831,False,False,False,True,科技爱好者周刊，每周五发布
Web-Dev-For-Beginners,microsoft,JavaScript,96023,15665,87,2073,True,True,True,True,"24 Lessons, 12 Weeks, Get Started as a Web Developer"
tailwindcss,tailwindlabs,TypeScript,96001,5511,57,3203,False,True,True,True,A utility-first CSS framework for rapid UI development.
app-ideas,florinpop17,,95875,10524,606,2696,True,True,True,True,A Collection of application ideas which can be used to improve your coding skills.
puppeteer,puppeteer,TypeScript,95443,9644,270,3353,False,True,True,True,JavaScript API for Chrome and Firefox
Deep-Live-Cam,hacksider,Python,94913,13822,52,1024,False,True,True,True,real time face swap and one-click video deepfake with only a single image
clean-code-javascript,ryanmcdermott,JavaScript,94783,12604,123,3518,False,False,False,True,Clean Code concepts adapted for JavaScript
bun,oven-sh,Rust,94719,4964,7410,1918,True,True,True,True,"Incredibly fast JavaScript runtime, bundler, test runner, and package manager – all in one"
java-design-patterns,iluwatar,Java,94234,27370,145,4357,False,True,True,True,Design patterns implemented in Java
nvm,nvm-sh,Shell,94134,10265,389,5934,True,True,True,True,Node Version Manager - POSIX-compliant bash script to manage multiple active node.js versions
TradingAgents,TauricResearch,Python,93024,17970,299,564,False,False,True,True,TradingAgents: Multi-Agents LLM Financial Trading Framework
playwright,microsoft,TypeScript,92857,6096,174,2433,True,True,True,True,"Playwright is a framework for Web Testing and Automation. It allows testing Chromium, Firefox and WebKit with a single API. "
DeepSeek-R1,deepseek-ai,,91987,11709,45,540,False,False,True,True,
autoresearch,karpathy,Python,91143,13078,198,130,False,False,True,True,AI agents running research on single-GPU nanochat training automatically
awesome-mcp-servers,punkpeye,,90784,13005,2567,592,False,True,True,True,A collection of MCP servers.
storybook,storybookjs,TypeScript,90696,10312,1776,3771,True,True,True,True,"Storybook is the industry standard workshop for building, documenting, and testing UI components in isolation"
vue-element-admin,PanJiaChen,Vue,90247,30410,1402,3376,False,False,False,True,:tada: A magical vue admin                                                                https://panjiachen.github.io/vue-element-admin
opencv,opencv,C++,89915,56773,2734,5108,False,True,True,True,Open Source Computer Vision Library
bitcoin,bitcoin,C++,89752,39170,666,5686,False,True,True,True,Bitcoin Core integration/staging tree
caveman,JuliusBrussee,JavaScript,89550,5150,396,101,True,True,True,True,🪨 why use many token when few token do trick — Claude Code skill that cuts 65% of tokens by talking like caveman
core,home-assistant,Python,89384,38098,3327,4683,True,True,True,True,:house_with_garden: Open source home automation that puts local control and privacy first.
mermaid,mermaid-js,TypeScript,89236,9113,1651,4273,True,True,True,True,Generation of diagrams like flowcharts or sequence diagrams from text in a similar manner as markdown
uptime-kuma,louislam,JavaScript,89130,8121,759,1838,True,True,True,True,A fancy self-hosted monitoring tool
hugo,gohugoio,Go,88986,8290,232,4758,False,True,True,True,The world’s fastest framework for building websites.
gin,gin-gonic,Go,88914,8640,718,4411,True,True,True,True,"Gin is a high-performance HTTP web framework written in Go. It provides a Martini-like API but with significantly better performance—up to 40 times faster—thanks to httprouter. Gin is designed for building REST APIs, web applications, and microservices."
manim,3b1b,Python,88547,7386,495,4132,False,False,True,True,Animation engine for explanatory math videos
servers,modelcontextprotocol,TypeScript,88484,11221,670,603,True,True,True,True,Model Context Protocol Servers
NextChat,ChatGPTNextWeb,TypeScript,88457,59438,841,1222,True,False,True,True,✨ Light and Fast AI Assistant. Support: Web | iOS | MacOS | Android |  Linux | Windows
django,django,Python,88225,34176,454,5191,True,True,True,True,The Web framework for perfectionists with deadlines.
ML-For-Beginners,microsoft,Jupyter Notebook,88135,21476,1,1960,True,True,True,True,"12 weeks, 26 lessons, 52 quizzes, classic Machine Learning for all"
svelte,sveltejs,JavaScript,87627,5119,1079,3523,True,True,True,True,web development for the rest of us
uv,astral-sh,Rust,87473,3321,2761,1016,True,True,True,True,"An extremely fast Python package and project manager, written in Rust."
awesome-for-beginners,MunGell,,87410,7941,140,3916,False,True,True,True,A list of awesome beginners-friendly projects.
claude-mem,thedotmack,JavaScript,87290,7562,254,317,False,False,True,True,"Persistent Context Across Sessions for Every Agent –  Captures everything your agent does during sessions, compresses it with AI, and injects relevant context back into future sessions. Works with Claude Code, OpenClaw, Codex, Gemini, Hermes, Copilot, OpenCode + More"
Stirling-PDF,Stirling-Tools,Java,87113,7778,499,1264,False,True,True,True,#1 PDF Application on GitHub that lets you edit PDFs on any device anywhere
zed,zed-industries,Rust,86991,9526,3340,1971,True,True,True,True,"Code at the speed of thought – Zed is a high-performance, multiplayer code editor from the creators of Atom and Tree-sitter."
graphify,Graphify-Labs,Python,86648,8521,504,102,False,False,True,True,"AI coding assistant skill (Claude Code, Codex, OpenCode, Cursor, Gemini CLI, and more). Turn any folder of code, SQL schemas, R scripts, shell scripts, docs, papers, images, or videos into a queryable knowledge graph. App code + database schema + infrastructure in one graph."
sherlock,sherlock-project,Python,86586,10150,309,2759,True,False,True,True,Hunt down social media accounts by username across social networks
syncthing,syncthing,Go,86392,5351,395,4613,False,True,True,True,Open Source Continuous File Synchronization
vllm,vllm-project,Python,86283,19424,5752,1251,True,True,True,True,A high-throughput and memory-efficient inference and serving engine for LLMs
system-design-101,ByteByteGoHq,,85907,9528,67,1030,False,True,True,True,Explain complex systems using visuals and simple terms. Help you prepare for system design interviews.
