repo_name,organization,language,stars,forks,open_issues,age_days,has_coc,has_contributing,has_workflows,has_readme,description
paperclip,paperclipai,TypeScript,70823,13176,4826,107,False,True,True,True,The open-source app everyone uses to manage agents at work
act,nektos,Go,70816,1958,339,2723,False,True,True,True,Run your GitHub Actions locally 🚀
swift,swiftlang,Swift,70052,10737,9040,3890,True,True,True,True,The Swift Programming Language
anime,juliangarnier,JavaScript,69969,4723,109,3748,False,True,True,True,JavaScript animation engine
ghidra,NationalSecurityAgency,Java,69834,7659,1887,2666,False,True,True,True,Ghidra is a software reverse engineering (SRE) framework
AFFiNE,toeverything,TypeScript,69514,4938,631,1417,True,True,True,True,"There can be more than Notion and Miro. AFFiNE(pronounced [ə‘fain]) is a next-gen knowledge base that brings planning, sorting and creating all together. Privacy first, open-source, customizable and ready to use. "
OpenBB,OpenBB-finance,Python,69365,6992,72,2005,True,False,True,True,"Financial data platform for analysts, quants and AI agents."
express,expressjs,JavaScript,69201,23748,207,6200,True,True,True,True,"Fast, unopinionated, minimalist web framework for node."
awesome-courses,prakhar1989,,69146,8380,63,4232,False,True,False,True,:books: List of awesome university courses for learning Computer Science!
ansible,ansible,Python,68977,24095,780,5216,True,True,True,True,"Ansible is a radically simple IT automation platform that makes your applications and systems easier to deploy and maintain. Automate everything from code deployment to network configuration to cloud management, in a language that approaches plain English, using SSH, with no agents to install on remote systems. https://docs.ansible.com."
MetaGPT,FoundationAgents,Python,68880,8806,129,1083,False,False,True,True,"🌟 The Multi-Agent Framework: First AI Software Company, Towards Natural Language Programming"
graphify,safishamsi,Python,68813,6946,360,75,False,False,True,True,"AI coding assistant skill (Claude Code, Codex, OpenCode, Cursor, Gemini CLI, and more). Turn any folder of code, SQL schemas, R scripts, shell scripts, docs, papers, images, or videos into a queryable knowledge graph. App code + database schema + infrastructure in one graph."
crawl4ai,unclecode,Python,68803,7018,102,769,True,True,True,True,"🚀🤖 Crawl4AI: Open-source LLM Friendly Web Crawler & Scraper. Don't be shy, join here: https://discord.gg/jP8KfhDhyN"
node,base,Shell,68518,3245,28,1232,False,True,True,True,Everything required to run your own Base node
Apollo-11,chrislgarry,Assembly,68101,7699,132,4458,False,True,True,True,Original Apollo 11 Guidance Computer (AGC) source code for the command and lunar modules.
MinerU,opendatalab,Python,67941,5726,26,839,False,False,True,True,Transforms complex documents like PDFs and Office docs into LLM-ready markdown/JSON for your Agentic workflows.
Chart.js,chartjs,JavaScript,67512,11941,569,4840,False,False,True,True,Simple HTML5 Charts using the <canvas> tag
ai-agents-for-beginners,microsoft,Jupyter Notebook,67483,22281,45,566,True,False,True,True,12 Lessons to Get Started Building AI Agents
learn-claude-code,shareAI-lab,Python,67310,10937,74,353,False,False,True,True,"Bash is all you need -  A nano claude code–like 「agent harness」, built from 0 to 1"
annotated_deep_learning_paper_implementations,labmlai,Python,66952,6708,32,2123,False,False,True,True,"🧑‍🏫 60+ Implementations/tutorials of deep learning papers with side-by-side notes 📝; including transformers (original, xl, switch, feedback, vit, ...), optimizers (adam, adabelief, sophia, ...), gans(cyclegan, stylegan2, ...), 🎮 reinforcement learning (ppo, dqn), capsnet, distillation, ... 🧠"
open-design,nexu-io,TypeScript,66946,7511,413,51,False,True,True,True,"🎨 Local-first, open-source Claude Design alternative. 🖥️ Native desktop app. ⚡ 259+ Skills · ✨ 142+ Design Systems 🖼️ Web · desktop · mobile prototypes · slides · images · videos · HyperFrames 📦 Sandboxed preview · HTML/PDF/PPTX/MP4 export 🤖 Claude Code / OpenClaw / Codex / Cursor / OpenCode / Qwen / Copilot / Hermes / Kimi & 17+ CLIs."
unsloth,unslothai,Python,66727,5993,1097,931,True,True,True,True,"Unsloth Studio is a web UI for training and running open models like Gemma 4, Qwen3.6, DeepSeek, gpt-oss locally."
MiroFish,666ghj,Python,66722,10404,321,204,False,False,True,True,"A Simple and Universal Swarm Intelligence Engine, Predicting Anything. 简洁通用的群体智能引擎，预测万物"
echarts,apache,TypeScript,66613,19796,1614,4824,True,True,True,True,"Apache ECharts is a powerful, interactive charting and data visualization library for browser"
33-js-concepts,leonardomso,JavaScript,66473,9165,2,2843,True,True,True,True,📜 33 JavaScript concepts every developer should know.
scikit-learn,scikit-learn,Python,66358,27072,2086,5783,True,True,True,True,scikit-learn: machine learning in Python
gpt4free,xtekky,Python,66342,13573,2,1176,True,True,True,True,The official gpt4free repository | various collection of powerful language models | opus 4.6 gpt 5.3 kimi 2.5 deepseek v3.2 gemini 3
design-resources-for-developers,bradtraversy,,66120,12094,46,2233,False,True,True,True,"Curated list of design and UI resources from stock photos, web templates, CSS frameworks, UI libraries, tools and much more"
awesome-nodejs,sindresorhus,,65991,6229,26,4359,True,True,True,True,":zap: Delightful Node.js packages and resources [BECAUSE OF TOO MUCH SPAM AND LOW-QUALITY SUBMISSIONS, SUBMISSIONS ARE PAUSED UNTIL JULY]"
Java,TheAlgorithms,Java,65851,21202,23,3623,True,True,True,True,All Algorithms implemented in Java
webpack,webpack,JavaScript,65842,9353,180,5212,True,True,True,True,"A bundler for javascript and friends. Packs many modules into a few bundled assets. Code Splitting allows for loading parts of the application on demand. Through ""loaders"", modules can be CommonJs, AMD, ES6 modules, CSS, Images, JSON, Coffeescript, LESS, ... and your custom stuff."
uBlock,gorhill,JavaScript,65576,4172,17,4095,False,True,True,True,uBlock Origin - An efficient blocker for Chromium and Firefox. Fast and lean.
nocode,kelseyhightower,Dockerfile,65398,4825,4714,3053,False,True,False,True,The best way to write secure and reliable applications. Write nothing; deploy nowhere.
30-Days-Of-Python,Asabeneh,Python,65335,12249,145,2402,False,False,True,True,The 30 Days of Python programming challenge is a step-by-step guide to learn the Python programming language in 30 days. This challenge may take more than 100 days. Follow your own pace. These videos may help too: https://www.youtube.com/channel/UC7PNRuno1rzYPb1xLa4yktw
javascript-questions,lydiahallie,,65327,9218,51,2562,False,False,False,True,"A long list of (advanced) JavaScript questions, and their explanations :sparkles:  "
docusaurus,facebook,TypeScript,65262,9933,408,3284,True,True,True,True,Easy to maintain open source documentation websites.
ripgrep,BurntSushi,Rust,65154,2596,201,3751,False,True,True,True,ripgrep recursively searches directories for a regex pattern while respecting your gitignore
localstack,localstack,Python,65059,4739,0,3522,True,True,True,True,💻 A fully functional local AWS cloud stack. Develop and test your cloud & Serverless apps offline
awesome-claude-skills,ComposioHQ,Python,65031,7207,832,244,False,True,True,True,"A curated list of awesome Claude Skills, resources, and tools for customizing Claude AI workflows"
interviews,kdn251,Java,64973,12882,120,3410,False,False,False,True,Everything you need to know to get the job.
Scrapling,D4Vinci,Python,64686,6347,9,612,True,True,True,True,🕷️ An adaptive Web Scraping framework that handles everything from a single request to a full-scale crawl!
alacritty,alacritty,Rust,64605,3492,339,3773,False,True,True,True,"A cross-platform, OpenGL terminal emulator."
prometheus,prometheus,Go,64569,10510,841,4953,True,True,True,True,The Prometheus monitoring system and time series database.
get-shit-done,gsd-build,JavaScript,64319,5466,9,185,False,True,True,True,"A light-weight and powerful meta-prompting, context engineering and spec-driven development system for Claude Code by TÂCHES."
ladybird,LadybirdBrowser,C++,64146,3071,508,748,True,True,True,True,Truly independent web browser
keras,keras-team,Python,64094,19734,193,4100,False,True,True,True,Deep Learning for humans
openinterpreter,openinterpreter,Rust,64035,5553,270,1070,False,True,True,True,"A lightweight coding agent for open models like Deepseek, Kimi, and Qwen"
pi,earendil-works,TypeScript,63686,7741,59,312,False,True,True,True,"AI agent toolkit: unified LLM API, agent loop, TUI, coding agent CLI"
traefik,traefik,Go,63667,6043,850,3930,True,True,True,True,The Cloud Native Application Proxy
nocodb,nocodb,TypeScript,63482,4848,687,3153,True,True,True,True,🔥 🔥 🔥 A Free & Self-hostable Airtable Alternative
cline,cline,TypeScript,63466,6713,1128,712,True,True,True,True,"Autonomous coding agent as an SDK, IDE extension, or CLI assistant."
rtk,rtk-ai,Rust,63424,3903,1249,146,False,True,True,True,"CLI proxy that reduces LLM token consumption by 60-90% on common dev commands. Single Rust binary, zero dependencies"
nerd-fonts,ryanoasis,CSS,63400,3902,77,4213,True,True,True,True,"Iconic font aggregator, collection, & patcher. 3,600+ icons, 50+ patched fonts: Hack, Source Code Pro, more. Glyph collections: Font Awesome, Material Design Icons, Octicons, & more"
rustlings,rust-lang,Rust,63251,11206,39,3929,False,True,True,True,:crab: Small exercises to get you used to reading and writing Rust code!
socket.io,socketio,TypeScript,63181,10149,176,5942,False,True,True,True,Bidirectional and low-latency communication for every platform
Understand-Anything,Egonex-AI,TypeScript,63073,5203,212,95,True,True,True,True,"Graphs that teach > graphs that impress. Turn any code into an interactive knowledge graph you can explore, search, and ask questions about. Works with Claude Code, Codex, Cursor, Copilot, Gemini CLI, and more."
pathway,pathwaycom,Python,62940,1676,39,1298,True,True,True,True,"Python ETL framework for stream processing, real-time analytics, LLM pipelines, and RAG."
tldr,tldr-pages,Markdown,62875,5302,330,4574,False,True,True,True,Collaborative cheatsheets for console commands 📚.
resume.github.com,resume,JavaScript,62861,1369,76,5610,False,False,False,True,Resumes generated using the GitHub informations
oh-my-openagent,code-yeongyu,TypeScript,62613,5071,677,197,False,True,True,True,"omo/lazycodex: The coding agent for tokenmaxxers;the one and only agent harness for complex codebases. For your Codex, for your OpenCode"
agent-skills,addyosmani,Shell,62499,6792,141,122,False,True,True,True,Production-grade engineering skills for AI coding agents.
vaultwarden,dani-garcia,Rust,62477,2909,53,3042,False,False,True,True,"Unofficial Bitwarden compatible server written in Rust, formerly known as bitwarden_rs"
scrapy,scrapy,Python,62306,11661,617,5960,True,True,True,True,"Scrapy, a fast high-level web crawling & scraping framework for Python."
warp,warpdotdev,Rust,61952,5039,4357,1805,True,True,True,True,"Warp is an agentic development environment, born out of the terminal."
docling,docling-project,Python,61780,4325,925,708,True,True,True,True,Get your documents ready for gen AI
anything-llm,Mintplex-Labs,JavaScript,61755,6739,307,1110,False,True,True,True,Stop renting your intelligence. Own it with AnythingLLM. Everything you need for a powerful local-first agent experience 
leetcode-master,youngyangyang04,Shell,61708,12330,247,2377,False,False,False,True,《代码随想录》LeetCode 刷题攻略：200道经典题目刷题顺序，共60w字的详细图解，视频难点剖析，50余张思维导图，支持C++，Java，Python，Go，JavaScript等多语言版本，从此算法学习不再迷茫！🔥🔥 来看看，你会发现相见恨晚！🚀 
drawio-desktop,jgraph,JavaScript,61672,5701,72,3310,True,False,True,True,Official electron build of draw.io
sway,FuelLabs,Rust,61620,5420,919,1975,False,False,True,True,🌴 Empowering everyone to build reliable and efficient smart contracts.
git,git,C,61547,28025,379,6538,True,True,True,True,Git Source Code Mirror - This is a publish-only repository but pull requests can be turned into patches to the mailing list via GitGitGadget (https://gitgitgadget.github.io/). Please follow Documentation/SubmittingPatches procedure for any of your improvements.
redux,reduxjs,TypeScript,61508,15057,49,4037,True,True,True,True,A JS library for predictable global state management
openpilot,commaai,Python,61409,10992,122,3493,False,True,True,True,"openpilot is an operating system for robotics. Currently, it upgrades the driver assistance system on 300+ supported cars."
FFmpeg,FFmpeg,C,61235,13920,3,5543,False,True,False,True,Mirror of https://git.ffmpeg.org/ffmpeg.git
lodash,lodash,JavaScript,61227,7183,152,5185,False,True,True,True,"A modern JavaScript utility library delivering modularity, performance, & extras."
minio,minio,Go,61205,7603,81,4172,True,True,True,True,"MinIO is a high-performance, S3 compatible object store, open sourced under GNU AGPLv3 license."
Magisk,topjohnwu,Kotlin,61015,17707,65,3569,False,False,True,True,The Magic Mask for Android
Front-end-Developer-Interview-Questions,h5bp,Nunjucks,60884,11034,62,5242,True,True,True,True,"A list of helpful front-end related questions you can use to interview potential candidates, test yourself or completely ignore."
memos,usememos,Go,60878,4474,25,1652,False,False,True,True,"Open-source, self-hosted note-taking tool built for quick capture. Markdown-native, lightweight, and fully yours."
architect-awesome,xingshaocheng,,60818,17689,63,2994,False,False,False,True,后端架构师技术图谱
atom,atom,JavaScript,60807,17213,994,5262,True,True,False,True,:atom: The hackable text editor
awesome-chatgpt-prompts-zh,PlexPt,,60667,13572,47,1284,False,False,False,True,ChatGPT 中文调教指南。各种场景使用指南。学习怎么让它听你的话。
nuxt,nuxt,TypeScript,60479,5670,817,3521,True,True,True,True,the full-stack Vue framework
awesome-flutter,Solido,Dart,60343,6892,36,3328,False,True,True,True,"An awesome list that curates the best Flutter libraries, tools, tutorials, articles and more."
astro,withastro,TypeScript,60262,3548,155,1920,True,True,True,True,The web framework for content-driven websites. ⭐️ Star to support our work!
markdown-here,adam-p,JavaScript,60218,11052,318,5149,False,True,False,True,"Google Chrome, Firefox, and Thunderbird extension that lets you write email in Markdown and render it before sending."
ai-hedge-fund,virattt,Python,60215,10657,142,565,False,False,True,True,An AI Hedge Fund Team
hello-agents,datawhalechina,Python,60125,7392,151,283,False,False,True,True,📚 《从零开始构建智能体》——从零开始的智能体原理与实践教程
spring-framework,spring-projects,Java,60034,38834,452,5671,True,True,True,True,Spring Framework
ruflo,ruvnet,TypeScript,60023,6955,646,380,False,False,True,True,"🌊 The leading agent meta-harness for Claude. Deploy intelligent multi-agent swarms, coordinate autonomous workflows, and build conversational AI systems. Features adaptive memory, self-learning swarm intelligence, RAG integration, and native Claude Code / Codex Integration"
Real-Time-Voice-Cloning,CorentinJ,Python,59923,9406,171,2579,False,False,True,True,Clone a voice in 5 seconds to generate arbitrary speech in real-time
jquery,jquery,JavaScript,59825,20408,97,6284,True,True,True,True,jQuery JavaScript Library
nanoGPT,karpathy,Python,59805,10320,349,1268,False,False,False,True,"The simplest, fastest repository for training/finetuning medium-sized GPTs."
TrendRadar,sansan0,Python,59591,24673,45,415,False,False,True,True,"⭐AI-driven public opinion & trend monitor with multi-platform aggregation, RSS, and smart alerts.🎯 告别信息过载，你的 AI 舆情监控助手与热点筛选工具！聚合多平台热点 +  RSS 订阅，支持关键词精准筛选。AI 智能筛选新闻 + AI 翻译 +  AI 分析简报直推手机，也支持接入 MCP 架构，赋能 AI 自然语言对话分析、情感洞察与趋势预测等。支持 Docker ，数据本地/云端自持。集成微信/飞书/钉钉/Telegram/邮件/ntfy/bark/slack 等渠道智能推送。"
shadowsocks-windows,shadowsocks,C#,59561,16251,200,4902,False,True,False,True,A C# port of shadowsocks
llama,meta-llama,Python,59467,9790,520,1219,True,True,True,True,Inference code for Llama models
pi-hole,pi-hole,Shell,59350,3229,43,4392,True,True,True,True,A black hole for Internet advertisements
llm-app,pathwaycom,Jupyter Notebook,59328,1431,10,1064,True,True,True,True,"Ready-to-run cloud templates for RAG, AI pipelines, and enterprise search with live data. 🐳Docker-friendly.⚡Always in sync with Sharepoint, Google Drive, S3, Kafka, PostgreSQL, real-time data APIs, and more."
bat,sharkdp,Rust,59282,1567,402,2979,False,True,True,True,A cat(1) clone with wings.
pocketbase,pocketbase,Go,59162,3460,16,1444,False,True,True,True,Open Source realtime backend in 1 file
mkcert,FiloSottile,Go,59103,3127,170,2915,True,True,True,True,A simple zero-config tool to make locally trusted development certificates with any names you'd like.
autogen,microsoft,Python,59048,8905,892,1034,True,True,True,True,A programming framework for agentic AI
mem0,mem0ai,Python,58825,6769,334,1093,False,True,True,True,Universal memory layer for AI Agents
GPT-SoVITS,RVC-Boss,Python,58793,6429,874,885,False,False,True,True,1 min voice data can also be used to train a good TTS model! (few shot voice cloning)
rails,rails,Ruby,58697,22167,1507,6642,True,True,True,True,Ruby on Rails
angular.js,angular,JavaScript,58598,27097,461,6007,True,True,False,True,AngularJS - HTML enhanced for web apps!
ultralytics,ultralytics,Python,58527,11206,309,1375,True,True,True,True,Ultralytics YOLO 🚀
starship,starship,Rust,58353,2554,1019,2634,True,True,True,True,"☄🌌️  The minimal, blazing-fast, and infinitely customizable prompt for any shell!"
zustand,pmndrs,TypeScript,58333,2072,3,2626,False,True,True,True,🐻 Bear necessities for state management in React
v2rayNG,2dust,Kotlin,58261,7610,7,2591,False,False,True,True,"A V2Ray client for Android, support Xray core and v2fly core"
claude-code-best-practice,shanraisshan,HTML,58208,5850,9,229,False,False,True,True,from vibe coding to agentic engineering - practice makes claude perfect
meilisearch,meilisearch,Rust,58162,2571,307,2977,True,True,True,True,A lightning-fast search engine API bringing AI-powered hybrid search to your sites and applications.
rclone,rclone,Go,57916,5165,1210,4476,True,True,True,True,"""rsync for cloud storage"" - Google Drive, S3, Dropbox, Backblaze B2, One Drive, Swift, Hubic, Wasabi, Google Cloud Storage, Azure Blob, Azure Files, Yandex Files"
awesome-rust,rust-unofficial,Rust,57912,3434,9,4353,False,True,True,True,A curated list of Rust code and resources.
context7,upstash,TypeScript,57594,2713,17,448,False,False,True,True,Context7 Platform -- Up-to-date code documentation for LLMs and AI code editors
yolov5,ultralytics,Python,57531,17465,42,2222,True,True,True,True,Ultralytics YOLOv5 in PyTorch > ONNX > CoreML > TFLite
marktext,marktext,TypeScript,57501,4300,1106,3139,False,True,True,True,"📝A simple and elegant markdown editor, available for Linux, macOS and Windows."
html5-boilerplate,h5bp,JavaScript,57496,12294,31,5988,True,True,True,True,"A professional front-end template for building fast, robust, and adaptable web apps or sites."
github-cheat-sheet,tiimgreen,,57436,5426,48,4449,False,True,False,True,A list of cool features of Git and GitHub.
DeepLearning-500-questions,scutan90,JavaScript,57434,15914,120,2913,False,False,False,True,深度学习500问，以问答形式对常用的概率知识、线性代数、机器学习、深度学习、计算机视觉等热点问题进行阐述，以帮助自己及有需要的读者。 全书分为18个章节，50余万字。由于水平有限，书中不妥之处恳请广大读者批评指正。   未完待续............ 如有意合作，联系scutjy2015@163.com                     版权所有，违权必究       Tan 2018.06
private-gpt,zylon-ai,Python,57280,7610,5,1142,False,False,True,True,"Interact with your documents using the power of GPT, 100% privately, no data leaks"
coolify,coollabsio,PHP,57114,4793,796,1969,True,True,True,True,"An open-source, self-hostable PaaS alternative to Vercel, Heroku & Netlify that lets you easily deploy static sites, databases, full-stack applications and 280+ one-click services on your own servers."
fuel-core,FuelLabs,Rust,57009,2861,194,2120,False,True,True,True,Rust full node implementation of the Fuel v2 protocol.
you-get,soimort,Python,56841,9730,384,5049,False,True,True,True,:arrow_double_down: Dumb downloader that scrapes the web
worldmonitor,koala73,TypeScript,56691,9078,169,160,True,True,True,True,"Real-time global intelligence dashboard. AI-powered news aggregation, geopolitical monitoring, and infrastructure tracking in a unified situational awareness interface"
ghostty,ghostty-org,Zig,56653,2923,251,1541,False,True,True,True,"👻 Ghostty is a fast, feature-rich, and cross-platform terminal emulator that uses platform-native UI and GPU acceleration."
rich,Textualize,Python,56644,2185,352,2411,True,True,True,True,Rich is a Python library for rich text and beautiful formatting in the terminal.
OpenCut,OpenCut-app,TypeScript,56612,6139,326,360,True,False,True,True,The open-source CapCut alternative
OpenManus,FoundationAgents,Python,56587,9846,525,468,True,False,True,True,"No fortress, purely open ground.  OpenManus is Coming."
termux-app,termux,Java,56526,6788,551,3890,False,False,True,True,Termux - a terminal emulator application for Android OS extendible by variety of packages.
face_recognition,ageitgey,Python,56511,13698,837,3393,False,True,True,True,The world's simplest facial recognition api for Python and the command line
awesome-android-ui,wasabeef,,56484,10247,39,4194,True,False,False,True,A curated list of awesome Android UI/UX libraries
react-router,remix-run,TypeScript,56449,10869,132,4415,True,True,True,True,Declarative routing for React
gitea,go-gitea,Go,56361,6807,2751,3516,True,True,True,True,"Git with a cup of tea! Painless self-hosted all-in-one software development service, including Git hosting, code review, team collaboration, package registry and CI/CD"
appwrite,appwrite,TypeScript,56335,5453,977,2627,True,True,True,True,"Appwrite® - complete cloud infrastructure for your web, mobile and AI apps. Including Auth, Databases, Storage, Functions, Messaging, Hosting, Realtime and more"
Mole,tw93,Shell,56291,1980,1,268,False,True,True,True,"🐹 Clean, uninstall, analyze, optimize, and monitor your Mac from the terminal."
project-layout,golang-standards,Makefile,56132,5442,95,3203,False,False,True,True,Standard Go Project Layout
winutil,ChrisTitusTech,PowerShell,56057,3184,53,1512,True,True,True,True,"Chris Titus Tech's Windows Utility - Install Programs, Tweaks, Fixes, and Updates"
gatsby,gatsbyjs,JavaScript,55938,10167,392,4045,True,True,True,True,"React-based framework with performance, scalability, and security built in."
mempalace,MemPalace,Python,55867,7242,581,74,False,True,True,True,The best-benchmarked open-source AI memory system. And it's free.
leetcode,azl397985856,JavaScript,55755,9408,10,3001,False,True,False,True,LeetCode Solutions: A Record of My Problem Solving Journey.( leetcode题解，记录自己的leetcode解题之路。)
OpenSpec,Fission-AI,TypeScript,55416,3875,416,316,False,False,True,True,Spec-driven development (SDD) for AI coding assistants.
faceswap,deepfakes,Python,55291,13364,9,3102,True,False,True,True,Deepfakes Software For All
joplin,laurent22,TypeScript,55264,6146,564,3439,False,True,True,True,"Joplin - the privacy-focused note taking app with sync capabilities for Windows, macOS, Linux, Android and iOS."
gpt-engineer,AntonOsika,Python,55206,7306,71,1145,True,True,True,True,CLI platform to experiment with codegen. Precursor to: https://lovable.dev
n8n-workflows,Zie619,Python,55189,7320,29,399,False,False,True,True,all of the workflows of n8n i could find (also from the site itself)
nanochat,karpathy,Python,55178,7583,109,247,False,False,True,True,The best ChatGPT that $100 can buy.
first-contributions,firstcontributions,,54520,104475,74,3557,True,True,True,True,🚀✨ Help beginners to contribute to open source projects
powerlevel10k,romkatv,Shell,54486,2421,147,2670,False,False,False,True,A Zsh theme
career-ops,santifer,JavaScript,54477,10806,179,74,True,True,True,True,"AI-powered job search system built on Claude Code. 14 skill modes, Go dashboard, PDF generation, batch processing."
ChatGPT,lencx,Rust,54385,6148,938,1288,False,False,True,True,"🔮 ChatGPT Desktop Application (Mac, Windows and Linux)"
typst,typst,Rust,54380,1608,1257,2458,False,True,True,True,A markup-based typesetting system that is powerful and easy to learn.
segment-anything,facebookresearch,Jupyter Notebook,54363,6358,594,1182,True,True,True,True,"The repository provides code for running inference with the SegmentAnything Model (SAM), links for downloading the trained model checkpoints, and example notebooks that show how to use the model."
dive,wagoodman,Go,54251,1982,205,2957,False,False,True,True,A tool for exploring each layer in a docker image
trackerslist,ngosang,,54202,6596,8,3706,False,False,True,True,Updated list of public BitTorrent trackers
maybe,maybe-finance,Ruby,54158,5598,0,898,False,True,True,True,The personal finance app for everyone
element,ElemeFE,Vue,54114,14452,2971,3575,False,False,True,True,A Vue.js 2.0 UI Toolkit for Web
requests,psf,Python,54047,9977,229,5603,True,True,True,True,"A simple, yet elegant, HTTP library."
