repo_name,organization,language,stars,forks,open_issues,age_days,has_coc,has_contributing,has_workflows,has_readme,description
huginn,huginn,Ruby,48962,4247,692,4762,False,False,True,True,Create agents that monitor and act on your behalf.  Your agents are standing by!
query,TanStack,TypeScript,48902,3741,149,2387,False,True,True,True,"🤖 Powerful asynchronous state management, server-state utilities and data fetching for the web. TS/JS, React Query, Solid Query, Svelte Query and Vue Query."
dayjs,iamkun,JavaScript,48617,2426,1199,2905,False,True,True,True,⏰ Day.js 2kB immutable date-time library alternative to Moment.js with the same modern API
julia,JuliaLang,Julia,48563,5754,4730,5451,True,True,True,True,The Julia Programming Language
ghostty,ghostty-org,Zig,48515,2116,202,1456,False,True,True,True,"👻 Ghostty is a fast, feature-rich, and cross-platform terminal emulator that uses platform-native UI and GPU acceleration."
RxJava,ReactiveX,Java,48470,7602,14,4823,False,True,True,True,RxJava – Reactive Extensions for the JVM – a library for composing asynchronous and event-based programs using observable sequences for the Java VM.
algorithm-visualizer,algorithm-visualizer,JavaScript,48422,7577,78,3601,True,True,False,True,:fireworks:Interactive Online Platform that Visualizes Algorithms from Code
pandas,pandas-dev,Python,48239,19779,3613,5692,True,True,True,True,"Flexible and powerful data analysis / manipulation library for Python, providing labeled data structures similar to R data.frame objects, statistical functions, and much more"
expo,expo,TypeScript,48198,11508,888,3508,False,True,True,True,"An open-source framework for making universal native apps with React. Expo runs on Android, iOS, and the web."
moment,moment,JavaScript,48035,7021,294,5503,False,True,True,True,"Parse, validate, manipulate, and display dates in javascript."
freqtrade,freqtrade,Python,48004,10002,42,3233,False,True,True,True,"Free, open source crypto trading bot"
terraform,hashicorp,Go,48001,10258,1896,4394,True,True,True,True,"Terraform enables you to safely and predictably create, change, and improve infrastructure. It is a source-available tool that codifies APIs into declarative configuration files that can be shared amongst team members, treated as code, edited, reviewed, and versioned."
open-source-mac-os-apps,serhii-londar,,47966,2495,40,3064,False,True,True,True,🚀 Awesome list of open source applications for macOS. https://t.me/s/opensourcemacosapps
llama_index,run-llama,Python,47962,7086,250,1239,True,True,True,True,LlamaIndex is the leading document agent and OCR platform
x64dbg,x64dbg,C++,47958,2693,588,4000,True,True,True,True,An open-source user mode debugger for Windows. Optimized for reverse engineering and malware analysis.
whisper.cpp,ggml-org,C++,47917,5332,1155,1276,False,False,True,True,Port of OpenAI's Whisper model in C/C++
Fooocus,lllyasviel,Python,47905,7828,287,958,False,False,True,True,Focus on prompting and generating
type-challenges,type-challenges,TypeScript,47869,5232,33130,2070,True,False,True,True,Collection of TypeScript type challenges with online judge
kubernetes-the-hard-way,kelseyhightower,,47829,15582,47,3547,False,True,False,True,Bootstrap Kubernetes the hard way. No scripts.
jadx,skylot,Java,47773,5464,414,4754,True,True,True,True,Dex to Java decompiler
htmx,bigskysoftware,JavaScript,47702,1582,658,2171,False,True,True,True,</> htmx - high power tools for HTML
design-patterns-for-humans,kamranahmedse,,47650,5508,17,3323,False,False,False,True,An ultra-simplified explanation to design patterns
awesome-claude-skills,ComposioHQ,Python,47633,4897,379,158,False,True,True,True,"A curated list of awesome Claude Skills, resources, and tools for customizing Claude AI workflows"
big-list-of-naughty-strings,minimaxir,Python,47616,2164,108,3881,False,False,False,True,The Big List of Naughty Strings is a list of strings which have a high probability of causing issues when used as user-input data.
gogs,gogs,Go,47600,5068,967,4424,False,True,True,True,Gogs is a painless self-hosted Git service
Projects,karan,,47529,10671,120,4646,False,True,False,True,:page_with_curl: A list of practical projects that anyone can solve in any programming language.
awesome-java,akullpp,,47394,7652,21,4276,False,True,True,True,"A curated list of awesome frameworks, libraries and software for the Java programming language."
chinese-independent-developer,1c7,,47352,4028,4,3106,False,False,True,True,👩🏿‍💻👨🏾‍💻👩🏼‍💻👨🏽‍💻👩🏻‍💻中国独立开发者项目列表 -- 分享大家都在做什么
OpenCut,OpenCut-app,TypeScript,47307,4916,281,275,True,True,True,True,The open-source CapCut alternative
brew,Homebrew,Ruby,47194,11029,20,3670,True,True,True,True,🍺 The missing package manager for macOS (or Linux)
awesome-react-components,brillout,,47124,3744,36,3560,True,True,True,True,Curated List of React Components & Libraries.
crewAI,crewAIInc,Python,47123,6371,455,880,False,False,True,True,"Framework for orchestrating role-playing, autonomous AI agents. By fostering collaborative intelligence, CrewAI empowers agents to work together seamlessly, tackling complex tasks."
PythonDataScienceHandbook,jakevdp,Jupyter Notebook,47112,18793,230,3513,True,True,False,True,Python Data Science Handbook: full text in Jupyter Notebooks
react,typescript-cheatsheets,JavaScript,47016,4293,1,2853,True,True,True,True,Cheatsheets for experienced React developers getting started with TypeScript
quill,slab,TypeScript,46995,3633,634,4985,True,True,True,True,Quill is a modern WYSIWYG editor built for compatibility and extensibility
Pake,tw93,Rust,46989,9285,2,1257,True,True,True,True,🤱🏻 Turn any webpage into a desktop app with one command.
v2ray-core,v2ray,Go,46974,8873,8,3854,True,False,True,True,A platform for building proxies to bypass network restrictions.
Made-With-ML,GokuMohandas,Jupyter Notebook,46949,7370,24,2697,False,False,True,True,"Learn how to develop, deploy and iterate on production-grade ML applications."
serverless,serverless,JavaScript,46946,5738,1220,3991,True,True,True,True,"⚡ Serverless Framework – Effortlessly build apps that auto-scale, incur zero costs when idle, and require minimal maintenance using AWS Lambda and other managed cloud services."
plane,makeplane,TypeScript,46939,3794,691,1221,True,True,True,True,"🔥🔥🔥 Open-source Jira, Linear, Monday, and ClickUp alternative. Plane is a modern project management platform to manage tasks, sprints, docs, and triage."
okhttp,square,Kotlin,46922,9282,90,4992,False,True,True,True,"Square’s meticulous HTTP client for the JVM, Android, and GraalVM."
pixijs,pixijs,TypeScript,46810,4988,322,4810,True,True,True,True,"The HTML5 Creation Engine: Create beautiful digital content with the fastest, most flexible 2D WebGL renderer."
ruff,astral-sh,Rust,46673,1956,1959,1323,True,True,True,True,"An extremely fast Python linter and code formatter, written in Rust."
discourse,discourse,Ruby,46628,8858,151,4820,True,True,True,True,"A platform for community discussion. Free, open, simple."
MediaCrawler,NanmiCoder,Python,46573,10029,138,1019,False,False,True,True,小红书笔记 | 评论爬虫、抖音视频 | 评论爬虫、快手视频 | 评论爬虫、B 站视频 ｜ 评论爬虫、微博帖子 ｜ 评论爬虫、百度贴吧帖子 ｜ 百度贴吧评论回复爬虫  | 知乎问答文章｜评论爬虫
awesome-design-patterns,DovAmir,,46560,3218,22,2850,False,True,False,True,A curated list of software and architecture related design patterns.
metabase,metabase,Clojure,46541,6318,4022,4068,False,True,True,True,The easy-to-use open source Business Intelligence and Embedded Analytics tool that lets everyone work with data :bar_chart:
ClickHouse,ClickHouse,C++,46516,8228,5543,3582,True,True,True,True,ClickHouse® is a real-time analytics database management system
text-generation-webui,oobabooga,Python,46354,5901,775,1190,False,False,True,True,"The original local LLM interface. Text, vision, tool-calling, training, and more. 100% offline."
frontend-dev-bookmarks,dypsilon,,46268,5153,123,4658,False,True,False,True,Manually curated collection of resources for frontend web developers.
AI-For-Beginners,microsoft,Jupyter Notebook,46243,9453,4,1847,True,False,True,True,"12 Weeks, 24 Lessons, AI for All!"
30-Days-Of-JavaScript,Asabeneh,JavaScript,46200,10443,368,2283,False,False,False,True,"30 days of JavaScript programming challenge is a step-by-step guide to learn JavaScript programming language in 30 days. This challenge may take more than 100 days,  please just follow your own pace. These videos may help too: https://www.youtube.com/channel/UC7PNRuno1rzYPb1xLa4yktw"
learn-regex,ziishaned,,46156,6210,65,3167,False,False,False,True,Learn regex the easy way
acme.sh,acmesh-official,Shell,46080,5548,1371,3741,False,False,True,True,A pure Unix shell script ACME client for SSL / TLS certificate automation
tldraw,tldraw,TypeScript,46034,3095,327,1780,True,True,True,True,very good whiteboard infinite canvas SDK
monaco-editor,microsoft,JavaScript,45816,4012,827,3577,True,True,True,True,A browser based code editor
GitHubDaily,GitHubDaily,,45769,4588,553,2641,False,False,False,True,"坚持分享 GitHub 上高质量、有趣实用的开源技术教程、开发者工具、编程网站、技术资讯。A list cool, interesting projects of GitHub."
nvm-windows,coreybutler,Go,45633,3775,95,4203,False,True,True,True,A node.js version management utility for Windows. Ironically written in Go.
architecture-samples,android,Kotlin,45619,11875,217,3700,False,True,True,True,A collection of samples to discuss and showcase different architectural tools and patterns for Android apps.
prisma,prisma,TypeScript,45590,2120,2537,2469,True,True,True,True,"Next-generation ORM for Node.js & TypeScript | PostgreSQL, MySQL, MariaDB, SQL Server, SQLite, MongoDB and CockroachDB"
JeecgBoot,jeecgboot,Java,45554,15850,70,2675,False,False,True,True,"一款 AI 驱动的低代码平台，提供""零代码""与""代码生成""双模式——零代码模式一句话搭建系统，代码生成模式自动输出前后端代码与建表 SQL，生成即可运行。平台内置 AI 聊天助手、AI大模型、知识库、AI流程编排、MCP 与插件体系，兼容主流大模型，支持一句话生成流程图、设计表单、聊天式业务操作，解决 Java 项目 80% 重复工作，高效且不失灵活。"
awesome-cheatsheets,LeCoupa,JavaScript,45530,6672,135,3058,False,False,True,True,"👩‍💻👨‍💻 Awesome cheatsheets for popular programming languages, frameworks and development tools. They include everything you should know in one single file."
gstack,garrytan,TypeScript,45468,5703,166,13,False,True,True,True,"Use Garry Tan's exact Claude Code setup: 15 opinionated tools that serve as CEO, Designer, Eng Manager, Release Manager, Doc Engineer, and QA"
jest,jestjs,TypeScript,45331,6639,243,4488,True,True,True,True,Delightful JavaScript Testing.
AdminLTE,ColorlibHQ,CSS,45321,18266,4,4473,True,True,True,True,AdminLTE - Free admin dashboard template based on Bootstrap 5
zx,google,JavaScript,45305,1223,33,1784,True,True,True,True,A tool for writing better scripts
bevy,bevyengine,Rust,45267,4469,3306,2257,True,True,True,True,A refreshingly simple data-driven game engine built in Rust
spotube,KRTirtho,Dart,45185,2022,763,1865,True,False,True,True,🎧 Open source music streaming app! Available for both desktop & mobile!
slidev,slidevjs,TypeScript,45115,1973,188,1796,True,True,True,True,Presentation Slides for Developers
legado,gedoor,Kotlin,45083,4973,71,2499,False,False,True,True,"Legado 3.0 Book Reader with powerful controls & full functions❤️阅读3.0, 阅读是一款可以自定义来源阅读网络内容的工具，为广大网络文学爱好者提供一种方便、快捷舒适的试读体验。"
penpot,penpot,Clojure,45009,2621,575,3738,True,True,True,True,Penpot: The open-source design tool for design and code collaboration
Rocket.Chat,RocketChat,TypeScript,45002,13455,3601,3962,True,True,True,True,The Secure CommsOS™ for mission-critical operations
TTS,coqui-ai,Python,44919,6013,7,2134,True,True,True,True,"🐸💬 - a deep learning toolkit for Text-to-Speech, battle-tested in research and production"
CppCoreGuidelines,isocpp,CSS,44861,5546,250,3870,False,True,True,True,"The C++ Core Guidelines are a set of tried-and-true guidelines, rules, and best practices about coding in C++"
meteor,meteor,JavaScript,44784,5267,368,5179,True,True,True,True,"Meteor, the JavaScript App Platform"
airflow,apache,Python,44773,16764,1818,3998,True,True,True,True,"Apache Airflow - A platform to programmatically author, schedule, and monitor workflows"
Leaflet,Leaflet,JavaScript,44716,6104,560,5662,True,True,True,True,🍃 JavaScript library for mobile-friendly interactive maps 🇺🇦
hyper,vercel,TypeScript,44714,3551,1026,3553,False,False,True,True,A terminal built on web technologies
react-hook-form,react-hook-form,TypeScript,44626,2375,126,2576,True,True,True,True,📋 React Hooks for form state management and validation (Web + React Native)
grpc,grpc,C++,44541,11094,1215,4124,True,True,True,True,"C++ based gRPC (C++, Python, Ruby, Objective-C, PHP, C#)"
awesome-compose,docker,HTML,44529,8092,353,2231,False,True,True,True,Awesome Docker Compose samples
edex-ui,GitSquared,JavaScript,44505,3058,6,3342,False,False,True,True,"A cross-platform, customizable science fiction terminal emulator with advanced monitoring & touchscreen support."
pyenv,pyenv,Shell,44476,3245,56,4953,False,True,True,True,Simple Python version management
reactjs-interview-questions,sudheerj,JavaScript,44393,10305,10,2854,False,False,True,True,List of top 500 ReactJS Interview Questions & Answers....Coding exercise questions are coming soon!!
LocalAI,mudler,Go,44336,3792,147,1102,False,True,True,True,"LocalAI is the open-source AI engine. Run any model - LLMs, vision, voice, image, video - on any hardware. No GPU required."
awesome-remote-job,lukasz-madon,,44243,4506,45,4100,False,True,True,True,A curated list of awesome remote jobs and resources. Inspired by https://github.com/vinta/awesome-python
iina,iina,Swift,44205,2780,1970,3382,False,True,True,True,The modern video player for macOS.
build-web-application-with-golang,astaxie,Go,44152,10528,138,4982,False,False,False,True,A golang ebook intro how to build a web with golang
EasySpider,NaiboWang,JavaScript,44145,5386,265,2076,False,False,True,True,A visual no-code/code-free web crawler/spider易采集：一个可视化浏览器自动化测试/数据采集/爬虫软件，可以无代码图形化的设计和执行爬虫任务。别名：ServiceWrapper面向Web应用的智能化服务封装系统。
upscayl,upscayl,TypeScript,44126,2133,61,1333,False,False,True,True,"🆙 Upscayl - #1 Free and Open Source AI Image Upscaler for Linux, MacOS and Windows."
parcel,parcel-bundler,JavaScript,44051,2277,592,3151,True,True,True,True,The zero configuration build tool for the web. 📦🚀
streamlit,streamlit,Python,44008,4161,1313,2405,True,True,True,True,Streamlit — A faster way to build and share data apps.
deer-flow,bytedance,Python,43961,5173,312,322,False,True,True,True,"An open-source SuperAgent harness that researches, codes, and creates. With the help of sandboxes, memories, tools, skill, subagents and message gateway, it handles different levels of tasks that could take minutes to hours."
react-use,streamich,TypeScript,43956,3277,653,2705,False,True,True,True,React Hooks — 👍
Summer2026-Internships,SimplifyJobs,Python,43918,3170,6,2131,False,True,True,True,Collection of Summer 2026 tech internships!
front-end-interview-handbook,yangshun,MDX,43912,5947,11,2992,True,True,True,True,Front End interview preparation materials for busy engineers (updated for 2026)
babel,babel,TypeScript,43911,5818,756,4195,True,True,True,True,🐠 Babel is a compiler for writing next generation JavaScript.
retrofit,square,HTML,43908,7361,169,5678,False,True,True,True,A type-safe HTTP client for Android and the JVM
Mole,tw93,Shell,43832,1279,8,182,False,True,True,True,🐹 Deep clean and optimize your Mac.
TensorFlow-Examples,aymericdamien,Jupyter Notebook,43789,14783,227,3786,False,False,False,True,TensorFlow Tutorial and Examples for Beginners (support TF v1 & v2)
jsoncrack.com,AykutSarac,TypeScript,43786,3530,41,1514,True,True,True,True,"✨ Innovative and open-source visualization application that transforms various data formats, such as JSON, YAML, XML and CSV into interactive graphs."
copyparty,9001,Python,43722,1786,248,2494,True,True,False,True,"Portable file server with accelerated resumable uploads, dedup, WebDAV, SFTP, FTP, TFTP, zeroconf, media indexer, thumbnails++ all in one file"
worldmonitor,koala73,TypeScript,43676,7096,91,75,True,True,True,True,"Real-time global intelligence dashboard — AI-powered news aggregation, geopolitical monitoring, and infrastructure tracking in a unified situational awareness interface"
helix,helix-editor,Rust,43621,3375,1468,2123,False,True,True,True,A post-modern modal text editor.
TrafficMonitor,zhongyang219,C++,43603,3621,1265,3160,False,False,True,True,这是一个用于显示当前网速、CPU及内存利用率的桌面悬浮窗软件，并支持任务栏显示，支持更换皮肤。
cobra,spf13,Go,43518,3089,359,4585,False,True,True,True,A Commander for modern Go CLI interactions
tmux,tmux,C,43509,2509,58,3947,False,True,True,True,tmux source code
milvus,milvus-io,Go,43457,3910,1109,2381,True,True,True,True,"Milvus is a high-performance, cloud-native vector database built for scalable vector ANN search"
minimind,jingyaogong,Python,43440,5219,38,606,True,False,True,True,🚀🚀 「大模型」2小时完全从0训练26M的小参数GPT！🌏 Train a 26M-parameter GPT from scratch in just 2h!
sentry,getsentry,Python,43437,4640,2152,5685,True,True,True,True,Developer-first error tracking and performance monitoring
fuels-rs,FuelLabs,Rust,43348,1359,68,1605,False,False,True,True,Fuel Network Rust SDK
cli,cli,Go,43346,8150,956,2364,True,True,True,True,GitHub’s official command line tool
fuels-ts,FuelLabs,TypeScript,43305,1367,79,1663,True,True,True,True,Fuel Network Typescript SDK
oh-my-openagent,code-yeongyu,TypeScript,43206,3200,391,112,False,True,True,True,omo; the best agent harness - previously oh-my-opencode
spark,apache,Scala,43037,29133,295,4410,True,True,True,True,Apache Spark - A unified analytics engine for large-scale data processing
kong,Kong,Lua,43034,5101,135,4145,True,True,True,True,🦍 The API and AI Gateway
pm2,Unitech,JavaScript,43009,2697,1096,4691,False,True,True,True,Node.js Production Process Manager with a built-in Load Balancer.
CPlusPlusThings,Light-City,C++,43006,8827,8,2445,False,False,False,True,C++那些事
RSSHub,DIYgod,TypeScript,42966,9482,375,2913,True,True,True,True,🧡 Everything is RSSible
exo,exo-explore,Python,42950,2961,175,638,False,True,True,True,Run frontier AI locally.
what-happens-when,alex,,42912,5728,2070,4521,False,False,False,True,"An attempt to answer the age old interview question ""What happens when you type google.com into your browser and press enter?"""
pandoc,jgm,Haskell,42855,3792,1056,5848,False,True,True,True,Universal markup converter
zig,ziglang,Zig,42836,3076,3428,3884,False,False,False,True,Moved to Codeberg
python-patterns,faif,Python,42803,7044,13,5039,False,False,True,True,A collection of design patterns/idioms in Python
mitmproxy,mitmproxy,Python,42791,4494,420,5881,True,True,True,True,An interactive TLS-capable intercepting HTTP proxy for penetration testers and software developers.
fanqiang,bannedbook,Kotlin,42783,7634,323,4088,False,False,True,True,翻墙-科学上网
Umi-OCR,hiroi-sora,Python,42759,4225,328,1458,False,False,False,True,"OCR software, free and offline. 开源、免费的离线OCR软件。支持截屏/批量导入图片，PDF文档识别，排除水印/页眉页脚，扫描/生成二维码。内置多国语言库。"
Files,files-community,C#,42654,2653,523,2636,True,True,True,True,A modern file manager that helps users organize their files and folders.
Win11Debloat,Raphire,PowerShell,42644,1680,31,1974,False,True,True,True,"A simple, lightweight PowerShell script that allows you to remove pre-installed apps, disable telemetry, as well as perform various other changes to declutter and customize your Windows experience. Win11Debloat works for both Windows 10 and Windows 11."
chatgpt-on-wechat,zhayujie,Python,42488,9856,351,1325,False,False,True,True,CowAgent是基于大模型的超级AI助理，能主动思考和任务规划、访问操作系统和外部资源、创造和执行Skills、拥有长期记忆并不断成长，比OpenClaw更轻量和便捷。同时支持微信、飞书、钉钉、企微、QQ、公众号、网页等接入，可选择OpenAI/Claude/Gemini/DeepSeek/ Qwen/GLM/Kimi/LinkAI，能处理文本、语音、图片和文件，可快速搭建个人AI助理和企业数字员工。
git-flight-rules,k88hudson,,42478,3189,16,4263,False,False,False,True,Flight rules for git
system-design,karanpratapsingh,,42388,5394,4,1317,True,True,False,True,Learn how to design systems at scale and prepare for system design interviews
Alamofire,Alamofire,Swift,42367,7655,44,4254,False,True,True,True,Elegant HTTP Networking in Swift
aider,Aider-AI,Python,42342,4061,1453,1050,False,True,True,True,aider is AI pair programming in your terminal
cherry-studio,CherryHQ,TypeScript,42256,3953,795,670,True,True,True,True,"AI productivity studio with smart chat, autonomous agents, and 300+ assistants. Unified access to frontier LLMs"
full-stack-fastapi-template,fastapi,TypeScript,42254,8253,15,2586,False,True,True,True,"Full stack, modern web application template. Using FastAPI, React, SQLModel, PostgreSQL, Docker, GitHub Actions, automatic HTTPS and more."
zod,colinhacks,TypeScript,42209,1865,294,2208,True,True,True,True,TypeScript-first schema validation with static type inference
fd,sharkdp,Rust,42169,1010,176,3241,False,True,True,True,"A simple, fast and user-friendly alternative to 'find'"
bruno,usebruno,JavaScript,42150,2233,1823,1274,False,True,True,True,Opensource IDE For Exploring and Testing API's (lightweight alternative to Postman/Insomnia)
ailearning,apachecn,Python,42147,11591,3,3314,False,False,False,True,AiLearning：数据分析+机器学习实战+线性代数+PyTorch+NLTK+TF2
gradio,gradio-app,Python,42146,3346,499,2652,True,True,True,True,"Build and share delightful machine learning apps, all in Python. 🌟 Star to support our work!"
BMAD-METHOD,bmad-code-org,JavaScript,42125,5089,136,345,True,True,True,True,Breakthrough Method for Agile Ai Driven Development
diagrams,mingrammer,Python,42122,2725,384,2242,False,True,True,True,:art: Diagram as Code for prototyping cloud system architectures
siyuan,siyuan-note,TypeScript,42088,2617,332,2032,True,True,True,True,"A privacy-first, self-hosted, fully open source personal knowledge management software, written in typescript and golang."
MiroFish,666ghj,Python,41955,5746,186,119,False,False,True,True,"A Simple and Universal Swarm Intelligence Engine, Predicting Anything. 简洁通用的群体智能引擎，预测万物"
DeepSpeed,deepspeedai,Python,41895,4764,1284,2252,True,True,True,True,"DeepSpeed is a deep learning optimization library that makes distributed training and inference easy, efficient, and effective."
ray,ray-project,Python,41842,7380,3512,3437,False,True,True,True,Ray is an AI compute engine. Ray consists of a core distributed runtime and a set of AI Libraries for accelerating ML workloads.
English-level-up-tips,byoungd,,41831,4404,28,3220,False,False,True,True,An advanced guide to learn English which might benefit you a lot 🎉 .  离谱的英语学习指南/英语学习教程/英语学习/学英语
swiper,nolimits4web,JavaScript,41823,9707,247,5123,True,True,True,True,Most modern mobile touch slider with hardware accelerated transitions
hyperswitch,juspay,Rust,41772,4573,1444,1254,True,True,True,True,"An open source payments switch written in Rust to make payments fast, reliable and affordable"
dubbo,apache,Java,41712,26527,945,5026,True,True,True,True,The java implementation of Apache Dubbo. An RPC and microservice framework.
logseq,logseq,Clojure,41705,2517,1008,2132,True,True,True,True,"A privacy-first, open-source platform for knowledge management and collaboration. Download link:  http://github.com/logseq/logseq/releases. roadmap: https://discuss.logseq.com/t/logseq-product-roadmap/34267"
awesome-openclaw-skills,VoltAgent,,41694,3980,3,58,False,True,True,True,"The awesome collection of OpenClaw skills. 5,400+ skills filtered and categorized from the official OpenClaw Skills Registry.🦞"
nw.js,nwjs,JavaScript,41574,3870,959,5193,False,False,False,True,Call all Node.js modules directly from DOM/WebWorker and enable a new way of writing applications with all Web technologies.
yarn,yarnpkg,JavaScript,41527,2733,2066,3717,True,True,True,True,The 1.x line is frozen - features and bugfixes now happen on https://github.com/yarnpkg/berry
ccxt,ccxt,Python,41501,8561,1368,3236,False,True,True,True,A cryptocurrency trading API with more than 100 exchanges in JavaScript / TypeScript / Python / C# / PHP / Go 
uni-app,dcloudio,Objective-C,41451,3715,673,2812,False,True,True,True,A cross-platform framework using Vue.js
RuView,ruvnet,Rust,41449,5677,64,291,False,False,True,True,"π RuView: WiFi DensePose turns commodity WiFi signals into real-time human pose estimation, vital sign monitoring, and presence detection — all without a single pixel of video. "
black,psf,Python,41444,2741,325,2932,True,True,True,True,The uncompromising Python code formatter
pure-bash-bible,dylanaraps,Shell,41442,3638,62,2842,False,True,False,True,📖 A collection of pure bash alternatives to external processes.
