repo_name,organization,language,stars,forks,open_issues,age_days,has_coc,has_contributing,has_workflows,has_readme,description
paperclip,paperclipai,TypeScript,71471,13307,4900,114,False,True,True,True,The open-source app everyone uses to manage agents at work
protobuf,protocolbuffers,C++,71400,16166,270,4320,True,True,True,True,Protocol Buffers - Google's data interchange format
gpt_academic,binary-husky,Python,70933,8357,329,1192,False,False,True,True,"为GPT/GLM等LLM大语言模型提供实用化交互接口，特别优化论文阅读/润色/写作体验，模块化设计，支持自定义快捷按钮&函数插件，支持Python和C++等项目剖析&自译解功能，PDF/LaTex论文翻译&总结功能，支持并行问询多种LLM模型，支持chatglm3等本地模型。接入通义千问, deepseekcoder, 讯飞星火, 文心一言, llama2, rwkv, claude2, moss等。"
act,nektos,Go,70838,1961,341,2730,False,True,True,True,Run your GitHub Actions locally 🚀
open-design,nexu-io,TypeScript,70785,7995,429,58,False,True,True,True,"🎨 Local-first, open-source Claude Design alternative. 🖥️ Native desktop app. ⚡ 259+ Skills · ✨ 142+ Design Systems 🖼️ Web · desktop · mobile prototypes · slides · images · videos · HyperFrames 📦 Sandboxed preview · HTML/PDF/PPTX/MP4 export 🤖 Claude Code / OpenClaw / Codex / Cursor / OpenCode / Qwen / Copilot / Hermes / Kimi & 17+ CLIs."
anime,juliangarnier,JavaScript,70408,4752,110,3755,False,True,True,True,JavaScript animation engine
swift,swiftlang,Swift,70117,10741,9053,3897,True,True,True,True,The Swift Programming Language
ghidra,NationalSecurityAgency,Java,70105,7685,1870,2673,False,True,True,True,Ghidra is a software reverse engineering (SRE) framework
AFFiNE,toeverything,TypeScript,69750,4977,635,1424,True,True,True,True,"There can be more than Notion and Miro. AFFiNE(pronounced [ə‘fain]) is a next-gen knowledge base that brings planning, sorting and creating all together. Privacy first, open-source, customizable and ready to use. "
OpenBB,OpenBB-finance,Python,69646,7041,67,2012,True,False,True,True,"Financial data platform for analysts, quants and AI agents."
crawl4ai,unclecode,Python,69531,7101,115,776,True,True,True,True,"🚀🤖 Crawl4AI: Open-source LLM Friendly Web Crawler & Scraper. Don't be shy, join here: https://discord.gg/jP8KfhDhyN"
awesome-courses,prakhar1989,,69300,8377,63,4239,False,True,False,True,:books: List of awesome university courses for learning Computer Science!
express,expressjs,JavaScript,69243,23834,213,6207,True,True,True,True,"Fast, unopinionated, minimalist web framework for node."
ansible,ansible,Python,69044,24095,801,5223,True,True,True,True,"Ansible is a radically simple IT automation platform that makes your applications and systems easier to deploy and maintain. Automate everything from code deployment to network configuration to cloud management, in a language that approaches plain English, using SSH, with no agents to install on remote systems. https://docs.ansible.com."
MetaGPT,FoundationAgents,Python,69016,8811,138,1090,False,False,True,True,"🌟 The Multi-Agent Framework: First AI Software Company, Towards Natural Language Programming"
MinerU,opendatalab,Python,68947,5825,27,846,False,False,True,True,Transforms complex documents like PDFs and Office docs into LLM-ready markdown/JSON for your Agentic workflows.
node,base,Shell,68510,3250,20,1239,False,True,True,True,Everything required to run your own Base node
learn-claude-code,shareAI-lab,Python,68308,11122,80,360,False,False,True,True,"Bash is all you need -  A nano claude code–like 「agent harness」, built from 0 to 1"
Apollo-11,chrislgarry,Assembly,68132,7699,132,4465,False,True,True,True,Original Apollo 11 Guidance Computer (AGC) source code for the command and lunar modules.
ai-agents-for-beginners,microsoft,Jupyter Notebook,67914,22526,11,573,True,False,True,True,12 Lessons to Get Started Building AI Agents
Understand-Anything,Egonex-AI,TypeScript,67612,5602,250,102,True,True,True,True,"Graphs that teach > graphs that impress. Turn any code into an interactive knowledge graph you can explore, search, and ask questions about. Works with Claude Code, Codex, Cursor, Copilot, Gemini CLI, and more."
Chart.js,chartjs,JavaScript,67528,11935,570,4847,False,False,True,True,Simple HTML5 Charts using the <canvas> tag
unsloth,unslothai,Python,67297,6042,1001,938,True,True,True,True,"Unsloth Studio is a web UI for training and running open models like Gemma 4, Qwen3.6, DeepSeek, gpt-oss locally."
MiroFish,666ghj,Python,67140,10464,326,211,False,False,True,True,"A Simple and Universal Swarm Intelligence Engine, Predicting Anything. 简洁通用的群体智能引擎，预测万物"
annotated_deep_learning_paper_implementations,labmlai,Python,66989,6718,32,2130,False,False,True,True,"🧑‍🏫 60+ Implementations/tutorials of deep learning papers with side-by-side notes 📝; including transformers (original, xl, switch, feedback, vit, ...), optimizers (adam, adabelief, sophia, ...), gans(cyclegan, stylegan2, ...), 🎮 reinforcement learning (ppo, dqn), capsnet, distillation, ... 🧠"
echarts,apache,TypeScript,66650,19802,1611,4831,True,True,True,True,"Apache ECharts is a powerful, interactive charting and data visualization library for browser"
agent-skills,addyosmani,Shell,66523,7170,143,129,False,True,True,True,Production-grade engineering skills for AI coding agents.
33-js-concepts,leonardomso,JavaScript,66480,9163,2,2850,True,True,True,True,📜 33 JavaScript concepts every developer should know.
gpt4free,xtekky,Python,66444,13571,3,1183,True,True,True,True,The official gpt4free repository | various collection of powerful language models | opus 4.6 gpt 5.3 kimi 2.5 deepseek v3.2 gemini 3
scikit-learn,scikit-learn,Python,66439,27105,2099,5790,True,True,True,True,scikit-learn: machine learning in Python
design-resources-for-developers,bradtraversy,,66204,12103,47,2240,False,True,True,True,"Curated list of design and UI resources from stock photos, web templates, CSS frameworks, UI libraries, tools and much more"
awesome-nodejs,sindresorhus,,66063,6226,26,4366,True,True,True,True,":zap: Delightful Node.js packages and resources [BECAUSE OF TOO MUCH SPAM AND LOW-QUALITY SUBMISSIONS, SUBMISSIONS ARE PAUSED UNTIL JULY]"
30-Days-Of-Python,Asabeneh,Python,66062,12345,148,2409,False,False,True,True,The 30 Days of Python programming challenge is a step-by-step guide to learn the Python programming language in 30 days. This challenge may take more than 100 days. Follow your own pace. These videos may help too: https://www.youtube.com/channel/UC7PNRuno1rzYPb1xLa4yktw
Scrapling,D4Vinci,Python,66005,6519,10,619,True,True,True,True,🕷️ An adaptive Web Scraping framework that handles everything from a single request to a full-scale crawl!
Java,TheAlgorithms,Java,65917,21209,14,3630,True,True,True,True,All Algorithms implemented in Java
webpack,webpack,JavaScript,65857,9349,172,5219,True,True,True,True,"A bundler for javascript and friends. Packs many modules into a few bundled assets. Code Splitting allows for loading parts of the application on demand. Through ""loaders"", modules can be CommonJs, AMD, ES6 modules, CSS, Images, JSON, Coffeescript, LESS, ... and your custom stuff."
rtk,rtk-ai,Rust,65850,4073,1344,153,False,True,True,True,"CLI proxy that reduces LLM token consumption by 60-90% on common dev commands. Single Rust binary, zero dependencies"
awesome-claude-skills,ComposioHQ,Python,65816,7314,868,250,False,True,True,True,"A curated list of awesome Claude Skills, resources, and tools for customizing Claude AI workflows"
uBlock,gorhill,JavaScript,65742,4187,17,4102,False,True,True,True,uBlock Origin - An efficient blocker for Chromium and Firefox. Fast and lean.
ripgrep,BurntSushi,Rust,65448,2607,198,3758,False,True,True,True,ripgrep recursively searches directories for a regex pattern while respecting your gitignore
nocode,kelseyhightower,Dockerfile,65429,4825,4714,3060,False,True,False,True,The best way to write secure and reliable applications. Write nothing; deploy nowhere.
pi,earendil-works,TypeScript,65420,7976,47,319,False,True,True,True,"AI agent toolkit: unified LLM API, agent loop, TUI, coding agent CLI"
docusaurus,facebook,TypeScript,65366,9943,374,3291,True,True,True,True,Easy to maintain open source documentation websites.
javascript-questions,lydiahallie,,65319,9213,52,2569,False,False,False,True,"A long list of (advanced) JavaScript questions, and their explanations :sparkles:  "
localstack,localstack,Python,65069,4746,0,3529,True,True,True,True,💻 A fully functional local AWS cloud stack. Develop and test your cloud & Serverless apps offline
interviews,kdn251,Java,65036,12886,120,3417,False,False,False,True,Everything you need to know to get the job.
prometheus,prometheus,Go,64767,10523,846,4960,True,True,True,True,The Prometheus monitoring system and time series database.
alacritty,alacritty,Rust,64670,3494,340,3780,False,True,True,True,"A cross-platform, OpenGL terminal emulator."
get-shit-done,gsd-build,JavaScript,64506,5471,13,192,False,True,True,True,"A light-weight and powerful meta-prompting, context engineering and spec-driven development system for Claude Code by TÂCHES."
ladybird,LadybirdBrowser,C++,64217,3072,505,755,True,True,True,True,Truly independent web browser
openinterpreter,openinterpreter,Rust,64118,5561,271,1076,False,True,True,True,"A lightweight coding agent for open models like Deepseek, Kimi, and Qwen"
keras,keras-team,Python,64102,19738,225,4107,False,True,True,True,Deep Learning for humans
cline,cline,TypeScript,63865,6773,1142,718,True,True,True,True,"Autonomous coding agent as an SDK, IDE extension, or CLI assistant."
traefik,traefik,Go,63726,6047,844,3937,True,True,True,True,The Cloud Native Application Proxy
nocodb,nocodb,TypeScript,63597,4866,682,3160,True,True,True,True,🔥 🔥 🔥 A Free & Self-hostable Airtable Alternative
oh-my-openagent,code-yeongyu,TypeScript,63546,5186,688,204,False,True,True,True,"omo/lazycodex: The coding agent for tokenmaxxers;the one and only agent harness for complex codebases. For your Codex, for your OpenCode"
nerd-fonts,ryanoasis,CSS,63480,3907,78,4220,True,True,True,True,"Iconic font aggregator, collection, & patcher. 3,600+ icons, 50+ patched fonts: Hack, Source Code Pro, more. Glyph collections: Font Awesome, Material Design Icons, Octicons, & more"
rustlings,rust-lang,Rust,63348,11207,39,3936,False,True,True,True,:crab: Small exercises to get you used to reading and writing Rust code!
socket.io,socketio,TypeScript,63205,10149,177,5949,False,True,True,True,Bidirectional and low-latency communication for every platform
tldr,tldr-pages,Markdown,62949,5318,299,4581,False,True,True,True,Collaborative cheatsheets for console commands 📚.
resume.github.com,resume,JavaScript,62866,1369,76,5617,False,False,False,True,Resumes generated using the GitHub informations
vaultwarden,dani-garcia,Rust,62853,2941,59,3049,False,False,True,True,"Unofficial Bitwarden compatible server written in Rust, formerly known as bitwarden_rs"
pathway,pathwaycom,Python,62847,1673,41,1305,True,True,True,True,"Python ETL framework for stream processing, real-time analytics, LLM pipelines, and RAG."
scrapy,scrapy,Python,62523,11695,612,5967,True,True,True,True,"Scrapy, a fast high-level web crawling & scraping framework for Python."
warp,warpdotdev,Rust,62342,5098,4430,1812,True,True,True,True,"Warp is an agentic development environment, born out of the terminal."
docling,docling-project,Python,62116,4348,925,715,True,True,True,True,Get your documents ready for gen AI
anything-llm,Mintplex-Labs,JavaScript,62058,6764,313,1117,False,True,True,True,Stop renting your intelligence. Own it with AnythingLLM. Everything you need for a powerful local-first agent experience 
drawio-desktop,jgraph,JavaScript,61780,5706,72,3317,True,False,True,True,Official electron build of draw.io
leetcode-master,youngyangyang04,Shell,61775,12329,247,2384,False,False,False,True,《代码随想录》LeetCode 刷题攻略：200道经典题目刷题顺序，共60w字的详细图解，视频难点剖析，50余张思维导图，支持C++，Java，Python，Go，JavaScript等多语言版本，从此算法学习不再迷茫！🔥🔥 来看看，你会发现相见恨晚！🚀 
git,git,C,61652,28048,377,6545,True,True,True,True,Git Source Code Mirror - This is a publish-only repository but pull requests can be turned into patches to the mailing list via GitGitGadget (https://gitgitgadget.github.io/). Please follow Documentation/SubmittingPatches procedure for any of your improvements.
sway,FuelLabs,Rust,61594,5421,921,1982,False,False,True,True,🌴 Empowering everyone to build reliable and efficient smart contracts.
hello-agents,datawhalechina,Python,61592,7599,147,290,False,False,True,True,📚 《从零开始构建智能体》——从零开始的智能体原理与实践教程
openpilot,commaai,Python,61535,11022,132,3500,False,True,True,True,"openpilot is an operating system for robotics. Currently, it upgrades the driver assistance system on 300+ supported cars."
redux,reduxjs,TypeScript,61509,15057,49,4044,True,True,True,True,A JS library for predictable global state management
FFmpeg,FFmpeg,C,61427,13929,3,5550,False,True,False,True,Mirror of https://git.ffmpeg.org/ffmpeg.git
Magisk,topjohnwu,Kotlin,61327,17777,63,3576,False,False,True,True,The Magic Mask for Android
ruflo,ruvnet,TypeScript,61312,7126,676,387,False,False,True,True,"🌊 The leading agent meta-harness for Claude. Deploy intelligent multi-agent swarms, coordinate autonomous workflows, and build conversational AI systems. Features adaptive memory, self-learning swarm intelligence, RAG integration, and native Claude Code / Codex Integration"
lodash,lodash,JavaScript,61237,7169,98,5192,False,True,True,True,"A modern JavaScript utility library delivering modularity, performance, & extras."
minio,minio,Go,61200,7617,81,4179,True,True,True,True,"MinIO is a high-performance, S3 compatible object store, open sourced under GNU AGPLv3 license."
memos,usememos,Go,61044,4490,22,1659,False,False,True,True,"Open-source, self-hosted note-taking tool built for quick capture. Markdown-native, lightweight, and fully yours."
Front-end-Developer-Interview-Questions,h5bp,Nunjucks,60880,11030,62,5249,True,True,True,True,"A list of helpful front-end related questions you can use to interview potential candidates, test yourself or completely ignore."
architect-awesome,xingshaocheng,,60828,17683,63,3001,False,False,False,True,后端架构师技术图谱
atom,atom,JavaScript,60810,17201,994,5269,True,True,False,True,:atom: The hackable text editor
awesome-chatgpt-prompts-zh,PlexPt,,60769,13565,46,1291,False,False,False,True,ChatGPT 中文调教指南。各种场景使用指南。学习怎么让它听你的话。
nuxt,nuxt,TypeScript,60528,5672,803,3528,True,True,True,True,the full-stack Vue framework
ai-hedge-fund,virattt,Python,60524,10696,146,572,False,False,True,True,An AI Hedge Fund Team
astro,withastro,TypeScript,60469,3568,153,1927,True,True,True,True,The web framework for content-driven websites. ⭐️ Star to support our work!
awesome-flutter,Solido,Dart,60403,6897,38,3335,False,True,True,True,"An awesome list that curates the best Flutter libraries, tools, tutorials, articles and more."
markdown-here,adam-p,JavaScript,60220,11048,318,5156,False,True,False,True,"Google Chrome, Firefox, and Thunderbird extension that lets you write email in Markdown and render it before sending."
nanoGPT,karpathy,Python,60107,10352,349,1275,False,False,False,True,"The simplest, fastest repository for training/finetuning medium-sized GPTs."
spring-framework,spring-projects,Java,60065,38827,453,5678,True,True,True,True,Spring Framework
claude-code-best-practice,shanraisshan,HTML,60059,6031,13,236,False,False,True,True,from vibe coding to agentic engineering - practice makes claude perfect
Real-Time-Voice-Cloning,CorentinJ,Python,59942,9404,172,2586,False,False,True,True,Clone a voice in 5 seconds to generate arbitrary speech in real-time
TrendRadar,sansan0,Python,59886,24723,46,422,False,False,True,True,"⭐AI-driven public opinion & trend monitor with multi-platform aggregation, RSS, and smart alerts.🎯 告别信息过载，你的 AI 舆情监控助手与热点筛选工具！聚合多平台热点 +  RSS 订阅，支持关键词精准筛选。AI 智能筛选新闻 + AI 翻译 +  AI 分析简报直推手机，也支持接入 MCP 架构，赋能 AI 自然语言对话分析、情感洞察与趋势预测等。支持 Docker ，数据本地/云端自持。集成微信/飞书/钉钉/Telegram/邮件/ntfy/bark/slack 等渠道智能推送。"
jquery,jquery,JavaScript,59816,20407,91,6291,True,True,True,True,jQuery JavaScript Library
worldmonitor,koala73,TypeScript,59640,9326,171,167,True,True,True,True,"Real-time global intelligence dashboard. AI-powered news aggregation, geopolitical monitoring, and infrastructure tracking in a unified situational awareness interface"
OpenCut,OpenCut-app,TypeScript,59595,6476,329,367,True,False,True,True,The open-source CapCut alternative
shadowsocks-windows,shadowsocks,C#,59570,16246,199,4909,False,True,False,True,A C# port of shadowsocks
llama,meta-llama,Python,59468,9792,521,1226,True,True,True,True,Inference code for Llama models
pi-hole,pi-hole,Shell,59447,3230,43,4399,True,True,True,True,A black hole for Internet advertisements
bat,sharkdp,Rust,59416,1572,387,2986,False,True,True,True,A cat(1) clone with wings.
mem0,mem0ai,Python,59396,6862,388,1100,False,True,True,True,Universal memory layer for AI Agents
pocketbase,pocketbase,Go,59260,3476,16,1451,False,True,True,True,Open Source realtime backend in 1 file
llm-app,pathwaycom,Jupyter Notebook,59250,1430,10,1071,True,True,True,True,"Ready-to-run cloud templates for RAG, AI pipelines, and enterprise search with live data. 🐳Docker-friendly.⚡Always in sync with Sharepoint, Google Drive, S3, Kafka, PostgreSQL, real-time data APIs, and more."
autogen,microsoft,Python,59225,8933,920,1041,True,True,True,True,A programming framework for agentic AI
mkcert,FiloSottile,Go,59166,3128,172,2922,True,True,True,True,A simple zero-config tool to make locally trusted development certificates with any names you'd like.
GPT-SoVITS,RVC-Boss,Python,59029,6441,869,892,False,False,True,True,1 min voice data can also be used to train a good TTS model! (few shot voice cloning)
ultralytics,ultralytics,Python,58786,11251,307,1382,True,True,True,True,Ultralytics YOLO 🚀
rails,rails,Ruby,58728,22167,1514,6649,True,True,True,True,Ruby on Rails
v2rayNG,2dust,Kotlin,58630,7653,16,2598,False,False,True,True,"A V2Ray client for Android, support Xray core and v2fly core"
angular.js,angular,JavaScript,58594,27083,461,6014,True,True,False,True,AngularJS - HTML enhanced for web apps!
starship,starship,Rust,58476,2562,1017,2641,True,True,True,True,"☄🌌️  The minimal, blazing-fast, and infinitely customizable prompt for any shell!"
zustand,pmndrs,TypeScript,58386,2078,5,2633,False,True,True,True,🐻 Bear necessities for state management in React
meilisearch,meilisearch,Rust,58286,2588,299,2984,True,True,True,True,A lightning-fast search engine API bringing AI-powered hybrid search to your sites and applications.
awesome-rust,rust-unofficial,Rust,58013,3440,8,4360,False,True,True,True,A curated list of Rust code and resources.
context7,upstash,TypeScript,58013,2730,19,455,False,False,True,True,Context7 Platform -- Up-to-date code documentation for LLMs and AI code editors
rclone,rclone,Go,57994,5178,1184,4483,True,True,True,True,"""rsync for cloud storage"" - Google Drive, S3, Dropbox, Backblaze B2, One Drive, Swift, Hubic, Wasabi, Google Cloud Storage, Azure Blob, Azure Files, Yandex Files"
marktext,marktext,TypeScript,57823,4314,899,3146,False,True,True,True,"📝A simple and elegant markdown editor, available for Linux, macOS and Windows."
github-cheat-sheet,tiimgreen,,57563,5423,48,4456,False,True,False,True,A list of cool features of Git and GitHub.
yolov5,ultralytics,Python,57557,17468,42,2229,True,True,True,True,Ultralytics YOLOv5 in PyTorch > ONNX > CoreML > TFLite
html5-boilerplate,h5bp,JavaScript,57516,12286,17,5995,True,True,True,True,"A professional front-end template for building fast, robust, and adaptable web apps or sites."
DeepLearning-500-questions,scutan90,JavaScript,57454,15908,120,2920,False,False,False,True,深度学习500问，以问答形式对常用的概率知识、线性代数、机器学习、深度学习、计算机视觉等热点问题进行阐述，以帮助自己及有需要的读者。 全书分为18个章节，50余万字。由于水平有限，书中不妥之处恳请广大读者批评指正。   未完待续............ 如有意合作，联系scutjy2015@163.com                     版权所有，违权必究       Tan 2018.06
Pake,tw93,Rust,57402,11434,4,1349,True,True,True,True,🤱🏻 Turn any webpage into a desktop app with one command.
coolify,coollabsio,PHP,57394,4837,797,1976,True,True,True,True,"An open-source, self-hostable PaaS alternative to Vercel, Heroku & Netlify that lets you easily deploy static sites, databases, full-stack applications and 280+ one-click services on your own servers."
private-gpt,zylon-ai,Python,57291,7606,6,1149,False,False,True,True,"Interact with your documents using the power of GPT, 100% privately, no data leaks"
Mole,tw93,Shell,57074,2008,15,275,False,True,True,True,"🐹 Clean, uninstall, analyze, optimize, and monitor your Mac from the terminal."
ghostty,ghostty-org,Zig,57040,2954,249,1548,False,True,True,True,"👻 Ghostty is a fast, feature-rich, and cross-platform terminal emulator that uses platform-native UI and GPU acceleration."
fuel-core,FuelLabs,Rust,56998,2861,195,2127,False,True,True,True,Rust full node implementation of the Fuel v2 protocol.
termux-app,termux,Java,56851,6837,551,3897,False,False,True,True,Termux - a terminal emulator application for Android OS extendible by variety of packages.
you-get,soimort,Python,56845,9728,384,5056,False,True,True,True,:arrow_double_down: Dumb downloader that scrapes the web
rich,Textualize,Python,56692,2199,354,2418,True,True,True,True,Rich is a Python library for rich text and beautiful formatting in the terminal.
OpenManus,FoundationAgents,Python,56638,9851,520,475,True,False,True,True,"No fortress, purely open ground.  OpenManus is Coming."
awesome-android-ui,wasabeef,,56578,10248,39,4201,True,False,False,True,A curated list of awesome Android UI/UX libraries
face_recognition,ageitgey,Python,56527,13693,837,3400,False,True,True,True,The world's simplest facial recognition api for Python and the command line
gitea,go-gitea,Go,56491,6823,2748,3523,True,True,True,True,"Git with a cup of tea! Painless self-hosted all-in-one software development service, including Git hosting, code review, team collaboration, package registry and CI/CD"
OpenSpec,Fission-AI,TypeScript,56470,3943,424,323,False,False,True,True,Spec-driven development (SDD) for AI coding assistants.
react-router,remix-run,TypeScript,56466,10875,132,4422,True,True,True,True,Declarative routing for React
appwrite,appwrite,TypeScript,56404,5481,996,2634,True,True,True,True,"Appwrite® - complete cloud infrastructure for your web, mobile and AI apps. Including Auth, Databases, Storage, Functions, Messaging, Hosting, Realtime and more"
winutil,ChrisTitusTech,PowerShell,56330,3205,34,1519,True,True,True,True,"Chris Titus Tech's Windows Utility - Install Programs, Tweaks, Fixes, and Updates"
mempalace,MemPalace,Python,56325,7287,565,81,False,True,True,True,The best-benchmarked open-source AI memory system. And it's free.
project-layout,golang-standards,Makefile,56179,5435,95,3210,False,False,True,True,Standard Go Project Layout
ponytail,DietrichGebert,JavaScript,55965,2832,71,13,False,False,True,True,Makes your AI agent think like the laziest senior dev in the room. The best code is the code you never wrote.
gatsby,gatsbyjs,JavaScript,55940,10163,399,4052,True,True,True,True,"React-based framework with performance, scalability, and security built in."
leetcode,azl397985856,JavaScript,55761,9406,10,3008,False,True,False,True,LeetCode Solutions: A Record of My Problem Solving Journey.( leetcode题解，记录自己的leetcode解题之路。)
career-ops,santifer,JavaScript,55590,10982,149,81,True,True,True,True,"AI-powered job search system built on Claude Code. 14 skill modes, Go dashboard, PDF generation, batch processing."
nanochat,karpathy,Python,55410,7622,110,254,False,False,True,True,The best ChatGPT that $100 can buy.
n8n-workflows,Zie619,Python,55375,7341,31,406,False,False,True,True,all of the workflows of n8n i could find (also from the site itself)
joplin,laurent22,TypeScript,55346,6162,570,3446,False,True,True,True,"Joplin - the privacy-focused note taking app with sync capabilities for Windows, macOS, Linux, Android and iOS."
faceswap,deepfakes,Python,55314,13363,9,3109,True,False,True,True,Deepfakes Software For All
gpt-engineer,AntonOsika,Python,55205,7303,71,1152,True,True,True,True,CLI platform to experiment with codegen. Precursor to: https://lovable.dev
English-level-up-tips,byoungd,,54710,5597,32,3312,False,False,True,True,An advanced guide to learn English which might benefit you a lot 🎉 . 人生进阶指南 离谱的人生 离谱的英语学习指南/英语学习教程/英语学习/学英语
first-contributions,firstcontributions,,54655,104898,82,3564,True,True,True,True,🚀✨ Help beginners to contribute to open source projects
powerlevel10k,romkatv,Shell,54563,2423,147,2677,False,False,False,True,A Zsh theme
typst,typst,Rust,54545,1624,1287,2465,False,True,True,True,A markup-based typesetting system that is powerful and easy to learn.
