repo_name,organization,language,stars,forks,open_issues,age_days,has_coc,has_contributing,has_workflows,has_readme,description
TrendRadar,sansan0,Python,49100,22666,45,322,False,False,True,True,"⭐AI-driven public opinion & trend monitor with multi-platform aggregation, RSS, and smart alerts.🎯 告别信息过载，你的 AI 舆情监控助手与热点筛选工具！聚合多平台热点 +  RSS 订阅，支持关键词精准筛选。AI 智能筛选新闻 + AI 翻译 +  AI 分析简报直推手机，也支持接入 MCP 架构，赋能 AI 自然语言对话分析、情感洞察与趋势预测等。支持 Docker ，数据本地/云端自持。集成微信/飞书/钉钉/Telegram/邮件/ntfy/bark/slack 等渠道智能推送。"
nanochat,karpathy,Python,49068,6430,80,154,False,False,True,True,The best ChatGPT that $100 can buy.
huginn,huginn,Ruby,48883,4231,693,4754,False,False,True,True,Create agents that monitor and act on your behalf.  Your agents are standing by!
query,TanStack,TypeScript,48841,3731,178,2379,False,True,True,True,"🤖 Powerful asynchronous state management, server-state utilities and data fetching for the web. TS/JS, React Query, Solid Query, Svelte Query and Vue Query."
dayjs,iamkun,JavaScript,48597,2424,1197,2897,False,True,True,True,⏰ Day.js 2kB immutable date-time library alternative to Moment.js with the same modern API
julia,JuliaLang,Julia,48579,5747,4727,5443,True,True,True,True,The Julia Programming Language
RxJava,ReactiveX,Java,48486,7604,21,4815,False,True,True,True,RxJava – Reactive Extensions for the JVM – a library for composing asynchronous and event-based programs using observable sequences for the Java VM.
algorithm-visualizer,algorithm-visualizer,JavaScript,48385,7576,78,3593,True,True,False,True,:fireworks:Interactive Online Platform that Visualizes Algorithms from Code
pandas,pandas-dev,Python,48158,19749,3672,5684,True,True,True,True,"Flexible and powerful data analysis / manipulation library for Python, providing labeled data structures similar to R data.frame objects, statistical functions, and much more"
moment,moment,JavaScript,48045,7023,295,5495,False,True,True,True,"Parse, validate, manipulate, and display dates in javascript."
expo,expo,TypeScript,48003,11395,853,3500,False,True,True,True,"An open-source framework for making universal native apps with React. Expo runs on Android, iOS, and the web."
terraform,hashicorp,Go,47958,10249,1897,4386,True,True,True,True,"Terraform enables you to safely and predictably create, change, and improve infrastructure. It is a source-available tool that codifies APIs into declarative configuration files that can be shared amongst team members, treated as code, edited, reviewed, and versioned."
x64dbg,x64dbg,C++,47899,2683,584,3992,True,True,True,True,An open-source user mode debugger for Windows. Optimized for reverse engineering and malware analysis.
Fooocus,lllyasviel,Python,47880,7816,284,950,False,False,True,True,Focus on prompting and generating
open-source-mac-os-apps,serhii-londar,,47853,2488,37,3056,False,True,True,True,🚀 Awesome list of open source applications for macOS. https://t.me/s/opensourcemacosapps
type-challenges,type-challenges,TypeScript,47827,5225,33108,2062,True,False,True,True,Collection of TypeScript type challenges with online judge
kubernetes-the-hard-way,kelseyhightower,,47740,15567,47,3539,False,True,False,True,Bootstrap Kubernetes the hard way. No scripts.
freqtrade,freqtrade,Python,47724,9962,45,3225,False,True,True,True,"Free, open source crypto trading bot"
llama_index,run-llama,Python,47720,7030,260,1230,True,True,True,True,LlamaIndex is the leading document agent and OCR platform
jadx,skylot,Java,47650,5448,416,4746,True,True,True,True,Dex to Java decompiler
htmx,bigskysoftware,JavaScript,47635,1577,657,2163,False,True,True,True,</> htmx - high power tools for HTML
design-patterns-for-humans,kamranahmedse,,47633,5504,17,3315,False,False,False,True,An ultra-simplified explanation to design patterns
big-list-of-naughty-strings,minimaxir,Python,47609,2162,108,3873,False,False,False,True,The Big List of Naughty Strings is a list of strings which have a high probability of causing issues when used as user-input data.
whisper.cpp,ggml-org,C++,47601,5300,1153,1268,False,False,True,True,Port of OpenAI's Whisper model in C/C++
gogs,gogs,Go,47584,5070,963,4416,False,True,True,True,Gogs is a painless self-hosted Git service
Projects,karan,,47496,10670,117,4638,False,True,False,True,:page_with_curl: A list of practical projects that anyone can solve in any programming language.
awesome-java,akullpp,,47327,7647,17,4268,False,True,True,True,"A curated list of awesome frameworks, libraries and software for the Java programming language."
ghostty,ghostty-org,Zig,47199,1980,192,1448,False,True,True,True,"👻 Ghostty is a fast, feature-rich, and cross-platform terminal emulator that uses platform-native UI and GPU acceleration."
chinese-independent-developer,1c7,,47098,3987,1,3098,False,False,True,True,👩🏿‍💻👨🏾‍💻👩🏼‍💻👨🏽‍💻👩🏻‍💻中国独立开发者项目列表 -- 分享大家都在做什么
PythonDataScienceHandbook,jakevdp,Jupyter Notebook,47071,18788,230,3505,True,True,False,True,Python Data Science Handbook: full text in Jupyter Notebooks
awesome-react-components,brillout,,47055,3741,34,3552,True,True,True,True,Curated List of React Components & Libraries.
brew,Homebrew,Ruby,47054,11011,20,3662,True,True,True,True,🍺 The missing package manager for macOS (or Linux)
react,typescript-cheatsheets,JavaScript,47005,4301,1,2844,True,True,True,True,Cheatsheets for experienced React developers getting started with TypeScript
quill,slab,TypeScript,46963,3629,628,4977,True,True,True,True,Quill is a modern WYSIWYG editor built for compatibility and extensibility
v2ray-core,v2ray,Go,46956,8879,8,3846,True,False,True,True,A platform for building proxies to bypass network restrictions.
serverless,serverless,JavaScript,46949,5739,1220,3983,True,True,True,True,"⚡ Serverless Framework – Effortlessly build apps that auto-scale, incur zero costs when idle, and require minimal maintenance using AWS Lambda and other managed cloud services."
okhttp,square,Kotlin,46928,9280,92,4984,False,True,True,True,"Square’s meticulous HTTP client for the JVM, Android, and GraalVM."
Made-With-ML,GokuMohandas,Jupyter Notebook,46809,7346,24,2689,False,False,True,True,"Learn how to develop, deploy and iterate on production-grade ML applications."
pixijs,pixijs,TypeScript,46755,4984,309,4802,True,True,True,True,"The HTML5 Creation Engine: Create beautiful digital content with the fastest, most flexible 2D WebGL renderer."
Pake,tw93,Rust,46687,9133,0,1249,True,True,True,True,🤱🏻 Turn any webpage into a desktop app with one command.
OpenCut,OpenCut-app,TypeScript,46676,4835,273,267,True,True,True,True,The open-source CapCut alternative
plane,makeplane,TypeScript,46650,3731,692,1213,True,True,True,True,"🔥🔥🔥 Open-source Jira, Linear, Monday, and ClickUp alternative. Plane is a modern project management platform to manage tasks, sprints, docs, and triage."
discourse,discourse,Ruby,46570,8846,149,4812,True,True,True,True,"A platform for community discussion. Free, open, simple."
awesome-design-patterns,DovAmir,,46439,3219,22,2842,False,True,False,True,A curated list of software and architecture related design patterns.
metabase,metabase,Clojure,46421,6308,3985,4060,False,True,True,True,The easy-to-use open source Business Intelligence and Embedded Analytics tool that lets everyone work with data :bar_chart:
ClickHouse,ClickHouse,C++,46362,8187,5471,3574,True,True,True,True,ClickHouse® is a real-time analytics database management system
ruff,astral-sh,Rust,46308,1854,1936,1315,True,True,True,True,"An extremely fast Python linter and code formatter, written in Rust."
text-generation-webui,oobabooga,Python,46272,5899,840,1181,False,False,True,True,"The original local LLM interface. Text, vision, tool-calling, training, and more. 100% offline."
crewAI,crewAIInc,Python,46266,6241,485,872,False,False,True,True,"Framework for orchestrating role-playing, autonomous AI agents. By fostering collaborative intelligence, CrewAI empowers agents to work together seamlessly, tackling complex tasks."
frontend-dev-bookmarks,dypsilon,,46206,5152,124,4650,False,True,False,True,Manually curated collection of resources for frontend web developers.
30-Days-Of-JavaScript,Asabeneh,JavaScript,46178,10435,367,2275,False,False,False,True,"30 days of JavaScript programming challenge is a step-by-step guide to learn JavaScript programming language in 30 days. This challenge may take more than 100 days,  please just follow your own pace. These videos may help too: https://www.youtube.com/channel/UC7PNRuno1rzYPb1xLa4yktw"
learn-regex,ziishaned,,46158,6213,65,3159,False,False,False,True,Learn regex the easy way
AI-For-Beginners,microsoft,Jupyter Notebook,46102,9421,3,1839,True,False,True,True,"12 Weeks, 24 Lessons, AI for All!"
acme.sh,acmesh-official,Shell,45998,5543,1374,3733,False,False,True,True,A pure Unix shell script ACME client for SSL / TLS certificate automation
MediaCrawler,NanmiCoder,Python,45994,9940,135,1011,False,False,True,True,小红书笔记 | 评论爬虫、抖音视频 | 评论爬虫、快手视频 | 评论爬虫、B 站视频 ｜ 评论爬虫、微博帖子 ｜ 评论爬虫、百度贴吧帖子 ｜ 百度贴吧评论回复爬虫  | 知乎问答文章｜评论爬虫
tldraw,tldraw,TypeScript,45869,3073,332,1772,True,True,True,True,very good whiteboard infinite canvas SDK
monaco-editor,microsoft,JavaScript,45764,4013,827,3569,True,True,True,True,A browser based code editor
GitHubDaily,GitHubDaily,,45652,4583,545,2633,False,False,False,True,"坚持分享 GitHub 上高质量、有趣实用的开源技术教程、开发者工具、编程网站、技术资讯。A list cool, interesting projects of GitHub."
architecture-samples,android,Kotlin,45609,11874,217,3692,False,True,True,True,A collection of samples to discuss and showcase different architectural tools and patterns for Android apps.
prisma,prisma,TypeScript,45540,2108,2513,2461,True,True,True,True,"Next-generation ORM for Node.js & TypeScript | PostgreSQL, MySQL, MariaDB, SQL Server, SQLite, MongoDB and CockroachDB"
awesome-cheatsheets,LeCoupa,JavaScript,45490,6673,133,3050,False,False,False,True,"👩‍💻👨‍💻 Awesome cheatsheets for popular programming languages, frameworks and development tools. They include everything you should know in one single file."
nvm-windows,coreybutler,Go,45484,3769,91,4195,False,True,True,True,A node.js version management utility for Windows. Ironically written in Go.
JeecgBoot,jeecgboot,Java,45417,15842,55,2667,False,False,True,True,"JeecgBoot 是一款 AI 驱动的低代码开发平台，提供""零代码""与""代码生成""双模式——零代码模式一句话搭建系统，代码生成模式自动输出前后端代码与建表 SQL，生成即可运行。平台内置 AI 聊天助手、AI大模型、知识库、AI流程编排、MCP 与插件体系，兼容主流大模型，支持一句话生成流程图、设计表单、聊天式业务操作，解决 Java 项目 80% 重复工作，高效且不失灵活。"
jest,jestjs,TypeScript,45326,6639,243,4480,True,True,True,True,Delightful JavaScript Testing.
AdminLTE,ColorlibHQ,CSS,45315,18268,4,4465,True,True,True,True,AdminLTE - Free admin dashboard template based on Bootstrap 5
zx,google,JavaScript,45290,1223,31,1776,True,True,True,True,A tool for writing better scripts
bevy,bevyengine,Rust,45114,4451,3296,2249,True,True,True,True,A refreshingly simple data-driven game engine built in Rust
spotube,KRTirtho,Dart,45008,2013,757,1857,True,False,True,True,🎧 Open source music streaming app! Available for both desktop & mobile!
Rocket.Chat,RocketChat,TypeScript,44925,13399,3572,3954,True,True,True,True,The Secure CommsOS™ for mission-critical operations
slidev,slidevjs,TypeScript,44891,1965,187,1788,True,True,True,True,Presentation Slides for Developers
penpot,penpot,Clojure,44865,2597,582,3730,True,True,True,True,Penpot: The open-source design tool for design and code collaboration
legado,gedoor,Kotlin,44846,4953,65,2490,False,False,True,True,"Legado 3.0 Book Reader with powerful controls & full functions❤️阅读3.0, 阅读是一款可以自定义来源阅读网络内容的工具，为广大网络文学爱好者提供一种方便、快捷舒适的试读体验。"
CppCoreGuidelines,isocpp,CSS,44844,5545,250,3862,False,True,True,True,"The C++ Core Guidelines are a set of tried-and-true guidelines, rules, and best practices about coding in C++"
TTS,coqui-ai,Python,44827,6001,8,2126,True,True,True,True,"🐸💬 - a deep learning toolkit for Text-to-Speech, battle-tested in research and production"
awesome-claude-skills,ComposioHQ,Python,44814,4538,323,150,False,True,True,True,"A curated list of awesome Claude Skills, resources, and tools for customizing Claude AI workflows"
meteor,meteor,JavaScript,44778,5266,373,5171,True,True,True,True,"Meteor, the JavaScript App Platform"
hyper,vercel,TypeScript,44717,3548,1026,3545,False,False,True,True,A terminal built on web technologies
airflow,apache,Python,44670,16711,1777,3990,True,True,True,True,"Apache Airflow - A platform to programmatically author, schedule, and monitor workflows"
Leaflet,Leaflet,JavaScript,44658,6095,558,5654,True,True,True,True,🍃 JavaScript library for mobile-friendly interactive maps 🇺🇦
react-hook-form,react-hook-form,TypeScript,44602,2375,123,2568,True,True,True,True,📋 React Hooks for form state management and validation (Web + React Native)
grpc,grpc,C++,44499,11085,1188,4116,True,True,True,True,"C++ based gRPC (C++, Python, Ruby, Objective-C, PHP, C#)"
edex-ui,GitSquared,JavaScript,44449,3050,6,3334,False,False,True,True,"A cross-platform, customizable science fiction terminal emulator with advanced monitoring & touchscreen support."
pyenv,pyenv,Shell,44437,3244,55,4945,False,True,True,True,Simple Python version management
awesome-compose,docker,HTML,44408,8082,349,2223,False,True,True,True,Awesome Docker Compose samples
reactjs-interview-questions,sudheerj,JavaScript,44372,10299,10,2846,False,False,True,True,List of top 500 ReactJS Interview Questions & Answers....Coding exercise questions are coming soon!!
build-web-application-with-golang,astaxie,Go,44151,10536,137,4974,False,False,False,True,A golang ebook intro how to build a web with golang
EasySpider,NaiboWang,JavaScript,44097,5386,264,2068,False,False,True,True,A visual no-code/code-free web crawler/spider易采集：一个可视化浏览器自动化测试/数据采集/爬虫软件，可以无代码图形化的设计和执行爬虫任务。别名：ServiceWrapper面向Web应用的智能化服务封装系统。
awesome-remote-job,lukasz-madon,,44097,4496,41,4092,False,True,True,True,A curated list of awesome remote jobs and resources. Inspired by https://github.com/vinta/awesome-python
iina,iina,Swift,44090,2775,1965,3374,False,True,True,True,The modern video player for macOS.
parcel,parcel-bundler,JavaScript,44050,2279,592,3143,True,True,True,True,The zero configuration build tool for the web. 📦🚀
upscayl,upscayl,TypeScript,43994,2124,64,1325,False,False,True,True,"🆙 Upscayl - #1 Free and Open Source AI Image Upscaler for Linux, MacOS and Windows."
react-use,streamich,TypeScript,43956,3279,653,2697,False,True,True,True,React Hooks — 👍
streamlit,streamlit,Python,43914,4141,1309,2397,True,True,True,True,Streamlit — A faster way to build and share data apps.
retrofit,square,HTML,43911,7360,168,5670,False,True,True,True,A type-safe HTTP client for Android and the JVM
front-end-interview-handbook,yangshun,MDX,43909,5953,14,2984,True,True,True,True,Front End interview preparation materials for busy engineers (updated for 2026)
babel,babel,TypeScript,43905,5812,752,4187,True,True,True,True,🐠 Babel is a compiler for writing next generation JavaScript.
Summer2026-Internships,SimplifyJobs,Python,43800,3174,5,2123,False,True,True,True,Collection of Summer 2026 tech internships!
TensorFlow-Examples,aymericdamien,Jupyter Notebook,43794,14793,227,3778,False,False,False,True,TensorFlow Tutorial and Examples for Beginners (support TF v1 & v2)
LocalAI,mudler,Go,43741,3711,151,1094,False,True,True,True,":robot: The free, Open Source alternative to OpenAI, Claude and others. Self-hosted and local-first. Drop-in replacement,  running on consumer-grade hardware. No GPU required. Runs gguf, transformers, diffusers and many more. Features: Generate Text, MCP, Audio, Video, Images, Voice Cloning, Distributed, P2P and decentralized inference"
copyparty,9001,Python,43525,1773,245,2486,True,True,False,True,"Portable file server with accelerated resumable uploads, dedup, WebDAV, SFTP, FTP, TFTP, zeroconf, media indexer, thumbnails++ all in one file"
helix,helix-editor,Rust,43512,3365,1445,2114,False,True,True,True,A post-modern modal text editor.
TrafficMonitor,zhongyang219,C++,43481,3616,1266,3152,False,False,True,True,这是一个用于显示当前网速、CPU及内存利用率的桌面悬浮窗软件，并支持任务栏显示，支持更换皮肤。
jsoncrack.com,AykutSarac,TypeScript,43479,3491,42,1506,True,True,True,True,"✨ Innovative and open-source visualization application that transforms various data formats, such as JSON, YAML, XML and CSV into interactive graphs."
cobra,spf13,Go,43479,3080,358,4577,False,True,True,True,A Commander for modern Go CLI interactions
sentry,getsentry,Python,43377,4632,2255,5677,True,True,True,True,Developer-first error tracking and performance monitoring
fuels-rs,FuelLabs,Rust,43367,1362,68,1597,False,False,True,True,Fuel Network Rust SDK
milvus,milvus-io,Go,43366,3904,1062,2373,True,True,True,True,"Milvus is a high-performance, cloud-native vector database built for scalable vector ANN search"
fuels-ts,FuelLabs,TypeScript,43322,1369,79,1655,True,True,True,True,Fuel Network Typescript SDK
cli,cli,Go,43187,8099,935,2356,True,True,True,True,GitHub’s official command line tool
tmux,tmux,C,43131,2490,48,3939,False,True,True,True,tmux source code
pm2,Unitech,JavaScript,42994,2693,1094,4683,False,True,True,True,Node.js Production Process Manager with a built-in Load Balancer.
spark,apache,Scala,42992,29127,300,4402,True,True,True,True,Apache Spark - A unified analytics engine for large-scale data processing
CPlusPlusThings,Light-City,C++,42983,8830,8,2437,False,False,False,True,C++那些事
kong,Kong,Lua,42971,5097,136,4137,True,True,True,True,🦍 The API and AI Gateway
ui-ux-pro-max-skill,nextlevelbuilder,Python,42966,4153,73,106,False,False,True,True,An AI SKILL that provide design intelligence for building professional UI/UX multiple platforms
zig,ziglang,Zig,42856,3080,3437,3876,False,False,False,True,Moved to Codeberg
what-happens-when,alex,,42847,5723,2071,4512,False,False,False,True,"An attempt to answer the age old interview question ""What happens when you type google.com into your browser and press enter?"""
python-patterns,faif,Python,42798,7048,13,5031,False,False,True,True,A collection of design patterns/idioms in Python
RSSHub,DIYgod,TypeScript,42723,9415,369,2905,True,True,True,True,🧡 Everything is RSSible
mitmproxy,mitmproxy,Python,42683,4490,423,5872,True,True,True,True,An interactive TLS-capable intercepting HTTP proxy for penetration testers and software developers.
exo,exo-explore,Python,42670,2931,162,630,False,True,True,True,Run frontier AI locally.
pandoc,jgm,Haskell,42644,3788,1055,5840,False,True,True,True,Universal markup converter
Umi-OCR,hiroi-sora,Python,42608,4207,328,1450,False,False,False,True,"OCR software, free and offline. 开源、免费的离线OCR软件。支持截屏/批量导入图片，PDF文档识别，排除水印/页眉页脚，扫描/生成二维码。内置多国语言库。"
fanqiang,bannedbook,Kotlin,42594,7586,329,4080,False,False,True,True,翻墙-科学上网
git-flight-rules,k88hudson,,42482,3190,16,4255,False,False,False,True,Flight rules for git
Files,files-community,C#,42429,2635,512,2628,True,True,True,True,A modern file manager that helps users organize their files and folders.
Alamofire,Alamofire,Swift,42363,7658,41,4246,False,True,True,True,Elegant HTTP Networking in Swift
chatgpt-on-wechat,zhayujie,Python,42243,9829,359,1317,False,False,True,True,CowAgent是基于大模型的超级AI助理，能主动思考和任务规划、访问操作系统和外部资源、创造和执行Skills、拥有长期记忆并不断成长。同时支持飞书、钉钉、企业微信、微信公众号、网页等接入，可选择OpenAI/Claude/Gemini/DeepSeek/ Qwen/GLM/Kimi/LinkAI，能处理文本、语音、图片和文件，可快速搭建个人AI助手和企业数字员工。
system-design,karanpratapsingh,,42153,5354,3,1309,True,True,False,True,Learn how to design systems at scale and prepare for system design interviews
zod,colinhacks,TypeScript,42141,1853,285,2200,True,True,True,True,TypeScript-first schema validation with static type inference
ailearning,apachecn,Python,42128,11598,3,3306,False,False,False,True,AiLearning：数据分析+机器学习实战+线性代数+PyTorch+NLTK+TF2
fd,sharkdp,Rust,42087,1008,172,3233,False,True,True,True,"A simple, fast and user-friendly alternative to 'find'"
full-stack-fastapi-template,fastapi,TypeScript,42083,8231,11,2578,False,True,True,True,"Full stack, modern web application template. Using FastAPI, React, SQLModel, PostgreSQL, Docker, GitHub Actions, automatic HTTPS and more."
diagrams,mingrammer,Python,42080,2723,385,2234,False,True,True,True,:art: Diagram as Code for prototyping cloud system architectures
Win11Debloat,Raphire,PowerShell,42070,1657,26,1966,False,True,True,True,"A simple, lightweight PowerShell script that allows you to remove pre-installed apps, disable telemetry, as well as perform various other changes to declutter and customize your Windows experience. Win11Debloat works for both Windows 10 and Windows 11."
gradio,gradio-app,Python,42034,3327,450,2644,True,True,True,True,"Build and share delightful machine learning apps, all in Python. 🌟 Star to support our work!"
aider,Aider-AI,Python,42020,4033,1440,1042,False,True,True,True,aider is AI pair programming in your terminal
siyuan,siyuan-note,TypeScript,41906,2611,346,2024,True,True,True,True,"A privacy-first, self-hosted, fully open source personal knowledge management software, written in typescript and golang."
bruno,usebruno,JavaScript,41861,2202,1796,1266,False,True,True,True,Opensource IDE For Exploring and Testing API's (lightweight alternative to Postman/Insomnia)
DeepSpeed,deepspeedai,Python,41824,4751,1279,2244,True,True,True,True,"DeepSpeed is a deep learning optimization library that makes distributed training and inference easy, efficient, and effective."
swiper,nolimits4web,JavaScript,41817,9711,249,5115,True,True,True,True,Most modern mobile touch slider with hardware accelerated transitions
ray,ray-project,Python,41779,7348,3474,3429,False,True,True,True,Ray is an AI compute engine. Ray consists of a core distributed runtime and a set of AI Libraries for accelerating ML workloads.
English-level-up-tips,byoungd,,41740,4403,29,3212,False,False,True,True,An advanced guide to learn English which might benefit you a lot 🎉 .  离谱的英语学习指南/英语学习教程/英语学习/学英语
dubbo,apache,Java,41712,26537,937,5018,True,True,True,True,The java implementation of Apache Dubbo. An RPC and microservice framework.
cherry-studio,CherryHQ,TypeScript,41610,3856,682,662,True,True,True,True,"AI productivity studio with smart chat, autonomous agents, and 300+ assistants. Unified access to frontier LLMs"
logseq,logseq,Clojure,41584,2498,1016,2124,True,True,True,True,"A privacy-first, open-source platform for knowledge management and collaboration. Download link:  http://github.com/logseq/logseq/releases. roadmap: https://discuss.logseq.com/t/logseq-product-roadmap/34267"
nw.js,nwjs,JavaScript,41576,3869,959,5185,False,False,False,True,Call all Node.js modules directly from DOM/WebWorker and enable a new way of writing applications with all Web technologies.
yarn,yarnpkg,JavaScript,41530,2730,2064,3709,True,True,True,True,The 1.x line is frozen - features and bugfixes now happen on https://github.com/yarnpkg/berry
hyperswitch,juspay,Rust,41515,4579,1416,1246,True,True,True,True,"An open source payments switch written in Rust to make payments fast, reliable and affordable"
uni-app,dcloudio,JavaScript,41447,3720,718,2804,False,True,True,True,A cross-platform framework using Vue.js
black,psf,Python,41430,2736,324,2924,True,True,True,True,The uncompromising Python code formatter
pure-bash-bible,dylanaraps,Shell,41426,3636,62,2834,False,True,False,True,📖 A collection of pure bash alternatives to external processes.
minimind,jingyaogong,Python,41387,5002,38,597,True,False,True,True,🚀🚀 「大模型」2小时完全从0训练26M的小参数GPT！🌏 Train a 26M-parameter GPT from scratch in just 2h!
ccxt,ccxt,Python,41366,8548,1368,3228,False,True,True,True,A cryptocurrency trading API with more than 100 exchanges in JavaScript / TypeScript / Python / C# / PHP / Go 
ColossalAI,hpcaitech,Python,41362,4526,492,1600,False,True,True,True,"Making large AI models cheaper, faster and more accessible"
hexo,hexojs,TypeScript,41312,5036,103,4922,True,True,True,True,"A fast, simple & powerful blog framework, powered by Node.js."
payload,payloadcms,TypeScript,41245,3476,771,1896,False,True,True,True,"Payload is the open-source, fullstack Next.js framework, giving you instant backend superpowers. Get a full TypeScript backend and admin panel instantly. Use Payload as a headless CMS or for building powerful applications."
