repo_name,organization,language,stars,forks,open_issues,age_days,has_coc,has_contributing,has_workflows,has_readme,description
ChatGLM-6B,zai-org,Python,41218,5202,605,1102,False,False,False,True,ChatGLM-6B: An Open Bilingual Dialogue Language Model | 开源双语对话语言模型
fastlane,fastlane,Ruby,41206,5981,847,4125,True,True,True,True,🚀 The easiest way to automate building and releasing your iOS and Android apps
curl,curl,C,41181,7107,51,5845,True,True,True,True,"A command line tool and library for transferring data with URL syntax, supporting DICT, FILE, FTP, FTPS, GOPHER, GOPHERS, HTTP, HTTPS, IMAP, IMAPS, LDAP, LDAPS, MQTT, MQTTS, POP3, POP3S, RTMP, RTMPS, RTSP, SCP, SFTP, SMB, SMBS, SMTP, SMTPS, TELNET, TFTP, WS and WSS. libcurl offers a myriad of powerful features"
jan,janhq,TypeScript,41156,2608,276,946,True,True,True,True,Jan is an open source alternative to ChatGPT that runs 100% offline on your computer.
vue2-elm,bailicangdu,Vue,41152,12333,121,3374,False,False,True,True,Large single page application with 45 pages built on vue2 + vuex. 基于 vue2 + vuex 构建一个具有 45 个页面的大型单页面应用
cheat.sh,chubin,Python,41135,1907,143,3238,False,True,True,True,the only cheat sheet you need
styled-components,styled-components,TypeScript,41027,2528,13,3502,True,True,True,True,Visual primitives for the component age. Use the best bits of ES6 and CSS to style your apps without stress 💅
vuetify,vuetifyjs,TypeScript,40982,7154,622,3476,True,True,True,True,🐉 Vue Component Framework
tabler,tabler,HTML,40863,4348,109,2968,True,False,True,True,Tabler is free and open-source HTML Dashboard UI Kit built on Bootstrap
bubbletea,charmbracelet,Go,40788,1143,174,2260,False,True,True,True,A powerful little TUI framework 🏗
desktop,zen-browser,JavaScript,40750,1386,537,722,True,False,True,True,Welcome to a calmer internet
WeChatMsg,LC044,,40667,4910,25,1163,False,False,False,True,
cal.com,calcom,TypeScript,40630,12247,1380,1823,True,True,True,True,Scheduling infrastructure for absolutely everyone.
data-engineer-handbook,DataExpert-io,Jupyter Notebook,40583,7731,25,851,False,False,False,True,This is a repo with links to everything you'd ever want to learn about data engineering
twenty,twentyhq,TypeScript,40571,5399,253,1204,True,True,True,True,"Building a modern alternative to Salesforce, powered by the community."
daisyui,saadeghi,Svelte,40555,1621,53,1937,False,True,True,True,"🌼 🌼 🌼 🌼 🌼  The most popular, free and open-source Tailwind CSS component library"
50projects50days,bradtraversy,CSS,40485,9777,47,1949,False,False,False,True,"50+ mini web projects using HTML, CSS & JS"
HEU_KMS_Activator,zbezj,,40475,3826,166,2462,False,False,False,True,
chakra-ui,chakra-ui,TypeScript,40368,3572,24,2406,True,True,True,True,Chakra UI is a component system for building SaaS products with speed ⚡️
zju-icicles,QSCTech,HTML,40355,9603,10,3551,False,False,True,True,浙江大学课程攻略共享计划
aria2,aria2,C++,40326,3830,1139,5591,False,False,True,True,"aria2 is a lightweight multi-protocol & multi-source, cross platform download utility operated in command-line. It supports HTTP/HTTPS, FTP, SFTP, BitTorrent and Metalink."
wrk,wg,C,40138,3029,203,5112,False,False,True,True,Modern HTTP benchmarking tool
remote-jobs,remoteintech,Nunjucks,40113,3928,16,3811,True,True,True,True,Source for remoteintech.company — a community-maintained directory of remote-friendly tech companies
remotion,remotion-dev,TypeScript,40048,2542,80,2095,True,True,True,True,🎥      Make videos programmatically with React
Fabric,danielmiessler,Go,40034,4001,26,806,True,True,True,True,Fabric is an open-source framework for augmenting humans using AI. It provides a modular system for solving specific problems using a crowdsourced set of AI prompts that can be used anywhere.
vim,vim,Vim Script,40027,6010,1662,3866,False,True,True,True,The official Vim repository
php-src,php,C,39992,8016,1755,5391,False,True,True,True,The PHP Interpreter
puter,HeyPuter,JavaScript,39971,3548,191,747,False,True,True,True,"🌐 The Internet Computer! Free, Open-Source, and Self-Hostable."
bert,google-research,Python,39921,9711,881,2702,False,True,False,True,TensorFlow code and pre-trained models for BERT
tidb,pingcap,Go,39903,6151,5868,3848,True,True,True,True,"TiDB - the open-source, cloud-native, distributed SQL database designed for modern applications."
esbuild,evanw,Go,39829,1300,604,3565,False,False,True,True,An extremely fast bundler for the web
awesome-openclaw-skills,VoltAgent,,39813,3813,19,53,False,True,True,True,"The awesome collection of OpenClaw skills. 5,400+ skills filtered and categorized from the official OpenClaw Skills Registry.🦞"
trpc,trpc,TypeScript,39797,1519,193,2071,False,True,True,True,🧙‍♀️  Move Fast and Break Nothing. End-to-end typesafe APIs made easy. 
free,freefq,,39796,5661,558,2112,False,False,False,True,翻墙、免费翻墙、免费科学上网、免费节点、免费梯子、免费ss/v2ray/trojan节点、蓝灯、谷歌商店、翻墙梯子
litellm,BerriAI,Python,39693,6565,1944,967,False,True,True,True,"Python SDK, Proxy Server (AI Gateway) to call 100+ LLM APIs in OpenAI (or native) format, with cost tracking, guardrails, loadbalancing and logging. [Bedrock, Azure, OpenAI, VertexAI, Cohere, Anthropic, Sagemaker, HuggingFace, VLLM, NVIDIA NIM]"
gorm,go-gorm,Go,39663,4144,529,4528,True,False,True,True,"The fantastic ORM library for Golang, aims to be developer friendly"
BettaFish,666ghj,Python,39579,7384,54,626,True,True,True,True,微舆：人人可用的多Agent舆情分析助手，打破信息茧房，还原舆情原貌，预测未来走向，辅助决策！从0实现，不依赖任何框架。
video.js,videojs,JavaScript,39560,7516,636,5788,True,True,True,True,Video.js - open source HTML5 video player
Deep-Learning-Papers-Reading-Roadmap,floodsung,Python,39480,7318,92,3443,False,False,False,True,Deep Learning papers reading roadmap for anyone who are eager to learn this amazing tech!
photoprism,photoprism,Go,39473,2227,441,2973,True,True,True,True,AI-Powered Photos App for the Decentralized Web 🌈💎✨
faiss,facebookresearch,C++,39444,4302,310,3327,True,True,True,True,A library for efficient similarity search and clustering of dense vectors.
FastChat,lm-sys,Python,39434,4788,1003,1097,False,False,True,True,"An open platform for training, serving, and evaluating large language models. Release repo for Vicuna and Chatbot Arena."
fiber,gofiber,Go,39417,1962,48,2255,True,True,True,True,⚡️ Express inspired web framework written in Go
appsmith,appsmithorg,TypeScript,39397,4501,4444,2089,True,True,True,True,"Platform to build admin panels, internal tools, and dashboards. Integrates with 25+ databases and any API."
Awesome-Design-Tools,goabstract,JavaScript,39315,2207,126,2592,False,False,True,True,The best design tools and plugins for everything 👉
phaser,phaserjs,JavaScript,39212,7125,118,4724,True,True,True,True,"Phaser is a fun, free and fast 2D game framework for making HTML5 games for desktop and mobile web browsers, supporting Canvas and WebGL rendering."
cobalt,imputnet,Svelte,39188,3276,224,1350,False,True,True,True,best way to save what you love
data-engineering-zoomcamp,DataTalksClub,Jupyter Notebook,39174,7884,4,1610,False,False,True,True,Data Engineering Zoomcamp is a free 9-week course on building production-ready data pipelines. The next cohort starts in January 2026. Join the course here 👇🏼
lossless-cut,mifi,TypeScript,39168,1906,242,3427,False,True,True,True,The swiss army knife of lossless video/audio editing
shellcheck,koalaman,Haskell,39139,1904,1202,4871,False,False,True,True,"ShellCheck, a static analysis tool for shell scripts"
materialize,Dogfalo,JavaScript,39113,4659,791,4206,True,True,True,True,"Materialize, a CSS Framework based on Material Design"
styleguide,google,HTML,39113,13000,173,3956,True,True,True,True,Style guides for Google-originated open-source projects
qlib,microsoft,Python,39059,6088,369,2043,True,False,True,True,"Qlib is an AI-oriented Quant investment platform that aims to use AI tech to empower Quant Research, from exploring ideas to implementing productions. Qlib supports diverse ML modeling paradigms, including supervised learning, market dynamics modeling, and RL, and is now equipped with https://github.com/microsoft/RD-Agent to automate R&D process."
bark,suno-ai,Jupyter Notebook,39047,4687,267,1077,False,False,False,True,🔊 Text-Prompted Generative Audio Model
quivr,QuivrHQ,Python,39042,3742,24,1042,False,False,True,True,"Opiniated RAG for integrating GenAI in your apps 🧠   Focus on your product rather than the RAG. Easy integration in existing products with customisation!  Any LLM: GPT4, Groq, Llama. Any Vectorstore: PGVector, Faiss. Any Files. Anyway you want."
chatbox,chatboxai,TypeScript,39038,3950,1078,1109,False,False,True,True,Powerful AI Client
ChatTTS,2noise,Python,38951,4226,65,661,False,False,True,True,A generative speech model for daily dialogue.
leveldb,google,C++,38912,8173,372,4222,True,True,True,True,LevelDB is a fast key-value storage library written at Google that provides an ordered mapping from string keys to string values.
agno,agno-agi,Python,38813,5139,677,1415,True,True,True,True,"Build, run, manage agentic software at scale."
nushell,nushell,Rust,38795,2086,1475,2505,True,True,True,True,A new type of shell
mindsdb,mindsdb,Python,38793,6149,171,2786,True,True,True,True,Query Engine for AI Analytics: Build self-reasoning agents across all your live data
novu,novuhq,TypeScript,38709,4239,142,1666,True,True,True,True,"The open-source notification Inbox infrastructure. E-mail, SMS, Push and Slack Integrations."
devdocs,freeCodeCamp,Ruby,38632,2579,228,4529,True,True,True,True,API Documentation Browser
awesome-cursorrules,PatrickJS,MDX,38577,3262,81,549,True,True,True,True,📄  Configuration files that enhance Cursor AI editor experience with custom rules and behaviors
impress.js,impress,JavaScript,38516,6617,59,5195,False,False,True,True,It's a presentation framework based on the power of CSS3 transforms and transitions in modern browsers and inspired by the idea behind prezi.com.
preact,preactjs,JavaScript,38489,2030,148,3843,True,True,True,True,⚛️ Fast 3kB React alternative with the same modern API. Components & Virtual DOM.
claude-mem,thedotmack,JavaScript,38486,2785,128,200,False,False,True,True,"A Claude Code plugin that automatically captures everything Claude does during your coding sessions, compresses it with AI (using Claude's agent-sdk), and injects relevant context back into future sessions."
googletest,google,C++,38374,10728,527,3887,True,True,True,True,GoogleTest - Google Testing and Mocking Framework
RuView,ruvnet,Rust,38373,5244,57,286,False,False,True,True,"π RuView: WiFi DensePose turns commodity WiFi signals into real-time human pose estimation, vital sign monitoring, and presence detection — all without a single pixel of video. "
python-cheatsheet,gto76,Python,38297,6734,0,2976,False,False,True,True,Comprehensive Python Cheatsheet
MPAndroidChart,PhilJay,Java,38228,9048,2189,4346,False,True,False,True,"A powerful 🚀 Android chart view / graph view library, supporting line- bar- pie- radar- bubble- and candlestick charts as well as scaling, panning and animations."
lapce,lapce,Rust,38151,1244,872,2963,False,True,True,True,Lightning-fast and Powerful Code Editor written in Rust
halo,halo-dev,Java,38120,10228,240,2920,True,True,True,True,强大易用的开源建站工具。
insomnia,Kong,TypeScript,38110,2246,810,3618,True,True,True,True,"The open-source, cross-platform API client for GraphQL, REST, WebSockets, SSE and gRPC. With Cloud, Local and Git storage."
istio,istio,Go,38098,8281,520,3408,False,True,True,True,"Connect, secure, control, and observe services."
ant-design-pro,ant-design,TypeScript,38011,8235,178,3128,True,False,True,True,👨🏻‍💻👩🏻‍💻 Use Ant Design like a Pro!
vnpy,vnpy,Python,37955,11134,15,4036,True,False,True,True,基于Python的开源量化交易平台开发框架
tesseract.js,naptha,JavaScript,37937,2363,42,3922,False,False,True,True,Pure Javascript OCR for more than 100 Languages 📖🎉🖥
polars,pola-rs,Rust,37799,2701,2717,2136,True,True,True,True,"Extremely fast Query Engine for DataFrames, written in Rust"
aspnetcore,dotnet,C#,37769,10612,3816,4391,True,True,True,True,"ASP.NET Core is a cross-platform .NET framework for building modern cloud-based web applications on Windows, Mac, or Linux."
wtfjs,denysdovhan,JavaScript,37767,2689,44,3170,False,True,True,True,🤪 A list of funny and tricky JavaScript examples
metasploit-framework,rapid7,Ruby,37751,14797,593,5315,True,True,True,True,Metasploit Framework
cli,httpie,Python,37748,3837,254,5136,True,True,True,True,"🥧 HTTPie CLI  — modern, user-friendly command-line HTTP client for the API era. JSON support, colors, sessions, downloads, plugins & more."
Folo,RSSNext,TypeScript,37733,2006,377,711,True,True,True,True,🧡 Folo is the AI RSS Reader
outline,outline,TypeScript,37713,3151,77,3588,True,False,True,True,"The fastest knowledge base for growing teams. Beautiful, realtime collaborative, feature packed, and markdown compatible."
it-tools,CorentinTh,Vue,37698,4704,764,2174,False,False,True,True,"Collection of handy online tools for developers, with great UX. "
interview,huihut,C++,37630,8125,2,2960,False,False,True,True,"📚 C/C++ 技术面试基础知识总结，包括语言、程序库、数据结构、算法、系统、网络、链接装载库等知识及面试经验、招聘、内推等信息。This repository is a summary of the basic knowledge of recruiting job seekers and beginners in the direction of C/C++ technology, including language, program library, data structure, algorithm, system, network, link loading library, interview experience, recruitment, recommendation, etc."
freecodecamp.cn,FreeCodeCampChina,CSS,37629,1413,157,3458,False,True,False,True,FCC China open source codebase and curriculum. Learn to code and help nonprofits.
ToolJet,ToolJet,JavaScript,37622,4982,956,1815,True,True,True,True,"ToolJet is the open-source foundation of ToolJet AI - the AI-native platform for building internal tools, dashboard, business applications, workflows and AI agents 🚀"
NewPipe,TeamNewPipe,Java,37595,3511,1384,3850,False,True,True,True,A libre lightweight streaming front-end for Android.
Langchain-Chatchat,chatchat-space,Python,37567,6185,19,1084,False,False,True,True,"Langchain-Chatchat（原Langchain-ChatGLM）基于 Langchain 与 ChatGLM, Qwen 与 Llama 等语言模型的 RAG 与 Agent 应用 | Langchain-Chatchat (formerly langchain-ChatGLM), local knowledge based LLM (like ChatGLM, Qwen and Llama) RAG and Agent app with langchain "
engineering-blogs,kilimchoi,Ruby,37535,1969,145,3932,False,True,True,True,A curated list of engineering blogs
paperless-ngx,paperless-ngx,Python,37501,2390,9,1496,True,True,True,True,"A community-supported supercharged document management system: scan, index and archive all your documents"
google-research,google-research,Jupyter Notebook,37493,8364,1803,2723,False,True,True,True,Google Research
llvm-project,llvm,LLVM,37477,16604,34961,3389,True,True,True,True,The LLVM Project is a collection of modular and reusable compiler and toolchain technologies.
v,vlang,V,37471,2238,987,2597,True,True,True,True,"Simple, fast, safe, compiled language for developing maintainable software. Compiles itself in <1s with zero library dependencies. Supports automatic C => V translation. https://vlang.io"
Open-Assistant,LAION-AI,Python,37438,3305,296,1192,False,True,True,True,"OpenAssistant is a chat-based assistant that understands tasks, can interact with third-party systems, and retrieve information dynamically to do so."
spacedrive,spacedriveapp,Rust,37412,1241,22,1634,True,True,True,True,"Spacedrive is an open source cross-platform file explorer, powered by a virtual distributed filesystem written in Rust."
GFPGAN,TencentARC,Python,37403,6282,403,1826,True,False,True,True,GFPGAN aims at developing Practical Algorithms for Real-world Face Restoration.
taro,NervJS,TypeScript,37363,4901,1717,2902,False,True,True,True,开放式跨端跨框架解决方案，支持使用 React/Vue 等框架来开发微信/京东/百度/支付宝/字节跳动/ QQ 小程序/H5/React Native 等应用。  https://taro.zone/
tutorials,eugenp,Java,37352,53737,31,4707,False,True,False,True,Getting Started with Spring Boot 3: 
manim,ManimCommunity,Python,37286,2729,455,2131,True,True,True,True,A community-maintained Python framework for creating mathematical animations. 
deeplearningbook-chinese,exacity,TeX,37221,9172,67,3389,False,False,True,True,Deep Learning Book Chinese Translation
interview_internal_reference,0voice,Python,37209,9420,36,2474,False,False,False,True,2025年最新总结，阿里，腾讯，百度，美团，头条等技术面试题目，以及答案，专家出题人分析汇总。
RevokeMsgPatcher,huiyadanli,C#,37199,3952,54,2433,False,False,True,True,:trollface: A hex editor for WeChat/QQ/TIM - PC版微信/QQ/TIM防撤回补丁（我已经看到了，撤回也没用了）
arthas,alibaba,Java,37194,7632,463,2759,False,True,True,True,Alibaba Java Diagnostic Tool Arthas/Alibaba Java诊断利器Arthas
stats,exelban,Swift,37182,1225,33,2486,False,False,True,True,macOS system monitor in your menu bar
compose,docker,Go,37181,5755,75,4483,False,True,True,True,Define and run multi-container applications with Docker
gym,openai,Python,37108,8705,128,3613,False,True,True,True,A toolkit for developing and comparing reinforcement learning algorithms.
gkd,gkd-kit,Kotlin,37098,1791,11,990,False,False,True,True,"基于无障碍，高级选择器，订阅规则的自定义屏幕点击安卓应用 | An Android APP with custom screen tapping based on Accessibility, Advanced Selectors, and Subscription Rules"
react-bits,DavidHDev,JavaScript,36959,1635,1,590,False,True,True,True,"An open source collection of animated, interactive & fully customizable React components for building memorable websites."
JavaFamily,AobingJava,,36926,7803,6,2320,False,False,False,True,【Java面试+Java学习指南】 一份涵盖大部分Java程序员所需要掌握的核心知识。
wtfpython,satwikkansal,Python,36913,2663,70,3125,True,True,True,True,What the f*ck Python? 😱
drawdb,drawdb-io,JavaScript,36910,2954,197,977,False,True,True,True,"Free, simple, and intuitive online database diagram editor and SQL generator."
portainer,portainer,TypeScript,36898,2802,730,3591,True,True,True,True,Making Docker and Kubernetes management easy.
MockingBird,babysor,Python,36886,5234,482,1686,True,False,False,True,🚀Clone a voice in 5 seconds to generate arbitrary speech in real-time
sqlmap,sqlmapproject,Python,36873,6221,61,5014,True,True,True,True,Automatic SQL injection and database takeover tool
REKCARC-TSC-UHT,PKUanonym,HTML,36848,7853,2,2541,False,False,False,True,"清华大学计算机系课程攻略 Guidance for courses in Department of Computer Science and Technology, Tsinghua University"
docs,inkonchain,MDX,36806,456,48,681,False,False,True,True,Ink Documentation
duckdb,duckdb,C++,36797,3020,628,2823,True,True,True,True,DuckDB is an analytical in-process SQL database management system
GPT_API_free,chatanywhere,Python,36788,2572,64,1061,False,False,False,True,Free ChatGPT&DeepSeek API Key，免费ChatGPT&DeepSeek API。免费接入DeepSeek API和GPT4 API，支持 gpt | deepseek | claude | gemini | grok 等排名靠前的常用大模型。
node,inkonchain,Shell,36753,633,18,675,False,False,True,True,How to run an Ink Node
supervision,roboflow,Python,36734,3145,130,1207,True,True,True,True,We write your reusable computer vision tools. 💜
shadowsocks-android,shadowsocks,Kotlin,36718,11528,60,4841,False,True,True,True,A shadowsocks client for Android
marked,markedjs,TypeScript,36673,3514,17,5352,True,True,True,True,A markdown parser and compiler. Built for speed.
awesome-shell,alebcay,,36669,2479,135,4274,False,True,True,True,"A curated list of awesome command-line frameworks, toolkits, guides and gizmos. Inspired by awesome-php."
ink-kit,inkonchain,TypeScript,36662,427,3,500,False,False,True,True,React component library for onchain applications - See README for modern alternatives
headscale,juanfont,Go,36621,1964,122,2097,True,True,True,True,"An open source, self-hosted implementation of the Tailscale control server"
og-aws,open-guides,Shell,36589,3910,160,3536,True,True,True,True,📙 Amazon Web Services — a practical guide
LLM101n,karpathy,,36552,1997,19,662,False,False,False,True,LLM101n: Let's build a Storyteller
pytorch-image-models,huggingface,Python,36538,5140,65,2602,True,True,True,True,"The largest collection of PyTorch image encoders / backbones. Including train, eval, inference, export scripts, and pretrained weights -- ResNet, ResNeXT, EfficientNet, NFNet, Vision Transformer (ViT), MobileNetV4, MobileNet-V3 & V2, RegNet, DPN, CSPNet, Swin Transformer, MaxViT, CoAtNet, ConvNeXt, and more"
date-fns,date-fns,TypeScript,36530,1940,916,4182,False,True,True,True,⏳ Modern JavaScript date utility library ⌛️
Coursera-ML-AndrewNg-Notes,fengdu78,HTML,36527,11158,68,3057,False,False,True,True,吴恩达老师的机器学习课程个人笔记
typeorm,typeorm,TypeScript,36395,6512,527,3671,False,True,True,True,"TypeScript & JavaScript ORM for Node.js — supports PostgreSQL, MySQL, MariaDB, SQLite, SQL Server, Oracle, and more."
get-shit-done,gsd-build,JavaScript,36344,2969,10,95,False,False,True,True,"A light-weight and powerful meta-prompting, context engineering and spec-driven development system for Claude Code by TÂCHES."
HanLP,hankcs,Python,36209,10908,12,4179,False,True,True,True,中文分词 词性标注 命名实体识别 依存句法分析 成分句法分析 语义依存分析 语义角色标注 指代消解 风格转换 语义相似度 新词发现 关键词短语提取 自动摘要 文本分类聚类 拼音简繁转换 自然语言处理
sheetjs,SheetJS,,36208,7957,132,4854,False,False,False,True,📗 SheetJS Spreadsheet Data Toolkit -- New home https://git.sheetjs.com/SheetJS/sheetjs
slate,slatedocs,,36165,360,50,4570,False,False,False,True,Beautiful static documentation for your API
955.WLB,formulahendry,,36161,1752,202,2549,False,False,False,True,955 不加班的公司名单 - 工作 955，work–life balance (工作与生活的平衡)
aseprite,aseprite,C++,36148,7871,1901,4230,True,True,True,True,"Animated sprite editor & pixel art tool (Windows, macOS, Linux)"
OpenVoice,myshell-ai,Python,36122,4035,299,841,False,False,False,True,Instant voice cloning by MIT and MyShell. Audio foundation model.
lerna,lerna,TypeScript,36090,2278,308,3758,True,True,True,True,"Lerna is a fast, modern build system for managing and publishing multiple JavaScript/TypeScript packages from the same repository."
qBittorrent,qbittorrent,C++,36069,4595,2517,5157,False,True,True,True,qBittorrent BitTorrent client
servo,servo,Rust,36063,3535,3107,5153,True,True,True,True,"Servo aims to empower developers with a lightweight, high-performance alternative for embedding web technologies in applications."
MiroFish,666ghj,Python,36050,4705,142,114,False,False,True,True,"A Simple and Universal Swarm Intelligence Engine, Predicting Anything. 简洁通用的群体智能引擎，预测万物"
Xray-core,XTLS,Go,36025,5065,50,1956,True,False,True,True,"Xray, Penetrates Everything. Also the best v2ray-core. Where the magic happens. An open platform for various uses."
hello-algorithm,geekxh,Java,36022,6449,11,2120,False,False,False,True,🌍 针对小白的算法训练 | 包括四部分：①.大厂面经 ②.力扣图解  ③.千本开源电子书 ④.百张技术思维导图（项目花了上百小时，希望可以点 star 支持，🌹感谢~）推荐免费ChatGPT使用网站
carbon,carbon-app,JavaScript,35997,1978,80,3199,True,True,True,True,:black_heart: Create and share beautiful images of your source code
awesome-deepseek-integration,deepseek-ai,,35970,3998,23,799,False,False,True,True,Integrate the DeepSeek API into popular software
DragGAN,XingangPan,Python,35959,3439,154,1036,False,False,False,True,Official Code for DragGAN (SIGGRAPH 2023)
ShareX,ShareX,C#,35936,3631,573,4545,False,False,True,True,"ShareX is a free and open-source application that enables users to capture or record any area of their screen with a single keystroke. It also supports uploading images, text, and various file types to a wide range of destinations."
ruoyi-vue-pro,YunaiV,Java,35909,7755,5,1881,False,False,True,True,🔥 官方推荐 🔥 RuoYi-Vue 全新 Pro 版本，优化重构所有功能。基于 Spring Boot + MyBatis Plus + Vue & Element 实现的后台管理系统 + 微信小程序，支持 RBAC 动态权限、数据权限、SaaS 多租户、Flowable 工作流、三方登录、支付、短信、商城、CRM、ERP、AI 大模型、IoT 物联网等功能。你的 ⭐️ Star ⭐️，是作者生发的动力！
BitNet,microsoft,Python,35900,3089,287,591,True,False,True,True,Official inference framework for 1-bit LLMs
mattermost,mattermost,TypeScript,35889,8434,826,3930,True,True,True,True,Mattermost is an open source platform for secure collaboration across the entire software development lifecycle..
manifesto,opentofu,HTML,35877,1045,20,949,False,False,True,True,The OpenTF Manifesto expresses concern over HashiCorp's switch of the Terraform license from open-source to the Business Source License (BSL) and calls for the tool's return to a truly open-source license.
fastify,fastify,JavaScript,35865,2627,117,3459,True,True,True,True,"Fast and low overhead web framework, for Node.js"
